bill_name,caption,filer_id,filer_name,function,session,leg_id,original_name,parsed_name
SR 52,Congratulating the Wylie Bulldogs for winning the Class 3A state basketball championship.,36668,Lt. Gov. David Dewhurst,author,713,1170,Lt. Gov. David Dewhurst,David Dewhurst
SR 60,Congratulating the Evant Elks on their stellar showing during the 1989-1990 season.,36668,Lt. Gov. David Dewhurst,author,713,1170,Lt. Gov. David Dewhurst,David Dewhurst
SCR 6,In memory of former state representative Walter Grubbs.,36668,Lt. Gov. David Dewhurst,author,712,1170,Lt. Gov. David Dewhurst,David Dewhurst
SR 77,Congratulating Station KXOX on its 50th anniversary.,36668,Lt. Gov. David Dewhurst,author,712,1170,Lt. Gov. David Dewhurst,David Dewhurst
SCR 5,In memory of Congressman Mickey Leland.,36668,Lt. Gov. David Dewhurst,coauthor,712,1170,Lt. Gov. David Dewhurst,David Dewhurst
HCR 9,In memory of Walter B. Grubbs.,36668,Lt. Gov. David Dewhurst,sponsor,712,1170,Lt. Gov. David Dewhurst,David Dewhurst
SB 22,Relating to the effective date of the legislation authorizing the creation of the San Saba County Hospital District.,36668,Lt. Gov. David Dewhurst,author,711,1170,Lt. Gov. David Dewhurst,David Dewhurst
SB 75,Relating to the effective date of the legislation relating to the qualifications for serving as judge of the County Court at Law of Nolan County.,36668,Lt. Gov. David Dewhurst,author,711,1170,Lt. Gov. David Dewhurst,David Dewhurst
SB 78,Relating to the establishment of Central Texas University.,36668,Lt. Gov. David Dewhurst,author,711,1170,Lt. Gov. David Dewhurst,David Dewhurst
SR 109,Congratulating the Llano High School baseball team for a job well done.,36668,Lt. Gov. David Dewhurst,author,711,1170,Lt. Gov. David Dewhurst,David Dewhurst
SR 119,"Commending Ludlum Measurements, Inc., and its president, Don Ludlum, for their commitment to the American democratic system.",36668,Lt. Gov. David Dewhurst,author,711,1170,Lt. Gov. David Dewhurst,David Dewhurst
SR 166,Congratulating the Reverend Johnny Floyd Franks on receiving the Exchange Club's 1989 Golden Deeds Award.,36668,Lt. Gov. David Dewhurst,author,711,1170,Lt. Gov. David Dewhurst,David Dewhurst
SR 167,"Congratulating Drayton McLane, Jr., on receiving the 1989 Distinguished Citizen Award.",36668,Lt. Gov. David Dewhurst,author,711,1170,Lt. Gov. David Dewhurst,David Dewhurst
SB 30,Relating to the punishment for certain offenses committed against a child during a ritual or ceremony.,36668,Lt. Gov. David Dewhurst,coauthor,711,1170,Lt. Gov. David Dewhurst,David Dewhurst
SB 62,Relating to the commercial use of information identifying the victims of certain crimes.,36668,Lt. Gov. David Dewhurst,coauthor,711,1170,Lt. Gov. David Dewhurst,David Dewhurst
HB 32,Relating to the effective date of the legislation authorizing the creation of the San Saba County Hospital District.,36668,Lt. Gov. David Dewhurst,sponsor,711,1170,Lt. Gov. David Dewhurst,David Dewhurst
HB 67,Relating to the establishment of Central Texas University.,36668,Lt. Gov. David Dewhurst,sponsor,711,1170,Lt. Gov. David Dewhurst,David Dewhurst
SB 68,Relating to the dates on which primaries occur declaring an emergency.,36668,Lt. Gov. David Dewhurst,author,71R,1170,Lt. Gov. David Dewhurst,David Dewhurst
SB 315,"Relating to the creation, administration, powers, duties, operation, and financing of the Nolan County Hospital District; authorizing a tax; granting the authority to issue bonds; and granting the power of eminent...",36668,Lt. Gov. David Dewhurst,author,71R,1170,Lt. Gov. David Dewhurst,David Dewhurst
SB 335,"Relating to the creation, administration, powers, duties, operation, and financing of the McCulloch County Hospital District; authorizing a tax; granting the authority to issue bonds; and granting the power of eminent...",36668,Lt. Gov. David Dewhurst,author,71R,1170,Lt. Gov. David Dewhurst,David Dewhurst
SB 588,Relating to the use and control of profits generated through sales of a commissary operated in a county jail.,36668,Lt. Gov. David Dewhurst,author,71R,1170,Lt. Gov. David Dewhurst,David Dewhurst
SB 636,Relating to competitive bidding requirements for certain counties.,36668,Lt. Gov. David Dewhurst,author,71R,1170,Lt. Gov. David Dewhurst,David Dewhurst
SB 691,Relating to a requirement that certain persons serving in elective offices as peace officers be licensed by the Commission on Law Enforcement Officer Standards and Education.,36668,Lt. Gov. David Dewhurst,author,71R,1170,Lt. Gov. David Dewhurst,David Dewhurst
SB 839,Relating to the inspection of certain juvenile files and records.,36668,Lt. Gov. David Dewhurst,author,71R,1170,Lt. Gov. David Dewhurst,David Dewhurst
SB 840,Relating to the procedure by which a jury trial is waived in a criminal case.,36668,Lt. Gov. David Dewhurst,author,71R,1170,Lt. Gov. David Dewhurst,David Dewhurst
SB 846,Relating to the qualifications of the Judge of the County Court at Law of Nolan County.,36668,Lt. Gov. David Dewhurst,author,71R,1170,Lt. Gov. David Dewhurst,David Dewhurst
SB 945,Relating to persons who may request an attorney general's opinion.,36668,Lt. Gov. David Dewhurst,author,71R,1170,Lt. Gov. David Dewhurst,David Dewhurst
SB 1022,Relating to the amendment of the Employees Retirement System.,36668,Lt. Gov. David Dewhurst,author,71R,1170,Lt. Gov. David Dewhurst,David Dewhurst
SB 1099,"Relating to disclosure of certain information relating to financial institutions and their depositors, owners, borrowers, and customers.",36668,Lt. Gov. David Dewhurst,author,71R,1170,Lt. Gov. David Dewhurst,David Dewhurst
SB 1195,"Relating to the location of graveyards, cemeteries or mausoleums.",36668,Lt. Gov. David Dewhurst,author,71R,1170,Lt. Gov. David Dewhurst,David Dewhurst
SB 1196,Relating to the award of certain costs to persons affected by regulated activities.,36668,Lt. Gov. David Dewhurst,author,71R,1170,Lt. Gov. David Dewhurst,David Dewhurst
SB 1197,Relating to procedures regarding certain state agency orders and decisions.,36668,Lt. Gov. David Dewhurst,author,71R,1170,Lt. Gov. David Dewhurst,David Dewhurst
SB 1198,Relating to certain revenue collected as a city sales and use tax in a newly annexed area.,36668,Lt. Gov. David Dewhurst,author,71R,1170,Lt. Gov. David Dewhurst,David Dewhurst
SB 1199,Relating to the operation of vehicles on highways.,36668,Lt. Gov. David Dewhurst,author,71R,1170,Lt. Gov. David Dewhurst,David Dewhurst
SB 1200,Relating to the jurisdiction and administration of certain district and county courts.,36668,Lt. Gov. David Dewhurst,author,71R,1170,Lt. Gov. David Dewhurst,David Dewhurst
SB 1201,Relating to the penalty for failure to report a hazardous materials release.,36668,Lt. Gov. David Dewhurst,author,71R,1170,Lt. Gov. David Dewhurst,David Dewhurst
SB 1202,Relating to changes in the Uniform Act Regulating Traffic on Highways.,36668,Lt. Gov. David Dewhurst,author,71R,1170,Lt. Gov. David Dewhurst,David Dewhurst
SB 1203,Relating to the prohibition of certain advertising to provide credit or credit related services; and providing a penalty.,36668,Lt. Gov. David Dewhurst,author,71R,1170,Lt. Gov. David Dewhurst,David Dewhurst
SB 1204,Relating to the safe operation of vehicles on highways and to driving safety courses.,36668,Lt. Gov. David Dewhurst,author,71R,1170,Lt. Gov. David Dewhurst,David Dewhurst
SB 1317,Relating to the transfer of students between Texas public school districts.,36668,Lt. Gov. David Dewhurst,author,71R,1170,Lt. Gov. David Dewhurst,David Dewhurst
SB 1318,Relating to service on the board of directors of a nonprofit corporation by a local public official.,36668,Lt. Gov. David Dewhurst,author,71R,1170,Lt. Gov. David Dewhurst,David Dewhurst
SB 1319,Relating to the offense of a driver fleeing or attempting to elude a police officer.,36668,Lt. Gov. David Dewhurst,author,71R,1170,Lt. Gov. David Dewhurst,David Dewhurst
SB 1320,Relating to child care provided by public schools.,36668,Lt. Gov. David Dewhurst,author,71R,1170,Lt. Gov. David Dewhurst,David Dewhurst
SB 1321,Relating to mechanics' liens and bonds for private and public works.,36668,Lt. Gov. David Dewhurst,author,71R,1170,Lt. Gov. David Dewhurst,David Dewhurst
SB 1322,Relating to rights and procedures governing the provision of services to persons with mental illness; providing a civil penalty.,36668,Lt. Gov. David Dewhurst,author,71R,1170,Lt. Gov. David Dewhurst,David Dewhurst
SB 1343,"Relating to determining, regulating and controlling medical professional liability insurance costs, the availability of medical professional insurance coverage, and controlling medical malpractice claims and suits.",36668,Lt. Gov. David Dewhurst,author,71R,1170,Lt. Gov. David Dewhurst,David Dewhurst
SB 1411,"Relating to the testing of inmates of the Texas Department of Corrections, county and municipal jails, and contract correctional facilities for AIDS and HIV.",36668,Lt. Gov. David Dewhurst,author,71R,1170,Lt. Gov. David Dewhurst,David Dewhurst
SB 1496,Relating to the creation of a public funds investment pool and to the investment of local funds of certain political subdivisions of the state.,36668,Lt. Gov. David Dewhurst,author,71R,1170,Lt. Gov. David Dewhurst,David Dewhurst
SB 1497,Relating to the investment of public funds.,36668,Lt. Gov. David Dewhurst,author,71R,1170,Lt. Gov. David Dewhurst,David Dewhurst
SB 1498,Relating to the collateral eligible to secure deposits of public funds.,36668,Lt. Gov. David Dewhurst,author,71R,1170,Lt. Gov. David Dewhurst,David Dewhurst
SB 1499,Relating to the property taxation professional certification act.,36668,Lt. Gov. David Dewhurst,author,71R,1170,Lt. Gov. David Dewhurst,David Dewhurst
SB 1633,"Relating to offenses committed by an actor against the actor's spouse or a member of the actor's family or household, and to the definition of ""owner"" in the Penal Code.",36668,Lt. Gov. David Dewhurst,author,71R,1170,Lt. Gov. David Dewhurst,David Dewhurst
SB 1792,Relating to transfer of an employer's experience rating for unemployment compensation taxes.,36668,Lt. Gov. David Dewhurst,author,71R,1170,Lt. Gov. David Dewhurst,David Dewhurst
SB 1793,Relating to a disqualification for unemployment compensation benefits based on the receipt of certain lump-sum retirement benefits or severance benefits.,36668,Lt. Gov. David Dewhurst,author,71R,1170,Lt. Gov. David Dewhurst,David Dewhurst
SB 1805,Relating to the composition of the Taylor County Juvenile Board.,36668,Lt. Gov. David Dewhurst,author,71R,1170,Lt. Gov. David Dewhurst,David Dewhurst
SB 1808,"Relating to the creation, administration, powers, duties, operation, and financing of the Lampasas County Underground Water Conservation District.",36668,Lt. Gov. David Dewhurst,author,71R,1170,Lt. Gov. David Dewhurst,David Dewhurst
SB 1809,"Relating to the creation, administration, powers, duties, operation, and financing of the Bell County Underground Water Conservation District.",36668,Lt. Gov. David Dewhurst,author,71R,1170,Lt. Gov. David Dewhurst,David Dewhurst
SB 1810,"Relating to the creation, administration, powers, duties, operation and financing of the San Saba Hospital District; authorizing taxes; granting the authority to issue bonds; and granting the power of eminent domain.",36668,Lt. Gov. David Dewhurst,author,71R,1170,Lt. Gov. David Dewhurst,David Dewhurst
SB 1823,"Relating to the weapons that may not be taken onto the premises of a school, polling place, or government office.",36668,Lt. Gov. David Dewhurst,author,71R,1170,Lt. Gov. David Dewhurst,David Dewhurst
SB 1824,Relating to the membership and election of the Fox Crossing Water District board of directors.,36668,Lt. Gov. David Dewhurst,author,71R,1170,Lt. Gov. David Dewhurst,David Dewhurst
SB 1829,Relating to the office of district attorney in Coleman County.,36668,Lt. Gov. David Dewhurst,author,71R,1170,Lt. Gov. David Dewhurst,David Dewhurst
SB 1839,Relating to junked vehicles.,36668,Lt. Gov. David Dewhurst,author,71R,1170,Lt. Gov. David Dewhurst,David Dewhurst
SB 1842,Relating to the establishment of a state veterans' cemetery.,36668,Lt. Gov. David Dewhurst,author,71R,1170,Lt. Gov. David Dewhurst,David Dewhurst
SB 1851,"Relating to the juvenile boards in Blanco, Burnet, Llano, Mason, and San Saba counties.",36668,Lt. Gov. David Dewhurst,author,71R,1170,Lt. Gov. David Dewhurst,David Dewhurst
SB 1857,"Relating to the jurisdiction and administration of certain district and county courts, to the creation of multicounty statutory county courts, and to the qualifications of office for judges of certain courts.",36668,Lt. Gov. David Dewhurst,author,71R,1170,Lt. Gov. David Dewhurst,David Dewhurst
SCR 67,In memory of Arthur Lance Sears.,36668,Lt. Gov. David Dewhurst,author,71R,1170,Lt. Gov. David Dewhurst,David Dewhurst
SCR 74,Requesting that educational curricula for judges and law enforcement officers include information about certain procedures and services regarding mentally ill persons.,36668,Lt. Gov. David Dewhurst,author,71R,1170,Lt. Gov. David Dewhurst,David Dewhurst
SCR 137,Recognizing National Mental Illness Awareness Week.,36668,Lt. Gov. David Dewhurst,author,71R,1170,Lt. Gov. David Dewhurst,David Dewhurst
SJR 67,Proposing a constitutional amendment to authorize local governments to invest their funds as authorized by law.,36668,Lt. Gov. David Dewhurst,author,71R,1170,Lt. Gov. David Dewhurst,David Dewhurst
SR 114,In memory of R. S. Moseley of Rochelle.,36668,Lt. Gov. David Dewhurst,author,71R,1170,Lt. Gov. David Dewhurst,David Dewhurst
SR 158,Congratulating R. D. Pietzsch of Roscoe on his retiring from the United States Postal Service after more than 30 years of service.,36668,Lt. Gov. David Dewhurst,author,71R,1170,Lt. Gov. David Dewhurst,David Dewhurst
SR 171,Commending the Honorable John Garth for his contribution to preserving the heritage and history of Bell County.,36668,Lt. Gov. David Dewhurst,author,71R,1170,Lt. Gov. David Dewhurst,David Dewhurst
SR 220,In memory of Jerry Schuchert of Stamford.,36668,Lt. Gov. David Dewhurst,author,71R,1170,Lt. Gov. David Dewhurst,David Dewhurst
SR 302,In memory of Miss Tommie Hazlewood Clack of Abilene.,36668,Lt. Gov. David Dewhurst,author,71R,1170,Lt. Gov. David Dewhurst,David Dewhurst
SR 372,Congratulating the six cooperative groups of the Killeen Independent School District for their vocational programs.,36668,Lt. Gov. David Dewhurst,author,71R,1170,Lt. Gov. David Dewhurst,David Dewhurst
SR 382,Expressing appreciation to Marilyn G. Hoster for her dedication and efforts on behalf of the children of our state.,36668,Lt. Gov. David Dewhurst,author,71R,1170,Lt. Gov. David Dewhurst,David Dewhurst
SR 412,Commending Jason Hart for his courage and intelligence in his response to a perilous situation.,36668,Lt. Gov. David Dewhurst,author,71R,1170,Lt. Gov. David Dewhurst,David Dewhurst
SR 413,"Congratulating Harwell Barber on receiving the Abilene ""citizen of the year"" award.",36668,Lt. Gov. David Dewhurst,author,71R,1170,Lt. Gov. David Dewhurst,David Dewhurst
SR 447,Congratulating the Evant Elks High School basketball team on their outstanding basketball season.,36668,Lt. Gov. David Dewhurst,author,71R,1170,Lt. Gov. David Dewhurst,David Dewhurst
SR 488,Congratulating the Railroad and Pioneer Museum for its contribution to the preservation of Texas' past.,36668,Lt. Gov. David Dewhurst,author,71R,1170,Lt. Gov. David Dewhurst,David Dewhurst
SR 512,Complimenting Susan Riggs for being crowned Yucca Gloriosa Yearbook Queen.,36668,Lt. Gov. David Dewhurst,author,71R,1170,Lt. Gov. David Dewhurst,David Dewhurst
SR 573,Congratulating Gregg Hallman on achieving the rank of Eagle Scout.,36668,Lt. Gov. David Dewhurst,author,71R,1170,Lt. Gov. David Dewhurst,David Dewhurst
SR 618,"Congratulating the Cardwell triplets, Faith, Hope, and Charity on their 90th birthday.",36668,Lt. Gov. David Dewhurst,author,71R,1170,Lt. Gov. David Dewhurst,David Dewhurst
SR 641,"Designating May 19, 1989, as ""Highland Lakes/Hill Country Legislative Day"" to commemorate this first legislative tour of the verdant valleys and sparkling clear lakes of Central Texas.",36668,Lt. Gov. David Dewhurst,author,71R,1170,Lt. Gov. David Dewhurst,David Dewhurst
SR 676,Congratulating the citizens of Sweetwater and the men and women who have contributed to the special rededication ceremony for the Sweetwater Municipal Airport.,36668,Lt. Gov. David Dewhurst,author,71R,1170,Lt. Gov. David Dewhurst,David Dewhurst
SR 677,Congratulating Fred Bandas on being selected as the Public Citizen of the Year for the Central Counties Unit of the National Association of Social Workers/Texas.,36668,Lt. Gov. David Dewhurst,author,71R,1170,Lt. Gov. David Dewhurst,David Dewhurst
SR 678,Congratulating Warren Townsend on being honored as the Social Worker of the Year for the Central Counties Unit of the National Association of Social Workers/Texas.,36668,Lt. Gov. David Dewhurst,author,71R,1170,Lt. Gov. David Dewhurst,David Dewhurst
SR 731,Commending B. C. Hooper on his retirement.,36668,Lt. Gov. David Dewhurst,author,71R,1170,Lt. Gov. David Dewhurst,David Dewhurst
SR 792,Commending Vernon B. Rucker for his lifetime of work for the public good and extending him best wishes for a fruitful and rewarding retirement.,36668,Lt. Gov. David Dewhurst,author,71R,1170,Lt. Gov. David Dewhurst,David Dewhurst
SR 795,Extending congratulations to the Maddox family for their innovative approach to sustainable agriculture.,36668,Lt. Gov. David Dewhurst,author,71R,1170,Lt. Gov. David Dewhurst,David Dewhurst
SR 796,Extending congratulations to the Sweetwater Independent School District for receiving richly deserved recognition for its exceptional gifted educational program.,36668,Lt. Gov. David Dewhurst,author,71R,1170,Lt. Gov. David Dewhurst,David Dewhurst
SR 797,"Honoring the memory of General Edward Burleson and proclaiming May 29, 1989, General Burleson Day in Texas.",36668,Lt. Gov. David Dewhurst,author,71R,1170,Lt. Gov. David Dewhurst,David Dewhurst
SR 798,Extending congratulations to Gaylon Ohlhausen for winning first place in the Computer Specialist II contest.,36668,Lt. Gov. David Dewhurst,author,71R,1170,Lt. Gov. David Dewhurst,David Dewhurst
SR 809,Extending congratulations to Steven Bridges on his 1989 Texas State Class AA pole vault record and championship.,36668,Lt. Gov. David Dewhurst,author,71R,1170,Lt. Gov. David Dewhurst,David Dewhurst
SR 849,Commending Watt Matthews for being awarded an honorary doctor of humanities degree.,36668,Lt. Gov. David Dewhurst,author,71R,1170,Lt. Gov. David Dewhurst,David Dewhurst
SR 850,Commending Dr. Virginia B. Connally for being awarded an honorary doctor of humanities degree.,36668,Lt. Gov. David Dewhurst,author,71R,1170,Lt. Gov. David Dewhurst,David Dewhurst
SB 119,"Relating to the designation of April 9 as ""Former Prisoners of War Recognition Day.""",36668,Lt. Gov. David Dewhurst,coauthor,71R,1170,Lt. Gov. David Dewhurst,David Dewhurst
SB 195,Relating to a reduced oil production tax rate for oil from certain enhanced recovery projects; providing a civil penalty.,36668,Lt. Gov. David Dewhurst,coauthor,71R,1170,Lt. Gov. David Dewhurst,David Dewhurst
SB 700,"Relating to determining, regulating and controlling worker's compensation insurance costs, the availability of worker's compensation insurance coverage, and the worker's compensation insurance system.",36668,Lt. Gov. David Dewhurst,coauthor,71R,1170,Lt. Gov. David Dewhurst,David Dewhurst
SB 803,Relating to the punishment for certain offenses committed against a child during a ritual or ceremony.,36668,Lt. Gov. David Dewhurst,coauthor,71R,1170,Lt. Gov. David Dewhurst,David Dewhurst
SB 911,"Relating to coverage of chemical dependency under certain health insurance, prepaid health plans, and self-funded and self-insured health plans.",36668,Lt. Gov. David Dewhurst,coauthor,71R,1170,Lt. Gov. David Dewhurst,David Dewhurst
SB 1028,Relating to funding for the Texas State Technical Institute and extension programs operated by the institute.,36668,Lt. Gov. David Dewhurst,coauthor,71R,1170,Lt. Gov. David Dewhurst,David Dewhurst
SB 1107,"Relating to securing of enhanced Medicaid and Medicare reimbursement in Texas by providing for the administering, providing and prescribing of non-narcotic drugs under physician supervision and relating....",36668,Lt. Gov. David Dewhurst,coauthor,71R,1170,Lt. Gov. David Dewhurst,David Dewhurst
SB 1740,Relating to the establishment of the center for rural health initiatives.,36668,Lt. Gov. David Dewhurst,coauthor,71R,1170,Lt. Gov. David Dewhurst,David Dewhurst
SB 1836,Relating to information resource management for state agencies.,36668,Lt. Gov. David Dewhurst,coauthor,71R,1170,Lt. Gov. David Dewhurst,David Dewhurst
HB 155,"Relating to the adoption of the Uniform Federal Lien Registration Act, governing the filing of notices affecting federal liens.",36668,Lt. Gov. David Dewhurst,sponsor,71R,1170,Lt. Gov. David Dewhurst,David Dewhurst
HB 353,Relating to certain requirements for state agency stationery.,36668,Lt. Gov. David Dewhurst,sponsor,71R,1170,Lt. Gov. David Dewhurst,David Dewhurst
HB 439,Relating to a defense to the offense of criminal trespass if the actor is a peace officer or fire fighter acting in the lawful discharge of an official duty.,36668,Lt. Gov. David Dewhurst,sponsor,71R,1170,Lt. Gov. David Dewhurst,David Dewhurst
HB 528,Relating to the membership and election of the Fox Crossing Water District board of directors.,36668,Lt. Gov. David Dewhurst,sponsor,71R,1170,Lt. Gov. David Dewhurst,David Dewhurst
HB 647,Relating to the authority of a district clerk to use optical data storage for the storage of records.,36668,Lt. Gov. David Dewhurst,sponsor,71R,1170,Lt. Gov. David Dewhurst,David Dewhurst
HB 648,Relating to the examination of certain records by the county auditor or the county treasurer.,36668,Lt. Gov. David Dewhurst,sponsor,71R,1170,Lt. Gov. David Dewhurst,David Dewhurst
HB 669,Relating to the authority of the sheriffs of certain counties to operate a county jail commissary and the disposition of commissary proceeds.,36668,Lt. Gov. David Dewhurst,sponsor,71R,1170,Lt. Gov. David Dewhurst,David Dewhurst
HB 925,Relating to a disqualification for unemployment compensation benefits based on the receipt of certain lump-sum retirement benefits or severance benefits.,36668,Lt. Gov. David Dewhurst,sponsor,71R,1170,Lt. Gov. David Dewhurst,David Dewhurst
HB 1476,Relating to the offense of a driver fleeing or attempting to elude a police officer.,36668,Lt. Gov. David Dewhurst,sponsor,71R,1170,Lt. Gov. David Dewhurst,David Dewhurst
HB 1728,Relating to transfer of an employer's experience rating for unemployment compensation taxes.,36668,Lt. Gov. David Dewhurst,sponsor,71R,1170,Lt. Gov. David Dewhurst,David Dewhurst
HB 1846,Relating to the punishments for offenses involving prohibited weapons.,36668,Lt. Gov. David Dewhurst,sponsor,71R,1170,Lt. Gov. David Dewhurst,David Dewhurst
HB 1871,Relating to the detention hearings for youths committed to the Texas Youth Commission who are detained at the request of the commission.,36668,Lt. Gov. David Dewhurst,sponsor,71R,1170,Lt. Gov. David Dewhurst,David Dewhurst
HB 1976,Relating to a county judge or commissioner or other local public official serving as an officer or director of another entity.,36668,Lt. Gov. David Dewhurst,sponsor,71R,1170,Lt. Gov. David Dewhurst,David Dewhurst
HB 2017,Relating to the rates applicable to property under fire insurance and homeowners insurance policies.,36668,Lt. Gov. David Dewhurst,sponsor,71R,1170,Lt. Gov. David Dewhurst,David Dewhurst
HB 2215,Relating to certain revenue collected as a city sales and use tax in a newly annexed area and to the collection of sales and use taxes by certain persons residing outside this state.,36668,Lt. Gov. David Dewhurst,sponsor,71R,1170,Lt. Gov. David Dewhurst,David Dewhurst
HB 2247,Relating to the transfer of certain misdemeanor cases from a county court to a district court or a county court at law with an attorney presiding as judge.,36668,Lt. Gov. David Dewhurst,sponsor,71R,1170,Lt. Gov. David Dewhurst,David Dewhurst
HB 2263,Relating to access of criminal history record information by the adjutant general; providing a penalty.,36668,Lt. Gov. David Dewhurst,sponsor,71R,1170,Lt. Gov. David Dewhurst,David Dewhurst
HB 2853,Relating to the establishment of Central Texas University as a four-year coeducational institution of higher education; granting the power of eminent domain.,36668,Lt. Gov. David Dewhurst,sponsor,71R,1170,Lt. Gov. David Dewhurst,David Dewhurst
HB 2990,Relating to the right of use and possession of property purchased at an ad valorem tax sale.,36668,Lt. Gov. David Dewhurst,sponsor,71R,1170,Lt. Gov. David Dewhurst,David Dewhurst
HB 3072,"Relating to the creation, jurisdiction, and operation of the Ballinger Memorial Hospital District and to the expiration of the Act authorizing its creation.",36668,Lt. Gov. David Dewhurst,sponsor,71R,1170,Lt. Gov. David Dewhurst,David Dewhurst
HB 3099,"Relating to the creation, administration, powers, duties, operation, and financing of the Central Texas Underground Water Conservation District.",36668,Lt. Gov. David Dewhurst,sponsor,71R,1170,Lt. Gov. David Dewhurst,David Dewhurst
HB 3104,Relating to the terms of office of directors of the Elm Creek Water Control District.,36668,Lt. Gov. David Dewhurst,sponsor,71R,1170,Lt. Gov. David Dewhurst,David Dewhurst
HB 3122,"Relating to the creation, administration, powers, duties, operation, and financing of the Saratoga Underground Water Conservation District.",36668,Lt. Gov. David Dewhurst,sponsor,71R,1170,Lt. Gov. David Dewhurst,David Dewhurst
HB 3168,"Relating to the creation, administration, powers, duties, operation, and financing of the San Saba Hospital District; authorizing taxes; granting the authority to issue bonds; and granting the power of....",36668,Lt. Gov. David Dewhurst,sponsor,71R,1170,Lt. Gov. David Dewhurst,David Dewhurst
