bill_name,caption,filer_id,filer_name,function,session
HB 2001,Relating to interlocal contracts between a governmental entity and a purchasing cooperative.,None,Charles Doc Anderson,author,84R
HB 2074,Relating to the eligibility of a Professional Rodeo Cowboys Association finals event to receive funding through a major events trust fund.,None,Charles Doc Anderson,author,84R
HB 2155,Relating to the abolition of the equine incentive program.,None,Charles Doc Anderson,author,84R
HB 2350,Relating to the amount that may be used to guarantee loans under the Texas Agricultural Finance Authority's agricultural loan guarantee program.,None,Charles Doc Anderson,author,84R
HB 2809,Relating to the creation and operations of health care provider participation programs in certain counties.,None,Charles Doc Anderson,author,84R
HB 3685,Relating to the employment status of certain individuals engaged in rehabilitative work-training programs.,None,Charles Doc Anderson,author,84R
HCR 37,Requesting creation of a joint interim committee to study a nonsubstantive reorganization of the Texas Constitution.,None,Charles Doc Anderson,author,84R
HR 198,"Recognizing February 4, 2015, as Waco Day at the State Capitol.",None,Charles Doc Anderson,author,84R
HR 258,Congratulating Dale and Janice Blackburn of Waco on their 50th wedding anniversary.,None,Charles Doc Anderson,author,84R
HR 271,Congratulating Jack and Marceline Aaron of China Spring on their 60th wedding anniversary.,None,Charles Doc Anderson,author,84R
HR 275,Commemorating the 2014 Veterans Day appreciation ceremony hosted by Crestview HealthCare Residence in Waco.,None,Charles Doc Anderson,author,84R
HR 277,Commemorating the 2014 Veterans Day appreciation ceremony hosted by Crestview HealthCare Residence in Waco.,None,Charles Doc Anderson,author,84R
HR 278,Congratulating Natalie James and DeeAnn Hoffman on their induction into the honor society Phi Kappa Phi.,None,Charles Doc Anderson,author,84R
HR 279,Congratulating Texas State Technical College on its receipt of a grant from the U.S. Department of Labor.,None,Charles Doc Anderson,author,84R
HR 321,Congratulating Tom and Donna Lene' of Waco on their 50th wedding anniversary.,None,Charles Doc Anderson,author,84R
HR 325,Congratulating Paul and Norma Jean Swanson of Waco on their 60th wedding anniversary.,None,Charles Doc Anderson,author,84R
HR 385,Honoring Dr. Edwin Trevathan on being named executive vice president and provost of Baylor University.,None,Charles Doc Anderson,author,84R
HR 386,Congratulating Rachel Elise Spross of Crawford on her presentation as a debutante.,None,Charles Doc Anderson,author,84R
HR 387,Congratulating Ramiro Salazar of Waco High School on being named the Region 3 Assistant Coach of the Year by the Texas Association of Soccer Coaches.,None,Charles Doc Anderson,author,84R
HR 434,Honoring Laura Waller of Waco for her contributions to the Family Abuse Center.,None,Charles Doc Anderson,author,84R
HR 715,"Congratulating Ronnie Wallace, Christe Hancock, and Marva Harrison on winning Midway ISD Extra Mile Awards.",None,Charles Doc Anderson,author,84R
HR 725,Congratulating Robert and Katherine Miller on their 60th wedding anniversary.,None,Charles Doc Anderson,author,84R
HR 841,Congratulating Virginia DuPuy of Waco on her receipt of the Silver Eagle Award from the Longhorn Council of the Boy Scouts of America.,None,Charles Doc Anderson,author,84R
HR 843,"Congratulating Randy Aaron, Marty Dominguez, and Zach Minnix on their promotions with the McGregor Volunteer Fire Department.",None,Charles Doc Anderson,author,84R
HR 844,Commending Texas Department of Public Safety officers Brent Crossley and Vance Griffin for their bravery in apprehending an armed suspect.,None,Charles Doc Anderson,author,84R
HR 1149,Honoring Joyce Eilene Denke of Riesel for her service with the Red Cross during the Vietnam War.,None,Charles Doc Anderson,author,84R
HR 1185,Congratulating Frank and Juanita Brown of Waco on their 75th wedding anniversary.,None,Charles Doc Anderson,author,84R
HR 1186,Commending Keric Donahue-Perez of Alta Vista Elementary School on his honesty and integrity.,None,Charles Doc Anderson,author,84R
HR 1187,"Commending Stuart Parsons Jr. of Waco on his $25,000 donation to the Doris Miller Family YMCA.",None,Charles Doc Anderson,author,84R
HR 1201,Congratulating Miranda Torres on her scholarly accomplishments.,None,Charles Doc Anderson,author,84R
HR 1203,Congratulating Darrell and Janie Allen on their 50th wedding anniversary.,None,Charles Doc Anderson,author,84R
HR 1204,Commemorating the grand opening of the new public safety facility in Hewitt.,None,Charles Doc Anderson,author,84R
HR 1205,Commending Bruceville-Eddy Judge Raymond Britton for his civic contributions.,None,Charles Doc Anderson,author,84R
HR 1268,Commending the Heart of Texas Sertoma Club in Waco for benefiting people who are hard of hearing or deaf.,None,Charles Doc Anderson,author,84R
HR 1269,In memory of Bishop A. LaDell Thomas of Waco.,None,Charles Doc Anderson,author,84R
HR 1270,Congratulating Payton Herzog of Robinson on winning the award for Grand Champion Overall Steer at the 2014 State Fair of Texas Youth Market Shows.,None,Charles Doc Anderson,author,84R
HR 1271,Congratulating Kenneth T. Harding on his receipt of a 60-Year Award from Eddy Masonic Lodge No. 797.,None,Charles Doc Anderson,author,84R
HR 1326,Commemorating the dedication of the Clyde Hart Track and Field Stadium at Baylor University.,None,Charles Doc Anderson,author,84R
HR 1327,Congratulating Crawford High School student Nate Moenning on signing a national letter of intent to play baseball and study at Union University.,None,Charles Doc Anderson,author,84R
HR 1328,Congratulating Midway High School students named as 2015 Texas All-State orchestra members by the Texas Music Educators Association.,None,Charles Doc Anderson,author,84R
HR 1452,Congratulating Felicity Fulton of Lorena High School on being named to the 2015 Texas All-State Symphonic Band by the Association of Texas Small School Bands.,None,Charles Doc Anderson,author,84R
HR 1465,Congratulating Nelda Modena Weathersbee of Waco on her 100th birthday.,None,Charles Doc Anderson,author,84R
HR 1601,Commending Baylor University on the occasion of Baylor Day at the State Capitol.,None,Charles Doc Anderson,author,84R
HR 1602,Congratulating the Midway High School mock trial team on its participation in the Texas High School Mock Trial Competition.,None,Charles Doc Anderson,author,84R
HR 1603,Congratulating General Dynamics Information Technology in Waco on receiving the 2015 Employer of the Year award from Workforce Solutions for the Heart of Texas.,None,Charles Doc Anderson,author,84R
HR 1754,Congratulating Jonathan Lewis and Zach Zajicek on their selection as members of the 2015 Texas All-State Band by the Association of Texas Small School Bands.,None,Charles Doc Anderson,author,84R
HR 1755,Congratulating the students from Waco Baptist Academy on their success at the Central Texas Science and Engineering Fair.,None,Charles Doc Anderson,author,84R
HR 1756,Congratulating the Heart of Texas RSVP of McLennan Community College on its receipt of a Community Leadership Award from the OneStar Foundation.,None,Charles Doc Anderson,author,84R
HR 1757,Commending Officers Kurt Morsbach and Charles Herren of the Waco Police Department for assisting a motorist in need.,None,Charles Doc Anderson,author,84R
HR 1758,In memory of Glendon O. DeZell of Waco.,None,Charles Doc Anderson,author,84R
HR 1759,Commemorating the 78th annual Rodeo Austin.,None,Charles Doc Anderson,author,84R
HR 1871,Congratulating the Greater Waco Chamber of Commerce on its selection as a 2014 Chamber of the Year finalist by the American Chamber of Commerce Executives.,None,Charles Doc Anderson,author,84R
HR 1872,Congratulating Dr. Cecelia Boswell on her receipt of the 2014 State Administrator of the Gifted Award from the Texas Association for the Gifted and Talented.,None,Charles Doc Anderson,author,84R
HR 1873,Congratulating the McGregor High School freshman football team on winning the 2014 district championship.,None,Charles Doc Anderson,author,84R
HR 1874,Commemorating the 60th wedding anniversary of Kenneth and Dorothy Ludwig of Waco.,None,Charles Doc Anderson,author,84R
HR 1875,Congratulating Larry and Grace Obr of Robinson on their 50th wedding anniversary.,None,Charles Doc Anderson,author,84R
HR 1876,Congratulating the Youth Chorus of Central Texas on its receipt of the 2014 Model of Unity Award.,None,Charles Doc Anderson,author,84R
HR 1942,Congratulating Dan and Leotia Morgan of China Spring on their 75th wedding anniversary.,None,Charles Doc Anderson,author,84R
HR 1943,Congratulating Braden Robinson and Easton Cox of Lorena ISD on advancing to the Texas History Day statewide competition.,None,Charles Doc Anderson,author,84R
HR 1944,Congratulating Vinnie Johnson on his induction into the NJCAA Men's Basketball Coaches Association Hall of Fame.,None,Charles Doc Anderson,author,84R
HR 1945,Honoring Midway High School student Caroline Goodnight for her volunteer work and accomplishments.,None,Charles Doc Anderson,author,84R
HR 1946,Congratulating Grant Teaff on his retirement as executive director of the American Football Coaches Association.,None,Charles Doc Anderson,author,84R
HR 1971,Commemorating the last issue of Hometown News in McLennan County.,None,Charles Doc Anderson,author,84R
HR 1972,Commending former Waco firefighter Ray Wells for his heroism.,None,Charles Doc Anderson,author,84R
HR 1973,Congratulating Naomi Mangum of Waco on her receipt of a 25-year service certificate from the National Society United States Daughters of 1812.,None,Charles Doc Anderson,author,84R
HR 1974,Congratulating Dr. Cynthia M. Sorelle of McLennan Community College on being named the 2015 College Theatre Educator of the Year by the Texas Educational Theatre Association.,None,Charles Doc Anderson,author,84R
HR 1975,Congratulating Reicher Catholic High School students who were named to the Texas Music Educators Association All-Region Choir.,None,Charles Doc Anderson,author,84R
HR 1994,"Recognizing April 22, 2015, as Texas State Technical College Day at the State Capitol.",None,Charles Doc Anderson,author,84R
HR 2029,Commending Jim Griffith of Waco for his public service and civic engagement.,None,Charles Doc Anderson,author,84R
HR 2030,Congratulating Elsa Luciano of University High School on competing in the regional-level Visual Arts Scholastic Event.,None,Charles Doc Anderson,author,84R
HR 2031,Congratulating Aaron Peña of Woodway Elementary School on his selection as a regional finalist for an HEB Excellence in Education Award.,None,Charles Doc Anderson,author,84R
HR 2032,Congratulating the Robinson High School boys' cross-country team on placing third at the 2014 UIL Cross Country State Championships.,None,Charles Doc Anderson,author,84R
HR 2033,Congratulating Moody High School students Cody Hubbard and Drew Hargrove on their participation in the 2014-2015 Faith Angler Network high school fishing tournament.,None,Charles Doc Anderson,author,84R
HR 2034,Commemorating the 70th anniversary of Circle Hardware Supply in Waco.,None,Charles Doc Anderson,author,84R
HR 2204,Congratulating the Robinson FFA floriculture judging team on their third-place finish at the Tarleton Invitational FFA CDE Judging Contest.,None,Charles Doc Anderson,author,84R
HR 2233,Honoring C. Wayne Nance of Waco for his service in the U.S. Army during World War II.,None,Charles Doc Anderson,author,84R
HR 2234,Congratulating Chase Wolf of Waco on his receipt of a scholarship from the Former Agents of the FBI Foundation.,None,Charles Doc Anderson,author,84R
HR 2235,In memory of Mary Wilson Russell McCall.,None,Charles Doc Anderson,author,84R
HR 2236,Honoring members of the Midway High School chapter of HOSA: Future Health Professionals for their exceptional generosity.,None,Charles Doc Anderson,author,84R
HR 2237,Congratulating the Rapoport Academy middle school students who earned 1st Division awards at the Riesel Solo and Ensemble Festival.,None,Charles Doc Anderson,author,84R
HR 2238,Congratulating the Tennyson Middle School students named to the TMEA All-Region 8 Choir.,None,Charles Doc Anderson,author,84R
HR 2275,Congratulating Midway High School students named as 2015 Texas All-State Choir members by the Texas Music Educators Association.,None,Charles Doc Anderson,author,84R
HR 2276,Honoring the Kiwanis Club of Waco Seniors for its contributions to the community.,None,Charles Doc Anderson,author,84R
HR 2277,Congratulating Darin Allen of Bruceville-Eddy High School on signing a national letter of intent to run track and cross-country at West Texas A&M University.,None,Charles Doc Anderson,author,84R
HR 2387,Congratulating Andy and Shelli Rosenkranz of Waco on their 25th wedding anniversary.,None,Charles Doc Anderson,author,84R
HR 2651,Congratulating Sophia Marie Garman of Waco on her selection as a 2015 Outstanding Youth Citizen.,None,Charles Doc Anderson,author,84R
HR 2652,Congratulating the University High School choir students who qualified for the UIL State Solo and Ensemble Contest.,None,Charles Doc Anderson,author,84R
HR 2653,Congratulating the Waco High School choir students who qualified for the UIL State Solo and Ensemble Contest.,None,Charles Doc Anderson,author,84R
HR 2654,Congratulating Lois Crook on her recognition in the Waco Tribune-Herald Voices of Valor series.,None,Charles Doc Anderson,author,84R
HR 2655,Congratulating Korean War-era veteran Olis Eaton of Waco on his recognition as one of the Voices of Valor by the Waco Tribune-Herald.,None,Charles Doc Anderson,author,84R
HR 2656,Congratulating teams from Rapoport Academy on their performance at the Heart of Texas Regional History Fair.,None,Charles Doc Anderson,author,84R
HR 2657,Congratulating Traci Martin of the Midway Independent School District on her receipt of multiple awards from the Texas School Public Relations Association.,None,Charles Doc Anderson,author,84R
HR 2661,Congratulating Gene Taylor of McGregor on his performance at the Texas State Senior Games.,None,Charles Doc Anderson,author,84R
HR 2662,Congratulating the Robinson High School home site team on its performance at the Sam Houston Invitational.,None,Charles Doc Anderson,author,84R
HR 2663,Congratulating Harold and Anne Peter of Waco on their 50th wedding anniversary.,None,Charles Doc Anderson,author,84R
HR 2664,Congratulating the Robinson High School girls' tennis team on winning a district championship.,None,Charles Doc Anderson,author,84R
HR 2665,Congratulating Jacob Turner of Waco on winning the regional spelling bee.,None,Charles Doc Anderson,author,84R
HR 2666,Honoring the McGregor Family Learning Center.,None,Charles Doc Anderson,author,84R
HR 2667,Congratulating the Live Oak Classical School mock trial team on winning the Region 12 championship in the Texas High School Mock Trial Competition.,None,Charles Doc Anderson,author,84R
HR 2680,Congratulating Diana R. Garland on having the Baylor University Diana R. Garland School of Social Work named in her honor.,None,Charles Doc Anderson,author,84R
HR 2681,Congratulating Hunter January of McGregor High School on signing a national letter of intent to play football at the University of Kansas.,None,Charles Doc Anderson,author,84R
HR 2682,Congratulating Cevekia DeGrate and Heather Helton on winning medals at the 18th annual Technology Olympics.,None,Charles Doc Anderson,author,84R
HR 2683,Congratulating Lauren Berry on being named Miss Waco Teen.,None,Charles Doc Anderson,author,84R
HR 2684,Congratulating Herchel and Ora Lee Gamble of Lorena on their 65th wedding anniversary.,None,Charles Doc Anderson,author,84R
HR 2685,Congratulating Crawford Elementary School on its nomination for a 2013-2014 Blue Ribbon School Award.,None,Charles Doc Anderson,author,84R
HR 2686,Honoring Charles Alford of Waco for his service to his country.,None,Charles Doc Anderson,author,84R
HR 2690,Congratulating Amber Rhodes of Live Oak Classical School in Waco on her selection as a 2015 Texas All-State Choir member.,None,Charles Doc Anderson,author,84R
HR 2691,Honoring Dr. William A. Mitchell for his service to his country.,None,Charles Doc Anderson,author,84R
HR 2692,Congratulating Henry Fleischhauer on his recognition as one of the Voices of Valor by the Waco Tribune-Herald.,None,Charles Doc Anderson,author,84R
HR 2736,Congratulating Ervin Davis on being featured by the Waco Tribune-Herald as part of its Voices of Valor series.,None,Charles Doc Anderson,author,84R
HR 2737,Congratulating Taylor Henderson of Waco High School on being named Best Overall Advocate during the 2015 Region 12 High School Mock Trial Competition.,None,Charles Doc Anderson,author,84R
HR 2738,Congratulating Stephen Parker of Waco Baptist Academy on his accomplishments as a Civil Air Patrol cadet.,None,Charles Doc Anderson,author,84R
HR 2739,Commending Alexander Good-Suhm of Rapoport Academy Meyer High School in Waco for his participation in the Texas High School Aerospace Scholars program at NASA.,None,Charles Doc Anderson,author,84R
HR 2740,Congratulating James White of Waco on his receipt of the 2015 Visiting Angels Caregiver of the Year Award.,None,Charles Doc Anderson,author,84R
HR 2741,Congratulating Mr. and Mrs. Lendburgh Haynes of McGregor on their 60th wedding anniversary.,None,Charles Doc Anderson,author,84R
HR 2742,Congratulating the varsity orchestra students of Tennyson Middle School in Waco on their sweepstakes win at the UIL Region 8 Concert and Sight-Reading Contest.,None,Charles Doc Anderson,author,84R
HR 2743,Congratulating six members of the Rotary Club of Waco on their 50 years of membership with the organization.,None,Charles Doc Anderson,author,84R
HR 2791,Commending Zion Lutheran Church in McGregor on donating quilts to individuals in the community and beyond.,None,Charles Doc Anderson,author,84R
HR 2792,Congratulating the Robinson High School boys' powerlifting team on winning the regional championship.,None,Charles Doc Anderson,author,84R
HR 2793,Congratulating the Waco Euterpean Club on its receipt of state awards from the Texas Federation of Music Clubs.,None,Charles Doc Anderson,author,84R
HR 2892,Congratulating Kenneth Kirk Krause of Waco on the occasion of his retirement from the Texas Department of Transportation.,None,Charles Doc Anderson,author,84R
HR 2897,Congratulating William and Ruth Martin of Waco on their 35th wedding anniversary.,None,Charles Doc Anderson,author,84R
HR 2898,Honoring James Benjamin Rogers on the occasion of his retirement as director of the W. R. Poage Legislative Library at Baylor University.,None,Charles Doc Anderson,author,84R
HR 2958,Congratulating students from Reicher Catholic High School in Waco on their performance at the 2015 Texas Association of Private and Parochial Schools 4A academic meet.,None,Charles Doc Anderson,author,84R
HR 2959,Honoring Jason McNamara on his retirement from the Bosqueville ISD Board of Trustees.,None,Charles Doc Anderson,author,84R
HR 2970,Honoring Louis Moncus on his retirement from the Bosqueville ISD Board of Trustees.,None,Charles Doc Anderson,author,84R
HR 2971,Congratulating Brittany Brewer and Matthew Parsons of Midway High School on their acceptance to the 2015 summer music program at the Boston University Tanglewood Institute.,None,Charles Doc Anderson,author,84R
HR 2972,Congratulating students of the Midway High School Business Professionals of America team on qualifying to compete at the 2015 National Leadership Conference.,None,Charles Doc Anderson,author,84R
HR 3010,Congratulating Gene and Bobbie Cox of Lorena on their 60th wedding anniversary.,None,Charles Doc Anderson,author,84R
HR 3011,Congratulating Edgar and Rena Luedeker of Waco on their 74th wedding anniversary.,None,Charles Doc Anderson,author,84R
HR 3012,Honoring the Altrusa Club of Waco for its scholarship program.,None,Charles Doc Anderson,author,84R
HR 3022,In memory of musician Johnny Gimble of Dripping Springs.,None,Charles Doc Anderson,author,84R
HR 3043,Extending best wishes to Blake Hyland of McGregor for his continued recovery from an accident.,None,Charles Doc Anderson,author,84R
HR 3178,Congratulating Clint Stearns of McGregor on his graduation from Texas State Technical College.,None,Charles Doc Anderson,author,84R
HR 3179,Congratulating the Robinson High School Symphonic Band on its selection to perform at the 2015 UIL State Wind Ensemble Festival.,None,Charles Doc Anderson,author,84R
HR 3180,Congratulating Dr. Frank Graves Jr. of McGregor on his graduation from the University of Mary Hardin-Baylor.,None,Charles Doc Anderson,author,84R
HR 3181,Congratulating Baylor University athletic director Ian McCaw on being named a winner of a 2014-2015 Under Armour Athletic Director of the Year Award.,None,Charles Doc Anderson,author,84R
HR 3182,Congratulating Diane Gough of Hewitt Elementary School on being named the 2015 National Distinguished Principal for the State of Texas by the Texas Elementary Principals and Supervisors Association.,None,Charles Doc Anderson,author,84R
HR 3183,Congratulating June Shipper on her retirement from the Waco Symphony Orchestra.,None,Charles Doc Anderson,author,84R
HR 3184,Congratulating the Waco chapter of Sigma Gamma Rho Sorority on its 70th anniversary.,None,Charles Doc Anderson,author,84R
HR 3185,"Congratulating Deanie Parrish and Nancy Parrish on their induction into the Pioneer Hall of Fame by Women in Aviation, International.",None,Charles Doc Anderson,author,84R
HR 3186,Congratulating Brandon Bray on winning the Class 4A pole vault state championship at the 2015 UIL Track & Field State Meet.,None,Charles Doc Anderson,author,84R
HR 3187,Congratulating Tracy Jander of Lorena High School on her performance at the 2015 UIL Track and Field State Meet.,None,Charles Doc Anderson,author,84R
HR 3188,Congratulating Riley Richards of China Spring High School on winning the silver medal in the Class 4A pole vault at the 2015 UIL Track & Field State Meet.,None,Charles Doc Anderson,author,84R
HR 3189,Congratulating Heather Metzgar of Hewitt Elementary School on her selection as the 2014-2015 Region 12 Assistant Principal of the Year by the Texas Elementary Principals and Supervisors Association.,None,Charles Doc Anderson,author,84R
HR 3196,Congratulating Helen Gaylor Lipsey of Waco on her 100th birthday.,None,Charles Doc Anderson,author,84R
HR 3197,"Congratulating Steven Moss of Texas State Technical College on the publication of his book, We Could Not Fail: The First African Americans in the Space Program.",None,Charles Doc Anderson,author,84R
HR 3222,Congratulating Henry Boehm of Vanguard College Preparatory School in Waco on being named a Forty Acres Scholar by The University of Texas Alumni Association.,None,Charles Doc Anderson,author,84R
HR 3233,Honoring Tinker Kramer on her retirement from Ridgecrest Retirement and Health Care in Waco.,None,Charles Doc Anderson,author,84R
HR 3258,Congratulating Stefen Alan Barton of Robinson on his graduation from The University of Texas Medical Branch at Galveston.,None,Charles Doc Anderson,author,84R
HR 3259,In memory of Gerald W. Bolfing of Waco.,None,Charles Doc Anderson,author,84R
HR 3335,"Commending local, state, and federal law enforcement officers for their swift and forceful response to the incident in Waco on May 17, 2015.",None,Charles Doc Anderson,author,84R
HR 3409,Recognizing the honorees at the 2014 Crawford Fall Sports Banquet.,None,Charles Doc Anderson,author,84R
HB 177,"Relating to the research, collection, and use of adult stem cells.",None,Charles Doc Anderson,author,84R
HB 335,Relating to named driver insurance policies and certain related exclusions.,None,Charles Doc Anderson,author,84R
HB 658,Relating to the creation of a campus of the Texas State Technical College System in Fort Bend County.,None,Charles Doc Anderson,author,84R
HB 750,Relating to a landowner's liability for certain aviation activities on or above the owner's land.,None,Charles Doc Anderson,author,84R
HB 805,Relating to authorizing a license holder to carry a concealed handgun on certain premises.,None,Charles Doc Anderson,author,84R
HB 946,Relating to painting and marking requirements for certain meteorological evaluation towers; creating an offense.,None,Charles Doc Anderson,author,84R
HB 1318,Relating to the eligibility of presidential general election debates for distributions from a Major Events trust fund.,None,Charles Doc Anderson,author,84R
HB 1378,Relating to the fiscal transparency and accountability of political subdivisions.,None,Charles Doc Anderson,author,84R
HB 1458,"Relating to the sales and use tax exemption for the repair, remodeling, or maintenance of aircraft.",None,Charles Doc Anderson,author,84R
HB 1653,Relating to the ownership or operation of a motor vehicle dealership by certain manufacturers or distributors.,None,Charles Doc Anderson,author,84R
HB 1936,Relating to notice by a property owner to a mortgage servicer that the owner intends to enter into a contract with a property tax lender.,None,Charles Doc Anderson,author,84R
HB 1984,Relating to the aerospace and aviation office of the Texas Economic Development and Tourism Office and to the aerospace and aviation advisory committee.,None,Charles Doc Anderson,author,84R
HB 2301,Relating to time credits awarded against the cumulative period of commitment or treatment of certain defendants determined to be incompetent to stand trial.,None,Charles Doc Anderson,author,84R
HB 2629,"Relating to unauthorized persons at public or private institutions of higher education in this state and to trespass, damage, or defacement occurring on the grounds of those institutions; amending provisions subject to a criminal penalty and creating offenses.",None,Charles Doc Anderson,author,84R
HB 3026,Relating to the permitting of crematories under the Texas Clean Air Act.,None,Charles Doc Anderson,author,84R
