bill_name,caption,filer_id,filer_name,function,session
HR 269,Congratulating Robert P. Steele.,None,Gibson Gib Lewis,author,71R
HR 270,Congratulating Roy Stewart.,None,Gibson Gib Lewis,author,71R
HR 271,Congratulating Darrell Davis.,None,Gibson Gib Lewis,author,71R
HR 272,Congratulating Mr. and Mrs. Jim Dudley.,None,Gibson Gib Lewis,author,71R
HR 273,Congratulating Mr. and Mrs. Ray Haley on their 50th wedding anniversary.,None,Gibson Gib Lewis,author,71R
HR 277,In memory of Doris Scranton Dorcy.,None,Gibson Gib Lewis,author,71R
HR 282,"Congratulating Don L. Armstrong, Jr.",None,Gibson Gib Lewis,author,71R
HR 283,Congratulating the Reverend and Mrs. John W. Douglass.,None,Gibson Gib Lewis,author,71R
HR 299,Congratulating the Eagle Mountain Volunteer Fire Department.,None,Gibson Gib Lewis,author,71R
HR 332,Congratulating Robert H. Price.,None,Gibson Gib Lewis,author,71R
HR 333,Congratulating Dell Stith.,None,Gibson Gib Lewis,author,71R
HR 334,Congratulating Cindy Walling.,None,Gibson Gib Lewis,author,71R
HR 335,Congratulating Mr. and Mrs. Lloyd Barron.,None,Gibson Gib Lewis,author,71R
HR 364,In memory of Martha Morgan Carmean.,None,Gibson Gib Lewis,author,71R
HR 365,"In memory of Neal Thomas ""Trey"" Jones III.",None,Gibson Gib Lewis,author,71R
HR 366,Congratulating Mr. and Mrs. H. O. Burchfield.,None,Gibson Gib Lewis,author,71R
HR 367,Congratulating Mr. and Mrs. Clarence Benware.,None,Gibson Gib Lewis,author,71R
HR 455,Congratulating Mickey Lloyd Rogillio.,None,Gibson Gib Lewis,author,71R
HR 456,"Commending Harry Beason, Jr.",None,Gibson Gib Lewis,author,71R
HR 457,In memory of Dr. Gaston Foote.,None,Gibson Gib Lewis,author,71R
HR 458,"Congratulating Harry H. Dulin, Jr.",None,Gibson Gib Lewis,author,71R
HR 459,In memory of A. T. Huffhines.,None,Gibson Gib Lewis,author,71R
HR 460,In memory of Judge John B. Honts.,None,Gibson Gib Lewis,author,71R
HR 461,"Congratulating Randall Burns, Jr.",None,Gibson Gib Lewis,author,71R
HR 463,Commending Emmy Lewis.,None,Gibson Gib Lewis,author,71R
HR 464,Congratulating Larry and Flora Brotherton.,None,Gibson Gib Lewis,author,71R
HR 465,Congratulating Suz-Ann Moore.,None,Gibson Gib Lewis,author,71R
HR 494,In memory of H. B. Fuqua.,None,Gibson Gib Lewis,author,71R
HR 505,In memory of Sterling Pruitt.,None,Gibson Gib Lewis,author,71R
HR 528,Congratulating Michael Cole.,None,Gibson Gib Lewis,author,71R
HR 535,In memory of James Amos Wilson.,None,Gibson Gib Lewis,author,71R
HR 536,"Recognizing April 5, 1989, as Fort Worth Day.",None,Gibson Gib Lewis,author,71R
HR 593,Congratulating O. Z. and Nona Coon on their 50th wedding anniversary.,None,Gibson Gib Lewis,author,71R
HR 614,Congratulating Chuck Todd.,None,Gibson Gib Lewis,author,71R
HR 623,"Congratulating Mary Sacco on being named ""First Lady of Azle.""",None,Gibson Gib Lewis,author,71R
HR 624,Congratulating Mr. and Mrs. Floyd Kuhn.,None,Gibson Gib Lewis,author,71R
HR 625,Congratulating Mr. and Mrs. James Waller.,None,Gibson Gib Lewis,author,71R
HR 721,Congratulating Mary Shields.,None,Gibson Gib Lewis,author,71R
HR 722,Congratulating Sherri Houser.,None,Gibson Gib Lewis,author,71R
HR 723,Congratulating Don Mills.,None,Gibson Gib Lewis,author,71R
HR 724,Congratulating Dottie Waggoman.,None,Gibson Gib Lewis,author,71R
HR 725,Congratulating Mike Wasser.,None,Gibson Gib Lewis,author,71R
HR 726,Congratulating Bob Street.,None,Gibson Gib Lewis,author,71R
HR 727,Congratulating Bill Parsley.,None,Gibson Gib Lewis,author,71R
HR 728,Congratulating Kenneth Reed.,None,Gibson Gib Lewis,author,71R
HR 742,Congratulating Kathleen Smith.,None,Gibson Gib Lewis,author,71R
HR 743,Congratulating Ruth Finis Brown.,None,Gibson Gib Lewis,author,71R
HR 744,Congratulating Angelina Rodriguez.,None,Gibson Gib Lewis,author,71R
HR 865,Congratulating Mr. and Mrs. Walter Porter.,None,Gibson Gib Lewis,author,71R
HR 902,"Recognizing the milestone event of 10,000 regular session drafting requests received by the Texas Legislative Council.",None,Gibson Gib Lewis,author,71R
HR 926,Congratulating Mr. and Mrs. Grover C. Gibson on their anniversary.,None,Gibson Gib Lewis,author,71R
HR 929,In memory of Lester C. Klenk.,None,Gibson Gib Lewis,author,71R
HR 965,Commending Professor Bryan Garner and the University of Texas on contribution to publication of Oxford Law Dictionary.,None,Gibson Gib Lewis,author,71R
HR 1020,In memory of Thedore Friederic Walter Lammert.,None,Gibson Gib Lewis,author,71R
HR 1056,Commending the North Fort Worth Historical Society.,None,Gibson Gib Lewis,author,71R
HR 1081,Commending Ben E. Keith Foods of Fort Worth.,None,Gibson Gib Lewis,author,71R
HR 1082,"Declaring August 28, 1989, as Icky Twerp Day in Texas.",None,Gibson Gib Lewis,author,71R
HR 1083,Honoring Dr. H. Logan Swords III.,None,Gibson Gib Lewis,author,71R
HR 1111,In memory of Bill Tipps.,None,Gibson Gib Lewis,author,71R
HR 1125,Recognizing Teysha's Winery as winner of the first biennial Toast of Texas Award.,None,Gibson Gib Lewis,author,71R
HB 1,"Relating to the reform of the workers' compensation system; to the creation, powers, and duties of the Texas Workers' Compensation Commission; to work safety; authorizing an appropriation; providing criminal and....",None,Gibson Gib Lewis,coauthor,71R
HB 2,Relating to a decision of the commissioner of education relating to a student's eligibility to participate in extracurricular activities.,None,Gibson Gib Lewis,coauthor,71R
HB 4,Relating to foreign offices of the department of commerce.,None,Gibson Gib Lewis,coauthor,71R
HB 5,Relating to the offenses of engaging in organized criminal activity.,None,Gibson Gib Lewis,coauthor,71R
HB 6,"Relating to the punishment imposed for persons convicted of certain repeat felony offenses under the Texas Controlled Substances Act, and the availability of release on parole and mandatory supervision for those....",None,Gibson Gib Lewis,coauthor,71R
HB 7,"Relating to chemical precursor record-keeping, reporting, and transfer requirements and penalties; to chemical precursor transfer permits; and to the creation of the offense of unlawful transfer of receipt of a chemical..",None,Gibson Gib Lewis,coauthor,71R
HB 8,Relating to the forfeiture of certain property related to enumerated felony offenses.,None,Gibson Gib Lewis,coauthor,71R
HB 9,"Relating to the offenses of aggravated assault and deadly assault on a peace officer, member or employee of the Board of Pardons and Paroles, or jailer or guard, or probation officer or employee of an adult....",None,Gibson Gib Lewis,coauthor,71R
HB 10,Relating to the punishment of murder during the commission or attempted commission of certain aggravated felonies under the Texas Controlled Substances Act as a capital offense.,None,Gibson Gib Lewis,coauthor,71R
HB 11,Relating to the admissibility of certain statements made by the accused in criminal proceedings.,None,Gibson Gib Lewis,coauthor,71R
HB 12,Relating to the admissibility of evidence in criminal cases.,None,Gibson Gib Lewis,coauthor,71R
HB 13,Relating to the making of payments to a crime stoppers program as a condition of probation.,None,Gibson Gib Lewis,coauthor,71R
HB 1432,Relating to the establishment of a council to explore possibilities for compact agreements regarding trade and other matters with the bordering states of Mexico.,None,Gibson Gib Lewis,coauthor,71R
HB 1776,Relating to admissions to and programs at The University of Texas at Dallas.,None,Gibson Gib Lewis,coauthor,71R
HCR 74,Honoring Jon Brumley for service as chairman of State Board of Education.,None,Gibson Gib Lewis,coauthor,71R
HJR 102,Proposing a constitutional amendment relating to the compensation of the lieutenant governor and members of the legislature.,None,Gibson Gib Lewis,coauthor,71R
HR 242,In memory of J. Verna Leggett.,None,Gibson Gib Lewis,coauthor,71R
HR 293,Extending best wishes to Representative Doyle Willis for a successful recovery.,None,Gibson Gib Lewis,coauthor,71R
HR 1084,Expressing appreciation to the Daughters of the Republic of Texas on stewardship of the Alamo.,None,Gibson Gib Lewis,coauthor,71R
SCR 8,In memory of former State Representative Albert Brown.,None,Gibson Gib Lewis,sponsor,71R
SCR 140,Congratulating Don Kennard on his 60th birthday.,None,Gibson Gib Lewis,sponsor,71R
SCR 166,Commending Don Rives.,None,Gibson Gib Lewis,sponsor,71R
