bill_name,caption,filer_id,filer_name,function,session,leg_id,original_name,parsed_name
HB 3065,Relating to the requirement that certain food service establishments post a sign depicting the Heimlich maneuver.,63380,Ralph Sheffield,author,82R,4430,Rep. Ralph Sheffield,Ralph Sheffield
HB 3465,Relating to the period for which a school district's participation in certain tax increment financing reinvestment zones may be taken into account in determining the total taxable value of property in the school district.,63380,Ralph Sheffield,author,82R,4430,Rep. Ralph Sheffield,Ralph Sheffield
HB 3845,"Relating to the powers of the CLL Municipal Utility District No. 1; providing authority to levy an assessment, impose a tax, and issue bonds.",63380,Ralph Sheffield,author,82R,4430,Rep. Ralph Sheffield,Ralph Sheffield
HR 214,Congratulating Bob and Sue Stone of Temple on their 50th wedding anniversary.,63380,Ralph Sheffield,author,82R,4430,Rep. Ralph Sheffield,Ralph Sheffield
HR 255,Congratulating Jim and Maxine Howell of Temple on their 50th wedding anniversary.,63380,Ralph Sheffield,author,82R,4430,Rep. Ralph Sheffield,Ralph Sheffield
HR 256,Congratulating Robert and Alice Hoelscher of Red Ranger on their 50th wedding anniversary.,63380,Ralph Sheffield,author,82R,4430,Rep. Ralph Sheffield,Ralph Sheffield
HR 257,Congratulating Roy and Iris Kneese of Belton on their 60th wedding anniversary.,63380,Ralph Sheffield,author,82R,4430,Rep. Ralph Sheffield,Ralph Sheffield
HR 327,Congratulating Bill and Marjorie Knight of Belton on their 60th wedding anniversary.,63380,Ralph Sheffield,author,82R,4430,Rep. Ralph Sheffield,Ralph Sheffield
HR 328,"Honoring Louis DeLaRosa, Jr., and Ophelia DeLaRosa of Temple on their 50th wedding anniversary.",63380,Ralph Sheffield,author,82R,4430,Rep. Ralph Sheffield,Ralph Sheffield
HR 459,Commemorating the 50th wedding anniversary of Paul and Oralia Luna of Belton.,63380,Ralph Sheffield,author,82R,4430,Rep. Ralph Sheffield,Ralph Sheffield
HR 460,Congratulating Jesse and Rosa Garcia of Temple on their 50th wedding anniversary.,63380,Ralph Sheffield,author,82R,4430,Rep. Ralph Sheffield,Ralph Sheffield
HR 461,Congratulating the Reverend Tommy Davis and Marilyn Davis of Belton on their 50th wedding anniversary.,63380,Ralph Sheffield,author,82R,4430,Rep. Ralph Sheffield,Ralph Sheffield
HR 620,Congratulating Bob and Bernice Priddy of Troy on their 60th wedding anniversary.,63380,Ralph Sheffield,author,82R,4430,Rep. Ralph Sheffield,Ralph Sheffield
HR 621,"Congratulating Eddie and Gladys Dantzler of Holland, Texas, on their 70th wedding anniversary.",63380,Ralph Sheffield,author,82R,4430,Rep. Ralph Sheffield,Ralph Sheffield
HR 756,Congratulating Lieutenant Colonel (Ret.) Deborah L. Van Dormolen of Salado on being named the 2010 Distinguished Military Retiree for Texas by the Fort Hood Retiree Council.,63380,Ralph Sheffield,author,82R,4430,Rep. Ralph Sheffield,Ralph Sheffield
HR 782,Honoring Keep Temple Beautiful for its exceptional community service.,63380,Ralph Sheffield,author,82R,4430,Rep. Ralph Sheffield,Ralph Sheffield
HR 830,Commemorating the 110th anniversary of the founding of RVOS Farm Mutual Insurance Company in Temple.,63380,Ralph Sheffield,author,82R,4430,Rep. Ralph Sheffield,Ralph Sheffield
HR 831,Congratulating Little Joe Hernandez y La Familia on winning the Grammy Award for Best Tejano Album at the 53rd annual Grammy Awards.,63380,Ralph Sheffield,author,82R,4430,Rep. Ralph Sheffield,Ralph Sheffield
HR 960,Congratulating Ernest and Lillian Winkler of Temple on their 65th wedding anniversary.,63380,Ralph Sheffield,author,82R,4430,Rep. Ralph Sheffield,Ralph Sheffield
HR 961,Congratulating Willie and Eula Bennett of Rockdale on their 65th wedding anniversary.,63380,Ralph Sheffield,author,82R,4430,Rep. Ralph Sheffield,Ralph Sheffield
HR 962,Congratulating Rufus and Betty Ruth Hurley of Temple on their 60th wedding anniversary.,63380,Ralph Sheffield,author,82R,4430,Rep. Ralph Sheffield,Ralph Sheffield
HR 980,"Recognizing March 23, 2011, as Salad Day and commending the owner/operators of Texas McDonald's restaurants.",63380,Ralph Sheffield,author,82R,4430,Rep. Ralph Sheffield,Ralph Sheffield
HR 981,Congratulating Jesse and Minnie Garcia of Temple on their 60th wedding anniversary.,63380,Ralph Sheffield,author,82R,4430,Rep. Ralph Sheffield,Ralph Sheffield
HR 982,Congratulating Melvin and Alice Gerngross of Temple on their 70th wedding anniversary.,63380,Ralph Sheffield,author,82R,4430,Rep. Ralph Sheffield,Ralph Sheffield
HR 1031,"Recognizing March 29, 2011, as Texas Charity Advocates Day at the State Capitol.",63380,Ralph Sheffield,author,82R,4430,Rep. Ralph Sheffield,Ralph Sheffield
HR 1150,"Recognizing April 4 through 8, 2011, as Connect a Million Minds Week.",63380,Ralph Sheffield,author,82R,4430,Rep. Ralph Sheffield,Ralph Sheffield
HR 1151,In memory of Eldo Johnson of Temple.,63380,Ralph Sheffield,author,82R,4430,Rep. Ralph Sheffield,Ralph Sheffield
HR 1419,"Recognizing October 26, 2011, as Texas Chicken Fried Steak Day.",63380,Ralph Sheffield,author,82R,4430,Rep. Ralph Sheffield,Ralph Sheffield
HR 1420,In memory of the Honorable Hiram Childress of Temple.,63380,Ralph Sheffield,author,82R,4430,Rep. Ralph Sheffield,Ralph Sheffield
HR 1421,Congratulating James and Sandy Champ of Little River on their 50th wedding anniversary.,63380,Ralph Sheffield,author,82R,4430,Rep. Ralph Sheffield,Ralph Sheffield
HR 1422,Congratulating Carrol and Blanch Ward of McGregor on their 60th wedding anniversary.,63380,Ralph Sheffield,author,82R,4430,Rep. Ralph Sheffield,Ralph Sheffield
HR 1423,Congratulating David and Betty Hester of Temple on their 50th wedding anniversary.,63380,Ralph Sheffield,author,82R,4430,Rep. Ralph Sheffield,Ralph Sheffield
HR 1747,In memory of U.S. Army Staff Sergeant Mecolus C. McDaniel.,63380,Ralph Sheffield,author,82R,4430,Rep. Ralph Sheffield,Ralph Sheffield
HR 1748,Honoring Donald Clifton Heath of Temple on his 80th birthday.,63380,Ralph Sheffield,author,82R,4430,Rep. Ralph Sheffield,Ralph Sheffield
HR 1749,Congratulating members of Extreme Cheer & Tumble on winning their division at the 2011 National Cheerleaders Association All-Star National Championship.,63380,Ralph Sheffield,author,82R,4430,Rep. Ralph Sheffield,Ralph Sheffield
HR 2258,Congratulating D. L. and Aggie Shannon of Temple on their 70th wedding anniversary.,63380,Ralph Sheffield,author,82R,4430,Rep. Ralph Sheffield,Ralph Sheffield
HR 2259,Congratulating Robert and Kathy Ranly of Temple on their 50th wedding anniversary.,63380,Ralph Sheffield,author,82R,4430,Rep. Ralph Sheffield,Ralph Sheffield
HR 2260,Congratulating Felipe and Corina Martinez of Temple on their 55th wedding anniversary.,63380,Ralph Sheffield,author,82R,4430,Rep. Ralph Sheffield,Ralph Sheffield
HR 2351,"Recognizing June 9, 2011, as Food First Day.",63380,Ralph Sheffield,author,82R,4430,Rep. Ralph Sheffield,Ralph Sheffield
HR 2352,Congratulating George and Frances Svatek of Temple on their 50th wedding anniversary.,63380,Ralph Sheffield,author,82R,4430,Rep. Ralph Sheffield,Ralph Sheffield
HR 2353,In memory of Mamie Sue Moon Zabcik.,63380,Ralph Sheffield,author,82R,4430,Rep. Ralph Sheffield,Ralph Sheffield
HR 2354,Commending Lieutenant General Robert W. Cone on his command of III Corps and Fort Hood and congratulating him on his promotion to the rank of four-star general.,63380,Ralph Sheffield,author,82R,4430,Rep. Ralph Sheffield,Ralph Sheffield
HR 2582,"Paying tribute to the memory of Officer Patrick Sirois, who was posthumously honored with the 2010 State of Texas Law Enforcement Achievement Award for Valor.",63380,Ralph Sheffield,author,82R,4430,Rep. Ralph Sheffield,Ralph Sheffield
HB 74,Relating to persons authorized to control the disposition of the remains of certain members of the United States armed forces.,63380,Ralph Sheffield,author,82R,4430,Rep. Ralph Sheffield,Ralph Sheffield
HB 182,Relating to the issuance of Bronze Star Medal specialty license plates.,63380,Ralph Sheffield,author,82R,4430,Rep. Ralph Sheffield,Ralph Sheffield
HB 246,Relating to the eligibility for service retirement annuities of certain elected officials convicted of certain crimes.,63380,Ralph Sheffield,author,82R,4430,Rep. Ralph Sheffield,Ralph Sheffield
HB 279,Relating to the use of eminent domain authority.,63380,Ralph Sheffield,author,82R,4430,Rep. Ralph Sheffield,Ralph Sheffield
HB 812,Relating to the definition of peace officer for purposes of intercepting or collecting information in relation to certain communications in an investigation of criminal conduct.,63380,Ralph Sheffield,author,82R,4430,Rep. Ralph Sheffield,Ralph Sheffield
HB 1776,Relating to contracts between dentists and health maintenance organizations or insurers.,63380,Ralph Sheffield,author,82R,4430,Rep. Ralph Sheffield,Ralph Sheffield
HB 2404,Relating to the imposition of a privilege fee for state-owned housing provided to certain state employees by a state agency.,63380,Ralph Sheffield,author,82R,4430,Rep. Ralph Sheffield,Ralph Sheffield
HB 3179,Relating to contributions to the fund for veterans' assistance.,63380,Ralph Sheffield,author,82R,4430,Rep. Ralph Sheffield,Ralph Sheffield
HJR 37,Proposing a constitutional amendment requiring certain tax bills to be approved by two-thirds of all the members elected to each house of the legislature.,63380,Ralph Sheffield,author,82R,4430,Rep. Ralph Sheffield,Ralph Sheffield
HJR 50,Applying to Congress to call a convention to propose an amendment to the United States Constitution to permit the repeal of federal law by two-thirds of the legislatures of the several states.,63380,Ralph Sheffield,author,82R,4430,Rep. Ralph Sheffield,Ralph Sheffield
HB 5,Relating to the Interstate Health Care Compact.,63380,Ralph Sheffield,coauthor,82R,4430,Rep. Ralph Sheffield,Ralph Sheffield
HB 6,"Relating to the foundation curriculum, the establishment of the instructional materials allotment, and the adoption, review, and purchase of instructional materials and technological equipment for public schools.",63380,Ralph Sheffield,coauthor,82R,4430,Rep. Ralph Sheffield,Ralph Sheffield
HB 7,"Relating to the prosecution, punishment, and certain criminal and civil consequences of offenses involving or related to the trafficking of persons and to certain protections for victims of those offenses.",63380,Ralph Sheffield,coauthor,82R,4430,Rep. Ralph Sheffield,Ralph Sheffield
HB 8,Relating to prohibiting certain private transfer fees and the preservation of private real property rights; providing penalties.,63380,Ralph Sheffield,coauthor,82R,4430,Rep. Ralph Sheffield,Ralph Sheffield
HB 9,Relating to student success-based funding for and reporting regarding public institutions of higher education.,63380,Ralph Sheffield,coauthor,82R,4430,Rep. Ralph Sheffield,Ralph Sheffield
HB 10,Relating to eligibility for a TEXAS grant and to administration of the TEXAS grant program.,63380,Ralph Sheffield,coauthor,82R,4430,Rep. Ralph Sheffield,Ralph Sheffield
HB 11,Relating to reports filed with the comptroller regarding certain alcoholic beverage sales; providing a penalty.,63380,Ralph Sheffield,coauthor,82R,4430,Rep. Ralph Sheffield,Ralph Sheffield
HB 12,Relating to the enforcement of state and federal laws governing immigration by certain governmental entities.,63380,Ralph Sheffield,coauthor,82R,4430,Rep. Ralph Sheffield,Ralph Sheffield
HB 15,Relating to informed consent to an abortion.,63380,Ralph Sheffield,coauthor,82R,4430,Rep. Ralph Sheffield,Ralph Sheffield
HB 32,Relating to required individual health insurance coverage.,63380,Ralph Sheffield,coauthor,82R,4430,Rep. Ralph Sheffield,Ralph Sheffield
HB 85,Relating to the state's or a state governmental entity's provision of support for the performance of an abortion or abortion-related services.,63380,Ralph Sheffield,coauthor,82R,4430,Rep. Ralph Sheffield,Ralph Sheffield
HB 174,Relating to the cancellation of the voter registration and to the eligibility to vote of persons who are deceased or not citizens of the United States.,63380,Ralph Sheffield,coauthor,82R,4430,Rep. Ralph Sheffield,Ralph Sheffield
HB 201,Relating to informed consent to an abortion.,63380,Ralph Sheffield,coauthor,82R,4430,Rep. Ralph Sheffield,Ralph Sheffield
HB 233,Relating to requirements for students to be assessed in certain subjects and in certain grades.,63380,Ralph Sheffield,coauthor,82R,4430,Rep. Ralph Sheffield,Ralph Sheffield
HB 238,"Relating to the issuance of ""Choose Life"" license plates and the creation of the Choose Life account in the general revenue fund.",63380,Ralph Sheffield,coauthor,82R,4430,Rep. Ralph Sheffield,Ralph Sheffield
HB 241,Relating to liability for interest if land appraised for ad valorem tax purposes as agricultural or open-space land is sold or diverted to a different use.,63380,Ralph Sheffield,coauthor,82R,4430,Rep. Ralph Sheffield,Ralph Sheffield
HB 275,Relating to making an appropriation of money from the economic stabilization fund for expenditure during the current state fiscal biennium.,63380,Ralph Sheffield,coauthor,82R,4430,Rep. Ralph Sheffield,Ralph Sheffield
HB 335,Relating to implementation and requirements of certain health care reform laws.,63380,Ralph Sheffield,coauthor,82R,4430,Rep. Ralph Sheffield,Ralph Sheffield
HB 400,Relating to flexibility for public schools to administer primary and secondary education efficiently.,63380,Ralph Sheffield,coauthor,82R,4430,Rep. Ralph Sheffield,Ralph Sheffield
HB 500,Relating to state-adopted assessment instruments administered to  public school students.,63380,Ralph Sheffield,coauthor,82R,4430,Rep. Ralph Sheffield,Ralph Sheffield
HB 529,Relating to certification for placement on the ballot of candidates for president or vice-president of the United States.,63380,Ralph Sheffield,coauthor,82R,4430,Rep. Ralph Sheffield,Ralph Sheffield
HB 670,Relating to the elimination of smoking in certain workplaces and public places; providing penalties.,63380,Ralph Sheffield,coauthor,82R,4430,Rep. Ralph Sheffield,Ralph Sheffield
HB 681,Relating to an employee's transportation and storage of certain firearms or ammunition while on certain property owned or controlled by the employee's employer.,63380,Ralph Sheffield,coauthor,82R,4430,Rep. Ralph Sheffield,Ralph Sheffield
HB 698,Relating to the carrying of concealed handguns by certain persons attending a school board meeting.,63380,Ralph Sheffield,coauthor,82R,4430,Rep. Ralph Sheffield,Ralph Sheffield
HB 718,Relating to the period in which a person commits the offense of funeral service disruption.,63380,Ralph Sheffield,coauthor,82R,4430,Rep. Ralph Sheffield,Ralph Sheffield
HB 750,Relating to the carrying of concealed handguns on certain premises of or locations associated with schools or institutions of higher education.,63380,Ralph Sheffield,coauthor,82R,4430,Rep. Ralph Sheffield,Ralph Sheffield
HB 1013,Relating to the powers and duties of the Texas Medical Board and the regulation of certain persons licensed by the board.,63380,Ralph Sheffield,coauthor,82R,4430,Rep. Ralph Sheffield,Ralph Sheffield
HB 1111,Relating to a tenant's failure to pay rent during an appeal of an eviction for nonpayment of rent after filing a pauper's affidavit.,63380,Ralph Sheffield,coauthor,82R,4430,Rep. Ralph Sheffield,Ralph Sheffield
HB 1121,Relating to the prosecution and punishment of certain offenses involving trafficking of persons.,63380,Ralph Sheffield,coauthor,82R,4430,Rep. Ralph Sheffield,Ralph Sheffield
HB 1168,Relating to smoke alarms and fire extinguishers in residential rental units.,63380,Ralph Sheffield,coauthor,82R,4430,Rep. Ralph Sheffield,Ralph Sheffield
HB 1427,Relating to the designation of a responsible third party.,63380,Ralph Sheffield,coauthor,82R,4430,Rep. Ralph Sheffield,Ralph Sheffield
HB 1766,Relating to the creation of a voluntary consumer-directed health plan for certain individuals eligible to participate in the insurance coverage provided under the Texas Employees Group Benefits Act and their qualified dependents.,63380,Ralph Sheffield,coauthor,82R,4430,Rep. Ralph Sheffield,Ralph Sheffield
HB 1971,Relating to the liability of a landowner for harm to a trespasser.,63380,Ralph Sheffield,coauthor,82R,4430,Rep. Ralph Sheffield,Ralph Sheffield
HB 2031,Relating to the establishment of a voluntary compensation plan as a method of alternative dispute resolution.,63380,Ralph Sheffield,coauthor,82R,4430,Rep. Ralph Sheffield,Ralph Sheffield
HB 2661,Relating to settlement of certain civil actions.,63380,Ralph Sheffield,coauthor,82R,4430,Rep. Ralph Sheffield,Ralph Sheffield
HB 2846,Relating to certain procedures and civil penalties under the Deceptive Trade Practices-Consumer Protection Act.,63380,Ralph Sheffield,coauthor,82R,4430,Rep. Ralph Sheffield,Ralph Sheffield
HB 2961,Relating to the creation of a program for the development of solar energy industry in this state.,63380,Ralph Sheffield,coauthor,82R,4430,Rep. Ralph Sheffield,Ralph Sheffield
HB 2986,Relating to political expenditures made by labor organizations; providing civil and criminal penalties.,63380,Ralph Sheffield,coauthor,82R,4430,Rep. Ralph Sheffield,Ralph Sheffield
HB 3498,Relating to the penalty for illegal voting.,63380,Ralph Sheffield,coauthor,82R,4430,Rep. Ralph Sheffield,Ralph Sheffield
HB 3610,Relating to periodic rate adjustments by electric utilities.,63380,Ralph Sheffield,coauthor,82R,4430,Rep. Ralph Sheffield,Ralph Sheffield
HCR 18,Urging Congress to propose and submit to the states an amendment to the United States Constitution providing for a federal balanced budget.,63380,Ralph Sheffield,coauthor,82R,4430,Rep. Ralph Sheffield,Ralph Sheffield
HCR 50,"Affirming the pride of all Texans in both our one and indivisible national union and our one and indivisible state, claiming sovereignty under the Tenth Amendment to the Constitution of the United States over all powers not otherwise enumerated and granted to the federal government by the U.S. Constitution, serving notice to the federal government to cease and desist from certain mandates, and providing that certain federal legislation be prohibited or repealed.",63380,Ralph Sheffield,coauthor,82R,4430,Rep. Ralph Sheffield,Ralph Sheffield
HCR 66,Urging the United States Congress to prevent the Environmental Protection Agency from regulating greenhouse gases for stationary sources.,63380,Ralph Sheffield,coauthor,82R,4430,Rep. Ralph Sheffield,Ralph Sheffield
HCR 126,In memory of the Honorable Edmund Kuempel of Seguin.,63380,Ralph Sheffield,coauthor,82R,4430,Rep. Ralph Sheffield,Ralph Sheffield
HJR 22,Proposing a constitutional amendment to prohibit the state or a governmental entity in the state from providing support for the performance of an abortion or abortion-related services.,63380,Ralph Sheffield,coauthor,82R,4430,Rep. Ralph Sheffield,Ralph Sheffield
HJR 48,Proposing a constitutional amendment authorizing the legislature to exempt from ad valorem taxation the residence homestead of the surviving spouse of a 100 percent or totally disabled veteran in an amount equal to the amount of the residence homestead exemption to which the disabled veteran was entitled on the same property.,63380,Ralph Sheffield,coauthor,82R,4430,Rep. Ralph Sheffield,Ralph Sheffield
HJR 56,Proposing a constitutional amendment to restrict the power of the legislature to mandate requirements on local governments.,63380,Ralph Sheffield,coauthor,82R,4430,Rep. Ralph Sheffield,Ralph Sheffield
HJR 100,Applying to the Congress of the United States to call a convention to propose an amendment to the United States Constitution to require a balanced federal budget.,63380,Ralph Sheffield,coauthor,82R,4430,Rep. Ralph Sheffield,Ralph Sheffield
HR 1694,"Commending President Barack Obama, intelligence personnel, and members of the armed forces for the successful completion of their operation.",63380,Ralph Sheffield,coauthor,82R,4430,Rep. Ralph Sheffield,Ralph Sheffield
SB 1009,Relating to requiring public institutions of higher education to notify the federal Student and Exchange Visitor Information System (SEVIS) regarding the withdrawal or nonattendance of certain foreign students.,63380,Ralph Sheffield,sponsor,82R,4430,Rep. Ralph Sheffield,Ralph Sheffield
SB 371,Relating to the eligibility for service retirement annuities of certain elected officials convicted of certain crimes.,63380,Ralph Sheffield,sponsor,82R,4430,Rep. Ralph Sheffield,Ralph Sheffield
SB 14,"Relating to requirements to vote, including presenting proof of identification; providing criminal penalties.",63380,Ralph Sheffield,cosponsor,82R,4430,Rep. Ralph Sheffield,Ralph Sheffield
SB 24,"Relating to the prosecution, punishment, and certain criminal and civil consequences of offenses involving or related to the trafficking of persons and to certain protections for victims of those offenses.",63380,Ralph Sheffield,cosponsor,82R,4430,Rep. Ralph Sheffield,Ralph Sheffield
SB 257,"Relating to the issuance of ""Choose Life"" license plates and the creation of the Choose Life account in the general revenue fund.",63380,Ralph Sheffield,cosponsor,82R,4430,Rep. Ralph Sheffield,Ralph Sheffield
HB 573,Relating to a person's eligibility for appointment as a volunteer deputy voter registrar.,63380,Ralph Sheffield,author,81R,4430,Rep. Ralph Sheffield,Ralph Sheffield
HB 574,Relating to disclosure at a facility performing certain laser cosmetic procedures.,63380,Ralph Sheffield,author,81R,4430,Rep. Ralph Sheffield,Ralph Sheffield
HB 575,Relating to a prohibition on the disclosure and use of certain information recorded or collected by a transponder used to electronically assess or collect a toll.,63380,Ralph Sheffield,author,81R,4430,Rep. Ralph Sheffield,Ralph Sheffield
HB 576,Relating to the electronic distribution of information to legislators by state agencies.,63380,Ralph Sheffield,author,81R,4430,Rep. Ralph Sheffield,Ralph Sheffield
HB 577,Relating to requiring public institutions of higher education to notify the federal Student Exchange and Visitor Information System (SEVIS) regarding the withdrawal or nonattendance of certain foreign students.,63380,Ralph Sheffield,author,81R,4430,Rep. Ralph Sheffield,Ralph Sheffield
HB 1475,Relating to the election of directors of the Clearwater Underground Water Conservation District.,63380,Ralph Sheffield,author,81R,4430,Rep. Ralph Sheffield,Ralph Sheffield
HB 1476,Relating to capital stock and surplus requirements for certain insurance companies.,63380,Ralph Sheffield,author,81R,4430,Rep. Ralph Sheffield,Ralph Sheffield
HB 1640,Relating to the purposes and powers of the Temple Health and Bioscience Economic Development District.,63380,Ralph Sheffield,author,81R,4430,Rep. Ralph Sheffield,Ralph Sheffield
HB 2877,Relating to liability insurance closed claim reports.,63380,Ralph Sheffield,author,81R,4430,Rep. Ralph Sheffield,Ralph Sheffield
HB 2878,Relating to the establishment for purposes of ad valorem taxation of an initial limit on the appraised value of the residence homestead of a disabled or elderly person that was rehabilitated or constructed as a replacement residence under the federal community development block grant program or a housing rehabilitation program of the Texas Department of Housing and Community Affairs.,63380,Ralph Sheffield,author,81R,4430,Rep. Ralph Sheffield,Ralph Sheffield
HB 3671,Relating to the documents that are required for the transfer of a defendant from a county to the Texas Department of Criminal Justice.,63380,Ralph Sheffield,author,81R,4430,Rep. Ralph Sheffield,Ralph Sheffield
HB 4210,Relating to the election of directors of the Clearwater Underground Water Conservation District.,63380,Ralph Sheffield,author,81R,4430,Rep. Ralph Sheffield,Ralph Sheffield
HCR 211,Congratulating the Blackland Research and Extension Center on its 100th anniversary.,63380,Ralph Sheffield,author,81R,4430,Rep. Ralph Sheffield,Ralph Sheffield
HCR 257,In memory of James Michael Grant of Gatesville.,63380,Ralph Sheffield,author,81R,4430,Rep. Ralph Sheffield,Ralph Sheffield
HJR 91,Proposing a constitutional amendment authorizing the legislature to establish for purposes of ad valorem taxation an initial limit on the appraised value of the residence homestead of a disabled or elderly person that was rehabilitated or constructed as a replacement residence under the federal community development block grant program or a housing rehabilitation program of the Texas Department of Housing and Community Affairs.,63380,Ralph Sheffield,author,81R,4430,Rep. Ralph Sheffield,Ralph Sheffield
HR 751,Honoring Leadership Temple for its promotion of civic engagement and volunteerism.,63380,Ralph Sheffield,author,81R,4430,Rep. Ralph Sheffield,Ralph Sheffield
HR 752,Commemorating the 50th anniversary of First Baptist Church of Academy.,63380,Ralph Sheffield,author,81R,4430,Rep. Ralph Sheffield,Ralph Sheffield
HR 834,Congratulating Chief Gary O. Smith of the Temple Police Department on his 30 years of service to the city.,63380,Ralph Sheffield,author,81R,4430,Rep. Ralph Sheffield,Ralph Sheffield
HR 887,In memory of the Honorable Jamie Hager Clements of Temple.,63380,Ralph Sheffield,author,81R,4430,Rep. Ralph Sheffield,Ralph Sheffield
HR 988,Congratulating Crystal Cox on being named a 2009 Texas Youth of the Year Finalist by the Texas Alliance of Boys & Girls Clubs.,63380,Ralph Sheffield,author,81R,4430,Rep. Ralph Sheffield,Ralph Sheffield
HR 989,In memory of John Fullerton Sammons of Temple.,63380,Ralph Sheffield,author,81R,4430,Rep. Ralph Sheffield,Ralph Sheffield
HR 997,Honoring Leadership Belton for its promotion of civic engagement and volunteerism.,63380,Ralph Sheffield,author,81R,4430,Rep. Ralph Sheffield,Ralph Sheffield
HR 1048,Congratulating Matthew Westwick on attaining the rank of Eagle Scout.,63380,Ralph Sheffield,author,81R,4430,Rep. Ralph Sheffield,Ralph Sheffield
HR 1082,Honoring Bob and Betty Thrasher of Temple on the occasion of their 60th wedding anniversary.,63380,Ralph Sheffield,author,81R,4430,Rep. Ralph Sheffield,Ralph Sheffield
