bill_name,caption,filer_id,filer_name,function,session
HB 2045,Relating to revenue from Texas State Rifle Association specialty license plates.,None,Bob Deuell,sponsor,80R
HB 2256,"Relating to the requirements for uniform fair hearing rules for Medicaid services, including services that require prior authorization.",None,Bob Deuell,sponsor,80R
HB 2389,"Relating to the right of a minor in the custody of the Texas Department of Criminal Justice to consent to medical, dental, psychological, and surgical treatment.",None,Bob Deuell,sponsor,80R
HB 2392,Relating to escrow fees required for the construction and leasing of certain health facilities.,None,Bob Deuell,sponsor,80R
HB 2426,Relating to the regulation of the practice of nursing and the renaming of the Board of Nurse Examiners as the Texas Board of Nursing.,None,Bob Deuell,sponsor,80R
HB 2460,Relating to the continuation and functions of the Texas Commission on the Arts.,None,Bob Deuell,sponsor,80R
HB 2471,Relating to the treatment and sale of certain bedding.,None,Bob Deuell,sponsor,80R
HB 2484,Relating to the funds allocation advisory committee of the Texas Commission on Fire Protection.,None,Bob Deuell,sponsor,80R
HB 2627,Relating to the requirements for the issuance of certain specialty license plates.,None,Bob Deuell,sponsor,80R
HB 2667,"Relating to certain insurance-related matters involving rural volunteer firefighters, volunteer police force members, or emergency services districts.",None,Bob Deuell,sponsor,80R
HB 2859,Relating to a memorial sign program for victims of certain vehicle accidents.,None,Bob Deuell,sponsor,80R
HB 2918,Relating to state information technology contracting and procurement practices.,None,Bob Deuell,sponsor,80R
HB 3084,Relating to the municipal street maintenance sales tax.,None,Bob Deuell,sponsor,80R
HB 3089,Relating to the definition of a roadway in connection with the prohibition against solicitation by a pedestrian.,None,Bob Deuell,sponsor,80R
HB 3154,Relating to the creation of a review committee to study the provision of indigent health care through county and regional health care services.,None,Bob Deuell,sponsor,80R
HB 3184,Relating to educating parents about the benefits of immunizing certain children against influenza.,None,Bob Deuell,sponsor,80R
HB 3613,"Relating to identification cards issued to peace officers, reserve law enforcement officers, and honorably retired peace officers by a law enforcement agency or other governmental entity.",None,Bob Deuell,sponsor,80R
HB 3930,Relating to the appeals process in the disposition of cruelly treated animals.,None,Bob Deuell,sponsor,80R
HB 4033,Relating to the creation of the Ledbetter Utility District No. 1 of Kaufman and Rockwall Counties; providing authority to impose a tax and issue bonds; granting the power of eminent domain.,None,Bob Deuell,sponsor,80R
HB 4034,Relating to the creation of the Ledbetter Utility District No. 2 of Kaufman and Rockwall Counties; providing authority to impose a tax and issue bonds; granting the power of eminent domain.,None,Bob Deuell,sponsor,80R
HB 4071,Relating to the authority of the Las Lomas Municipal Utility District No. 4 of Kaufman County and the Kaufman County Water Control and Improvement District No. 1 to undertake road projects.,None,Bob Deuell,sponsor,80R
HB 4085,"Relating to the creation of the Triple Creek Municipal Management District; providing authority to levy an assessment, impose a tax, and issue bonds.",None,Bob Deuell,sponsor,80R
HB 4139,Relating to the creation of a county court at law in Van Zandt County.,None,Bob Deuell,sponsor,80R
HCR 7,"Recognizing March 20, 2007, as Sulphur Springs/Hopkins County Day at the State Capitol.",None,Bob Deuell,sponsor,80R
HCR 136,Designating the Ghostriders as the official Rodeo Drill Team of Texas.,None,Bob Deuell,sponsor,80R
HCR 167,"Recognizing the 2007 and 2008 appointments of State Poet Laureate, State Musician, and State Visual Artists.",None,Bob Deuell,sponsor,80R
HCR 182,Honoring Rachel Ming of Sulphur Springs on qualifying for the Business Professionals of America National Leadership Conference and Contest.,None,Bob Deuell,sponsor,80R
HCR 183,Honoring the members of the Sulphur Springs Middle School academic team for their victory at the UIL district competition.,None,Bob Deuell,sponsor,80R
HCR 260,Congratulating Michael J. Warner of Austin on his graduation from The University of Texas at Austin.,None,Bob Deuell,sponsor,80R
HCR 32,"Designating February 26 to February 27, 2007, as Tyler Days at the State Capitol.",None,Bob Deuell,sponsor,80R
HB 14,"Relating to reorganizing certain state institutions that provide financing for cancer research, including creating the Cancer Prevention and Research Institute of Texas, and information about certain cancer treatments; granting authority to issue bonds.",None,Bob Deuell,cosponsor,80R
HB 323,Relating to three-point seat belts on buses that transport schoolchildren.,None,Bob Deuell,cosponsor,80R
HB 416,Relating to providing for restroom access for persons with certain medical conditions; providing a criminal penalty.,None,Bob Deuell,cosponsor,80R
HB 3678,Relating to voluntary student expression of religious viewpoints in public schools.,None,Bob Deuell,cosponsor,80R
SR 84,Commending the Terrell Independent School District Head Start program for 40 years of service to the children of Terrell.,None,Bob Deuell,author,793
HB 72,Relating to providing for an adjustment of the limitation on the total amount of ad valorem taxes that may be imposed by a school district on the residence homesteads of the elderly or disabled to reflect any change in the school district's tax rate and protecting a school district against the resulting loss in local revenue.,None,Bob Deuell,sponsor,793
HJR 26,Proposing a constitutional amendment providing for an adjustment of the limitation on the total amount of ad valorem taxes that may be imposed for public school purposes on the residence homesteads of the elderly or disabled to reflect any change in the rate of those taxes.,None,Bob Deuell,sponsor,793
SR 104,Commending Rockwall County Young Republicans for its achievements.,None,Bob Deuell,author,792
SR 118,Recognizing the Mesquite Republican Women's Club on the occasion of its 30th anniversary.,None,Bob Deuell,author,792
HCR 16,"Commending Dereck Hatley of Sulphur Springs for his heroic actions during a vicious dog attack on July 16, 2005.",None,Bob Deuell,sponsor,792
SB 51,Relating to the regulation of academic dyslexia teachers and therapists; imposing penalties.,None,Bob Deuell,author,791
SB 73,Relating to the issuance of revenue bonds for Texas A&M University--Commerce.,None,Bob Deuell,author,791
SJR 10,Proposing a constitutional amendment to prohibit a political subdivision from taking private property for the primary purpose of economic development.,None,Bob Deuell,author,791
SR 37,Recognizing Benjamin Moore and Company in Mesquite for its contributions to the Mesquite community.,None,Bob Deuell,author,791
SR 66,"Congratulating Key and Holly Walker on the birth of their daughter, Sydney Rebecca Walker.",None,Bob Deuell,author,791
SB 58,Relating to authorizing the issuance of revenue bonds to fund capital projects at certain public institutions of higher education.,None,Bob Deuell,author,791
SB 62,Relating to limiting the use of eminent domain to take private property for private parties or economic development purposes and to certain eminent domain procedures.,None,Bob Deuell,coauthor,791
HCR 25,"Proclaiming July 25, 2005, as Henry Miller Morgan Day in Texas and commemorating the dedication of a Texas State Historical Marker at the site in Tyler of the first African American barber college.",None,Bob Deuell,sponsor,791
SB 310,Relating to certain diseases or illnesses suffered by firefighters and emergency medical technicians.,None,Bob Deuell,author,79R
SB 311,Relating to the regulation of academic language teachers and therapists; imposing penalties.,None,Bob Deuell,author,79R
SB 312,"Relating to the use, sale, purchase, or possession of a traffic-control signal preemption device; providing criminal penalties.",None,Bob Deuell,author,79R
SB 330,Relating to the creation of a stroke committee and the development of a statewide stroke emergency transport plan and stroke facility criteria.,None,Bob Deuell,author,79R
SB 377,"Relating to authorizing a county, city, town, school district, or other political subdivision to provide an additional exemption from ad valorem taxation of the residence homesteads of certain surviving spouses of peace officers and firefighters.",None,Bob Deuell,author,79R
SB 378,Relating to the State Board of Education review of public school textbooks.,None,Bob Deuell,author,79R
SB 468,Relating to the depository designated by the Hunt Memorial Hospital District.,None,Bob Deuell,author,79R
SB 511,Relating to public testimony at regular meetings of the governing board of a general academic teaching institution.,None,Bob Deuell,author,79R
SB 512,Relating to the criminal penalty for the unlawful delivery of a dangerous drug on a school bus or in a drug-free zone.,None,Bob Deuell,author,79R
SB 513,Relating to the prosecution of the offense of credit card or debit card abuse.,None,Bob Deuell,author,79R
SB 514,Relating to the conversion of the Verandah Fresh Water Supply District of Hunt County to a municipal utility district; providing authority to impose a tax and issue bonds; granting the power of eminent domain.,None,Bob Deuell,author,79R
SB 515,Relating to the creation of the Sunrise Municipal Utility District of Hunt County; providing authority to impose a tax and issue bonds; granting the power of eminent domain.,None,Bob Deuell,author,79R
SB 516,Relating to the creation of the Union Valley Ranch Municipal Utility District of Hunt County; providing authority to impose a tax and issue bonds; granting the power of eminent domain.,None,Bob Deuell,author,79R
SB 523,Relating to the regional emergency medical dispatch resource center pilot program.,None,Bob Deuell,author,79R
SB 537,Relating to the registration of antique boats with the Parks and Wildlife Department.,None,Bob Deuell,author,79R
SB 538,Relating to evidence establishing ownership of a vessel for a certificate of title issued by the Parks and Wildlife Department.,None,Bob Deuell,author,79R
SB 565,Relating to the posting of a list of employees in certain child-care facilities and family homes.,None,Bob Deuell,author,79R
SB 566,Relating to a Medicaid buy-in program for employed persons with disabilities.,None,Bob Deuell,author,79R
SB 567,Relating to requiring a taxing unit to include in the public notice of a hearing on the adoption of an ad valorem tax rate certain information relating to the taxing unit's budget and appraisal roll.,None,Bob Deuell,author,79R
SB 568,Relating to private security and personal emergency response system providers; providing penalties.,None,Bob Deuell,author,79R
SB 701,Relating to the issuance of revenue bonds for Texas A&M University--Commerce.,None,Bob Deuell,author,79R
SB 702,Relating to authorizing certain uses for student center complex fees charged to students enrolled in component institutions of The Texas A&M University System.,None,Bob Deuell,author,79R
SB 719,Relating to the operation of mail order prescription plans for certain public employees and retirees.,None,Bob Deuell,author,79R
SB 720,Relating to required patient counseling regarding mail order prescription plans for certain public employees and retirees.,None,Bob Deuell,author,79R
SB 725,"Relating to the additional exit conference required following inspection, survey, or investigation of certain facilities.",None,Bob Deuell,author,79R
SB 726,Relating to the authority of a dental hygienist to administer fluoride varnish.,None,Bob Deuell,author,79R
SB 811,Relating to services referred to podiatrists under the Medicaid program.,None,Bob Deuell,author,79R
SB 812,Relating to the powers of a community center.,None,Bob Deuell,author,79R
SB 816,Relating to the offense of harassment by persons in certain correctional facilities and to creating the offense of harassment of public servant.,None,Bob Deuell,author,79R
SB 864,"Relating to the liability of certain local governments for fire, emergency, or law enforcement services provided to another local government.",None,Bob Deuell,author,79R
SB 1015,Relating to minimum standards for day-care centers serving children with special care needs.,None,Bob Deuell,author,79R
SB 1016,"Relating to the right of health care facilities, health insurers, and health care providers to object to providing or participating in the provision of certain procedures.",None,Bob Deuell,author,79R
SB 1024,Relating to prohibiting changes in certain prescription drug orders without the approval of the prescribing health care practitioner.,None,Bob Deuell,author,79R
SB 1099,Relating to professional health care liability insurance coverage information provided by a nursing home.,None,Bob Deuell,author,79R
SB 1100,Relating to the promotion of tourism related to the musical heritage of this state.,None,Bob Deuell,author,79R
SB 1101,Relating to the marketing and sale of certain license plates by a private vendor.,None,Bob Deuell,author,79R
SB 1209,Relating to the licensing and regulation of the practice of dietetics and nutrition.,None,Bob Deuell,author,79R
SB 1210,"Relating to the uniform fair hearing rules for Medicaid-funded services, including services requiring prior authorization.",None,Bob Deuell,author,79R
SB 1211,Relating to providing information about respiratory syncytial virus under certain continuing education programs.,None,Bob Deuell,author,79R
SB 1267,Relating to the circumstances under which knowledge regarding the receipt of stolen property by a pawnshop may be presumed for the purposes of establishing theft; providing penalties.,None,Bob Deuell,author,79R
SB 1268,Relating to the transfer of vehicle registration and license plates between vehicles with the same owner.,None,Bob Deuell,author,79R
SB 1269,Relating to establishment of a defined contribution health care benefits program for certain active state employees that is operated through the establishment of health reimbursement arrangements.,None,Bob Deuell,author,79R
SB 1292,Relating to the requirement that a person operating a pornographic Internet site obtain proof of customer age eligibility; providing a criminal penalty.,None,Bob Deuell,author,79R
SB 1293,Relating to prohibiting wireless Internet access to obscene materials on public property.,None,Bob Deuell,author,79R
SB 1294,Relating to the punishment for the offense of obscenity.,None,Bob Deuell,author,79R
SB 1295,Relating to the distribution of proceeds from the sale of certain forfeited property in a criminal case.,None,Bob Deuell,author,79R
SB 1296,"Relating to development regulations for certain unincorporated areas associated with the watersheds of Cedar Creek Lake, the Trinity River, and the East Fork of the Trinity River; providing a penalty.",None,Bob Deuell,author,79R
SB 1515,Relating to the implementation of the Texas Integrated Eligibility and Redesign System.,None,Bob Deuell,author,79R
SB 1516,Relating to the adequacy of health maintenance organization health care delivery networks and availability of preferred provider benefits; providing penalties.,None,Bob Deuell,author,79R
SB 1517,Relating to qualifications of physicians who perform certain utilization review duties for a health benefit plan.,None,Bob Deuell,author,79R
SB 1518,Relating to validation of the creation of and certain acts taken by the Rockwall County Public Safety and Fire Assistance District.,None,Bob Deuell,author,79R
SB 1519,Relating to the development of a regional water supply reservoir project at a site known as Lower Bois d'Arc Creek in Fannin County.,None,Bob Deuell,author,79R
SB 1520,Relating to prescription drug insurance benefits provided through or by the Employees Retirement System of Texas or the Teacher Retirement System of Texas.,None,Bob Deuell,author,79R
SB 1521,Relating to the authority of a pharmacist to dispense a Schedule II controlled substance pursuant to a facsimile copy of an official prescription.,None,Bob Deuell,author,79R
SB 1771,Relating to the voluntary regulation of persons providing certain ophthalmic goods and services.,None,Bob Deuell,author,79R
SB 1772,Relating to the validation and confirmation of the boundaries and acts of Dallas County Water Control and Improvement District No. 6.,None,Bob Deuell,author,79R
SB 1773,Relating to immunization requirements for children in regulated child-care facilities.,None,Bob Deuell,author,79R
SB 1774,"Relating to access to certain obstetrical or gynecological care provided by qualified physicians, including family physicians.",None,Bob Deuell,author,79R
SB 1845,Relating to audit practices of pharmacy benefit plans.,None,Bob Deuell,author,79R
SB 1855,"Relating to the creation of the Rockwall County Municipal Utility Districts Nos. 6, 7, 8, and 9; providing authority to impose a tax and issue bonds; granting the power of eminent domain.",None,Bob Deuell,author,79R
SB 1856,Relating to tax increment financing.,None,Bob Deuell,author,79R
SB 1868,Relating to the creation of an additional county court at law in Kaufman County.,None,Bob Deuell,author,79R
SB 1878,"Relating to validating actions of and amending assessments imposed by the Falcon's Lair Utility and Reclamation District, of Dallas County, Texas.",None,Bob Deuell,author,79R
SB 1881,"Relating to the validation, annexation, powers, and duties of the Parker Creek Municipal Utility District of Rockwall County; providing authority to impose a tax and issue bonds; granting the power of eminent domain.",None,Bob Deuell,author,79R
SB 1894,"Relating to the creation, powers, management, and boundaries of certain utility districts and a water control and improvement district in Kaufman County; providing authority to impose a tax and issue bonds; granting the power of eminent domain.",None,Bob Deuell,author,79R
SB 1898,Relating to the creation of the Dallas County Municipal Utility District No. 3; providing authority to impose a tax and issue bonds; granting the power of eminent domain.,None,Bob Deuell,author,79R
SCR 39,Designating July 2005 as Lawn Mower Safety Awareness Month.,None,Bob Deuell,author,79R
SCR 42,Instructing the enrolling clerk of the Senate to make technical corrections to S.B. No. 568.,None,Bob Deuell,author,79R
SJR 13,"Proposing a constitutional amendment authorizing a county, city, town, school district, or other political subdivision to provide an additional exemption from ad valorem taxation of the residence homesteads of certain surviving spouses of peace officers and firefighters.",None,Bob Deuell,author,79R
SJR 44,"Proposing a constitutional amendment providing authorization for a county to issue bonds or notes to finance the development or redevelopment of an unproductive, underdeveloped, or blighted area within the county.",None,Bob Deuell,author,79R
SR 67,"Recognizing February 1 and 2, 2005, as Commerce Days at the State Capitol.",None,Bob Deuell,author,79R
SR 96,Recognizing the 24th Annual Terrell Heritage Jubilee Cook-off as a Texas State BBQ Championship competition.,None,Bob Deuell,author,79R
SR 197,"Recognizing February 23, 2005, as Fannin County Day at the State Capitol.",None,Bob Deuell,author,79R
SR 244,"In memory of James M. ""Jim"" Allison of Woodville.",None,Bob Deuell,author,79R
SR 256,"Recognizing February 28, 2005, as Rockwall County Day at the State Capitol.",None,Bob Deuell,author,79R
SR 283,"Recognizing March 2, 2005, as Rains County Day at the State Capitol.",None,Bob Deuell,author,79R
SR 292,"Recognizing March 3, 2005, as Bob Wills Day at the Capitol.",None,Bob Deuell,author,79R
SR 293,Commending Butch Miles for his accomplishments as a drummer.,None,Bob Deuell,author,79R
SR 303,Recognizing Mildred H. Burnett of Bonham on the occasion of her 94th birthday.,None,Bob Deuell,author,79R
SR 321,"Recognizing March 7, 2005, as Kaufman County Day at the State Capitol.",None,Bob Deuell,author,79R
SR 322,Commending the Seagoville Chamber of Commerce for its service to its community.,None,Bob Deuell,author,79R
SR 344,"Recognizing March 9, 2005, as Van Zandt County Day at the State Capitol.",None,Bob Deuell,author,79R
SR 358,Commending Matt Wilson for his achievements in music.,None,Bob Deuell,author,79R
SR 440,Commending Mercy Ships for bringing hospital ships to developing nations.,None,Bob Deuell,author,79R
SR 441,"Recognizing March 22, 2005, as Sunnyvale Day at the Capitol.",None,Bob Deuell,author,79R
SR 475,"Recognizing March 30, 2005, as Hunt County Day at the State Capitol.",None,Bob Deuell,author,79R
SR 516,Recognizing the members of Leadership Rowlett 2005.,None,Bob Deuell,author,79R
SR 568,Recognizing Wood Farm for its selection as a 150-year honoree by the Family Land Heritage Program.,None,Bob Deuell,author,79R
SR 623,"Recognizing October 23, 2005, as Texas Paralegal Day.",None,Bob Deuell,author,79R
SR 643,"Welcoming Leadership Sachse to the State Capitol on April 19 and 20, 2005.",None,Bob Deuell,author,79R
SR 848,In memory of Jimmie Doyle Birdwell of Ferris.,None,Bob Deuell,author,79R
SR 902,"Recognizing Blake Ingram, Jr., of Mesquite for being selected as a student ambassador in the People to People Student Ambassador Program.",None,Bob Deuell,author,79R
SR 903,Commending Bobby Jenkins of the Rowlett Police Department for his heroism.,None,Bob Deuell,author,79R
SR 904,In memory of William Freeman Simmons of Irving.,None,Bob Deuell,author,79R
SB 12,"Relating to state contract management, including the training of personnel, the negotiation of contracts, and the standardization of practices.",None,Bob Deuell,author,79R
SB 275,Relating to authorizing The University of Texas at Tyler to offer doctoral degree programs in nursing and human resource development.,None,Bob Deuell,author,79R
SB 276,Relating to authorizing The University of Texas Health Science Center at Tyler to offer courses and degree programs in allied health and related fields.,None,Bob Deuell,author,79R
SB 309,"Relating to the creation of an address confidentiality program to assist victims of family violence, sexual assault, or stalking in maintaining confidential addresses.",None,Bob Deuell,author,79R
SB 571,Relating to the hours of sale and consumption of wine at a winery.,None,Bob Deuell,author,79R
SB 722,Relating to the creation of the TexasNextStep grant program to pay tuition and required fees and textbook costs of certain students enrolled in two-year public institutions of higher education in this state.,None,Bob Deuell,author,79R
SB 730,Relating to the establishment of a law school in the City of Dallas by the University of North Texas System.,None,Bob Deuell,author,79R
SB 802,Relating to the designation of a portion of State Highway 130 in Williamson and Travis Counties as the Willie Nelson Turnpike.,None,Bob Deuell,author,79R
SB 831,Relating to the creation of programs and funding for emerging technology industries.,None,Bob Deuell,author,79R
SB 968,Relating to allowing the Texas Department of Transportation to make grants to a county or municipality for recreational trails.,None,Bob Deuell,author,79R
SB 1137,Relating to the development of the wine industry and other businesses related to agriculture or tourism in this state.,None,Bob Deuell,author,79R
SB 1756,Relating to the managed care delivery system known as integrated care management.,None,Bob Deuell,author,79R
SB 1874,Relating to the Automobile Theft Prevention Authority.,None,Bob Deuell,author,79R
SCR 23,Memorializing congress to permanently repeal the federal death tax in 2005.,None,Bob Deuell,author,79R
SCR 24,Memorializing Congress to support federal efforts to simplify the Free Application for Federal Student Aid and to support legislation requiring a new formula for distributing federal campus-based funds among institutions.,None,Bob Deuell,author,79R
SR 79,"Welcoming the members of the Texas High School Rodeo Association and recognizing February 7, 2005, as THSRA Day at the State Capitol.",None,Bob Deuell,author,79R
SR 98,Commending The University of Texas M. D. Anderson Cancer Center and its rehabilitation ski program.,None,Bob Deuell,author,79R
SR 125,Commending Rodger A. Pool of Garland for his contributions to Eastfield College and the Dallas County Community College District.,None,Bob Deuell,author,79R
SR 203,"Recognizing February 23, 2005, as Children's Advocacy Centers of Texas Day at the Capitol.",None,Bob Deuell,author,79R
SR 214,"Recognizing February 22, 2005, as Cedar Creek Lake Area Day at the State Captiol.",None,Bob Deuell,author,79R
SR 472,"Welcoming members of the 1st Battalion, 23rd Marine Regiment, 4th Marine Division home from their deployment in Iraq.",None,Bob Deuell,author,79R
SR 563,In memory of His Holiness Pope John Paul II.,None,Bob Deuell,author,79R
SR 660,Recognizing James Terry on the occasion of his retirement as Superintendent of the Mesquite Independent School District.,None,Bob Deuell,author,79R
SR 713,"Recognizing April 30 through May 7, 2005, as the 30th anniversary of the end of the Vietnam era.",None,Bob Deuell,author,79R
SR 891,Congratulating William T. Solomon of Dallas for receiving the Linz Award.,None,Bob Deuell,author,79R
SB 42,"Relating to health education, physical activity, and food products in public primary and secondary schools.",None,Bob Deuell,coauthor,79R
SB 107,Relating to the civil and criminal consequences of engaging in certain conduct related to the manufacture of methamphetamine and to the distribution and retail sales of pseudoephedrine; providing penalties.,None,Bob Deuell,coauthor,79R
SB 170,Relating to the designation of the portion of Interstate Highway 20 inside Dallas and Tarrant Counties as the Ronald Reagan Memorial Highway.,None,Bob Deuell,coauthor,79R
