bill_name,caption,filer_id,filer_name,function,session,leg_id,original_name,parsed_name
HB 357,Relating to the records of the conviction or adjudication of a minor.,12135,John Shields,coauthor,73R,4435,Rep. John Shields,John Shields
HB 373,Relating to products liability.,12135,John Shields,coauthor,73R,4435,Rep. John Shields,John Shields
HB 443,Relating to the creation of the offense of drive-by shooting and the seizure of contraband used in that offense.,12135,John Shields,coauthor,73R,4435,Rep. John Shields,John Shields
HB 487,Relating to the abolition of the Adolescent Pregnancy and Parenthood Advisory Council.,12135,John Shields,coauthor,73R,4435,Rep. John Shields,John Shields
HB 584,Relating to a reporting requirement applicable to certain financial institutions.,12135,John Shields,coauthor,73R,4435,Rep. John Shields,John Shields
HB 735,Relating to information provided to a jury in the punishment stage of a criminal trial for a felony offense.,12135,John Shields,coauthor,73R,4435,Rep. John Shields,John Shields
HB 920,Relating to the right of parents to choose the school their child attends through the use of education scholarships.,12135,John Shields,coauthor,73R,4435,Rep. John Shields,John Shields
HB 938,Relating to course materials and instruction in human sexuality.,12135,John Shields,coauthor,73R,4435,Rep. John Shields,John Shields
HB 1776,Relating to a referendum on rules for the issuance of a license to carry a handgun.,12135,John Shields,coauthor,73R,4435,Rep. John Shields,John Shields
HB 2153,Relating to the use of funds in the smart jobs fund.,12135,John Shields,coauthor,73R,4435,Rep. John Shields,John Shields
HB 2518,Relating to parental access to certain assessment instruments administered by a school district.,12135,John Shields,coauthor,73R,4435,Rep. John Shields,John Shields
HCR 52,Requesting the United States Congress to revise the federal Endangered Species Act.,12135,John Shields,coauthor,73R,4435,Rep. John Shields,John Shields
HJR 29,Proposing a constitutional amendment to reserve to the people the powers of initiative and referendum.,12135,John Shields,coauthor,73R,4435,Rep. John Shields,John Shields
HJR 36,Proposing a constitutional amendment to limit the tax rate on the income component of the franchise tax.,12135,John Shields,coauthor,73R,4435,Rep. John Shields,John Shields
HR 520,Congratulating The University of Texas Health Science Center at San Antonio dental school on being named the best dental school in the nation by U.S. News and World Report.,12135,John Shields,coauthor,73R,4435,Rep. John Shields,John Shields
HR 521,Congratulating The University of Texas College of Pharmacy on being named the number two graduate pharmacy school in the nation by U.S. News & World Report.,12135,John Shields,coauthor,73R,4435,Rep. John Shields,John Shields
HR 538,Honoring the members of the Texas Federation of Republican Women.,12135,John Shields,coauthor,73R,4435,Rep. John Shields,John Shields
HR 545,Paying tribute to the life of Officer Gary C. Hires of the Haltom City Police Department.,12135,John Shields,coauthor,73R,4435,Rep. John Shields,John Shields
