bill_name,caption,filer_id,filer_name,function,session,leg_id,original_name,parsed_name
HB 3423,Relating to the creation of a consolidated municipal-county government in Bexar County.,12135,John Shields,author,75R,4435,Rep. John Shields,John Shields
HB 3518,Relating to workers' compensation insurance requirements for public contracts.,12135,John Shields,author,75R,4435,Rep. John Shields,John Shields
HJR 58,Proposing a constitutional amendment to provide an exemption from ad valorem taxation for a residence homestead that has been constructed or improved to remove architectural or physical barriers to a resident of the homestead who has a disability.,12135,John Shields,author,75R,4435,Rep. John Shields,John Shields
HJR 84,Proposing a constitutional amendment relating to the appraisal of real property for ad valorem taxation.,12135,John Shields,author,75R,4435,Rep. John Shields,John Shields
HJR 85,Proposing a constitutional amendment to create the Texas Redistricting Commission and to revise the constitutional redistricting provisions.,12135,John Shields,author,75R,4435,Rep. John Shields,John Shields
HJR 86,Proposing a constitutional amendment to limit the time that a member of the Bexar County Commissioners Court may serve in office.,12135,John Shields,author,75R,4435,Rep. John Shields,John Shields
HJR 105,"Proposing a constitutional amendment providing that the legislature may create a commission to recommend abolishing or reducing the size of state agencies and require future legislatures to accept or reject, but not amend, the commission's recommendations.",12135,John Shields,author,75R,4435,Rep. John Shields,John Shields
HJR 118,"Proposing a constitutional amendment to authorize the voters of Bexar County and certain political subdivisions located, in whole or in part, in Bexar County to create a consolidated city-county government by adopting a charter restructuring and consolidating political subdivisions.",12135,John Shields,author,75R,4435,Rep. John Shields,John Shields
HR 149,Honoring Joshua Clark Davis for his achievements during the 1996 Summer Olympic Games.,12135,John Shields,author,75R,4435,Rep. John Shields,John Shields
HR 308,Congratulating Walter Stoneham on the occasion of his retirement as chief appraiser of Bexar County.,12135,John Shields,author,75R,4435,Rep. John Shields,John Shields
HR 309,"Honoring Edward L. Wellberg, Jr.",12135,John Shields,author,75R,4435,Rep. John Shields,John Shields
HR 632,"In memory of Jiovanni Batista ""John"" Zito.",12135,John Shields,author,75R,4435,Rep. John Shields,John Shields
HR 1049,"In memory of John Earl ""Jack"" Fulbright.",12135,John Shields,author,75R,4435,Rep. John Shields,John Shields
HR 1140,Honoring pilot Linda Finch on her flight around the world.,12135,John Shields,author,75R,4435,Rep. John Shields,John Shields
HB 7,Relating to lawsuits arising outside or brought by persons who reside outside of Texas.,12135,John Shields,coauthor,75R,4435,Rep. John Shields,John Shields
HB 11,Relating to the recognition of a same-sex marriage.,12135,John Shields,coauthor,75R,4435,Rep. John Shields,John Shields
HB 92,Relating to the financing of sports and community venues and related infrastructure; authorizing the imposition of certain local taxes and the issuance of local bonds; providing penalties.,12135,John Shields,coauthor,75R,4435,Rep. John Shields,John Shields
HB 95,Relating to summary judgments in civil actions.,12135,John Shields,coauthor,75R,4435,Rep. John Shields,John Shields
HB 98,Relating to the telecommunications infrastructure fund.,12135,John Shields,coauthor,75R,4435,Rep. John Shields,John Shields
HB 180,Relating to access to certain obstetric or gynecological health care under a health benefit plan.,12135,John Shields,coauthor,75R,4435,Rep. John Shields,John Shields
HB 276,Relating to parental notification before an abortion may be performed on a minor; providing a criminal penalty.,12135,John Shields,coauthor,75R,4435,Rep. John Shields,John Shields
HB 751,"Relating to the disannexation of certain areas annexed on or after December 1, 1996, by certain municipalities.",12135,John Shields,coauthor,75R,4435,Rep. John Shields,John Shields
HB 952,Relating to the dedication of revenue derived from the state lottery to the foundation school fund.,12135,John Shields,coauthor,75R,4435,Rep. John Shields,John Shields
HB 1202,Relating to the liability of certain persons for injury to others that occurs on certain real property.,12135,John Shields,coauthor,75R,4435,Rep. John Shields,John Shields
HB 1682,Relating to the creation of certain judicial districts.,12135,John Shields,coauthor,75R,4435,Rep. John Shields,John Shields
HB 2036,Relating to the transfer of child support enforcement duties from the Office of the Attorney General and the creation of the Texas Family Support Commission.,12135,John Shields,coauthor,75R,4435,Rep. John Shields,John Shields
HB 2245,"Relating to the parent-child relationship, suits affecting the parent-child relationship, and the protection of children.",12135,John Shields,coauthor,75R,4435,Rep. John Shields,John Shields
HB 2481,Relating to faith-based chemical dependency treatment programs and counselors.,12135,John Shields,coauthor,75R,4435,Rep. John Shields,John Shields
HB 2482,Relating to the establishment of an accreditation program for child-care facilities and child-placing agencies as an alternative to state licensure; providing a criminal penalty.,12135,John Shields,coauthor,75R,4435,Rep. John Shields,John Shields
HB 2501,Relating to compensation of a lobbyist with public funds of a political subdivision.,12135,John Shields,coauthor,75R,4435,Rep. John Shields,John Shields
HB 2577,Relating to the Texas Department of Housing and Community Affairs and to low income and affordable housing.,12135,John Shields,coauthor,75R,4435,Rep. John Shields,John Shields
HCR 148,Designating the Texas Sweet Onion as the official State Vegetable of Texas.,12135,John Shields,coauthor,75R,4435,Rep. John Shields,John Shields
HCR 149,Designating the City of Weslaco as the Citrus Capital of Texas.,12135,John Shields,coauthor,75R,4435,Rep. John Shields,John Shields
HCR 217,Memorializing Congress to restore the federal income tax deductibility of state sales taxes.,12135,John Shields,coauthor,75R,4435,Rep. John Shields,John Shields
HCR 238,Conferring the Texas Legislative Medal of Honor on Technical Sergeant James M. Logan.,12135,John Shields,coauthor,75R,4435,Rep. John Shields,John Shields
HJR 31,Proposing a constitutional amendment permitting an encumbrance against homestead property for certain extensions of equity credit.,12135,John Shields,coauthor,75R,4435,Rep. John Shields,John Shields
HR 288,Recognizing the Honorable Frank Tejeda for his years of community service.,12135,John Shields,coauthor,75R,4435,Rep. John Shields,John Shields
HR 895,In memory of San Antonio Firefighter Jesse F. Bricker.,12135,John Shields,coauthor,75R,4435,Rep. John Shields,John Shields
SB 95,Relating to the immediate qualification for an ad valorem tax exemption for a church or other nonprofit organization.,12135,John Shields,sponsor,75R,4435,Rep. John Shields,John Shields
SB 756,Relating to certain juror donations used to compensate victims of crime.,12135,John Shields,sponsor,75R,4435,Rep. John Shields,John Shields
SB 1179,Relating to testimony given before a county commissioners court; providing a penalty.,12135,John Shields,sponsor,75R,4435,Rep. John Shields,John Shields
SB 263,Relating to the creation of an appellate judicial system for the Fourth Court of Appeals District.,12135,John Shields,sponsor,75R,4435,Rep. John Shields,John Shields
SB 970,Relating to certain district courts in Bexar County.,12135,John Shields,cosponsor,75R,4435,Rep. John Shields,John Shields
HB 129,Relating to medical savings accounts; providing a penalty.,12135,John Shields,author,74R,4435,Rep. John Shields,John Shields
HB 130,Relating to restitution to be made by juveniles convicted of criminal activity.,12135,John Shields,author,74R,4435,Rep. John Shields,John Shields
HB 131,Relating to the punishment for certain assaults committed on employees of certain primary or secondary schools.,12135,John Shields,author,74R,4435,Rep. John Shields,John Shields
HB 132,"Relating to the regulation by home-rule municipalities of streets, avenues, alleys, and boulevards.",12135,John Shields,author,74R,4435,Rep. John Shields,John Shields
HB 133,Relating to a requirement that a student enrolled in a general academic teaching institution serve as an assistant to a public school teacher.,12135,John Shields,author,74R,4435,Rep. John Shields,John Shields
HB 146,Relating to the confidentiality of the records and proceedings of a medical committee.,12135,John Shields,author,74R,4435,Rep. John Shields,John Shields
HB 147,"Relating to abolishing the school district property tax and dedicating all lottery revenue, some sales taxes and certain other statewide taxes to education.",12135,John Shields,author,74R,4435,Rep. John Shields,John Shields
HB 148,Relating to consumer protection for unfair competition and unfair practices for the business of insurance.,12135,John Shields,author,74R,4435,Rep. John Shields,John Shields
HB 907,Relating to prekindergarten classes in public schools.,12135,John Shields,author,74R,4435,Rep. John Shields,John Shields
HB 908,Relating to computing and reporting the number of state employees.,12135,John Shields,author,74R,4435,Rep. John Shields,John Shields
HB 1213,Relating to truancy.,12135,John Shields,author,74R,4435,Rep. John Shields,John Shields
HB 1808,Relating to a franchise tax credit for payments made to certain medical savings accounts.,12135,John Shields,author,74R,4435,Rep. John Shields,John Shields
HB 1934,Relating to the appeal from a justice or municipal court in a criminal case.,12135,John Shields,author,74R,4435,Rep. John Shields,John Shields
HB 2256,Relating to viatical settlements.,12135,John Shields,author,74R,4435,Rep. John Shields,John Shields
HB 2257,Relating to certain inquiries made by the Texas Department of Insurance and information from those inquiries.,12135,John Shields,author,74R,4435,Rep. John Shields,John Shields
HB 2258,Relating to the authority of a municipality to impose a fee for municipal drainage.,12135,John Shields,author,74R,4435,Rep. John Shields,John Shields
HB 2259,Relating to discipline in public school classrooms.,12135,John Shields,author,74R,4435,Rep. John Shields,John Shields
HB 2790,Relating to the exemption of insurance benefits and certain annuity proceeds from seizure under process.,12135,John Shields,author,74R,4435,Rep. John Shields,John Shields
HB 2791,Relating to the retirement system for police officers and fire fighters in certain municipalities.,12135,John Shields,author,74R,4435,Rep. John Shields,John Shields
HB 2792,Relating to the annexation of an area in certain home-rule municipalities by certain general-law municipalities.,12135,John Shields,author,74R,4435,Rep. John Shields,John Shields
HB 2793,Relating to the regulation of insurance holding companies.,12135,John Shields,author,74R,4435,Rep. John Shields,John Shields
HB 2794,Relating to penalties for violation of certain insurance laws relating to licensing and regulation of life insurance counselors.,12135,John Shields,author,74R,4435,Rep. John Shields,John Shields
HB 3136,Relating to the standard Nonforfeiture benefits for life insurance.,12135,John Shields,author,74R,4435,Rep. John Shields,John Shields
HJR 28,"Applying to the Congress of the United States to call a convention for the specific and exclusive purpose of proposing an amendment to the Constitution of the United States to prohibit the United States Supreme Court, and all other federal courts, from ordering or instructing a state, or a political subdivision thereof, or an official of such state or political subdivision, to levy or increase taxes for any reason.",12135,John Shields,author,74R,4435,Rep. John Shields,John Shields
HJR 83,Proposing a constitutional amendment to limit the number of years that a person may serve in an elective executive department office of state government.,12135,John Shields,author,74R,4435,Rep. John Shields,John Shields
HJR 84,Proposing a constitutional amendment limiting the time that a person may serve in certain judicial offices and changing the titles of certain judicial officers.,12135,John Shields,author,74R,4435,Rep. John Shields,John Shields
HJR 85,Proposing a constitutional amendment to limit the time that a person may serve in legislative office.,12135,John Shields,author,74R,4435,Rep. John Shields,John Shields
HJR 86,Proposing a constitutional amendment to limit the time that a person may serve in an elective county or precinct office.,12135,John Shields,author,74R,4435,Rep. John Shields,John Shields
HJR 87,Applying to the Congress of the United States to call a convention for the specific and exclusive purpose of proposing an amendment to the Constitution of the United States to specify twelve-year terms of service for justices of the United States Supreme Court and for judges of federal courts inferior thereto.,12135,John Shields,author,74R,4435,Rep. John Shields,John Shields
HR 264,Honoring Karen Tedder.,12135,John Shields,author,74R,4435,Rep. John Shields,John Shields
HR 265,In memory of Constable Bill C. Hancock.,12135,John Shields,author,74R,4435,Rep. John Shields,John Shields
HR 266,Honoring Jennifer Stork.,12135,John Shields,author,74R,4435,Rep. John Shields,John Shields
HR 267,Honoring John Nelson on being named a finalist in the Environmental Stamp Design Contest.,12135,John Shields,author,74R,4435,Rep. John Shields,John Shields
HR 268,In memory of Roy Maas.,12135,John Shields,author,74R,4435,Rep. John Shields,John Shields
HR 269,Congratulating Holman and Genevieve Murray Cox on the occasion of their 65th wedding anniversary.,12135,John Shields,author,74R,4435,Rep. John Shields,John Shields
HR 689,Honoring Dr. Arline Patterson.,12135,John Shields,author,74R,4435,Rep. John Shields,John Shields
HR 690,Commending Jack Ridgeway for his contributions to his community.,12135,John Shields,author,74R,4435,Rep. John Shields,John Shields
HR 691,Honoring George H. Ensley on his exemplary tenure as president of the Rotary Club of San Antonio.,12135,John Shields,author,74R,4435,Rep. John Shields,John Shields
HR 736,Honoring Dr. J. Raleigh Jackson.,12135,John Shields,author,74R,4435,Rep. John Shields,John Shields
HR 1005,Honoring Shirley Trevor on the occasion of her retirement.,12135,John Shields,author,74R,4435,Rep. John Shields,John Shields
HR 1055,Honoring Pastor Allen Randolph.,12135,John Shields,author,74R,4435,Rep. John Shields,John Shields
HR 1056,In memory of Barbara Schoolcraft.,12135,John Shields,author,74R,4435,Rep. John Shields,John Shields
HB 40,Relating to the requirement of DNA analysis of certain inmates and to the creation of a DNA database; providing penalties.,12135,John Shields,coauthor,74R,4435,Rep. John Shields,John Shields
HB 69,Relating to a period of quiet reflection in public schools.,12135,John Shields,coauthor,74R,4435,Rep. John Shields,John Shields
HB 72,Relating to the issuance of a license to carry a concealed handgun; requiring of an applicant for the license a handgun proficiency and safety training course and a criminal background check; providing penalties.,12135,John Shields,coauthor,74R,4435,Rep. John Shields,John Shields
HB 301,Relating to the right of parents to choose the school their child attends through the use of education scholarships.,12135,John Shields,coauthor,74R,4435,Rep. John Shields,John Shields
HB 405,Relating to the exemption of certain peace officers from provisions of the Private Investigators and Private Security Agencies Act.,12135,John Shields,coauthor,74R,4435,Rep. John Shields,John Shields
HB 496,Relating to the issuance of special license plates for certain vehicles owned by certain foreign organizations.,12135,John Shields,coauthor,74R,4435,Rep. John Shields,John Shields
HB 508,Relating to delay of the vehicle emissions inspection and maintenance program.,12135,John Shields,coauthor,74R,4435,Rep. John Shields,John Shields
HB 913,Relating to termination of AFDC payments for certain children.,12135,John Shields,coauthor,74R,4435,Rep. John Shields,John Shields
HB 1334,Relating to the protection of the rights and health of women using or considering the use of abortion services; providing penalties.,12135,John Shields,coauthor,74R,4435,Rep. John Shields,John Shields
HB 1583,Relating to taxation of certain lawn services.,12135,John Shields,coauthor,74R,4435,Rep. John Shields,John Shields
HB 1831,Relating to the election of members of the board of directors of the San Antonio Water System.,12135,John Shields,coauthor,74R,4435,Rep. John Shields,John Shields
HB 2062,"Relating to the conversion to an elected board, and to the removal of board members by recall, of certain mass transit authorities.",12135,John Shields,coauthor,74R,4435,Rep. John Shields,John Shields
HB 3189,Relating to the board of directors of the Edwards Aquifer Authority and the management of the Edwards Aquifer.,12135,John Shields,coauthor,74R,4435,Rep. John Shields,John Shields
HCR 65,Urging the  Congress of the United States to amend the federal Endangered Species Act.,12135,John Shields,coauthor,74R,4435,Rep. John Shields,John Shields
HCR 158,Directing the State Preservation Board to restore the Capitol chapel.,12135,John Shields,coauthor,74R,4435,Rep. John Shields,John Shields
HCR 200,In memory of former State Representative Lou Nelle Sutton.,12135,John Shields,coauthor,74R,4435,Rep. John Shields,John Shields
HCR 230,Commending the members of the Texas Task Force for Tiltrotor Technology.,12135,John Shields,coauthor,74R,4435,Rep. John Shields,John Shields
HJR 11,Proposing a constitutional amendment relating to garnishment of wages for court-ordered restitution in a criminal judgment.,12135,John Shields,coauthor,74R,4435,Rep. John Shields,John Shields
HJR 12,Proposing a constitutional amendment to reserve to the people the powers of initiative and referendum.,12135,John Shields,coauthor,74R,4435,Rep. John Shields,John Shields
HJR 56,Proposing a constitutional amendment to limit the time that a person may serve in legislative office or in a statewide elective executive office.,12135,John Shields,coauthor,74R,4435,Rep. John Shields,John Shields
HR 342,Expressing support for Texas military bases and military communities and urging elected and appointed state officials to help protect and retain Texas defense installations.,12135,John Shields,coauthor,74R,4435,Rep. John Shields,John Shields
HR 351,Commending the Texas Federation of Republican Women.,12135,John Shields,coauthor,74R,4435,Rep. John Shields,John Shields
HR 1182,Honoring Cliff Morton on his many years of service to the community of San Antonio.,12135,John Shields,coauthor,74R,4435,Rep. John Shields,John Shields
HR 1183,"Designating June 4-10, 1995, as Kelly Air Force Base Week.",12135,John Shields,coauthor,74R,4435,Rep. John Shields,John Shields
SB 400,Relating to the application of the doctrine of forum non conveniens to certain actions.,12135,John Shields,sponsor,74R,4435,Rep. John Shields,John Shields
SB 918,Relating to the appeal from a justice or municipal court in a criminal case.,12135,John Shields,sponsor,74R,4435,Rep. John Shields,John Shields
SB 1009,Relating to the sanctions for acting as a life insurance counselor without a license or violating certain laws applicable to life insurance counselors; providing a criminal penalty.,12135,John Shields,sponsor,74R,4435,Rep. John Shields,John Shields
SB 1148,Relating to the retirement system for police officers and fire fighters in certain municipalities.,12135,John Shields,sponsor,74R,4435,Rep. John Shields,John Shields
HB 586,Relating to truancy proceedings in certain justice courts.,12135,John Shields,author,73R,4435,Rep. John Shields,John Shields
HB 1540,Relating to regulation of multiple employer welfare arrangements; creating offenses and providing civi and criminal penalties; providing for fees.,12135,John Shields,author,73R,4435,Rep. John Shields,John Shields
HB 1653,Relating to the exemption of certain students from the Texas academic skills program.,12135,John Shields,author,73R,4435,Rep. John Shields,John Shields
HB 1927,Relating to the confidentiality of the records and proceedings of a medical committee.,12135,John Shields,author,73R,4435,Rep. John Shields,John Shields
HB 2246,Relating to the criminal responsibility of a person who is 13 years of age or older and who intentionally inflicts serious bodily injury on another by the use of a deadly weapon.,12135,John Shields,author,73R,4435,Rep. John Shields,John Shields
HB 2247,Relating to the use of certain safety equipment by a bicycle operator or passenger; providing a penalty.,12135,John Shields,author,73R,4435,Rep. John Shields,John Shields
HB 2602,Relating to consumer protection for unfair competition and unfair practices for the business of insurance.,12135,John Shields,author,73R,4435,Rep. John Shields,John Shields
HB 2664,"Relating to abolishing the school district property tax and dedicating all lottery revenue, some sales taxes and certain other statewide taxes to education.",12135,John Shields,author,73R,4435,Rep. John Shields,John Shields
HB 2665,Relating to the regulation of the insurance industry.,12135,John Shields,author,73R,4435,Rep. John Shields,John Shields
HB 2762,Relating to the election of district judges in certain counties by cumulative voting.,12135,John Shields,author,73R,4435,Rep. John Shields,John Shields
HB 2763,Relating to indemnifying physicians who provide free medical care to indigent patients.,12135,John Shields,author,73R,4435,Rep. John Shields,John Shields
HB 2764,Relating to the use of school children during normal school operating hours from campaigning for any person or proposition on election ballots.,12135,John Shields,author,73R,4435,Rep. John Shields,John Shields
HB 2765,Relating to the disposition of game killed illegally within city limits.,12135,John Shields,author,73R,4435,Rep. John Shields,John Shields
HCM 19,Congratulating Mrs. Gayle Randolph on the occasion of her 50th birthday.,12135,John Shields,author,73R,4435,Rep. John Shields,John Shields
HCM 21,"Congratulating Donn Edward Edgington, Jr., for being awarded rank of Eagle Scout.",12135,John Shields,author,73R,4435,Rep. John Shields,John Shields
HCM 98,Congratulating Joey Legere on his appointment to the Merchant Marine Academy.,12135,John Shields,author,73R,4435,Rep. John Shields,John Shields
HCM 130,Congratulating the Madison High School Girls' Soccer Team on their state championship.,12135,John Shields,author,73R,4435,Rep. John Shields,John Shields
HCM 142,Recognizing Bexar County Republican Women's Club for their exceptional contributions.,12135,John Shields,author,73R,4435,Rep. John Shields,John Shields
HCM 920,"Congratulating Ms. Bea B. Devlin on retiring as principal of Madison High School in San Antonio, Tx.",12135,John Shields,author,73R,4435,Rep. John Shields,John Shields
HCM 921,"Congratulating Mr. Marion ""Don"" Wilkinson on retiring as principal of Northern Hills Elementary in San Antonio, Tx.",12135,John Shields,author,73R,4435,Rep. John Shields,John Shields
HCM 1020,Congratulating Susan Close on her graduation from Churchill High School.,12135,John Shields,author,73R,4435,Rep. John Shields,John Shields
HCR 85,Requesting the Congress of the United States to enact legislation authorizing states to require out-of-state mail order businesses to collect and remit sales and use taxes on sales to customers within the state.,12135,John Shields,author,73R,4435,Rep. John Shields,John Shields
HCR 188,Instructing the enrolling clerk of the house of representatives to make a correction to H.B. 1540.,12135,John Shields,author,73R,4435,Rep. John Shields,John Shields
HJR 87,"Proposing a constitutional amendment relating to redistricting and the creation of a redistricting commission to redistrict the state's congressional, legislative, and other statewide election districts.",12135,John Shields,author,73R,4435,Rep. John Shields,John Shields
HR 398,Commending George B. Pierce for his service in the House of Representatives.,12135,John Shields,author,73R,4435,Rep. John Shields,John Shields
HR 518,Recognizing the exceptional contributions of the Bexar County Republican Women's Club.,12135,John Shields,author,73R,4435,Rep. John Shields,John Shields
HR 519,Recognizing the exceptional contributions of the Alamo City Republican Women's Club.,12135,John Shields,author,73R,4435,Rep. John Shields,John Shields
HB 681,Relating to truancy; providing a penalty.,12135,John Shields,author,73R,4435,Rep. John Shields,John Shields
HB 1634,Relating to the period for which students are suspended from participation in extracurricular activities on account of grades.,12135,John Shields,author,73R,4435,Rep. John Shields,John Shields
HB 2572,Relating to the creation and funding of community education development projects.,12135,John Shields,author,73R,4435,Rep. John Shields,John Shields
HB 2875,Relating to financing public schools.,12135,John Shields,author,73R,4435,Rep. John Shields,John Shields
HB 51,Relating to the creation of a stalking offense.,12135,John Shields,coauthor,73R,4435,Rep. John Shields,John Shields
HB 63,Relating to the regulation of mammography devices and the practice of mammography.,12135,John Shields,coauthor,73R,4435,Rep. John Shields,John Shields
HB 100,Relating to the issuance of a license to carry a concealed handgun; providing penalties.,12135,John Shields,coauthor,73R,4435,Rep. John Shields,John Shields
HB 110,Relating to limiting the terms of trustees of independent school districts to four years.,12135,John Shields,coauthor,73R,4435,Rep. John Shields,John Shields
HB 272,Relating to accessibility of vehicle accident reports.,12135,John Shields,coauthor,73R,4435,Rep. John Shields,John Shields
