bill_name,caption,filer_id,filer_name,function,session
SB 10,Relating to the operation and financing of the medical assistance program and other programs to provide health care benefits and services to persons in this state; providing penalties.,None,Tommy Williams,coauthor,80R
SB 22,Relating to long-term care insurance and a partnership for long-term care program and to the eligibility for certain home and community-based services.,None,Tommy Williams,coauthor,80R
SB 47,Relating to certain requirements relating to the issuance of a marriage license or the recording of a declaration of informal marriage and to the maintenance of marriage and divorce indexes by the bureau of vital statistics.,None,Tommy Williams,coauthor,80R
SB 85,Relating to a moratorium and other limitations on increases in designated tuition charged by public institutions of higher education.,None,Tommy Williams,coauthor,80R
SB 96,Relating to designated tuition.,None,Tommy Williams,coauthor,80R
SB 103,Relating to the Texas Youth Commission and the prosecution of certain offenses and delinquent conduct in the Texas Youth Commission and certain other criminal justice agencies; providing penalties.,None,Tommy Williams,coauthor,80R
SB 112,Relating to the confiscation of firearms and ammunition during a state of disaster.,None,Tommy Williams,coauthor,80R
SB 156,Relating to a competitive grant program to fund nurse-family partnership programs in certain communities in this state.,None,Tommy Williams,coauthor,80R
SB 161,Relating to intercollegiate athletics fees at institutions within the Texas State University System.,None,Tommy Williams,coauthor,80R
SB 252,Relating to the allocation and use of the sporting goods sales tax revenue to fund state and local parks.,None,Tommy Williams,coauthor,80R
SB 438,Relating to prohibiting immunization against human papilloma virus as a condition for admission to public school.,None,Tommy Williams,coauthor,80R
SB 439,Relating to advance directives and health care and treatment decisions.,None,Tommy Williams,coauthor,80R
SB 620,Relating to the marking of oyster beds.,None,Tommy Williams,coauthor,80R
SB 785,Relating to information related to the performance of an abortion; creating an offense.,None,Tommy Williams,coauthor,80R
SB 1096,Relating to mandatory participation in certain TANF employment programs by certain persons.,None,Tommy Williams,coauthor,80R
SB 1951,"Relating to the creation, operation, and officers of certain courts and juvenile boards.",None,Tommy Williams,coauthor,80R
SJR 13,Proposing a constitutional amendment authorizing the legislature to provide for a reduction of the limitation on the total amount of ad valorem taxes that may be imposed for public school purposes on the residence homesteads of the elderly or disabled to reflect any reduction in the rate of those taxes for the 2006 and 2007 tax years.,None,Tommy Williams,coauthor,80R
SR 141,"Providing for the display of the motto ""In God We Trust"" in the senate chamber.",None,Tommy Williams,coauthor,80R
SR 173,Congratulating James Marcus Pappas for being selected 2007 Houston Area Engineer of the Year.,None,Tommy Williams,coauthor,80R
SR 588,Recognizing April 2007 as Child Abuse Prevention Month.,None,Tommy Williams,coauthor,80R
HB 27,Relating to the filing of campaign finance reports with the Texas Ethics Commission.,None,Tommy Williams,sponsor,80R
HB 566,Relating to compulsory school attendance for students who are at least 18 years of age.,None,Tommy Williams,sponsor,80R
HB 626,Relating to the procedures for registering to vote.,None,Tommy Williams,sponsor,80R
HB 735,Relating to the discontinuation of the Telecommunications Infrastructure Fund.,None,Tommy Williams,sponsor,80R
HB 823,Relating to the liability of certain licensed or registered professionals for damages arising from certain services provided during an emergency.,None,Tommy Williams,sponsor,80R
HB 860,"Relating to the management, investment, and expenditure of state funds and institutional funds and the adoption of the Uniform Prudent Management of Institutional Funds Act.",None,Tommy Williams,sponsor,80R
HB 864,Relating to a garagekeeper's duty to report the abandonment of a motor vehicle.,None,Tommy Williams,sponsor,80R
HB 1022,Relating to the exemption from ad valorem taxation of a motor vehicle owned by an individual and used in the course of the owner's occupation or profession and also for personal activities of the owner and to the rendition of such vehicles.,None,Tommy Williams,sponsor,80R
HB 1244,"Relating to contributions to, benefits from, and the administration of the Texas Municipal Retirement System.",None,Tommy Williams,sponsor,80R
HB 1446,Relating to the period for preserving precinct election records.,None,Tommy Williams,sponsor,80R
HB 1491,Relating to disclosure of certain relationships with local government officers.,None,Tommy Williams,sponsor,80R
HB 1497,Relating to the consequences of the failure by a person requesting information under the public information law to timely respond to certain written communications from a governmental body.,None,Tommy Williams,sponsor,80R
HB 1522,Relating to parking a commercial motor vehicle on certain streets.,None,Tommy Williams,sponsor,80R
HB 1759,"Relating to the transfer of certain state property from the Health and Human Services Commission, the Department of State Health Services, or the Department of Aging and Disability Services to Spindletop MHMR Services.",None,Tommy Williams,sponsor,80R
HB 1820,Relating to the authority to impose a county hotel occupancy tax and to the maximum rate of the tax.,None,Tommy Williams,sponsor,80R
HB 1892,Relating to the authority of certain counties and other entities with respect to certain transportation projects; providing penalties.,None,Tommy Williams,sponsor,80R
HB 2054,Relating to the authority of the Texas Historical Commission to assist in establishing and operating a museum and study center at Fort Bliss.,None,Tommy Williams,sponsor,80R
HB 2061,"Relating to the acquisition or disclosure of the social security number of a living person by a governmental body, including by a district or county clerk.",None,Tommy Williams,sponsor,80R
HB 2105,Relating to the issuance of disabled parking placards to and the registration of vehicles by certain veterans with disabilities.,None,Tommy Williams,sponsor,80R
HB 2120,Relating to the operation of the unemployment compensation system and computation of an individual's unemployment compensation benefits; providing a criminal penalty.,None,Tommy Williams,sponsor,80R
HB 2127,Relating to the operation of all-terrain vehicles in connection with utility work.,None,Tommy Williams,sponsor,80R
HB 2144,Relating to the regulation of the practice of public accountancy by certain out-of-state license holders.,None,Tommy Williams,sponsor,80R
HB 2188,Relating to the exception of certain ad valorem tax appraisal information from required disclosure under the public information law.,None,Tommy Williams,sponsor,80R
HB 2248,Relating to the ability of a governmental body under the public information law to request a redetermination from the attorney general on dismissal of litigation relating to the same issue.,None,Tommy Williams,sponsor,80R
HB 2252,"Relating to provision of health-related services, health care information, and incentives promoting disease prevention, wellness, and health by certain insurers and related entities and certain health care providers.",None,Tommy Williams,sponsor,80R
HB 2445,Relating to certain employment records maintained by the Commission on Law Enforcement Officer Standards and Education; providing an administrative penalty.,None,Tommy Williams,sponsor,80R
HB 2492,Relating to the applicability of restrictions on corporate political contributions and expenditures to corporations organized under provisions of the Business Organizations Code.,None,Tommy Williams,sponsor,80R
HB 2503,Relating to a technology literacy assessment instrument to be administered to certain public school students.,None,Tommy Williams,sponsor,80R
HB 2727,Relating to storage of certain imported alcoholic beverages.,None,Tommy Williams,sponsor,80R
HB 2782,Relating to the creation of the Liberty County Municipal Utility District No. 5.,None,Tommy Williams,sponsor,80R
HB 2991,Relating to the control of access to highways within certain counties.,None,Tommy Williams,sponsor,80R
HB 3158,"Relating to the name, powers, and board of directors of the Chambers County-Cedar Bayou Navigation District.",None,Tommy Williams,sponsor,80R
HB 3195,Relating to the requirements of a municipal or county budget that raises more property taxes than in the previous year's budget.,None,Tommy Williams,sponsor,80R
HB 3270,Relating to authorizing the issuance of anticipation notes or other obligations by issuers located along the Gulf Coast in the event of an emergency.,None,Tommy Williams,sponsor,80R
HB 3295,Relating to the DNA samples taken from certain offenders.,None,Tommy Williams,sponsor,80R
HB 3470,Relating to the program of supplemental health coverage for individuals eligible under the TRICARE military health system offered through the Employees Retirement System of Texas.,None,Tommy Williams,sponsor,80R
HB 3490,Relating to the authority of a chief appraiser to appeal from an order of an appraisal review board determining a taxpayer protest.,None,Tommy Williams,sponsor,80R
HB 3491,Relating to the qualifications and selection of the board of directors of an appraisal district.,None,Tommy Williams,sponsor,80R
HB 3493,Relating to the regulation of property tax professionals and appraisal review boards.,None,Tommy Williams,sponsor,80R
HB 3494,"Relating to the appeal through binding arbitration of a protest of an appraisal review board order, and to related complaints filed by a property owner and disciplinary action by the Board of Tax Professional Examiners; providing penalties.",None,Tommy Williams,sponsor,80R
HB 3495,Relating to the contents of the notice of the meeting at which the governing body of a taxing unit will vote on a proposed ad valorem tax rate that will result in a tax revenue increase.,None,Tommy Williams,sponsor,80R
HB 3496,Relating to the delivery or filing of certain ad valorem tax notices.,None,Tommy Williams,sponsor,80R
HB 3634,Relating to the name and powers of the Jefferson County Waterway and Navigation District.,None,Tommy Williams,sponsor,80R
HB 3678,Relating to voluntary student expression of religious viewpoints in public schools.,None,Tommy Williams,sponsor,80R
HB 3699,Relating to the management of public school land and the investment of the permanent school fund.,None,Tommy Williams,sponsor,80R
HB 3998,Relating to the creation of the Southeast Montgomery County Municipal Utility District No. 1; providing authority to impose a tax and issue bonds; granting the power of eminent domain.,None,Tommy Williams,sponsor,80R
HB 4014,"Relating to the creation of the Plum Creek Water Control and Improvement District No. 1 of Liberty, Montgomery, and Harris Counties; providing authority to impose a tax and issue bonds; granting the power of eminent domain.",None,Tommy Williams,sponsor,80R
HB 4015,Relating to the powers and duties of the East Montgomery County Improvement District; providing authority to impose a tax.,None,Tommy Williams,sponsor,80R
HB 4016,Relating to the creation of the Harris County Municipal Utility District No. 508; providing authority to impose a tax and issue bonds; granting the power of eminent domain.,None,Tommy Williams,sponsor,80R
HB 4046,Relating to the creation of the Montgomery County Municipal Utility District No. 104; providing authority to impose taxes and issue bonds.,None,Tommy Williams,sponsor,80R
HB 4073,Relating to the creation of the Montgomery County Municipal Utility District No. 103; providing authority to impose taxes and issue bonds.,None,Tommy Williams,sponsor,80R
HB 4074,Relating to the creation of the Montgomery County Municipal Utility District No. 102; providing authority to impose taxes and issue bonds.,None,Tommy Williams,sponsor,80R
HB 4079,Relating to the creation of the Montgomery County Municipal Utility District No. 119; providing authority to impose taxes and issue bonds.,None,Tommy Williams,sponsor,80R
HB 4083,Relating to the creation of the Montgomery County Municipal Utility District No. 117; providing authority to impose taxes and issue bonds.,None,Tommy Williams,sponsor,80R
HB 4084,Relating to the creation of the Montgomery County Municipal Utility District No. 120; providing authority to impose taxes and issue bonds.,None,Tommy Williams,sponsor,80R
HB 4093,Relating to the creation of the Chambers-Liberty Counties Improvement District; providing authority to impose a tax and issue bonds.,None,Tommy Williams,sponsor,80R
HB 4104,Relating to the powers and duties of the Montgomery County Municipal Utility District No. 112; providing authority to impose a tax and issue bonds.,None,Tommy Williams,sponsor,80R
HB 4109,"Relating to the administration, powers, including taxing powers and the authority to issue bonds, boundaries, operations, financing, and dissolution of the Town Center Improvement District of Montgomery County, Texas.",None,Tommy Williams,sponsor,80R
HCR 96,Requesting the lieutenant governor and speaker to create a joint interim committee to study the qualifications and standards necessary to be designated a police agency and to encourage a moratorium on the statutory creation of new police agencies.,None,Tommy Williams,sponsor,80R
HCR 230,Instructing the enrolling clerk of the house to make corrections in H.B. No. 1892.,None,Tommy Williams,sponsor,80R
HCR 231,In memory of Beaumont police officer Lisa Renee Ligda Beaulieu.,None,Tommy Williams,sponsor,80R
HJR 54,Proposing a constitutional amendment authorizing the legislature to exempt from ad valorem taxation one motor vehicle owned by an individual and used in the course of the owner's occupation or profession and also for personal activities of the owner.,None,Tommy Williams,sponsor,80R
HB 14,"Relating to reorganizing certain state institutions that provide financing for cancer research, including creating the Cancer Prevention and Research Institute of Texas, and information about certain cancer treatments; granting authority to issue bonds.",None,Tommy Williams,cosponsor,80R
HB 323,Relating to three-point seat belts on buses that transport schoolchildren.,None,Tommy Williams,cosponsor,80R
SB 23,Relating to the costs of damages to Lamar University and its related institutions caused by Hurricane Rita; making an appropriation.,None,Tommy Williams,author,793
SB 33,Relating to the authority of the governor to issue evacuation orders during disasters.,None,Tommy Williams,author,793
SB 41,Relating to the recovery and securitization of hurricane reconstruction costs incurred by certain electric utilities outside of the Electric Reliability Council of Texas area.,None,Tommy Williams,author,793
SR 27,Recognizing the class of 1956 of Stephen F. Austin High School on the occasion of its 50-year reunion.,None,Tommy Williams,author,793
SR 61,Recognizing Robert Krienke on the occasion of his retirement.,None,Tommy Williams,author,793
SR 152,Recognizing Marie Carter on the occasion of her 80th birthday.,None,Tommy Williams,author,793
SR 153,Commending Joseph Richard Fochtman of Kingwood for achieving the rank of Eagle Scout.,None,Tommy Williams,author,793
SJR 8,Proposing a constitutional amendment authorizing the governing body of a political subdivision to establish for purposes of ad valorem taxation by the political subdivision a limit on the maximum average annual percentage increase in the appraised value of residence homesteads in the political subdivision.,None,Tommy Williams,coauthor,793
HB 2,"Relating to the allocation of certain revenue from franchise taxes, motor vehicle sales and use taxes, and taxes on cigarettes and other tobacco products to school district property tax relief and public education.",None,Tommy Williams,sponsor,793
HB 63,Relating to appropriations to pay for damages and disruptions suffered by Lamar University and its related institutions caused by Hurricanes Katrina and Rita.,None,Tommy Williams,sponsor,793
HB 163,Relating to the recovery and securitization of hurricane reconstruction costs incurred by certain electric utilities outside of the Electric Reliability Council of Texas area.,None,Tommy Williams,sponsor,793
SB 33,Relating to certain limitations on the ad valorem tax rates of certain taxing units.,None,Tommy Williams,author,792
SR 111,In memory of Wallace Lee Luthy of Kingwood.,None,Tommy Williams,author,792
SR 112,Congratulating the Liberty Ponytails softball team of Liberty for winning a state championship.,None,Tommy Williams,author,792
SR 113,Recognizing Peggy and Charles Mason of New Caney on the occasion of their 50th wedding anniversary.,None,Tommy Williams,author,792
SJR 4,Proposing a constitutional amendment authorizing the governing body of a political subdivision to establish for purposes of ad valorem taxation by the political subdivision a lower limit on the maximum average annual percentage increase in the appraised value of residence homesteads in the political subdivision.,None,Tommy Williams,coauthor,792
SB 4,Relating to the calculation and imposition of an ad valorem tax by a taxing unit.,None,Tommy Williams,author,791
SR 92,Recognizing Kingwood High School in Humble for winning the Class 5A 2005 Lone Star Cup.,None,Tommy Williams,author,791
SB 18,Relating to the adoption of ad valorem tax rates by taxing units and to related tax bills.,None,Tommy Williams,author,79R
SB 256,Relating to the release of certain student information by a school district.,None,Tommy Williams,author,79R
SB 257,Relating to the forfeiture of contraband used or intended to be used in the commission of certain criminal offenses.,None,Tommy Williams,author,79R
SB 258,Relating to the disposition of certain obscene material and child pornography.,None,Tommy Williams,author,79R
SB 259,Relating to the use of excess money in the compensation to victims of crime fund.,None,Tommy Williams,author,79R
SB 260,Relating to the division of legal fees between attorneys in different law firms.,None,Tommy Williams,author,79R
SB 261,Relating to the creation of a program to educate the public on the value of health coverage and to increase public awareness of health coverage options.,None,Tommy Williams,author,79R
SB 262,Relating to benefits from the Employees Retirement System of Texas for law enforcement officers commissioned by the Texas State Board of Pharmacy.,None,Tommy Williams,author,79R
SB 263,Relating to use of certain information relating to tax audits; providing penalties.,None,Tommy Williams,author,79R
SB 264,Relating to the authority of the Montgomery County Hospital District to issue certain bonds or incur or assume other debt.,None,Tommy Williams,author,79R
SB 265,Relating to certain continuing education requirements for insurance agents.,None,Tommy Williams,author,79R
SB 266,Relating to the release of certain information regarding a workers' compensation claim.,None,Tommy Williams,author,79R
SB 267,Relating to the exclusion from an emergency services district of certain territory subject to assessments.,None,Tommy Williams,author,79R
SB 272,Relating to the creation of an oyster license moratorium program.,None,Tommy Williams,author,79R
SB 494,Relating to permissive interlocutory appeals in civil actions.,None,Tommy Williams,author,79R
SB 495,Relating to the fee paid to the attorney general for examining the record of proceedings authorizing the issuance of a public security or related credit agreement.,None,Tommy Williams,author,79R
SB 496,"Relating to the validation of any act, governmental proceeding, official, bond, or obligation of a navigation district or port authority or a corporation of the district or authority.",None,Tommy Williams,author,79R
SB 497,Relating to the qualifications and removal of a constable.,None,Tommy Williams,author,79R
SB 731,Relating to initial training and continuing education requirements for a constable.,None,Tommy Williams,author,79R
SB 732,Relating to the administration of polygraph examinations to certain applicants for positions in the Department of Public Safety.,None,Tommy Williams,author,79R
SB 733,Relating to the certification of the amount of excess money in the compensation to victims of crime fund.,None,Tommy Williams,author,79R
SB 734,Relating to municipal regulation of the discharge of firearms and certain other weapons.,None,Tommy Williams,author,79R
SB 735,Relating to delay in the deregulation of certain electric utilities outside of ERCOT.,None,Tommy Williams,author,79R
SB 787,Relating to the eligibility of certain organizations to join a risk pool established by a political subdivision for the purpose of providing uniform group benefits.,None,Tommy Williams,author,79R
SB 788,Relating to eligibility for certain unemployment compensation benefits.,None,Tommy Williams,author,79R
SB 789,Relating to the liability of a person who has obtained improper unemployment compensation benefits.,None,Tommy Williams,author,79R
SB 790,Relating to the determination of benefit wage credits for purposes of unemployment compensation.,None,Tommy Williams,author,79R
SB 791,Relating to initial claims under the unemployment compensation system.,None,Tommy Williams,author,79R
SB 883,Relating to the creation of the East Montgomery County Municipal Utility District No. 8; providing authority to impose a tax and issue bonds; granting the power of eminent domain.,None,Tommy Williams,author,79R
SB 884,Relating to the creation of the East Montgomery County Municipal Utility District No. 9; providing authority to impose a tax and issue bonds; granting the power of eminent domain.,None,Tommy Williams,author,79R
SB 885,Relating to the creation of the East Montgomery County Municipal Utility District No. 10; providing authority to impose a tax and issue bonds; granting the power of eminent domain.,None,Tommy Williams,author,79R
SB 886,Relating to the creation of the East Montgomery County Municipal Utility District No. 11; providing authority to impose a tax and issue bonds; granting the power of eminent domain.,None,Tommy Williams,author,79R
SB 887,Relating to the creation of the East Montgomery County Municipal Utility District No. 12; providing authority to impose a tax and issue bonds; granting the power of eminent domain.,None,Tommy Williams,author,79R
SB 888,"Relating to the powers, duties, privileges, and immunities of a peace officer.",None,Tommy Williams,author,79R
SB 889,Relating to the creation of the East Montgomery County Municipal Utility District No. 13; providing authority to impose a tax and issue bonds; granting the power of eminent domain.,None,Tommy Williams,author,79R
SB 890,Relating to the amount of recovery in a civil action.,None,Tommy Williams,author,79R
SB 891,Relating to the creation of the East Montgomery County Municipal Utility District No. 14; providing authority to impose a tax and issue bonds; granting the power of eminent domain.,None,Tommy Williams,author,79R
SB 957,Relating to the powers and duties of the Texas Department of Licensing and Regulation.,None,Tommy Williams,author,79R
SB 1351,Relating to the appeal of certain ad valorem tax determinations through binding arbitration.,None,Tommy Williams,author,79R
SB 1352,Relating to the maximum reservation for certain individual projects of a portion of the state ceiling for private activity bonds.,None,Tommy Williams,author,79R
SB 1353,"Relating to the powers and duties of the Town Center Improvement District of Montgomery County, Texas, and of governmental entities and peace officers that interact with the district; providing a penalty.",None,Tommy Williams,author,79R
SB 1483,Relating to exempting textbooks for university and college courses from the sales tax.,None,Tommy Williams,author,79R
SB 1484,Relating to general revenue appropriations to institutions of higher education.,None,Tommy Williams,author,79R
SB 1485,Relating to providing that the social security number of a living person is excepted from required disclosure under the public information law and may be redacted without the necessity of requesting a decision from the attorney general.,None,Tommy Williams,author,79R
SB 1486,Relating to eligibility for certification as an independent hearing examiner for teacher contract hearings.,None,Tommy Williams,author,79R
SB 1487,Relating to termination or suspension without pay of a teacher who does not request an independent hearing examiner.,None,Tommy Williams,author,79R
SB 1488,Relating to the discharge of teachers for good cause under a probationary contract in a public school.,None,Tommy Williams,author,79R
SB 1489,Relating to the termination of a teacher's contract for a financial exigency that requires a reduction in personnel.,None,Tommy Williams,author,79R
SB 1490,"Relating to the creation of the office of criminal district attorney of Chambers County, the abolition of the office of county attorney of Chambers County, and the duties of the district attorney for the 253rd Judicial District.",None,Tommy Williams,author,79R
SB 1491,Relating to a fee charged for services provided by the staff of the state law library.,None,Tommy Williams,author,79R
SB 1492,Relating to the fee for the issuance of an attorney's license or certificate.,None,Tommy Williams,author,79R
SB 1493,Relating to the laws administered by the Texas Ethics Commission for the fair conduct of elections and election campaigns; providing penalties.,None,Tommy Williams,author,79R
SB 1567,Relating to the amount of longevity and hazardous duty pay for certain state employees.,None,Tommy Williams,author,79R
SB 1568,Relating to membership in the Employees Retirement System of Texas.,None,Tommy Williams,author,79R
