bill_name,caption,filer_id,filer_name,function,session,leg_id,original_name,parsed_name
HCR 26,"Requesting the comptroller of public accounts to continue the performance audits required by Chapter 1, Acts of the 72nd Legislature.",63380,Ralph Sheffield,coauthor,721,4430,Rep. Ralph Sheffield,Ralph Sheffield
HJR 17,"Proposing a constitutional amendment providing for equal educational opportunity, providing for local control by a school district of local taxes, authorizing the legislature to redistribute a portion of the ad valorem taxes levied and collected by ""tax haven"" school districts, authorizing the legislature to determine the methods by which school districts are formed and by which state funds appropriated to school districts are allocated, providing for appropriate state funding for rural school districts that are small and sparsely populated, and restricting the power of the courts to overturn a legislative decision regarding the system of or support for public education by adopting federal constitutional law which also preserves equal access to the courts.",63380,Ralph Sheffield,coauthor,721,4430,Rep. Ralph Sheffield,Ralph Sheffield
HB 1232,Relating to the issuance and use of property tax receipts.,63380,Ralph Sheffield,author,72R,4430,Rep. Ralph Sheffield,Ralph Sheffield
HB 1260,Relating to the regulation of certain talent agencies.,63380,Ralph Sheffield,author,72R,4430,Rep. Ralph Sheffield,Ralph Sheffield
HB 1583,Relating to certain information filed with the State Board of Insurance and the computation of an automobile experience modifier based on that information.,63380,Ralph Sheffield,author,72R,4430,Rep. Ralph Sheffield,Ralph Sheffield
HB 1617,"Relating to qualifications of directors of the Dallas County Utility and Reclamation District, written notice given to purchasers of real property located in the district, and validation of certain actions of the district.",63380,Ralph Sheffield,author,72R,4430,Rep. Ralph Sheffield,Ralph Sheffield
HB 1811,Relating to insurance coverage for chemical dependency under certain health insurance programs.,63380,Ralph Sheffield,author,72R,4430,Rep. Ralph Sheffield,Ralph Sheffield
HB 2048,Relating to title insurance policy provisions.,63380,Ralph Sheffield,author,72R,4430,Rep. Ralph Sheffield,Ralph Sheffield
HB 2049,Relating to the authority of the Dallas County Flood Control District No. 1 to enter into a tax abatement agreement and to designate a reinvestment zone.,63380,Ralph Sheffield,author,72R,4430,Rep. Ralph Sheffield,Ralph Sheffield
HB 2050,"Relating to regulation of solvency of insurers, reinsurers, and certain associated persons and entities.",63380,Ralph Sheffield,author,72R,4430,Rep. Ralph Sheffield,Ralph Sheffield
HB 2101,Relating to the costs incurred by counties for maintaining juvenile probation services.,63380,Ralph Sheffield,author,72R,4430,Rep. Ralph Sheffield,Ralph Sheffield
HB 2257,Relating to issuance of insured closing letters by title insurance companies.,63380,Ralph Sheffield,author,72R,4430,Rep. Ralph Sheffield,Ralph Sheffield
HB 2417,Relating to the regulation of joint underwriting associations and their activities.,63380,Ralph Sheffield,author,72R,4430,Rep. Ralph Sheffield,Ralph Sheffield
HCR 244,"Directing the State Board of Insurance to remove pharmacies from class 8017, ""Retail Not Otherwise Classified"" and provide a separate and discrete classification with a rate more appropriate to the actual loss history of Texas pharmacies.",63380,Ralph Sheffield,author,72R,4430,Rep. Ralph Sheffield,Ralph Sheffield
HCR 255,Requesting the governor to return House Bill 779 to the house.,63380,Ralph Sheffield,author,72R,4430,Rep. Ralph Sheffield,Ralph Sheffield
HJR 65,Proposing a constitutional amendment to authorize the partial exemption from ad valorem taxation of certain personal property temporarily in the state for certain purposes.,63380,Ralph Sheffield,author,72R,4430,Rep. Ralph Sheffield,Ralph Sheffield
HR 658,"Granting the American Legion permission to use the house chamber on Friday, June 7, 1991, for the purpose of conducting its Boys State legislative session.",63380,Ralph Sheffield,author,72R,4430,Rep. Ralph Sheffield,Ralph Sheffield
HB 761,"Relating to ethics and accountability in state government, to the composition, powers, and duties of the State Ethics Commission, to expenditures made to influence legislation or administrative action, to the filing of personal financial statements, to the receipt of certain compensation, and to political contributions and expenditures; making an appropriation; and providing civil and criminal penalties.",63380,Ralph Sheffield,coauthor,72R,4430,Rep. Ralph Sheffield,Ralph Sheffield
HB 861,Relating to the payment of costs associated with the appearance of a licensed health care professional for the state at criminal proceedings arising from a sexual assault.,63380,Ralph Sheffield,coauthor,72R,4430,Rep. Ralph Sheffield,Ralph Sheffield
HB 2366,"Relating to the Legislative Budget Board and the calculation of the limit on the growth of state appropriations as required by Article VIII, Section 22 of the Texas Constitution.",63380,Ralph Sheffield,coauthor,72R,4430,Rep. Ralph Sheffield,Ralph Sheffield
HCR 228,Recognizing 1991 as the Bill of Rights Bicentennial.,63380,Ralph Sheffield,coauthor,72R,4430,Rep. Ralph Sheffield,Ralph Sheffield
HJR 28,Proposing a constitutional amendment to prohibit the imposition of personal income taxes unless approved by the voters of this state.,63380,Ralph Sheffield,coauthor,72R,4430,Rep. Ralph Sheffield,Ralph Sheffield
SB 861,"Relating to qualifications of directors of the Dallas County Utility and Reclamation District, written notice given to purchasers of real property located in the district, and validation of certain actions of the district.",63380,Ralph Sheffield,sponsor,72R,4430,Rep. Ralph Sheffield,Ralph Sheffield
SB 985,Relating to retail installment contracts or retail charge agreements and providing for credit unemployment insurance.,63380,Ralph Sheffield,sponsor,72R,4430,Rep. Ralph Sheffield,Ralph Sheffield
SCR 162,Instructing the State Board of Insurance to clarify pharmacies separately from other retail businesses for purposes of workers compensation insurance.,63380,Ralph Sheffield,sponsor,72R,4430,Rep. Ralph Sheffield,Ralph Sheffield
HR 85,"Honoring E. B. ""Tex"" Hanna.",63380,Ralph Sheffield,author,716,4430,Rep. Ralph Sheffield,Ralph Sheffield
HCR 24,Commemorating the 70th anniversary of the ratification of the 19th Amendment to the United States Constitution.,63380,Ralph Sheffield,coauthor,716,4430,Rep. Ralph Sheffield,Ralph Sheffield
HCR 11,Honoring Representative Al Price.,63380,Ralph Sheffield,coauthor,715,4430,Rep. Ralph Sheffield,Ralph Sheffield
HCR 29,In memory of State Trooper Glen Perkins.,63380,Ralph Sheffield,coauthor,715,4430,Rep. Ralph Sheffield,Ralph Sheffield
HR 122,Commending Roy A. Baze.,63380,Ralph Sheffield,coauthor,715,4430,Rep. Ralph Sheffield,Ralph Sheffield
HR 127,Honoring Barbara Bush.,63380,Ralph Sheffield,coauthor,715,4430,Rep. Ralph Sheffield,Ralph Sheffield
HB 170,Relating to certain security requirements for registration as a talent agency.,63380,Ralph Sheffield,author,714,4430,Rep. Ralph Sheffield,Ralph Sheffield
HR 68,In memory of Harris Hill.,63380,Ralph Sheffield,author,712,4430,Rep. Ralph Sheffield,Ralph Sheffield
HR 234,Electing Lauren Elyse Soileau to the honorary office of mascot.,63380,Ralph Sheffield,author,712,4430,Rep. Ralph Sheffield,Ralph Sheffield
HR 103,Honoring Dr. W. Firman Haynie.,63380,Ralph Sheffield,author,711,4430,Rep. Ralph Sheffield,Ralph Sheffield
HCR 18,Calling on Congress to submit to the states a constitutional amendment protecting the American flag from willful burning or destruction.,63380,Ralph Sheffield,coauthor,711,4430,Rep. Ralph Sheffield,Ralph Sheffield
HB 744,Relating to sunset review of the State Board of Insurance.,63380,Ralph Sheffield,author,71R,4430,Rep. Ralph Sheffield,Ralph Sheffield
HB 931,Relating to investment by certain domestic insurers in bonds of Canadian corporations.,63380,Ralph Sheffield,author,71R,4430,Rep. Ralph Sheffield,Ralph Sheffield
HB 1098,Relating to the issuance of cease and desist orders against unauthorized insurers and persons engaged in an insurance business by the commissioner of insurance.,63380,Ralph Sheffield,author,71R,4430,Rep. Ralph Sheffield,Ralph Sheffield
HB 1099,Relating to issuance of emergency cease and desist orders by the commissioner of insurance and to the creation of an antifraud action by certain private insurers; authorizing the imposition of a civil....,63380,Ralph Sheffield,author,71R,4430,Rep. Ralph Sheffield,Ralph Sheffield
HB 1100,Relating to the registration of certain talent agencies; providing a penalty.,63380,Ralph Sheffield,author,71R,4430,Rep. Ralph Sheffield,Ralph Sheffield
HB 1360,Relating to the regulation of credit life and credit accident and health insurance for certain loans and credit transactions.,63380,Ralph Sheffield,author,71R,4430,Rep. Ralph Sheffield,Ralph Sheffield
HB 1670,Relating to the charging of a processing fee by the holder of a dishonored check.,63380,Ralph Sheffield,author,71R,4430,Rep. Ralph Sheffield,Ralph Sheffield
HB 1700,Relating to the powers and duties of the Dallas County Utility and Reclamation District and the terms of office of the district directors.,63380,Ralph Sheffield,author,71R,4430,Rep. Ralph Sheffield,Ralph Sheffield
HB 2142,Relating to required information on a federal postcard application for an absentee ballot.,63380,Ralph Sheffield,author,71R,4430,Rep. Ralph Sheffield,Ralph Sheffield
HB 2748,Relating to the premium tax credit claimed for insured losses under the catastrophe property insurance pool.,63380,Ralph Sheffield,author,71R,4430,Rep. Ralph Sheffield,Ralph Sheffield
HB 2749,Relating to the premium tax credit claimed for insured losses under the catastrophe property insurance pool.,63380,Ralph Sheffield,author,71R,4430,Rep. Ralph Sheffield,Ralph Sheffield
HB 2750,Relating to the use of certain funds dedicated to the compensation of crime victims.,63380,Ralph Sheffield,author,71R,4430,Rep. Ralph Sheffield,Ralph Sheffield
HB 2751,Relating to reform of the state workers compensation assigned risk system; creating the Texas workers compensation accident prevention fund and creating a reinsurance facility as part of such fund; establishing....,63380,Ralph Sheffield,author,71R,4430,Rep. Ralph Sheffield,Ralph Sheffield
HB 2752,Relating to the rights of a victim of certain delinquent children and children in need of supervision and of the victim's guardian and certain relatives.,63380,Ralph Sheffield,author,71R,4430,Rep. Ralph Sheffield,Ralph Sheffield
HB 2753,Relating to farm mutual companies.,63380,Ralph Sheffield,author,71R,4430,Rep. Ralph Sheffield,Ralph Sheffield
HB 2961,"Relating to advertising, price quotes, and charges of automobile rental companies.",63380,Ralph Sheffield,author,71R,4430,Rep. Ralph Sheffield,Ralph Sheffield
HCR 76,Honoring Dr. Harold C. Boehning.,63380,Ralph Sheffield,author,71R,4430,Rep. Ralph Sheffield,Ralph Sheffield
HCR 96,Requesting Congress to increase the income tax exemption for dependent children.,63380,Ralph Sheffield,author,71R,4430,Rep. Ralph Sheffield,Ralph Sheffield
HCR 123,Instructing the State Board of Insurance to reassign furniture stores to more accurate classifications.,63380,Ralph Sheffield,author,71R,4430,Rep. Ralph Sheffield,Ralph Sheffield
HJR 50,Proposing a constitutional amendment to control the authority of the courts of this state to require the state or a local government to increase the level of funding for the judicial branch.,63380,Ralph Sheffield,author,71R,4430,Rep. Ralph Sheffield,Ralph Sheffield
HR 1049,Honoring State Representative John Gavin on his legislative service.,63380,Ralph Sheffield,author,71R,4430,Rep. Ralph Sheffield,Ralph Sheffield
HB 1,"Relating to the reform of the workers' compensation system; to the creation, powers, and duties of the Texas Workers' Compensation Commission; to work safety; authorizing an appropriation; providing criminal and....",63380,Ralph Sheffield,coauthor,71R,4430,Rep. Ralph Sheffield,Ralph Sheffield
HB 631,Relating to an emergency appropriation to defray the expense of staff group insurance at public junior and community colleges.,63380,Ralph Sheffield,coauthor,71R,4430,Rep. Ralph Sheffield,Ralph Sheffield
HB 918,Relating to the accountability review of certain regional transportation authorities.,63380,Ralph Sheffield,coauthor,71R,4430,Rep. Ralph Sheffield,Ralph Sheffield
HB 2267,Relating to the authority of a municipality to adopt zoning regulations applicable to certain businesses.,63380,Ralph Sheffield,coauthor,71R,4430,Rep. Ralph Sheffield,Ralph Sheffield
HB 2268,Relating to the authority of governmental entities to adopt zoning or other regulations applicable to certain business establishments.,63380,Ralph Sheffield,coauthor,71R,4430,Rep. Ralph Sheffield,Ralph Sheffield
HR 534,Restating the legislative intent of the Public Utility Regulatory Act.,63380,Ralph Sheffield,coauthor,71R,4430,Rep. Ralph Sheffield,Ralph Sheffield
HR 596,Honoring Governor William P. Clements on his birthday.,63380,Ralph Sheffield,coauthor,71R,4430,Rep. Ralph Sheffield,Ralph Sheffield
HR 1084,Expressing appreciation to the Daughters of the Republic of Texas on stewardship of the Alamo.,63380,Ralph Sheffield,coauthor,71R,4430,Rep. Ralph Sheffield,Ralph Sheffield
SB 569,Relating to disclosure of guaranty fund non-participation in insurance policies and contracts and applications and in certificates and evidences of coverage.,63380,Ralph Sheffield,sponsor,71R,4430,Rep. Ralph Sheffield,Ralph Sheffield
SB 603,"Relating to the compensation, benefits, and working conditions of members of fire and police departments in certain municipalities.",63380,Ralph Sheffield,sponsor,71R,4430,Rep. Ralph Sheffield,Ralph Sheffield
SB 759,Relating to the regulation of certain talent agencies; providing a penalty.,63380,Ralph Sheffield,sponsor,71R,4430,Rep. Ralph Sheffield,Ralph Sheffield
SB 829,Relating to the regulation of credit life and credit accident and health insurance for certain loans and credit transactions.,63380,Ralph Sheffield,sponsor,71R,4430,Rep. Ralph Sheffield,Ralph Sheffield
SB 1133,Relating to the use of certain funds dedicated to the compensation of crime victims.,63380,Ralph Sheffield,sponsor,71R,4430,Rep. Ralph Sheffield,Ralph Sheffield
SB 1386,Relating to the rights of a victim of certain delinquent children and children in need of supervision and of the victim's guardian and certain relatives.,63380,Ralph Sheffield,sponsor,71R,4430,Rep. Ralph Sheffield,Ralph Sheffield
SB 1644,Relating to life insurance policies and applications.,63380,Ralph Sheffield,sponsor,71R,4430,Rep. Ralph Sheffield,Ralph Sheffield
