bill_name,caption,filer_id,filer_name,function,session,leg_id,original_name,parsed_name
SCR 75,In memory of Troy Lynn Duncan.,36668,Lt. Gov. David Dewhurst,author,72R,1170,Lt. Gov. David Dewhurst,David Dewhurst
SCR 101,"Declaring Armed Forces Day and Armed Forces Week as a time to pay tribute to the men and women who have shown exemplary discipline, spirit, and perseverance in defending our heritage.",36668,Lt. Gov. David Dewhurst,author,72R,1170,Lt. Gov. David Dewhurst,David Dewhurst
SCR 116,"Designating May 1, 1991, as Law Day in the State of Texas.",36668,Lt. Gov. David Dewhurst,author,72R,1170,Lt. Gov. David Dewhurst,David Dewhurst
SJR 28,Proposing a constitutional amendment entitling Texas State Technical Institute to a share of certain constitutionally dedicated funds.,36668,Lt. Gov. David Dewhurst,author,72R,1170,Lt. Gov. David Dewhurst,David Dewhurst
SR 39,Commending Texas State Technical Institute for 25 years of innovative technical education.,36668,Lt. Gov. David Dewhurst,author,72R,1170,Lt. Gov. David Dewhurst,David Dewhurst
SR 76,Honoring Mrs. A. V. S. Davis of Temple on the occasion of her 100th birthday.,36668,Lt. Gov. David Dewhurst,author,72R,1170,Lt. Gov. David Dewhurst,David Dewhurst
SR 77,Congratulating Mike Welch of Sweetwater for being named the 1990 recipient of the Spirit of America Award.,36668,Lt. Gov. David Dewhurst,author,72R,1170,Lt. Gov. David Dewhurst,David Dewhurst
SR 78,Congratulating the Texas Alcoholic Beverage Commissioned Officers Association for their exceptionally fine work and their new and highly praised public education campaign.,36668,Lt. Gov. David Dewhurst,author,72R,1170,Lt. Gov. David Dewhurst,David Dewhurst
SR 142,"Recognizing the Caruth Small Business Development Center at Abilene Christian University on the celebration of its 1,000th new client.",36668,Lt. Gov. David Dewhurst,author,72R,1170,Lt. Gov. David Dewhurst,David Dewhurst
SR 176,Congratulating the Abilene High School cheerleaders for their excellent performance in the National Cheerleading Competition held in Dallas.,36668,Lt. Gov. David Dewhurst,author,72R,1170,Lt. Gov. David Dewhurst,David Dewhurst
SR 296,"Recognizing the Centex Chapter of the American Red Cross on the occasion of its 75th anniversary on March 15, 1991.",36668,Lt. Gov. David Dewhurst,author,72R,1170,Lt. Gov. David Dewhurst,David Dewhurst
SR 338,In memory of Troy Lynn Duncan.,36668,Lt. Gov. David Dewhurst,author,72R,1170,Lt. Gov. David Dewhurst,David Dewhurst
SR 384,"Congratulating Dr. Joseph D. Stamey, McMurry University professor of philosophy, for being named 1990 Texas Professor of the Year by the Council for the Advancement and Support of Education (CASE) of Washington, D.C.",36668,Lt. Gov. David Dewhurst,author,72R,1170,Lt. Gov. David Dewhurst,David Dewhurst
SR 385,"Extending best wishes to Dr. L. Harlan Ford, President of the University of Central Texas at Killeen, on his retirement and commending him for his dynamic leadership over the past 10 years.",36668,Lt. Gov. David Dewhurst,author,72R,1170,Lt. Gov. David Dewhurst,David Dewhurst
SR 394,In memory of Judge Jack B. Miller.,36668,Lt. Gov. David Dewhurst,author,72R,1170,Lt. Gov. David Dewhurst,David Dewhurst
SR 440,Extending appreciation to Mrs. Sue Mayborn.,36668,Lt. Gov. David Dewhurst,author,72R,1170,Lt. Gov. David Dewhurst,David Dewhurst
SR 441,Congratulating Daryl Lane McEwen of Tuscola on achieving the rank of Eagle Scout.,36668,Lt. Gov. David Dewhurst,author,72R,1170,Lt. Gov. David Dewhurst,David Dewhurst
SR 442,"Commending Colonel Alexander M. Walczak for the splendid work he performed as Staff Judge Advocate, III Corps and Fort Hood since September, 1989.",36668,Lt. Gov. David Dewhurst,author,72R,1170,Lt. Gov. David Dewhurst,David Dewhurst
SR 443,"Honoring the board of trustees, administration, and faculty of the Highland Independent School District on their exceptional achievement in conceptualizing and instituting the Hilltop Technology Program in the district.",36668,Lt. Gov. David Dewhurst,author,72R,1170,Lt. Gov. David Dewhurst,David Dewhurst
SR 623,Paying tribute to Mondel Rogers of Sweetwater for being chosen as the Texas State Artist.,36668,Lt. Gov. David Dewhurst,author,72R,1170,Lt. Gov. David Dewhurst,David Dewhurst
SR 627,Joining with the citizens of West Texas in recognizing Camp Boothe Oaks on the grand occasion of its 40th anniversary.,36668,Lt. Gov. David Dewhurst,author,72R,1170,Lt. Gov. David Dewhurst,David Dewhurst
SR 692,In memory of Shelley V. Smith.,36668,Lt. Gov. David Dewhurst,author,72R,1170,Lt. Gov. David Dewhurst,David Dewhurst
SR 809,In memory of Nancy Boone of Abilene.,36668,Lt. Gov. David Dewhurst,author,72R,1170,Lt. Gov. David Dewhurst,David Dewhurst
SR 810,"Congratulating Tammy Barnes, D'Linn Blair, Julie Byers, Will Davis, Dianna Edwards, Jennifer Hejl, Billy Hindman, Beth Holland, Stacy Hyde, Christina Meffert, Tim Neal, Marla Self, Amber Waddington, and Jimmy Waddington on their graduation from Blackwell High School.",36668,Lt. Gov. David Dewhurst,author,72R,1170,Lt. Gov. David Dewhurst,David Dewhurst
SR 811,"Commending Willie L. Basey, Warren Burton, Robert T. Edwards, Albert Elam, Emmett L. Johnson, Charles Milton, Sam Novy, and Felix C. Scott for their exemplary service and dedication as car guards for the Senate.",36668,Lt. Gov. David Dewhurst,author,72R,1170,Lt. Gov. David Dewhurst,David Dewhurst
SR 812,Congratulating Billy Holland of Winters on achieving the rank of Eagle Scout.,36668,Lt. Gov. David Dewhurst,author,72R,1170,Lt. Gov. David Dewhurst,David Dewhurst
SR 878,"Resolving to suspend Rule 12.03, Rules of the Senate, 72nd Legislature, to enable the conference committee appointed to adjust the differences between the house and senate versions of House Bill No. 66.",36668,Lt. Gov. David Dewhurst,author,72R,1170,Lt. Gov. David Dewhurst,David Dewhurst
SB 155,Relating to the award of certain costs to persons affected by hazardous waste disposal well regulation.,36668,Lt. Gov. David Dewhurst,author,72R,1170,Lt. Gov. David Dewhurst,David Dewhurst
SB 630,Relating to the issuance of a commercial driver's license and certain information required to be provided by the Department of Public Safety; providing penalties.,36668,Lt. Gov. David Dewhurst,author,72R,1170,Lt. Gov. David Dewhurst,David Dewhurst
SB 1579,Relating to the creation of an executive committee of the Board of Pardons and Paroles for the administration and operation of the board.,36668,Lt. Gov. David Dewhurst,author,72R,1170,Lt. Gov. David Dewhurst,David Dewhurst
SR 516,"Welcoming the Honorable Bill Parker, the Honorable Charles H. Griffin and the Honorable Marvin Lindsey, County Commissioners from Mills County.",36668,Lt. Gov. David Dewhurst,author,72R,1170,Lt. Gov. David Dewhurst,David Dewhurst
SR 844,Creating a Special Interim Advisory Committee on Texas-Latin American Trade in the 1990's to study these issues and serve as a central repository for information on these matters.,36668,Lt. Gov. David Dewhurst,author,72R,1170,Lt. Gov. David Dewhurst,David Dewhurst
SB 1,"Relating to ethics of public servants, including the composition, powers, and duties of the Texas Ethics Commission; to registration, reporting, and restrictions concerning expenditures made to influence legislation or administrative action; to personal financial statements filed by public officers and employees; to the giving or acceptance of certain benefits; to restrictions and reporting concerning political contributions and expenditures; and providing penalties.",36668,Lt. Gov. David Dewhurst,coauthor,72R,1170,Lt. Gov. David Dewhurst,David Dewhurst
SB 20,Relating to fire prevention and fire-fighting support activities of the Texas Forest Service.,36668,Lt. Gov. David Dewhurst,coauthor,72R,1170,Lt. Gov. David Dewhurst,David Dewhurst
SB 63,Relating to refunding certain tuition and fees and assigning grades to certain students at institutions of higher education.,36668,Lt. Gov. David Dewhurst,coauthor,72R,1170,Lt. Gov. David Dewhurst,David Dewhurst
SB 112,Relating to community centers and to the provision of community mental health and mental retardation services.,36668,Lt. Gov. David Dewhurst,coauthor,72R,1170,Lt. Gov. David Dewhurst,David Dewhurst
SB 198,Relating to the creation of the rural economic assistance clearinghouse within the Texas Department of Commerce.,36668,Lt. Gov. David Dewhurst,coauthor,72R,1170,Lt. Gov. David Dewhurst,David Dewhurst
SB 226,Relating to establishing a law school at Texas A&I University.,36668,Lt. Gov. David Dewhurst,coauthor,72R,1170,Lt. Gov. David Dewhurst,David Dewhurst
SB 231,Relating to the award of certain costs to persons affected by hazardous waste regulation.,36668,Lt. Gov. David Dewhurst,coauthor,72R,1170,Lt. Gov. David Dewhurst,David Dewhurst
SB 261,Relating to the designation of the anniversary of the signing of the Treaty of Guadalupe Hidalgo as a legal holiday.,36668,Lt. Gov. David Dewhurst,coauthor,72R,1170,Lt. Gov. David Dewhurst,David Dewhurst
SB 300,Relating to salary payments for state employees who are called to active military duty.,36668,Lt. Gov. David Dewhurst,coauthor,72R,1170,Lt. Gov. David Dewhurst,David Dewhurst
SB 325,Relating to certain nonprofit corporations that supply water or provide wastewater services.,36668,Lt. Gov. David Dewhurst,coauthor,72R,1170,Lt. Gov. David Dewhurst,David Dewhurst
SB 444,Relating to the adoption of the Durable Power of Attorney Act.,36668,Lt. Gov. David Dewhurst,coauthor,72R,1170,Lt. Gov. David Dewhurst,David Dewhurst
SB 1160,Relating to certain measures to decrease the nursing shortage in this state.,36668,Lt. Gov. David Dewhurst,coauthor,72R,1170,Lt. Gov. David Dewhurst,David Dewhurst
SB 1184,Relating to the designation of and tax incentives for an enterprize zone or enterprise project.,36668,Lt. Gov. David Dewhurst,coauthor,72R,1170,Lt. Gov. David Dewhurst,David Dewhurst
SB 1392,Relating to the term of certain enterprise project tax abatement agreements.,36668,Lt. Gov. David Dewhurst,coauthor,72R,1170,Lt. Gov. David Dewhurst,David Dewhurst
SB 1425,Relating to the exemption from ad valorem taxation of certain property in an enterprise zone.,36668,Lt. Gov. David Dewhurst,coauthor,72R,1170,Lt. Gov. David Dewhurst,David Dewhurst
SB 1456,"Relating to the renewal by the State Board of Insurance of a license, certificate, or other authorization to perform an activity regulated under the insurance laws of this state that is held by certain persons on active duty in the United States armed forces.",36668,Lt. Gov. David Dewhurst,coauthor,72R,1170,Lt. Gov. David Dewhurst,David Dewhurst
SB 1596,"Relating to reducing overcrowding in jails and promoting a more effective state criminal justice system, including provisions relating to maintenance and operation tax rate, the composition of the Criminal Justice Policy Council, the creation of the Texas Sentencing and Corrections Commission, performance rewards payments to certain counties, and conditions of parole; and repealing certain statutes related to criminal offenses.",36668,Lt. Gov. David Dewhurst,coauthor,72R,1170,Lt. Gov. David Dewhurst,David Dewhurst
SCR 66,Expressing support for the establishment of a funding mechanism for the Texas Silver Haired Legislature.,36668,Lt. Gov. David Dewhurst,coauthor,72R,1170,Lt. Gov. David Dewhurst,David Dewhurst
SJR 15,Proposing a constitutional amendment to authorize the exemption from ad valorem taxation of property owned by a nonprofit water supply or wastewater service corporation.,36668,Lt. Gov. David Dewhurst,coauthor,72R,1170,Lt. Gov. David Dewhurst,David Dewhurst
SJR 39,Proposing a constitutional amendment to exempt from property taxes certain property in an enterprise zone.,36668,Lt. Gov. David Dewhurst,coauthor,72R,1170,Lt. Gov. David Dewhurst,David Dewhurst
SR 227,In memory of Wenona Christine Jones Glasgow.,36668,Lt. Gov. David Dewhurst,coauthor,72R,1170,Lt. Gov. David Dewhurst,David Dewhurst
SR 763,Urging all Texas communities to support the Governor's Committee to Salute Texas Troops.,36668,Lt. Gov. David Dewhurst,coauthor,72R,1170,Lt. Gov. David Dewhurst,David Dewhurst
HB 37,Relating to prohibited practices concerning taxicab fares; providing a penalty.,36668,Lt. Gov. David Dewhurst,sponsor,72R,1170,Lt. Gov. David Dewhurst,David Dewhurst
HB 44,Relating to the punishments for offenses involving prohibited weapons.,36668,Lt. Gov. David Dewhurst,sponsor,72R,1170,Lt. Gov. David Dewhurst,David Dewhurst
HB 50,Relating to a defense to the offense of criminal trespass if the actor is a fire fighter or emergency medical services personnel acting in the lawful discharge of an official duty under exigent circumstances.,36668,Lt. Gov. David Dewhurst,sponsor,72R,1170,Lt. Gov. David Dewhurst,David Dewhurst
HB 66,"Relating to the creation, jurisdiction, and administration of certain county and statutory county courts, to the creation of multicounty statutory county courts, and to the qualifications of office for an compensation of judges of certain courts and certain county attorneys.",36668,Lt. Gov. David Dewhurst,sponsor,72R,1170,Lt. Gov. David Dewhurst,David Dewhurst
HB 128,Relating to the operation and maintenance of State of Texas foreign offices by the Texas Department of Commerce.,36668,Lt. Gov. David Dewhurst,sponsor,72R,1170,Lt. Gov. David Dewhurst,David Dewhurst
HB 134,Relating to the qualifications and compensation of presiding judges of administrative judicial regions.,36668,Lt. Gov. David Dewhurst,sponsor,72R,1170,Lt. Gov. David Dewhurst,David Dewhurst
HB 650,"Relating to the definition of ""benefit year"" under the Texas Unemployment Compensation Act.",36668,Lt. Gov. David Dewhurst,sponsor,72R,1170,Lt. Gov. David Dewhurst,David Dewhurst
HB 806,Relating to the punishment for deadly assault on an employee of the Texas Youth Commission.,36668,Lt. Gov. David Dewhurst,sponsor,72R,1170,Lt. Gov. David Dewhurst,David Dewhurst
HB 936,Relating to the regulation of credit unions.,36668,Lt. Gov. David Dewhurst,sponsor,72R,1170,Lt. Gov. David Dewhurst,David Dewhurst
HB 1093,Relating to the establishment of debit card suspense accounts at Texas Youth Commission facilities.,36668,Lt. Gov. David Dewhurst,sponsor,72R,1170,Lt. Gov. David Dewhurst,David Dewhurst
HB 1253,Relating to subrogation recoveries by the director of the State Employees Division of the Attorney General's Office.,36668,Lt. Gov. David Dewhurst,sponsor,72R,1170,Lt. Gov. David Dewhurst,David Dewhurst
HB 1257,Relating to the regulation of certain code enforcement officers; providing a penalty.,36668,Lt. Gov. David Dewhurst,sponsor,72R,1170,Lt. Gov. David Dewhurst,David Dewhurst
HB 1258,"Relating to the authority of the Consumer Credit Commissioner, the regulation of certain consumer credit practices, and the regulation of pawnshops; providing civil and administrative penalties.",36668,Lt. Gov. David Dewhurst,sponsor,72R,1170,Lt. Gov. David Dewhurst,David Dewhurst
HB 1477,Relating to Central Texas University.,36668,Lt. Gov. David Dewhurst,sponsor,72R,1170,Lt. Gov. David Dewhurst,David Dewhurst
HB 1578,Relating to the commission of special game wardens by the director of the Parks and Wildlife Department.,36668,Lt. Gov. David Dewhurst,sponsor,72R,1170,Lt. Gov. David Dewhurst,David Dewhurst
HB 1583,Relating to certain information filed with the State Board of Insurance and the computation of an automobile experience modifier based on that information.,36668,Lt. Gov. David Dewhurst,sponsor,72R,1170,Lt. Gov. David Dewhurst,David Dewhurst
HB 1666,Relating to the housing in the institutional division of the Texas Department of Criminal Justice of persons punished for violation of probation.,36668,Lt. Gov. David Dewhurst,sponsor,72R,1170,Lt. Gov. David Dewhurst,David Dewhurst
HB 1673,Relating to limiting the authority of a court that sentences a defendant to the institutional division of the Texas Department of Criminal Justice to exercise jurisdiction over the department or its officers or employees.,36668,Lt. Gov. David Dewhurst,sponsor,72R,1170,Lt. Gov. David Dewhurst,David Dewhurst
HB 1688,Relating to child support records and orders.,36668,Lt. Gov. David Dewhurst,sponsor,72R,1170,Lt. Gov. David Dewhurst,David Dewhurst
HB 1843,Relating to notification of certain facilities in which a child resides of the filing or modification of a suit affecting the parent-child relationship in which possession of or access to the child is sought.,36668,Lt. Gov. David Dewhurst,sponsor,72R,1170,Lt. Gov. David Dewhurst,David Dewhurst
HB 1889,Relating to the determinations necessary before withholding or withdrawing life-sustaining procedures under the Natural Death Act.,36668,Lt. Gov. David Dewhurst,sponsor,72R,1170,Lt. Gov. David Dewhurst,David Dewhurst
HB 1985,Relating to participation and credit in the Texas County and District Retirement System.,36668,Lt. Gov. David Dewhurst,sponsor,72R,1170,Lt. Gov. David Dewhurst,David Dewhurst
HB 2136,"Relating to the creation of the Texas Partnership for Economic Development to develop a plan for the advancement of science, technology, and industry in the state.",36668,Lt. Gov. David Dewhurst,sponsor,72R,1170,Lt. Gov. David Dewhurst,David Dewhurst
HB 2153,Relating to the civil liability of Parks and Wildlife Department and Parks and Wildlife Commission members and employees.,36668,Lt. Gov. David Dewhurst,sponsor,72R,1170,Lt. Gov. David Dewhurst,David Dewhurst
HB 2154,Relating to sovereign immunity in judicial actions based on a written contract for improvements to real property.,36668,Lt. Gov. David Dewhurst,sponsor,72R,1170,Lt. Gov. David Dewhurst,David Dewhurst
HB 2183,"Relating to the punishment for the purchase, possession, or consumption of alcoholic beverages by a minor.",36668,Lt. Gov. David Dewhurst,sponsor,72R,1170,Lt. Gov. David Dewhurst,David Dewhurst
HB 2845,Relating to the jurisdiction of the county courts at law in Taylor County.,36668,Lt. Gov. David Dewhurst,sponsor,72R,1170,Lt. Gov. David Dewhurst,David Dewhurst
HCR 58,Honoring Ray Silva and radio station KMXO.,36668,Lt. Gov. David Dewhurst,sponsor,72R,1170,Lt. Gov. David Dewhurst,David Dewhurst
HCR 84,"Commending L. G. ""Dusty"" and Helen Rhodes for their generosity and commitment to the well-being of the children of their community.",36668,Lt. Gov. David Dewhurst,sponsor,72R,1170,Lt. Gov. David Dewhurst,David Dewhurst
HCR 186,Honoring Fort Hood and all of its personnel for their important role in Operation Desert Shield and Operation Desert Storm.,36668,Lt. Gov. David Dewhurst,sponsor,72R,1170,Lt. Gov. David Dewhurst,David Dewhurst
HCR 189,"Commending Telemedical Interactive Consultative Services, Inc., and Project Bluebonnet for their efforts to improve the provision of rural health care.",36668,Lt. Gov. David Dewhurst,sponsor,72R,1170,Lt. Gov. David Dewhurst,David Dewhurst
HCR 243,In memory of Omar Burleson.,36668,Lt. Gov. David Dewhurst,sponsor,72R,1170,Lt. Gov. David Dewhurst,David Dewhurst
HB 1214,Relating to the  petroleum storage tank remediation fund.,36668,Lt. Gov. David Dewhurst,cosponsor,72R,1170,Lt. Gov. David Dewhurst,David Dewhurst
HB 1413,Relating to competitive bidding requirements for personal property in certain school districts.,36668,Lt. Gov. David Dewhurst,cosponsor,72R,1170,Lt. Gov. David Dewhurst,David Dewhurst
SB 5,Relating to courses offered by branch campuses of junior colleges located in certain counties.,36668,Lt. Gov. David Dewhurst,author,716,1170,Lt. Gov. David Dewhurst,David Dewhurst
SB 6,Relating to the dissolution of the Concho County Water Control and Improvement District No. 1.,36668,Lt. Gov. David Dewhurst,author,716,1170,Lt. Gov. David Dewhurst,David Dewhurst
SB 7,Relating to funding of school districts with declining attendance due to the closing or reduction in troops of military bases.,36668,Lt. Gov. David Dewhurst,author,716,1170,Lt. Gov. David Dewhurst,David Dewhurst
SB 13,Relating to emergency appropriations to the institutional division of the Texas Department of Criminal Justice and the Public Utility Commission of Texas.,36668,Lt. Gov. David Dewhurst,author,716,1170,Lt. Gov. David Dewhurst,David Dewhurst
SB 1,Relating to public education.,36668,Lt. Gov. David Dewhurst,coauthor,716,1170,Lt. Gov. David Dewhurst,David Dewhurst
SB 4,"Relating to the basis of fees, charges, and rates for medical assistance provided by certain hospitals serving as primary teaching hospitals for certain institutions of higher education.",36668,Lt. Gov. David Dewhurst,coauthor,716,1170,Lt. Gov. David Dewhurst,David Dewhurst
SR 30,"Declaring that Lieutenant Governor William P. Hobby, Jr., has been the guiding hand for and example to the Texas Senate in its legislative achievements during his 18 years in office.",36668,Lt. Gov. David Dewhurst,coauthor,716,1170,Lt. Gov. David Dewhurst,David Dewhurst
SB 3,Relating to the board of directors of the Nolan County Hospital District.,36668,Lt. Gov. David Dewhurst,author,715,1170,Lt. Gov. David Dewhurst,David Dewhurst
SB 5,Relating to emergency appropriations to the institutional division of the Texas Department of Criminal Justice for projects related to corrections institutions and the Texas Department of Mental Health and Mental....,36668,Lt. Gov. David Dewhurst,author,715,1170,Lt. Gov. David Dewhurst,David Dewhurst
SB 6,Relating to the dissolution of the Concho County Water Control and Improvement District No. 1.,36668,Lt. Gov. David Dewhurst,author,715,1170,Lt. Gov. David Dewhurst,David Dewhurst
SB 7,Relating to funding of school districts with declining attendance due to the closing or reduction in troops of military bases.,36668,Lt. Gov. David Dewhurst,author,715,1170,Lt. Gov. David Dewhurst,David Dewhurst
SB 8,Relating to courses offered by branch campuses of junior colleges located in certain counties.,36668,Lt. Gov. David Dewhurst,author,715,1170,Lt. Gov. David Dewhurst,David Dewhurst
SR 33,Joining the Texas Department of Mental Health and Mental Retardation in expressing its gratitude to the participants for their invaluable contributions to children throughout the Abilene community.,36668,Lt. Gov. David Dewhurst,author,715,1170,Lt. Gov. David Dewhurst,David Dewhurst
SR 34,Congratulating the Evant High School Class of 1990.,36668,Lt. Gov. David Dewhurst,author,715,1170,Lt. Gov. David Dewhurst,David Dewhurst
SR 35,Saluting Judd Wall on the momentous occasion of his high school graduation with best wishes for future success.,36668,Lt. Gov. David Dewhurst,author,715,1170,Lt. Gov. David Dewhurst,David Dewhurst
SB 4,"Relating to the basis of fees, charges, and rates for medical assistance provided by certain hospitals serving as primary teaching hospitals for certain institutions of higher education.",36668,Lt. Gov. David Dewhurst,coauthor,715,1170,Lt. Gov. David Dewhurst,David Dewhurst
HB 24,Relating to the board of directors of the Nolan County Hospital District.,36668,Lt. Gov. David Dewhurst,sponsor,715,1170,Lt. Gov. David Dewhurst,David Dewhurst
HCR 10,Honoring the Rockwell-Dallas chapter of the National Management Association.,36668,Lt. Gov. David Dewhurst,sponsor,715,1170,Lt. Gov. David Dewhurst,David Dewhurst
SB 3,Relating to funding of school districts with declining attendance due to the closing or reduction in troops of military bases.,36668,Lt. Gov. David Dewhurst,author,714,1170,Lt. Gov. David Dewhurst,David Dewhurst
SB 4,Relating to the dissolution of the Concho County Water Control and Improvement District No. 1.,36668,Lt. Gov. David Dewhurst,author,714,1170,Lt. Gov. David Dewhurst,David Dewhurst
SB 5,Relating to emergency appropriations to the institutional division of the Texas Department of Criminal Justice for projects related to corrections institutions and the Texas Department of Mental Health and Mental....,36668,Lt. Gov. David Dewhurst,author,714,1170,Lt. Gov. David Dewhurst,David Dewhurst
SB 6,Relating to the board of directors of the Nolan County Hospital District.,36668,Lt. Gov. David Dewhurst,author,714,1170,Lt. Gov. David Dewhurst,David Dewhurst
SB 88,Relating to courses offered by branch campuses of junior colleges located in certain counties.,36668,Lt. Gov. David Dewhurst,author,714,1170,Lt. Gov. David Dewhurst,David Dewhurst
SR 110,Extending congratulations to Mondel Rogers of Sweetwater on his selection as Texas State Artist.,36668,Lt. Gov. David Dewhurst,author,714,1170,Lt. Gov. David Dewhurst,David Dewhurst
SR 118,Creating the Senate Committee on the Texas State Technical Institute.,36668,Lt. Gov. David Dewhurst,author,714,1170,Lt. Gov. David Dewhurst,David Dewhurst
SB 78,"Relating to the basis of fees, charges, and rates for medical assistance provided by certain hospitals serving as primary teaching hospitals for certain institutions of higher education.",36668,Lt. Gov. David Dewhurst,coauthor,714,1170,Lt. Gov. David Dewhurst,David Dewhurst
HCR 49,"Recognizing May 1, 1990, as Law Day, U.S.A.",36668,Lt. Gov. David Dewhurst,sponsor,714,1170,Lt. Gov. David Dewhurst,David Dewhurst
SB 6,Relating to an emergency appropriation to the Texas Department of Criminal Justice for projects related to corrections institutions.,36668,Lt. Gov. David Dewhurst,author,713,1170,Lt. Gov. David Dewhurst,David Dewhurst
SB 28,Relating to the dissolution of the Concho County Water Control and Improvement District No. 1.,36668,Lt. Gov. David Dewhurst,author,713,1170,Lt. Gov. David Dewhurst,David Dewhurst
SB 37,Relating to average daily attendance in school districts with high military or civil service populations.,36668,Lt. Gov. David Dewhurst,author,713,1170,Lt. Gov. David Dewhurst,David Dewhurst
SB 53,Relating to the board of directors of the Nolan County Hospital District.,36668,Lt. Gov. David Dewhurst,author,713,1170,Lt. Gov. David Dewhurst,David Dewhurst
SR 9,Congratulating Mr. and Mrs. Primo Guiterrez of Sweetwater on their 45th wedding anniversary.,36668,Lt. Gov. David Dewhurst,author,713,1170,Lt. Gov. David Dewhurst,David Dewhurst
SR 48,Commending Mrs. Sue White Mayborn.,36668,Lt. Gov. David Dewhurst,author,713,1170,Lt. Gov. David Dewhurst,David Dewhurst
