bill_name,caption,filer_id,filer_name,function,session
HB 621,Relating to the establishment of the Texas Chiropractic College as a public institution of higher education.,None,Mike Jackson,author,75R
HB 841,Relating to voting procedures for persons on a space flight.,None,Mike Jackson,author,75R
HB 872,Relating to the appraisal of certain real property located in more than one appraisal district.,None,Mike Jackson,author,75R
HB 1228,Relating to consolidated permit processing by the Texas Natural Resource Conservation Commission.,None,Mike Jackson,author,75R
HB 1239,"Relating to the voluntary cleanup program, including municipal tax abatements for certain property located in reinvestment zones and subject to voluntary cleanup agreements.",None,Mike Jackson,author,75R
HB 1254,"Relating to the validation of all acts, governmental proceedings, officials, bonds, and obligations of navigation districts and port authorities.",None,Mike Jackson,author,75R
HB 1614,Relating to the appraisal of signs for ad valorem tax purposes.,None,Mike Jackson,author,75R
HB 1764,Relating to allowing municipalities to purchase goods for retail sale without following competitive bidding procedures.,None,Mike Jackson,author,75R
HB 1793,Relating to eligibility to be awarded a contract by the Texas Transportation Commission.,None,Mike Jackson,author,75R
HB 2133,"Relating to the creation, powers, and duties of the State Office of Risk Management and to provisions of workers' compensation insurance coverage for state employees.",None,Mike Jackson,author,75R
HB 2296,Relating to the servicing of a portable fire extinguisher.,None,Mike Jackson,author,75R
HB 2467,Relating to the regulation of persons engaged in asbestos-related activities.,None,Mike Jackson,author,75R
HB 2776,Relating to the regulation of state superfund sites.,None,Mike Jackson,author,75R
HB 3011,Relating to precommitment approval for certain purchases of a port authority.,None,Mike Jackson,author,75R
HB 3192,Relating to hearings on certain exemptions from permitting procedures under the Texas Clean Air Act.,None,Mike Jackson,author,75R
HB 3219,Relating to the placement of informational signs along certain public highways.,None,Mike Jackson,author,75R
HB 3470,"Amending Section 2001.024, relating to the content of notice required for the adoption of rules.",None,Mike Jackson,author,75R
HB 3564,"Relating to the boundaries, confirmation election, and taxing authority of the Clear Creek Watershed Regional Flood Control District.",None,Mike Jackson,author,75R
HCR 100,"Proclaiming April 12, 1997, Space Explorers' Day in Texas.",None,Mike Jackson,author,75R
HCR 272,"Designating June 9, 1997, International Space University Day in the State of Texas.",None,Mike Jackson,author,75R
HCR 334,Honoring Harris County Commissioner Jim Fonteno for his development of a senior citizens program.,None,Mike Jackson,author,75R
HR 589,Honoring the Houston Yacht Club on the occasion of its 100th anniversary.,None,Mike Jackson,author,75R
HR 657,"Congratulating Jamie Kitchen, Shell Salmon, Stacey Golden, Jeanna Poteet, Angie Gutierrez, Coach Robert Kelly, and Coach Darla Kelly.",None,Mike Jackson,author,75R
HB 547,Relating to the eligibility for release on parole of certain inmates serving sentences for violent offenses.,None,Mike Jackson,author,75R
HB 961,Relating to indemnity provisions in certain agreements for services relating to real property.,None,Mike Jackson,author,75R
HB 1438,Relating to the annexation of industrial areas by certain municipalities.,None,Mike Jackson,author,75R
HB 1442,Relating to the adoption of certain plumbing codes.,None,Mike Jackson,author,75R
HB 1443,Relating to certain standards involving the regulation of air conditioning and refrigeration contractors.,None,Mike Jackson,author,75R
HR 580,"In memory of the Honorable Gary Pinkney Pearson, Jr.",None,Mike Jackson,author,75R
HR 730,Honoring Jim Culberson.,None,Mike Jackson,author,75R
HR 1101,"Recognizing May 25-31, 1997, as Texas Space and Technology Week.",None,Mike Jackson,author,75R
HR 1354,"In memory of Tom ""T-Bone Tom"" Fitzmorris.",None,Mike Jackson,author,75R
HB 11,Relating to the recognition of a same-sex marriage.,None,Mike Jackson,coauthor,75R
HB 276,Relating to parental notification before an abortion may be performed on a minor; providing a criminal penalty.,None,Mike Jackson,coauthor,75R
HB 2245,"Relating to the parent-child relationship, suits affecting the parent-child relationship, and the protection of children.",None,Mike Jackson,coauthor,75R
HCR 81,In memory of Pam Lychner.,None,Mike Jackson,coauthor,75R
HCR 217,Memorializing Congress to restore the federal income tax deductibility of state sales taxes.,None,Mike Jackson,coauthor,75R
HCR 238,Conferring the Texas Legislative Medal of Honor on Technical Sergeant James M. Logan.,None,Mike Jackson,coauthor,75R
SB 23,"Relating to the boundaries, confirmation election, and taxing authority of the Clear Creek Watershed Regional Flood Control District.",None,Mike Jackson,sponsor,75R
SB 492,Relating to the cancellation and removal from the delinquent tax roll of an ad valorem tax on certain real property.,None,Mike Jackson,sponsor,75R
SB 693,Relating to standing to enforce restrictions relating to state property.,None,Mike Jackson,sponsor,75R
SB 804,Relating to allowing municipalities to purchase goods for retail sale without following competitive bidding procedures.,None,Mike Jackson,sponsor,75R
SB 863,Relating to precommitment approval for certain purchases of a port authority.,None,Mike Jackson,sponsor,75R
SB 1715,Relating to required contents in a notice for the adoption of proposed rules by a state agency.,None,Mike Jackson,sponsor,75R
SB 1888,Relating to certain conservation and reclamation districts that are part of more than one municipality.,None,Mike Jackson,sponsor,75R
HB 431,Relating to the offense of theft.,None,Mike Jackson,author,74R
HB 432,Relating to the membership of the board of directors of the La Porte Area Water Authority.,None,Mike Jackson,author,74R
HB 1212,Relating to the safe operation of motor carriers on highways.,None,Mike Jackson,author,74R
HB 1364,Relating to audible warning sounds used by certain industrial facilities.,None,Mike Jackson,author,74R
HB 1589,"Relating to the provision of workers' compensation benefits for certain state employees and to the creation, powers, and duties of the State Office of Risk Management.",None,Mike Jackson,author,74R
HB 1622,Relating to the exemption of a residence homestead from ad valorem taxation by a school district.,None,Mike Jackson,author,74R
HB 1623,Relating to the elimination of dual permitting for wastewater discharges.,None,Mike Jackson,author,74R
HB 1744,Relating  to the appraisal of signs for ad valorem tax purposes.,None,Mike Jackson,author,74R
HB 1775,Relating to permit and license requirements for the Texas Low-Level Radioactive Waste Disposal Authority.,None,Mike Jackson,author,74R
HB 1826,Relating to the approval of disposal system plans by the Texas Natural Resource Conservation Commission.,None,Mike Jackson,author,74R
HB 2049,Relating to the assessment of civil penalties by the Gulf Coast Waste Disposal Authority.,None,Mike Jackson,author,74R
HB 2050,Relating to the compensation of the directors of the Gulf Coast Waste Disposal Authority.,None,Mike Jackson,author,74R
HB 2052,Relating to the regulation of the use and installation of certain fire  detection devices and fire alarms.,None,Mike Jackson,author,74R
HB 2148,Relating to certain structures on coastal public land.,None,Mike Jackson,author,74R
HB 2177,"Relating to the validation of all acts, governmental proceedings, officials, bonds, and obligations of navigation districts.",None,Mike Jackson,author,74R
HB 2296,Relating to the creation of a voluntary cleanup program for solid and hazardous wastes.,None,Mike Jackson,author,74R
HB 2436,Relating to the regulation of persons engaged in asbestos-related activities.,None,Mike Jackson,author,74R
HB 2500,Relating to the appraisal of property located in more than one appraisal district.,None,Mike Jackson,author,74R
HB 2765,Relating to certain Texas Department of Transportation statutes and rules governing highway construction contracts.,None,Mike Jackson,author,74R
HCR 174,Honoring the city of Friendswood's Centennial Celebration.,None,Mike Jackson,author,74R
HCR 188,Rejecting NASA contentions regarding the Johnson Space Center and memorializing congress to countermand the NASA proposal to consolidate and downsize the operations of the center.,None,Mike Jackson,author,74R
HCR 223,"Honoring Chelsi Smith, Miss Universe 1995.",None,Mike Jackson,author,74R
HJR 75,Proposing a constitutional amendment to authorize the voters of a school district to adopt or determine the amount of a residence homestead exemption from ad valorem taxation by the district.,None,Mike Jackson,author,74R
HR 237,Congratulating La Porte Volunteer Fire Department Assistant Chief James Crate on being named Texas Fire Fighter of the Year.,None,Mike Jackson,author,74R
HR 238,Congratulating La Porte Police Sergeant Ron Parker on being named Texas Police Officer of the Year.,None,Mike Jackson,author,74R
HR 547,Honoring Leon Grevenberg on his 100th birthday.,None,Mike Jackson,author,74R
HR 863,Honoring William E. Crowder for his contributions as a dedicated civic leader of La Porte.,None,Mike Jackson,author,74R
HR 912,"Honoring Earl Tischofer, executive director of the North NASA Area Association of Realtors.",None,Mike Jackson,author,74R
HR 183,Congratulating Sallie Ann Langseth on her selection as Secondary School Teacher of the Year.,None,Mike Jackson,author,74R
HR 670,In memory of Fred Ernest Gray.,None,Mike Jackson,author,74R
HB 2473,"Relating to audits to determine compliance with certain laws, rules, and regulations; providing penalties.",None,Mike Jackson,coauthor,74R
HB 2593,Relating to rates for commercial windstorm and hail insurance coverage through the Texas Catastrophe Property Insurance Association.,None,Mike Jackson,coauthor,74R
HCR 158,Directing the State Preservation Board to restore the Capitol chapel.,None,Mike Jackson,coauthor,74R
HR 297,Commending George Foreman.,None,Mike Jackson,coauthor,74R
HR 351,Commending the Texas Federation of Republican Women.,None,Mike Jackson,coauthor,74R
SCR 49,Commending the Texas oyster industry for maintaining high standards of quality.,None,Mike Jackson,sponsor,74R
SCR 75,Congratulating the University of Houston-Clear Lake for two decades of superior service to the State of Texas.,None,Mike Jackson,sponsor,74R
HB 450,Relating to the safe operation of motor carriers on highways.,None,Mike Jackson,author,73R
HB 672,Relating to the use of certain municipal hotel occupancy tax revenue for a manned space flight tourism facility.,None,Mike Jackson,author,73R
HB 861,Relating to contractual agreements between the Texas Higher Education Coordinating Board and Texas Chiropractic College.,None,Mike Jackson,author,73R
HB 896,Relating to a restriction of the use of certain indemnity provisions in construction contracts.,None,Mike Jackson,author,73R
HB 897,Relating to the sales and use tax on gasoline.,None,Mike Jackson,author,73R
HB 898,Relating to the application of certain statutes of limitation to certain districts and entities.,None,Mike Jackson,author,73R
HB 914,Relating to appraisal district budget and financing.,None,Mike Jackson,author,73R
HB 1072,Relating to the responsibility of persons involved in construction.,None,Mike Jackson,author,73R
HMM 44,Paying tribute to the life of Officer Jeffery Dean Gunn of the Pasadena Police Department.,None,Mike Jackson,author,73R
HR 230,Honoring Librarian Jo Hofstetter on the occasion of her retirement.,None,Mike Jackson,author,73R
HR 239,Expressing support for continued funding of the Space Station Freedom program.,None,Mike Jackson,author,73R
HR 347,"Recognizing June 12 and 13, 1993, as Galveston Bay Weekend.",None,Mike Jackson,author,73R
HR 365,Honoring the legislative and governmental affairs division of the Deer Park Chamber of Commerce and welcoming them to the Capitol.,None,Mike Jackson,author,73R
HR 390,Honoring Jack R. Oliphant on the occasion of his retirement.,None,Mike Jackson,author,73R
HR 529,"Declaring April 12-13, 1993, Pasadena Days at the State Capitol.",None,Mike Jackson,author,73R
HR 574,Paying tribute to the life of Officer Jeffery Dean Ginn of the Pasadena Police Department.,None,Mike Jackson,author,73R
HR 634,Honoring Deer Park Mayor Jimmy Burke on his record of achievements.,None,Mike Jackson,author,73R
HB 51,Relating to the creation of a stalking offense.,None,Mike Jackson,coauthor,73R
HB 487,Relating to the abolition of the Adolescent Pregnancy and Parenthood Advisory Council.,None,Mike Jackson,coauthor,73R
HB 729,Relating to the county in which a defendant released on parole or mandatory supervision must reside as a condition of release.,None,Mike Jackson,coauthor,73R
HB 938,Relating to course materials and instruction in human sexuality.,None,Mike Jackson,coauthor,73R
HB 1965,Relating to the creation of metropolitan rapid transit authorities.,None,Mike Jackson,coauthor,73R
HR 545,Paying tribute to the life of Officer Gary C. Hires of the Haltom City Police Department.,None,Mike Jackson,coauthor,73R
SB 201,Relating to contractual agreements between the Texas Higher Education Coordinating Board and Texas Chiropractic College and Parker College of Chiropractic.,None,Mike Jackson,sponsor,73R
HR 44,Commending the employees of Solvay Interox for their numerous contributions to the Deer Park community and congratulating the company on being named 1992 Industry of the Year by the Deer Park Chamber of Commerce.,None,Mike Jackson,author,724
HR 112,Commending the Honorable Gibson D. (Gib) Lewis on his long and distinguished tenure as speaker of the Texas House of Representatives and extending sincere appreciation to him for his many years of outstanding service on behalf of the legislature and the citizens of Texas.,None,Mike Jackson,coauthor,724
HR 81,Commemorating the La Porte Centennial.,None,Mike Jackson,author,723
HR 82,Honoring the Deer Park Centennial.,None,Mike Jackson,author,723
SCR 3,Expressing appreciation to the people of the City of Deer Park and extending best wishes for a joyous celebration in honor of the city's 100th anniversary.,None,Mike Jackson,sponsor,723
SCR 4,Extending best wishes to all citizens of La Porte for a most joyous and festive 100th birthday.,None,Mike Jackson,sponsor,723
SCR 5,Commending Ben G. Levisee for his record of exemplary work with credit unions.,None,Mike Jackson,sponsor,723
HR 41,Commending Richard Florance for his outstanding service to his community.,None,Mike Jackson,author,722
HR 151,Commending Roger C. Threde for his remarkable accomplishments.,None,Mike Jackson,author,721
HR 152,"Honoring Robert H. Williams, Jr. on the occasion of his retirement.",None,Mike Jackson,author,721
HR 217,Honoring Representative Steve Holzheauser on the occasion of his birthday.,None,Mike Jackson,author,721
HR 198,In memory of Fred Hartman.,None,Mike Jackson,author,721
HB 218,Relating to a review of state services by the comptroller of public accounts.,None,Mike Jackson,coauthor,721
HJR 6,Proposing a constitutional amendment to prohibit a personal income tax.,None,Mike Jackson,coauthor,721
HR 253,In memory of Representative Larry Q. Evans.,None,Mike Jackson,coauthor,721
SCR 4,Honoring the veterans of the United States Armed Forces.,None,Mike Jackson,sponsor,721
HB 571,Relating to the notice requirement for competitive bids or proposals for municipal contracts.,None,Mike Jackson,author,72R
HB 1191,Relating to permitting certain federal criminal investigators to carry weapons.,None,Mike Jackson,author,72R
HB 1423,Relating to noise regulation of sport shooting ranges.,None,Mike Jackson,author,72R
HB 1424,Relating to an exemption from fishing license fees for handicapped persons.,None,Mike Jackson,author,72R
HB 1425,Relating to the identification of crab traps.,None,Mike Jackson,author,72R
HB 1447,Relating to the collection of fees on conviction of certain offenses involving the dishonor of a check.,None,Mike Jackson,author,72R
HB 1581,Relating to the inclusion of a household hazardous waste collection program in a local or regional solid waste management plan.,None,Mike Jackson,author,72R
HB 2194,Relating to the sale of protected game fish species; providing penalties.,None,Mike Jackson,author,72R
HB 2195,Relating to the seizure and disposition of illegal fishing devices.,None,Mike Jackson,author,72R
HB 2196,Relating to a restriction of the use of certain indemnity provisions in construction contracts.,None,Mike Jackson,author,72R
HB 2583,Relating to the counting and form of certain ballots.,None,Mike Jackson,author,72R
HCR 109,Encouraging manufacturers to eliminate heavy metals from the production of household paints and printing inks.,None,Mike Jackson,author,72R
HCR 160,"Supporting the passage of H.R. 1223 by the Congress of the United States, directing the Secretary of the Army to remove a railroad swing bridge crossing Clear Creek, Texas.",None,Mike Jackson,author,72R
HR 107,"Honoring the City of La Porte Support the Troops Rally on February 5, 1991, and our troops serving in the Persian Gulf.",None,Mike Jackson,author,72R
HR 304,Welcoming the chaplains participating in the Gulf Coast Maritime Conference to Texas.,None,Mike Jackson,author,72R
HR 933,Honoring Jim Gaudet for his exemplary record of service and achievement.,None,Mike Jackson,author,72R
HB 30,Relating to exempting from ad valorem taxation certain property of organizations of members or veterans of the armed forces.,None,Mike Jackson,coauthor,72R
HB 124,"Relating to the manner in which maximum capacity is established or increased for units in the institutional division of the Texas Department of Criminal Justice, to the manner in which the systemwide capacity of the institutional division is increased, and to the housing of inmates in the institutional division.",None,Mike Jackson,coauthor,72R
HJR 10,"Proposing a constitutional amendment providing for equal educational opportunity and authorizing the legislature to determine the methods by which school districts are formed, school district taxes are assessed and collected, and state funds appropriated to school districts are allocated.",None,Mike Jackson,coauthor,72R
SB 215,Relating to noise regulation of sport shooting ranges.,None,Mike Jackson,sponsor,72R
SCR 33,Commending Mrs. Bea Ramirez Svambera and her students on their excellent contribution to the preservation of the history of Texas.,None,Mike Jackson,sponsor,72R
HB 22,Relating to the procedures for adding territory to certain rapid transit authorities.,None,Mike Jackson,author,716
HR 61,Congratulating the San Jacinto College North Baseball Team.,None,Mike Jackson,author,716
HB 52,"Relating to drug-free zones and to the imposition of penalties for the delivery, manufacture, or possession with the intent to deliver or manufacture a controlled substance in drug-free zones.",None,Mike Jackson,coauthor,716
HB 6,Relating to the procedures for adding territory to certain rapid transit authorities.,None,Mike Jackson,author,715
HR 154,Commending Pamela Barrett.,None,Mike Jackson,author,715
HB 4,Relating to the procedures for adding territory to certain rapid transit authorities.,None,Mike Jackson,author,714
HR 169,In memory of Dorothy Elois Wofford Byars.,None,Mike Jackson,author,714
HB 33,Relating to the procedures for adding territory to certain rapid transit authorities.,None,Mike Jackson,author,713
HR 108,Congratulating Jack and Ellie Jackson on their 40th anniversary.,None,Mike Jackson,author,713
HB 27,Relating to the procedures for adding territory to certain rapid transit authorities.,None,Mike Jackson,author,712
HR 132,In memory of Thomas W. Records.,None,Mike Jackson,author,712
HR 170,In memory of Bruce Porter.,None,Mike Jackson,author,712
HCR 2,Commending members of the Channel Industries Mutual Aid Organization.,None,Mike Jackson,coauthor,712
HR 148,Congratulating Betty and Gaston Groos on the birth of Hollie Solms Groos.,None,Mike Jackson,author,711
HCR 18,Calling on Congress to submit to the states a constitutional amendment protecting the American flag from willful burning or destruction.,None,Mike Jackson,coauthor,711
HB 1303,Relating to commercial hazardous waste incinerators.,None,Mike Jackson,author,71R
HB 1304,Relating to credit in the Texas Municipal Retirement System for military service.,None,Mike Jackson,author,71R
HB 1393,Relating to the validation of certain municipal consolidations.,None,Mike Jackson,author,71R
HB 1394,Relating to the validation of certain municipal annexations.,None,Mike Jackson,author,71R
HB 2149,Relating to personnel files and photographs of police officers and fire fighters in certain municipalities.,None,Mike Jackson,author,71R
HB 2150,Relating to the counting and form of certain ballots.,None,Mike Jackson,author,71R
HB 3198,"Relating to the creation, extension, or modification of restrictive covenants applicable to certain residential subdivisions.",None,Mike Jackson,author,71R
HCR 277,Congratulating the Deer Park High School Academic Decathlon Team.,None,Mike Jackson,author,71R
HR 383,Congratulating the La Porte High School Lady Bulldogs.,None,Mike Jackson,author,71R
HR 527,In memory of William James Metcalfe.,None,Mike Jackson,author,71R
HR 746,Honoring Dr. Ella Van Fleet.,None,Mike Jackson,author,71R
HR 840,Honoring Karl and Loretta Johnston on their 50th wedding anniversary.,None,Mike Jackson,author,71R
HR 851,Congratulating the Deer Park High School Academic Decathlon Team.,None,Mike Jackson,author,71R
HR 1064,Honoring Jake Bussey.,None,Mike Jackson,author,71R
HR 1065,Honoring Sonja Angelo.,None,Mike Jackson,author,71R
HR 1066,Honoring Fritz Lanham.,None,Mike Jackson,author,71R
HR 1134,Congratulating Representative and Mrs. Dan Shelley on the birth of their son Daniel Shelley.,None,Mike Jackson,author,71R
HB 1,"Relating to the reform of the workers' compensation system; to the creation, powers, and duties of the Texas Workers' Compensation Commission; to work safety; authorizing an appropriation; providing criminal and....",None,Mike Jackson,coauthor,71R
HB 631,Relating to an emergency appropriation to defray the expense of staff group insurance at public junior and community colleges.,None,Mike Jackson,coauthor,71R
HB 818,Relating to the provision of extended metropolitan calling telephone service in certain counties.,None,Mike Jackson,coauthor,71R
HB 980,"Relating to the deadline for filing an application for a place on the ballot in a water control and improvement district election, a municipal utility district election, a water improvement district election, an....",None,Mike Jackson,coauthor,71R
HB 987,Relating to the consent to abortion for certain minors; providing penalties.,None,Mike Jackson,coauthor,71R
HB 1422,"Relating to the punishments for certain misdemeanors, to the amounts of pecuniary loss for certain offenses as those amounts affect punishments for the offenses, and to the jurisdiction of county, justice, and....",None,Mike Jackson,coauthor,71R
HB 1432,Relating to the establishment of a council to explore possibilities for compact agreements regarding trade and other matters with the bordering states of Mexico.,None,Mike Jackson,coauthor,71R
HB 1946,Relating to the creation of the Gulf Coast Environmental Research Consortium.,None,Mike Jackson,coauthor,71R
HB 2166,Relating to spills or releases of hazardous substances into waters in this state.,None,Mike Jackson,coauthor,71R
HB 2167,Relating to the annual reporting of toxic chemical releases.,None,Mike Jackson,coauthor,71R
HB 2300,"Relating to awards, incentives, and assistance for certain schools, school districts, and students, to the qualifications of school principals, to the accreditation of public schools, and to educational economic....",None,Mike Jackson,coauthor,71R
HB 2508,Relating to rates to be charged for insurance on certain property and risks located seaward of the Intracoastal Canal.,None,Mike Jackson,coauthor,71R
HB 2979,Relating to the regulation of hazardous waste management in Texas; restricting hazardous waste from disposal at municipal solid waste facilities.,None,Mike Jackson,coauthor,71R
HB 2980,"Relating to the imposition of fees on the storage, processing and disposal of hazardous waste at commercial hazardous waste storage, processing and disposal facilities in the state.",None,Mike Jackson,coauthor,71R
HCR 150,"Requesting that the federal government implement policies to insure that each state develop adequate and environmentally sound options for the storage, processing and disposal of hazardous wastes.",None,Mike Jackson,coauthor,71R
HCR 151,"Directing the Texas Water Commission to explore the efficacy of entering into a compact with the states of Oklahoma, Louisiana, and Arkansas and such other states for the purposes of establishing....",None,Mike Jackson,coauthor,71R
HCR 212,"Commending Ben Brown, 1989 Texas State Poster Child.",None,Mike Jackson,coauthor,71R
HJR 20,Proposing a constitutional amendment to prohibit the imposition of personal net income taxes.,None,Mike Jackson,coauthor,71R
HR 596,Honoring Governor William P. Clements on his birthday.,None,Mike Jackson,coauthor,71R
