bill_name,caption,filer_id,filer_name,function,session
HB 3617,"Relating to the creation, administration, powers, duties, operation, and financing of the Kingsborough Municipal Utility District No. 6 of Kaufman County.",None,Bob Deuell,sponsor,78R
HB 3618,"Relating to the creation, administration, powers, duties, operation, and financing of the Kingsborough Municipal Utility District No. 5 of Kaufman County.",None,Bob Deuell,sponsor,78R
HB 3619,"Relating to the creation, administration, powers, duties, operation, and financing of the Kingsborough Municipal Utility District No. 4 of Kaufman County.",None,Bob Deuell,sponsor,78R
HB 3620,"Relating to the creation, administration, powers, duties, operation, and financing of the Kingsborough Municipal Utility District No. 3 of Kaufman County.",None,Bob Deuell,sponsor,78R
HB 3621,"Relating to the creation, administration, powers, duties, operation, and financing of the Kingsborough Municipal Utility District No. 2 of Kaufman County.",None,Bob Deuell,sponsor,78R
HB 3622,"Relating to the creation, administration, powers, duties, operation, and financing of the Kingsborough Municipal Utility District Nos. 1, 2, 3, 4, and 5 of Kaufman County.",None,Bob Deuell,sponsor,78R
HCR 85,Saluting volunteers in the State of Texas.,None,Bob Deuell,sponsor,78R
HCR 257,In memory of Jesse W. Orr of the Birthright community.,None,Bob Deuell,sponsor,78R
HCR 274,In memory of Quentin Miller of Cooper.,None,Bob Deuell,sponsor,78R
SB 17,Relating to the exemption of property in this state from the satisfaction of another state's judgment for unpaid income taxes on certain retirement benefits.,None,Bob Deuell,author,73R
SB 157,Relating to peace officers of medical facilities in certain municipalities.,None,Bob Deuell,author,73R
SB 158,Relating to authority to regulate underground water.,None,Bob Deuell,author,73R
SB 163,Relating to the protection of buildings and grounds at and regulation of private institutions of higher education; providing penalties.,None,Bob Deuell,author,73R
SB 169,Relating to venue for redistricting suits.,None,Bob Deuell,author,73R
SB 196,Relating to the residency and certain duties of public weighers.,None,Bob Deuell,author,73R
SB 237,Relating to a temporary credit for certain franchise taxes paid by a corporation.,None,Bob Deuell,author,73R
SB 238,Relating to the priority of claims on liquidation of a state or private bank or on a purchase of assets and assumption of liabilities of a state bank.,None,Bob Deuell,author,73R
SB 306,Relating to combining certain county election precincts.,None,Bob Deuell,author,73R
SB 315,Relating to the application of the professional prosecutors law to certain district and county attorneys.,None,Bob Deuell,author,73R
SB 405,Relating to the continuation of the Texas Department of Commerce.,None,Bob Deuell,author,73R
SB 419,Relating to the University of North Texas.,None,Bob Deuell,author,73R
SB 420,Relating to requiring a gas utility to refund illegal or unlawful compensation collected by the utility.,None,Bob Deuell,author,73R
SB 421,Relating to the requirement of notice of requests by gas utilities for rate increases and to the statutory procedures for approval and refund of temporary rates in gas utility rate cases.,None,Bob Deuell,author,73R
SB 425,Relating to the dates of the general and runoff primary elections.,None,Bob Deuell,author,73R
SB 442,Relating to the use of herbicides in certain counties.,None,Bob Deuell,author,73R
SB 499,"Relating to abolishing certain district courts, creating additional district courts, and the election of district court judges in certain counties.",None,Bob Deuell,author,73R
SB 500,"Relating to temporary reciprocal licenses for certain physicians, the relationship between hospitals and other health care providers in rural areas, establishing a program to assist certain nonprofit organizations in recruiting and retaining health professionals to practice in medically underserved areas, the distribution of certain fees collected and tuition charged at medical schools.",None,Bob Deuell,author,73R
SB 527,Relating to the election of justices of the supreme court and judges of the court of criminal appeals from single-member districts.,None,Bob Deuell,author,73R
SB 543,Relating to the operations of a grand jury; providing penalties.,None,Bob Deuell,author,73R
SB 566,Relating to the return of a warrant or check issued by a county.,None,Bob Deuell,author,73R
SB 577,Relating to collection of certain amounts in relation to proof of financial responsibility by an operator of a motor vehicle.,None,Bob Deuell,author,73R
SB 578,Relating to the authority of a municipality to adopt an additional sales and use tax.,None,Bob Deuell,author,73R
SB 584,Relating to benefits for state employees.,None,Bob Deuell,author,73R
SB 588,Relating to the designation of responsibility for the transporting of juvenile offenders.,None,Bob Deuell,author,73R
SB 621,Relating to the continuation and functions of the Texas State Board of Pharmacy and to the regulation of the practice of pharmacy; providing penalties.,None,Bob Deuell,author,73R
SB 622,Relating to the continuation of the Texas Alcoholic Beverage Commission and to the regulation of alcoholic beverages and bingo; providing penalties.,None,Bob Deuell,author,73R
SB 623,Relating to the continuation and functions of the State Board of Veterinary Medical Examiners and to the regulation of the practice of veterinary medicine and the administration of dangerous drugs to animals; providing penalties.,None,Bob Deuell,author,73R
SB 632,Relating to the service areas of certain public utilities.,None,Bob Deuell,author,73R
SB 644,Relating to the use of herbicides in certain counties; providing a penalty.,None,Bob Deuell,author,73R
SB 656,Relating to the election of justices of the courts of appeals by place.,None,Bob Deuell,author,73R
SB 666,Relating to the cancellation of an application for an early voting ballot to be voted by mail.,None,Bob Deuell,author,73R
SB 690,"Relating to the regulation of the practice of physical therapy and occupational therapy, including the creation of the Executive Council of Physical Therapy and Occupational Therapy Examiners and the continuation and modification of the Texas Board of Physical Therapy Examiners and The Texas Advisory Board of Occupational Therapy.",None,Bob Deuell,author,73R
SB 795,Relating to voluntary payroll deductions for state employees for charitable organizations; making an appropriation.,None,Bob Deuell,author,73R
SB 823,Relating to authorizing the issuance of revenue bonds for the University of North Texas.,None,Bob Deuell,author,73R
SB 844,Relating to tax credits for the discovery of new oil or gas fields.,None,Bob Deuell,author,73R
SB 845,Relating to tax exemption for oil and gas wells returned to productive status after three years of inactivity.,None,Bob Deuell,author,73R
SB 945,Relating to the allocation of the judicial and court personnel training fund.,None,Bob Deuell,author,73R
SB 979,Relating to the establishment of an education tariff for certain telecommunications services.,None,Bob Deuell,author,73R
SB 1003,Relating to the regulation of physician assistants; providing a criminal penalty.,None,Bob Deuell,author,73R
SB 1005,"Relating to technical and substantive amendments to the laws relating to ethics of public servants, including laws governing the Texas Ethics Commission, communications to influence legislation or administrative action, the filing of personal financial statements, conflicts of interest, the giving or acceptance of certain benefits, and political funds and political advertising; providing civil and criminal penalties.",None,Bob Deuell,author,73R
SB 1006,Relating to the regulation of persons who communicate to influence legislation or administrative action and to benefits accepted by public servants.,None,Bob Deuell,author,73R
SB 1007,Relating to the reapportionment of judicial districts.,None,Bob Deuell,author,73R
SB 1013,Relating to procedures regarding the cancellation of the voter registrations of persons whose names appear on the lists of returned registration certificates.,None,Bob Deuell,author,73R
SB 1107,Relating to the regulation of physician assistants; providing a criminal penalty.,None,Bob Deuell,author,73R
SB 1108,Relating to providing incentives for certain health care professionals to provide certain charity care services.,None,Bob Deuell,author,73R
SB 1109,Relating to procedural requirements for hearing solid waste permit applications.,None,Bob Deuell,author,73R
SB 1110,"Relating to state regulation and assistance in the field of fire protection, including the powers and duties of the Texas Commission on Fire Protection; providing a penalty.",None,Bob Deuell,author,73R
SB 1125,Relating to the right of a motorcycle operator to complete a motorcylce operator training course to have a misdemeanor traffic violation charge dismissed.,None,Bob Deuell,author,73R
SB 1193,Relating to the participation of appraisal districts in emergency communications programs.,None,Bob Deuell,author,73R
SB 1194,Relating to providing 9-1-1 emergency service to certain residential facilities; providing criminal penalties.,None,Bob Deuell,author,73R
SB 1195,Relating to representation of the Office of the State Long-Term Care Ombudsman of the Department on Aging.,None,Bob Deuell,author,73R
SB 1196,"Relating to certain expenditures and contributions under Title 15, Election Code.",None,Bob Deuell,author,73R
SB 1274,Relating to the authority of the Parks and Wildlife Department to establish a checkpoint on a public highway to determine whether a person possesses a wildlife resource in violation of the Parks and Wildlife Code.,None,Bob Deuell,author,73R
SB 1275,Relating to the regulation of auctioneers.,None,Bob Deuell,author,73R
SB 1307,Relating to the numbers assigned to certain state senate districts.,None,Bob Deuell,author,73R
SB 1314,Relating to the creation of a multicounty statutory county court composed of Fisher and Nolan counties.,None,Bob Deuell,author,73R
SB 1323,Relating to prepaid funeral services or merchandise.,None,Bob Deuell,author,73R
SB 1387,Relating to the creation of municipal courts of record in Denton.,None,Bob Deuell,author,73R
SB 1459,Relating to unpaid leave for state employees for job-related education or service with a state employee organization.,None,Bob Deuell,author,73R
SB 1460,Relating to the farm and ranch finance program; granting the authority to issue bonds; providing penalties.,None,Bob Deuell,author,73R
SCR 2,"Granting the Texas YMCA Youth and Government Program permission to use the House Chamber of the State Capitol on February 25, 26, and 27 in 1993 and February 17, 18, and 19 in 1994.",None,Bob Deuell,author,73R
SCR 24,"Granting J. E. Isbell, Inc., permission to sue the State of Texas and the Parks and Wildlife Department.",None,Bob Deuell,author,73R
SCR 28,Expressing the intent of the legislature that district court judges in counties that are subject to the LULAC case be elected from places composed of less than whole counties.,None,Bob Deuell,author,73R
SCR 37,Commending the remarkable life of Dr. Gideon Lincecum and recognizing his magnificent contributions to his adopted state and the world.,None,Bob Deuell,author,73R
SJR 5,Proposing a constitutional amendment relating to assessments on cotton producers to promote boll weevil eradication.,None,Bob Deuell,author,73R
SJR 12,Proposing a constitutional amendment to allow judges and other government officeholders to be eligible to serve in the Texas Legislature during their terms of office.,None,Bob Deuell,author,73R
SJR 23,Proposing a constitutional amendment relating to the composition of the supreme court and the court of criminal appeals and authorizing the legislature to provide for the election of judges of those courts from single-member districts.,None,Bob Deuell,author,73R
SJR 24,Proposing a constitutional amendment authorizing the legislature to provide for the election of justices to the courts of appeals by place.,None,Bob Deuell,author,73R
SJR 26,Proposing a constitutional amendment to increase the number of members on the Texas Ethics Commission and to require vacancies to be filled expeditiously.,None,Bob Deuell,author,73R
SJR 27,Proposing a constitutional amendment authorizing the legislature to provide for the election of district judges by place.,None,Bob Deuell,author,73R
SR 182,Congratulating Texas Ranger Charles Kenneth Fleming upon his retirement.,None,Bob Deuell,author,73R
SR 415,"Declaring April 24, 1993, as ""Clean Wichita River Day"" and commending the participants for their efforts to preserve the natural wonder and vitality of this important resource.",None,Bob Deuell,author,73R
SR 512,Encouraging the attorney general of Texas to settle the cases of Rangel v. Mattox and LULAC of Texas v. State of Texas.,None,Bob Deuell,author,73R
SR 520,Recognizing Marilyn Lancaster for her contributions as President of the Texas Junior College Teachers Association.,None,Bob Deuell,author,73R
SR 1069,"Requesting state-funded medical schools and health science centers, the Texas Department of Health, the Center for Rural Health Initiatives, the Texas Higher Education Coordinating Board, the Texas Academy of Family Physicians, the Texas Pediatric Society, the Texas Society of Internal Medicine, and the Texas Medical Association to heighten public awareness of the continuing need for primary care physicians.",None,Bob Deuell,author,73R
SR 1153,"Suspending limitations on conference committee jurisdiction, HB 1445.",None,Bob Deuell,author,73R
SR 1163,"Suspending limitations on conference committee jurisdiction, S.B. 421.",None,Bob Deuell,author,73R
SR 1191,"Honoring Jimmy Granado of Tulia, whose heroic action saved the life of his close friend, Jerry Don Williams.",None,Bob Deuell,author,73R
SB 229,Relating to the administration of a statewide plan for child support by the attorney general's office.,None,Bob Deuell,author,73R
SB 300,Relating to the commissioner of higher education.,None,Bob Deuell,author,73R
SB 1334,Relating to the rulemaking authority of the Texas Water Commission regarding underground water.,None,Bob Deuell,author,73R
SB 1458,Relating to the regulation of licensed psychological specialists and to the creation of the Texas State Board of Examiners of Licensed Psychological Specialists; providing a penalty.,None,Bob Deuell,author,73R
SCR 71,Designating the City of Denton as the Redbud Capital of Texas.,None,Bob Deuell,author,73R
SR 521,Allowing for the at-large election system for the state district courts in the nine affected counties to be replaced by a phased-in plan.,None,Bob Deuell,author,73R
SB 2,Relating to the application of the doctrine of forum non conveniens to certain actions.,None,Bob Deuell,coauthor,73R
SB 4,Relating to products liability.,None,Bob Deuell,coauthor,73R
SB 25,"Relating to the offense of harassment and including within that offense conduct that constitutes stalking; providing limitations on release on bond, furlough, probation, and parole; and providing notification.",None,Bob Deuell,coauthor,73R
SB 33,Relating to district offices of the Texas Department of Transportation.,None,Bob Deuell,coauthor,73R
SB 155,Relating to the creation of the Texas Commission on Children and Youth.,None,Bob Deuell,coauthor,73R
SB 168,Relating to the classification of sexual assault as aggravated sexual assault if more than one individual engages in conduct directed toward the same victim.,None,Bob Deuell,coauthor,73R
SB 266,Relating to immunizations.,None,Bob Deuell,coauthor,73R
SB 308,Relating to the age at which a child is allowed to accompany a parent to a voting station.,None,Bob Deuell,coauthor,73R
SB 364,Relating to infant and child immunization requirements.,None,Bob Deuell,coauthor,73R
SB 373,"Relating to the regulation of the sale, distribution, or use of cigarettes and tobacco products; providing penalties.",None,Bob Deuell,coauthor,73R
SB 379,"Relating to abolishing certain district courts, creating additional district courts, and the election of district court judges in certain counties.",None,Bob Deuell,coauthor,73R
SB 456,Relating to the punishment for certain offenses motivated by bias or prejudice and to the conditions of community supervsion or parole of persons convicted of that offense.,None,Bob Deuell,coauthor,73R
SB 466,Relating to the qualification of oil from new or expanded enhanced recovery projects for special tax rates.,None,Bob Deuell,coauthor,73R
SB 778,Relating to the dedication of certain funds for the use of the Texas Commission on the Arts.,None,Bob Deuell,coauthor,73R
SB 1163,Relating to public school education and to certain programs financed under the foundation school program.,None,Bob Deuell,coauthor,73R
SB 1408,Relating to discrimination by certain accommodations and associations; imposing civil penalties.,None,Bob Deuell,coauthor,73R
SJR 13,Proposing a constitutional amendment relating to the amount and expenditure of certain constitutionally dedicated funding for public institutions of higher education.,None,Bob Deuell,coauthor,73R
SJR 42,Proposing a constitutional amendment providing for a 55-day budget session of the legislature in even-numbered years and an annual state budget.,None,Bob Deuell,coauthor,73R
SJR 49,"Proposing a constitutional amendment prohibiting a personal income tax without voter approval and dedicating the proceeds of the tax, if enacted, to education and property tax relief.",None,Bob Deuell,coauthor,73R
SR 1155,Expressing the intention of the Senate of the State of Texas that the institutions of higher education of South Texas and along the border receive adequate support from the Texas Higher Education Coordinating Board.,None,Bob Deuell,coauthor,73R
HB 74,Relating to certain processes and procedures connected with the registration of voters; providing a criminal penalty.,None,Bob Deuell,sponsor,73R
HB 75,Relating to certain election processes and procedures; providing criminal penalties.,None,Bob Deuell,sponsor,73R
HB 76,Relating to the accessibility of a polling place or a precinct convention to the elderly and physically handicapped.,None,Bob Deuell,sponsor,73R
HB 372,Relating to peace officers of hospitals in certain municipalities.,None,Bob Deuell,sponsor,73R
HB 384,Relating to the authority of a municipality to adopt an additional sales and use tax.,None,Bob Deuell,sponsor,73R
HB 603,Relating to the admission of foreign exchange students to the public free schools.,None,Bob Deuell,sponsor,73R
HB 605,Relating to the forfeiture of proceeds from the commission of certain offenses and to the compensation of crime victims.,None,Bob Deuell,sponsor,73R
HB 629,Relating to riding a bicycle on a shoulder of a street or highway.,None,Bob Deuell,sponsor,73R
HB 638,Relating to combining certain county election precincts.,None,Bob Deuell,sponsor,73R
HB 689,Relating to the form of a punch-card ballot in regard to straight-party voting.,None,Bob Deuell,sponsor,73R
HB 756,Relating to the regulation of the practice of professional nursing.,None,Bob Deuell,sponsor,73R
HB 903,Relating to payroll deductions for state employees for credit union membership and for contributions to charitable organizations; making an appropriation.,None,Bob Deuell,sponsor,73R
HB 1146,Relating to statistical reporting by aquatic products dealers.,None,Bob Deuell,sponsor,73R
HB 1224,Relating to the creation of a county court at law in Wilbarger County.,None,Bob Deuell,sponsor,73R
HB 1309,Relating to the composition and authority of the Texas Agricultural Finance Authority.,None,Bob Deuell,sponsor,73R
HB 1377,Relating to the return of a warrant or check issued by a county.,None,Bob Deuell,sponsor,73R
HB 1445,Relating to the continuation of the Texas Alcoholic Beverage Commission and to the regulation of alcoholic beverages; providing penalties.,None,Bob Deuell,sponsor,73R
HB 1544,Relating to providing 9-1-1 emergency service to certain residential facilities.,None,Bob Deuell,sponsor,73R
HB 1674,Relating to the participation of appraisal districts in emergency communications programs.,None,Bob Deuell,sponsor,73R
HB 1684,Relating to the farm and ranch finance program; granting the authority to issue bonds; providing penalties.,None,Bob Deuell,sponsor,73R
HB 1773,Relating to the use of in-house counsel by the Banking Department of Texas.,None,Bob Deuell,sponsor,73R
HB 1945,Relating to the definition and operation of personal watercraft.,None,Bob Deuell,sponsor,73R
HB 1974,Relating to tax credits for the discovery of new oil or gas fields.,None,Bob Deuell,sponsor,73R
HB 1975,Relating to tax exemption for oil and gas wells returned to productive status after three years of inactivity.,None,Bob Deuell,sponsor,73R
HB 2227,Relating to the regulation of auctioneers.,None,Bob Deuell,sponsor,73R
HB 2241,Relating to health careers promotion for high school students interested in providing health care services in qualified areas.,None,Bob Deuell,sponsor,73R
HB 2264,Relating to representation of the office of the state long-term care ombudsman of the Department on Aging.,None,Bob Deuell,sponsor,73R
HB 2284,Relating to the registration and bonding of and financial reporting by persons soliciting for charitable organizations and to the prohibition of deceptive practices in the solicitation of contributions.,None,Bob Deuell,sponsor,73R
HB 2407,Relating to allowing testing and training to be required by the State Board of Private Investigators and Private Security Agencies.,None,Bob Deuell,sponsor,73R
HB 2434,Relating to ex parte communications in contested cases involving hazardous waste permits.,None,Bob Deuell,sponsor,73R
HB 2468,Relating to certain procedures regarding election contests and recounts.,None,Bob Deuell,sponsor,73R
HB 2498,Relating to the regulation of physician assistants; providing a criminal penalty.,None,Bob Deuell,sponsor,73R
HB 2790,Relating to county responsibility for indigent care services; providing a criminal penalty.,None,Bob Deuell,sponsor,73R
HB 2851,Relating to the creation of municipal courts of record in Denton.,None,Bob Deuell,sponsor,73R
HB 2862,"Relating to the creation, administration, powers, duties, operation, and financing of the Haskell/Knox County Underground Water Conservation District.",None,Bob Deuell,sponsor,73R
HCR 28,"Commending the Texas Department of Transportation for its ""Share the Road"" Bicycle Safety Campaign.",None,Bob Deuell,sponsor,73R
HCR 72,Honoring Ben Blackburn for his contributions to his community and state.,None,Bob Deuell,sponsor,73R
HCR 134,"Congratulating the Texas Rural Water Association on the occasion of its 25th anniversary and designating January 14, 1994, as Rural Water Day in Texas.",None,Bob Deuell,sponsor,73R
HCR 171,Instructing the House enrolling clerk to make a correction to H.B. 74.,None,Bob Deuell,sponsor,73R
HB 2499,Relating to prepaid funeral services or merchandise.,None,Bob Deuell,cosponsor,73R
SB 3,Relating to providing for methods and procedures for the eradication of boll weevils in cotton; providing penalties.,None,Bob Deuell,author,724
SR 71,Commending Dr. Mary Moses.,None,Bob Deuell,author,724
SCR 11,Encouraging the attorney general of Texas to settle the case of LULAC v. Mattox in as timely a manner as possible.,None,Bob Deuell,coauthor,724
HCR 11,Honoring the memory of former U.S. Representative Herbert Ray Roberts.,None,Bob Deuell,sponsor,724
HCR 13,Commemorating the centennial of the pledge of allegiance to the flag of the United States of America and joining with all citizens of this nation in honoring the principles it celebrates.,None,Bob Deuell,sponsor,724
SB 12,Relating to the election of justices of the supreme court and judges of the court of criminal appeals from single-member districts.,None,Bob Deuell,author,723
SB 1,Relating to apportionment of the state into senatorial districts.,None,Bob Deuell,coauthor,723
HB 1,Relating to apportionment of the state into state representative districts.,None,Bob Deuell,sponsor,723
HB 2,Relating to the date of the primary elections for 1992 and other electoral and political processes relative to the date of those elections.,None,Bob Deuell,sponsor,723
HCR 2,Honoring the memory of Frank N. Ikard.,None,Bob Deuell,sponsor,723
HCR 5,Commemorating the bicentennial of the founding of the Democratic Party.,None,Bob Deuell,sponsor,723
SB 28,Relating to primary elections and political party conventions held in the year following redistricting pursuant to the federal decennial census.,None,Bob Deuell,author,722
SB 35,Relating to the exemption of property in this state from the satisfaction of another state's judgment for unpaid income taxes on certain retirement benefits.,None,Bob Deuell,author,722
SCR 8,Resolving that taxing entities shall continue to view nursery stock seasonal protection units as tax-exempt implements of husbandry under the laws of the State of Texas.,None,Bob Deuell,author,722
SCR 16,"Resolved that the 72nd Legislature of the State of Texas, 2nd Called Session, intends that the assets of the former Texas Federal Inspection Service are property of the state of Texas.",None,Bob Deuell,author,722
SR 76,In memory of Robert Eugene Chambers of Wichita Falls.,None,Bob Deuell,author,722
SB 39,Relating to the sale and protection of certain animals; providing civil and criminal penalties.,None,Bob Deuell,coauthor,722
HCR 3,Commending the Reserve Officers Training Corps on the occasion of its 75th anniversary.,None,Bob Deuell,sponsor,722
SB 60,Relating to regulation of long-term care insurance.,None,Bob Deuell,author,721
SR 51,In memory of Jessie Denton of Wichita Falls.,None,Bob Deuell,author,721
SR 80,Congratulating Mr. and Mrs. Benjamin August Hutson on the occasion of their 60th wedding anniversary.,None,Bob Deuell,author,721
