bill_name,caption,filer_id,filer_name,function,session
SR 47,In memory of Clell Everett Bullock.,None,Ted Lyon,author,724
SCR 11,Encouraging the attorney general of Texas to settle the case of LULAC v. Mattox in as timely a manner as possible.,None,Ted Lyon,coauthor,724
SB 12,Relating to the election of justices of the supreme court and judges of the court of criminal appeals from single-member districts.,None,Ted Lyon,author,723
SCR 1,"Directing the Texas Department of Transportation to issue ""U.S. Judges"" license plates to magistrates of the United States district courts.",None,Ted Lyon,author,723
SB 1,Relating to apportionment of the state into senatorial districts.,None,Ted Lyon,author,723
SB 5,"Relating to the efficient operation of the state criminal justice system, including the punishment of offenses, probation and parole, criminal justice services, the issuance of general obligation bonds for criminal justice facilities, and an emergency appropriation to the Texas Department of Criminal Justice for projects related to criminal justice facilities.",None,Ted Lyon,author,722
SB 58,Relating to the authority of certain counties to impose a county hotel occupancy tax and to the use of the tax revenues.,None,Ted Lyon,author,722
SJR 3,Proposing a constitutional amendment providing for the election of justices to the supreme court and judges to the court of criminal appeals from single-member districts.,None,Ted Lyon,author,722
SJR 4,Proposing a constitutional amendment requiring the legislature to provide for the election of justices to the courts of appeals from single-member districts.,None,Ted Lyon,author,722
SJR 5,Proposing a constitutional amendment requiring the legislature to provide for the election of certain district judges from single-member judicial divisions.,None,Ted Lyon,author,722
SB 32,Relating to fingerprinting and photographing certain children referred to juvenile court.,None,Ted Lyon,coauthor,722
SB 33,Relating to the notification of certain statewide and national criminal information systems when a warrant is issued for a juvenile.,None,Ted Lyon,coauthor,722
SB 39,Relating to the sale and protection of certain animals; providing civil and criminal penalties.,None,Ted Lyon,coauthor,722
HB 93,"Relating to the efficient operation of the state criminal justice and judicial system, including the punishment of offenses, probation and parole, criminal justice services, and the issuance of general obligation bonds for criminal justice facilities; making appropriations.",None,Ted Lyon,sponsor,722
SB 24,"Relating to the efficient operation of the institutional division of the Texas Department of Criminal Justice and the management of special needs offenders, including the provision of services and facilities by private vendors and the issuance of general obligation bonds for acquiring, constructing, or equipping corrections institutions.",None,Ted Lyon,author,721
SB 53,Relating to the placement of the thumbprint and photograph of certain juveniles on an adjudication order.,None,Ted Lyon,author,721
SCR 2,Welcoming the 1994 World Cup to Texas.,None,Ted Lyon,author,721
SJR 4,"Proposing a constitutional amendment providing for the authorization for issuance of general obligation bonds for acquiring, constructing, or equipping new prisons and other punishment facilities to confine criminals, mental health and mental retardation institutions, and youth corrections institutions, for major repair or renovation of existing facilities of those institutions, and for the acquisition of, major repair to, or renovation of other facilities to convert those facilities into state prisons or other punishment facilities.",None,Ted Lyon,author,721
SJR 12,Proposing a constitutional amendment providing for the election of justices to the supreme court and judges to the court of criminal appeals from single-member districts.,None,Ted Lyon,author,721
SJR 13,Proposing a constitutional amendment requiring the legislature to provide for the election of justices to the courts of appeals from single-member districts.,None,Ted Lyon,author,721
SJR 14,Proposing a constitutional amendment requiring the legislature to provide for the election of certain district judges from single-member judicial divisions.,None,Ted Lyon,author,721
SR 4,Congratulating Leon Vineyard of Terrell on being selected to be a member of the University of North Texas Hall of Fame.,None,Ted Lyon,author,721
SR 5,Paying tribute to Vernice Crayton Melontree on the occasion of her retirement from the Tyler Independent School District.,None,Ted Lyon,author,721
SR 17,Recognizing Dorothy Bryant Pendleton on the occasion of her retirement after 35 years of distinguished service in the Tyler Independent School District.,None,Ted Lyon,author,721
SR 272,Resolving to suspend Senate Rule 12.03 to enable the conference committee appointed to resolve the differences on Senate Joint Resolution No. 4.,None,Ted Lyon,author,721
SR 281,Suspending the rules to allow the Conference Committee on SJR 4 to go outside the bounds of the committee.,None,Ted Lyon,author,721
SCR 18,Requesting the attorney general to settle the LULAC v. Mattox case.,None,Ted Lyon,coauthor,721
HCR 14,Commending Amy Howerton.,None,Ted Lyon,sponsor,721
SB 109,Relating to prohibiting employment discrimination against certain peace officers and employees of the institutional division of the Texas Department of Criminal Justice for refusing to take a polygraph examination.,None,Ted Lyon,author,72R
SB 110,Relating to complaints about and disciplinary measures taken against certain peace officers or fire fighters.,None,Ted Lyon,author,72R
SB 113,Relating to the compensation of a deputy sheriff assigned as a bailiff in Dallas County.,None,Ted Lyon,author,72R
SB 185,Relating to the regulation by the public utility commission of fuel cost collection by electric utilities.,None,Ted Lyon,author,72R
SB 201,Relating to the violation by a county clerk or the clerk's deputy of certain requirements relating to the filing of a subdivision plat or replat.,None,Ted Lyon,author,72R
SB 238,Relating to the termination of insurance agency contracts.,None,Ted Lyon,author,72R
SB 290,Relating to the regulation of certain electronic products used in the practice of dentistry.,None,Ted Lyon,author,72R
SB 327,"Relating to the reporting of injuries to the Texas Department of Health; amending Title 2, Health and Safety Code; and declaring an emergency.",None,Ted Lyon,author,72R
SB 354,Relating to the purchase of insurance by municipalities without competitive bidding.,None,Ted Lyon,author,72R
SB 405,Relating to the protection of wildlife resources from toxic products or hazardous material; providing a penalty.,None,Ted Lyon,author,72R
SB 407,"Relating to the imposition and recovery of penalties for the unauthorized killing, catching, possessing, taking, or injuring of particular animals.",None,Ted Lyon,author,72R
SB 428,"Relating to the eligibility of professional athletes who are employed by a franchise of the National Football League, National Basketball Association, American League of Professional Baseball Clubs or the National League of Professional Baseball Clubs for the receipt of workers' compensation benefits.",None,Ted Lyon,author,72R
SB 440,Relating to the designation of a portion of dues in certain employee organizations as contributions to the organization's political committee.,None,Ted Lyon,author,72R
SB 554,Relating to the requirement that the thumbprint of certain juveniles be placed on an adjudication order.,None,Ted Lyon,author,72R
SB 555,Relating to the adjudication and disposition of a child engaging in conduct indicating a need for supervision.,None,Ted Lyon,author,72R
SB 563,"Relating to warrantless arrests, amending Chapter 14 of the Code of Criminal Procedure, 1965, as amended.",None,Ted Lyon,author,72R
SB 564,Relating to the licensing and regulation of electricians and electrical contractors; providing a criminal penalty.,None,Ted Lyon,author,72R
SB 580,Relating to the regulation of currency exchange or transmission businesses; providing penalties.,None,Ted Lyon,author,72R
SB 583,"Relating to the Role of the Family in Reducing Recidivism Advisory Committee to the institutional division of the Texas Department of Criminal Justice and the Texas Youth Commission, and to the duties of that committee.",None,Ted Lyon,author,72R
SB 628,Relating to the jurisdiction of the county courts at law in Smith County.,None,Ted Lyon,author,72R
SB 717,"Relating to the licensing and training of peace officers, jailers, and reserve law enforcement officers by the Commission on Law Enforcement Officer Standards and Education.",None,Ted Lyon,author,72R
SB 820,Relating to the post-exposure treatment of first responders exposed to reportable communicable diseases; and declaring an emergency.,None,Ted Lyon,author,72R
SB 828,Relating to the treatment of chemically dependent offenders in the criminal justice system.,None,Ted Lyon,author,72R
SB 894,Relating to admitting wills to probate without the necessity of a hearing.,None,Ted Lyon,author,72R
SB 895,Relating to the registration and regulation of all-terrain vehicles; and declaring an emergency.,None,Ted Lyon,author,72R
SB 910,Relating to rights and remedies under The Securities Act.,None,Ted Lyon,author,72R
SB 911,Relating to the preparation of an annual report on the availability of substance abuse treatment and prevention services to participants in the criminal justice system.,None,Ted Lyon,author,72R
SB 912,Relating to the composition of community justice task forces.,None,Ted Lyon,author,72R
SB 967,Relating to requirements that certain actions involving an insurance corporation and a resident of this state be brought in the courts of this state.,None,Ted Lyon,author,72R
SB 968,Relating to the requirement that certain actions involving a public retirement system be brought in the courts of this state.,None,Ted Lyon,author,72R
SB 969,Relating to the fines for the offense of illegal expenditure or investment under the Texas Controlled Substances Act.,None,Ted Lyon,author,72R
SB 970,Relating to certain annuities based on service credited in the elected class of membership of the Employees Retirement System of Texas.,None,Ted Lyon,author,72R
SB 1144,Relating to an expansion of the rights of crime victims.,None,Ted Lyon,author,72R
SB 1145,"Relating to the subpoena of a lawyer or a lawyer's representative to provide testimony, documents, or tangible objects concerning a client or former client.",None,Ted Lyon,author,72R
SB 1167,Relating to the requirements for an expunction order.,None,Ted Lyon,author,72R
SB 1214,Relating to the Smith County Juvenile Board.,None,Ted Lyon,author,72R
SB 1260,Relating to the licensure and regulation of clinical laboratories; providing penalties; and appropriating fees.,None,Ted Lyon,author,72R
SB 1268,Relating to the review of placement of a child under the care of the Texas Department of Human Services.,None,Ted Lyon,author,72R
SB 1290,"Relating to a security interest in minerals, including oil and gas.",None,Ted Lyon,author,72R
SB 1368,"Relating to the offense of solicitation of the delivery of controlled substance, controlled substance analogue, or dangerous drug.",None,Ted Lyon,author,72R
SB 1375,Relating to the terms of office of a member of the governing boards of certain hospital districts.,None,Ted Lyon,author,72R
SB 1407,Relating to the rights of victims of crimes.,None,Ted Lyon,author,72R
SB 1496,Relating to the offense of failing to require a child riding in a car to be secured by a safety belt.,None,Ted Lyon,author,72R
SB 1546,Relating to improvements which may be undertaken by a municipal public improvement district and to the procedure for creating the district.,None,Ted Lyon,author,72R
SB 1563,"Relating to the composition of the Board of Pardons and Paroles, the employment of parole commissioners to make certain parole decisions, and to the manner in which decisions regarding population management are made in emergency overcrowding situations in the institutional division of the Texas Department of Criminal Justice.",None,Ted Lyon,author,72R
SB 1573,Relating to creation of a state grant writing team in the Office of State-Federal Relations.,None,Ted Lyon,author,72R
SB 1607,Relating to the disposal of solid waste in certain landfills in this state.,None,Ted Lyon,author,72R
SCR 57,Granting Mary Esther Messick permission to sue the State of Texas and the Texas Department of Human Services.,None,Ted Lyon,author,72R
SCR 60,Encouraging all independent school districts to fully utilize the Education for Self Responsibility II:  Prevention of Drug Use curriculum guide.,None,Ted Lyon,author,72R
SCR 97,Extending sincere congratulations to Mr. and Mrs. George T. Griffin on their 50th wedding anniversary.,None,Ted Lyon,author,72R
SCR 154,Welcoming the 1994 World Cup to Texas.,None,Ted Lyon,author,72R
SCR 158,Resolving that a joint interim study committee be designated as the Legislative Law Enforcement Study Committee.,None,Ted Lyon,author,72R
SR 9,"Congratulating Danny G. Shaw, Jr. for achieving the rank of Eagle Scout.",None,Ted Lyon,author,72R
SR 85,Congratulating Sarah McClendon upon receiving the Lifetime Achievement Award for journalism from the Headliners Foundation.,None,Ted Lyon,author,72R
SR 143,In memory of Marine Lance Corporal Daniel B. Walker.,None,Ted Lyon,author,72R
SR 171,Paying tribute to County Judge Winston Reagan on the occasion of his retirement after 20 years of public service.,None,Ted Lyon,author,72R
SR 219,"Recognizing February 27, 1991, as Tyler Day.",None,Ted Lyon,author,72R
SR 220,Honoring Mrs. Gertrude Buckley Windsor.,None,Ted Lyon,author,72R
SR 275,Welcoming the members of D-FY-IT.,None,Ted Lyon,author,72R
SR 406,"Declaring March 25, 1991, Kaufman County Day.",None,Ted Lyon,author,72R
SR 465,"Congratulating Mrs. Ivah Albright and the Tyler Area Children's Chorale for being chosen to represent the United States at the United Nations ""World Children's Day"" Event.",None,Ted Lyon,author,72R
SR 527,"Designating the 1990s as ""The Aviation and Space Technologies Advancement Decade"" in Texas.",None,Ted Lyon,author,72R
SR 531,Joining with the Texas Narcotics Officers Association in recognizing Overton High School's D-FY-IT (Drug-Free Youth in Texas).,None,Ted Lyon,author,72R
SR 673,Recognizing Larry A. Boyd for his outstanding work as a game warden for our state.,None,Ted Lyon,author,72R
SR 746,Honoring Mrs. Vernon Henretta Prince Stanton on the occasion of her 100th birthday.,None,Ted Lyon,author,72R
SR 747,Recognizing Charles C. Craddock on the occasion of his retirement from 33 years of devoted service in the field of education.,None,Ted Lyon,author,72R
SR 748,"Commending Alpha Omicron Pi, an international Greek sorority, for its hard work and exemplary goals and extending best wishes for success on its future projects.",None,Ted Lyon,author,72R
SR 806,"Designating May 27, 1991, as ""The Day of the Missing Child"" statewide to remind Texans of Megan Elizabeth Garner and other missing children.",None,Ted Lyon,author,72R
SR 807,"Recognizing the proclamation by the City of Tyler of May 27, 1991, as ""The Day of the Missing Child"" in honor of Megan Elizabeth Garner, abducted from a Tyler playground March 27, 1991, and the more than 4,000 missing children in the State of Texas.",None,Ted Lyon,author,72R
SR 818,"Joining with the City Council and the citizens of Fate in designating May 19, 1991, as ""Crow"" Lindsey Day in honor of this beloved resident who is celebrating his 80th birthday.",None,Ted Lyon,author,72R
SR 839,"Declaring May 4, 1991, as ""Mabank Independent School District Vocational Industrial Clubs of America State Champions Day"".",None,Ted Lyon,author,72R
SR 841,"Welcoming Mrs. Maria Gwiazda as a new citizen of the United States of America to be sworn in on May 24, 2992 at her home in Terrell.",None,Ted Lyon,author,72R
SR 856,Honoring Marty Walker for receiving an Honorable Mention designation from the Texas Committee for the Humanities in outstanding teaching.,None,Ted Lyon,author,72R
SR 857,Honoring Sue E. Platzer for receiving an Honorable Mention designation from the Texas Committee for the Humanities in outstanding teaching.,None,Ted Lyon,author,72R
SR 81,Extending congratulations to Earl Christian Campbell for this induction into the Pro Football Hall of Fame in his first year of eligibility.,None,Ted Lyon,author,72R
SB 1,"Relating to ethics of public servants, including the composition, powers, and duties of the Texas Ethics Commission; to registration, reporting, and restrictions concerning expenditures made to influence legislation or administrative action; to personal financial statements filed by public officers and employees; to the giving or acceptance of certain benefits; to restrictions and reporting concerning political contributions and expenditures; and providing penalties.",None,Ted Lyon,coauthor,72R
SB 10,Relating to the murder of an individual under six years of age as a capital offense.,None,Ted Lyon,coauthor,72R
SB 14,"Relating to the prevention of, and the damage, cleanup, costs, and liability for, oil spills in coastal waters of the state; providing for adequate response to spills of oil and other pollutants in coastal waters; levying a coastal protection fee; creating the coastal protection fund; amending licensing requirements for pilots in state waters; making appropriations; and providing civil and criminal penalties.",None,Ted Lyon,coauthor,72R
SB 16,Relating to the suspension of the driver's license of a person convicted of certain felony offenses; making an appropriation.,None,Ted Lyon,coauthor,72R
SB 35,"Relating to the creation, powers, and duties of the Texas Department of Natural Resources; transferring appropriations.",None,Ted Lyon,coauthor,72R
SB 55,"Relating to drug-free zones and to the imposition of penalties for the delivery, manufacture, or possession with the intent to deliver or manufacture a controlled substance in drug-free zones.",None,Ted Lyon,coauthor,72R
SB 112,Relating to community centers and to the provision of community mental health and mental retardation services.,None,Ted Lyon,coauthor,72R
SB 166,Relating to a prohibition on the requirement of a polygraph examination of a complainant as a condition of charging a defendant accused of certain criminal offenses.,None,Ted Lyon,coauthor,72R
SB 226,Relating to establishing a law school at Texas A&I University.,None,Ted Lyon,coauthor,72R
SB 233,Relating to regulation of tow truck owners.,None,Ted Lyon,coauthor,72R
SB 712,Relating to the certification and licensing of real estate appraisers.,None,Ted Lyon,coauthor,72R
SB 853,"Relating to the reimbursement of expenses for the confiscation, analysis, storage, and disposal of controlled substances and related items by a law enforcement agency.",None,Ted Lyon,coauthor,72R
SB 1596,"Relating to reducing overcrowding in jails and promoting a more effective state criminal justice system, including provisions relating to maintenance and operation tax rate, the composition of the Criminal Justice Policy Council, the creation of the Texas Sentencing and Corrections Commission, performance rewards payments to certain counties, and conditions of parole; and repealing certain statutes related to criminal offenses.",None,Ted Lyon,coauthor,72R
SR 227,In memory of Wenona Christine Jones Glasgow.,None,Ted Lyon,coauthor,72R
SR 763,Urging all Texas communities to support the Governor's Committee to Salute Texas Troops.,None,Ted Lyon,coauthor,72R
HB 9,"Relating to the waiver of a jury trial for a person charged with a capital offense and to the punishment, sentencing, and availability of parole for a person convicted of a capital offense.",None,Ted Lyon,sponsor,72R
HB 46,Relating to the regulation of currency exchange or transmission businesses; providing penalties.,None,Ted Lyon,sponsor,72R
HB 173,Relating to essential need driver's licenses.,None,Ted Lyon,sponsor,72R
HB 177,Relating to the right of certain witnesses to return to employment.,None,Ted Lyon,sponsor,72R
HB 399,Relating to the operation of an authorized emergency vehicle by a volunteer fire fighter.,None,Ted Lyon,sponsor,72R
HB 827,Relating to regulation of water and sewer utilities.,None,Ted Lyon,sponsor,72R
HB 944,Relating to the adjudication and disposition of a child engaging in conduct indicating a need for supervision.,None,Ted Lyon,sponsor,72R
HB 954,"Relating to certain obsolete provisions addressing health and safety standards in some eleemosynary institutions; repealing Section 13.001, Health and Safety Code; and declaring an emergency.",None,Ted Lyon,sponsor,72R
HB 1066,Relating to a study of the manner in which inmates of the institutional division of the Texas Department of Criminal Justice prove worthiness to begin obtaining good conduct time.,None,Ted Lyon,sponsor,72R
HB 1313,Relating to the composition of the juvenile board of Smith County.,None,Ted Lyon,sponsor,72R
HB 1586,Relating to certain motor vehicle installment sales.,None,Ted Lyon,sponsor,72R
HB 1632,Relating to rights and remedies under The Securities Act.,None,Ted Lyon,sponsor,72R
HB 1753,Relating to the administration of the Van Zandt County Waste Disposal District.,None,Ted Lyon,sponsor,72R
HB 1838,Relating to the requirements for an expunction order.,None,Ted Lyon,sponsor,72R
HB 2029,Relating to the review of placement of a child under the care of the Texas Department of Human Services.,None,Ted Lyon,sponsor,72R
HB 2034,Relating to the classification of certain felony offenses and to the establishment of a work program operated by the insitutional division of the Texas Department of Criminal Justice to punish persons convicted of those offenses and benefit the state and its political subdivisions.,None,Ted Lyon,sponsor,72R
HB 2411,Relating to county enforcement in unincorporated areas of public health laws.,None,Ted Lyon,sponsor,72R
HB 2570,Relating to the election and powers and duties of the board of directors of the Dallas County Levee Improvement District No. 1.,None,Ted Lyon,sponsor,72R
HB 2571,Relating to the election and powers and duties of the board of directors of the Bois d'Arc Island Levee Improvement District of Dallas and Kaufman Counties.,None,Ted Lyon,sponsor,72R
HB 2572,Relating to the election and powers and duties of the board of directors of the Dallas County Levee District No. 8.,None,Ted Lyon,sponsor,72R
HB 2573,Relating to the election and powers and duties of the board of directors of the Dallas County Levee Improvement District No. 14.,None,Ted Lyon,sponsor,72R
HB 2847,Relating to the appointment of a bailiff for the 86th District Court.,None,Ted Lyon,sponsor,72R
HB 2882,Relating to the authority of the Texas Board of Criminal Justice to manage inmate population at the institutional division during emergency overcrowding situations.,None,Ted Lyon,sponsor,72R
HB 2884,"Relating to the creation, administration, powers, duties, operations, financing, and organization of the Upper Sabine Valley Solid Waste District; granting the power of eminent domain and the authority to issue bonds; authorizing a tax.",None,Ted Lyon,sponsor,72R
HCR 192,"Declaring Mineola to be the ""City of Festivals"".",None,Ted Lyon,sponsor,72R
HB 124,"Relating to the manner in which maximum capacity is established or increased for units in the institutional division of the Texas Department of Criminal Justice, to the manner in which the systemwide capacity of the institutional division is increased, and to the housing of inmates in the institutional division.",None,Ted Lyon,cosponsor,72R
SR 45,"Bidding farewell to Jerry Strader, one of our state's most distinguished journalists, and extending best wishes to him for future success.",None,Ted Lyon,author,716
SB 1,Relating to public education.,None,Ted Lyon,coauthor,716
SR 30,"Declaring that Lieutenant Governor William P. Hobby, Jr., has been the guiding hand for and example to the Texas Senate in its legislative achievements during his 18 years in office.",None,Ted Lyon,coauthor,716
HCR 18,Honoring State Representative Bill Hollowell.,None,Ted Lyon,sponsor,716
SCR 13,Inviting Bavaria to join Texas in a sister state relationship.,None,Ted Lyon,author,715
SR 30,Applauding and commending Gladys Bradshaw for her commitment to the youth of our state and wishing her a rewarding retirement.,None,Ted Lyon,author,715
SR 68,Commending Dale Hamman for his superb contributions to the educational system of Texas and extending best wishes to him for a rich and rewarding retirement.,None,Ted Lyon,author,715
SR 85,In memory of Lillie Ann Gallaway of Canton.,None,Ted Lyon,author,715
SR 88,Commending Noble Welch for his invaluable contributions to the City of Terrell.,None,Ted Lyon,author,715
SR 123,In memory of Dr. David H. Johnson.,None,Ted Lyon,author,715
HCR 4,Inviting the people of Bavaria to join Texas in a relationship of friendship and commerce.,None,Ted Lyon,sponsor,715
HCR 14,Honoring Alvin V. Anderson.,None,Ted Lyon,sponsor,715
SR 19,"Paying tribute to Eddie Golder, Steve Baskin, and Steve Austin of the Van Zandt County sheriff's department for the courage and resoluteness they displayed in carrying out their assigned duties.",None,Ted Lyon,author,714
SR 99,"Honoring Captain Charles F. Shappard of Mesquite, one of the state's most valued peace officers.",None,Ted Lyon,author,714
SR 114,Congratulating the Red Raiders soccer team on their impressive season.,None,Ted Lyon,author,714
HCR 2,Commending Opportunities in Tyler on occasion of 25th anniversary.,None,Ted Lyon,sponsor,714
HCR 32,Congratulating Mother Frances Hospital of Tyler.,None,Ted Lyon,sponsor,714
SR 3,Paying tribute to Harold Gouge on the occasion of his retirement from the Mesquite Police Department.,None,Ted Lyon,author,713
SR 12,Extending appreciation to Hobart W. Wisdom for his 30 years of dedicated service to the Rockwall Independent School District.,None,Ted Lyon,author,713
