bill_name,caption,filer_id,filer_name,function,session,leg_id,original_name,parsed_name
HB 1914,Relating to abolishing the Private Sector Prison Industries Oversight Authority and to the certification and operation of private sector prison industries programs.,19923,Wayne Christian,author,81R,2525,Rep. Wayne Christian,Wayne Christian
HB 1988,Relating to the duties of a peace officer and the Department of Public Safety in connection with the suspension of a driver's license for a failure to pass a blood or breath test for intoxication or the presence of alcohol.,19923,Wayne Christian,author,81R,2525,Rep. Wayne Christian,Wayne Christian
HB 2058,Relating to the standards for attorneys representing indigent defendants in capital cases.,19923,Wayne Christian,author,81R,2525,Rep. Wayne Christian,Wayne Christian
HB 2379,Relating to the establishment of an adult stem cell research program.,19923,Wayne Christian,author,81R,2525,Rep. Wayne Christian,Wayne Christian
HB 2504,"Relating to requiring a public institution of higher education to establish uniform standards for publishing cost of attendance information, to conduct student course evaluations of faculty, and to make certain information available on the Internet.",19923,Wayne Christian,author,81R,2525,Rep. Wayne Christian,Wayne Christian
HB 2563,Relating to determination of and notification regarding the state compression percentage under the public school finance system and the elimination of property taxes for school district maintenance and operations.,19923,Wayne Christian,author,81R,2525,Rep. Wayne Christian,Wayne Christian
HB 2746,"Relating to the establishment of the School of Ethics, Western Civilization, and American Traditions at The University of Texas at Austin.",19923,Wayne Christian,author,81R,2525,Rep. Wayne Christian,Wayne Christian
HB 3226,Relating to the payment of temporary housing costs for certain individuals who are released or are eligible for release on parole or to mandatory supervision.,19923,Wayne Christian,author,81R,2525,Rep. Wayne Christian,Wayne Christian
HB 3496,Relating to the establishment of the Texas Nursery and Floral Advisory Council and the promotion of Texas nursery and floral industries.,19923,Wayne Christian,author,81R,2525,Rep. Wayne Christian,Wayne Christian
HJR 38,Proposing a constitutional amendment regarding the rainy day fund and dedicating certain surplus revenues to property tax reduction.,19923,Wayne Christian,author,81R,2525,Rep. Wayne Christian,Wayne Christian
HJR 46,Proposing a constitutional amendment to permit the attorney general to prosecute certain offenses arising under the campaign finance laws of this state.,19923,Wayne Christian,author,81R,2525,Rep. Wayne Christian,Wayne Christian
HJR 89,Proposing a constitutional amendment dedicating certain revenue derived from motor fuel taxes to the construction of public highways.,19923,Wayne Christian,author,81R,2525,Rep. Wayne Christian,Wayne Christian
HB 4,"Relating to eminent domain, including certain limitations, procedures, and standards relating to the use of eminent domain.",19923,Wayne Christian,coauthor,81R,2525,Rep. Wayne Christian,Wayne Christian
HB 11,Relating to repeal of authority for the establishment and operation of the Trans-Texas Corridor.,19923,Wayne Christian,coauthor,81R,2525,Rep. Wayne Christian,Wayne Christian
HB 36,Relating to informed consent to an abortion.,19923,Wayne Christian,coauthor,81R,2525,Rep. Wayne Christian,Wayne Christian
HB 109,"Relating to the issuance of ""Choose Life"" license plates and the creation of the Choose Life account in the general revenue fund.",19923,Wayne Christian,coauthor,81R,2525,Rep. Wayne Christian,Wayne Christian
HB 206,Relating to the on-premises consumption of certain alcoholic beverages; providing a penalty.,19923,Wayne Christian,coauthor,81R,2525,Rep. Wayne Christian,Wayne Christian
HB 208,Relating to the cancellation of the voter registration and to the eligibility to vote of persons who are deceased or not citizens of the United States.,19923,Wayne Christian,coauthor,81R,2525,Rep. Wayne Christian,Wayne Christian
HB 260,"Relating to the eligibility of certain persons to receive a sentence of community supervision, including deferred adjudication community supervision.",19923,Wayne Christian,coauthor,81R,2525,Rep. Wayne Christian,Wayne Christian
HB 266,"Relating to regulating the provision of benefits and services to, and the verification of the employment status of, immigrants and to enforcing laws relating to immigrants;  providing civil and criminal penalties.",19923,Wayne Christian,coauthor,81R,2525,Rep. Wayne Christian,Wayne Christian
HB 267,Relating to the interstate purchase of certain firearms.,19923,Wayne Christian,coauthor,81R,2525,Rep. Wayne Christian,Wayne Christian
HB 276,Relating to the requirement that state agencies report the cost of services and benefits provided to undocumented immigrants.,19923,Wayne Christian,coauthor,81R,2525,Rep. Wayne Christian,Wayne Christian
HB 387,Relating to the exemption of volunteer fire departments from certain motor fuel taxes.,19923,Wayne Christian,coauthor,81R,2525,Rep. Wayne Christian,Wayne Christian
HB 404,Relating to the enforcement of state and federal laws governing immigration by certain governmental entities.,19923,Wayne Christian,coauthor,81R,2525,Rep. Wayne Christian,Wayne Christian
HB 410,Relating to the requirement under certain circumstances that a license holder display the person's license to carry a concealed handgun.,19923,Wayne Christian,coauthor,81R,2525,Rep. Wayne Christian,Wayne Christian
HB 417,"Relating to the acquisition of and compensation for real property, including blighted property, for public purposes through condemnation or certain other means.",19923,Wayne Christian,coauthor,81R,2525,Rep. Wayne Christian,Wayne Christian
HB 469,Relating to the establishment of incentives by this state for the implementation of certain projects to capture and sequester carbon dioxide that would otherwise be emitted into the atmosphere.,19923,Wayne Christian,coauthor,81R,2525,Rep. Wayne Christian,Wayne Christian
HB 543,Relating to prohibiting human cloning and other uses of human tissue by institutions of higher education; providing penalties.,19923,Wayne Christian,coauthor,81R,2525,Rep. Wayne Christian,Wayne Christian
HB 658,Relating to requiring governmental entities to participate in the federal electronic verification of work authorization program.,19923,Wayne Christian,coauthor,81R,2525,Rep. Wayne Christian,Wayne Christian
HB 832,Relating to the computation of taxable margin for purposes of the franchise tax by certain taxable entities.,19923,Wayne Christian,coauthor,81R,2525,Rep. Wayne Christian,Wayne Christian
HB 870,Relating to transition to competition in the Southwestern Electric Power Company service area.,19923,Wayne Christian,coauthor,81R,2525,Rep. Wayne Christian,Wayne Christian
HB 873,"Relating to incentives for the film, television, video, and digital interactive media production industries.",19923,Wayne Christian,coauthor,81R,2525,Rep. Wayne Christian,Wayne Christian
HB 1037,Relating to allowing persons acquiring a new residence homestead to receive an ad valorem tax exemption on the homestead in the year in which the property is acquired.,19923,Wayne Christian,coauthor,81R,2525,Rep. Wayne Christian,Wayne Christian
HB 1038,Relating to the determination of the market value of a residence homestead for purposes of ad valorem taxation.,19923,Wayne Christian,coauthor,81R,2525,Rep. Wayne Christian,Wayne Christian
HB 1061,"Relating to the requirement of citizenship or lawful presence in the United States for issuance or renewal of certain occupational licenses, driver's licenses, and identification certificates.",19923,Wayne Christian,coauthor,81R,2525,Rep. Wayne Christian,Wayne Christian
HB 1102,Relating to the requirements for the recommended and advanced public high school programs.,19923,Wayne Christian,coauthor,81R,2525,Rep. Wayne Christian,Wayne Christian
HB 1301,Relating to an employee's transportation and storage of certain firearms or ammunition while on certain property owned or controlled by the employee's employer.,19923,Wayne Christian,coauthor,81R,2525,Rep. Wayne Christian,Wayne Christian
HB 1483,Relating to the use of eminent domain authority.,19923,Wayne Christian,coauthor,81R,2525,Rep. Wayne Christian,Wayne Christian
HB 1555,Relating to public school finance.,19923,Wayne Christian,coauthor,81R,2525,Rep. Wayne Christian,Wayne Christian
HB 1863,"Relating to exempting the intrastate manufacture of a firearm, a firearm accessory, or ammunition from federal regulation.",19923,Wayne Christian,coauthor,81R,2525,Rep. Wayne Christian,Wayne Christian
HB 1876,Relating to creating the health care access fund to recruit health care providers in health professional shortage areas and to support federally-qualified health centers and to using for those purposes revenue from a tax imposed on certain tobacco products.,19923,Wayne Christian,coauthor,81R,2525,Rep. Wayne Christian,Wayne Christian
HB 1893,Relating to the carrying of concealed handguns on the campuses of institutions of higher education.,19923,Wayne Christian,coauthor,81R,2525,Rep. Wayne Christian,Wayne Christian
HB 2083,Relating to determination of state contributions for participation by certain junior college employees in the state employees group benefits program.,19923,Wayne Christian,coauthor,81R,2525,Rep. Wayne Christian,Wayne Christian
HB 2084,Relating to a suit for access to a child by a grandparent.,19923,Wayne Christian,coauthor,81R,2525,Rep. Wayne Christian,Wayne Christian
HB 2110,Relating to the applicability of the Private Real Property Rights Preservation Act to certain governmental actions.,19923,Wayne Christian,coauthor,81R,2525,Rep. Wayne Christian,Wayne Christian
HB 2656,Relating to the composition of the board of trustees of the Teacher Retirement System of Texas.,19923,Wayne Christian,coauthor,81R,2525,Rep. Wayne Christian,Wayne Christian
HB 2749,Relating to economic recovery grants for certain municipalities following public calamities.,19923,Wayne Christian,coauthor,81R,2525,Rep. Wayne Christian,Wayne Christian
HB 3325,Relating to advance directives or health care or treatment decisions made by or on behalf of patients.,19923,Wayne Christian,coauthor,81R,2525,Rep. Wayne Christian,Wayne Christian
HB 3606,Relating to election through secret ballot of a labor union as the exclusive bargaining representative.,19923,Wayne Christian,coauthor,81R,2525,Rep. Wayne Christian,Wayne Christian
HB 3613,Relating to the determination of the market value of a residence homestead for ad valorem tax purposes on the basis of the property's value as a residence homestead and to an exemption from ad valorem taxation of the residence homesteads of certain totally disabled veterans and to the amount of the exemption from ad valorem taxation to which a disabled veteran is entitled based on disability rating.,19923,Wayne Christian,coauthor,81R,2525,Rep. Wayne Christian,Wayne Christian
HB 3769,Relating to certain fraudulent investment schemes; providing penalties.,19923,Wayne Christian,coauthor,81R,2525,Rep. Wayne Christian,Wayne Christian
HB 3796,Relating to informed and voluntary consent for an abortion and the collection and reporting of information related to the performance of an abortion; providing penalties.,19923,Wayne Christian,coauthor,81R,2525,Rep. Wayne Christian,Wayne Christian
HB 3986,Relating to the closure of certain man-made passes between the Gulf of Mexico and inland bays by the commissioner of the General Land Office.,19923,Wayne Christian,coauthor,81R,2525,Rep. Wayne Christian,Wayne Christian
HB 4014,Relating to prohibiting school districts from requiring or coercing school district employees to make charitable contributions.,19923,Wayne Christian,coauthor,81R,2525,Rep. Wayne Christian,Wayne Christian
HB 4294,"Relating to textbooks, electronic textbooks, instructional material, and technological equipment in public schools.",19923,Wayne Christian,coauthor,81R,2525,Rep. Wayne Christian,Wayne Christian
HB 4765,Relating to the computation of the franchise tax.,19923,Wayne Christian,coauthor,81R,2525,Rep. Wayne Christian,Wayne Christian
HCR 50,"Affirming that the State of Texas claims sovereignty under the Tenth Amendment to the Constitution of the United States over all powers not otherwise enumerated and granted to the federal government by the U.S. Constitution, serving notice to the federal government to cease and desist certain mandates, and providing that certain federal legislation be prohibited or repealed.",19923,Wayne Christian,coauthor,81R,2525,Rep. Wayne Christian,Wayne Christian
HCR 64,Urging the Congress of the United States to oppose any efforts to adopt the Employee Free Choice Act or any similar legislation.,19923,Wayne Christian,coauthor,81R,2525,Rep. Wayne Christian,Wayne Christian
HCR 168,Extending appreciation to former president George W. Bush for his service to our state and nation.,19923,Wayne Christian,coauthor,81R,2525,Rep. Wayne Christian,Wayne Christian
HJR 30,Proposing a constitutional amendment requiring any increase in a rate of the franchise tax be approved by two-thirds of all the members elected to each house of the legislature.,19923,Wayne Christian,coauthor,81R,2525,Rep. Wayne Christian,Wayne Christian
HJR 39,Post-ratifying Amendment XXIV to the Constitution of the United States prohibiting the denial or abridgment of the right to vote for failure to pay any poll tax or other tax.,19923,Wayne Christian,coauthor,81R,2525,Rep. Wayne Christian,Wayne Christian
HJR 84,Proposing a constitutional amendment allowing a state mandate imposed on a county to have effect only if the state provides for payment to the county of the cost of the mandate.,19923,Wayne Christian,coauthor,81R,2525,Rep. Wayne Christian,Wayne Christian
HR 454,"Recognizing April 16, 2009, as Texas Federation of Republican Women Day at the Capitol.",19923,Wayne Christian,coauthor,81R,2525,Rep. Wayne Christian,Wayne Christian
HR 716,"Expressing intent that funds provided to the State of Texas by the American Recovery and Reinvestment Act be spent, as far as practicable, on domestic goods, materials, and services.",19923,Wayne Christian,coauthor,81R,2525,Rep. Wayne Christian,Wayne Christian
SB 596,Relating to the name of Stephen F. Austin State University.,19923,Wayne Christian,sponsor,81R,2525,Rep. Wayne Christian,Wayne Christian
SB 859,Relating to initial claims under the unemployment compensation system.,19923,Wayne Christian,sponsor,81R,2525,Rep. Wayne Christian,Wayne Christian
SB 11,"Relating to the prevention, investigation, prosecution, and punishment for certain gang-related and other criminal offenses and to the consequences and costs of engaging in certain activities of a criminal street gang or certain other criminal activity; providing penalties.",19923,Wayne Christian,sponsor,81R,2525,Rep. Wayne Christian,Wayne Christian
SB 366,Relating to authorizing consecutive sentencing for certain offenses committed by a member of a criminal street gang.,19923,Wayne Christian,sponsor,81R,2525,Rep. Wayne Christian,Wayne Christian
SB 369,Relating to information contained in an intelligence database used to investigate and prosecute offenses committed by criminal street gangs.,19923,Wayne Christian,sponsor,81R,2525,Rep. Wayne Christian,Wayne Christian
SB 371,Relating to certain civil consequences of engaging in organized crime.,19923,Wayne Christian,sponsor,81R,2525,Rep. Wayne Christian,Wayne Christian
SB 385,"Relating to the interception of wire, oral, or electronic communications.",19923,Wayne Christian,sponsor,81R,2525,Rep. Wayne Christian,Wayne Christian
SB 413,Relating to the prosecution of a Class C misdemeanor offense for which the defendant does not appear.,19923,Wayne Christian,sponsor,81R,2525,Rep. Wayne Christian,Wayne Christian
SB 414,Relating to conducting by electronic means a hearing to determine a defendant's ability to discharge certain fines and court costs.,19923,Wayne Christian,sponsor,81R,2525,Rep. Wayne Christian,Wayne Christian
SB 415,Relating to the court in which certain persons charged with misdemeanors punishable by fine only may be arraigned.,19923,Wayne Christian,sponsor,81R,2525,Rep. Wayne Christian,Wayne Christian
SB 418,"Relating to the compilation, maintenance, and release of information in a criminal street gang intelligence database by law enforcement agencies and criminal justice agencies.",19923,Wayne Christian,sponsor,81R,2525,Rep. Wayne Christian,Wayne Christian
SB 423,Relating to the conditions of community supervision that may be imposed on a defendant with regard to association with a member of a criminal street gang.,19923,Wayne Christian,sponsor,81R,2525,Rep. Wayne Christian,Wayne Christian
SB 449,Relating to the penalty group classification of certain controlled substances.,19923,Wayne Christian,sponsor,81R,2525,Rep. Wayne Christian,Wayne Christian
SB 537,"Relating to the emergency installation and use of a device to intercept wire, oral, or electronic communications.",19923,Wayne Christian,sponsor,81R,2525,Rep. Wayne Christian,Wayne Christian
SB 689,"Relating to restrictions on the use of the Internet by sex offenders and to the reporting, collection, and exchange of information regarding those offenders; providing a civil penalty.",19923,Wayne Christian,sponsor,81R,2525,Rep. Wayne Christian,Wayne Christian
SB 787,Relating to the statute of limitations on prosecution of the offense of bigamy.,19923,Wayne Christian,sponsor,81R,2525,Rep. Wayne Christian,Wayne Christian
SB 1061,Relating to improving the accuracy of reporting concerning certain criminal history.,19923,Wayne Christian,sponsor,81R,2525,Rep. Wayne Christian,Wayne Christian
SB 1176,Relating to the punishment prescribed for the offense of evading arrest or detention.,19923,Wayne Christian,sponsor,81R,2525,Rep. Wayne Christian,Wayne Christian
SB 1273,Relating to creating an offense for interference with certain radio frequencies.,19923,Wayne Christian,sponsor,81R,2525,Rep. Wayne Christian,Wayne Christian
SB 1662,Relating to the prosecution of and punishment for the offense of breach of computer security.,19923,Wayne Christian,sponsor,81R,2525,Rep. Wayne Christian,Wayne Christian
SB 2047,Relating to the interception or the collection of information from certain communications in an investigation of criminal conduct.,19923,Wayne Christian,sponsor,81R,2525,Rep. Wayne Christian,Wayne Christian
SB 2438,Relating to imposing a duty on a sheriff to report certain warrant or capias information to a national database.,19923,Wayne Christian,sponsor,81R,2525,Rep. Wayne Christian,Wayne Christian
SB 710,Relating to the punishment for the offense of employment harmful to children.,19923,Wayne Christian,cosponsor,81R,2525,Rep. Wayne Christian,Wayne Christian
SB 1281,Relating to the fraudulent obtaining of a controlled substance from a practitioner; providing a penalty.,19923,Wayne Christian,cosponsor,81R,2525,Rep. Wayne Christian,Wayne Christian
SB 1500,Relating to the employment of physicians by certain hospitals.,19923,Wayne Christian,cosponsor,81R,2525,Rep. Wayne Christian,Wayne Christian
SB 1707,Relating to the use of proceeds from criminal asset forfeiture to provide college scholarships to children of peace officers killed in the line of duty and to an annual report regarding the total value of forfeited property in this state.,19923,Wayne Christian,cosponsor,81R,2525,Rep. Wayne Christian,Wayne Christian
HB 970,Relating to the adoption of state agency rules that impose certain costs on local governments or persons.,19923,Wayne Christian,author,80R,2525,Rep. Wayne Christian,Wayne Christian
HB 1214,Relating to the goal of installing additional capacity for generating renewable energy.,19923,Wayne Christian,author,80R,2525,Rep. Wayne Christian,Wayne Christian
HB 1408,Relating to the indemnification of a school district for a  cause of action arising out of the discipline of a student by a professional employee of the district.,19923,Wayne Christian,author,80R,2525,Rep. Wayne Christian,Wayne Christian
HB 1774,Relating to the enforcement of immigration laws by local governments.,19923,Wayne Christian,author,80R,2525,Rep. Wayne Christian,Wayne Christian
HB 1775,Relating to authorizing the issuance of revenue bonds for the expansion of school of nursing facilities at Stephen F. Austin State University.,19923,Wayne Christian,author,80R,2525,Rep. Wayne Christian,Wayne Christian
HB 1776,Relating to restricting students who fail to perform satisfactorily on state-administered assessment instruments from participating in extracurricular activities.,19923,Wayne Christian,author,80R,2525,Rep. Wayne Christian,Wayne Christian
HB 2290,Relating to procedures to help ensure that certain state agency actions are consistent with the meaning and intent of applicable legislative enactments.,19923,Wayne Christian,author,80R,2525,Rep. Wayne Christian,Wayne Christian
HB 2357,Relating to the requirement that a licensed engineer be involved in the construction of certain public works by a political subdivision of this state.,19923,Wayne Christian,author,80R,2525,Rep. Wayne Christian,Wayne Christian
HB 2998,Relating to the duty of a peace officer to verify the citizenship and immigration status of certain persons.,19923,Wayne Christian,author,80R,2525,Rep. Wayne Christian,Wayne Christian
HB 2999,Relating to the generation of hydroelectric power by the Sabine River Authority in the Toledo Bend Reservoir.,19923,Wayne Christian,author,80R,2525,Rep. Wayne Christian,Wayne Christian
HB 3000,Relating to the administration by certain health care professionals of treatments ordered by an optometrist or therapeutic optometrist.,19923,Wayne Christian,author,80R,2525,Rep. Wayne Christian,Wayne Christian
HB 3001,Relating to verification of information disseminated by state agencies.,19923,Wayne Christian,author,80R,2525,Rep. Wayne Christian,Wayne Christian
HB 3002,Relating to student loan repayment assistance for speech-language pathologists employed by a rural public school.,19923,Wayne Christian,author,80R,2525,Rep. Wayne Christian,Wayne Christian
HB 3003,Relating to the investment of public funds in ways that benefit the state and local economies and to the selection of local financial institutions for the deposit of public funds.,19923,Wayne Christian,author,80R,2525,Rep. Wayne Christian,Wayne Christian
HB 3004,"Relating to the investment of public funds, including making investments in ways that benefit the state and local economies, and to the selection of local financial institutions for the deposit of public funds.",19923,Wayne Christian,author,80R,2525,Rep. Wayne Christian,Wayne Christian
HB 3005,Relating to electric service reliability measures.,19923,Wayne Christian,author,80R,2525,Rep. Wayne Christian,Wayne Christian
HB 3332,Relating to certain interviews conducted in investigations of child abuse or neglect.,19923,Wayne Christian,author,80R,2525,Rep. Wayne Christian,Wayne Christian
HB 3348,Relating to the mechanism by which prices are established in the competitive wholesale electric energy and capacity markets in Texas.,19923,Wayne Christian,author,80R,2525,Rep. Wayne Christian,Wayne Christian
HB 3349,Relating to the availability of baseload generation at a price reflective of its cost in this state's competitive wholesale market.,19923,Wayne Christian,author,80R,2525,Rep. Wayne Christian,Wayne Christian
HB 3541,Relating to designating July 21 as First Lady Frances Cox Henderson Remembrance Day.,19923,Wayne Christian,author,80R,2525,Rep. Wayne Christian,Wayne Christian
HB 4087,Relating to the composition and terms of office of the board of directors of the Sabine County Hospital District.,19923,Wayne Christian,author,80R,2525,Rep. Wayne Christian,Wayne Christian
HCR 117,Requesting that the president of the United States grant a presidential pardon to U.S. Border Patrol Agent Ignacio Ramos and U.S. Border Patrol Agent Jose Alonso Compean.,19923,Wayne Christian,author,80R,2525,Rep. Wayne Christian,Wayne Christian
HJR 95,Proposing a constitutional amendment directing state and local governmental entities that invest public funds to make investments that will benefit the Texas economy to the extent that it is possible to do so under a prudent investment strategy.,19923,Wayne Christian,author,80R,2525,Rep. Wayne Christian,Wayne Christian
HR 156,"Recognizing February 21 and 22, 2007, as Nacogdoches County Days.",19923,Wayne Christian,author,80R,2525,Rep. Wayne Christian,Wayne Christian
HR 392,Recognizing the Young Conservatives of Texas on its 27th anniversary.,19923,Wayne Christian,author,80R,2525,Rep. Wayne Christian,Wayne Christian
HR 513,"Congratulating the Nacogdoches High School Band on its selection to participate in the 119th Rose Parade at the Tournament of Roses on January 1, 2008.",19923,Wayne Christian,author,80R,2525,Rep. Wayne Christian,Wayne Christian
HR 968,Congratulating Dr. Baker Pattillo on being named the eighth president of Stephen F. Austin State University.,19923,Wayne Christian,author,80R,2525,Rep. Wayne Christian,Wayne Christian
HR 969,In memory of Frank Edward Parker of Center.,19923,Wayne Christian,author,80R,2525,Rep. Wayne Christian,Wayne Christian
HR 970,In memory of Robert Vance Payne of Center.,19923,Wayne Christian,author,80R,2525,Rep. Wayne Christian,Wayne Christian
HR 971,In memory of U.S. Army Private First Class Travis Wayne Buford.,19923,Wayne Christian,author,80R,2525,Rep. Wayne Christian,Wayne Christian
HR 1051,In memory of James Earl Keffer of Dallas.,19923,Wayne Christian,author,80R,2525,Rep. Wayne Christian,Wayne Christian
HR 1052,"Recognizing March 27, 2007, as Shelby County Day at the State Capitol.",19923,Wayne Christian,author,80R,2525,Rep. Wayne Christian,Wayne Christian
