bill_name,caption,filer_id,filer_name,function,session
HR 2242,Congratulating Jake and Bettye Tucker of West on their 60th wedding anniversary.,None,Charles Doc Anderson,author,82R
HR 2243,In memory of Norvil Lavel Flatt.,None,Charles Doc Anderson,author,82R
HR 2244,In memory of Johnna Lynn Behringer of Waco.,None,Charles Doc Anderson,author,82R
HR 2245,In memory of Wayne Roy Neumann.,None,Charles Doc Anderson,author,82R
HR 2246,In memory of Benjamin Aviles of McGregor.,None,Charles Doc Anderson,author,82R
HR 2247,"In memory of Ernest E. ""Gene"" King of Robinson.",None,Charles Doc Anderson,author,82R
HR 2248,In memory of Dora Kate Howell of Waco.,None,Charles Doc Anderson,author,82R
HR 2249,"In memory of Ernest ""Ray"" Hicks of Waco.",None,Charles Doc Anderson,author,82R
HR 2250,In memory of Gloria St. John of Waco.,None,Charles Doc Anderson,author,82R
HR 2251,In memory of Ida Mae Niekamp of Waco.,None,Charles Doc Anderson,author,82R
HR 2252,In memory of Mary Ann Harold of Waco.,None,Charles Doc Anderson,author,82R
HR 2253,In memory of Dorothy Nolan of Waco.,None,Charles Doc Anderson,author,82R
HR 2288,In memory of Roy E. Kokel of Waco.,None,Charles Doc Anderson,author,82R
HR 2407,In memory of Adelia Engelbrecht of Crawford.,None,Charles Doc Anderson,author,82R
HR 2408,In memory of Helen Marie Davis of Waco.,None,Charles Doc Anderson,author,82R
HR 2409,In memory of Arlene M. Tomchesson of Waco.,None,Charles Doc Anderson,author,82R
HR 2410,"In memory of Milton John ""M. J."" Norris, Jr.",None,Charles Doc Anderson,author,82R
HR 2411,In memory of Mary Massie Goss.,None,Charles Doc Anderson,author,82R
HR 2412,In memory of Betty Jo Smith of Waco.,None,Charles Doc Anderson,author,82R
HR 2413,In memory of Curtis Rodriguez of Waco.,None,Charles Doc Anderson,author,82R
HR 2414,In memory of Debra Lynn Ramirez of Waco.,None,Charles Doc Anderson,author,82R
HR 2415,In memory of Charles Franklin Smith of Waco.,None,Charles Doc Anderson,author,82R
HR 2416,Congratulating Wendy Willis and Brandon Dale Sharp on their wedding.,None,Charles Doc Anderson,author,82R
HR 2583,In memory of James Stephen Odom of McGregor.,None,Charles Doc Anderson,author,82R
HR 2584,In memory of Hugh Clark Garland of Waco.,None,Charles Doc Anderson,author,82R
HR 2585,"In memory of Lorenzo ""Lorry"" Rosas of Speegleville.",None,Charles Doc Anderson,author,82R
HR 2586,In memory of Betty Ann McWilliams of Waco.,None,Charles Doc Anderson,author,82R
HR 2589,In memory of Anita Van Cleave Glass of Waco.,None,Charles Doc Anderson,author,82R
HR 2590,In memory of Diana Marie Woodward of Waco.,None,Charles Doc Anderson,author,82R
HR 2591,Congratulating Ashley Anne Roberts and Aaron Michael Rieger on their wedding.,None,Charles Doc Anderson,author,82R
HR 2592,In memory of Joe Alba of Waco.,None,Charles Doc Anderson,author,82R
HR 2593,In memory of Michael Benavidez of Waco.,None,Charles Doc Anderson,author,82R
HR 2594,In memory of Doris Kathleen Burch of Waco.,None,Charles Doc Anderson,author,82R
HR 2595,In memory of Laverne Townsend of Waco.,None,Charles Doc Anderson,author,82R
HR 2596,In memory of Iris Marie Vonasek of West.,None,Charles Doc Anderson,author,82R
HR 2597,In memory of Andrew Jackson Wade of Waco.,None,Charles Doc Anderson,author,82R
HR 2598,"Congratulating Michelle Penney and Jack Abel, Jr., on their wedding.",None,Charles Doc Anderson,author,82R
HR 2599,In memory of Joyce Norsworthy Wailes of Waco.,None,Charles Doc Anderson,author,82R
HR 2670,In memory of Lillian Rose Harlan of Woodway.,None,Charles Doc Anderson,author,82R
HR 2671,In memory of Bobby Alan Morris of Waco.,None,Charles Doc Anderson,author,82R
HR 2672,In memory of Nina Blackburn Ferguson of Robinson.,None,Charles Doc Anderson,author,82R
HR 2673,In memory of Melvyn E. Drake of Waco.,None,Charles Doc Anderson,author,82R
HR 2674,"In memory of George E. Busby, Sr., of Waco.",None,Charles Doc Anderson,author,82R
HR 2675,In memory of Karmin Tergerson Brown of Bellmead.,None,Charles Doc Anderson,author,82R
HR 2676,In memory of Maria Rosario Flores of Waco.,None,Charles Doc Anderson,author,82R
HR 2677,In memory of Martha Ann Belcher of Waco.,None,Charles Doc Anderson,author,82R
HR 2678,In memory of Eugenia G. Reyes of Woodway.,None,Charles Doc Anderson,author,82R
HR 2679,In memory of Billy R. Holtkamp of Robinson.,None,Charles Doc Anderson,author,82R
HR 2680,In memory of Linda Sue Brooks of Axtell.,None,Charles Doc Anderson,author,82R
HR 2741,In memory of Robert Scott Middleton of Moody.,None,Charles Doc Anderson,author,82R
HR 2742,In memory of Kellie Ona Campbell of West.,None,Charles Doc Anderson,author,82R
HR 2743,Congratulating Henry and Josephine Kubala of West on their 70th wedding anniversary.,None,Charles Doc Anderson,author,82R
HR 2744,Congratulating Edgar and Rena Belle Luedeker of Waco on their 70th wedding anniversary.,None,Charles Doc Anderson,author,82R
HR 2745,In memory of Brenda Sue Osterholtz of Crawford.,None,Charles Doc Anderson,author,82R
HR 2749,In memory of Thomas David Venable of Waco.,None,Charles Doc Anderson,author,82R
HR 2750,In memory of Bud Allan Price of Waco.,None,Charles Doc Anderson,author,82R
HR 2751,In memory of Kenneth Brown of Waco.,None,Charles Doc Anderson,author,82R
HR 2752,In memory of Gladys Frasier Griffin of Rosenthal.,None,Charles Doc Anderson,author,82R
HR 2753,In memory of James Francis Thomas of Waco.,None,Charles Doc Anderson,author,82R
HB 400,Relating to flexibility for public schools to administer primary and secondary education efficiently.,None,Charles Doc Anderson,author,82R
HB 437,Relating to manufacturers' inclusion of denatonium benzoate in certain products containing ethylene glycol.,None,Charles Doc Anderson,author,82R
HB 597,Relating to designating certain synthetic cannabinoids as controlled substances under the Texas Controlled Substances Act; providing penalties and establishing certain criminal consequences or procedures.,None,Charles Doc Anderson,author,82R
HB 812,Relating to the definition of peace officer for purposes of intercepting or collecting information in relation to certain communications in an investigation of criminal conduct.,None,Charles Doc Anderson,author,82R
HB 1064,Relating to exempting certain customers from certain demand charges by transmission and distribution utilities.,None,Charles Doc Anderson,author,82R
HB 1272,Relating to requiring employers to participate in the federal electronic verification of work authorization program or E-Verify; establishing an unlawful employment practice and providing criminal penalties.,None,Charles Doc Anderson,author,82R
HB 1681,Relating to the composition of the Finance Commission of Texas.,None,Charles Doc Anderson,author,82R
HB 2948,Relating to the designation of certain highways as part of the Purple Heart Trail.,None,Charles Doc Anderson,author,82R
HB 2986,Relating to political expenditures made by labor organizations; providing civil and criminal penalties.,None,Charles Doc Anderson,author,82R
HB 3179,Relating to contributions to the fund for veterans' assistance.,None,Charles Doc Anderson,author,82R
HR 204,"Honoring the Texas A&M College of Veterinary Medicine and Biomedical Sciences, the Texas Veterinary Medical Association, and veterinarians throughout Texas on the occasion of World Veterinary Year.",None,Charles Doc Anderson,author,82R
HR 1373,Congratulating the Texas A&M University women's basketball team on winning the NCAA Division I national championship.,None,Charles Doc Anderson,author,82R
HR 1694,"Commending President Barack Obama, intelligence personnel, and members of the armed forces for the successful completion of their operation.",None,Charles Doc Anderson,author,82R
HB 5,Relating to the Interstate Health Care Compact.,None,Charles Doc Anderson,coauthor,82R
HB 7,"Relating to the prosecution, punishment, and certain criminal and civil consequences of offenses involving or related to the trafficking of persons and to certain protections for victims of those offenses.",None,Charles Doc Anderson,coauthor,82R
HB 10,Relating to eligibility for a TEXAS grant and to administration of the TEXAS grant program.,None,Charles Doc Anderson,coauthor,82R
HB 11,Relating to reports filed with the comptroller regarding certain alcoholic beverage sales; providing a penalty.,None,Charles Doc Anderson,coauthor,82R
HB 12,Relating to the enforcement of state and federal laws governing immigration by certain governmental entities.,None,Charles Doc Anderson,coauthor,82R
HB 15,Relating to informed consent to an abortion.,None,Charles Doc Anderson,coauthor,82R
HB 32,Relating to required individual health insurance coverage.,None,Charles Doc Anderson,coauthor,82R
HB 108,Relating to the addition of a synthetic derivative of marihuana to Penalty Group 2 of the Texas Controlled Substances Act.,None,Charles Doc Anderson,coauthor,82R
HB 174,Relating to the cancellation of the voter registration and to the eligibility to vote of persons who are deceased or not citizens of the United States.,None,Charles Doc Anderson,coauthor,82R
HB 188,Relating to limitations on the use of eminent domain authority.,None,Charles Doc Anderson,coauthor,82R
HB 201,Relating to informed consent to an abortion.,None,Charles Doc Anderson,coauthor,82R
HB 238,"Relating to the issuance of ""Choose Life"" license plates and the creation of the Choose Life account in the general revenue fund.",None,Charles Doc Anderson,coauthor,82R
HB 241,Relating to liability for interest if land appraised for ad valorem tax purposes as agricultural or open-space land is sold or diverted to a different use.,None,Charles Doc Anderson,coauthor,82R
HB 274,Relating to the reform of certain remedies and procedures in civil actions and family law matters.,None,Charles Doc Anderson,coauthor,82R
HB 325,Relating to providing access to an ultrasound before an abortion.,None,Charles Doc Anderson,coauthor,82R
HB 335,Relating to implementation and requirements of certain health care reform laws.,None,Charles Doc Anderson,coauthor,82R
HB 500,Relating to state-adopted assessment instruments administered to  public school students.,None,Charles Doc Anderson,coauthor,82R
HB 529,Relating to certification for placement on the ballot of candidates for president or vice-president of the United States.,None,Charles Doc Anderson,coauthor,82R
HB 580,Relating to informed consent to an abortion.,None,Charles Doc Anderson,coauthor,82R
HB 681,Relating to an employee's transportation and storage of certain firearms or ammunition while on certain property owned or controlled by the employee's employer.,None,Charles Doc Anderson,coauthor,82R
HB 698,Relating to the carrying of concealed handguns by certain persons attending a school board meeting.,None,Charles Doc Anderson,coauthor,82R
HB 750,Relating to the carrying of concealed handguns on certain premises of or locations associated with schools or institutions of higher education.,None,Charles Doc Anderson,coauthor,82R
HB 816,Relating to coverage provided by certain qualified health plans for abortions.,None,Charles Doc Anderson,coauthor,82R
HB 817,Relating to the computation of taxable margin for purposes of the franchise tax by certain taxable entities.,None,Charles Doc Anderson,coauthor,82R
HB 1013,Relating to the powers and duties of the Texas Medical Board and the regulation of certain persons licensed by the board.,None,Charles Doc Anderson,coauthor,82R
HB 1201,Relating to repeal of authority for the establishment and operation of the Trans-Texas Corridor.,None,Charles Doc Anderson,coauthor,82R
HB 1548,Relating to adding certain synthetic substances to Penalty Group 2 of the Texas Controlled Substances Act.,None,Charles Doc Anderson,coauthor,82R
HB 1602,Relating to reporting requirements regarding the provision of an abortion or treatment for complications resulting from the provision of an abortion; creating criminal offenses; providing penalties.,None,Charles Doc Anderson,coauthor,82R
HB 1633,Relating to a person's ability to read and write in English as a qualification for service as a petit juror.,None,Charles Doc Anderson,coauthor,82R
HB 1766,Relating to the creation of a voluntary consumer-directed health plan for certain individuals eligible to participate in the insurance coverage provided under the Texas Employees Group Benefits Act and their qualified dependents.,None,Charles Doc Anderson,coauthor,82R
HB 1937,Relating to prosecution and punishment for the offense of official oppression by the intrusive touching of persons seeking access to public buildings and transportation; providing penalties.,None,Charles Doc Anderson,coauthor,82R
HB 1938,Relating to the regulation of body imaging scanning equipment in airports; providing criminal and civil penalties.,None,Charles Doc Anderson,coauthor,82R
HB 2097,Relating to adding a synthetic substance to Penalty Group 2 of the Texas Controlled Substances Act.,None,Charles Doc Anderson,coauthor,82R
HB 2118,Relating to adding certain synthetic compounds to Penalty Group 2 of the Texas Controlled Substances Act.,None,Charles Doc Anderson,coauthor,82R
HB 2483,Relating to certain do-not-resuscitate orders and advance directives; providing penalties.,None,Charles Doc Anderson,coauthor,82R
HB 2555,Relating to the regulation of abortion procedures; providing penalties.,None,Charles Doc Anderson,coauthor,82R
HB 2557,Relating to a suit for possession of or access to a child by a grandparent.,None,Charles Doc Anderson,coauthor,82R
HB 2592,Relating to notice and disclosure requirements for certain credit services organizations regarding charges and consumer borrowing; providing an administrative penalty.,None,Charles Doc Anderson,coauthor,82R
HB 2593,Relating to certain restrictions on deferred presentment transactions and motor vehicle certificate of title loans that a credit services organization obtains for a consumer or assists a consumer in obtaining.,None,Charles Doc Anderson,coauthor,82R
HB 2594,Relating to the licensing and regulation of certain credit services organizations and the regulation of certain extensions of consumer credit obtained by those organizations or with regard to which the organizations provide assistance; providing an administrative penalty.,None,Charles Doc Anderson,coauthor,82R
HB 2646,Relating to distribution by the School Land Board of revenue derived from permanent school fund land or other properties to the available school fund.,None,Charles Doc Anderson,coauthor,82R
HB 2828,Relating to the offense of coercing a person to have or seek an abortion and informed and voluntary consent for an abortion; providing penalties.,None,Charles Doc Anderson,coauthor,82R
HB 3104,Relating to precious metal coins.,None,Charles Doc Anderson,coauthor,82R
HB 3498,Relating to the penalty for illegal voting.,None,Charles Doc Anderson,coauthor,82R
HB 3520,Relating to advance directives or health care or treatment decisions made by or on behalf of patients.,None,Charles Doc Anderson,coauthor,82R
HCR 18,Urging Congress to propose and submit to the states an amendment to the United States Constitution providing for a federal balanced budget.,None,Charles Doc Anderson,coauthor,82R
HCR 50,"Affirming the pride of all Texans in both our one and indivisible national union and our one and indivisible state, claiming sovereignty under the Tenth Amendment to the Constitution of the United States over all powers not otherwise enumerated and granted to the federal government by the U.S. Constitution, serving notice to the federal government to cease and desist from certain mandates, and providing that certain federal legislation be prohibited or repealed.",None,Charles Doc Anderson,coauthor,82R
HCR 60,Urging Congress to propose and submit to the states for ratification the Parental Rights Amendment to the U.S. Constitution.,None,Charles Doc Anderson,coauthor,82R
HCR 66,Urging the United States Congress to prevent the Environmental Protection Agency from regulating greenhouse gases for stationary sources.,None,Charles Doc Anderson,coauthor,82R
HCR 126,In memory of the Honorable Edmund Kuempel of Seguin.,None,Charles Doc Anderson,coauthor,82R
HJR 37,Proposing a constitutional amendment requiring certain tax bills to be approved by two-thirds of all the members elected to each house of the legislature.,None,Charles Doc Anderson,coauthor,82R
HJR 56,Proposing a constitutional amendment to restrict the power of the legislature to mandate requirements on local governments.,None,Charles Doc Anderson,coauthor,82R
HJR 109,"Proposing a constitutional amendment to clarify references to the permanent school fund, to allow the General Land Office to distribute revenue derived from permanent school fund land or other properties to the available school fund, and to provide for an increase in the market value of the permanent school fund for the purpose of allowing increased distributions from the available school fund.",None,Charles Doc Anderson,coauthor,82R
HJR 135,Proposing a constitutional amendment relating to an individual's or a religious organization's freedom of religion.,None,Charles Doc Anderson,coauthor,82R
HR 288,"Recognizing March 3, 2011, as Texas Federation of Republican Women Day at the Capitol.",None,Charles Doc Anderson,coauthor,82R
SB 348,Relating to the sale or delivery of salvia divinorum or Salvinorin A; providing a penalty.,None,Charles Doc Anderson,sponsor,82R
SB 514,Relating to the acquisition of land and facilities by the Texas State Technical College System.,None,Charles Doc Anderson,sponsor,82R
SB 957,Relating to the clarification of terminology relating to the Waco Center for Youth.,None,Charles Doc Anderson,sponsor,82R
SJR 14,Proposing a constitutional amendment authorizing the legislature to provide for an exemption from ad valorem taxation of all or part of the market value of the residence homestead of the surviving spouse of a 100 percent or totally disabled veteran.,None,Charles Doc Anderson,sponsor,82R
SB 1311,Relating to the designation of certain highways as part of the Purple Heart Trail.,None,Charles Doc Anderson,sponsor,82R
SB 14,"Relating to requirements to vote, including presenting proof of identification; providing criminal penalties.",None,Charles Doc Anderson,cosponsor,82R
SB 24,"Relating to the prosecution, punishment, and certain criminal and civil consequences of offenses involving or related to the trafficking of persons and to certain protections for victims of those offenses.",None,Charles Doc Anderson,cosponsor,82R
SB 257,"Relating to the issuance of ""Choose Life"" license plates and the creation of the Choose Life account in the general revenue fund.",None,Charles Doc Anderson,cosponsor,82R
SB 331,Relating to designating certain synthetic cannabinoids as controlled substances under the Texas Controlled Substances Act; providing penalties and establishing certain criminal consequences or procedures.,None,Charles Doc Anderson,cosponsor,82R
HB 126,Relating to the addition of Salvia divinorum and its derivatives and extracts to Penalty Group 3 of the Texas Controlled Substances Act.,None,Charles Doc Anderson,author,81R
HB 366,Relating to creating a task force to review electric energy generation policies and to study the state's long-term demand for electric generation capacity.,None,Charles Doc Anderson,author,81R
HB 367,Relating to restrictions on written information required to be provided by school districts and public school teachers.,None,Charles Doc Anderson,author,81R
HB 368,Relating to site-based public school discipline policy committees.,None,Charles Doc Anderson,author,81R
HB 373,Relating to requiring a voter to present proof of identification.,None,Charles Doc Anderson,author,81R
HB 1374,Relating to the application of certain demand charges by transmission and distribution utilities to certain schools and nonprofit athletic or sports associations.,None,Charles Doc Anderson,author,81R
HB 2765,Relating to the authority of a veterinarian to fill certain prescriptions in an emergency.,None,Charles Doc Anderson,author,81R
HB 2766,Relating to the jurisdiction and operation of the district courts in McLennan County.,None,Charles Doc Anderson,author,81R
HB 2767,Relating to the issuance of specialty license plates for municipal judges and justices of the peace.,None,Charles Doc Anderson,author,81R
HB 2768,Relating to applicability of fee exemptions for military personnel and their children to certain course fees charged by public technical institutes and public state colleges.,None,Charles Doc Anderson,author,81R
HB 2769,Relating to the requirement that a seller of regulated material to a metal recycling entity present evidence of an occupational license.,None,Charles Doc Anderson,author,81R
HB 2770,Relating to the consideration of the cumulative effects of certain air contaminant emissions in the emissions permitting process for electric generating facilities.,None,Charles Doc Anderson,author,81R
HB 2771,Relating to the computation of total revenue in relation to facilities that use a carbon gasification technology to generate electricity.,None,Charles Doc Anderson,author,81R
HB 3606,Relating to election through secret ballot of a labor union as the exclusive bargaining representative.,None,Charles Doc Anderson,author,81R
HCR 62,Extending appreciation to former president George W. Bush for his service to our state and nation.,None,Charles Doc Anderson,author,81R
HCR 63,Honoring former first lady Laura Bush and welcoming her back to Texas.,None,Charles Doc Anderson,author,81R
HCR 168,Extending appreciation to former president George W. Bush for his service to our state and nation.,None,Charles Doc Anderson,author,81R
HJR 20,Proposing a constitutional amendment relating to the right to hunt and fish.,None,Charles Doc Anderson,author,81R
HJR 30,Proposing a constitutional amendment requiring any increase in a rate of the franchise tax be approved by two-thirds of all the members elected to each house of the legislature.,None,Charles Doc Anderson,author,81R
HJR 31,Proposing a constitutional amendment to prohibit the state or a political subdivision of the state from taking private property for the primary purpose of economic development or to benefit a particular private party.,None,Charles Doc Anderson,author,81R
HR 551,In memory of Chaplain Wendell A. Russell of Waco.,None,Charles Doc Anderson,author,81R
HR 552,"Recognizing February 24, 2009, as Waco Day at the State Capitol.",None,Charles Doc Anderson,author,81R
HR 553,In memory of Diana Cooke of Waco.,None,Charles Doc Anderson,author,81R
HR 554,In memory of Stanley Alvin Fleming of Elm Mott.,None,Charles Doc Anderson,author,81R
HR 555,In memory of Judith Ann Francis of Waco.,None,Charles Doc Anderson,author,81R
HR 556,In memory of Lou Jean Doak of Waco.,None,Charles Doc Anderson,author,81R
HR 557,In memory of Gregory Dayle Gillenwater of Woodway.,None,Charles Doc Anderson,author,81R
HR 746,"Recognizing March 11, 2009, as Hewitt Day at the State Capitol.",None,Charles Doc Anderson,author,81R
HR 901,"Recognizing March 24, 2009, as Texas State Technical College Day at the State Capitol.",None,Charles Doc Anderson,author,81R
HR 990,Congratulating the Robinson High School girls' basketball team on winning the 2009 UIL 3A state championship.,None,Charles Doc Anderson,author,81R
HR 1071,In memory of William Eugene Nichols of Hewitt.,None,Charles Doc Anderson,author,81R
HR 1072,Congratulating the football team of Reicher Catholic High School in Waco on winning the 2008 TAPPS Division 3 state title.,None,Charles Doc Anderson,author,81R
HR 1073,Congratulating the girls' basketball team from Midway High School in Waco on winning the 2009 UIL 4A state championship.,None,Charles Doc Anderson,author,81R
HR 1469,"Recognizing April 21, 2009 as West Day at the State Capitol.",None,Charles Doc Anderson,author,81R
HR 1514,"Honoring the life of Thomas Champe Fitzhugh, Jr., of Waco.",None,Charles Doc Anderson,author,81R
HR 1515,Congratulating Gladys and George Picha of Waco on their 50th wedding anniversary.,None,Charles Doc Anderson,author,81R
HR 1516,Congratulating Garrett Jaynes of Hewitt on becoming an Eagle Scout.,None,Charles Doc Anderson,author,81R
HR 1517,"Congratulating Sam H. Shurtleff, Jr., and Glen Rose Shurtleff of Waco on their 60th wedding anniversary.",None,Charles Doc Anderson,author,81R
HR 1518,Congratulating the Baylor University men's basketball team on its successful 2008-2009 season.,None,Charles Doc Anderson,author,81R
HR 1519,Congratulating Johnny and Dorothy Vanek of Robinson on their 50th wedding anniversary.,None,Charles Doc Anderson,author,81R
HR 1520,Congratulating Edward and Billie Brem of Lorena on their 50th wedding anniversary.,None,Charles Doc Anderson,author,81R
HR 1521,Honoring Edward and Edna Thompson of Woodway on their 50th wedding anniversary.,None,Charles Doc Anderson,author,81R
HR 1522,Congratulating Marty and Marilyn Ginnane of Waco on their 50th wedding anniversary.,None,Charles Doc Anderson,author,81R
HR 1523,Congratulating Al and Mary Helen Dees of Waco on the occasion of their 50th wedding anniversary.,None,Charles Doc Anderson,author,81R
HR 1524,Congratulating George and Dorcas Simpson of Lorena on their 50th wedding anniversary in 2007.,None,Charles Doc Anderson,author,81R
HR 1525,Congratulating Lieutenant Jeff Lewellen on his receipt of a Life-Saving Award from the Robinson Police Department.,None,Charles Doc Anderson,author,81R
HR 1526,Congratulating Barry Gann on his receipt of a Distinguished Service Award from the Robinson Police Department.,None,Charles Doc Anderson,author,81R
HR 1527,"Congratulating John ""D. J."" and Marillyn Nystrom on their 60th wedding anniversary.",None,Charles Doc Anderson,author,81R
HR 1528,Congratulating Jessica Dumesnil on her receipt of a Life-Saving Award from the Robinson Police Department.,None,Charles Doc Anderson,author,81R
HR 1569,Congratulating Corporal Brent Ewing on his receipt of a Distinguished Service Award from the Robinson Police Department.,None,Charles Doc Anderson,author,81R
