bill_name,caption,filer_id,filer_name,function,session,leg_id,original_name,parsed_name
HB 408,Relating to misrepresentation concerning political activity of a tax-exempt organization; providing a criminal penalty.,12135,John Shields,author,77R,4435,Rep. John Shields,John Shields
HB 409,"Relating to the requirement that the name, address, and phone number of a bondsman appear on the face of performance and payment bonds.",12135,John Shields,author,77R,4435,Rep. John Shields,John Shields
HB 540,Relating to collateral protection insurance.,12135,John Shields,author,77R,4435,Rep. John Shields,John Shields
HB 1032,Relating to the purposes for which certain municipalities may use revenue from the municipal hotel occupancy tax.,12135,John Shields,author,77R,4435,Rep. John Shields,John Shields
HB 1257,"Relating to the issuance of special ""Choose Life"" license plates.",12135,John Shields,author,77R,4435,Rep. John Shields,John Shields
HB 1323,Relating to the expunction of arrest records and files when an indictment or information is dismissed or quashed.,12135,John Shields,author,77R,4435,Rep. John Shields,John Shields
HB 1389,Relating to the classification of the use of water for the irrigation of horticultural products for purposes of regulation by the Edwards Aquifer Authority.,12135,John Shields,author,77R,4435,Rep. John Shields,John Shields
HB 1426,Relating to the repeal of an obsolete provision authorizing a temporary reduction of the royalty rate on gas produced from certain state land.,12135,John Shields,author,77R,4435,Rep. John Shields,John Shields
HB 1455,"Relating to the creation, administration, powers, duties, operations, and financing of Cibolo Canyon Conservation and Improvement District No. 1; granting the authority to impose taxes and issue bonds; granting the power of eminent domain.",12135,John Shields,author,77R,4435,Rep. John Shields,John Shields
HB 1835,Relating to responses to medical grievances filed by inmates confined by the Texas Department of Criminal Justice.,12135,John Shields,author,77R,4435,Rep. John Shields,John Shields
HB 1960,Relating to character education programs in public schools.,12135,John Shields,author,77R,4435,Rep. John Shields,John Shields
HB 2014,"Relating to the creation, administration, powers, duties, operation, and financing of the Southern Trinity Groundwater Conservation District.",12135,John Shields,author,77R,4435,Rep. John Shields,John Shields
HB 2067,Relating to the eligibility of certain persons to serve as members of the State Board of Education or act as general counsel to that board.,12135,John Shields,author,77R,4435,Rep. John Shields,John Shields
HB 2581,Relating to certain subdivision improvements and the bond requirements for certain subdivision improvements.,12135,John Shields,author,77R,4435,Rep. John Shields,John Shields
HB 3228,Relating to containment systems required for certain underground storage tanks.,12135,John Shields,author,77R,4435,Rep. John Shields,John Shields
HB 3557,Relating to advanced transportation districts and the funding of those districts.,12135,John Shields,author,77R,4435,Rep. John Shields,John Shields
HCR 319,Commemorating the quasquicentennial of the Texas Constitution.,12135,John Shields,author,77R,4435,Rep. John Shields,John Shields
HR 54,Amending the House Rules to prohibit Sunday sessions.,12135,John Shields,author,77R,4435,Rep. John Shields,John Shields
HR 1176,Honoring Winston Churchill High School senior Nicole Melton for winning the Class 5A individual girls state golf title.,12135,John Shields,author,77R,4435,Rep. John Shields,John Shields
HR 1203,Honoring Hidden Forest Elementary School for being selected as a national Blue Ribbon School.,12135,John Shields,author,77R,4435,Rep. John Shields,John Shields
HB 86,Relating to character education programs in public schools.,12135,John Shields,author,77R,4435,Rep. John Shields,John Shields
HB 1187,Relating to the Parents as Scholars pilot program for certain recipients of temporary assistance for needy families.,12135,John Shields,author,77R,4435,Rep. John Shields,John Shields
HB 2005,"Relating to the creation, administration, powers, duties, operation, and financing of the Trinity Glen Rose Groundwater Conservation District.",12135,John Shields,author,77R,4435,Rep. John Shields,John Shields
HB 3202,Relating to the disqualification of a judge in an action that arise under the Election Code.,12135,John Shields,author,77R,4435,Rep. John Shields,John Shields
HR 485,"Memorializing the Congress of the United States to propose and submit to the states for ratification an amendment to the United States Constitution to prohibit federal courts from ordering or instructing any state or political subdivision thereof, or an official of any state or political subdivision, to levy or increase taxes.",12135,John Shields,author,77R,4435,Rep. John Shields,John Shields
HR 763,Congratulating Alexander E. Briseno on his retirement as city manager of San Antonio.,12135,John Shields,author,77R,4435,Rep. John Shields,John Shields
HB 17,Relating to regulation of abortion.,12135,John Shields,coauthor,77R,4435,Rep. John Shields,John Shields
HB 63,Relating to the suspension of a person's driver's license following the person's arrest for certain intoxication offenses.,12135,John Shields,coauthor,77R,4435,Rep. John Shields,John Shields
HB 89,Relating to possessing or consuming an alcoholic beverage in a motor vehicle.,12135,John Shields,coauthor,77R,4435,Rep. John Shields,John Shields
HB 90,Relating to the civil and criminal consequences of operating a motor vehicle while intoxicated.,12135,John Shields,coauthor,77R,4435,Rep. John Shields,John Shields
HB 91,Relating to possessing or consuming an alcoholic beverage in a motor vehicle and to the civil and criminal consequences of operating a motor vehicle while intoxicated.,12135,John Shields,coauthor,77R,4435,Rep. John Shields,John Shields
HB 137,Relating to excepting certain information relating to family violence shelter centers and sexual assault programs from disclosure under the public information law.,12135,John Shields,coauthor,77R,4435,Rep. John Shields,John Shields
HB 386,Relating to participation by private school students in University Interscholastic League sponsored activities.,12135,John Shields,coauthor,77R,4435,Rep. John Shields,John Shields
HB 496,Relating to the recognition of a same-sex marriage or civil union.,12135,John Shields,coauthor,77R,4435,Rep. John Shields,John Shields
HB 754,Relating to the use of uniform election dates.,12135,John Shields,coauthor,77R,4435,Rep. John Shields,John Shields
HB 801,Relating to the implementation of a public education curriculum based on scientific research.,12135,John Shields,coauthor,77R,4435,Rep. John Shields,John Shields
HB 909,Relating to the forfeiture of profits received from the sale of crime memorabilia.,12135,John Shields,coauthor,77R,4435,Rep. John Shields,John Shields
HB 911,Relating to character education programs in public schools.,12135,John Shields,coauthor,77R,4435,Rep. John Shields,John Shields
HB 1200,"Relating to the enactment of the Texas Economic Development Act, authorizing certain ad valorem tax incentives for economic development, including authorizing school districts to provide tax relief for certain corporations and limited liability companies that make large investments that create jobs in this state, to authorizing the imposition of certain impact fees, and to continuing the Property Redevelopment and Tax Abatement Act.",12135,John Shields,coauthor,77R,4435,Rep. John Shields,John Shields
HB 1244,Relating to fetal pain during abortion; providing a penalty.,12135,John Shields,coauthor,77R,4435,Rep. John Shields,John Shields
HB 1439,Relating to the creation of a municipal development corporation to provide educational and job training; authorizing the imposition of certain local taxes and the issuance of local bonds; providing an administrative penalty.,12135,John Shields,coauthor,77R,4435,Rep. John Shields,John Shields
HB 1600,"Relating to the punishment for the offense of taking or attempting to take a weapon from a peace officer, parole officer, or community supervision and corrections department officer.",12135,John Shields,coauthor,77R,4435,Rep. John Shields,John Shields
HB 1668,Relating to character education programs in public schools.,12135,John Shields,coauthor,77R,4435,Rep. John Shields,John Shields
HB 1752,Relating to proof of financial responsibility in connection with operation of a motor vehicle and creating the motor vehicle insurance verification program; providing criminal penalties.,12135,John Shields,coauthor,77R,4435,Rep. John Shields,John Shields
HB 1776,Relating to the establishment of Celebrate Freedom Week in public schools.,12135,John Shields,coauthor,77R,4435,Rep. John Shields,John Shields
HB 1806,Relating to the issuance of certain alcoholic beverage licenses and permits.,12135,John Shields,coauthor,77R,4435,Rep. John Shields,John Shields
HB 1809,Relating to certain transactions subject to regulation as loans.,12135,John Shields,coauthor,77R,4435,Rep. John Shields,John Shields
HB 1869,Relating to the acquisition of manufactured homes through financing or other means and to persons associated with those acquisitions.,12135,John Shields,coauthor,77R,4435,Rep. John Shields,John Shields
HB 2060,Relating to returning a public school teacher to probationary contract status.,12135,John Shields,coauthor,77R,4435,Rep. John Shields,John Shields
HB 2215,Relating to the disannexation of certain areas by certain municipalities.,12135,John Shields,coauthor,77R,4435,Rep. John Shields,John Shields
HCR 77,Memorializing congress to revise certain provisions of Public Law 106-230.,12135,John Shields,coauthor,77R,4435,Rep. John Shields,John Shields
HCR 207,Requesting the Texas  delegation to the U.S. Congress to support and work to pass the tax relief plan introduced by President Bush.,12135,John Shields,coauthor,77R,4435,Rep. John Shields,John Shields
HR 183,"Honoring Cenizo Park Elementary School for being awarded ""exemplary"" status by the Texas Education Agency.",12135,John Shields,coauthor,77R,4435,Rep. John Shields,John Shields
HR 790,In memory of Officer Hector Garza of San Antonio.,12135,John Shields,coauthor,77R,4435,Rep. John Shields,John Shields
HR 1200,Honoring Edward D. Garza on his election as mayor of San Antonio.,12135,John Shields,coauthor,77R,4435,Rep. John Shields,John Shields
SB 7,Relating to the period during which a person arrested is required to be taken before a magistrate or released on bond and to the appointment and compensation of counsel to represent indigent persons accused of crime.,12135,John Shields,sponsor,77R,4435,Rep. John Shields,John Shields
SB 19,Relating to health education in public schools and to the improvement of children's health through daily physical activity in public schools and a coordinated approach by public schools to prevent obesity and certain diseases.,12135,John Shields,cosponsor,77R,4435,Rep. John Shields,John Shields
SB 795,Relating to the forfeiture of profits received from the sale of crime memorabilia.,12135,John Shields,cosponsor,77R,4435,Rep. John Shields,John Shields
HB 704,Relating to a teacher's right of refusal following an assault by a student and allowing school districts the option of expelling students for assaulting school district employees.,12135,John Shields,author,76R,4435,Rep. John Shields,John Shields
HB 705,"Relating to the creation of the offenses of and providing for recovery of reasonable attorney's fees for falsely identifying a tax-exempt organization with political activity or endangering the tax-exempt status of an organization by unauthorized engaging in political activity in the name of the organization, and creating a private cause of action.",12135,John Shields,author,76R,4435,Rep. John Shields,John Shields
HB 1267,Relating to the fee an employer may deduct from an employee's earnings for withholding child support from salary.,12135,John Shields,author,76R,4435,Rep. John Shields,John Shields
HB 1292,Relating to the sales price of a taxable item that may be sold in a tax-free sale held by certain organizations.,12135,John Shields,author,76R,4435,Rep. John Shields,John Shields
HB 1743,Relating to the registration and the transfer of motor vehicles owned by certain persons on active duty in the armed forces of the United States.,12135,John Shields,author,76R,4435,Rep. John Shields,John Shields
HB 1791,Relating to the expunction of arrest records and files when an indictment or information is dismissed or quashed.,12135,John Shields,author,76R,4435,Rep. John Shields,John Shields
HB 2195,Relating to the creation of a municipal court of record in Hill Country Village.,12135,John Shields,author,76R,4435,Rep. John Shields,John Shields
HB 3698,Relating to allowing Health Maintenance Organization enrollees to choose a nonnetwork pediatrician as primary care physician.,12135,John Shields,author,76R,4435,Rep. John Shields,John Shields
HB 3699,Relating to the distribution of federal local law enforcement block grants; granting rulemaking authority.,12135,John Shields,author,76R,4435,Rep. John Shields,John Shields
HB 3700,Relating to notice of intent to use real property for a public purpose.,12135,John Shields,author,76R,4435,Rep. John Shields,John Shields
HB 3701,Relating to a school property tax credit for certain education-related expenses.,12135,John Shields,author,76R,4435,Rep. John Shields,John Shields
HB 3702,Relating to a governor's private citizen committee to study and recommend cost control in state government.,12135,John Shields,author,76R,4435,Rep. John Shields,John Shields
HB 3703,Relating to the payment of interest on tax overpayments.,12135,John Shields,author,76R,4435,Rep. John Shields,John Shields
HB 3704,"Relating to the requirement for the name, address, and phone number of the bondsman to appear on the face of performance and payment bonds.",12135,John Shields,author,76R,4435,Rep. John Shields,John Shields
HB 3714,Relating to collateral protection insurance.,12135,John Shields,author,76R,4435,Rep. John Shields,John Shields
HB 3715,Relating to the definition of higher education institutions under the Higher Education Coordinating Act of 1965.,12135,John Shields,author,76R,4435,Rep. John Shields,John Shields
HCR 54,Congratulating Dr. Ronald K. Calgaard on his retirement from Trinity University.,12135,John Shields,author,76R,4435,Rep. John Shields,John Shields
HJR 7,"Proposing a constitutional amendment to impose term limits on the Governor, Lieutenant Governor and Speaker of the House of Representatives.",12135,John Shields,author,76R,4435,Rep. John Shields,John Shields
HR 127,Honoring Dr. Ronald K. Calgaard on his retirement from Trinity University.,12135,John Shields,author,76R,4435,Rep. John Shields,John Shields
HR 513,In memory of Diane Howe Ross.,12135,John Shields,author,76R,4435,Rep. John Shields,John Shields
HR 573,"Memorializing the Congress of the United States to propose and submit to the states for ratification an amendment to the United States Constitution to prohibit federal courts from ordering or instructing any state or political subdivision thereof, or an official of any state or political subdivision, to levy or increase taxes.",12135,John Shields,author,76R,4435,Rep. John Shields,John Shields
HR 1033,Honoring the Odyssey of the Mind team from Barbara Bush Middle School.,12135,John Shields,author,76R,4435,Rep. John Shields,John Shields
HR 1322,"Recognizing Redland Oaks Elementary School's ""Exemplary"" status.",12135,John Shields,author,76R,4435,Rep. John Shields,John Shields
HB 736,Relating to exceptions to the requirement to conduct elections on uniform election dates.,12135,John Shields,author,76R,4435,Rep. John Shields,John Shields
HB 1756,Relating to the adoption of a county charter by Bexar County.,12135,John Shields,author,76R,4435,Rep. John Shields,John Shields
HB 3396,Relating to parental rights concerning students in public schools.,12135,John Shields,author,76R,4435,Rep. John Shields,John Shields
HJR 12,Proposing a constitutional amendment to require a two-thirds vote of the membership of each house of the legislature to enact certain tax bills.,12135,John Shields,author,76R,4435,Rep. John Shields,John Shields
HJR 61,"Proposing a constitutional amendment to allow the voters of certain counties to adopt a charter that restructures and empowers the county government and that may allow the integration of the county government with certain other political subdivisions located, in whole or in part, in the county.",12135,John Shields,author,76R,4435,Rep. John Shields,John Shields
HB 48,Relating to the punishment for theft committed against elderly individuals.,12135,John Shields,coauthor,76R,4435,Rep. John Shields,John Shields
HB 49,Relating to a misdemeanant's liability for the cost of confinement in a county jail.,12135,John Shields,coauthor,76R,4435,Rep. John Shields,John Shields
HB 86,Relating to sales tax exemptions.,12135,John Shields,coauthor,76R,4435,Rep. John Shields,John Shields
HB 140,Relating to the state's support of certain municipalities' bids to host the 2007 Pan American Games and the 2012 Summer Olympic Games and agreements relating to the hosting of those international sporting events.,12135,John Shields,coauthor,76R,4435,Rep. John Shields,John Shields
HB 341,Relating to the use of certain information regarding a current or former employee.,12135,John Shields,coauthor,76R,4435,Rep. John Shields,John Shields
HB 350,Relating to creating a covenant marriage.,12135,John Shields,coauthor,76R,4435,Rep. John Shields,John Shields
HB 543,Relating to the designation of a person to receive notice of utility service connections.,12135,John Shields,coauthor,76R,4435,Rep. John Shields,John Shields
HB 603,Relating to the abolition of the Public Utility Commission of Texas and to the transfer of its powers and duties to the Railroad Commission of Texas.,12135,John Shields,coauthor,76R,4435,Rep. John Shields,John Shields
HB 604,Relating to contingent fee contracts for legal services entered into by a state or local governmental entity and to the deposit of certain delinquent or disputed funds recovered by a state or local governmental entity.,12135,John Shields,coauthor,76R,4435,Rep. John Shields,John Shields
HB 623,Relating to parental notification before an abortion may be performed on certain minors; providing a criminal penalty.,12135,John Shields,coauthor,76R,4435,Rep. John Shields,John Shields
HB 695,Relating to the contracting power of the Upper Trinity Regional Water District.,12135,John Shields,coauthor,76R,4435,Rep. John Shields,John Shields
HB 713,"Relating to the establishment and operation of the Toward EXcellence, Access, & Success (TEXAS) grant program and the Teach for Texas Grant Program; consolidating and revising financial aid, grant, and scholarship programs; and providing for the education, certification, and recruitment of teachers and faculty instructors.",12135,John Shields,coauthor,76R,4435,Rep. John Shields,John Shields
HB 911,Relating to character education programs in public schools.,12135,John Shields,coauthor,76R,4435,Rep. John Shields,John Shields
HB 1036,Relating to class actions.,12135,John Shields,coauthor,76R,4435,Rep. John Shields,John Shields
HB 1057,Relating to computation of annuities for members of the elected class of the Employees Retirement System of Texas.,12135,John Shields,coauthor,76R,4435,Rep. John Shields,John Shields
HB 1195,Relating to authorizing school districts to offer drug testing programs.,12135,John Shields,coauthor,76R,4435,Rep. John Shields,John Shields
HB 1200,"Relating to the disannexation of certain areas annexed on or after December 1, 1996, by certain municipalities.",12135,John Shields,coauthor,76R,4435,Rep. John Shields,John Shields
HB 1309,Relating to the regulation of private process servers; providing penalties.,12135,John Shields,coauthor,76R,4435,Rep. John Shields,John Shields
HB 1418,Relating to optional career and technology education programs offered by public school districts and a study of career and technology education programs.,12135,John Shields,coauthor,76R,4435,Rep. John Shields,John Shields
HB 1561,"Relating to the authority of governmental entities to bring suit against a firearms or ammunition manufacturer, trade association, or seller.",12135,John Shields,coauthor,76R,4435,Rep. John Shields,John Shields
HB 1638,Relating to parental consent before an abortion may be performed on a minor.,12135,John Shields,coauthor,76R,4435,Rep. John Shields,John Shields
HB 1683,Relating to funding for school districts that open new schools or expand existing schools.,12135,John Shields,coauthor,76R,4435,Rep. John Shields,John Shields
HB 1685,Relating to state assistance for school facilities in certain fast-growth school districts.,12135,John Shields,coauthor,76R,4435,Rep. John Shields,John Shields
HB 1701,Relating to the regulation of telecommunications utilities and to the provision of telecommunications and related services.,12135,John Shields,coauthor,76R,4435,Rep. John Shields,John Shields
HB 1716,"Relating to certain suits against firearms or ammunition manufacturers, trade associations, or sellers.",12135,John Shields,coauthor,76R,4435,Rep. John Shields,John Shields
HB 2117,Relating to the authority of a school district to permit certain persons to perform teaching services or to provide teachers for the district in lieu of paying ad valorem taxes owed to the district.,12135,John Shields,coauthor,76R,4435,Rep. John Shields,John Shields
HB 2680,Relating to exemptions from ad valorem and sales and use taxation of certain timber and certain items used in timber operations and the valuation of certain timber land for ad valorem tax purposes.,12135,John Shields,coauthor,76R,4435,Rep. John Shields,John Shields
HB 2869,Relating to the requirement that a child provide certain information to a juvenile probation officer as a condition of probation for certain offenses involving a handgun.,12135,John Shields,coauthor,76R,4435,Rep. John Shields,John Shields
HB 3461,Relating to the regulation of certain political contributions and political expenditures; providing civil and criminal penalties.,12135,John Shields,coauthor,76R,4435,Rep. John Shields,John Shields
HJR 21,Proposing a constitutional amendment to require a two-thirds vote of the membership of each house of the legislature to enact certain tax bills.,12135,John Shields,coauthor,76R,4435,Rep. John Shields,John Shields
HR 558,Honoring Pulitzer Prize winner Ken Towery of Austin.,12135,John Shields,coauthor,76R,4435,Rep. John Shields,John Shields
SB 1166,Relating to the purposes for which certain municipalities may use revenue from the municipal hotel occupancy tax.,12135,John Shields,sponsor,76R,4435,Rep. John Shields,John Shields
HB 526,Relating to the immediate qualification for an ad valorem tax exemption for a church or other nonprofit organization.,12135,John Shields,author,75R,4435,Rep. John Shields,John Shields
HB 531,Relating to expunction of certain records of the Texas Department of Insurance.,12135,John Shields,author,75R,4435,Rep. John Shields,John Shields
HB 598,Relating to reimbursement of certain administrative costs incurred by an employer in implementing a garnishment order.,12135,John Shields,author,75R,4435,Rep. John Shields,John Shields
HB 635,Relating to public school admission and attendance; providing a criminal penalty.,12135,John Shields,author,75R,4435,Rep. John Shields,John Shields
HB 669,Relating to certain activities involving false proof of motor vehicle liability insurance coverage; providing criminal penalties.,12135,John Shields,author,75R,4435,Rep. John Shields,John Shields
HB 670,Relating to the appraisal of property for ad valorem tax purposes.,12135,John Shields,author,75R,4435,Rep. John Shields,John Shields
HB 730,Relating to promoting security and safety for neighborhood residents by permitting the limiting of access to certain municipal streets and alleys.,12135,John Shields,author,75R,4435,Rep. John Shields,John Shields
HB 731,Relating to the funding of the telecommunications infrastructure fund.,12135,John Shields,author,75R,4435,Rep. John Shields,John Shields
HB 760,Relating to a franchise tax credit for contributions made to medical savings accounts.,12135,John Shields,author,75R,4435,Rep. John Shields,John Shields
HB 811,Relating to liability insurance provided by a school district for certain purposes.,12135,John Shields,author,75R,4435,Rep. John Shields,John Shields
HB 1781,Relating to creating a governor's committee to study cost control in state government.,12135,John Shields,author,75R,4435,Rep. John Shields,John Shields
HB 2274,Relating to the exemption of insurance benefits and certain annuity proceeds from seizure under process.,12135,John Shields,author,75R,4435,Rep. John Shields,John Shields
HB 2275,Relating to the jurisdiction of and procedure in justice and small claims courts.,12135,John Shields,author,75R,4435,Rep. John Shields,John Shields
HB 2276,"Relating to the disposition of a juvenile who damages property with graffiti, to law enforcement records relating to a child who uses a graffiti tag, and to the criminal responsibility of a parent for a child's criminal mischief involving graffiti; providing a penalty.",12135,John Shields,author,75R,4435,Rep. John Shields,John Shields
HB 2969,Relating to the expunction of arrest records and files when an indictment or information is dismissed or quashed.,12135,John Shields,author,75R,4435,Rep. John Shields,John Shields
HB 3008,Relating to certain inquiries made by the Texas Department of Insurance and information from those inquiries.,12135,John Shields,author,75R,4435,Rep. John Shields,John Shields
HB 3422,Relating to certain district courts in Bexar County.,12135,John Shields,author,75R,4435,Rep. John Shields,John Shields
