bill_name,caption,filer_id,filer_name,function,session
HR 1570,Congratulating Ruth Pitts of McLennan Community College for being named a Piper Professor of 2008.,None,Charles Doc Anderson,author,81R
HR 1571,Congratulating Officer Patrick Carey on his receipt of a Life-Saving Award from the Robinson Police Department.,None,Charles Doc Anderson,author,81R
HR 1572,Congratulating Fernando and Hortensia Reyna on their 50th wedding anniversary.,None,Charles Doc Anderson,author,81R
HR 1573,Congratulating Jacob L. Oatman of Waco on attaining the rank of Eagle Scout.,None,Charles Doc Anderson,author,81R
HR 1574,Congratulating David Johnson of Crawford on becoming an Eagle Scout.,None,Charles Doc Anderson,author,81R
HR 1575,Congratulating T. J. and Jerrie Lynn Corbitt of Waco on their 50th anniversary.,None,Charles Doc Anderson,author,81R
HR 1576,In memory of Lucile Lacy Taylor II of Waco.,None,Charles Doc Anderson,author,81R
HR 1577,Congratulating John R. Dailey of Lorena on attaining the rank of Eagle Scout.,None,Charles Doc Anderson,author,81R
HR 1578,Congratulating J. T. and Reba Taylor on their 70th wedding anniversary.,None,Charles Doc Anderson,author,81R
HR 1674,Congratulating James and Nancy Swor of Waco on their 50th wedding anniversary.,None,Charles Doc Anderson,author,81R
HR 1675,Congratulating Johnny Mynar of West on his retirement from the McLennan County Sheriff's Office.,None,Charles Doc Anderson,author,81R
HR 1676,In memory of Margaret Gilder Nesbitt of Waco.,None,Charles Doc Anderson,author,81R
HR 1677,In memory of Nancy Elaine Hagemann Frazier of Waco.,None,Charles Doc Anderson,author,81R
HR 1678,Congratulating Jane and Hubert Z. Shannon of Waco on their 50th wedding anniversary.,None,Charles Doc Anderson,author,81R
HR 1679,In memory of John D. Cabaniss of Waco.,None,Charles Doc Anderson,author,81R
HR 1680,In memory of U.S. Marine Lieutenant Corporal Johnny Ray Strong.,None,Charles Doc Anderson,author,81R
HR 1681,Congratulating Willie and Maxine Hammonds of Waco on their 50th wedding anniversary.,None,Charles Doc Anderson,author,81R
HR 1682,Congratulating Dr. Debra Bishop on being named the 2008 Hazel Harvey Peace Educator of the Year.,None,Charles Doc Anderson,author,81R
HR 1683,Congratulating Lewis and Mary Propst of Hewitt on their 50th wedding anniversary.,None,Charles Doc Anderson,author,81R
HR 1684,Congratulating Robert and Doris Bray of Woodway on their 55th wedding anniversary.,None,Charles Doc Anderson,author,81R
HR 1685,Congratulating Jack and Cathryn Garrison of Elm Mott on their 70th wedding anniversary.,None,Charles Doc Anderson,author,81R
HR 1686,Congratulating Melton and Julie Connell of Woodway on their 60th wedding anniversary.,None,Charles Doc Anderson,author,81R
HR 1687,Congratulating Jimmy and Margie Voiles of Hewitt on their 50th wedding anniversary.,None,Charles Doc Anderson,author,81R
HR 1688,Congratulating Bill and Stella Ellis of Waco on their 60th wedding anniversary.,None,Charles Doc Anderson,author,81R
HR 1797,Congratulating Thomas and Francis Turner of Waco on their 65th wedding anniversary.,None,Charles Doc Anderson,author,81R
HR 1798,Congratulating James and Doris Dean of Waco on their 65th wedding anniversary.,None,Charles Doc Anderson,author,81R
HR 1799,Congratulating Sidney and Betty Henson of Waco on their 60th wedding anniversary in 2008.,None,Charles Doc Anderson,author,81R
HR 1800,Congratulating Jack and Frances Chandler of Crawford on their 60th wedding anniversary.,None,Charles Doc Anderson,author,81R
HR 1801,Congratulating Elton and Esther Manthei of Robinson on their 65th wedding anniversary.,None,Charles Doc Anderson,author,81R
HR 1802,Congratulating Raymond and Martha Johnson of Waco on their 70th wedding anniversary.,None,Charles Doc Anderson,author,81R
HR 1803,Congratulating L. D. and Barbara Parsons of Waco on their 65th wedding anniversary.,None,Charles Doc Anderson,author,81R
HR 1804,Congratulating Edna Bryant of Waco on her 100th birthday.,None,Charles Doc Anderson,author,81R
HR 1805,Congratulating Leo and Rosalie Mynarcik of West on their 60th wedding anniversary.,None,Charles Doc Anderson,author,81R
HR 1806,Congratulating Billy and Bobbie Mills of Waco on their 60th wedding anniversary.,None,Charles Doc Anderson,author,81R
HR 1807,Congratulating Daniel and Betty Carroll of Waco on their 60th wedding anniversary.,None,Charles Doc Anderson,author,81R
HR 1808,Congratulating Kenneth and Enelda Niles of Waco on their 60th wedding anniversary.,None,Charles Doc Anderson,author,81R
HR 1809,In memory of Tori Danielle Gordon of Robinson.,None,Charles Doc Anderson,author,81R
HR 1840,Honoring Bobby and Betty Chastain of Waco on their 60th wedding anniversary.,None,Charles Doc Anderson,author,81R
HR 1841,In memory of Lorenza Garcia of Waco.,None,Charles Doc Anderson,author,81R
HR 1842,Congratulating Lane and Mary Stecher of Waco on their 60th wedding anniversary.,None,Charles Doc Anderson,author,81R
HR 1843,Congratulating L. A. and Marie Rager of Moody on their 60th wedding anniversary.,None,Charles Doc Anderson,author,81R
HR 1844,Congratulating Wade and Martha Colbert on their 59th wedding anniversary.,None,Charles Doc Anderson,author,81R
HR 1845,Honoring Billy and Mary Lou Peterson of Robinson on their 60th wedding anniversary.,None,Charles Doc Anderson,author,81R
HR 1846,Congratulating Pernell and Audrey Peterson on their 65th wedding anniversary.,None,Charles Doc Anderson,author,81R
HR 1847,Congratulating Willie and Henrietta Urban of Waco on their 60th wedding anniversary.,None,Charles Doc Anderson,author,81R
HR 1848,Congratulating Harry and Sue Ferrell on their 70th wedding anniversary.,None,Charles Doc Anderson,author,81R
HR 1849,Congratulating Bill and Karen Erck of Waco on their 50th wedding anniversary.,None,Charles Doc Anderson,author,81R
HR 1850,Congratulating Don and Jeanette Markum of Waco on their 50th wedding anniversary.,None,Charles Doc Anderson,author,81R
HR 1851,"Congratulating Reta and Charles ""Shorty"" Stone of Robinson on their 50th wedding anniversary.",None,Charles Doc Anderson,author,81R
HR 1852,Congratulating Dale and Shirley DeWitt of China Spring on their 50th wedding anniversary in 2008.,None,Charles Doc Anderson,author,81R
HR 1853,Congratulating Henry and Diane Walbesser on their 50th wedding anniversary.,None,Charles Doc Anderson,author,81R
HR 1854,Congratulating Ronald and Geneva Vaughan of McGregor on their 50th wedding anniversary.,None,Charles Doc Anderson,author,81R
HR 1855,Congratulating Robert and Barbara Szanto of McLennan County on their 50th wedding anniversary.,None,Charles Doc Anderson,author,81R
HR 1856,Congratulating Carl and Ella Buhl of Waco on their 50th wedding anniversary.,None,Charles Doc Anderson,author,81R
HR 1857,Congratulating Ivan and Brenda Ker of Waco on their 50th wedding anniversary.,None,Charles Doc Anderson,author,81R
HR 1858,Congratulating David and Ann Cox of Lorena on their 50th wedding anniversary.,None,Charles Doc Anderson,author,81R
HR 1859,Congratulating William and Mary Krause on their 50th wedding anniversary.,None,Charles Doc Anderson,author,81R
HR 1881,Congratulating William and Sondra Harper of Bruceville on their 50th wedding anniversary.,None,Charles Doc Anderson,author,81R
HR 1882,Congratulating Jimmie Joe and Gloria Helleson of Waco on their 50th wedding anniversary.,None,Charles Doc Anderson,author,81R
HR 1883,Congratulating Patrick and Patricia Stroman on their 50th wedding anniversary.,None,Charles Doc Anderson,author,81R
HR 1884,Congratulating James and Jean Vorderkunz of Robinson on their 50th wedding anniversary.,None,Charles Doc Anderson,author,81R
HR 1885,Congratulating Bob and Jean Chapman of Lorena on their 50th wedding anniversary.,None,Charles Doc Anderson,author,81R
HR 1886,Congratulating Ken and Pat James of Waco on their 50th wedding anniversary.,None,Charles Doc Anderson,author,81R
HR 1887,Congratulating Carl and Dee Rucker of Waco on their 50th wedding anniversary.,None,Charles Doc Anderson,author,81R
HR 1888,Congratulating Jerry and Ruth McKethan of Waco on their 50th wedding anniversary.,None,Charles Doc Anderson,author,81R
HR 1889,Congratulating Joe and Linda Gough on their 50th wedding anniversary.,None,Charles Doc Anderson,author,81R
HR 1890,Congratulating Lawrence and Evelyn Hlavaty of West on their 55th wedding anniversary.,None,Charles Doc Anderson,author,81R
HR 1906,Congratulating Gene and Kay Wenzel on their 50th wedding anniversary.,None,Charles Doc Anderson,author,81R
HR 1907,Congratulating Daniel Bristow of McGregor on attaining the rank of Eagle Scout.,None,Charles Doc Anderson,author,81R
HR 1908,"Congratulating the Riverside Dental Center in Waco on the first anniversary of its partnership with the City of Waco, the Waco-McLennan County Public Health District, and the Heart of Texas Community Health Center.",None,Charles Doc Anderson,author,81R
HR 1909,In memory of Ethelee Huey of Waco.,None,Charles Doc Anderson,author,81R
HR 1910,Congratulating Melanie Decker of Midway High School in Waco for being named 2008-2009 Teacher of the Year.,None,Charles Doc Anderson,author,81R
HR 1912,Congratulating Dr. Holly Kunert on being named High School Counselor of the Year by Texas State Technical College.,None,Charles Doc Anderson,author,81R
HR 1913,Honoring Chase Alexander Giles on attaining the rank of Eagle Scout.,None,Charles Doc Anderson,author,81R
HR 1914,Congratulating Caitlin Smith of Crawford High School on being named a Commended Student in the 2008 National Merit Scholarship Program.,None,Charles Doc Anderson,author,81R
HR 1915,Congratulating Marvin Lane Dameron on being named a Distinguished Alumnus by the Midway High School Alumni Association.,None,Charles Doc Anderson,author,81R
HR 1916,Honoring Jesse's Tortilla Factory in Waco on its 50th anniversary in 2008.,None,Charles Doc Anderson,author,81R
HR 1917,Congratulating Ray and Irene Boman on their 50th wedding anniversary.,None,Charles Doc Anderson,author,81R
HR 1918,Congratulating Richard and Rita Jurek of Woodway on their 50th wedding anniversary.,None,Charles Doc Anderson,author,81R
HR 1919,Congratulating Sharron Zachry on her receipt of a National PTA Life Achievement Award.,None,Charles Doc Anderson,author,81R
HR 1920,"In memory of Sandra Kay ""Sandy"" Nutt of West.",None,Charles Doc Anderson,author,81R
HR 1921,Commemorating the 125th anniversary of the founding of First Lutheran Church in Waco.,None,Charles Doc Anderson,author,81R
HR 2409,In memory of U.S. Marine Lance Corporal Johnny Ray Strong.,None,Charles Doc Anderson,author,81R
HR 2420,Congratulating Carl and Louise Threadgill of Robinson on their 60th wedding anniversary.,None,Charles Doc Anderson,author,81R
HR 2421,Congratulating George and Ruth Erickson of Waco on their 65th wedding anniversary.,None,Charles Doc Anderson,author,81R
HR 2422,Congratulating Ollie and Leta Hartgroves of McGregor on their 50th wedding anniversary.,None,Charles Doc Anderson,author,81R
HR 2423,Congratulating Donald and Carol Ann Tindell on their 50th wedding anniversary.,None,Charles Doc Anderson,author,81R
HR 2424,Congratulating Brian and Mozelle Cunningham on their 70th wedding anniversary.,None,Charles Doc Anderson,author,81R
HR 2425,Congratulating Norm and Tippy Gowens on their 50th wedding anniversary.,None,Charles Doc Anderson,author,81R
HR 2426,Honoring Velton and Darlene Cunningham of Woodway on their 50th wedding anniversary.,None,Charles Doc Anderson,author,81R
HR 2427,Congratulating Myra and William R. Casbeer of Waco on their 50th wedding anniversary.,None,Charles Doc Anderson,author,81R
HR 2428,Congratulating Don and Linda Filgo of Woodway on their 50th wedding anniversary.,None,Charles Doc Anderson,author,81R
HR 2429,Honoring Francis and Lorraine Trzcinski of Robinson on their 50th wedding anniversary.,None,Charles Doc Anderson,author,81R
HR 2443,Congratulating Bob and Beth Braden of China Spring on their 50th wedding anniversary.,None,Charles Doc Anderson,author,81R
HR 2445,Congratulating Jack and Rita Boozer of Woodway on their 45th wedding anniversary.,None,Charles Doc Anderson,author,81R
HR 2446,Congratulating James and Elleen Frazier of Hewitt on their 50th wedding anniversary.,None,Charles Doc Anderson,author,81R
HR 2447,Congratulating Harvey and Zelma Hunke of Robinson on their 65th wedding anniversary.,None,Charles Doc Anderson,author,81R
HR 2448,Congratulating Clayton and Dorothy Thompson on their 60th wedding anniversary.,None,Charles Doc Anderson,author,81R
HR 2449,Congratulating Joe and Mildred Stanislav of Waco on their 60th wedding anniversary.,None,Charles Doc Anderson,author,81R
HR 2450,Congratulating Kenneth and Nelda Weldon of Waco on their 50th wedding anniversary.,None,Charles Doc Anderson,author,81R
HR 2451,Congratulating Bennice and LaVerne Johnson of Woodway on their 50th wedding anniversary.,None,Charles Doc Anderson,author,81R
HR 2830,In memory of Jack Thomas Garrison of Elm Mott.,None,Charles Doc Anderson,author,81R
HR 2831,Congratulating Erbie and Shirley Lewis of Woodway on their 50th wedding anniversary.,None,Charles Doc Anderson,author,81R
HR 2851,Honoring Austin Epps and Hannah Hammack for their service as legislative interns in the office of State Representative Charles Anderson.,None,Charles Doc Anderson,author,81R
HR 2869,In memory of Frances Sturgis of Waco.,None,Charles Doc Anderson,author,81R
HB 230,"Relating to exempting certain schools, nonprofit athletic or sports associations, municipally owned facilities, summer camps, places of worship, and fairgrounds from certain demand charges by transmission and distribution utilities.",None,Charles Doc Anderson,author,81R
HB 1020,"Relating to the use, exhibition, or possession of a firearm by public school students participating in certain school-sponsored programs and activities sponsored or supported by the Parks and Wildlife Department.",None,Charles Doc Anderson,author,81R
HB 1046,Relating to the appeals process in the disposition of cruelly treated animals.,None,Charles Doc Anderson,author,81R
HB 1348,Relating to initial claims under the unemployment compensation system.,None,Charles Doc Anderson,author,81R
HB 1684,Relating to the creation and administration of the rural veterinarian loan repayment program.,None,Charles Doc Anderson,author,81R
HB 1948,Relating to a public health extension service pilot program.,None,Charles Doc Anderson,author,81R
HB 1960,Relating to the payment for an appearance as a witness for certain peace officers and firefighters.,None,Charles Doc Anderson,author,81R
HB 2084,Relating to a suit for access to a child by a grandparent.,None,Charles Doc Anderson,author,81R
HB 2805,"Relating to the administration, powers, duties, operation, and financing of the East Williamson County Multi-Institution Teaching Center.",None,Charles Doc Anderson,author,81R
HB 2927,Relating to the regulation of cemeteries by state and local government.,None,Charles Doc Anderson,author,81R
HB 3237,Relating to the franchise tax.,None,Charles Doc Anderson,author,81R
HB 4011,Relating to the use of money in the system benefit fund to purchase advanced meters for low-income customers.,None,Charles Doc Anderson,author,81R
HB 4224,Relating to the teaching of science in public schools.,None,Charles Doc Anderson,author,81R
HCR 76,"Memorializing Congress in defense of the Tenth Amendment to the U.S. Constitution, affirming the right of states to nullify acts of Congress, executive orders, and judicial orders, and calling for the creation of a joint committee to communicate with other states about the limits of federal power.",None,Charles Doc Anderson,author,81R
HCR 86,Memorializing Congress in support of establishing a veterans hospital in the Rio Grande Valley.,None,Charles Doc Anderson,author,81R
HJR 14,"Proposing constitutional amendments limiting the public taking of private property, establishing the national research university fund to fund emerging research universities, and eliminating the higher education fund.",None,Charles Doc Anderson,author,81R
HJR 84,Proposing a constitutional amendment allowing a state mandate imposed on a county to have effect only if the state provides for payment to the county of the cost of the mandate.,None,Charles Doc Anderson,author,81R
HR 2737,In memory of Brendon Chase Mooney of Spring.,None,Charles Doc Anderson,author,81R
HR 2747,Honoring Dr. James A. Curry for his service to Baylor University and the Bob Bullock Scholars Program.,None,Charles Doc Anderson,author,81R
HR 2918,Congratulating Dr. Michael W. Mansfield on his retirement from Baylor University.,None,Charles Doc Anderson,author,81R
HB 36,Relating to informed consent to an abortion.,None,Charles Doc Anderson,coauthor,81R
HB 109,"Relating to the issuance of ""Choose Life"" license plates and the creation of the Choose Life account in the general revenue fund.",None,Charles Doc Anderson,coauthor,81R
HB 125,Relating to requiring a voter to present proof of identification.,None,Charles Doc Anderson,coauthor,81R
HB 206,Relating to the on-premises consumption of certain alcoholic beverages; providing a penalty.,None,Charles Doc Anderson,coauthor,81R
HB 277,Relating to the franchise tax and alternative revenue sources and spending priorities for this state.,None,Charles Doc Anderson,coauthor,81R
HB 410,Relating to the requirement under certain circumstances that a license holder display the person's license to carry a concealed handgun.,None,Charles Doc Anderson,coauthor,81R
HB 469,Relating to the establishment of incentives by this state for the implementation of certain projects to capture and sequester carbon dioxide that would otherwise be emitted into the atmosphere.,None,Charles Doc Anderson,coauthor,81R
HB 642,Relating to requiring the Texas Education Agency to prepare a report regarding public education mandates.,None,Charles Doc Anderson,coauthor,81R
HB 644,Relating to the permissible uses of the state highway fund.,None,Charles Doc Anderson,coauthor,81R
HB 720,Relating to the total revenue exemption for the franchise tax.,None,Charles Doc Anderson,coauthor,81R
HB 742,Relating to an exemption from ad valorem taxation of the residence homesteads of certain totally disabled veterans and to the amount of the exemption from ad valorem taxation to which a disabled veteran is entitled based on disability rating.,None,Charles Doc Anderson,coauthor,81R
HB 775,Relating to the penalty for theft of a central air-conditioning unit.,None,Charles Doc Anderson,coauthor,81R
HB 853,Relating to inclusion of pets and other companion animals in protective orders; providing a penalty.,None,Charles Doc Anderson,coauthor,81R
HB 873,"Relating to incentives for the film, television, video, and digital interactive media production industries.",None,Charles Doc Anderson,coauthor,81R
HB 994,Relating to the limitation on the rate of growth in appropriations from state tax revenues.,None,Charles Doc Anderson,coauthor,81R
HB 1092,Relating to the authority of the voters of a county to allow the owners of certain real property to require that county and any municipal ad valorem taxes be imposed on that real property on the basis of a five-year average of the property's value.,None,Charles Doc Anderson,coauthor,81R
HB 1301,Relating to an employee's transportation and storage of certain firearms or ammunition while on certain property owned or controlled by the employee's employer.,None,Charles Doc Anderson,coauthor,81R
HB 1483,Relating to the use of eminent domain authority.,None,Charles Doc Anderson,coauthor,81R
HB 1673,Relating to funding of the Communities In Schools program.,None,Charles Doc Anderson,coauthor,81R
HB 1825,Relating to the computation of the franchise tax.,None,Charles Doc Anderson,coauthor,81R
HB 1893,Relating to the carrying of concealed handguns on the campuses of institutions of higher education.,None,Charles Doc Anderson,coauthor,81R
HB 1918,Relating to changing the name of the Office of Rural Community Affairs to the Texas Department of Rural Affairs.,None,Charles Doc Anderson,coauthor,81R
HB 2083,Relating to determination of state contributions for participation by certain junior college employees in the state employees group benefits program.,None,Charles Doc Anderson,coauthor,81R
HB 2812,"Relating to the curriculum, funding, promotion, and economic impact of career and technology education in public educational institutions.",None,Charles Doc Anderson,coauthor,81R
HB 3325,Relating to advance directives or health care or treatment decisions made by or on behalf of patients.,None,Charles Doc Anderson,coauthor,81R
HB 3613,Relating to the determination of the market value of a residence homestead for ad valorem tax purposes on the basis of the property's value as a residence homestead and to an exemption from ad valorem taxation of the residence homesteads of certain totally disabled veterans and to the amount of the exemption from ad valorem taxation to which a disabled veteran is entitled based on disability rating.,None,Charles Doc Anderson,coauthor,81R
HB 3769,Relating to certain fraudulent investment schemes; providing penalties.,None,Charles Doc Anderson,coauthor,81R
HB 3796,Relating to informed and voluntary consent for an abortion and the collection and reporting of information related to the performance of an abortion; providing penalties.,None,Charles Doc Anderson,coauthor,81R
HB 3820,Relating to the governance and disclosure requirements of electric cooperative corporations and the review of complaints of electric cooperative corporation members by the Office of the Attorney General.,None,Charles Doc Anderson,coauthor,81R
HB 4009,"Relating to the provision of services to certain persons involved in, and the prosecution, punishment, and prevention of, offenses involving trafficking of persons or certain forced or sex-based labor or services, and to law enforcement training related to offenses involving that trafficking.",None,Charles Doc Anderson,coauthor,81R
HB 4765,Relating to the computation of the franchise tax.,None,Charles Doc Anderson,coauthor,81R
HCR 5,Posthumously conferring the Texas Legislative Medal of Honor on Pedro Cano of Hidalgo County for his heroic actions in World War II.,None,Charles Doc Anderson,coauthor,81R
HCR 50,"Affirming that the State of Texas claims sovereignty under the Tenth Amendment to the Constitution of the United States over all powers not otherwise enumerated and granted to the federal government by the U.S. Constitution, serving notice to the federal government to cease and desist certain mandates, and providing that certain federal legislation be prohibited or repealed.",None,Charles Doc Anderson,coauthor,81R
HJR 38,Proposing a constitutional amendment regarding the rainy day fund and dedicating certain surplus revenues to property tax reduction.,None,Charles Doc Anderson,coauthor,81R
HJR 39,Post-ratifying Amendment XXIV to the Constitution of the United States prohibiting the denial or abridgment of the right to vote for failure to pay any poll tax or other tax.,None,Charles Doc Anderson,coauthor,81R
HR 454,"Recognizing April 16, 2009, as Texas Federation of Republican Women Day at the Capitol.",None,Charles Doc Anderson,coauthor,81R
HR 501,"Welcoming a delegation from Baylor University to the State Capitol on February 19, 2009.",None,Charles Doc Anderson,coauthor,81R
SB 257,Relating to the sale or delivery of salvia divinorum or Salvinorin A to a child; providing a penalty.,None,Charles Doc Anderson,sponsor,81R
SB 847,Relating to applicability of fee exemptions for military personnel and their children to certain course fees charged by public technical institutes and public state colleges.,None,Charles Doc Anderson,sponsor,81R
SB 2230,Relating to the jurisdiction and operation of the district courts in McLennan County.,None,Charles Doc Anderson,sponsor,81R
HB 205,Relating to the punishment for certain sex offenses committed against a child.,None,Charles Doc Anderson,author,80R
HB 376,Relating to site-based public school discipline policy committees.,None,Charles Doc Anderson,author,80R
HB 377,Relating to the appointment of magistrates in McLennan County.,None,Charles Doc Anderson,author,80R
HB 1791,Relating to safety seats on school buses.,None,Charles Doc Anderson,author,80R
HB 1950,Relating to an exemption from the sales tax for byproducts sold by electric generating facilities that use integrated gasification combined cycle technology.,None,Charles Doc Anderson,author,80R
HB 1951,Relating to the computation of total revenue in relation to electric generating facilities that use integrated gasification combined cycle technology.,None,Charles Doc Anderson,author,80R
HB 1952,Relating to the eligibility of new electric generating facilities and new industrial facilities that use gasification technology for economic benefits authorized by the Texas Economic Development Act.,None,Charles Doc Anderson,author,80R
HB 2345,Relating to the creation of the Texas Organic Agricultural Industry Advisory Board.,None,Charles Doc Anderson,author,80R
HB 2346,Relating to the authority of a veterinarian to fill certain prescriptions in an emergency.,None,Charles Doc Anderson,author,80R
HB 2347,Relating to the addition of Salvinorin A and Salvia divinorum to Penalty Group 2 of the Texas Controlled Substances Act.,None,Charles Doc Anderson,author,80R
HB 2847,Relating to the consideration of the cumulative effects of certain air contaminant emissions in the emissions permitting process for electric generating facilities.,None,Charles Doc Anderson,author,80R
HB 2848,Relating to creating a task force to review electric energy generation policies and certain permits for operation of electric generation facilities and to study the state's long-term demand for electric generation capacity.,None,Charles Doc Anderson,author,80R
HB 2849,Relating to restrictions on written information required to be provided by school districts and public school teachers.,None,Charles Doc Anderson,author,80R
