bill_name,caption,filer_id,filer_name,function,session,leg_id,original_name,parsed_name
HB 3172,"Relating to the creation, administration, powers, duties, operation, and financing of the Clearwater Underground Water Conservation District.",36668,Lt. Gov. David Dewhurst,sponsor,71R,1170,Lt. Gov. David Dewhurst,David Dewhurst
HB 3173,Relating to the composition of the Taylor County Juvenile Board.,36668,Lt. Gov. David Dewhurst,sponsor,71R,1170,Lt. Gov. David Dewhurst,David Dewhurst
HCR 16,Requesting that educational curricula for judges and law enforcement officers include information about certain procedures and services regarding mentally ill persons.,36668,Lt. Gov. David Dewhurst,sponsor,71R,1170,Lt. Gov. David Dewhurst,David Dewhurst
HCR 48,"Recognizing September 19, 1989, as POW/MIA Day.",36668,Lt. Gov. David Dewhurst,sponsor,71R,1170,Lt. Gov. David Dewhurst,David Dewhurst
HCR 73,Recognizing Temple as the Wildflower Capital of Texas.,36668,Lt. Gov. David Dewhurst,sponsor,71R,1170,Lt. Gov. David Dewhurst,David Dewhurst
HCR 197,Recognizing the Salado Historical Society.,36668,Lt. Gov. David Dewhurst,sponsor,71R,1170,Lt. Gov. David Dewhurst,David Dewhurst
HCR 229,Recognizing National Mental Illness Awareness Week.,36668,Lt. Gov. David Dewhurst,sponsor,71R,1170,Lt. Gov. David Dewhurst,David Dewhurst
HCR 278,Designating October 1989 as Texas Society of Architects Month.,36668,Lt. Gov. David Dewhurst,sponsor,71R,1170,Lt. Gov. David Dewhurst,David Dewhurst
