bill_name,caption,filer_id,filer_name,function,session,leg_id,original_name,parsed_name
HR 1180,Congratulating Richard and Mary Clark of Temple on the occasion of their 50th wedding anniversary.,63380,Ralph Sheffield,author,81R,4430,Rep. Ralph Sheffield,Ralph Sheffield
HR 1181,Congratulating E. L. and Ina Lee Hochstedler on the occasion of their 65th wedding anniversary.,63380,Ralph Sheffield,author,81R,4430,Rep. Ralph Sheffield,Ralph Sheffield
HR 1271,Honoring Uno for winning the best in show title at the 2008 Westminster Kennel Club Dog Show and congratulating owner Caroline Dowell on her success.,63380,Ralph Sheffield,author,81R,4430,Rep. Ralph Sheffield,Ralph Sheffield
HR 1322,"Recognizing April 22, 2009, as Texas Charity Advocates Day at the State Capitol.",63380,Ralph Sheffield,author,81R,4430,Rep. Ralph Sheffield,Ralph Sheffield
HR 1595,Congratulating Robert and Jan Elliott of Belton on the occasion of their 50th wedding anniversary.,63380,Ralph Sheffield,author,81R,4430,Rep. Ralph Sheffield,Ralph Sheffield
HR 1714,Congratulating Candance L. Hawks on her appointment to the Texas Special Education Continuing Advisory Committee.,63380,Ralph Sheffield,author,81R,4430,Rep. Ralph Sheffield,Ralph Sheffield
HR 1715,In memory of the Reverend Theiss L. Jones of Temple.,63380,Ralph Sheffield,author,81R,4430,Rep. Ralph Sheffield,Ralph Sheffield
HR 1716,Congratulating Dr. Larry R. Montgomery of Belton on his appointment to the Texas Board of Chiropractic Examiners.,63380,Ralph Sheffield,author,81R,4430,Rep. Ralph Sheffield,Ralph Sheffield
HR 1775,Congratulating Dan and Helen Wiley of Temple on their 60th wedding anniversary.,63380,Ralph Sheffield,author,81R,4430,Rep. Ralph Sheffield,Ralph Sheffield
HR 1776,Congratulating Charles and Greneta Ordner of Westphalia on their 50th wedding anniversary.,63380,Ralph Sheffield,author,81R,4430,Rep. Ralph Sheffield,Ralph Sheffield
HR 1777,Congratulating Bill and Dottie Kyle of Salado on their 50th wedding anniversary.,63380,Ralph Sheffield,author,81R,4430,Rep. Ralph Sheffield,Ralph Sheffield
HR 1778,Congratulating Nick and Bertie Gandy of Temple on their 60th wedding anniversary.,63380,Ralph Sheffield,author,81R,4430,Rep. Ralph Sheffield,Ralph Sheffield
HR 2331,In memory of U.S. Army Corporal William Troy Warford III of Temple.,63380,Ralph Sheffield,author,81R,4430,Rep. Ralph Sheffield,Ralph Sheffield
HR 2344,In memory of U.S. Army Specialist Aaron James Walker of Harker Heights.,63380,Ralph Sheffield,author,81R,4430,Rep. Ralph Sheffield,Ralph Sheffield
HR 2418,Congratulating Chad Bludau on his graduation from The University of Texas at Austin.,63380,Ralph Sheffield,author,81R,4430,Rep. Ralph Sheffield,Ralph Sheffield
HR 2542,Congratulating Beatrice Arnold of Falls County on her receipt of the Mrs. VFW award.,63380,Ralph Sheffield,author,81R,4430,Rep. Ralph Sheffield,Ralph Sheffield
HR 2920,Honoring Dr. J. James Rohack on his installation as president of the American Medical Association.,63380,Ralph Sheffield,author,81R,4430,Rep. Ralph Sheffield,Ralph Sheffield
HB 5,Relating to the elimination of smoking in all workplaces and public places; providing penalties.,63380,Ralph Sheffield,author,81R,4430,Rep. Ralph Sheffield,Ralph Sheffield
HB 61,Relating to the statutory limitation imposed on certain university systems to issue revenue bonds to fund facilities at certain institutions of higher education.,63380,Ralph Sheffield,author,81R,4430,Rep. Ralph Sheffield,Ralph Sheffield
HB 63,"Relating to the conservatorship or possession of, or access to, a child by a parent who is deployed by the military.",63380,Ralph Sheffield,author,81R,4430,Rep. Ralph Sheffield,Ralph Sheffield
HB 276,Relating to the requirement that state agencies report the cost of services and benefits provided to undocumented immigrants.,63380,Ralph Sheffield,author,81R,4430,Rep. Ralph Sheffield,Ralph Sheffield
HB 333,Relating to tuition and fee exemptions for the spouses of certain military personnel.,63380,Ralph Sheffield,author,81R,4430,Rep. Ralph Sheffield,Ralph Sheffield
HB 335,Relating to stabilizing the amount of tuition charged to certain residents of this state by general academic teaching institutions.,63380,Ralph Sheffield,author,81R,4430,Rep. Ralph Sheffield,Ralph Sheffield
HB 449,Relating to the regulation of laser hair removal facilities; providing penalties.,63380,Ralph Sheffield,author,81R,4430,Rep. Ralph Sheffield,Ralph Sheffield
HB 488,Relating to the eligibility requirements for volunteer deputy registrars.,63380,Ralph Sheffield,author,81R,4430,Rep. Ralph Sheffield,Ralph Sheffield
HB 503,Relating to adoption of the Interstate Compact on Educational Opportunity for Military Children.,63380,Ralph Sheffield,author,81R,4430,Rep. Ralph Sheffield,Ralph Sheffield
HB 518,"Relating to programs to provide student loan repayment assistance for certain correctional officers, for certain speech-language pathologists and audiologists, and for certain mathematics and science teachers.",63380,Ralph Sheffield,author,81R,4430,Rep. Ralph Sheffield,Ralph Sheffield
HB 793,Relating to the authority to charge reasonable fees for emergency services performed by volunteer fire departments.,63380,Ralph Sheffield,author,81R,4430,Rep. Ralph Sheffield,Ralph Sheffield
HB 826,Relating to the relationship between the amount of an administrative penalty imposed by the Texas Commission on Environmental Quality and the economic benefit of the violation to the alleged violator.,63380,Ralph Sheffield,author,81R,4430,Rep. Ralph Sheffield,Ralph Sheffield
HB 831,Relating to the exemption from certain taxation of certain organizations.,63380,Ralph Sheffield,author,81R,4430,Rep. Ralph Sheffield,Ralph Sheffield
HB 857,Relating to the penalty for certain outdoor burning violations.,63380,Ralph Sheffield,author,81R,4430,Rep. Ralph Sheffield,Ralph Sheffield
HB 1008,Relating to an exemption from ad valorem taxation of the residence homesteads of certain totally disabled veterans.,63380,Ralph Sheffield,author,81R,4430,Rep. Ralph Sheffield,Ralph Sheffield
HB 1159,Relating to the extension of the term of a reinvestment zone created under the Tax Increment Financing Act.,63380,Ralph Sheffield,author,81R,4430,Rep. Ralph Sheffield,Ralph Sheffield
HB 1257,Relating to the payment in installments of ad valorem taxes on certain property owned by a business entity and located in a disaster area and to the ad valorem taxation of a residence homestead rendered uninhabitable or unusable by a casualty or by wind or water damage.,63380,Ralph Sheffield,author,81R,4430,Rep. Ralph Sheffield,Ralph Sheffield
HB 1307,Relating to the availability of certain school district financial information on certain districts' Internet websites.,63380,Ralph Sheffield,author,81R,4430,Rep. Ralph Sheffield,Ralph Sheffield
HB 1372,Relating to the definition of victim in relation to certain crime victims' rights.,63380,Ralph Sheffield,author,81R,4430,Rep. Ralph Sheffield,Ralph Sheffield
HB 1967,Relating to the operation of certain institutions of higher education as general academic teaching institutions and to the statutory limitation imposed on certain university systems to issue revenue bonds to fund facilities at certain institutions of higher education.,63380,Ralph Sheffield,author,81R,4430,Rep. Ralph Sheffield,Ralph Sheffield
HB 2805,"Relating to the administration, powers, duties, operation, and financing of the East Williamson County Multi-Institution Teaching Center.",63380,Ralph Sheffield,author,81R,4430,Rep. Ralph Sheffield,Ralph Sheffield
HB 4334,Relating to the licensing and regulation of pain management clinics.,63380,Ralph Sheffield,author,81R,4430,Rep. Ralph Sheffield,Ralph Sheffield
HJR 20,Proposing a constitutional amendment relating to the right to hunt and fish.,63380,Ralph Sheffield,author,81R,4430,Rep. Ralph Sheffield,Ralph Sheffield
HR 1589,"In memory of Matt Gayton Martinez, Jr., of Dallas.",63380,Ralph Sheffield,author,81R,4430,Rep. Ralph Sheffield,Ralph Sheffield
HB 3,"Relating to public school accountability, curriculum, and promotion requirements.",63380,Ralph Sheffield,coauthor,81R,4430,Rep. Ralph Sheffield,Ralph Sheffield
HB 4,"Relating to eminent domain, including certain limitations, procedures, and standards relating to the use of eminent domain.",63380,Ralph Sheffield,coauthor,81R,4430,Rep. Ralph Sheffield,Ralph Sheffield
HB 11,Relating to repeal of authority for the establishment and operation of the Trans-Texas Corridor.,63380,Ralph Sheffield,coauthor,81R,4430,Rep. Ralph Sheffield,Ralph Sheffield
HB 36,Relating to informed consent to an abortion.,63380,Ralph Sheffield,coauthor,81R,4430,Rep. Ralph Sheffield,Ralph Sheffield
HB 47,Relating to the procedures for registering to vote and accepting a voter at a polling place.,63380,Ralph Sheffield,coauthor,81R,4430,Rep. Ralph Sheffield,Ralph Sheffield
HB 52,Relating to limitations on the automatic admission of undergraduate students to general academic teaching institutions.,63380,Ralph Sheffield,coauthor,81R,4430,Rep. Ralph Sheffield,Ralph Sheffield
HB 67,Relating to a medical assistance buy-in program for children with certain developmental disabilities.,63380,Ralph Sheffield,coauthor,81R,4430,Rep. Ralph Sheffield,Ralph Sheffield
HB 109,"Relating to the issuance of ""Choose Life"" license plates and the creation of the Choose Life account in the general revenue fund.",63380,Ralph Sheffield,coauthor,81R,4430,Rep. Ralph Sheffield,Ralph Sheffield
HB 125,Relating to requiring a voter to present proof of identification.,63380,Ralph Sheffield,coauthor,81R,4430,Rep. Ralph Sheffield,Ralph Sheffield
HB 130,Relating to an enhanced quality full-day prekindergarten program provided by public school districts in conjunction with community providers.,63380,Ralph Sheffield,coauthor,81R,4430,Rep. Ralph Sheffield,Ralph Sheffield
HB 208,Relating to the cancellation of the voter registration and to the eligibility to vote of persons who are deceased or not citizens of the United States.,63380,Ralph Sheffield,coauthor,81R,4430,Rep. Ralph Sheffield,Ralph Sheffield
HB 267,Relating to the interstate purchase of certain firearms.,63380,Ralph Sheffield,coauthor,81R,4430,Rep. Ralph Sheffield,Ralph Sheffield
HB 359,Relating to the absence of a student from public school to visit with a parent who has been or will be deployed to a combat zone.,63380,Ralph Sheffield,coauthor,81R,4430,Rep. Ralph Sheffield,Ralph Sheffield
HB 410,Relating to the requirement under certain circumstances that a license holder display the person's license to carry a concealed handgun.,63380,Ralph Sheffield,coauthor,81R,4430,Rep. Ralph Sheffield,Ralph Sheffield
HB 417,"Relating to the acquisition of and compensation for real property, including blighted property, for public purposes through condemnation or certain other means.",63380,Ralph Sheffield,coauthor,81R,4430,Rep. Ralph Sheffield,Ralph Sheffield
HB 464,Relating to the preparation by the Legislative Budget Board of a dynamic fiscal impact statement for certain bills and joint resolutions affecting taxes and fees.,63380,Ralph Sheffield,coauthor,81R,4430,Rep. Ralph Sheffield,Ralph Sheffield
HB 469,Relating to the establishment of incentives by this state for the implementation of certain projects to capture and sequester carbon dioxide that would otherwise be emitted into the atmosphere.,63380,Ralph Sheffield,coauthor,81R,4430,Rep. Ralph Sheffield,Ralph Sheffield
HB 670,Relating to a qualified privilege of a journalist not to testify.,63380,Ralph Sheffield,coauthor,81R,4430,Rep. Ralph Sheffield,Ralph Sheffield
HB 720,Relating to the total revenue exemption for the franchise tax.,63380,Ralph Sheffield,coauthor,81R,4430,Rep. Ralph Sheffield,Ralph Sheffield
HB 742,Relating to an exemption from ad valorem taxation of the residence homesteads of certain totally disabled veterans and to the amount of the exemption from ad valorem taxation to which a disabled veteran is entitled based on disability rating.,63380,Ralph Sheffield,coauthor,81R,4430,Rep. Ralph Sheffield,Ralph Sheffield
HB 994,Relating to the limitation on the rate of growth in appropriations from state tax revenues.,63380,Ralph Sheffield,coauthor,81R,4430,Rep. Ralph Sheffield,Ralph Sheffield
HB 1037,Relating to allowing persons acquiring a new residence homestead to receive an ad valorem tax exemption on the homestead in the year in which the property is acquired.,63380,Ralph Sheffield,coauthor,81R,4430,Rep. Ralph Sheffield,Ralph Sheffield
HB 1047,Relating to the permissible uses of the state highway fund.,63380,Ralph Sheffield,coauthor,81R,4430,Rep. Ralph Sheffield,Ralph Sheffield
HB 1069,Relating to service of process in this state.,63380,Ralph Sheffield,coauthor,81R,4430,Rep. Ralph Sheffield,Ralph Sheffield
HB 1092,Relating to the authority of the voters of a county to allow the owners of certain real property to require that county and any municipal ad valorem taxes be imposed on that real property on the basis of a five-year average of the property's value.,63380,Ralph Sheffield,coauthor,81R,4430,Rep. Ralph Sheffield,Ralph Sheffield
HB 1176,Relating to the creation of a voluntary consumer-directed health plan for certain individuals eligible to participate in the insurance coverage provided under the Texas Employees Group Benefits Act and their qualified dependents.,63380,Ralph Sheffield,coauthor,81R,4430,Rep. Ralph Sheffield,Ralph Sheffield
HB 1205,Relating to the circumstances in which the approval of the governing body of a taxing unit is required for refunds of overpayments or erroneous payments of ad valorem taxes.,63380,Ralph Sheffield,coauthor,81R,4430,Rep. Ralph Sheffield,Ralph Sheffield
HB 1301,Relating to an employee's transportation and storage of certain firearms or ammunition while on certain property owned or controlled by the employee's employer.,63380,Ralph Sheffield,coauthor,81R,4430,Rep. Ralph Sheffield,Ralph Sheffield
HB 1348,Relating to initial claims under the unemployment compensation system.,63380,Ralph Sheffield,coauthor,81R,4430,Rep. Ralph Sheffield,Ralph Sheffield
HB 1483,Relating to the use of eminent domain authority.,63380,Ralph Sheffield,coauthor,81R,4430,Rep. Ralph Sheffield,Ralph Sheffield
HB 1511,Relating to requirements that fire sprinkler systems be installed in certain dwellings.,63380,Ralph Sheffield,coauthor,81R,4430,Rep. Ralph Sheffield,Ralph Sheffield
HB 1555,Relating to public school finance.,63380,Ralph Sheffield,coauthor,81R,4430,Rep. Ralph Sheffield,Ralph Sheffield
HB 1673,Relating to funding of the Communities In Schools program.,63380,Ralph Sheffield,coauthor,81R,4430,Rep. Ralph Sheffield,Ralph Sheffield
HB 1796,Relating to the development of carbon dioxide capture and sequestration in this state.,63380,Ralph Sheffield,coauthor,81R,4430,Rep. Ralph Sheffield,Ralph Sheffield
HB 1843,Relating to the disposition of cash in possession of a deceased pauper.,63380,Ralph Sheffield,coauthor,81R,4430,Rep. Ralph Sheffield,Ralph Sheffield
HB 1863,"Relating to exempting the intrastate manufacture of a firearm, a firearm accessory, or ammunition from federal regulation.",63380,Ralph Sheffield,coauthor,81R,4430,Rep. Ralph Sheffield,Ralph Sheffield
HB 1893,Relating to the carrying of concealed handguns on the campuses of institutions of higher education.,63380,Ralph Sheffield,coauthor,81R,4430,Rep. Ralph Sheffield,Ralph Sheffield
HB 1950,Relating to state travel policies and procedures for the reimbursement or payment of travel expenses.,63380,Ralph Sheffield,coauthor,81R,4430,Rep. Ralph Sheffield,Ralph Sheffield
HB 2083,Relating to determination of state contributions for participation by certain junior college employees in the state employees group benefits program.,63380,Ralph Sheffield,coauthor,81R,4430,Rep. Ralph Sheffield,Ralph Sheffield
HB 2084,Relating to a suit for access to a child by a grandparent.,63380,Ralph Sheffield,coauthor,81R,4430,Rep. Ralph Sheffield,Ralph Sheffield
HB 2110,Relating to the applicability of the Private Real Property Rights Preservation Act to certain governmental actions.,63380,Ralph Sheffield,coauthor,81R,4430,Rep. Ralph Sheffield,Ralph Sheffield
HB 2291,Relating to the procedure to be used by a taxing unit in adopting an ad valorem tax rate.,63380,Ralph Sheffield,coauthor,81R,4430,Rep. Ralph Sheffield,Ralph Sheffield
HB 2669,"Relating to the implementation of projects involving the capture, injection, sequestration, or geologic storage of carbon dioxide.",63380,Ralph Sheffield,coauthor,81R,4430,Rep. Ralph Sheffield,Ralph Sheffield
HB 2743,Relating to the availability of certain county financial information on certain counties' Internet websites.,63380,Ralph Sheffield,coauthor,81R,4430,Rep. Ralph Sheffield,Ralph Sheffield
HB 2943,Relating to a temporary franchise tax discount for job creation and retention.,63380,Ralph Sheffield,coauthor,81R,4430,Rep. Ralph Sheffield,Ralph Sheffield
HB 2944,Relating to the franchise tax rates.,63380,Ralph Sheffield,coauthor,81R,4430,Rep. Ralph Sheffield,Ralph Sheffield
HB 2945,Relating to the total revenue exemption from the franchise tax.,63380,Ralph Sheffield,coauthor,81R,4430,Rep. Ralph Sheffield,Ralph Sheffield
HB 3325,Relating to advance directives or health care or treatment decisions made by or on behalf of patients.,63380,Ralph Sheffield,coauthor,81R,4430,Rep. Ralph Sheffield,Ralph Sheffield
HB 3391,Relating to the continuation and functions of the Parks and Wildlife Department; changing the elements of an offense.,63380,Ralph Sheffield,coauthor,81R,4430,Rep. Ralph Sheffield,Ralph Sheffield
HB 3613,Relating to the determination of the market value of a residence homestead for ad valorem tax purposes on the basis of the property's value as a residence homestead and to an exemption from ad valorem taxation of the residence homesteads of certain totally disabled veterans and to the amount of the exemption from ad valorem taxation to which a disabled veteran is entitled based on disability rating.,63380,Ralph Sheffield,coauthor,81R,4430,Rep. Ralph Sheffield,Ralph Sheffield
HB 3769,Relating to certain fraudulent investment schemes; providing penalties.,63380,Ralph Sheffield,coauthor,81R,4430,Rep. Ralph Sheffield,Ralph Sheffield
HB 3774,Relating to retirement benefits for certain teachers.,63380,Ralph Sheffield,coauthor,81R,4430,Rep. Ralph Sheffield,Ralph Sheffield
HB 3796,Relating to informed and voluntary consent for an abortion and the collection and reporting of information related to the performance of an abortion; providing penalties.,63380,Ralph Sheffield,coauthor,81R,4430,Rep. Ralph Sheffield,Ralph Sheffield
HB 3816,Relating to the powers and duties of the Texas Medical Board.,63380,Ralph Sheffield,coauthor,81R,4430,Rep. Ralph Sheffield,Ralph Sheffield
HB 3820,Relating to the governance and disclosure requirements of electric cooperative corporations and the review of complaints of electric cooperative corporation members by the Office of the Attorney General.,63380,Ralph Sheffield,coauthor,81R,4430,Rep. Ralph Sheffield,Ralph Sheffield
HB 4009,"Relating to the provision of services to certain persons involved in, and the prosecution, punishment, and prevention of, offenses involving trafficking of persons or certain forced or sex-based labor or services, and to law enforcement training related to offenses involving that trafficking.",63380,Ralph Sheffield,coauthor,81R,4430,Rep. Ralph Sheffield,Ralph Sheffield
HB 4294,"Relating to textbooks, electronic textbooks, instructional material, and technological equipment in public schools.",63380,Ralph Sheffield,coauthor,81R,4430,Rep. Ralph Sheffield,Ralph Sheffield
HB 4385,Relating to the prosecution and punishment of fraud upon certain practitioners; creating an offense and providing criminal penalties.,63380,Ralph Sheffield,coauthor,81R,4430,Rep. Ralph Sheffield,Ralph Sheffield
HB 4765,Relating to the computation of the franchise tax.,63380,Ralph Sheffield,coauthor,81R,4430,Rep. Ralph Sheffield,Ralph Sheffield
HCR 50,"Affirming that the State of Texas claims sovereignty under the Tenth Amendment to the Constitution of the United States over all powers not otherwise enumerated and granted to the federal government by the U.S. Constitution, serving notice to the federal government to cease and desist certain mandates, and providing that certain federal legislation be prohibited or repealed.",63380,Ralph Sheffield,coauthor,81R,4430,Rep. Ralph Sheffield,Ralph Sheffield
HCR 64,Urging the Congress of the United States to oppose any efforts to adopt the Employee Free Choice Act or any similar legislation.,63380,Ralph Sheffield,coauthor,81R,4430,Rep. Ralph Sheffield,Ralph Sheffield
HCR 192,Congratulating Duncan Elementary School in Fort Hood on its receipt of the 2009 Texas State School of Character Award.,63380,Ralph Sheffield,coauthor,81R,4430,Rep. Ralph Sheffield,Ralph Sheffield
HCR 258,Urging the University of Houston and other institutions of higher education to cease displaying the flag of the Socialist Republic of Vietnam and to replace it with the Freedom and Heritage Flag.,63380,Ralph Sheffield,coauthor,81R,4430,Rep. Ralph Sheffield,Ralph Sheffield
HJR 14,"Proposing constitutional amendments limiting the public taking of private property, establishing the national research university fund to fund emerging research universities, and eliminating the higher education fund.",63380,Ralph Sheffield,coauthor,81R,4430,Rep. Ralph Sheffield,Ralph Sheffield
HJR 29,Proposing a constitutional amendment to allow the legislature to override a veto of the governor following a legislative session.,63380,Ralph Sheffield,coauthor,81R,4430,Rep. Ralph Sheffield,Ralph Sheffield
HJR 39,Post-ratifying Amendment XXIV to the Constitution of the United States prohibiting the denial or abridgment of the right to vote for failure to pay any poll tax or other tax.,63380,Ralph Sheffield,coauthor,81R,4430,Rep. Ralph Sheffield,Ralph Sheffield
HR 454,"Recognizing April 16, 2009, as Texas Federation of Republican Women Day at the Capitol.",63380,Ralph Sheffield,coauthor,81R,4430,Rep. Ralph Sheffield,Ralph Sheffield
HR 1032,Congratulating George and Laura Murphy of Salado on their 40th wedding anniversary.,63380,Ralph Sheffield,coauthor,81R,4430,Rep. Ralph Sheffield,Ralph Sheffield
SB 374,Relating to the authority of a county or the Department of Public Safety of the State of Texas to enforce compliance with posted speed limits by an automated traffic control system.,63380,Ralph Sheffield,sponsor,81R,4430,Rep. Ralph Sheffield,Ralph Sheffield
SB 713,Relating to a prohibition on the disclosure and use of certain information recorded or collected by a transponder used to electronically assess or collect a toll.,63380,Ralph Sheffield,sponsor,81R,4430,Rep. Ralph Sheffield,Ralph Sheffield
SB 1033,Relating to the purposes and powers of the Temple Health and Bioscience Economic Development District.,63380,Ralph Sheffield,sponsor,81R,4430,Rep. Ralph Sheffield,Ralph Sheffield
SB 1755,Relating to the election of directors of the Clearwater Underground Water Conservation District.,63380,Ralph Sheffield,sponsor,81R,4430,Rep. Ralph Sheffield,Ralph Sheffield
SCR 58,"Recognizing April 12 through 18, 2009, as Texas Fraternal Week.",63380,Ralph Sheffield,sponsor,81R,4430,Rep. Ralph Sheffield,Ralph Sheffield
SCR 78,In memory of James Michael Grant of Gatesville.,63380,Ralph Sheffield,sponsor,81R,4430,Rep. Ralph Sheffield,Ralph Sheffield
SB 90,Relating to adoption of the Interstate Compact on Educational Opportunity for Military Children.,63380,Ralph Sheffield,sponsor,81R,4430,Rep. Ralph Sheffield,Ralph Sheffield
SB 629,Relating to the operation of certain institutions of higher education as general academic teaching institutions and to the statutory limitation imposed on certain university systems to issue revenue bonds to fund facilities at certain institutions of higher education.,63380,Ralph Sheffield,sponsor,81R,4430,Rep. Ralph Sheffield,Ralph Sheffield
SB 1877,Relating to the creation of the Texas Medical Child Abuse Resources and Education System grant program.,63380,Ralph Sheffield,cosponsor,81R,4430,Rep. Ralph Sheffield,Ralph Sheffield
HR 112,Commending the Honorable Gibson D. (Gib) Lewis on his long and distinguished tenure as speaker of the Texas House of Representatives and extending sincere appreciation to him for his many years of outstanding service on behalf of the legislature and the citizens of Texas.,63380,Ralph Sheffield,coauthor,724,4430,Rep. Ralph Sheffield,Ralph Sheffield
HR 22,Honoring the Honorable Anna Mowery on the occasion of her birthday.,63380,Ralph Sheffield,author,723,4430,Rep. Ralph Sheffield,Ralph Sheffield
HJR 1,"Proposing a constitutional amendment providing for equal educational opportunity, providing for local control by a school district of local taxes, authorizing the legislature to determine the methods by which school districts are formed and by which state funds appropriated to school districts are allocated, providing for appropriate state funding for rural school districts that are small and sparsely populated, and restricting the power of the courts to overturn a legislative decision regarding the system of or support for public education by adopting federal constitutional law that also preserves equal access to the courts.",63380,Ralph Sheffield,coauthor,723,4430,Rep. Ralph Sheffield,Ralph Sheffield
HR 235,Honoring Representative Troy Fraser on the occasion of his 42nd birthday.,63380,Ralph Sheffield,author,721,4430,Rep. Ralph Sheffield,Ralph Sheffield
HR 238,Commending the Irving Community Television Network on the occasion of its 10th anniversary of broadcasting excellence.,63380,Ralph Sheffield,author,721,4430,Rep. Ralph Sheffield,Ralph Sheffield
HB 218,Relating to a review of state services by the comptroller of public accounts.,63380,Ralph Sheffield,coauthor,721,4430,Rep. Ralph Sheffield,Ralph Sheffield
