bill_name,caption,filer_id,filer_name,function,session
SR 40,Congratulating the Troup High School Basketball Team for its recent accomplishments.,None,Ted Lyon,author,713
HCR 5,Congratulating Dr. Mark Atkinson.,None,Ted Lyon,sponsor,713
HCR 15,Honoring A. A. Arnold.,None,Ted Lyon,sponsor,713
HCR 34,Congratulating the Chapel Hill Bulldogs.,None,Ted Lyon,sponsor,713
HCR 38,Congratulating George W. Oge.,None,Ted Lyon,sponsor,713
HCR 39,Congratulating Barbara Bass.,None,Ted Lyon,sponsor,713
HCR 40,Congratulating Tom Woldert.,None,Ted Lyon,sponsor,713
HCR 41,Congratulating Dr. Raymond Hawkins.,None,Ted Lyon,sponsor,713
HCR 47,Honoring Mr. and Mrs. Frank Singletary.,None,Ted Lyon,sponsor,713
HCR 48,Commending Dr. Earl Christian Kinzie.,None,Ted Lyon,sponsor,713
SB 18,"Relating to the reform of the workers' compensation system; to creation, powers, and duties of the Texas Workers' Compensation Commission; to work safety; authorizing an appropriation; providing......",None,Ted Lyon,author,712
SCR 16,Expressing legislative intent to apportion state judicial district boundaries on the basis of state representative districts in those counties named in the LULAC v. Mattox case.,None,Ted Lyon,author,712
SJR 3,Proposing a constitutional amendment relating to the composition of certain courts and to the election of justices and judges of those courts and certain district courts from single-member districts or divisions.,None,Ted Lyon,author,712
SR 8,Commending Lieutenant Asa Robert Hughes of the Mesquite Police Department for his 27 years of meritorious service.,None,Ted Lyon,author,712
SR 74,Requesting the lieutenant governor to establish an interim commitee to study the issue of revising the system of choosing state judicial district judges.,None,Ted Lyon,author,712
SCR 5,In memory of Congressman Mickey Leland.,None,Ted Lyon,coauthor,712
HCR 16,Commending Donna Vinson.,None,Ted Lyon,sponsor,712
SB 23,"Relating to the creation, administration, and powers, including the power of eminent domain subject to limitations, and to the duties, operations, and financing of Collin County Water Authority, and to the creation.....",None,Ted Lyon,author,711
SCR 17,Commending Bobby Evans and Billy Black.,None,Ted Lyon,author,711
SCR 22,"Granting W.E. Washerlesky, Jr. permission to sue the State of Texas and the Veterans Land Board.",None,Ted Lyon,author,711
SR 112,Expressing its gratitude for the more than 39 years of outstanding service of Electronics Technician Second Class Roy Stanley to his nation and to Texas.,None,Ted Lyon,author,711
SB 1,"Relating to the reform of the workers' compensation system; to the creation, powers, and duties of the Texas Workers' Compensation Commission; to work safety; making appropriations; providing criminal and....",None,Ted Lyon,coauthor,711
SB 30,Relating to the punishment for certain offenses committed against a child during a ritual or ceremony.,None,Ted Lyon,coauthor,711
SB 31,"Relating to services to children, youth, and their families provided by the Texas Youth Commission and juvenile boards.",None,Ted Lyon,coauthor,711
SB 76,Relating to the transfer of funds by certain state teaching hospitals and hospital districts and the use of those funds for the Medicaid disproportionate share program and making an appropriation.,None,Ted Lyon,coauthor,711
HB 114,Relating to the powers and duties of the Van Zandt County Waste Disposal District.,None,Ted Lyon,sponsor,711
HCR 30,Honoring Judge J. W. Summers.,None,Ted Lyon,sponsor,711
SB 30,Relating to the penalty imposed for failure to maintain financial responsibility in an accident involving bodily injury or death.,None,Ted Lyon,author,71R
SB 41,Relating to the required wearing of protective headgear by motorcycle riders.,None,Ted Lyon,author,71R
SB 63,Relating to signal lamps on emergency vehicles used by volunteer fire fighters.,None,Ted Lyon,author,71R
SB 156,Relating to certain annuities based on service credited in the elected class of membership of the Employees Retirement System of Texas.,None,Ted Lyon,author,71R
SB 173,Relating to the issuance of a search warrant based on the sworn oral statement of a peace officer to a magistrate.,None,Ted Lyon,author,71R
SB 190,Relating to prohibiting discrimination against certain peace officers and department of corrections employees for refusal to take a polygraph examination.,None,Ted Lyon,author,71R
SB 217,Relating to the regulation by the public utility commission of fuel cost collection by electric utilities.,None,Ted Lyon,author,71R
SB 219,Relating to eligibility for a beginning position as a fire fighter or police officer in certain cities; and declaring an emergency.,None,Ted Lyon,author,71R
SB 240,Relating to the borrowing of money by a school district.,None,Ted Lyon,author,71R
SB 289,Relating to the designation of areas within a county jail where certain fire safety devices are unsuitable for use.,None,Ted Lyon,author,71R
SB 390,Relating to complaints about and disciplinary measures taken against certain law enforcement officers or fire fighters.,None,Ted Lyon,author,71R
SB 431,Relating to the authority of a law enforcement officer commissioned by the Department of Public Safety to wear the officer's state-issued uniform while providing law enforcement services for compensation....,None,Ted Lyon,author,71R
SB 432,Relating to the right of a commissioned officer of the Department of Public Safety to engage in certain off-duty activities.,None,Ted Lyon,author,71R
SB 556,Relating to exempting police officers from wearing safety belts in motor vehicles in certain circumstances.,None,Ted Lyon,author,71R
SB 599,Relating to venue and proof requirements in certain enforcement proceedings under the Parks and Wildlife Code.,None,Ted Lyon,author,71R
SB 600,Relating to the authority of public utilities to self-insure against certain losses and to the consideration of those costs in determining rates.,None,Ted Lyon,author,71R
SB 601,Relating to a study to determine the feasibility of state funding for research on the drug prolastin.,None,Ted Lyon,author,71R
SB 602,Relating to the necessity of an applicant's bond for a receivership lease agreement.,None,Ted Lyon,author,71R
SB 659,Relating to control share acquisitions and certain business combinations.,None,Ted Lyon,author,71R
SB 675,Relating to the creation of a state criminal task force coordinating committee.,None,Ted Lyon,author,71R
SB 692,Relating to the compensation of a deputy sheriff assigned to duty as a bailiff in certain counties.,None,Ted Lyon,author,71R
SB 700,"Relating to determining, regulating and controlling worker's compensation insurance costs, the availability of worker's compensation insurance coverage, and the worker's compensation insurance system.",None,Ted Lyon,author,71R
SB 701,Relating to the regulation of rates for liability insurance.,None,Ted Lyon,author,71R
SB 702,Relating to required reserves of liability insurers.,None,Ted Lyon,author,71R
SB 703,Relating to the duty of certain insurers to write certain lines and classes of insurance coverage.,None,Ted Lyon,author,71R
SB 704,Relating to the Texas Free Enterprise and Anti-trust Act of 1983.,None,Ted Lyon,author,71R
SB 806,Relating to the use of fire trucks.,None,Ted Lyon,author,71R
SB 807,"Relating to the definition of ""bet"".",None,Ted Lyon,author,71R
SB 821,Relating to deeds requiring structures on residential property to use wood shingle roofs.,None,Ted Lyon,author,71R
SB 909,Relating to certain procedures regarding arrest without a warrant.,None,Ted Lyon,author,71R
SB 935,"Relating to the management and operation of certain municipally owned utilities, including the power to issue bonds and the power of eminent domain.",None,Ted Lyon,author,71R
SB 992,Relating to professional achievement and proficiency certificates for law enforcement officers.,None,Ted Lyon,author,71R
SB 993,"Relating to the creation, administration, and powers, including the power of eminent domain subject to limitations, and to the duties, operations, and financing of Collin County Regional Water Authority, and to the....",None,Ted Lyon,author,71R
SB 1141,Relating to required instruction in railroad and highway grade crossing safety in driving safety courses.,None,Ted Lyon,author,71R
SB 1254,Relating to attorney general enforcement of certain consumer protection provisions of the Insurance Code.,None,Ted Lyon,author,71R
SB 1255,Relating to enforcement and penalties for violation of the Deceptive Trade Practices-Consumer Protection Act.,None,Ted Lyon,author,71R
SB 1256,Relating to the certification of real estate appraisers.,None,Ted Lyon,author,71R
SB 1263,Relating to enhanced warning sign visibility at railroad grade crossings.,None,Ted Lyon,author,71R
SB 1301,Relating to the number of voters who must sign a petition for the incorporation of certain general-law municipalities.,None,Ted Lyon,author,71R
SB 1352,Relating to the frequency with which an election for the incorporation of certain general-law municipalities may be held.,None,Ted Lyon,author,71R
SB 1384,Relating to the determination of the existence of an occupational disease after a documented exposure of a fire fighter to certain disease-causing agents.,None,Ted Lyon,author,71R
SB 1439,Relating to the punishment for a Class C misdemeanor.,None,Ted Lyon,author,71R
SB 1440,"Relating to electoral and political processes and procedures, including conducting elections, voter registration, political party conventions, and candidacy for public office; providing criminal penalties.",None,Ted Lyon,author,71R
SB 1572,Relating to statements of cause of discharge of child care workers.,None,Ted Lyon,author,71R
SB 1612,"Relating to the creation, administration, powers, duties, operations, financing, and organization of the Van Zandt County Waste Disposal District; granting the power of eminent domain and the authority issue....",None,Ted Lyon,author,71R
SB 1734,"Relating to the regulation of hunting leases, private bird hunting areas, and field trial areas.",None,Ted Lyon,author,71R
SB 1746,Relating to requirements for election to the board of Smith County Water Control and Improvement District Number One--Owentown.,None,Ted Lyon,author,71R
SB 1773,Relating to spring water and the spacing of water wells.,None,Ted Lyon,author,71R
SB 1778,Relating to the creation of two judicial districts composed of Collin County.,None,Ted Lyon,author,71R
SB 1802,Relating to the regulation of Texas youth camps.,None,Ted Lyon,author,71R
SCR 24,Granting East Texas Optical Company permission to sue the State of Texas and the Texas Department of Corrections.,None,Ted Lyon,author,71R
SCR 142,Congratulating the Texas Nature Conservancy.,None,Ted Lyon,author,71R
SCR 143,Commending the Public Transportation Commission of the Tyler District.,None,Ted Lyon,author,71R
SCR 146,Establishing a special interim committee to study the entire criminal justice system.,None,Ted Lyon,author,71R
SCR 150,"Granting W.E. Washerlesky, Jr. permission to sue the State of Texas and the Veterans Land Board.",None,Ted Lyon,author,71R
SJR 7,Proposing a constitutional amendment providing for the election of justices to the supreme court from single-member districts.,None,Ted Lyon,author,71R
SR 7,Commending Congressman Bill Sarpalius.,None,Ted Lyon,author,71R
SR 39,Congratulating Mrs. Susie Virginia Dunbar Vinson on her 100th birthday.,None,Ted Lyon,author,71R
SR 51,Congratulating the East Texas State University on its centennial year.,None,Ted Lyon,author,71R
SR 52,"Declaring February 11, 1989 as Pat Tucker Day in the City of Tyler.",None,Ted Lyon,author,71R
SR 98,"Extending congratulations to the city of Tyler on ""Tyler Day"", February 22, 1989.",None,Ted Lyon,author,71R
SR 160,"Extending congratulations to A.W. ""Dub"" Riter, Jr., on his retirement as president and chief executive officer of NCNB Tyler.",None,Ted Lyon,author,71R
SR 202,Congratulating the Rockwall Rotary Club on its 50th anniversary.,None,Ted Lyon,author,71R
SR 222,Recognizing the Rockwall Rotary Breakfast Club.,None,Ted Lyon,author,71R
SR 223,"Designating March 13, 1989, as Terrell Day.",None,Ted Lyon,author,71R
SR 242,Commending the Bereaved Parent Support Group.,None,Ted Lyon,author,71R
SR 336,Commending the Edgewood High School Basketball team.,None,Ted Lyon,author,71R
SR 349,"Recognizing April 10 through April 15, 1989, as Whitehouse CAREs Week.",None,Ted Lyon,author,71R
SR 360,Congratulating the Fannindel basketball team on winning the 1988-89 1-A State Basketball Championship.,None,Ted Lyon,author,71R
SR 522,Commending Dr. Dorothy Scott for her lifetime of work for the schoolchildren of Texas and her community.,None,Ted Lyon,author,71R
SR 608,Commending the 1988-89 Fannindel basketball team for its outstanding basketball season and for obtaining the state championship.,None,Ted Lyon,author,71R
SR 680,In memory of Judge Milton Mell of Tyler.,None,Ted Lyon,author,71R
SB 255,Relating to the regulation of insurance companies; providing penalties.,None,Ted Lyon,coauthor,71R
SB 269,Relating to the peace officer college loan program.,None,Ted Lyon,coauthor,71R
SB 762,Relating to death benefits payable to the survivors of certain public servants killed on duty.,None,Ted Lyon,coauthor,71R
SB 801,"Relating to the creation of a lien for services performed by an architect, engineer, or surveyor.",None,Ted Lyon,coauthor,71R
SB 803,Relating to the punishment for certain offenses committed against a child during a ritual or ceremony.,None,Ted Lyon,coauthor,71R
SB 1379,Relating to the creation of judicial districts; making an appropriation.,None,Ted Lyon,coauthor,71R
SB 1721,Relating to children who engage in delinquent conduct or conduct indicating a need for supervision and the families of those children.,None,Ted Lyon,coauthor,71R
SB 1722,"Relating to services to children, youth, and their families provided by the Texas Youth Commission and juvenile boards.",None,Ted Lyon,coauthor,71R
HB 24,"Relating to taxes on the purchase, acquisition, importation, manufacture, or production of a controlled substance, counterfeit substance, simulated controlled substance, or marihuana; providing criminal penalties and....",None,Ted Lyon,sponsor,71R
HB 220,Relating to the creation of the offense of the fraudulent transfer of a motor vehicle.,None,Ted Lyon,sponsor,71R
HB 413,Relating to the number of voters who must sign a petition for the incorporation of certain general-law municipalities.,None,Ted Lyon,sponsor,71R
HB 414,Relating to the frequency with which an election for the incorporation of certain general-law municipalities may be held.,None,Ted Lyon,sponsor,71R
HB 731,Relating to the creation of the offense of taking or attempting to take a weapon from a peace officer.,None,Ted Lyon,sponsor,71R
HB 832,Relating to the authority of a peace officer from another state and the persons considered to be peace officers under the Penal Code.,None,Ted Lyon,sponsor,71R
HB 1088,Relating to venue for certain writs of injunction.,None,Ted Lyon,sponsor,71R
HB 1325,Relating to the entrance examination for a beginning position in the fire or police department of certain cities.,None,Ted Lyon,sponsor,71R
HB 1417,Relating to enforcement and application of certain laws and regulations under the Parks and Wildlife Code.,None,Ted Lyon,sponsor,71R
HB 1910,Relating to required instruction in railroad and highway grade crossing safety in driving safety courses.,None,Ted Lyon,sponsor,71R
HB 1926,Relating to the jurisdiction of justice of the peace courts and county courts.,None,Ted Lyon,sponsor,71R
HB 2104,Relating to the posting of bond in certain actions in which a receiver may be appointed for the mineral interest or leasehold interest under a mineral lease owned by a nonresident or absent defendant.,None,Ted Lyon,sponsor,71R
HB 2408,Relating to railroad crossing safety information regarding railroad intersections in unincorporated areas of the state.,None,Ted Lyon,sponsor,71R
HB 2681,Relating to enhanced warning sign visibility at railroad grade crossings.,None,Ted Lyon,sponsor,71R
HB 3084,"Relating to the creation, administration, powers, duties, operations, financing, and organization of the Van Zandt County Waste Disposal District; granting the power of eminent domain and the authority to....",None,Ted Lyon,sponsor,71R
HB 3085,"Relating to the regulation of hunting leases, private bird hunting areas, and field trial areas.",None,Ted Lyon,sponsor,71R
HB 3155,Relating to the qualifications for election as a director of the Smith County Water Control and Improvement District No. 1 (Owentown).,None,Ted Lyon,sponsor,71R
HB 3182,"Relating to the reorganization, administration, powers, duties, financing, and functions of the Seis Lagos Utility District; authorizing the issuance of bonds and the levy of a property tax; providing the power of eminent....",None,Ted Lyon,sponsor,71R
HCR 5,Congratulating MP Industries of Tyler.,None,Ted Lyon,sponsor,71R
HCR 6,Commending the Hawkins Industrial Arts Club.,None,Ted Lyon,sponsor,71R
HCR 11,Recognizing April 9 as Former Prisoner of War Recognition Day in Texas.,None,Ted Lyon,sponsor,71R
HCR 42,Congratulating Dr. Don Smith and Dr. David Fletcher.,None,Ted Lyon,sponsor,71R
HCR 53,Congratulating Aileen Franklin.,None,Ted Lyon,sponsor,71R
HCR 56,Commending Shane McGuire.,None,Ted Lyon,sponsor,71R
HCR 60,Commending Robert and Louise Rogers.,None,Ted Lyon,sponsor,71R
HCR 66,Commending Harold Smotherman.,None,Ted Lyon,sponsor,71R
HCR 103,"Honoring A. W. Riter, Jr.",None,Ted Lyon,sponsor,71R
HCR 133,Commending the Top Ladies of Distinction.,None,Ted Lyon,sponsor,71R
HCR 186,Requesting Congress to reimburse the state for payment claims made under Title IV-E of the Social Security Act.,None,Ted Lyon,sponsor,71R
HCR 193,Commending the East Texas Crisis Center.,None,Ted Lyon,sponsor,71R
HCR 223,Congratulating Dr. Jack L. Davidson.,None,Ted Lyon,sponsor,71R
HB 1,"Relating to the reform of the workers' compensation system; to the creation, powers, and duties of the Texas Workers' Compensation Commission; to work safety; authorizing an appropriation; providing criminal and....",None,Ted Lyon,cosponsor,71R
HB 18,"Relating to health care, including powers and duties of the center for rural health initiatives, the collection of data concerning health professions, surveys of hospitals and physicians, breast cancer screening..",None,Ted Lyon,cosponsor,71R
