Unnamed: 0,Unnamed: 0.1,Unnamed: 0.1.1,bill_name,caption,filer_id,filer_name,function,session,leg_id,original_name,parsed_name
398,398,398,HB 1200,"Relating to the enactment of the Texas Economic Development Act, authorizing certain ad valorem tax incentives for economic development, including authorizing school districts to provide tax relief for certain corporations and limited liability companies that make large investments that create jobs in this state, to authorizing the imposition of certain impact fees, and to continuing the Property Redevelopment and Tax Abatement Act.",65751,Eric Johnson,coauthor,77R,3345,Rep. Eric Johnson,Eric Johnson
399,399,399,HB 1723,Relating to the creation of a county employment development board in certain counties to develop programs for rural economic assistance for career training; authorizing a tax.,65751,Eric Johnson,coauthor,77R,3345,Rep. Eric Johnson,Eric Johnson
400,400,400,HB 1806,Relating to the issuance of certain alcoholic beverage licenses and permits.,65751,Eric Johnson,coauthor,77R,3345,Rep. Eric Johnson,Eric Johnson
401,401,401,HB 1862,Relating to the regulation and prompt payment of health care providers under certain health benefit plans; providing penalties.,65751,Eric Johnson,coauthor,77R,3345,Rep. Eric Johnson,Eric Johnson
402,402,402,HB 2215,Relating to the disannexation of certain areas by certain municipalities.,65751,Eric Johnson,coauthor,77R,3345,Rep. Eric Johnson,Eric Johnson
403,403,403,HB 3097,Relating to the security provided for revenue bonds issued by the Veterans' Land Board.,65751,Eric Johnson,coauthor,77R,3345,Rep. Eric Johnson,Eric Johnson
404,404,404,HCR 11,Conferring the Texas Legislative Medal of Honor on Master Sergeant Roy P. Benavidez.,65751,Eric Johnson,coauthor,77R,3345,Rep. Eric Johnson,Eric Johnson
405,405,405,HCR 38,"Directing the State Preservation Board to erect a statue, monument, or exhibit on the Capitol grounds honoring contributions of Tejanos.",65751,Eric Johnson,coauthor,77R,3345,Rep. Eric Johnson,Eric Johnson
406,406,406,HCR 77,Memorializing congress to revise certain provisions of Public Law 106-230.,65751,Eric Johnson,coauthor,77R,3345,Rep. Eric Johnson,Eric Johnson
407,407,407,HCR 186,Memorializing congress to repeal the Government Pension Offset enacted in 1977.,65751,Eric Johnson,coauthor,77R,3345,Rep. Eric Johnson,Eric Johnson
408,408,408,HJR 14,Proposing a constitutional amendment relating to the right to hunt and fish.,65751,Eric Johnson,coauthor,77R,3345,Rep. Eric Johnson,Eric Johnson
409,409,409,HJR 18,Proposing a constitutional amendment providing for four-year terms of office for members of the house of representatives.,65751,Eric Johnson,coauthor,77R,3345,Rep. Eric Johnson,Eric Johnson
410,410,410,HR 53,Honoring State Representative Helen Giddings on her election as president of the National Order of Women Legislators.,65751,Eric Johnson,coauthor,77R,3345,Rep. Eric Johnson,Eric Johnson
411,411,411,HR 69,Honoring the groundbreaking of the National Cowgirl Museum and Hall of Fame in February 2001.,65751,Eric Johnson,coauthor,77R,3345,Rep. Eric Johnson,Eric Johnson
412,412,412,HR 92,Congratulating Representative Dianne White Delisi on being named chair of the Women In Government Board of Directors.,65751,Eric Johnson,coauthor,77R,3345,Rep. Eric Johnson,Eric Johnson
413,413,413,HR 367,"Recognizing February 27, 2001, as 4-H Day in Texas.",65751,Eric Johnson,coauthor,77R,3345,Rep. Eric Johnson,Eric Johnson
414,414,414,SB 115,Relating to creating a foundation to finance health programs in the rural areas of the state.,65751,Eric Johnson,sponsor,77R,3345,Rep. Eric Johnson,Eric Johnson
415,415,415,SB 406,Relating to the preservation of rail facilities by the Texas Department of Transportation.,65751,Eric Johnson,sponsor,77R,3345,Rep. Eric Johnson,Eric Johnson
416,416,416,SB 516,Relating to creating the rural physician relief program and to licensing of physicians intending to practice in rural areas or other underserved or shortage areas.,65751,Eric Johnson,sponsor,77R,3345,Rep. Eric Johnson,Eric Johnson
417,417,417,SB 717,Relating to the boll weevil eradication program.,65751,Eric Johnson,sponsor,77R,3345,Rep. Eric Johnson,Eric Johnson
418,418,418,SB 746,Relating to an economic development program administered by the Texas Department of Agriculture.,65751,Eric Johnson,sponsor,77R,3345,Rep. Eric Johnson,Eric Johnson
419,419,419,SB 827,Relating to certain anticipation notes for rural economic development.,65751,Eric Johnson,sponsor,77R,3345,Rep. Eric Johnson,Eric Johnson
420,420,420,SB 907,Relating to requiring the Texas Department of Transportation to conduct a study of strategic deployment routes and highways and intermodal facilities used by the military.,65751,Eric Johnson,sponsor,77R,3345,Rep. Eric Johnson,Eric Johnson
421,421,421,SB 1001,Relating to the authority of a judge of a district court to hear certain matters at a correctional facility.,65751,Eric Johnson,sponsor,77R,3345,Rep. Eric Johnson,Eric Johnson
422,422,422,SB 1036,Relating to the election dates for directors of the Bee Groundwater Conservation District.,65751,Eric Johnson,sponsor,77R,3345,Rep. Eric Johnson,Eric Johnson
423,423,423,SB 1154,Relating to information included on the Internet website of the Texas Department of Transportation.,65751,Eric Johnson,sponsor,77R,3345,Rep. Eric Johnson,Eric Johnson
424,424,424,SB 1214,Relating to the financing and disposition of certain airport and air navigation facilities.,65751,Eric Johnson,sponsor,77R,3345,Rep. Eric Johnson,Eric Johnson
425,425,425,SB 1394,Relating to the operation of a statewide rural health care system.,65751,Eric Johnson,sponsor,77R,3345,Rep. Eric Johnson,Eric Johnson
426,426,426,SB 1573,Relating to the regulation of floating cabins; providing penalties.,65751,Eric Johnson,sponsor,77R,3345,Rep. Eric Johnson,Eric Johnson
427,427,427,SB 1758,Relating to the boundaries of the Beeville Water Supply District.,65751,Eric Johnson,sponsor,77R,3345,Rep. Eric Johnson,Eric Johnson
428,428,428,SB 1802,"Relating to the annexation of additional territory and the composition of the port commission of the Port of Corpus Christi Authority of Nueces County, Texas.",65751,Eric Johnson,sponsor,77R,3345,Rep. Eric Johnson,Eric Johnson
429,429,429,SB 65,Relating to the regulation of telepharmacy as a method to dispense drugs.,65751,Eric Johnson,sponsor,77R,3345,Rep. Eric Johnson,Eric Johnson
430,430,430,SB 126,Relating to the creation of the Rural Communities Health Care Investment Program to attract and retain rural health care professionals.,65751,Eric Johnson,sponsor,77R,3345,Rep. Eric Johnson,Eric Johnson
431,431,431,SB 577,Relating to driving privileges of drivers under 18 years of age.,65751,Eric Johnson,sponsor,77R,3345,Rep. Eric Johnson,Eric Johnson
432,432,432,SB 1264,Relating to the scope of practice of a physician assistant acting in a delegated practice.,65751,Eric Johnson,sponsor,77R,3345,Rep. Eric Johnson,Eric Johnson
433,433,433,SB 1783,Relating to enhanced availability of advanced telecommunications service.,65751,Eric Johnson,sponsor,77R,3345,Rep. Eric Johnson,Eric Johnson
434,434,434,SB 43,"Relating to eligibility for and enrollment in certain medical assistance programs, including simplifying the certification process for medical assistance provided to children.",65751,Eric Johnson,cosponsor,77R,3345,Rep. Eric Johnson,Eric Johnson
435,435,435,SB 1053,Relating to rates and expenditures under the Medicaid and state child health plan programs in the Texas-Mexico border region.,65751,Eric Johnson,cosponsor,77R,3345,Rep. Eric Johnson,Eric Johnson
436,436,436,HB 931,Relating to eligibility for appointment to an appraisal review board.,65751,Eric Johnson,author,76R,3345,Rep. Eric Johnson,Eric Johnson
437,437,437,HB 932,Relating to the use of towing safety chains.,65751,Eric Johnson,author,76R,3345,Rep. Eric Johnson,Eric Johnson
438,438,438,HB 933,Relating to exempting members of the armed forces from the Texas Academic Skills Program.,65751,Eric Johnson,author,76R,3345,Rep. Eric Johnson,Eric Johnson
439,439,439,HB 934,Relating to payment of contributions by certain employers of domestic service workers.,65751,Eric Johnson,author,76R,3345,Rep. Eric Johnson,Eric Johnson
440,440,440,HB 935,Relating to the application of the Texas Academic Skills Program.,65751,Eric Johnson,author,76R,3345,Rep. Eric Johnson,Eric Johnson
441,441,441,HB 1030,Relating to the deliberations of certain school district advisory bodies.,65751,Eric Johnson,author,76R,3345,Rep. Eric Johnson,Eric Johnson
442,442,442,HB 1164,Relating to an exemption from the severance tax for oil and gas produced from certain wells under certain market conditions.,65751,Eric Johnson,author,76R,3345,Rep. Eric Johnson,Eric Johnson
443,443,443,HB 1286,Relating to the powers and duties of the Office of Defense Affairs and Texas Strategic Military Planning Commission.,65751,Eric Johnson,author,76R,3345,Rep. Eric Johnson,Eric Johnson
444,444,444,HB 1363,Relating to the transfer of certain state property from the Texas Department of Criminal Justice to Karnes County.,65751,Eric Johnson,author,76R,3345,Rep. Eric Johnson,Eric Johnson
445,445,445,HB 1364,Relating to cancelling or prohibiting the issuance of certain original or renewal alcoholic beverage permits or licenses for nonpayment of ad valorem taxes.,65751,Eric Johnson,author,76R,3345,Rep. Eric Johnson,Eric Johnson
446,446,446,HB 1714,Relating to motor vehicle certificates of title.,65751,Eric Johnson,author,76R,3345,Rep. Eric Johnson,Eric Johnson
447,447,447,HB 1771,Relating to the punishment for the offense of trespassing.,65751,Eric Johnson,author,76R,3345,Rep. Eric Johnson,Eric Johnson
448,448,448,HB 1772,Relating to application of the Private Investigators and Private Security Agencies Act to reserve peace officers in certain counties.,65751,Eric Johnson,author,76R,3345,Rep. Eric Johnson,Eric Johnson
449,449,449,HB 1832,Relating to the implementation and financing of approved management plans for designated estuaries of national significance in the state.,65751,Eric Johnson,author,76R,3345,Rep. Eric Johnson,Eric Johnson
450,450,450,HB 2035,Relating to insurance coverage for employees of  certain motor carriers.,65751,Eric Johnson,author,76R,3345,Rep. Eric Johnson,Eric Johnson
451,451,451,HB 2247,Relating to the method of payment of fees for goods sold or services provided by the Texas Department of Transportation or for the administration of Texas Department of Transportation programs.,65751,Eric Johnson,author,76R,3345,Rep. Eric Johnson,Eric Johnson
452,452,452,HB 2248,Relating to the establishment of a statewide transit expenditure database.,65751,Eric Johnson,author,76R,3345,Rep. Eric Johnson,Eric Johnson
453,453,453,HB 2308,Relating to services of a gas utility provided to a school district.,65751,Eric Johnson,author,76R,3345,Rep. Eric Johnson,Eric Johnson
454,454,454,HB 2449,Relating to the period during which the School Land Board may reduce the royalty rate under certain oil and gas leases.,65751,Eric Johnson,author,76R,3345,Rep. Eric Johnson,Eric Johnson
455,455,455,HB 3014,Relating to the Texas Department of Transportation's automated registration and title system.,65751,Eric Johnson,author,76R,3345,Rep. Eric Johnson,Eric Johnson
456,456,456,HB 3502,Relating to rights of survivorship transfer of a motor vehicle.,65751,Eric Johnson,author,76R,3345,Rep. Eric Johnson,Eric Johnson
457,457,457,HB 3696,Relating to the approval of assignments of oil and gas leases covering certain state land.,65751,Eric Johnson,author,76R,3345,Rep. Eric Johnson,Eric Johnson
458,458,458,HB 3831,"Relating to the creation, administration, powers, duties, operation, and financing of the Refugio Groundwater Conservation District.",65751,Eric Johnson,author,76R,3345,Rep. Eric Johnson,Eric Johnson
459,459,459,HR 411,Congratulating Ruth Lindsay on her selection as Bee County 1999 Citizen of Year.,65751,Eric Johnson,author,76R,3345,Rep. Eric Johnson,Eric Johnson
460,460,460,HR 712,Recognizing the Texas Scholars of San Patricio County.,65751,Eric Johnson,author,76R,3345,Rep. Eric Johnson,Eric Johnson
461,461,461,HR 930,Honoring Mona McCain on her 90th birthday.,65751,Eric Johnson,author,76R,3345,Rep. Eric Johnson,Eric Johnson
462,462,462,HR 952,Congratulating Elizabeth DelBosque on her selection as an American Cancer Society Relay for Life honoree.,65751,Eric Johnson,author,76R,3345,Rep. Eric Johnson,Eric Johnson
463,463,463,HR 1351,"Congratulating William L. ""Bill"" Chapman on his retirement as superintendent of the Kenedy school district.",65751,Eric Johnson,author,76R,3345,Rep. Eric Johnson,Eric Johnson
464,464,464,HB 2,Relating to agriculture and state agricultural policy.,65751,Eric Johnson,author,76R,3345,Rep. Eric Johnson,Eric Johnson
465,465,465,HB 161,Relating to the tax appraisal of certain land owned or formerly owned by honorably discharged veterans or their spouses and designated for agricultural use.,65751,Eric Johnson,author,76R,3345,Rep. Eric Johnson,Eric Johnson
466,466,466,HB 381,Relating to rights of survivorship transfer of a motor vehicle or manufactured home.,65751,Eric Johnson,author,76R,3345,Rep. Eric Johnson,Eric Johnson
467,467,467,HB 704,Relating to a teacher's right of refusal following an assault by a student and allowing school districts the option of expelling students for assaulting school district employees.,65751,Eric Johnson,author,76R,3345,Rep. Eric Johnson,Eric Johnson
468,468,468,HB 801,Relating to public participation in certain environmental permitting procedures of the Texas Natural Resource Conservation Commission.,65751,Eric Johnson,author,76R,3345,Rep. Eric Johnson,Eric Johnson
469,469,469,HB 949,Relating to the application of the Private Investigators and Private Security Agencies Act to reserve peace officers in certain counties.,65751,Eric Johnson,author,76R,3345,Rep. Eric Johnson,Eric Johnson
470,470,470,HB 989,Relating to a temporary exemption from the severance tax for oil and gas produced from wells under certain market conditions.,65751,Eric Johnson,author,76R,3345,Rep. Eric Johnson,Eric Johnson
471,471,471,HB 1289,Relating to the regulation of gas utilities organized as limited liability companies.,65751,Eric Johnson,author,76R,3345,Rep. Eric Johnson,Eric Johnson
472,472,472,HB 2104,Relating to a tax exemption for hydrocarbon production from certain inactive oil and gas leases returned to production.,65751,Eric Johnson,author,76R,3345,Rep. Eric Johnson,Eric Johnson
473,473,473,HB 2561,Relating to the implementation and financing of approved management plans for designated estuaries of national significance in the state.,65751,Eric Johnson,author,76R,3345,Rep. Eric Johnson,Eric Johnson
474,474,474,HB 3465,Relating to requiring the Texas Department of Transportation to conduct a study of strategic deployment routes and highways used by the military.,65751,Eric Johnson,author,76R,3345,Rep. Eric Johnson,Eric Johnson
475,475,475,HR 81,Honoring the memory of First Lieutenant George Kenneth Sisler and commemorating the maiden voyage of the USNS Sisler.,65751,Eric Johnson,author,76R,3345,Rep. Eric Johnson,Eric Johnson
476,476,476,HB 86,Relating to sales tax exemptions.,65751,Eric Johnson,coauthor,76R,3345,Rep. Eric Johnson,Eric Johnson
477,477,477,HB 210,"Relating to the standard of alcohol concentration used in defining the term  ""intoxicated"" for the purposes of certain offenses involving intoxication.",65751,Eric Johnson,coauthor,76R,3345,Rep. Eric Johnson,Eric Johnson
478,478,478,HB 424,Relating to the distribution of money to certain counties for the payment of extraordinary costs of prosecution.,65751,Eric Johnson,coauthor,76R,3345,Rep. Eric Johnson,Eric Johnson
479,479,479,HB 537,Relating to telephone solicitation; providing penalties.,65751,Eric Johnson,coauthor,76R,3345,Rep. Eric Johnson,Eric Johnson
480,480,480,HB 601,Relating to government restrictions on the exercise of religion.,65751,Eric Johnson,coauthor,76R,3345,Rep. Eric Johnson,Eric Johnson
481,481,481,HB 623,Relating to parental notification before an abortion may be performed on certain minors; providing a criminal penalty.,65751,Eric Johnson,coauthor,76R,3345,Rep. Eric Johnson,Eric Johnson
482,482,482,HB 690,Relating to the penalty for cutting a fence used for certain animals.,65751,Eric Johnson,coauthor,76R,3345,Rep. Eric Johnson,Eric Johnson
483,483,483,HB 713,"Relating to the establishment and operation of the Toward EXcellence, Access, & Success (TEXAS) grant program and the Teach for Texas Grant Program; consolidating and revising financial aid, grant, and scholarship programs; and providing for the education, certification, and recruitment of teachers and faculty instructors.",65751,Eric Johnson,coauthor,76R,3345,Rep. Eric Johnson,Eric Johnson
484,484,484,HB 854,Relating to the identification of certain persons confined by the Texas Department of Criminal Justice who are subject to a warrant.,65751,Eric Johnson,coauthor,76R,3345,Rep. Eric Johnson,Eric Johnson
485,485,485,HB 1200,"Relating to the disannexation of certain areas annexed on or after December 1, 1996, by certain municipalities.",65751,Eric Johnson,coauthor,76R,3345,Rep. Eric Johnson,Eric Johnson
486,486,486,HB 1418,Relating to optional career and technology education programs offered by public school districts and a study of career and technology education programs.,65751,Eric Johnson,coauthor,76R,3345,Rep. Eric Johnson,Eric Johnson
487,487,487,HB 2290,Relating to a review that health care benefits be provided under certain health benefit plans.,65751,Eric Johnson,coauthor,76R,3345,Rep. Eric Johnson,Eric Johnson
488,488,488,HB 2591,Relating to skills assessment and placement testing of undergraduate students entering public institutions of higher education.,65751,Eric Johnson,coauthor,76R,3345,Rep. Eric Johnson,Eric Johnson
489,489,489,HB 2680,Relating to exemptions from ad valorem and sales and use taxation of certain timber and certain items used in timber operations and the valuation of certain timber land for ad valorem tax purposes.,65751,Eric Johnson,coauthor,76R,3345,Rep. Eric Johnson,Eric Johnson
490,490,490,HB 3092,"Relating to the operation of the Texas Motor Vehicle Board and the regulation of motor vehicle dealers, manufacturers, and distributors.",65751,Eric Johnson,coauthor,76R,3345,Rep. Eric Johnson,Eric Johnson
491,491,491,HCR 59,Memorializing congress to pass the Conservation and Reinvestment Act of 1999.,65751,Eric Johnson,coauthor,76R,3345,Rep. Eric Johnson,Eric Johnson
492,492,492,HJR 21,Proposing a constitutional amendment to require a two-thirds vote of the membership of each house of the legislature to enact certain tax bills.,65751,Eric Johnson,coauthor,76R,3345,Rep. Eric Johnson,Eric Johnson
493,493,493,HJR 72,Proposing a constitutional amendment relating to the exemption from ad valorem taxation of certain leased motor vehicles not held primarily for the production of income.,65751,Eric Johnson,coauthor,76R,3345,Rep. Eric Johnson,Eric Johnson
494,494,494,HJR 81,"Proposing a constitutional amendment relating to the ad valorem taxation of boats and other equipment used in the commercial taking or production of fish, shrimp, shellfish, or other marine life.",65751,Eric Johnson,coauthor,76R,3345,Rep. Eric Johnson,Eric Johnson
495,495,495,SB 170,Relating to cancelling or prohibiting the issuance of certain original or renewal alcoholic beverage permits or licenses for nonpayment of ad valorem taxes.,65751,Eric Johnson,sponsor,76R,3345,Rep. Eric Johnson,Eric Johnson
496,496,496,SB 448,Relating to the boll weevil eradication program.,65751,Eric Johnson,sponsor,76R,3345,Rep. Eric Johnson,Eric Johnson
497,497,497,SB 495,Relating to the powers and duties of the Office of Defense Affairs and Texas Strategic Military Planning Commission.,65751,Eric Johnson,sponsor,76R,3345,Rep. Eric Johnson,Eric Johnson
498,498,498,SB 1677,Relating to the method of payment of fees for goods sold or services provided by the Texas Department of Transportation or for the administration of Texas Department of Transportation programs.,65751,Eric Johnson,sponsor,76R,3345,Rep. Eric Johnson,Eric Johnson
499,499,499,SB 1731,Relating to the period during which the School Land Board may reduce the royalty rate under certain oil and gas leases.,65751,Eric Johnson,sponsor,76R,3345,Rep. Eric Johnson,Eric Johnson
500,500,500,SB 1797,Relating to services of a gas utility provided to a school district.,65751,Eric Johnson,sponsor,76R,3345,Rep. Eric Johnson,Eric Johnson
501,501,501,SB 290,Relating to a temporary exemption from the severance tax for oil and gas produced from wells under certain market conditions.,65751,Eric Johnson,sponsor,76R,3345,Rep. Eric Johnson,Eric Johnson
502,502,502,SB 631,Relating to the boll weevil eradication program.,65751,Eric Johnson,sponsor,76R,3345,Rep. Eric Johnson,Eric Johnson
503,503,503,HB 574,Relating to the fiscal administration of the San Patricio County Navigation District No. 1.,65751,Eric Johnson,author,75R,3345,Rep. Eric Johnson,Eric Johnson
504,504,504,HB 822,Relating to the regulatory authority of a county over wild animals.,65751,Eric Johnson,author,75R,3345,Rep. Eric Johnson,Eric Johnson
505,505,505,HB 823,Relating to the transportation of public school students.,65751,Eric Johnson,author,75R,3345,Rep. Eric Johnson,Eric Johnson
506,506,506,HB 824,Relating to the expulsion of public school students for certain drug offenses.,65751,Eric Johnson,author,75R,3345,Rep. Eric Johnson,Eric Johnson
507,507,507,HB 825,Relating to the admission of public school students who have been expelled.,65751,Eric Johnson,author,75R,3345,Rep. Eric Johnson,Eric Johnson
508,508,508,HB 1029,Relating to the creation of municipal development districts; authorizing the imposition of certain local taxes and the issuance of local bonds.,65751,Eric Johnson,author,75R,3345,Rep. Eric Johnson,Eric Johnson
509,509,509,HB 1112,Relating to certain procedures and hearings concerning the revocation of the release status of persons under the supervision of the pardons and paroles division of the Texas Department of Criminal Justice and the housing of those persons pending the hearings.,65751,Eric Johnson,author,75R,3345,Rep. Eric Johnson,Eric Johnson
510,510,510,HB 1440,Relating to free trial transcripts for appeals in which an affidavit of inability to pay costs has been filed.,65751,Eric Johnson,author,75R,3345,Rep. Eric Johnson,Eric Johnson
511,511,511,HB 1921,Relating to the creation of municipal development districts; authorizing the imposition of certain local taxes and the issuance of local bonds.,65751,Eric Johnson,author,75R,3345,Rep. Eric Johnson,Eric Johnson
512,512,512,HB 1922,Relating to cancelling or prohibiting the issuance of certain original or renewal alcoholic beverage permits or licenses for nonpayment of ad valorem taxes.,65751,Eric Johnson,author,75R,3345,Rep. Eric Johnson,Eric Johnson
513,513,513,HB 1958,"Relating to the imposition, collection, and administration of LPG delivery fees.",65751,Eric Johnson,author,75R,3345,Rep. Eric Johnson,Eric Johnson
514,514,514,HB 1959,Relating to the continuing education requirements for a medical radiologic technologist.,65751,Eric Johnson,author,75R,3345,Rep. Eric Johnson,Eric Johnson
515,515,515,HB 2138,Relating to the standards for certain equipment on vehicles.,65751,Eric Johnson,author,75R,3345,Rep. Eric Johnson,Eric Johnson
516,516,516,HB 2665,Relating to permitting certain commercial mariculture facilities in coastal counties.,65751,Eric Johnson,author,75R,3345,Rep. Eric Johnson,Eric Johnson
517,517,517,HB 2667,Relating to the administration of property taxation.,65751,Eric Johnson,author,75R,3345,Rep. Eric Johnson,Eric Johnson
518,518,518,HB 2681,Relating to the issuance of specially designed Texas license plates for Keep Texas Beautiful.,65751,Eric Johnson,author,75R,3345,Rep. Eric Johnson,Eric Johnson
519,519,519,HB 2682,Relating to ad valorem tax sanctions on certain land diverted from agricultural use.,65751,Eric Johnson,author,75R,3345,Rep. Eric Johnson,Eric Johnson
520,520,520,HB 3249,Relating to school buses; providing a penalty.,65751,Eric Johnson,author,75R,3345,Rep. Eric Johnson,Eric Johnson
521,521,521,HB 3559,Relating to the County Court at Law of Bee County.,65751,Eric Johnson,author,75R,3345,Rep. Eric Johnson,Eric Johnson
522,522,522,HB 3590,"Relating to the creation, administration, powers, duties, operation, and financing of the San Patricio Groundwater Conservation District.",65751,Eric Johnson,author,75R,3345,Rep. Eric Johnson,Eric Johnson
523,523,523,HR 27,Honoring Charlie Marshall for his contributions to the Aransas Pass community.,65751,Eric Johnson,author,75R,3345,Rep. Eric Johnson,Eric Johnson
524,524,524,HR 48,Congratulating Robert and Annie Adams on the occasion of their 50th wedding anniversary.,65751,Eric Johnson,author,75R,3345,Rep. Eric Johnson,Eric Johnson
525,525,525,HR 188,Honoring Robert L. Herndon.,65751,Eric Johnson,author,75R,3345,Rep. Eric Johnson,Eric Johnson
526,526,526,HR 374,"Recognizing March 19, 1997, as Texas State Pilots Day at the Capitol.",65751,Eric Johnson,author,75R,3345,Rep. Eric Johnson,Eric Johnson
527,527,527,HR 375,Congratulating Benjamin and Anna Dell Kowalik on their 50th anniversary.,65751,Eric Johnson,author,75R,3345,Rep. Eric Johnson,Eric Johnson
528,528,528,HR 490,"Granting the Capitol Scholars program permission to use the house chamber on July 18, 1997.",65751,Eric Johnson,author,75R,3345,Rep. Eric Johnson,Eric Johnson
529,529,529,HR 509,Congratulating John and Agnes Kollodziej on the occasion of their 50th wedding anniversary.,65751,Eric Johnson,author,75R,3345,Rep. Eric Johnson,Eric Johnson
530,530,530,HR 578,"Recognizing April 8, 1997, as Aransas Pass Day at the State Capitol.",65751,Eric Johnson,author,75R,3345,Rep. Eric Johnson,Eric Johnson
531,531,531,HR 719,In memory of German Carvajal.,65751,Eric Johnson,author,75R,3345,Rep. Eric Johnson,Eric Johnson
