Unnamed: 0,Unnamed: 0.1,Unnamed: 0.1.1,bill_name,caption,filer_id,filer_name,function,session,leg_id,original_name,parsed_name
127,127,127,SB 471,Relating to reviews and investigations conducted by the Texas Education Agency.,65889,Dan Huberty,sponsor,84R,2285,Rep. Dan Huberty,Dan Huberty
128,128,128,SB 892,Relating to educator preparation programs and teacher certification examinations.,65889,Dan Huberty,sponsor,84R,2285,Rep. Dan Huberty,Dan Huberty
129,129,129,SB 1081,Relating to the disclosure of certain information under a consolidated insurance program.,65889,Dan Huberty,sponsor,84R,2285,Rep. Dan Huberty,Dan Huberty
130,130,130,SB 1200,Relating to the creation of a commission to recommend a new system for student assessment and public school accountability.,65889,Dan Huberty,sponsor,84R,2285,Rep. Dan Huberty,Dan Huberty
131,131,131,SB 1222,Relating to the authority of the commissioner of education to issue subpoenas during an investigation of educator misconduct.,65889,Dan Huberty,sponsor,84R,2285,Rep. Dan Huberty,Dan Huberty
132,132,132,SB 1452,Relating to the power of a commissioners court to authorize ad valorem tax sales of real property to be conducted by means of online auctions.,65889,Dan Huberty,sponsor,84R,2285,Rep. Dan Huberty,Dan Huberty
133,133,133,SCR 1,"Claiming sovereignty under the Tenth Amendment to the U.S. Constitution over all powers not otherwise enumerated and granted to the federal government by the U.S. Constitution, serving notice to the federal government to halt and reverse certain mandates, and providing that certain federal legislation be prohibited or repealed.",65889,Dan Huberty,sponsor,84R,2285,Rep. Dan Huberty,Dan Huberty
134,134,134,SB 1024,Relating to eligibility for course credit and high school diplomas of students enrolled in educational programs provided by the Windham School District in the Texas Department of Criminal Justice.,65889,Dan Huberty,sponsor,84R,2285,Rep. Dan Huberty,Dan Huberty
135,135,135,SB 694,"Relating to authorizing patients with certain terminal illnesses to access certain investigational drugs, biological products, and devices that are in clinical trials.",65889,Dan Huberty,cosponsor,84R,2285,Rep. Dan Huberty,Dan Huberty
136,136,136,SB 2065,Relating to the rights of certain religious organizations and individuals relating to a marriage that violates a sincerely held religious belief.,65889,Dan Huberty,cosponsor,84R,2285,Rep. Dan Huberty,Dan Huberty
137,137,137,HR 44,"Congratulating Carolyn and Christopher Peavey on the birth of their son, Jackson William Peavey.",65889,Dan Huberty,author,832,2285,Rep. Dan Huberty,Dan Huberty
138,138,138,HR 91,Commending Robert Yarbrough for his service with the Houston Fire Department.,65889,Dan Huberty,author,832,2285,Rep. Dan Huberty,Dan Huberty
139,139,139,HR 92,In memory of Merilyn Kathleen Hartnett Deane of Kingwood.,65889,Dan Huberty,author,832,2285,Rep. Dan Huberty,Dan Huberty
140,140,140,HCR 16,"Designating July 18, 2013, as Nelson Mandela International Day in Texas.",65889,Dan Huberty,coauthor,832,2285,Rep. Dan Huberty,Dan Huberty
141,141,141,HR 218,Congratulating Jacob Gonzales and Ashley Lance of Crosby High School on winning the 4A championship at the 2013 UIL Cross-Examination Debate State Meet.,65889,Dan Huberty,author,831,2285,Rep. Dan Huberty,Dan Huberty
142,142,142,HR 233,Commending Molly McShane of Kingwood High School for her involvement with the Lone Star Youth Leadership Council.,65889,Dan Huberty,author,831,2285,Rep. Dan Huberty,Dan Huberty
143,143,143,HB 70,Relating to appropriating money to the Texas A&M Forest Service to assist volunteer fire departments during the next state fiscal biennium.,65889,Dan Huberty,coauthor,831,2285,Rep. Dan Huberty,Dan Huberty
144,144,144,HB 73,Relating to appropriating money to the Texas A&M Forest Service to be used to assist volunteer fire departments during the current state fiscal biennium.,65889,Dan Huberty,coauthor,831,2285,Rep. Dan Huberty,Dan Huberty
145,145,145,HB 222,Relating to a public school student's eligibility for a public education grant to attend another public school.,65889,Dan Huberty,author,83R,2285,Rep. Dan Huberty,Dan Huberty
146,146,146,HB 223,Relating to the carrying of concealed handguns by certain persons attending a school board meeting.,65889,Dan Huberty,author,83R,2285,Rep. Dan Huberty,Dan Huberty
147,147,147,HB 224,Relating to the use of a public school student's performance on an end-of-course assessment instrument in determining the student's final grade for the course.,65889,Dan Huberty,author,83R,2285,Rep. Dan Huberty,Dan Huberty
148,148,148,HB 462,"Relating to state control of teacher appraisal criteria, curriculum standards, and assessment instruments.",65889,Dan Huberty,author,83R,2285,Rep. Dan Huberty,Dan Huberty
149,149,149,HB 609,Relating to the eligibility of certain persons to participate in the retirement systems of certain municipalities.,65889,Dan Huberty,author,83R,2285,Rep. Dan Huberty,Dan Huberty
150,150,150,HB 866,Relating to the administration to public school students in certain grades of state-administered assessment instruments.,65889,Dan Huberty,author,83R,2285,Rep. Dan Huberty,Dan Huberty
151,151,151,HB 1035,Relating to the filing of reports of political contributions and expenditures and of personal financial statements by certain officeholders and candidates.,65889,Dan Huberty,author,83R,2285,Rep. Dan Huberty,Dan Huberty
152,152,152,HB 1251,Relating to the service areas of certain junior college districts.,65889,Dan Huberty,author,83R,2285,Rep. Dan Huberty,Dan Huberty
153,153,153,HB 1264,Relating to information regarding the number of public school students with dyslexia.,65889,Dan Huberty,author,83R,2285,Rep. Dan Huberty,Dan Huberty
154,154,154,HB 1593,Relating to the powers and duties of the Harris County Municipal Utility District No. 505; providing authority to issue bonds; providing authority to impose fees and taxes.,65889,Dan Huberty,author,83R,2285,Rep. Dan Huberty,Dan Huberty
155,155,155,HB 1594,Relating to the powers and duties of the Harris County Municipal Utility District No. 504; providing authority to issue bonds; providing authority to impose fees and taxes.,65889,Dan Huberty,author,83R,2285,Rep. Dan Huberty,Dan Huberty
156,156,156,HB 1800,Relating to the powers and duties of the Harris County Municipal Utility District No. 422; providing authority to issue bonds; providing authority to impose fees and taxes.,65889,Dan Huberty,author,83R,2285,Rep. Dan Huberty,Dan Huberty
157,157,157,HB 1801,Relating to the powers and duties of the Harris County Municipal Utility District No. 423; providing authority to issue bonds; providing authority to impose fees and taxes.,65889,Dan Huberty,author,83R,2285,Rep. Dan Huberty,Dan Huberty
158,158,158,HB 1802,Relating to the date by which a school district must complete a report of an initial evaluation of a student for special education services.,65889,Dan Huberty,author,83R,2285,Rep. Dan Huberty,Dan Huberty
159,159,159,HB 2049,Relating to a qualifying cogeneration facility's ability to sell electric energy to multiple purchasers.,65889,Dan Huberty,author,83R,2285,Rep. Dan Huberty,Dan Huberty
160,160,160,HB 2607,Relating to the representation through a telephone conference call of a school district employee under a district grievance policy.,65889,Dan Huberty,author,83R,2285,Rep. Dan Huberty,Dan Huberty
161,161,161,HB 2608,Relating to an exemption from certain requirements for certain funeral establishments that do not perform embalming services.,65889,Dan Huberty,author,83R,2285,Rep. Dan Huberty,Dan Huberty
162,162,162,HB 2961,Relating to the social security numbers of school district employees.,65889,Dan Huberty,author,83R,2285,Rep. Dan Huberty,Dan Huberty
163,163,163,HCR 119,Urging the United States Congress to rewrite the Elementary and Secondary Education Act in order to lessen the burden of over-testing and teaching to the test.,65889,Dan Huberty,author,83R,2285,Rep. Dan Huberty,Dan Huberty
164,164,164,HR 235,"Recognizing February 13, 2013, as Dyslexia Awareness Day at the State Capitol.",65889,Dan Huberty,author,83R,2285,Rep. Dan Huberty,Dan Huberty
165,165,165,HR 502,"Recognizing February 21, 2013, as Texas Building Owners and Managers Association Advocacy Day at the State Capitol.",65889,Dan Huberty,author,83R,2285,Rep. Dan Huberty,Dan Huberty
166,166,166,HR 503,"Congratulating Robert A. Sitton on his receipt of the Hayden McKay, M.D., Citizen of the Year award from the Lake Houston Area Chamber of Commerce.",65889,Dan Huberty,author,83R,2285,Rep. Dan Huberty,Dan Huberty
167,167,167,HR 504,Congratulating Dave Kilby on his receipt of the 2012 Spirit of the Chamber Award from the Lake Houston Area Chamber of Commerce.,65889,Dan Huberty,author,83R,2285,Rep. Dan Huberty,Dan Huberty
168,168,168,HR 1458,Congratulating Alexa Pagano of Humble on earning the Overall Award of Excellence in Dance Choreography at the 2013 Texas PTA Reflections competition.,65889,Dan Huberty,author,83R,2285,Rep. Dan Huberty,Dan Huberty
169,169,169,HR 1804,"Congratulating David P. Martin, Jr., on his graduation from The University of Texas at Austin and on his acceptance to the Baylor College of Medicine.",65889,Dan Huberty,author,83R,2285,Rep. Dan Huberty,Dan Huberty
170,170,170,HR 2162,Congratulating Macie Rianne Walters on her graduation from Atascocita High School.,65889,Dan Huberty,author,83R,2285,Rep. Dan Huberty,Dan Huberty
171,171,171,HR 2163,Honoring Molly Karol Spratt for her service as a legislative intern in the office of Representative Dan Huberty.,65889,Dan Huberty,author,83R,2285,Rep. Dan Huberty,Dan Huberty
172,172,172,HR 2320,Honoring Seth Howard for his service as a legislative intern for Representative Dan Huberty.,65889,Dan Huberty,author,83R,2285,Rep. Dan Huberty,Dan Huberty
173,173,173,HR 2321,Congratulating Jessica Beemer on obtaining her master's degree in public administration from The University of Texas at San Antonio.,65889,Dan Huberty,author,83R,2285,Rep. Dan Huberty,Dan Huberty
174,174,174,HR 2386,Congratulating Autumn Marie Jodzio and Matthew David Niemczak of Houston on their engagement.,65889,Dan Huberty,author,83R,2285,Rep. Dan Huberty,Dan Huberty
175,175,175,HR 2387,"Congratulating Sam and Casey Schrade on the birth of their daughter, Emma Avery Schrade.",65889,Dan Huberty,author,83R,2285,Rep. Dan Huberty,Dan Huberty
176,176,176,HR 2388,Recognizing Erin and Jared McAnally on their marriage.,65889,Dan Huberty,author,83R,2285,Rep. Dan Huberty,Dan Huberty
177,177,177,HR 2390,Honoring Victoria Haas on her service as a legislative intern for Representative Dan Huberty.,65889,Dan Huberty,author,83R,2285,Rep. Dan Huberty,Dan Huberty
178,178,178,HR 2391,Commending Chase Austin Barker on his service as a legislative aide in the office of State Representative Dan Huberty.,65889,Dan Huberty,author,83R,2285,Rep. Dan Huberty,Dan Huberty
179,179,179,HR 2463,Congratulating Tom Huberty and Audi Clyde of Atascocita on their engagement.,65889,Dan Huberty,author,83R,2285,Rep. Dan Huberty,Dan Huberty
180,180,180,HR 2547,Congratulating Gia Jones on being named the Atascocita Middle School Teacher of the Year.,65889,Dan Huberty,author,83R,2285,Rep. Dan Huberty,Dan Huberty
181,181,181,HR 2634,"Honoring Benjamin Blanton Melson, Jr., for his service as a legislative aide in the office of State Representative Dan Huberty.",65889,Dan Huberty,author,83R,2285,Rep. Dan Huberty,Dan Huberty
182,182,182,HR 2635,In memory of Alfred P. Kanuch.,65889,Dan Huberty,author,83R,2285,Rep. Dan Huberty,Dan Huberty
183,183,183,HR 2701,"Congratulating Sarah Story, salutatorian of the Class of 2013 at Hargrave High School in Huffman.",65889,Dan Huberty,author,83R,2285,Rep. Dan Huberty,Dan Huberty
184,184,184,HR 2702,Congratulating Jamie Lehnen on being named valedictorian of the Kingwood Park High School Class of 2013.,65889,Dan Huberty,author,83R,2285,Rep. Dan Huberty,Dan Huberty
185,185,185,HR 2703,Congratulating Diane Dreucean on being named salutatorian of the Kingwood Park High School Class of 2013.,65889,Dan Huberty,author,83R,2285,Rep. Dan Huberty,Dan Huberty
186,186,186,HR 2704,"Congratulating Bret Rudolph, valedictorian of the Class of 2013 at Hargrave High School in Huffman.",65889,Dan Huberty,author,83R,2285,Rep. Dan Huberty,Dan Huberty
187,187,187,HR 2765,Congratulating Nicole Edgar on being named the salutatorian of the Atascocita High School Class of 2013.,65889,Dan Huberty,author,83R,2285,Rep. Dan Huberty,Dan Huberty
188,188,188,HR 2766,"Congratulating Ariel Thomas, valedictorian of the Summer Creek High School Class of 2013.",65889,Dan Huberty,author,83R,2285,Rep. Dan Huberty,Dan Huberty
189,189,189,HR 2877,"Congratulating Karina Cabrera, valedictorian of the Humble High School Class of 2013.",65889,Dan Huberty,author,83R,2285,Rep. Dan Huberty,Dan Huberty
190,190,190,HR 2878,"Congratulating Mieola Easter, salutatorian of the Humble High School Class of 2013.",65889,Dan Huberty,author,83R,2285,Rep. Dan Huberty,Dan Huberty
191,191,191,HR 2879,"Congratulating Adam Romero, salutatorian of the Holy Trinity Episcopal School Class of 2013.",65889,Dan Huberty,author,83R,2285,Rep. Dan Huberty,Dan Huberty
192,192,192,HR 2916,"Congratulating Krysten Barnes, salutatorian of the Summer Creek High School Class of 2013.",65889,Dan Huberty,author,83R,2285,Rep. Dan Huberty,Dan Huberty
193,193,193,HR 2917,Congratulating Jason Zhang on being named valedictorian of the Atascocita High School Class of 2013.,65889,Dan Huberty,author,83R,2285,Rep. Dan Huberty,Dan Huberty
194,194,194,HR 2918,"Congratulating Monika Winkler, valedictorian of the Holy Trinity Episcopal School Class of 2013.",65889,Dan Huberty,author,83R,2285,Rep. Dan Huberty,Dan Huberty
195,195,195,HR 3052,"Commending Jessica Renee Muldrow, salutatorian of the Crosby High School class of 2013.",65889,Dan Huberty,author,83R,2285,Rep. Dan Huberty,Dan Huberty
196,196,196,HR 3053,"Commending Rosaline Cruz, valedictorian of the Crosby High School Class of 2013.",65889,Dan Huberty,author,83R,2285,Rep. Dan Huberty,Dan Huberty
197,197,197,HR 3054,"Congratulating Madeline Hazle, salutatorian of the Kingwood High School Class of 2013.",65889,Dan Huberty,author,83R,2285,Rep. Dan Huberty,Dan Huberty
198,198,198,HR 3055,"Congratulating Bronwyn Scott, valedictorian of the Kingwood High School Class of 2013.",65889,Dan Huberty,author,83R,2285,Rep. Dan Huberty,Dan Huberty
199,199,199,HB 103,Relating to a supplemental payment for retirees of the Teacher Retirement System of Texas and the unfunded actuarial liabilities allowed under that system.,65889,Dan Huberty,author,83R,2285,Rep. Dan Huberty,Dan Huberty
200,200,200,HB 274,Relating to reporting requirements related to school districts that obtain exceptions from class size limits.,65889,Dan Huberty,author,83R,2285,Rep. Dan Huberty,Dan Huberty
201,201,201,HB 558,"Relating to the purchase of iron, steel, and manufactured goods made in the United States for certain state, state-aided, and governmental entity construction projects.",65889,Dan Huberty,author,83R,2285,Rep. Dan Huberty,Dan Huberty
202,202,202,HB 628,"Relating to the right of a member of the board of trustees of a school district to obtain information, documents, and records.",65889,Dan Huberty,author,83R,2285,Rep. Dan Huberty,Dan Huberty
203,203,203,HB 697,Relating to a sales and use tax exemption for certain items sold by school booster clubs and support organizations; authorizing a sales and use tax exemption.,65889,Dan Huberty,author,83R,2285,Rep. Dan Huberty,Dan Huberty
204,204,204,HB 711,Relating to the computation of an electric utility's income taxes.,65889,Dan Huberty,author,83R,2285,Rep. Dan Huberty,Dan Huberty
205,205,205,HB 885,Relating to the guarantee of refinanced open-enrollment charter school bonds by the permanent school fund.,65889,Dan Huberty,author,83R,2285,Rep. Dan Huberty,Dan Huberty
206,206,206,HB 1374,Relating to equal opportunity for access by home-schooled students to University Interscholastic League sponsored activities; authorizing a fee.,65889,Dan Huberty,author,83R,2285,Rep. Dan Huberty,Dan Huberty
207,207,207,HB 1831,Relating to an adult high school diploma and industry certification charter school pilot program for adults 19 to 50 years of age.,65889,Dan Huberty,author,83R,2285,Rep. Dan Huberty,Dan Huberty
208,208,208,HB 1956,Relating to an adult high school diploma and industry certification pilot program for adults 19 to 50 years of age.,65889,Dan Huberty,author,83R,2285,Rep. Dan Huberty,Dan Huberty
209,209,209,HB 2201,Relating to increasing the courses offered in the career and technology education curriculum.,65889,Dan Huberty,author,83R,2285,Rep. Dan Huberty,Dan Huberty
210,210,210,HB 2808,Relating to an exemption from the state hotel occupancy tax for certain members of the Texas State Guard.,65889,Dan Huberty,author,83R,2285,Rep. Dan Huberty,Dan Huberty
211,211,211,HB 2836,Relating to the essential knowledge and skills of the required public school curriculum and to certain state-adopted or state-developed assessment instruments for public school students.,65889,Dan Huberty,author,83R,2285,Rep. Dan Huberty,Dan Huberty
212,212,212,HB 4,Relating to the administration of the Texas Water Development Board and the funding of water projects by the board and other entities; authorizing the issuance of revenue bonds.,65889,Dan Huberty,coauthor,83R,2285,Rep. Dan Huberty,Dan Huberty
213,213,213,HB 5,"Relating to public school accountability, including assessment, and curriculum requirements; providing a criminal penalty.",65889,Dan Huberty,coauthor,83R,2285,Rep. Dan Huberty,Dan Huberty
214,214,214,HB 13,Relating to the State Pension Review Board and public retirement systems; authorizing a fee.,65889,Dan Huberty,coauthor,83R,2285,Rep. Dan Huberty,Dan Huberty
215,215,215,HB 14,Relating to the fiscal transparency and accountability of certain entities responsible for public money.,65889,Dan Huberty,coauthor,83R,2285,Rep. Dan Huberty,Dan Huberty
216,216,216,HB 44,Relating to a moratorium on administering assessment instruments to public school students under the public school accountability system.,65889,Dan Huberty,coauthor,83R,2285,Rep. Dan Huberty,Dan Huberty
217,217,217,HB 45,Relating to the occupational licensing of spouses of members of the military and the eligibility requirements for certain occupational licenses issued to applicants with military experience.,65889,Dan Huberty,coauthor,83R,2285,Rep. Dan Huberty,Dan Huberty
218,218,218,HB 47,Relating to a handgun proficiency course that is taken to obtain or renew a concealed handgun license.,65889,Dan Huberty,coauthor,83R,2285,Rep. Dan Huberty,Dan Huberty
219,219,219,HB 48,Relating to the procedure under which a person may renew a license to carry a concealed handgun.,65889,Dan Huberty,coauthor,83R,2285,Rep. Dan Huberty,Dan Huberty
220,220,220,HB 78,Relating to the exemption from the sales and use tax for certain coins and precious metals.,65889,Dan Huberty,coauthor,83R,2285,Rep. Dan Huberty,Dan Huberty
221,221,221,HB 86,Relating to the criteria for review by the Sunset Advisory Commission of an agency that licenses an occupation.,65889,Dan Huberty,coauthor,83R,2285,Rep. Dan Huberty,Dan Huberty
222,222,222,HB 87,Relating to regulation of an individual's occupation.,65889,Dan Huberty,coauthor,83R,2285,Rep. Dan Huberty,Dan Huberty
223,223,223,HB 88,Relating to the constitutional limit on the rate of growth of appropriations.,65889,Dan Huberty,coauthor,83R,2285,Rep. Dan Huberty,Dan Huberty
224,224,224,HB 95,Relating to exempting a school district from the obligation to comply with certain unfunded state educational mandates.,65889,Dan Huberty,coauthor,83R,2285,Rep. Dan Huberty,Dan Huberty
225,225,225,HB 98,Relating to zero-based budgeting for certain entities funded by this state.,65889,Dan Huberty,coauthor,83R,2285,Rep. Dan Huberty,Dan Huberty
226,226,226,HB 130,Relating to honesty in state taxation.,65889,Dan Huberty,coauthor,83R,2285,Rep. Dan Huberty,Dan Huberty
227,227,227,HB 149,Relating to the Texas Liberty Preservation Act; providing penalties.,65889,Dan Huberty,coauthor,83R,2285,Rep. Dan Huberty,Dan Huberty
228,228,228,HB 200,"Relating to liability of certain electric utilities that allow certain uses of land that the electric utility owns, occupies, or leases.",65889,Dan Huberty,coauthor,83R,2285,Rep. Dan Huberty,Dan Huberty
229,229,229,HB 202,Relating to the absence of a student from school to visit with a parent or guardian who will be or has been deployed on military duty.,65889,Dan Huberty,coauthor,83R,2285,Rep. Dan Huberty,Dan Huberty
230,230,230,HB 204,Relating to zero-based budgeting for certain entities funded by this state and requiring a state agency that is undergoing review by the Sunset Advisory Commission to undergo a financial audit and submit a zero-based budget in connection with the review.,65889,Dan Huberty,coauthor,83R,2285,Rep. Dan Huberty,Dan Huberty
231,231,231,HB 220,"Relating to consecutive sentences for certain offenses involving injury to a child, an elderly individual, or a disabled individual and arising out of the same criminal episode.",65889,Dan Huberty,coauthor,83R,2285,Rep. Dan Huberty,Dan Huberty
232,232,232,HB 228,Relating to the maximum rate of growth of appropriations.,65889,Dan Huberty,coauthor,83R,2285,Rep. Dan Huberty,Dan Huberty
233,233,233,HB 237,Relating to the limitation on the rate of growth in appropriations from state tax revenues.,65889,Dan Huberty,coauthor,83R,2285,Rep. Dan Huberty,Dan Huberty
234,234,234,HB 257,Relating to the creation of the Texas Tech University Health Sciences Center at El Paso as a component institution of the Texas Tech University System.,65889,Dan Huberty,coauthor,83R,2285,Rep. Dan Huberty,Dan Huberty
235,235,235,HB 308,Relating to a school district's recognition of and education regarding traditional winter celebrations.,65889,Dan Huberty,coauthor,83R,2285,Rep. Dan Huberty,Dan Huberty
236,236,236,HB 478,Relating to the limit on the number of charters that may be granted for an open-enrollment charter school.,65889,Dan Huberty,coauthor,83R,2285,Rep. Dan Huberty,Dan Huberty
237,237,237,HB 500,"Relating to the computation of the franchise tax, including certain exclusions from the tax.",65889,Dan Huberty,coauthor,83R,2285,Rep. Dan Huberty,Dan Huberty
238,238,238,HB 509,Relating to the phaseout and repeal of the franchise tax; lowering the rates of the taxes.,65889,Dan Huberty,coauthor,83R,2285,Rep. Dan Huberty,Dan Huberty
239,239,239,HB 524,Relating to the disclosure on personal financial statements of certain contracts or subcontracts with governmental entities.,65889,Dan Huberty,coauthor,83R,2285,Rep. Dan Huberty,Dan Huberty
240,240,240,HB 553,Relating to firearms and the preservation of the Second Amendment to the United States Constitution; providing penalties.,65889,Dan Huberty,coauthor,83R,2285,Rep. Dan Huberty,Dan Huberty
241,241,241,HB 607,Relating to the phaseout and repeal of the franchise tax; lowering the rates of the tax.,65889,Dan Huberty,coauthor,83R,2285,Rep. Dan Huberty,Dan Huberty
242,242,242,HB 680,Relating to provisions in the dedicatory instruments of property owners' associations regarding display of flags.,65889,Dan Huberty,coauthor,83R,2285,Rep. Dan Huberty,Dan Huberty
243,243,243,HB 698,Relating to certain procedures for submitting legible and classifiable fingerprints with an application for a license to carry a concealed handgun.,65889,Dan Huberty,coauthor,83R,2285,Rep. Dan Huberty,Dan Huberty
244,244,244,HB 760,Relating to State Board of Education oversight of regional education service center services and products concerning student curriculum.,65889,Dan Huberty,coauthor,83R,2285,Rep. Dan Huberty,Dan Huberty
245,245,245,HB 773,Relating to the recitation of the pledges of allegiance to and display of the United States and state flags at and the observation of a moment of silence at open-enrollment charter schools and other public schools.,65889,Dan Huberty,coauthor,83R,2285,Rep. Dan Huberty,Dan Huberty
246,246,246,HB 783,Relating to the constitutional limit on the rate of growth of appropriations and the use of surplus state revenues.,65889,Dan Huberty,coauthor,83R,2285,Rep. Dan Huberty,Dan Huberty
247,247,247,HB 785,Relating to ballot language for a proposition to approve the issuance or increase of debt.,65889,Dan Huberty,coauthor,83R,2285,Rep. Dan Huberty,Dan Huberty
248,248,248,HB 800,Relating to a sales and use tax exemption and a franchise tax credit related to certain research and development activities.,65889,Dan Huberty,coauthor,83R,2285,Rep. Dan Huberty,Dan Huberty
249,249,249,HB 912,Relating to images captured by unmanned aircraft and other images and recordings; providing penalties.,65889,Dan Huberty,coauthor,83R,2285,Rep. Dan Huberty,Dan Huberty
250,250,250,HB 997,Relating to health plan and health benefit plan coverage for abortions.,65889,Dan Huberty,coauthor,83R,2285,Rep. Dan Huberty,Dan Huberty
251,251,251,HB 1000,Relating to the creation of a new university in South Texas within The University of Texas System.,65889,Dan Huberty,coauthor,83R,2285,Rep. Dan Huberty,Dan Huberty
252,252,252,HB 1379,Relating to coercive conditions placed on the receipt by this state of federal money.,65889,Dan Huberty,coauthor,83R,2285,Rep. Dan Huberty,Dan Huberty
253,253,253,HB 1383,Relating to the state contribution for the Teacher Retirement System of Texas.,65889,Dan Huberty,coauthor,83R,2285,Rep. Dan Huberty,Dan Huberty
254,254,254,HB 1444,Relating to advance directives and health care and treatment decisions.,65889,Dan Huberty,coauthor,83R,2285,Rep. Dan Huberty,Dan Huberty
255,255,255,HB 1455,Relating to in-hospital and out-of-hospital do-not-resuscitate orders and advance directives; providing a criminal penalty.,65889,Dan Huberty,coauthor,83R,2285,Rep. Dan Huberty,Dan Huberty
