Unnamed: 0,Unnamed: 0.1,Unnamed: 0.1.1,bill_name,caption,filer_id,filer_name,function,session,leg_id,original_name,parsed_name
363,363,363,SB 87,"Relating to adverse licensing, listing, or registration decisions by certain health and human services agencies.",41354,Lois Kolkhorst,sponsor,81R,3495,Rep. Lois W. Kolkhorst,Lois Kolkhorst
364,364,364,SB 286,Relating to a health passport for Medicaid recipients.,41354,Lois Kolkhorst,sponsor,81R,3495,Rep. Lois W. Kolkhorst,Lois Kolkhorst
365,365,365,SB 287,Relating to the use of electronic prescribing data transmission systems under the state Medicaid program.,41354,Lois Kolkhorst,sponsor,81R,3495,Rep. Lois W. Kolkhorst,Lois Kolkhorst
366,366,366,SB 288,"Relating to improving the quality of health care services provided under certain state programs through certain initiatives, including payment strategies and medication history review requirements.",41354,Lois Kolkhorst,sponsor,81R,3495,Rep. Lois W. Kolkhorst,Lois Kolkhorst
367,367,367,SB 289,Relating to health information technology used in the medical assistance and child health plan programs.,41354,Lois Kolkhorst,sponsor,81R,3495,Rep. Lois W. Kolkhorst,Lois Kolkhorst
368,368,368,SB 346,Relating to information submitted to and maintained in the immunization registry after an individual becomes an adult.,41354,Lois Kolkhorst,sponsor,81R,3495,Rep. Lois W. Kolkhorst,Lois Kolkhorst
369,369,369,SB 347,Relating to the receipt and release of immunization information by the immunization registry in connection with a disaster; providing penalties.,41354,Lois Kolkhorst,sponsor,81R,3495,Rep. Lois W. Kolkhorst,Lois Kolkhorst
370,370,370,SB 527,Relating to certain mammography systems that fail certification standards.,41354,Lois Kolkhorst,sponsor,81R,3495,Rep. Lois W. Kolkhorst,Lois Kolkhorst
371,371,371,SB 646,Relating to a study regarding the confidentiality of prescription information; providing a civil penalty.,41354,Lois Kolkhorst,sponsor,81R,3495,Rep. Lois W. Kolkhorst,Lois Kolkhorst
372,372,372,SB 704,Relating to the regulation of pharmacy benefit managers and mail order pharmacies.,41354,Lois Kolkhorst,sponsor,81R,3495,Rep. Lois W. Kolkhorst,Lois Kolkhorst
373,373,373,SB 1005,Relating to the regulation of polygraph examiners by the Texas Department of Licensing and Regulation and the abolition of the Polygraph Examiners Board.,41354,Lois Kolkhorst,sponsor,81R,3495,Rep. Lois W. Kolkhorst,Lois Kolkhorst
374,374,374,SB 1163,"Relating to the penalties for theft of cattle, horses, exotic livestock, exotic fowl, sheep, swine, or goats.",41354,Lois Kolkhorst,sponsor,81R,3495,Rep. Lois W. Kolkhorst,Lois Kolkhorst
375,375,375,SB 1329,"Relating to food manufacturers, food wholesalers, and warehouse operators required to hold a license.",41354,Lois Kolkhorst,sponsor,81R,3495,Rep. Lois W. Kolkhorst,Lois Kolkhorst
376,376,376,SB 2397,"Relating to the licensing and regulation of physicians, physician assistants, acupuncturists, and surgical assistants.",41354,Lois Kolkhorst,sponsor,81R,3495,Rep. Lois W. Kolkhorst,Lois Kolkhorst
377,377,377,SB 1016,"Relating to the continuation and functions of the Department of Agriculture and the Prescribed Burning Board, the creation of the Texas Bioenergy Policy Council and Texas Bioenergy Research Committee, and the abolition of the Texas-Israel Exchange Fund Board; providing penalties.",41354,Lois Kolkhorst,sponsor,81R,3495,Rep. Lois W. Kolkhorst,Lois Kolkhorst
378,378,378,HB 275,Relating to the margin of error to be used by the comptroller of public accounts in connection with the annual property value study to determine whether the local value for a school district is valid.,41354,Lois Kolkhorst,author,80R,3495,Rep. Lois W. Kolkhorst,Lois Kolkhorst
379,379,379,HB 384,Relating to the use of direct recording electronic voting machines.,41354,Lois Kolkhorst,author,80R,3495,Rep. Lois W. Kolkhorst,Lois Kolkhorst
380,380,380,HB 730,Relating to the notice of a municipality's or county's intention to issue certificates of obligation.,41354,Lois Kolkhorst,author,80R,3495,Rep. Lois W. Kolkhorst,Lois Kolkhorst
381,381,381,HB 731,Relating to the use of certain voting equipment in an election that does not involve a federal office.,41354,Lois Kolkhorst,author,80R,3495,Rep. Lois W. Kolkhorst,Lois Kolkhorst
382,382,382,HB 1074,Relating to the creation of an offense for a parent's contribution to a child's failure to comply with a sentence or court order relating to a disruptive activity or disruption of class on school property.,41354,Lois Kolkhorst,author,80R,3495,Rep. Lois W. Kolkhorst,Lois Kolkhorst
383,383,383,HB 1196,Relating to restrictions on the use of certain public subsidies.,41354,Lois Kolkhorst,author,80R,3495,Rep. Lois W. Kolkhorst,Lois Kolkhorst
384,384,384,HB 1418,Relating to the name of Sam Houston State University.,41354,Lois Kolkhorst,author,80R,3495,Rep. Lois W. Kolkhorst,Lois Kolkhorst
385,385,385,HB 1419,Relating to a prohibition against changing the name of a public institution of higher education that is named after a state historical figure.,41354,Lois Kolkhorst,author,80R,3495,Rep. Lois W. Kolkhorst,Lois Kolkhorst
386,386,386,HB 1521,Relating to the prohibition of signs on certain roads.,41354,Lois Kolkhorst,author,80R,3495,Rep. Lois W. Kolkhorst,Lois Kolkhorst
387,387,387,HB 1880,Relating to restrictions on investments by certain public retirement systems of this state.,41354,Lois Kolkhorst,author,80R,3495,Rep. Lois W. Kolkhorst,Lois Kolkhorst
388,388,388,HB 1881,Relating to repeal of authority for the establishment and operation of the Trans-Texas Corridor.,41354,Lois Kolkhorst,author,80R,3495,Rep. Lois W. Kolkhorst,Lois Kolkhorst
389,389,389,HB 1922,Relating to eligibility of school districts for state assistance with payment of existing debt.,41354,Lois Kolkhorst,author,80R,3495,Rep. Lois W. Kolkhorst,Lois Kolkhorst
390,390,390,HB 1923,Relating to coordination between school districts and other governmental agencies regarding necessary transportation infrastructure improvements associated with real property owned or proposed to be purchased by school districts.,41354,Lois Kolkhorst,author,80R,3495,Rep. Lois W. Kolkhorst,Lois Kolkhorst
391,391,391,HB 1924,Relating to career and technology programs and certain articulation agreements in public schools.,41354,Lois Kolkhorst,author,80R,3495,Rep. Lois W. Kolkhorst,Lois Kolkhorst
392,392,392,HB 1925,Relating to the transmission of information regarding public school students through the use of radio frequency identification technology.,41354,Lois Kolkhorst,author,80R,3495,Rep. Lois W. Kolkhorst,Lois Kolkhorst
393,393,393,HB 2024,Relating to the continuation and functions of the Texas Veterinary Medical Diagnostic Laboratory.,41354,Lois Kolkhorst,author,80R,3495,Rep. Lois W. Kolkhorst,Lois Kolkhorst
394,394,394,HB 2102,Relating to the abolishment of the Office of State-Federal Relations as an independent agency and the transfer of the duties and functions of that agency to the office of the governor.,41354,Lois Kolkhorst,author,80R,3495,Rep. Lois W. Kolkhorst,Lois Kolkhorst
395,395,395,HB 2103,Relating to a pilot program to provide student loan repayment assistance to certain correctional officers who graduate from Sam Houston State University.,41354,Lois Kolkhorst,author,80R,3495,Rep. Lois W. Kolkhorst,Lois Kolkhorst
396,396,396,HB 2119,Relating to the issuance of certain search warrants by certain municipal courts.,41354,Lois Kolkhorst,author,80R,3495,Rep. Lois W. Kolkhorst,Lois Kolkhorst
397,397,397,HB 2121,Relating to the amount of hazardous duty pay for certain state employees.,41354,Lois Kolkhorst,author,80R,3495,Rep. Lois W. Kolkhorst,Lois Kolkhorst
398,398,398,HB 2200,Relating to the submission of annual reports by farm mutual insurance companies.,41354,Lois Kolkhorst,author,80R,3495,Rep. Lois W. Kolkhorst,Lois Kolkhorst
399,399,399,HB 2201,Relating to the creation of a judicial district composed of Grimes and Waller Counties and to the composition of the 9th Judicial District.,41354,Lois Kolkhorst,author,80R,3495,Rep. Lois W. Kolkhorst,Lois Kolkhorst
400,400,400,HB 2203,Relating to payments by the Texas Department of Transportation to an unsuccessful private entity that submits a proposal for a comprehensive development agreement.,41354,Lois Kolkhorst,author,80R,3495,Rep. Lois W. Kolkhorst,Lois Kolkhorst
401,401,401,HB 2337,Relating to including Texas history on state-mandated assessment instruments administered to public school students.,41354,Lois Kolkhorst,author,80R,3495,Rep. Lois W. Kolkhorst,Lois Kolkhorst
402,402,402,HB 2542,Relating to the continuation and functions of the Office of Rural Community Affairs.,41354,Lois Kolkhorst,author,80R,3495,Rep. Lois W. Kolkhorst,Lois Kolkhorst
403,403,403,HB 2543,Relating to the continuation and operation of the Texas Animal Health  Commission; providing penalties.,41354,Lois Kolkhorst,author,80R,3495,Rep. Lois W. Kolkhorst,Lois Kolkhorst
404,404,404,HB 2554,Relating to the organization and employees of the Department of Aging and Disability Services.,41354,Lois Kolkhorst,author,80R,3495,Rep. Lois W. Kolkhorst,Lois Kolkhorst
405,405,405,HB 2555,"Relating to licensing, regulation, and reporting regarding certain facilities providing personal care to persons with disabilities; providing penalties.",41354,Lois Kolkhorst,author,80R,3495,Rep. Lois W. Kolkhorst,Lois Kolkhorst
406,406,406,HB 2772,Relating to a moratorium on the inclusion of certain provisions in a comprehensive development agreement or the sale of a toll project and to the creation and duties of a study committee.,41354,Lois Kolkhorst,author,80R,3495,Rep. Lois W. Kolkhorst,Lois Kolkhorst
407,407,407,HB 3482,Relating to a museum and visitor's center at San Felipe State Historic Site in the Stephen F. Austin State Park.,41354,Lois Kolkhorst,author,80R,3495,Rep. Lois W. Kolkhorst,Lois Kolkhorst
408,408,408,HB 3484,Relating to the programs and functions of The Texas A&M University System and Sam Houston State University.,41354,Lois Kolkhorst,author,80R,3495,Rep. Lois W. Kolkhorst,Lois Kolkhorst
409,409,409,HB 3486,Relating to the authority of the asset management division of the General Land Office to sell real property to an economic development corporation.,41354,Lois Kolkhorst,author,80R,3495,Rep. Lois W. Kolkhorst,Lois Kolkhorst
410,410,410,HB 3488,Relating to a study of the effect on this state's economy of replacing all state and school district ad valorem tax revenue with revenue from a transaction tax.,41354,Lois Kolkhorst,author,80R,3495,Rep. Lois W. Kolkhorst,Lois Kolkhorst
411,411,411,HB 3646,Relating to the length of certain contracts between a state agency and a private entity.,41354,Lois Kolkhorst,author,80R,3495,Rep. Lois W. Kolkhorst,Lois Kolkhorst
412,412,412,HB 3647,Relating to a study by the attorney general of the effects on state law and authority of certain international and other agreements and bodies.,41354,Lois Kolkhorst,author,80R,3495,Rep. Lois W. Kolkhorst,Lois Kolkhorst
413,413,413,HB 3727,Relating to authorizing the issuance of tuition revenue bonds for Sam Houston State University for facilities in Montgomery County.,41354,Lois Kolkhorst,author,80R,3495,Rep. Lois W. Kolkhorst,Lois Kolkhorst
414,414,414,HB 3728,Relating to state education fiscal matters.,41354,Lois Kolkhorst,author,80R,3495,Rep. Lois W. Kolkhorst,Lois Kolkhorst
415,415,415,HB 3729,Relating to the requirements for home-taught driver education courses.,41354,Lois Kolkhorst,author,80R,3495,Rep. Lois W. Kolkhorst,Lois Kolkhorst
416,416,416,HB 3936,Relating to the application of the franchise tax to banking corporations.,41354,Lois Kolkhorst,author,80R,3495,Rep. Lois W. Kolkhorst,Lois Kolkhorst
417,417,417,HCR 6,"Designating Industry, Texas, as the Oldest German Settlement in the Lone Star State.",41354,Lois Kolkhorst,author,80R,3495,Rep. Lois W. Kolkhorst,Lois Kolkhorst
418,418,418,HCR 201,Designating San Felipe as the Colonial Capital of Texas.,41354,Lois Kolkhorst,author,80R,3495,Rep. Lois W. Kolkhorst,Lois Kolkhorst
419,419,419,HCR 202,Designating Washington County as the official Birthplace of Texas.,41354,Lois Kolkhorst,author,80R,3495,Rep. Lois W. Kolkhorst,Lois Kolkhorst
420,420,420,HR 10,Commemorating the 100th anniversary of the founding of Blue Bell Creameries of Brenham.,41354,Lois Kolkhorst,author,80R,3495,Rep. Lois W. Kolkhorst,Lois Kolkhorst
421,421,421,HR 217,"Recognizing February 28, 2007, as Washington County Day at the State Capitol.",41354,Lois Kolkhorst,author,80R,3495,Rep. Lois W. Kolkhorst,Lois Kolkhorst
422,422,422,HR 218,"Recognizing February 21, 2007, as Sheriffs' Association of Texas Day at the State Capitol.",41354,Lois Kolkhorst,author,80R,3495,Rep. Lois W. Kolkhorst,Lois Kolkhorst
423,423,423,HR 439,"Recognizing March 15, 2007, as Austin County Day at the State Capitol.",41354,Lois Kolkhorst,author,80R,3495,Rep. Lois W. Kolkhorst,Lois Kolkhorst
424,424,424,HR 587,Honoring Mayor Philip Brooks Harrison of Bellville for his exemplary public service.,41354,Lois Kolkhorst,author,80R,3495,Rep. Lois W. Kolkhorst,Lois Kolkhorst
425,425,425,HR 1374,"Recognizing April 5, 2007, as Grimes County Day at the State Capitol.",41354,Lois Kolkhorst,author,80R,3495,Rep. Lois W. Kolkhorst,Lois Kolkhorst
426,426,426,HR 1632,Congratulating Ward Tomlinson of Brenham on winning Best of Fair at the 2007 Texas State Science and Engineering Fair.,41354,Lois Kolkhorst,author,80R,3495,Rep. Lois W. Kolkhorst,Lois Kolkhorst
427,427,427,HR 1899,Congratulating the Blinn College football team on winning the 2006 National Junior College Athletic Association championship.,41354,Lois Kolkhorst,author,80R,3495,Rep. Lois W. Kolkhorst,Lois Kolkhorst
428,428,428,HR 2140,Congratulating the town of Richards on its centennial.,41354,Lois Kolkhorst,author,80R,3495,Rep. Lois W. Kolkhorst,Lois Kolkhorst
429,429,429,HR 2226,In memory of U.S. Army Private First Class Larry I. Guyton.,41354,Lois Kolkhorst,author,80R,3495,Rep. Lois W. Kolkhorst,Lois Kolkhorst
430,430,430,HR 2478,In memory of U.S. Army Staff Sergeant Christopher L. Everett of Huntsville.,41354,Lois Kolkhorst,author,80R,3495,Rep. Lois W. Kolkhorst,Lois Kolkhorst
431,431,431,HR 2527,In memory of Thomas Michael Buzbee of New Waverly.,41354,Lois Kolkhorst,author,80R,3495,Rep. Lois W. Kolkhorst,Lois Kolkhorst
432,432,432,HR 2956,In memory of William Prentice Mearns of Brenham.,41354,Lois Kolkhorst,author,80R,3495,Rep. Lois W. Kolkhorst,Lois Kolkhorst
433,433,433,HR 2957,Congratulating Teri E. Flack on her retirement after a career in public service.,41354,Lois Kolkhorst,author,80R,3495,Rep. Lois W. Kolkhorst,Lois Kolkhorst
434,434,434,HR 2958,Congratulating the winners of the Search for Solutions competition held during the 22nd annual John Ben Shepperd Texas Leadership Forum.,41354,Lois Kolkhorst,author,80R,3495,Rep. Lois W. Kolkhorst,Lois Kolkhorst
435,435,435,HB 383,Relating to providing for a student who qualifies for automatic admission to an institution of higher education to maintain that status for transferring between institutions in certain circumstances.,41354,Lois Kolkhorst,author,80R,3495,Rep. Lois W. Kolkhorst,Lois Kolkhorst
436,436,436,HB 461,Relating to participation in an animal identification system.,41354,Lois Kolkhorst,author,80R,3495,Rep. Lois W. Kolkhorst,Lois Kolkhorst
437,437,437,HB 637,Relating to making participation in an animal identification program voluntary.,41354,Lois Kolkhorst,author,80R,3495,Rep. Lois W. Kolkhorst,Lois Kolkhorst
438,438,438,HB 690,Relating to the use of certain voting equipment in certain elections that do not involve a federal office.,41354,Lois Kolkhorst,author,80R,3495,Rep. Lois W. Kolkhorst,Lois Kolkhorst
439,439,439,HB 696,Relating to the limitation on the maximum average annual percentage increase in the appraised value of residence homesteads for ad valorem tax purposes.,41354,Lois Kolkhorst,author,80R,3495,Rep. Lois W. Kolkhorst,Lois Kolkhorst
440,440,440,HB 1105,"Relating to the state contribution to the Teacher Retirement System of Texas, including a one-time supplemental annuity payment.",41354,Lois Kolkhorst,author,80R,3495,Rep. Lois W. Kolkhorst,Lois Kolkhorst
441,441,441,HB 1168,Relating to licensing and regulation by a state agency.,41354,Lois Kolkhorst,author,80R,3495,Rep. Lois W. Kolkhorst,Lois Kolkhorst
442,442,442,HB 1982,Relating to the creation of the Public Education Management Institute of Texas.,41354,Lois Kolkhorst,author,80R,3495,Rep. Lois W. Kolkhorst,Lois Kolkhorst
443,443,443,HB 2053,"Relating to the continuation and functions of the Texas Board of Criminal Justice, the Texas Department of Criminal Justice, and the Correctional Managed Health Care Committee and to the functions of the Board of Pardons and Paroles.",41354,Lois Kolkhorst,author,80R,3495,Rep. Lois W. Kolkhorst,Lois Kolkhorst
444,444,444,HB 2173,Relating to the continuation and functions of the Prepaid Higher Education Tuition Board.,41354,Lois Kolkhorst,author,80R,3495,Rep. Lois W. Kolkhorst,Lois Kolkhorst
445,445,445,HB 2425,Relating to the continuation and functions of the Texas Alcoholic Beverage Commission; providing penalties.,41354,Lois Kolkhorst,author,80R,3495,Rep. Lois W. Kolkhorst,Lois Kolkhorst
446,446,446,HB 2426,Relating to the regulation of the practice of nursing and the renaming of the Board of Nurse Examiners as the Texas Board of Nursing.,41354,Lois Kolkhorst,author,80R,3495,Rep. Lois W. Kolkhorst,Lois Kolkhorst
447,447,447,HB 2427,Relating to the continuation and functions of the Teacher Retirement System of Texas; providing penalties.,41354,Lois Kolkhorst,author,80R,3495,Rep. Lois W. Kolkhorst,Lois Kolkhorst
448,448,448,HB 2458,Relating to the licensing and regulation of structural pest control by the Department of Agriculture and the abolition of the Texas Structural Pest Control Board.,41354,Lois Kolkhorst,author,80R,3495,Rep. Lois W. Kolkhorst,Lois Kolkhorst
449,449,449,HB 2460,Relating to the continuation and functions of the Texas Commission on the Arts.,41354,Lois Kolkhorst,author,80R,3495,Rep. Lois W. Kolkhorst,Lois Kolkhorst
450,450,450,HB 2461,Relating to the continuation and functions of the Texas Historical Commission.,41354,Lois Kolkhorst,author,80R,3495,Rep. Lois W. Kolkhorst,Lois Kolkhorst
451,451,451,HB 2497,Relating to compensatory time accrued by a correctional officer employed by the Texas Department of Criminal Justice.,41354,Lois Kolkhorst,author,80R,3495,Rep. Lois W. Kolkhorst,Lois Kolkhorst
452,452,452,HB 2498,Relating to hazardous duty pay for correctional officers employed by the Texas Department of Criminal Justice.,41354,Lois Kolkhorst,author,80R,3495,Rep. Lois W. Kolkhorst,Lois Kolkhorst
453,453,453,HB 2499,Relating to a salary career ladder for correctional officers.,41354,Lois Kolkhorst,author,80R,3495,Rep. Lois W. Kolkhorst,Lois Kolkhorst
454,454,454,HB 2515,Relating to the continuation and functions of the State Office of Risk Management.,41354,Lois Kolkhorst,author,80R,3495,Rep. Lois W. Kolkhorst,Lois Kolkhorst
455,455,455,HB 2560,Relating to the availability of certain school district financial information on districts' Internet websites.,41354,Lois Kolkhorst,author,80R,3495,Rep. Lois W. Kolkhorst,Lois Kolkhorst
456,456,456,HB 2845,Relating to the continuation and functions of the Texas State Library and Archives Commission.,41354,Lois Kolkhorst,author,80R,3495,Rep. Lois W. Kolkhorst,Lois Kolkhorst
457,457,457,HB 3140,Relating to the review and functions of the Veterans' Land Board.,41354,Lois Kolkhorst,author,80R,3495,Rep. Lois W. Kolkhorst,Lois Kolkhorst
458,458,458,HB 3249,"Relating to the powers and duties of, and the entities reviewed by, the Sunset Advisory Commission.",41354,Lois Kolkhorst,author,80R,3495,Rep. Lois W. Kolkhorst,Lois Kolkhorst
459,459,459,HB 3250,"Relating to the continuation and functions of the Texas Real Estate Commission and the regulation of real estate brokers, salespersons, inspectors, appraisers, residential service companies, and timeshares; providing administrative penalties.",41354,Lois Kolkhorst,author,80R,3495,Rep. Lois W. Kolkhorst,Lois Kolkhorst
460,460,460,HB 3426,Relating to the continuation and functions of the Texas Veterans Commission.,41354,Lois Kolkhorst,author,80R,3495,Rep. Lois W. Kolkhorst,Lois Kolkhorst
461,461,461,HB 3485,Relating to career and technical education provided by school districts and certain postsecondary institutions.,41354,Lois Kolkhorst,author,80R,3495,Rep. Lois W. Kolkhorst,Lois Kolkhorst
462,462,462,HB 3490,Relating to the authority of a chief appraiser to appeal from an order of an appraisal review board determining a taxpayer protest.,41354,Lois Kolkhorst,author,80R,3495,Rep. Lois W. Kolkhorst,Lois Kolkhorst
463,463,463,HB 3491,Relating to the qualifications and selection of the board of directors of an appraisal district.,41354,Lois Kolkhorst,author,80R,3495,Rep. Lois W. Kolkhorst,Lois Kolkhorst
464,464,464,HB 3492,Relating to the determination of the total taxable value of property in a school district under the property value study conducted by the comptroller of public accounts.,41354,Lois Kolkhorst,author,80R,3495,Rep. Lois W. Kolkhorst,Lois Kolkhorst
465,465,465,HB 3493,Relating to the regulation of property tax professionals and appraisal review boards.,41354,Lois Kolkhorst,author,80R,3495,Rep. Lois W. Kolkhorst,Lois Kolkhorst
466,466,466,HB 3494,"Relating to the appeal through binding arbitration of a protest of an appraisal review board order, and to related complaints filed by a property owner and disciplinary action by the Board of Tax Professional Examiners; providing penalties.",41354,Lois Kolkhorst,author,80R,3495,Rep. Lois W. Kolkhorst,Lois Kolkhorst
467,467,467,HB 3495,Relating to the contents of the notice of the meeting at which the governing body of a taxing unit will vote on a proposed ad valorem tax rate that will result in a tax revenue increase.,41354,Lois Kolkhorst,author,80R,3495,Rep. Lois W. Kolkhorst,Lois Kolkhorst
468,468,468,HB 3496,Relating to the delivery or filing of certain ad valorem tax notices.,41354,Lois Kolkhorst,author,80R,3495,Rep. Lois W. Kolkhorst,Lois Kolkhorst
469,469,469,HJR 47,"Proposing a constitutional amendment authorizing the legislature to establish for purposes of ad valorem taxation by a school district a limit on the annual increase in the appraised value of residence homesteads of five percent or more, and to permit other political subdivisions to adopt a five percent limit on those appraisal increases.",41354,Lois Kolkhorst,author,80R,3495,Rep. Lois W. Kolkhorst,Lois Kolkhorst
470,470,470,HJR 48,Proposing a constitutional amendment authorizing the legislature to provide for an exemption from ad valorem taxation of a portion of the assessed value of a residence homestead based on the average assessed value of all qualified residence homesteads that are located in the same county as the homestead.,41354,Lois Kolkhorst,author,80R,3495,Rep. Lois W. Kolkhorst,Lois Kolkhorst
471,471,471,HB 6,Relating to the allocation and use of the sporting goods sales tax revenue to fund state and local parks.,41354,Lois Kolkhorst,coauthor,80R,3495,Rep. Lois W. Kolkhorst,Lois Kolkhorst
472,472,472,HB 9,Relating to the elimination of smoking in certain workplaces and public places; providing penalties.,41354,Lois Kolkhorst,coauthor,80R,3495,Rep. Lois W. Kolkhorst,Lois Kolkhorst
473,473,473,HB 12,"Relating to parks, wildlife, hunting, and historic sites; the funding, powers, and duties of the Parks and Wildlife Department, the Parks and Wildlife Commission, and the Texas Historical Commission; and standards for certain state law enforcement officers; providing a criminal penalty.",41354,Lois Kolkhorst,coauthor,80R,3495,Rep. Lois W. Kolkhorst,Lois Kolkhorst
474,474,474,HB 284,Relating to the use of force or deadly force in defense of a person.,41354,Lois Kolkhorst,coauthor,80R,3495,Rep. Lois W. Kolkhorst,Lois Kolkhorst
475,475,475,HB 285,Relating to a consumer debt owed by certain military personnel called to active duty.,41354,Lois Kolkhorst,coauthor,80R,3495,Rep. Lois W. Kolkhorst,Lois Kolkhorst
476,476,476,HB 1022,Relating to the exemption from ad valorem taxation of a motor vehicle owned by an individual and used in the course of the owner's occupation or profession and also for personal activities of the owner and to the rendition of such vehicles.,41354,Lois Kolkhorst,coauthor,80R,3495,Rep. Lois W. Kolkhorst,Lois Kolkhorst
477,477,477,HB 1034,Relating to the pledge of allegiance to the state flag.,41354,Lois Kolkhorst,coauthor,80R,3495,Rep. Lois W. Kolkhorst,Lois Kolkhorst
478,478,478,HB 1098,Relating to immunization against human papillomavirus.,41354,Lois Kolkhorst,coauthor,80R,3495,Rep. Lois W. Kolkhorst,Lois Kolkhorst
479,479,479,HB 1287,Relating to public school elective courses providing academic study of the Bible.,41354,Lois Kolkhorst,coauthor,80R,3495,Rep. Lois W. Kolkhorst,Lois Kolkhorst
480,480,480,HB 1398,Relating to the reporting of health care-associated infections at certain health care facilities and the creation of an advisory panel.,41354,Lois Kolkhorst,coauthor,80R,3495,Rep. Lois W. Kolkhorst,Lois Kolkhorst
481,481,481,HB 2006,Relating to the use of eminent domain authority.,41354,Lois Kolkhorst,coauthor,80R,3495,Rep. Lois W. Kolkhorst,Lois Kolkhorst
482,482,482,HB 2061,"Relating to the acquisition or disclosure of the social security number of a living person by a governmental body, including by a district or county clerk.",41354,Lois Kolkhorst,coauthor,80R,3495,Rep. Lois W. Kolkhorst,Lois Kolkhorst
483,483,483,HB 2277,Relating to delivery of certain unclaimed money to a rural scholarship fund.,41354,Lois Kolkhorst,coauthor,80R,3495,Rep. Lois W. Kolkhorst,Lois Kolkhorst
484,484,484,HB 2785,Relating to school district property tax rate reductions.,41354,Lois Kolkhorst,coauthor,80R,3495,Rep. Lois W. Kolkhorst,Lois Kolkhorst
