Unnamed: 0,Unnamed: 0.1,Unnamed: 0.1.1,bill_name,caption,filer_id,filer_name,function,session,leg_id,original_name,parsed_name
734,734,734,SB 224,Relating to the authority of county judges to issue certain search warrants.,62344,Allen Fletcher,sponsor,75R,2830,Rep. Allen Fletcher,Allen Fletcher
735,735,735,SCR 32,"Extending the term of the Red River Boundary Commission to June 30, 2000.",62344,Allen Fletcher,sponsor,75R,2830,Rep. Allen Fletcher,Allen Fletcher
736,736,736,SB 1814,Relating to modifications of the official cotton growers' boll weevil eradication program.,62344,Allen Fletcher,sponsor,75R,2830,Rep. Allen Fletcher,Allen Fletcher
737,737,737,SB 97,"Relating to the prosecution, punishment, and sentencing of a defendant charged with the offense of stalking.",62344,Allen Fletcher,cosponsor,75R,2830,Rep. Allen Fletcher,Allen Fletcher
738,738,738,HB 499,Relating to the rental of a motor vehicle to a state employee; providing a penalty.,62344,Allen Fletcher,author,74R,2830,Rep. Allen Fletcher,Allen Fletcher
739,739,739,HB 707,Relating to the creation of a distance learning clearinghouse in the Department of Information Resources.,62344,Allen Fletcher,author,74R,2830,Rep. Allen Fletcher,Allen Fletcher
740,740,740,HB 708,Relating to the creation of a distance learning clearinghouse in the Central Education Agency.,62344,Allen Fletcher,author,74R,2830,Rep. Allen Fletcher,Allen Fletcher
741,741,741,HB 1024,Relating to the election of the members of the board of directors of the Jack County Hospital District.,62344,Allen Fletcher,author,74R,2830,Rep. Allen Fletcher,Allen Fletcher
742,742,742,HB 1124,Relating to the investigation of certain railroad crossing violations reported by a railway employee.,62344,Allen Fletcher,author,74R,2830,Rep. Allen Fletcher,Allen Fletcher
743,743,743,HB 1294,Relating to the duties of a clerk of a justice court.,62344,Allen Fletcher,author,74R,2830,Rep. Allen Fletcher,Allen Fletcher
744,744,744,HB 2531,Relating to the tuition charged at certian public institutions of higher education to a student who resides in a bordering state.,62344,Allen Fletcher,author,74R,2830,Rep. Allen Fletcher,Allen Fletcher
745,745,745,HB 3002,Relating to the use of frequent flyer bonuses awarded to certain state officers and employees.,62344,Allen Fletcher,author,74R,2830,Rep. Allen Fletcher,Allen Fletcher
746,746,746,HB 3003,Relating to the control and eradication of cotton pests by the Department of Agriculture.,62344,Allen Fletcher,author,74R,2830,Rep. Allen Fletcher,Allen Fletcher
747,747,747,HCR 21,"Paying tribute to the life of John Bowden Connally, Jr.",62344,Allen Fletcher,author,74R,2830,Rep. Allen Fletcher,Allen Fletcher
748,748,748,HCR 22,"Granting the Texas YMCA youth and government program permission to use the house and senate chambers on February 23, 24, and 25, 1995.",62344,Allen Fletcher,author,74R,2830,Rep. Allen Fletcher,Allen Fletcher
749,749,749,HCR 45,In memory of John C. White.,62344,Allen Fletcher,author,74R,2830,Rep. Allen Fletcher,Allen Fletcher
750,750,750,HCR 110,"Granting J. E. Isbell, Inc., permission to sue the State of Texas and the Parks and Wildlife Department.",62344,Allen Fletcher,author,74R,2830,Rep. Allen Fletcher,Allen Fletcher
751,751,751,HCR 127,Memorializing the Congress of the United States to permit states to establish a 65 mph speed limit on certain highways.,62344,Allen Fletcher,author,74R,2830,Rep. Allen Fletcher,Allen Fletcher
752,752,752,HCR 128,Re-creating the Red River Boundary Commission.,62344,Allen Fletcher,author,74R,2830,Rep. Allen Fletcher,Allen Fletcher
753,753,753,HR 17,Congratulating the Vernon Regional Junior College men's rodeo team on attaining the 1994 National Intercollegiate Rodeo Association championship.,62344,Allen Fletcher,author,74R,2830,Rep. Allen Fletcher,Allen Fletcher
754,754,754,HR 18,Honoring the Possum King Relays.,62344,Allen Fletcher,author,74R,2830,Rep. Allen Fletcher,Allen Fletcher
755,755,755,HR 19,Honoring St. Peter Lutheran Church on its 100 years of service as a house of worship.,62344,Allen Fletcher,author,74R,2830,Rep. Allen Fletcher,Allen Fletcher
756,756,756,HR 20,Paying tribute to the life of former Montague County Sheriff W. F. Conway.,62344,Allen Fletcher,author,74R,2830,Rep. Allen Fletcher,Allen Fletcher
757,757,757,HR 21,Congratulating coach Jim Wood and the Quanah High School boys' golf squad on attaining the UIL Class 2A golf championship.,62344,Allen Fletcher,author,74R,2830,Rep. Allen Fletcher,Allen Fletcher
758,758,758,HR 22,Congratulating the 1993-1994 Holliday Eagle Band on winning the Class 2A state championship in marching band competition.,62344,Allen Fletcher,author,74R,2830,Rep. Allen Fletcher,Allen Fletcher
759,759,759,HR 23,Honoring the members of the Iwo Jima Survivors Association of Texas on their 50th anniversary reunion.,62344,Allen Fletcher,author,74R,2830,Rep. Allen Fletcher,Allen Fletcher
760,760,760,HR 24,Congratulating coach Lonnie Gaylor and the Graham High School Lady Blues golf squad on their 1994 UIL Class 3A state championship.,62344,Allen Fletcher,author,74R,2830,Rep. Allen Fletcher,Allen Fletcher
761,761,761,HR 25,Paying tribute to the life of the Honorable Maurice Benton Ball.,62344,Allen Fletcher,author,74R,2830,Rep. Allen Fletcher,Allen Fletcher
762,762,762,HR 26,Paying tribute to the life of Jack Crain.,62344,Allen Fletcher,author,74R,2830,Rep. Allen Fletcher,Allen Fletcher
763,763,763,HR 39,Congratulating Don C. King on the occasion of his retirement.,62344,Allen Fletcher,author,74R,2830,Rep. Allen Fletcher,Allen Fletcher
764,764,764,HR 110,Commemorating the 100th anniversary of Valley View Baptist Church.,62344,Allen Fletcher,author,74R,2830,Rep. Allen Fletcher,Allen Fletcher
765,765,765,HR 111,Congratulating the Windthorst High School girls' volleyball team on winning the 1994 Class A state championship.,62344,Allen Fletcher,author,74R,2830,Rep. Allen Fletcher,Allen Fletcher
766,766,766,HR 166,Urging the Texas congressional delegation to support efforts to authorize states to establish a 65 mph speed limit on certain highways.,62344,Allen Fletcher,author,74R,2830,Rep. Allen Fletcher,Allen Fletcher
767,767,767,HR 239,Congratulating Doris Richeson on becoming the first woman leader of the Cactus Sqaudron of the Confederate Air Force.,62344,Allen Fletcher,author,74R,2830,Rep. Allen Fletcher,Allen Fletcher
768,768,768,HR 441,"Recognizing March 20 and 21, 1995, as Graham-Young County Community Day at the Capitol.",62344,Allen Fletcher,author,74R,2830,Rep. Allen Fletcher,Allen Fletcher
769,769,769,HR 561,Honoring the Bowie High School Lady Rabbits basketball team.,62344,Allen Fletcher,author,74R,2830,Rep. Allen Fletcher,Allen Fletcher
770,770,770,HR 963,"Declaring the week of May 14-20, 1995, as Santa Rosa Roundup Week in Texas.",62344,Allen Fletcher,author,74R,2830,Rep. Allen Fletcher,Allen Fletcher
771,771,771,HR 989,Honoring the Jacksboro High School FFA Range and Pasture team.,62344,Allen Fletcher,author,74R,2830,Rep. Allen Fletcher,Allen Fletcher
772,772,772,HR 1044,Commending Vernon State Hospital.,62344,Allen Fletcher,author,74R,2830,Rep. Allen Fletcher,Allen Fletcher
773,773,773,HR 1045,Honoring the Midway Independent School District math teams.,62344,Allen Fletcher,author,74R,2830,Rep. Allen Fletcher,Allen Fletcher
774,774,774,HB 43,Relating to civil liability for stalking.,62344,Allen Fletcher,author,74R,2830,Rep. Allen Fletcher,Allen Fletcher
775,775,775,HB 85,Relating to the development of distance learning and related activities by institutions of higher education.,62344,Allen Fletcher,author,74R,2830,Rep. Allen Fletcher,Allen Fletcher
776,776,776,HB 145,Relating to the punishment of theft committed against elderly individuals.,62344,Allen Fletcher,author,74R,2830,Rep. Allen Fletcher,Allen Fletcher
777,777,777,HB 280,Relating to limiting the liability of certain persons for equine activities.,62344,Allen Fletcher,author,74R,2830,Rep. Allen Fletcher,Allen Fletcher
778,778,778,HB 1930,Relating to the offense of theft of public library property.,62344,Allen Fletcher,author,74R,2830,Rep. Allen Fletcher,Allen Fletcher
779,779,779,HB 2068,Relating to tuition paid by air force personnel for certain courses at Midwestern State University.,62344,Allen Fletcher,author,74R,2830,Rep. Allen Fletcher,Allen Fletcher
780,780,780,HB 2,Relating to restrictions on contributions to legislative caucuses during regular sessions of the legislature and to reporting requirements concerning caucus contributions and expenditures; providing penalties.,62344,Allen Fletcher,coauthor,74R,2830,Rep. Allen Fletcher,Allen Fletcher
781,781,781,HB 11,Relating to a crime victim's right to appear in person before members of the Board of Pardons and Paroles.,62344,Allen Fletcher,coauthor,74R,2830,Rep. Allen Fletcher,Allen Fletcher
782,782,782,HB 40,Relating to the requirement of DNA analysis of certain inmates and to the creation of a DNA database; providing penalties.,62344,Allen Fletcher,coauthor,74R,2830,Rep. Allen Fletcher,Allen Fletcher
783,783,783,HB 69,Relating to a period of quiet reflection in public schools.,62344,Allen Fletcher,coauthor,74R,2830,Rep. Allen Fletcher,Allen Fletcher
784,784,784,HB 327,"Relating to the juvenile justice system, including the adjudication and disposition of children; providing for civil and criminal penalties.",62344,Allen Fletcher,coauthor,74R,2830,Rep. Allen Fletcher,Allen Fletcher
785,785,785,HB 332,Relating to the inclusion of tax abatements in the determination of the taxable property value of a school district.,62344,Allen Fletcher,coauthor,74R,2830,Rep. Allen Fletcher,Allen Fletcher
786,786,786,HB 439,"Relating to drug-free and weapon-free zones and to the imposition of penalties for the possession, delivery, manufacture, or possession with the intent to deliver or manufacture a controlled substance in drug-free zones or on school buses and penalties for certain offenses involving weapons committed in weapon-free zones.",62344,Allen Fletcher,coauthor,74R,2830,Rep. Allen Fletcher,Allen Fletcher
787,787,787,HB 496,Relating to the issuance of special license plates for certain vehicles owned by certain foreign organizations.,62344,Allen Fletcher,coauthor,74R,2830,Rep. Allen Fletcher,Allen Fletcher
788,788,788,HB 507,Relating to delay of the vehicle emissions inspection and maintenance program.,62344,Allen Fletcher,coauthor,74R,2830,Rep. Allen Fletcher,Allen Fletcher
789,789,789,HB 508,Relating to delay of the vehicle emissions inspection and maintenance program.,62344,Allen Fletcher,coauthor,74R,2830,Rep. Allen Fletcher,Allen Fletcher
790,790,790,HB 648,Relating to the personal needs allowance for certain Medicaid recipients who are residents of long-term care facilities.,62344,Allen Fletcher,coauthor,74R,2830,Rep. Allen Fletcher,Allen Fletcher
791,791,791,HB 722,Relating to liability for false disparagement of perishable food products.,62344,Allen Fletcher,coauthor,74R,2830,Rep. Allen Fletcher,Allen Fletcher
792,792,792,HB 835,Relating to violation of speed limits required by federal law.,62344,Allen Fletcher,coauthor,74R,2830,Rep. Allen Fletcher,Allen Fletcher
793,793,793,HB 930,Relating to benefits payable by the Teacher Retirement System of Texas.,62344,Allen Fletcher,coauthor,74R,2830,Rep. Allen Fletcher,Allen Fletcher
794,794,794,HB 1214,Relating to the establishment of a prepaid higher education tuition program.,62344,Allen Fletcher,coauthor,74R,2830,Rep. Allen Fletcher,Allen Fletcher
795,795,795,HB 1379,"Relating to the registration, release, and supervision of sexual offenders.",62344,Allen Fletcher,coauthor,74R,2830,Rep. Allen Fletcher,Allen Fletcher
796,796,796,HB 1957,"Relating to the punishment for the offense of theft of cattle, horses, sheep, swine, goats, exotic livestock, or exotic fowl.",62344,Allen Fletcher,coauthor,74R,2830,Rep. Allen Fletcher,Allen Fletcher
797,797,797,HB 2067,Relating to the issuance of bonds by Midwestern State University.,62344,Allen Fletcher,coauthor,74R,2830,Rep. Allen Fletcher,Allen Fletcher
798,798,798,HB 2133,Relating to the authority of certain Parks and Wildlife Department employees to enter on private property and to the use of information obtained.,62344,Allen Fletcher,coauthor,74R,2830,Rep. Allen Fletcher,Allen Fletcher
799,799,799,HB 2603,Relating to the liability of certain volunteer fire departments.,62344,Allen Fletcher,coauthor,74R,2830,Rep. Allen Fletcher,Allen Fletcher
800,800,800,HCR 37,Rejecting the suggestion by the U.S. Fish and Wildlife Service that it has failed to manage its natural resources in the Ogallala Aquifer in an environmentally conscious manner.,62344,Allen Fletcher,coauthor,74R,2830,Rep. Allen Fletcher,Allen Fletcher
801,801,801,HCR 65,Urging the  Congress of the United States to amend the federal Endangered Species Act.,62344,Allen Fletcher,coauthor,74R,2830,Rep. Allen Fletcher,Allen Fletcher
802,802,802,HCR 158,Directing the State Preservation Board to restore the Capitol chapel.,62344,Allen Fletcher,coauthor,74R,2830,Rep. Allen Fletcher,Allen Fletcher
803,803,803,HCR 230,Commending the members of the Texas Task Force for Tiltrotor Technology.,62344,Allen Fletcher,coauthor,74R,2830,Rep. Allen Fletcher,Allen Fletcher
804,804,804,HJR 1,Proposing a constitutional amendment to limit the time that a person may serve as a member of the Texas Legislature or the United States Congress or as an elected state officer.,62344,Allen Fletcher,coauthor,74R,2830,Rep. Allen Fletcher,Allen Fletcher
805,805,805,HJR 12,Proposing a constitutional amendment to reserve to the people the powers of initiative and referendum.,62344,Allen Fletcher,coauthor,74R,2830,Rep. Allen Fletcher,Allen Fletcher
806,806,806,HJR 66,Proposing a constitutional amendment to reserve to the people the powers of initiative and referendum.,62344,Allen Fletcher,coauthor,74R,2830,Rep. Allen Fletcher,Allen Fletcher
807,807,807,SB 561,Relating to the election of the members of the board of directors of the Jack County Hospital District.,62344,Allen Fletcher,sponsor,74R,2830,Rep. Allen Fletcher,Allen Fletcher
808,808,808,SCR 30,Granting the Texas YMCA youth and government program permission to use the house and senate chambers.,62344,Allen Fletcher,sponsor,74R,2830,Rep. Allen Fletcher,Allen Fletcher
809,809,809,SCR 122,Commending Peggy Sue Garner for her exceptional service to the State of Texas.,62344,Allen Fletcher,sponsor,74R,2830,Rep. Allen Fletcher,Allen Fletcher
810,810,810,HB 605,Relating to the forfeiture of proceeds from the commission of certain offenses and to the compensation of crime victims.,62344,Allen Fletcher,author,73R,2830,Rep. Allen Fletcher,Allen Fletcher
811,811,811,HB 658,Relating to the prevention of horse theft.,62344,Allen Fletcher,author,73R,2830,Rep. Allen Fletcher,Allen Fletcher
812,812,812,HB 1029,Relating to the creation of the Texas interactive multimedia communications fund; regulating interactive multimedia communications services and equipment.,62344,Allen Fletcher,author,73R,2830,Rep. Allen Fletcher,Allen Fletcher
813,813,813,HB 1053,Relating to the use of frequent flyer bonuses awarded to certain state officers and employees.,62344,Allen Fletcher,author,73R,2830,Rep. Allen Fletcher,Allen Fletcher
814,814,814,HB 1224,Relating to the creation of a county court at law in Wilbarger County.,62344,Allen Fletcher,author,73R,2830,Rep. Allen Fletcher,Allen Fletcher
815,815,815,HB 1310,Relating to certain special stops required of motor vehicles at railroad crossings.,62344,Allen Fletcher,author,73R,2830,Rep. Allen Fletcher,Allen Fletcher
816,816,816,HB 1656,Relating to enhanced pavement marking visibility at certain railroad grade crossings.,62344,Allen Fletcher,author,73R,2830,Rep. Allen Fletcher,Allen Fletcher
817,817,817,HB 1657,Relating to the dismantling of a warning signal at a railroad crossing; providing a criminal penalty.,62344,Allen Fletcher,author,73R,2830,Rep. Allen Fletcher,Allen Fletcher
818,818,818,HB 1658,Relating to state agency advisory committees.,62344,Allen Fletcher,author,73R,2830,Rep. Allen Fletcher,Allen Fletcher
819,819,819,HCM 122,Congratulating Ringgold Baptist Church on its 100th anniversary.,62344,Allen Fletcher,author,73R,2830,Rep. Allen Fletcher,Allen Fletcher
820,820,820,HCM 135,Congratulating Vernon High School Tennis Team for an outstanding year.,62344,Allen Fletcher,author,73R,2830,Rep. Allen Fletcher,Allen Fletcher
821,821,821,HCM 941,"Recognizing The First Annual ""Iris Village Festival"", dedicated to historic preservation.",62344,Allen Fletcher,author,73R,2830,Rep. Allen Fletcher,Allen Fletcher
822,822,822,HCM 942,Recognizing the Olney One-Arm Dove Hunt Association.,62344,Allen Fletcher,author,73R,2830,Rep. Allen Fletcher,Allen Fletcher
823,823,823,HCM 946,"Recognizing The First Annual ""Iris Village Festival"", dedicated to historical preservation.",62344,Allen Fletcher,author,73R,2830,Rep. Allen Fletcher,Allen Fletcher
824,824,824,HCM 947,Recognizing the Olney One-Arm Dove Hunt Association.,62344,Allen Fletcher,author,73R,2830,Rep. Allen Fletcher,Allen Fletcher
825,825,825,HCR 33,"Granting the Texas YMCA Youth and Government Program permission to use the house and senate chambers on February 25, 26, and 27, 1993, and February 17, 18, and 19, 1994.",62344,Allen Fletcher,author,73R,2830,Rep. Allen Fletcher,Allen Fletcher
826,826,826,HCR 71,"Granting J.E. Isbell, Inc., permission to sue the State of Texas and the Parks and Wildlife Department.",62344,Allen Fletcher,author,73R,2830,Rep. Allen Fletcher,Allen Fletcher
827,827,827,HMM 1,"Paying tribute to the life of Linda Louise Craft of Jacksboro, Texas.",62344,Allen Fletcher,author,73R,2830,Rep. Allen Fletcher,Allen Fletcher
828,828,828,HMM 17,Paying tribute to the life of Sergeant Richard Allen Beck of the Vernon Police Department.,62344,Allen Fletcher,author,73R,2830,Rep. Allen Fletcher,Allen Fletcher
829,829,829,HMM 20,Paying tribute to the life of Lennie Frances Mosley Shelton.,62344,Allen Fletcher,author,73R,2830,Rep. Allen Fletcher,Allen Fletcher
830,830,830,HR 162,Honoring Clay County Sheriff Jake Bogard on the occasion of his retirement.,62344,Allen Fletcher,author,73R,2830,Rep. Allen Fletcher,Allen Fletcher
831,831,831,HR 163,"Paying tribute to the life of Zack Thomason Burkett, Jr.",62344,Allen Fletcher,author,73R,2830,Rep. Allen Fletcher,Allen Fletcher
832,832,832,HR 164,Congratulating the First Baptist Church of Paducah on the 100th anniversary of its founding.,62344,Allen Fletcher,author,73R,2830,Rep. Allen Fletcher,Allen Fletcher
833,833,833,HR 317,"Recognizing March 2, 1993, as Graham-Young County Day at the State Capitol.",62344,Allen Fletcher,author,73R,2830,Rep. Allen Fletcher,Allen Fletcher
834,834,834,HR 777,"Recognizing the downtown square of Graham, Texas, as The Largest and Greatest Downtown Square in the United States.",62344,Allen Fletcher,author,73R,2830,Rep. Allen Fletcher,Allen Fletcher
835,835,835,HR 778,"Recognizing Graham, Texas, as the Daffodil Capital of Texas.",62344,Allen Fletcher,author,73R,2830,Rep. Allen Fletcher,Allen Fletcher
836,836,836,HR 793,Supporting the people of Graham in declaring the city's downtown square as the Largest and Greatest Downtown Square in the United States.,62344,Allen Fletcher,author,73R,2830,Rep. Allen Fletcher,Allen Fletcher
837,837,837,HR 794,Recognizing the efforts of the people of Graham to establish their city as the Daffodil Capital of Texas.,62344,Allen Fletcher,author,73R,2830,Rep. Allen Fletcher,Allen Fletcher
838,838,838,HB 183,"Relating to developing and promoting educational technology through pilot, model, or demonstration projects.",62344,Allen Fletcher,author,73R,2830,Rep. Allen Fletcher,Allen Fletcher
839,839,839,HCR 69,"Designating the week of March 28 to April 3, 1993, as Distance Learning Week in Texas.",62344,Allen Fletcher,author,73R,2830,Rep. Allen Fletcher,Allen Fletcher
840,840,840,HR 613,Honoring the memory of former Representative Foster Whaley.,62344,Allen Fletcher,author,73R,2830,Rep. Allen Fletcher,Allen Fletcher
841,841,841,HB 51,Relating to the creation of a stalking offense.,62344,Allen Fletcher,coauthor,73R,2830,Rep. Allen Fletcher,Allen Fletcher
842,842,842,HB 63,Relating to the regulation of mammography devices and the practice of mammography.,62344,Allen Fletcher,coauthor,73R,2830,Rep. Allen Fletcher,Allen Fletcher
843,843,843,HB 123,Relating to the adoption of the Texas Free Flow of Information Act concerning disclosure of information by a newsperson in response to a subpoena.,62344,Allen Fletcher,coauthor,73R,2830,Rep. Allen Fletcher,Allen Fletcher
844,844,844,HB 175,Relating to the rate of taxes and fees imposed on bingo games.,62344,Allen Fletcher,coauthor,73R,2830,Rep. Allen Fletcher,Allen Fletcher
845,845,845,HB 187,Relating to violation of speed limits required by federal law.,62344,Allen Fletcher,coauthor,73R,2830,Rep. Allen Fletcher,Allen Fletcher
846,846,846,HB 353,Relating to providing for methods and procedures for the eradication of boll weevils in cotton; providing penalties.,62344,Allen Fletcher,coauthor,73R,2830,Rep. Allen Fletcher,Allen Fletcher
847,847,847,HB 631,Relating to the number and location of district offices of the Texas Department of Transportation.,62344,Allen Fletcher,coauthor,73R,2830,Rep. Allen Fletcher,Allen Fletcher
848,848,848,HB 924,Relating to the abolition of the Adolescent Pregnancy and Parenthood Advisory Council.,62344,Allen Fletcher,coauthor,73R,2830,Rep. Allen Fletcher,Allen Fletcher
849,849,849,HB 1287,Relating to the establishment and funding of a young farmer loan guarantee program.,62344,Allen Fletcher,coauthor,73R,2830,Rep. Allen Fletcher,Allen Fletcher
850,850,850,HB 1741,"Relating to providing the choice of ""none of the above"" on the election ballot for the general election for state and county officers.",62344,Allen Fletcher,coauthor,73R,2830,Rep. Allen Fletcher,Allen Fletcher
851,851,851,HB 2274,"Relating to the efficient operation of the state criminal justice system, including the preservation of the Penal Code, creation of criminal offenses, and punishment of offenses.",62344,Allen Fletcher,coauthor,73R,2830,Rep. Allen Fletcher,Allen Fletcher
852,852,852,HCR 52,Requesting the United States Congress to revise the federal Endangered Species Act.,62344,Allen Fletcher,coauthor,73R,2830,Rep. Allen Fletcher,Allen Fletcher
853,853,853,HCR 130,"Urging the president and United States Congress to thoroughly investigate the national farm credit system, and to consider enactment or implementation of a moratorium on farm foreclosure actions.",62344,Allen Fletcher,coauthor,73R,2830,Rep. Allen Fletcher,Allen Fletcher
854,854,854,HJR 29,Proposing a constitutional amendment to reserve to the people the powers of initiative and referendum.,62344,Allen Fletcher,coauthor,73R,2830,Rep. Allen Fletcher,Allen Fletcher
855,855,855,HJR 36,Proposing a constitutional amendment to limit the tax rate on the income component of the franchise tax.,62344,Allen Fletcher,coauthor,73R,2830,Rep. Allen Fletcher,Allen Fletcher
856,856,856,HR 432,"Congratulating the Honorable James E. ""Pete"" Laney on the momentous occasion of his 50th birthday.",62344,Allen Fletcher,coauthor,73R,2830,Rep. Allen Fletcher,Allen Fletcher
857,857,857,SB 588,Relating to the designation of responsibility for the transporting of juvenile offenders.,62344,Allen Fletcher,sponsor,73R,2830,Rep. Allen Fletcher,Allen Fletcher
858,858,858,SB 1143,Relating to the prevention of horse theft.,62344,Allen Fletcher,sponsor,73R,2830,Rep. Allen Fletcher,Allen Fletcher
859,859,859,SCR 2,"Granting the Texas YMCA Youth and Government Program permission to use the House Chamber of the State Capitol on February 25, 26, and 27 in 1993 and February 17, 18, and 19 in 1994.",62344,Allen Fletcher,sponsor,73R,2830,Rep. Allen Fletcher,Allen Fletcher
860,860,860,HR 147,Paying tribute to the life of Leigh McGee.,62344,Allen Fletcher,author,724,2830,Rep. Allen Fletcher,Allen Fletcher
861,861,861,HR 148,Congratulating the members of the First United Methodist Church of Holliday on the occasion of their church's centennial.,62344,Allen Fletcher,author,724,2830,Rep. Allen Fletcher,Allen Fletcher
862,862,862,HR 150,Congratulating St. Mary's Catholic Church on the 100th anniversary of its founding.,62344,Allen Fletcher,author,724,2830,Rep. Allen Fletcher,Allen Fletcher
863,863,863,HR 151,Honoring St. Mary's Catholic Church in Jacksboro on the memorable occasion of its 100th anniversary.,62344,Allen Fletcher,author,724,2830,Rep. Allen Fletcher,Allen Fletcher
864,864,864,HR 174,Congratulating the First United Methodist Church of Electra on the 100th anniversary of its founding.,62344,Allen Fletcher,author,724,2830,Rep. Allen Fletcher,Allen Fletcher
865,865,865,HR 175,Congratulating the Chillicothe Church of Christ on the occasion of its 100th anniversary.,62344,Allen Fletcher,author,724,2830,Rep. Allen Fletcher,Allen Fletcher
866,866,866,HR 176,Congratulating the Windthorst High School Trojanettes and their coaches on winning the UIL Class A state volleyball championship.,62344,Allen Fletcher,author,724,2830,Rep. Allen Fletcher,Allen Fletcher
867,867,867,HR 112,Commending the Honorable Gibson D. (Gib) Lewis on his long and distinguished tenure as speaker of the Texas House of Representatives and extending sincere appreciation to him for his many years of outstanding service on behalf of the legislature and the citizens of Texas.,62344,Allen Fletcher,coauthor,724,2830,Rep. Allen Fletcher,Allen Fletcher
868,868,868,HB 10,Relating to the forfeiture of proceeds from the commission of certain offenses and to the compensation of crime victims.,62344,Allen Fletcher,author,723,2830,Rep. Allen Fletcher,Allen Fletcher
869,869,869,HCR 2,Honoring the memory of Frank N. Ikard.,62344,Allen Fletcher,author,723,2830,Rep. Allen Fletcher,Allen Fletcher
870,870,870,HR 25,Commending Bill Klepper.,62344,Allen Fletcher,author,723,2830,Rep. Allen Fletcher,Allen Fletcher
