Unnamed: 0,Unnamed: 0.1,Unnamed: 0.1.1,bill_name,caption,filer_id,filer_name,function,session,leg_id,original_name,parsed_name
123,123,123,HB 912,Relating to images captured by unmanned aircraft and other images and recordings; providing penalties.,67615,Justin Rodriguez,coauthor,83R,2550,Rep. Justin Rodriguez,Justin Rodriguez
124,124,124,HB 1000,Relating to the creation of a new university in South Texas within The University of Texas System.,67615,Justin Rodriguez,coauthor,83R,2550,Rep. Justin Rodriguez,Justin Rodriguez
125,125,125,HB 1351,"Relating to the authority of the Texas Higher Education Coordinating Board regarding the initiation, consolidation, or elimination of a degree or certificate program offered by a public institution of higher education.",67615,Justin Rodriguez,coauthor,83R,2550,Rep. Justin Rodriguez,Justin Rodriguez
126,126,126,HB 1374,Relating to equal opportunity for access by home-schooled students to University Interscholastic League sponsored activities; authorizing a fee.,67615,Justin Rodriguez,coauthor,83R,2550,Rep. Justin Rodriguez,Justin Rodriguez
127,127,127,HB 1383,Relating to the state contribution for the Teacher Retirement System of Texas.,67615,Justin Rodriguez,coauthor,83R,2550,Rep. Justin Rodriguez,Justin Rodriguez
128,128,128,HB 1516,Relating to solid waste services for rental property and solid waste management programs in the extraterritorial jurisdiction of municipalities in certain counties; authorizing penalties.,67615,Justin Rodriguez,coauthor,83R,2550,Rep. Justin Rodriguez,Justin Rodriguez
129,129,129,HB 1536,Relating to a Medicaid provider's right to an administrative hearing on an action taken by the office of inspector general for the Health and Human Services Commission to recover overpayments under the Medicaid program.,67615,Justin Rodriguez,coauthor,83R,2550,Rep. Justin Rodriguez,Justin Rodriguez
130,130,130,HB 1608,Relating to warrants or orders issued to obtain location information from wireless communications devices and to public access to law enforcement or prosecutor requests for certain related location or communication information.,67615,Justin Rodriguez,coauthor,83R,2550,Rep. Justin Rodriguez,Justin Rodriguez
131,131,131,HB 1611,Relating to the date by which certain entering students at public and private or independent institutions of higher education must receive a vaccination against bacterial meningitis.,67615,Justin Rodriguez,coauthor,83R,2550,Rep. Justin Rodriguez,Justin Rodriguez
132,132,132,HB 1763,"Relating to the sale of malt liquor, ale, and beer by the holder of a brewpub license.",67615,Justin Rodriguez,coauthor,83R,2550,Rep. Justin Rodriguez,Justin Rodriguez
133,133,133,HB 1764,Relating to the distribution of ale by certain brewers.,67615,Justin Rodriguez,coauthor,83R,2550,Rep. Justin Rodriguez,Justin Rodriguez
134,134,134,HB 1765,Relating to the distribution of beer by certain manufacturers.,67615,Justin Rodriguez,coauthor,83R,2550,Rep. Justin Rodriguez,Justin Rodriguez
135,135,135,HB 1766,Relating to the authority of certain brewers and manufacturers to sell beer and ale to ultimate consumers.,67615,Justin Rodriguez,coauthor,83R,2550,Rep. Justin Rodriguez,Justin Rodriguez
136,136,136,HB 2662,Relating to a personal financial literacy credit for high school programs.,67615,Justin Rodriguez,coauthor,83R,2550,Rep. Justin Rodriguez,Justin Rodriguez
137,137,137,HB 3206,"Relating to the creation of a Texas resident driver's permit, provisional Texas resident driver's permit, and Texas resident driver's instruction permit; authorizing fees; creating an offense.",67615,Justin Rodriguez,coauthor,83R,2550,Rep. Justin Rodriguez,Justin Rodriguez
138,138,138,HB 3276,Relating to the coverage by certain health benefit plans for the screening and treatment of autism spectrum disorder.,67615,Justin Rodriguez,coauthor,83R,2550,Rep. Justin Rodriguez,Justin Rodriguez
139,139,139,HB 3495,Relating to educator financial incentives and salary contingencies based on student performance on certain assessment instruments.,67615,Justin Rodriguez,coauthor,83R,2550,Rep. Justin Rodriguez,Justin Rodriguez
140,140,140,HB 3677,Relating to the issuance of Foundation School Program license plates.,67615,Justin Rodriguez,coauthor,83R,2550,Rep. Justin Rodriguez,Justin Rodriguez
141,141,141,HCR 113,Authorizing the State Preservation Board to approve and permit the construction of a monument on the Capitol grounds recognizing Vietnamese Americans for their contributions to this state and nation.,67615,Justin Rodriguez,coauthor,83R,2550,Rep. Justin Rodriguez,Justin Rodriguez
142,142,142,HJR 74,Proposing a constitutional amendment prohibiting the taxation of the sale or use of certain food and medicine.,67615,Justin Rodriguez,coauthor,83R,2550,Rep. Justin Rodriguez,Justin Rodriguez
143,143,143,HR 237,"Recognizing January 31, 2013, as Texas Muslim Capitol Day.",67615,Justin Rodriguez,coauthor,83R,2550,Rep. Justin Rodriguez,Justin Rodriguez
144,144,144,HR 1400,"Recognizing April 17, 2013, as Vietnamese American Day at the State Capitol.",67615,Justin Rodriguez,coauthor,83R,2550,Rep. Justin Rodriguez,Justin Rodriguez
145,145,145,SB 475,Relating to the expiration of the municipal sales and use tax for street maintenance in certain municipalities.,67615,Justin Rodriguez,sponsor,83R,2550,Rep. Justin Rodriguez,Justin Rodriguez
146,146,146,SB 1799,Relating to the period of time allowed for issuance of decisions by the commissioner of education in certain appeals against school districts.,67615,Justin Rodriguez,sponsor,83R,2550,Rep. Justin Rodriguez,Justin Rodriguez
