Unnamed: 0,Unnamed: 0.1,Unnamed: 0.1.1,bill_name,caption,filer_id,filer_name,function,session,leg_id,original_name,parsed_name
278,278,278,SR 54,Congratulating Keith Love on achieving the rank of Eagle Scout.,20189,Don Henderson,author,721,1210,Sen. Don Henderson,Don Henderson
279,279,279,SR 275,Congratulating Richard Odum on attaining the rank of Eagle Scout.,20189,Don Henderson,author,721,1210,Sen. Don Henderson,Don Henderson
280,280,280,SR 276,Commending and applauding Bryan Lee Garrison in recognition of achieving the rank of Eagle Scout.,20189,Don Henderson,author,721,1210,Sen. Don Henderson,Don Henderson
281,281,281,SR 277,Honoring the 441st Transportation Company Army Reserve Unit for its exemplary service to their country.,20189,Don Henderson,author,721,1210,Sen. Don Henderson,Don Henderson
282,282,282,SR 256,Commending Paul William Hobby.,20189,Don Henderson,author,721,1210,Sen. Don Henderson,Don Henderson
283,283,283,SB 5,Relating to requiring an election before the adoption or implementation of a rail plan by certain metropolitan rapid transit authorities.,20189,Don Henderson,author,72R,1210,Sen. Don Henderson,Don Henderson
284,284,284,SB 252,"Relating to the issuance of a permit for a hazardous waste processing, storage, or disposal facility.",20189,Don Henderson,author,72R,1210,Sen. Don Henderson,Don Henderson
285,285,285,SB 543,"Relating to the continuation, functions, and operations of the Texas National Research Laboratory Commission, including the advancement of superconductivity research through engineering and science recruiting and to the bonding authority of the commission, of finance corporations established by the commission, and of other state agencies.",20189,Don Henderson,author,72R,1210,Sen. Don Henderson,Don Henderson
286,286,286,SB 544,Relating to the continuation and operation of the Texas Board of Irrigators; providing penalties.,20189,Don Henderson,author,72R,1210,Sen. Don Henderson,Don Henderson
287,287,287,SB 545,Relating to the continuation and operation of the Texas Board of Professional Land Surveying; providing penalties.,20189,Don Henderson,author,72R,1210,Sen. Don Henderson,Don Henderson
288,288,288,SB 638,"Relating to restrictions on the issuance of a permit for a salt dome hazardous waste storage, processing, or disposal facility.",20189,Don Henderson,author,72R,1210,Sen. Don Henderson,Don Henderson
289,289,289,SB 708,Relating to the imposition of the motor vehicle sales tax on a motor vehicle sold using seller financing.,20189,Don Henderson,author,72R,1210,Sen. Don Henderson,Don Henderson
290,290,290,SB 772,"Relating to the appraisal and assessment of property for property taxes and to property that is omitted from a property tax appraisal roll, valuation notification, appraisal district and appraisal review board hearings; to property tax liens, interest, and exemptions; and regarding tax appeal attorney's fees.",20189,Don Henderson,author,72R,1210,Sen. Don Henderson,Don Henderson
291,291,291,SB 773,Relating to the regulation of certain persons who represent or advise others in property tax matters; providing a criminal penalty.,20189,Don Henderson,author,72R,1210,Sen. Don Henderson,Don Henderson
292,292,292,SB 844,Relating to certain assessments imposed on insurance companies to cover costs of state examination.,20189,Don Henderson,author,72R,1210,Sen. Don Henderson,Don Henderson
293,293,293,SB 845,Relating to the power of the commissioners court in a county with a population of 2.39 million or more to set an optional motor vehicle registration fee in an amount not to exceed $10.,20189,Don Henderson,author,72R,1210,Sen. Don Henderson,Don Henderson
294,294,294,SB 921,Relating to the microfilming of local government records by the Texas State Library and Archives Commission.,20189,Don Henderson,author,72R,1210,Sen. Don Henderson,Don Henderson
295,295,295,SB 1055,Relating to county approval of annexations by certain municipalities.,20189,Don Henderson,author,72R,1210,Sen. Don Henderson,Don Henderson
296,296,296,SB 1141,Relating to credits for reinsurance for domestic ceding insurers.,20189,Don Henderson,author,72R,1210,Sen. Don Henderson,Don Henderson
297,297,297,SB 1158,Relating to contractual limitations periods and notice requirements in certain substantial commercial transactions.,20189,Don Henderson,author,72R,1210,Sen. Don Henderson,Don Henderson
298,298,298,SB 1159,Relating to liability of subscribers and shareholders of Texas business corporations.,20189,Don Henderson,author,72R,1210,Sen. Don Henderson,Don Henderson
299,299,299,SB 1179,Relating to exceptions from certain requirements to purchase or lease vehicles exceeding 39.5 feet in length and capable of using alternative fuels on the grounds of unavailability of such vehicles.,20189,Don Henderson,author,72R,1210,Sen. Don Henderson,Don Henderson
300,300,300,SB 1208,Relating to the sales and use tax on gasoline and diesel fuel.,20189,Don Henderson,author,72R,1210,Sen. Don Henderson,Don Henderson
301,301,301,SB 1236,Relating to brackets establishing ranges of cash advances or balances to which certain rates of charges apply under certain state credit law.,20189,Don Henderson,author,72R,1210,Sen. Don Henderson,Don Henderson
302,302,302,SB 1473,Relating to an exemption from the gas production tax for gas produced as a result of qualified enhanced completion or production techniques.,20189,Don Henderson,author,72R,1210,Sen. Don Henderson,Don Henderson
303,303,303,SB 1474,Relating to a credit for the gas and oil production tax for certain dry hole costs.,20189,Don Henderson,author,72R,1210,Sen. Don Henderson,Don Henderson
304,304,304,SB 1478,Relating to the production allowable for a well in a newly discovered gas field.,20189,Don Henderson,author,72R,1210,Sen. Don Henderson,Don Henderson
305,305,305,SCR 55,"Granting John R. Phenix & Associates, Inc., permission to sue the State of Texas and the University of Houston System.",20189,Don Henderson,author,72R,1210,Sen. Don Henderson,Don Henderson
306,306,306,SR 13,Congratulating Jonathan Stephen Smith for achieving the rank of Eagle Scout.,20189,Don Henderson,author,72R,1210,Sen. Don Henderson,Don Henderson
307,307,307,SR 30,Congratulating Jason Lombardo on achieving the rank of Eagle Scout.,20189,Don Henderson,author,72R,1210,Sen. Don Henderson,Don Henderson
308,308,308,SR 37,Congratulating David Todd Harris for achieving the rank of Eagle Scout.,20189,Don Henderson,author,72R,1210,Sen. Don Henderson,Don Henderson
309,309,309,SR 79,"Congratulating James Waldron Mitchell of Kingswood, Texas, on achieving the rank of Eagle Scout.",20189,Don Henderson,author,72R,1210,Sen. Don Henderson,Don Henderson
310,310,310,SR 80,"Commending Bob Michael of Houston, Texas, for his 13 years of splendid service to the Boy Scouts of America.",20189,Don Henderson,author,72R,1210,Sen. Don Henderson,Don Henderson
311,311,311,SR 147,Congratulating David Bryan Tupper of Houston on achieving the rank of Eagle Scout.,20189,Don Henderson,author,72R,1210,Sen. Don Henderson,Don Henderson
312,312,312,SR 151,"Requesting that the City of Houston, the Houston City Council, and the Department of Aviation not impose an airport access tax for off-site parking lots.",20189,Don Henderson,author,72R,1210,Sen. Don Henderson,Don Henderson
313,313,313,SR 166,Congratulating Todd Eudy of Houston on achieving the rank of Eagle Scout.,20189,Don Henderson,author,72R,1210,Sen. Don Henderson,Don Henderson
314,314,314,SR 168,Congratulating Laurent-Christopher Therivel of Kingwood on achieving the rank of Eagle Scout.,20189,Don Henderson,author,72R,1210,Sen. Don Henderson,Don Henderson
315,315,315,SR 178,Congratulating Ryan Christopher Runkle on achieving the rank of Eagle Scout.,20189,Don Henderson,author,72R,1210,Sen. Don Henderson,Don Henderson
316,316,316,SR 179,Congratulating Bryan Edwards of Houston on achieving the rank of Eagle Scout.,20189,Don Henderson,author,72R,1210,Sen. Don Henderson,Don Henderson
317,317,317,SR 241,Congratulating Michael Cooper from the Spring 4-H Club for being selected to participate in the House Livestock Show and Rodeo Calf Scramble.,20189,Don Henderson,author,72R,1210,Sen. Don Henderson,Don Henderson
318,318,318,SR 367,Congratulating Katie McMahon for her outstanding achievements as a member of the Katy 4-H Club.,20189,Don Henderson,author,72R,1210,Sen. Don Henderson,Don Henderson
319,319,319,SR 459,Congratulating Gordon Hansen of Spring for achieving the rank of Eagle Scout.,20189,Don Henderson,author,72R,1210,Sen. Don Henderson,Don Henderson
320,320,320,SR 460,Congratulating Atman Madhukar Trivedi of Houston for achieving the rank of Eagle Scout.,20189,Don Henderson,author,72R,1210,Sen. Don Henderson,Don Henderson
321,321,321,SR 549,Recognizing Mrs. Geneva Blackburn of Lubbock on her 70th birthday.,20189,Don Henderson,author,72R,1210,Sen. Don Henderson,Don Henderson
322,322,322,SR 572,Congratulating Jim Hook of Houston on achieving the rank of Eagle Scout.,20189,Don Henderson,author,72R,1210,Sen. Don Henderson,Don Henderson
323,323,323,SR 630,"Commending Anita Beneke, M.D., for her involvement in the excellent preceptorship program of the Texas Academy of Family Physicians.",20189,Don Henderson,author,72R,1210,Sen. Don Henderson,Don Henderson
324,324,324,SR 721,Congratulating Jason Van Kirk of Houston on achieving the rank of Eagle Scout.,20189,Don Henderson,author,72R,1210,Sen. Don Henderson,Don Henderson
325,325,325,SR 722,"Congratulating the Klein Oak High School Strutters of Spring on receiving top honors in the Miss Drill Team U.S.A. Pageant held in Torrance, California.",20189,Don Henderson,author,72R,1210,Sen. Don Henderson,Don Henderson
326,326,326,SR 723,Congratulating Thomas Ellerbrock of Kingwood on achieving the rank of Eagle Scout.,20189,Don Henderson,author,72R,1210,Sen. Don Henderson,Don Henderson
327,327,327,SR 724,"Joining with Archbishop Patrick Flores and the entire nation in paying tribute to the Karate Kids of America Program on May 19, 1991.",20189,Don Henderson,author,72R,1210,Sen. Don Henderson,Don Henderson
328,328,328,SR 731,Congratulating Rusty Major of Houston on achieving the rank of Eagle Scout.,20189,Don Henderson,author,72R,1210,Sen. Don Henderson,Don Henderson
329,329,329,SR 732,Congratulating Brian Thorp of Houston on achieving the rank of Eagle Scout.,20189,Don Henderson,author,72R,1210,Sen. Don Henderson,Don Henderson
330,330,330,SR 733,Congratulating Patrik Nilsson of Houston on achieving the rank of Eagle Scout.,20189,Don Henderson,author,72R,1210,Sen. Don Henderson,Don Henderson
331,331,331,SR 734,Congratulating Hoa Le of Houston on achieving the rank of Eagle Scout.,20189,Don Henderson,author,72R,1210,Sen. Don Henderson,Don Henderson
332,332,332,SR 735,Congratulating Peter Jensen of Houston on achieving the rank of Eagle Scout.,20189,Don Henderson,author,72R,1210,Sen. Don Henderson,Don Henderson
333,333,333,SR 825,Recognizing Edward F. Bartsch for his enthusiastic participation in the preceptorship program of the Texas Academy of Family Physicians.,20189,Don Henderson,author,72R,1210,Sen. Don Henderson,Don Henderson
334,334,334,SB 1,"Relating to ethics of public servants, including the composition, powers, and duties of the Texas Ethics Commission; to registration, reporting, and restrictions concerning expenditures made to influence legislation or administrative action; to personal financial statements filed by public officers and employees; to the giving or acceptance of certain benefits; to restrictions and reporting concerning political contributions and expenditures; and providing penalties.",20189,Don Henderson,coauthor,72R,1210,Sen. Don Henderson,Don Henderson
335,335,335,SB 63,Relating to refunding certain tuition and fees and assigning grades to certain students at institutions of higher education.,20189,Don Henderson,coauthor,72R,1210,Sen. Don Henderson,Don Henderson
336,336,336,SB 112,Relating to community centers and to the provision of community mental health and mental retardation services.,20189,Don Henderson,coauthor,72R,1210,Sen. Don Henderson,Don Henderson
337,337,337,SB 755,Relating to changing the name of the University of Houston-University Park to the University of Houston.,20189,Don Henderson,coauthor,72R,1210,Sen. Don Henderson,Don Henderson
338,338,338,SB 756,Relating to the permanent advisory committee at the University of Houston-Clear Lake.,20189,Don Henderson,coauthor,72R,1210,Sen. Don Henderson,Don Henderson
339,339,339,SB 923,"Relating to the liability of a person for demolishing, causing to be demolished, or adversely affecting a historic structure without a permit.",20189,Don Henderson,coauthor,72R,1210,Sen. Don Henderson,Don Henderson
340,340,340,SB 1135,Relating to fees at component institutions of the University of Houston System.,20189,Don Henderson,coauthor,72R,1210,Sen. Don Henderson,Don Henderson
341,341,341,SR 227,In memory of Wenona Christine Jones Glasgow.,20189,Don Henderson,coauthor,72R,1210,Sen. Don Henderson,Don Henderson
342,342,342,SR 763,Urging all Texas communities to support the Governor's Committee to Salute Texas Troops.,20189,Don Henderson,coauthor,72R,1210,Sen. Don Henderson,Don Henderson
343,343,343,HB 111,Relating to requiring a prosecutor to provide the court with a written copy of a plea bargain agreement in a criminal case.,20189,Don Henderson,sponsor,72R,1210,Sen. Don Henderson,Don Henderson
344,344,344,HB 172,Relating to finance charge limitations.,20189,Don Henderson,sponsor,72R,1210,Sen. Don Henderson,Don Henderson
345,345,345,HB 739,Relating to brackets establishing ranges of cash advances or balances to which certain rates of charges apply under certain regulated loans.,20189,Don Henderson,sponsor,72R,1210,Sen. Don Henderson,Don Henderson
346,346,346,HB 998,Relating to the promotion of the use of toll roads.,20189,Don Henderson,sponsor,72R,1210,Sen. Don Henderson,Don Henderson
347,347,347,HB 1436,Relating to the microfilming of local government records by the Texas State Library and Archives Commission.,20189,Don Henderson,sponsor,72R,1210,Sen. Don Henderson,Don Henderson
348,348,348,HB 1779,Relating to the authority of the Inverness Forest Improvement District to levy and collect a maintenance tax and to continue in operation after the district's territory is annexed.,20189,Don Henderson,sponsor,72R,1210,Sen. Don Henderson,Don Henderson
349,349,349,HB 1941,"Relating to the regulation of certain motor vehicle dealers and the sale, titling, and registration of certain motor vehicles.",20189,Don Henderson,sponsor,72R,1210,Sen. Don Henderson,Don Henderson
350,350,350,HB 2283,Relating to county approval of annexations by certain municipalities.,20189,Don Henderson,sponsor,72R,1210,Sen. Don Henderson,Don Henderson
351,351,351,HB 2454,Relating to the regulation of transporting of oil field equipment incidental and directly in connection with the performance of oil field services.,20189,Don Henderson,sponsor,72R,1210,Sen. Don Henderson,Don Henderson
352,352,352,HCR 140,Honoring Representative Barry Connelly.,20189,Don Henderson,sponsor,72R,1210,Sen. Don Henderson,Don Henderson
353,353,353,HCR 206,Commending the Starlettes of Spring High School on their performance in winning the national championship at the American Drill Team School National competition.,20189,Don Henderson,sponsor,72R,1210,Sen. Don Henderson,Don Henderson
354,354,354,HCR 246,"Congratulating R. G. ""Gary"" Dillard on the occasion of his retirement from Shell Oil Company.",20189,Don Henderson,sponsor,72R,1210,Sen. Don Henderson,Don Henderson
355,355,355,SB 22,Relating to requiring an election before the adoption or implementation of a rail plan by certain metropolitan rapid transit authorities.,20189,Don Henderson,author,716,1210,Sen. Don Henderson,Don Henderson
356,356,356,SR 36,In memory of James Quayle Burke.,20189,Don Henderson,author,716,1210,Sen. Don Henderson,Don Henderson
357,357,357,SB 1,Relating to public education.,20189,Don Henderson,coauthor,716,1210,Sen. Don Henderson,Don Henderson
358,358,358,SR 30,"Declaring that Lieutenant Governor William P. Hobby, Jr., has been the guiding hand for and example to the Texas Senate in its legislative achievements during his 18 years in office.",20189,Don Henderson,coauthor,716,1210,Sen. Don Henderson,Don Henderson
359,359,359,HCR 1,Welcoming Foreign Affairs Minister Hans-Dietrich Genscher and Finance Minister Theo Waigel.,20189,Don Henderson,sponsor,716,1210,Sen. Don Henderson,Don Henderson
360,360,360,HCR 2,Welcoming Foreign Affairs Minister Ciriaco DeMita and Finance Minister Giuliano Amato.,20189,Don Henderson,sponsor,716,1210,Sen. Don Henderson,Don Henderson
361,361,361,HCR 3,Welcoming Prime Minister Brian Mulroney of Canada.,20189,Don Henderson,sponsor,716,1210,Sen. Don Henderson,Don Henderson
362,362,362,HCR 4,Welcoming Prime Minister Giulio Andreotti of Italy.,20189,Don Henderson,sponsor,716,1210,Sen. Don Henderson,Don Henderson
363,363,363,HCR 5,Welcoming the Right Honorable Joe Clark and the Right Honorable Michael Wilson.,20189,Don Henderson,sponsor,716,1210,Sen. Don Henderson,Don Henderson
364,364,364,HCR 6,Welcoming Secretary of State James Baker and Secretary of the Treasury Nicholas J. Brady.,20189,Don Henderson,sponsor,716,1210,Sen. Don Henderson,Don Henderson
365,365,365,HCR 7,"Welcoming His Excellency Toshiki Kaifu, Prime Minister of Japan.",20189,Don Henderson,sponsor,716,1210,Sen. Don Henderson,Don Henderson
366,366,366,HCR 8,Welcoming President George Bush.,20189,Don Henderson,sponsor,716,1210,Sen. Don Henderson,Don Henderson
367,367,367,HCR 9,Welcoming the Honorable Frans Andriessen and the Honorable Honning Christophersen.,20189,Don Henderson,sponsor,716,1210,Sen. Don Henderson,Don Henderson
368,368,368,HCR 10,Honoring Kenneth L. Lay and George Strake.,20189,Don Henderson,sponsor,716,1210,Sen. Don Henderson,Don Henderson
369,369,369,HCR 11,Welcoming President Jacques Delors.,20189,Don Henderson,sponsor,716,1210,Sen. Don Henderson,Don Henderson
370,370,370,HCR 12,Welcoming French President Francois Mitterrand.,20189,Don Henderson,sponsor,716,1210,Sen. Don Henderson,Don Henderson
371,371,371,HCR 13,Welcoming Prime Minister Margaret Thatcher.,20189,Don Henderson,sponsor,716,1210,Sen. Don Henderson,Don Henderson
372,372,372,HCR 14,Welcoming the Honorable Taro Nakayama and the Honorable Ryutaro Hashimoto.,20189,Don Henderson,sponsor,716,1210,Sen. Don Henderson,Don Henderson
373,373,373,HCR 15,Welcoming Chancellor Helmut Kohl.,20189,Don Henderson,sponsor,716,1210,Sen. Don Henderson,Don Henderson
374,374,374,HCR 16,Welcoming the Right Honorable Sir Douglas Hurd and the Right Honorable John Major.,20189,Don Henderson,sponsor,716,1210,Sen. Don Henderson,Don Henderson
375,375,375,HCR 17,Welcoming the Honorable Roland Dumas and the Honorable Pierre Beregrovoy.,20189,Don Henderson,sponsor,716,1210,Sen. Don Henderson,Don Henderson
376,376,376,SB 21,Relating to requiring an election before the adoption or implementation of a rail plan by certain metropolitan rapid transit authorities.,20189,Don Henderson,author,715,1210,Sen. Don Henderson,Don Henderson
377,377,377,SB 28,Relating to the Texas Department of Commerce.,20189,Don Henderson,author,715,1210,Sen. Don Henderson,Don Henderson
378,378,378,SB 29,Relating to the designation of enterprise zones.,20189,Don Henderson,author,715,1210,Sen. Don Henderson,Don Henderson
379,379,379,SB 37,Relating to the designation of enterprise zones.,20189,Don Henderson,author,714,1210,Sen. Don Henderson,Don Henderson
380,380,380,SB 45,Relating to certain assessments imposed on insurance companies to cover costs of state examination.,20189,Don Henderson,author,714,1210,Sen. Don Henderson,Don Henderson
381,381,381,SB 75,Relating to the Texas Department of Commerce.,20189,Don Henderson,author,714,1210,Sen. Don Henderson,Don Henderson
382,382,382,SB 92,Relating to requiring an election before the adoption or implementation of a rail plan by certain metropolitan rapid transit authorities.,20189,Don Henderson,author,714,1210,Sen. Don Henderson,Don Henderson
383,383,383,SR 26,Commending the Kid's Way program for its superlative efforts on behalf of the youth of Houston.,20189,Don Henderson,author,714,1210,Sen. Don Henderson,Don Henderson
384,384,384,HCR 4,"Inviting the region of Wielkopolska, Poland, to join Texas in friendship and commerce.",20189,Don Henderson,sponsor,714,1210,Sen. Don Henderson,Don Henderson
385,385,385,SB 27,Relating to certain assessments imposed on insurance companies to cover costs of state examination.,20189,Don Henderson,author,713,1210,Sen. Don Henderson,Don Henderson
386,386,386,SB 32,Relating to the designation of enterprise zones.,20189,Don Henderson,author,713,1210,Sen. Don Henderson,Don Henderson
387,387,387,SR 15,"Congratulating Thomas L. St. John, Jr., of Houston on attaining the rank of Eagle Scout.",20189,Don Henderson,author,713,1210,Sen. Don Henderson,Don Henderson
388,388,388,SR 16,Congratulating Philip Michael Nicosia of Spring on attaining the rank of Eagle Scout.,20189,Don Henderson,author,713,1210,Sen. Don Henderson,Don Henderson
389,389,389,SR 25,Congratulating Brad Holt on attaining the rank of Eagle Scout.,20189,Don Henderson,author,713,1210,Sen. Don Henderson,Don Henderson
390,390,390,SR 26,Congratulating Patrick Williams on attaining the rank of Eagle Scout.,20189,Don Henderson,author,713,1210,Sen. Don Henderson,Don Henderson
391,391,391,SR 45,Congratulating Dr. Harold Guthrie on being named 1989 Superintendent of the Year.,20189,Don Henderson,author,713,1210,Sen. Don Henderson,Don Henderson
392,392,392,SR 71,"In memory of Jack M. Fields, Sr.",20189,Don Henderson,author,713,1210,Sen. Don Henderson,Don Henderson
393,393,393,HCR 2,Congratulating the Spring ISD Vocational Advisory Board.,20189,Don Henderson,sponsor,713,1210,Sen. Don Henderson,Don Henderson
394,394,394,SB 40,Relating to the designation of enterprise zones.,20189,Don Henderson,coauthor,712,1210,Sen. Don Henderson,Don Henderson
395,395,395,SCR 5,In memory of Congressman Mickey Leland.,20189,Don Henderson,coauthor,712,1210,Sen. Don Henderson,Don Henderson
396,396,396,SCR 24,Congratulating Andre Ware on being the 1989 Heisman Trophy winner.,20189,Don Henderson,coauthor,712,1210,Sen. Don Henderson,Don Henderson
397,397,397,SCR 4,"Granting John Phenix and Associates, Inc., permission to sue the State of Texas and the University of Houston System.",20189,Don Henderson,author,711,1210,Sen. Don Henderson,Don Henderson
398,398,398,SCR 5,"Granting Glenn H. Johnson, John Neale and Roberto Pensotti permission to sue the State of Texas and the Parks and Wildlife Department.",20189,Don Henderson,author,711,1210,Sen. Don Henderson,Don Henderson
399,399,399,SR 11,Congratulating John Monroig on achieving the rank of Eagle Scout.,20189,Don Henderson,author,711,1210,Sen. Don Henderson,Don Henderson
400,400,400,SR 12,Congratulating Scott A. Buehler of Houston on achieving the rank of Eagle Scout.,20189,Don Henderson,author,711,1210,Sen. Don Henderson,Don Henderson
401,401,401,SR 16,Congratulating Michael C. Peabody of Houston on achieving the rank of Eagle Scout.,20189,Don Henderson,author,711,1210,Sen. Don Henderson,Don Henderson
402,402,402,SR 70,Congratulating Marcus David Chance of Spring on achieving the rank of Eagle Scout.,20189,Don Henderson,author,711,1210,Sen. Don Henderson,Don Henderson
403,403,403,SR 206,Congratulating J.P. Villont of Katy on achieving the rank of Eagle Scout.,20189,Don Henderson,author,711,1210,Sen. Don Henderson,Don Henderson
404,404,404,SR 207,Congratulating Randal M. Whiddon on attaining the Gold Medal of Achievement from the Royal Rangers.,20189,Don Henderson,author,711,1210,Sen. Don Henderson,Don Henderson
405,405,405,SB 76,Relating to the transfer of funds by certain state teaching hospitals and hospital districts and the use of those funds for the Medicaid disproportionate share program and making an appropriation.,20189,Don Henderson,coauthor,711,1210,Sen. Don Henderson,Don Henderson
406,406,406,HCR 18,Calling on Congress to submit to the states a constitutional amendment protecting the American flag from willful burning or destruction.,20189,Don Henderson,cosponsor,711,1210,Sen. Don Henderson,Don Henderson
407,407,407,SB 86,Relating to a deed of trust on a homestead.,20189,Don Henderson,author,71R,1210,Sen. Don Henderson,Don Henderson
408,408,408,SB 94,Relating to the designation of certain bonds as college savings bonds.,20189,Don Henderson,author,71R,1210,Sen. Don Henderson,Don Henderson
409,409,409,SB 113,Relating to the confirmation election for certain regional water districts.,20189,Don Henderson,author,71R,1210,Sen. Don Henderson,Don Henderson
410,410,410,SB 165,Relating to creation and operation of the Texas exporters loan fund.,20189,Don Henderson,author,71R,1210,Sen. Don Henderson,Don Henderson
411,411,411,SB 189,Relating to the operation and regulation of certain metropolitan rapid transit authorities and passenger conduct thereon; authorizing penalties.,20189,Don Henderson,author,71R,1210,Sen. Don Henderson,Don Henderson
412,412,412,SB 331,Relating to the designation of certain county toll roads as controlled access toll roads.,20189,Don Henderson,author,71R,1210,Sen. Don Henderson,Don Henderson
413,413,413,SB 334,Relating to authorized investments of and the transaction of business by certain domestic insurance companies with defined clearing corporations.,20189,Don Henderson,author,71R,1210,Sen. Don Henderson,Don Henderson
414,414,414,SB 364,"Relating to the authority of the commissioners courts of certain counties to set maximum speed limits on highways, roads, and streets that provide access to county toll roads and similar thoroughfares.",20189,Don Henderson,author,71R,1210,Sen. Don Henderson,Don Henderson
415,415,415,SB 404,Relating to certain exemptions from the open records law.,20189,Don Henderson,author,71R,1210,Sen. Don Henderson,Don Henderson
