Unnamed: 0,Unnamed: 0.1,Unnamed: 0.1.1,bill_name,caption,filer_id,filer_name,function,session,leg_id,original_name,parsed_name
258,258,258,HB 2300,"Relating to awards, incentives, and assistance for certain schools, school districts, and students, to the qualifications of school principals, to the accreditation of public schools, and to educational economic....",20370,Steve Holzheauser,coauthor,71R,3295,Rep. Steve Holzheauser,Steve Holzheauser
259,259,259,HB 2611,Relating to the regulation of certain motor carriers; conferring regulatory authority to the Public Safety Commission and requiring actions by the secretary of state.,20370,Steve Holzheauser,coauthor,71R,3295,Rep. Steve Holzheauser,Steve Holzheauser
260,260,260,HCR 13,Memorializing Congress to increase Medicare compensation to rural hospitals.,20370,Steve Holzheauser,coauthor,71R,3295,Rep. Steve Holzheauser,Steve Holzheauser
261,261,261,HCR 22,Honoring Seaman Dorris Miller and supporting legislation to award him the Congressional Medal of Honor for his heroism in World War II.,20370,Steve Holzheauser,coauthor,71R,3295,Rep. Steve Holzheauser,Steve Holzheauser
262,262,262,HR 534,Restating the legislative intent of the Public Utility Regulatory Act.,20370,Steve Holzheauser,coauthor,71R,3295,Rep. Steve Holzheauser,Steve Holzheauser
263,263,263,HR 596,Honoring Governor William P. Clements on his birthday.,20370,Steve Holzheauser,coauthor,71R,3295,Rep. Steve Holzheauser,Steve Holzheauser
264,264,264,HR 626,Commending the vocational agriculture teachers of Texas.,20370,Steve Holzheauser,coauthor,71R,3295,Rep. Steve Holzheauser,Steve Holzheauser
265,265,265,HR 1084,Expressing appreciation to the Daughters of the Republic of Texas on stewardship of the Alamo.,20370,Steve Holzheauser,coauthor,71R,3295,Rep. Steve Holzheauser,Steve Holzheauser
266,266,266,SB 444,Relating to coding of certain plastic containers to facilitate recycling; providing a civil penalty.,20370,Steve Holzheauser,sponsor,71R,3295,Rep. Steve Holzheauser,Steve Holzheauser
267,267,267,SB 794,Relating to the transfer of certain used or secondhand vehicles.,20370,Steve Holzheauser,sponsor,71R,3295,Rep. Steve Holzheauser,Steve Holzheauser
