Unnamed: 0,Unnamed: 0.1,Unnamed: 0.1.1,bill_name,caption,filer_id,filer_name,function,session,leg_id,original_name,parsed_name
485,485,485,HB 3309,Relating to the ability of certain advocacy and support groups to provide services for children confined in Texas Youth Commission facilities.,41354,Lois Kolkhorst,coauthor,80R,3495,Rep. Lois W. Kolkhorst,Lois Kolkhorst
486,486,486,HB 3430,"Relating to the availability of information about state expenditures and rules, including the creation of a state database containing information on state expenditures, and to certain comptroller reports, and to certain amounts received by institutions of higher education.",41354,Lois Kolkhorst,coauthor,80R,3495,Rep. Lois W. Kolkhorst,Lois Kolkhorst
487,487,487,HB 3900,Relating to the Texas tomorrow fund II prepaid tuition unit undergraduate education program.,41354,Lois Kolkhorst,coauthor,80R,3495,Rep. Lois W. Kolkhorst,Lois Kolkhorst
488,488,488,HCR 67,Urging Congress to provide further drought relief for Texas.,41354,Lois Kolkhorst,coauthor,80R,3495,Rep. Lois W. Kolkhorst,Lois Kolkhorst
489,489,489,HJR 39,Post-ratifying Amendment XXIV to the Constitution of the United States prohibiting the denial or abridgment of the right to vote for failure to pay any poll tax or other tax.,41354,Lois Kolkhorst,coauthor,80R,3495,Rep. Lois W. Kolkhorst,Lois Kolkhorst
490,490,490,HJR 44,Proposing a constitutional amendment requiring any increase in a franchise tax rate to be approved by three-fourths of all the members elected to each house of the legislature.,41354,Lois Kolkhorst,coauthor,80R,3495,Rep. Lois W. Kolkhorst,Lois Kolkhorst
491,491,491,HJR 53,Proposing a constitutional amendment regarding limitations on taxation and expenditures by the state government and local governments.,41354,Lois Kolkhorst,coauthor,80R,3495,Rep. Lois W. Kolkhorst,Lois Kolkhorst
492,492,492,HJR 54,Proposing a constitutional amendment authorizing the legislature to exempt from ad valorem taxation one motor vehicle owned by an individual and used in the course of the owner's occupation or profession and also for personal activities of the owner.,41354,Lois Kolkhorst,coauthor,80R,3495,Rep. Lois W. Kolkhorst,Lois Kolkhorst
493,493,493,HJR 59,Proposing a constitutional amendment to allow the legislature to override a veto of the governor following a legislative session.,41354,Lois Kolkhorst,coauthor,80R,3495,Rep. Lois W. Kolkhorst,Lois Kolkhorst
494,494,494,SB 50,Relating to early childhood education.,41354,Lois Kolkhorst,sponsor,80R,3495,Rep. Lois W. Kolkhorst,Lois Kolkhorst
495,495,495,SB 139,Relating to a study on improving the curricula of professional and vocational nursing education programs.,41354,Lois Kolkhorst,sponsor,80R,3495,Rep. Lois W. Kolkhorst,Lois Kolkhorst
496,496,496,SB 140,Relating to a study of the feasibility of providing immunizations to certain students enrolled in health professional degree programs.,41354,Lois Kolkhorst,sponsor,80R,3495,Rep. Lois W. Kolkhorst,Lois Kolkhorst
497,497,497,SB 737,Relating to the amount of hazardous duty pay for certain state employees.,41354,Lois Kolkhorst,sponsor,80R,3495,Rep. Lois W. Kolkhorst,Lois Kolkhorst
498,498,498,SB 840,Relating to professional development institutes for public school teachers and paraprofessionals regarding education of students with disabilities.,41354,Lois Kolkhorst,sponsor,80R,3495,Rep. Lois W. Kolkhorst,Lois Kolkhorst
499,499,499,SB 849,Relating to the submission of annual reports by farm mutual insurance companies.,41354,Lois Kolkhorst,sponsor,80R,3495,Rep. Lois W. Kolkhorst,Lois Kolkhorst
500,500,500,SB 903,Relating to the continuation and functions of the Office of State-Federal Relations and the administrative attachment of that agency to the office of the governor.,41354,Lois Kolkhorst,sponsor,80R,3495,Rep. Lois W. Kolkhorst,Lois Kolkhorst
501,501,501,SB 1267,Relating to a moratorium on the inclusion of certain provisions in a comprehensive development agreement or the sale of a toll project and to the creation and duties of a study committee.,41354,Lois Kolkhorst,sponsor,80R,3495,Rep. Lois W. Kolkhorst,Lois Kolkhorst
502,502,502,SB 1509,Relating to the authority of the asset management division of the General Land Office to sell real property to an economic development corporation.,41354,Lois Kolkhorst,sponsor,80R,3495,Rep. Lois W. Kolkhorst,Lois Kolkhorst
503,503,503,SB 1700,Relating to state assistance with the costs of constructing or renovating public high school science laboratories.,41354,Lois Kolkhorst,sponsor,80R,3495,Rep. Lois W. Kolkhorst,Lois Kolkhorst
504,504,504,SB 1795,Relating to the amount of bonds and other public securities that may be secured by a pledge of and payable from revenue deposited to the credit of the state highway fund.,41354,Lois Kolkhorst,sponsor,80R,3495,Rep. Lois W. Kolkhorst,Lois Kolkhorst
505,505,505,SB 1969,"Relating to the creation of the Las Damas Management District; providing authority to levy an assessment, impose a tax, and issue bonds.",41354,Lois Kolkhorst,sponsor,80R,3495,Rep. Lois W. Kolkhorst,Lois Kolkhorst
506,506,506,SB 909,"Relating to the continuation and functions of the Texas Board of Criminal Justice, the Texas Department of Criminal Justice, and the Correctional Managed Health Care Committee, and to the functions of the Board of Pardons and Paroles.",41354,Lois Kolkhorst,sponsor,80R,3495,Rep. Lois W. Kolkhorst,Lois Kolkhorst
507,507,507,SB 914,"Relating to the continuation and functions of the Texas Real Estate Commission and the regulation of real estate brokers, salespersons, inspectors, appraisers, residential service companies, and timeshares; providing administrative penalties.",41354,Lois Kolkhorst,sponsor,80R,3495,Rep. Lois W. Kolkhorst,Lois Kolkhorst
508,508,508,SB 1951,"Relating to the creation, operation, and officers of certain courts and juvenile boards.",41354,Lois Kolkhorst,sponsor,80R,3495,Rep. Lois W. Kolkhorst,Lois Kolkhorst
509,509,509,SJR 49,Proposing a constitutional amendment limiting the service of certain officeholders after the expiration of the person's term of office.,41354,Lois Kolkhorst,sponsor,80R,3495,Rep. Lois W. Kolkhorst,Lois Kolkhorst
510,510,510,SB 378,Relating to the use of force or deadly force in defense of a person.,41354,Lois Kolkhorst,cosponsor,80R,3495,Rep. Lois W. Kolkhorst,Lois Kolkhorst
511,511,511,HB 62,Relating to the use of certain voting equipment in an election that does not involve a federal office.,41354,Lois Kolkhorst,author,793,3495,Rep. Lois W. Kolkhorst,Lois Kolkhorst
512,512,512,HR 63,Honoring the Cat Spring Agricultural Society on its 150th anniversary in June 2006.,41354,Lois Kolkhorst,author,793,3495,Rep. Lois W. Kolkhorst,Lois Kolkhorst
513,513,513,HR 730,In memory of Deputy Sheriff Donald Ellis Wass of Bellville.,41354,Lois Kolkhorst,author,793,3495,Rep. Lois W. Kolkhorst,Lois Kolkhorst
514,514,514,HB 2,"Relating to the allocation of certain revenue from franchise taxes, motor vehicle sales and use taxes, and taxes on cigarettes and other tobacco products to school district property tax relief and public education.",41354,Lois Kolkhorst,author,793,3495,Rep. Lois W. Kolkhorst,Lois Kolkhorst
515,515,515,HB 15,Relating to the limitation on the maximum average annual percentage increase in the appraised value of residence homesteads for ad valorem tax purposes.,41354,Lois Kolkhorst,author,793,3495,Rep. Lois W. Kolkhorst,Lois Kolkhorst
516,516,516,HB 47,Relating to prohibiting mandatory participation in an animal identification system.,41354,Lois Kolkhorst,author,793,3495,Rep. Lois W. Kolkhorst,Lois Kolkhorst
517,517,517,HB 152,Relating to authorizing the governing body of a school district to establish for purposes of ad valorem taxation by the district a limitation on increases in the appraised value of real property in the district that is less than 10 percent but not less than five percent.,41354,Lois Kolkhorst,coauthor,793,3495,Rep. Lois W. Kolkhorst,Lois Kolkhorst
518,518,518,HJR 15,Proposing a constitutional amendment requiring the state to pay at least 50 percent of the cost of maintaining and operating the public school system and prohibiting the comptroller from certifying legislation containing an appropriation unless the requirement is met.,41354,Lois Kolkhorst,coauthor,793,3495,Rep. Lois W. Kolkhorst,Lois Kolkhorst
519,519,519,HJR 36,Proposing a constitutional amendment authorizing the governing body of a school district to establish for purposes of ad valorem taxation by the school district a limitation on the maximum average annual percentage increase in the appraised value of real property in the school district.,41354,Lois Kolkhorst,coauthor,793,3495,Rep. Lois W. Kolkhorst,Lois Kolkhorst
520,520,520,HR 772,Recognizing the Honorable Ken Armbrister for his many years of distinguished service in the Texas Legislature.,41354,Lois Kolkhorst,coauthor,793,3495,Rep. Lois W. Kolkhorst,Lois Kolkhorst
521,521,521,HB 65,Relating to limiting the use of eminent domain to take private property for private uses or economic development purposes.,41354,Lois Kolkhorst,author,792,3495,Rep. Lois W. Kolkhorst,Lois Kolkhorst
522,522,522,HB 16,Relating to limits on the use of the power of eminent domain.,41354,Lois Kolkhorst,author,792,3495,Rep. Lois W. Kolkhorst,Lois Kolkhorst
523,523,523,HB 29,Relating to limiting the maximum average annual increase in the appraised value of residence homesteads for ad valorem taxation by a school district to five percent.,41354,Lois Kolkhorst,author,792,3495,Rep. Lois W. Kolkhorst,Lois Kolkhorst
524,524,524,HJR 20,Proposing a constitutional amendment authorizing the legislature to limit the maximum average annual increase in the appraised value of residence homesteads for purposes of ad valorem taxation by a school district to five percent or more.,41354,Lois Kolkhorst,author,792,3495,Rep. Lois W. Kolkhorst,Lois Kolkhorst
525,525,525,SB 7,Relating to limits on the use of the power of eminent domain.,41354,Lois Kolkhorst,sponsor,792,3495,Rep. Lois W. Kolkhorst,Lois Kolkhorst
526,526,526,HR 43,In memory of Lu Ellen Gibbs of Huntsville.,41354,Lois Kolkhorst,author,791,3495,Rep. Lois W. Kolkhorst,Lois Kolkhorst
527,527,527,HJR 19,Proposing a constitutional amendment to restrict the state or a political subdivision from taking private property for the primary purpose of economic development or to benefit a particular class of identifiable individuals.,41354,Lois Kolkhorst,coauthor,791,3495,Rep. Lois W. Kolkhorst,Lois Kolkhorst
528,528,528,HB 381,Relating to the service area of the Blinn College District.,41354,Lois Kolkhorst,author,79R,3495,Rep. Lois W. Kolkhorst,Lois Kolkhorst
529,529,529,HB 841,Relating to the rates charged by a municipally owned utility to certain recreational vehicle parks for potable water or wastewater service.,41354,Lois Kolkhorst,author,79R,3495,Rep. Lois W. Kolkhorst,Lois Kolkhorst
530,530,530,HB 858,Relating to the issuance of a marriage license to applicants who are unable to personally appear before the county clerk.,41354,Lois Kolkhorst,author,79R,3495,Rep. Lois W. Kolkhorst,Lois Kolkhorst
531,531,531,HB 863,Relating to an employment preference for veterans at state agencies.,41354,Lois Kolkhorst,author,79R,3495,Rep. Lois W. Kolkhorst,Lois Kolkhorst
532,532,532,HB 1273,Relating to the development of the Trans-Texas Corridor.,41354,Lois Kolkhorst,author,79R,3495,Rep. Lois W. Kolkhorst,Lois Kolkhorst
533,533,533,HB 1322,Relating to testing and examination fee requirements for persons completing certain driver education courses.,41354,Lois Kolkhorst,author,79R,3495,Rep. Lois W. Kolkhorst,Lois Kolkhorst
534,534,534,HB 1402,Relating to requiring a voter to present proof of identification.,41354,Lois Kolkhorst,author,79R,3495,Rep. Lois W. Kolkhorst,Lois Kolkhorst
535,535,535,HB 1579,Relating to certain retired school employees and the powers and duties of the Teacher Retirement System of Texas.,41354,Lois Kolkhorst,author,79R,3495,Rep. Lois W. Kolkhorst,Lois Kolkhorst
536,536,536,HB 1583,"Relating to the authority of an emergency services district to obtain information to determine whether the district's 9-1-1 emergency service fee is correctly billed, collected, and remitted.",41354,Lois Kolkhorst,author,79R,3495,Rep. Lois W. Kolkhorst,Lois Kolkhorst
537,537,537,HB 1821,Relating to the authority of a county to require waste haulers to be licensed as a waste hauler.,41354,Lois Kolkhorst,author,79R,3495,Rep. Lois W. Kolkhorst,Lois Kolkhorst
538,538,538,HB 1822,Relating to an offense of passing or avoiding a weigh station by certain vehicle operators.,41354,Lois Kolkhorst,author,79R,3495,Rep. Lois W. Kolkhorst,Lois Kolkhorst
539,539,539,HB 2076,Relating to the use of revenue generated by municipally owned electric utilities.,41354,Lois Kolkhorst,author,79R,3495,Rep. Lois W. Kolkhorst,Lois Kolkhorst
540,540,540,HB 2077,Relating to the prohibition of wireless communications devices in correctional facilities operated by or under contract with the Texas Department of Criminal Justice; providing penalties.,41354,Lois Kolkhorst,author,79R,3495,Rep. Lois W. Kolkhorst,Lois Kolkhorst
541,541,541,HB 2512,Relating to statutory authority to reduce appropriations made by the legislature to certain governmental educational entities and to other fiscal matters involving certain governmental educational entities.,41354,Lois Kolkhorst,author,79R,3495,Rep. Lois W. Kolkhorst,Lois Kolkhorst
542,542,542,HB 2927,Relating to requiring the licensing of resellers of certified seed; imposing a criminal penalty.,41354,Lois Kolkhorst,author,79R,3495,Rep. Lois W. Kolkhorst,Lois Kolkhorst
543,543,543,HB 2928,Relating to projects that may be undertaken by certain development corporations with respect to business enterprises or business development.,41354,Lois Kolkhorst,author,79R,3495,Rep. Lois W. Kolkhorst,Lois Kolkhorst
544,544,544,HB 2952,Relating to requirements for the residence of an emergency medical services medical director.,41354,Lois Kolkhorst,author,79R,3495,Rep. Lois W. Kolkhorst,Lois Kolkhorst
545,545,545,HB 2953,Relating to the identification of public school students through the use of radio frequency identification technology.,41354,Lois Kolkhorst,author,79R,3495,Rep. Lois W. Kolkhorst,Lois Kolkhorst
546,546,546,HB 3045,"Relating to the juvenile boards of Grimes, Leon, Madison, and Walker Counties.",41354,Lois Kolkhorst,author,79R,3495,Rep. Lois W. Kolkhorst,Lois Kolkhorst
547,547,547,HB 3082,Relating to the eligibility of school district bonds for state assistance under the existing debt allotment.,41354,Lois Kolkhorst,author,79R,3495,Rep. Lois W. Kolkhorst,Lois Kolkhorst
548,548,548,HB 3083,Relating to the use of direct recording electronic voting machines.,41354,Lois Kolkhorst,author,79R,3495,Rep. Lois W. Kolkhorst,Lois Kolkhorst
549,549,549,HCR 24,Designating Navasota the Blues Capital of Texas.,41354,Lois Kolkhorst,author,79R,3495,Rep. Lois W. Kolkhorst,Lois Kolkhorst
550,550,550,HCR 34,Designating San Felipe as the Colonial Capital of Texas.,41354,Lois Kolkhorst,author,79R,3495,Rep. Lois W. Kolkhorst,Lois Kolkhorst
551,551,551,HCR 122,Designating Industry as the Oldest German Settlement in Texas.,41354,Lois Kolkhorst,author,79R,3495,Rep. Lois W. Kolkhorst,Lois Kolkhorst
552,552,552,HR 73,Commemorating San Felipe as the birthplace of the Texas Rangers.,41354,Lois Kolkhorst,author,79R,3495,Rep. Lois W. Kolkhorst,Lois Kolkhorst
553,553,553,HR 74,Honoring head football coach Ron Randleman on his retirement from Sam Houston State University.,41354,Lois Kolkhorst,author,79R,3495,Rep. Lois W. Kolkhorst,Lois Kolkhorst
554,554,554,HR 75,Honoring the Sam Houston State University football team for an outstanding 2004 season.,41354,Lois Kolkhorst,author,79R,3495,Rep. Lois W. Kolkhorst,Lois Kolkhorst
555,555,555,HR 76,"Recognizing February 16, 2005, as Texas Heritage Trails Day.",41354,Lois Kolkhorst,author,79R,3495,Rep. Lois W. Kolkhorst,Lois Kolkhorst
556,556,556,HR 82,"In memory of David Shane Howard of Brenham, Texas.",41354,Lois Kolkhorst,author,79R,3495,Rep. Lois W. Kolkhorst,Lois Kolkhorst
557,557,557,HR 191,"Recognizing February 15, 2005, as Walker County Day at the State Capitol.",41354,Lois Kolkhorst,author,79R,3495,Rep. Lois W. Kolkhorst,Lois Kolkhorst
558,558,558,HR 272,"Recognizing February 24, 2005, as Austin County Day.",41354,Lois Kolkhorst,author,79R,3495,Rep. Lois W. Kolkhorst,Lois Kolkhorst
559,559,559,HR 273,Honoring the life of Mary Pilger Giles of Iola.,41354,Lois Kolkhorst,author,79R,3495,Rep. Lois W. Kolkhorst,Lois Kolkhorst
560,560,560,HR 274,Honoring Andra Kareem Manson of Brenham for his track and field accomplishments.,41354,Lois Kolkhorst,author,79R,3495,Rep. Lois W. Kolkhorst,Lois Kolkhorst
561,561,561,HR 275,Congratulating Kelly Kaminski of Bellville on winning the barrel-racing championship at the National Finals Rodeo.,41354,Lois Kolkhorst,author,79R,3495,Rep. Lois W. Kolkhorst,Lois Kolkhorst
562,562,562,HR 644,In memory of Kevin Kulow of Sealy.,41354,Lois Kolkhorst,author,79R,3495,Rep. Lois W. Kolkhorst,Lois Kolkhorst
563,563,563,HR 694,"Recognizing March 8, 2005, as Washington County Day at the State Capitol.",41354,Lois Kolkhorst,author,79R,3495,Rep. Lois W. Kolkhorst,Lois Kolkhorst
564,564,564,HR 747,Honoring Hester Smith Lockett of Brenham on her 100th birthday.,41354,Lois Kolkhorst,author,79R,3495,Rep. Lois W. Kolkhorst,Lois Kolkhorst
565,565,565,HR 949,Congratulating Andrew and Ila Martinez of Huntsville on their 50th wedding anniversary.,41354,Lois Kolkhorst,author,79R,3495,Rep. Lois W. Kolkhorst,Lois Kolkhorst
566,566,566,HR 1192,Honoring Coach Bob Brock of Sam Houston State University on his 800th career victory.,41354,Lois Kolkhorst,author,79R,3495,Rep. Lois W. Kolkhorst,Lois Kolkhorst
567,567,567,HR 1482,"Recognizing May 1-7, 2005, as Texas Correctional Officers Week.",41354,Lois Kolkhorst,author,79R,3495,Rep. Lois W. Kolkhorst,Lois Kolkhorst
568,568,568,HR 2283,In memory of David and Carole Mahnke of Palacios.,41354,Lois Kolkhorst,author,79R,3495,Rep. Lois W. Kolkhorst,Lois Kolkhorst
569,569,569,HB 166,Relating to the use of direct recording electronic voting machines.,41354,Lois Kolkhorst,author,79R,3495,Rep. Lois W. Kolkhorst,Lois Kolkhorst
570,570,570,HB 315,Relating to criteria for voluntary admission to state schools for persons with mental retardation.,41354,Lois Kolkhorst,author,79R,3495,Rep. Lois W. Kolkhorst,Lois Kolkhorst
571,571,571,HB 519,Relating to the exemption of volunteer fire departments from the gasoline tax.,41354,Lois Kolkhorst,author,79R,3495,Rep. Lois W. Kolkhorst,Lois Kolkhorst
572,572,572,HB 520,Relating to the tax on gasoline sold to volunteer fire departments for their exclusive use.,41354,Lois Kolkhorst,author,79R,3495,Rep. Lois W. Kolkhorst,Lois Kolkhorst
573,573,573,HB 557,Relating to the number of administrators employed by a school district and the salaries paid to those persons.,41354,Lois Kolkhorst,author,79R,3495,Rep. Lois W. Kolkhorst,Lois Kolkhorst
574,574,574,HB 661,Relating to allowing designated public school libraries to participate in group purchasing agreements with the TexShare Library Consortium.,41354,Lois Kolkhorst,author,79R,3495,Rep. Lois W. Kolkhorst,Lois Kolkhorst
575,575,575,HB 784,Relating to providing tax relief and protection for ad valorem tax payers.,41354,Lois Kolkhorst,author,79R,3495,Rep. Lois W. Kolkhorst,Lois Kolkhorst
576,576,576,HB 1765,Relating to the creation of programs and funding for emerging technology industries.,41354,Lois Kolkhorst,author,79R,3495,Rep. Lois W. Kolkhorst,Lois Kolkhorst
577,577,577,HB 2201,Relating to implementing a clean coal project in this state.,41354,Lois Kolkhorst,author,79R,3495,Rep. Lois W. Kolkhorst,Lois Kolkhorst
578,578,578,HB 3298,Relating to providing tax relief and protection for ad valorem tax payers.,41354,Lois Kolkhorst,author,79R,3495,Rep. Lois W. Kolkhorst,Lois Kolkhorst
579,579,579,HR 1027,In memory of Robert Anthony Proffitt of Liberty Hill.,41354,Lois Kolkhorst,author,79R,3495,Rep. Lois W. Kolkhorst,Lois Kolkhorst
580,580,580,HB 120,"Relating to the creation of a donor education, awareness, and registry program, the establishment of an organ donor and tissue council, and anatomical gift donation.",41354,Lois Kolkhorst,coauthor,79R,3495,Rep. Lois W. Kolkhorst,Lois Kolkhorst
581,581,581,HB 129,Relating to the authority to require a convicted person to perform manual labor for a nonprofit organization or a cemetery maintained by the county.,41354,Lois Kolkhorst,coauthor,79R,3495,Rep. Lois W. Kolkhorst,Lois Kolkhorst
582,582,582,HB 151,Relating to the punishment for the offense of burglary of a vehicle.,41354,Lois Kolkhorst,coauthor,79R,3495,Rep. Lois W. Kolkhorst,Lois Kolkhorst
583,583,583,HB 225,Relating to the issuance and expiration of certain licenses to carry a concealed handgun.,41354,Lois Kolkhorst,coauthor,79R,3495,Rep. Lois W. Kolkhorst,Lois Kolkhorst
584,584,584,HB 790,Relating to the conduct of newborn screening by the Department of State Health Services.,41354,Lois Kolkhorst,coauthor,79R,3495,Rep. Lois W. Kolkhorst,Lois Kolkhorst
585,585,585,HB 894,Relating to produce samples at municipally owned farmers' markets.,41354,Lois Kolkhorst,coauthor,79R,3495,Rep. Lois W. Kolkhorst,Lois Kolkhorst
586,586,586,HB 1007,Relating to certain low-interest home loan programs administered by the Texas State Affordable Housing Corporation.,41354,Lois Kolkhorst,coauthor,79R,3495,Rep. Lois W. Kolkhorst,Lois Kolkhorst
587,587,587,HB 1212,Relating to abortion and parental consent to an abortion; providing penalties.,41354,Lois Kolkhorst,coauthor,79R,3495,Rep. Lois W. Kolkhorst,Lois Kolkhorst
588,588,588,HB 1364,Relating to municipal regulation of the discharge of firearms and certain other weapons.,41354,Lois Kolkhorst,coauthor,79R,3495,Rep. Lois W. Kolkhorst,Lois Kolkhorst
589,589,589,HB 1655,Relating to funding for the Texas statewide emergency services personnel retirement fund.,41354,Lois Kolkhorst,coauthor,79R,3495,Rep. Lois W. Kolkhorst,Lois Kolkhorst
590,590,590,HB 1771,Relating to the Medicaid managed care delivery system.,41354,Lois Kolkhorst,coauthor,79R,3495,Rep. Lois W. Kolkhorst,Lois Kolkhorst
591,591,591,HB 2061,"Relating to the right of health care facilities, health insurers, and health care providers to object to providing or participating in the provision of certain procedures.",41354,Lois Kolkhorst,coauthor,79R,3495,Rep. Lois W. Kolkhorst,Lois Kolkhorst
592,592,592,HB 3305,Relating to coercing a woman to have an abortion and parental notification of abortion; creating offenses.,41354,Lois Kolkhorst,coauthor,79R,3495,Rep. Lois W. Kolkhorst,Lois Kolkhorst
593,593,593,HB 3363,Relating to the financing of state highways and the Trans-Texas Corridor.,41354,Lois Kolkhorst,coauthor,79R,3495,Rep. Lois W. Kolkhorst,Lois Kolkhorst
594,594,594,HCR 22,Directing the legislative staff responsible for maintaining the Internet website for the Texas Legislature to provide improved public access to information on votes taken on legislation.,41354,Lois Kolkhorst,coauthor,79R,3495,Rep. Lois W. Kolkhorst,Lois Kolkhorst
595,595,595,HCR 208,"Encouraging the board of regents of Texas Southern University to name a building, an outdoor plaza, or an interior space of honor on the campus after the Honorable Joe E. Moreno.",41354,Lois Kolkhorst,coauthor,79R,3495,Rep. Lois W. Kolkhorst,Lois Kolkhorst
596,596,596,HJR 6,Proposing a constitutional amendment providing that marriage in this state consists only of the union of one man and one woman.,41354,Lois Kolkhorst,coauthor,79R,3495,Rep. Lois W. Kolkhorst,Lois Kolkhorst
597,597,597,SB 23,Relating to subsidized child-care services and early childhood care and education program coordination.,41354,Lois Kolkhorst,sponsor,79R,3495,Rep. Lois W. Kolkhorst,Lois Kolkhorst
598,598,598,SB 696,Relating to testing and examination fee requirements for certain provisional license holders.,41354,Lois Kolkhorst,sponsor,79R,3495,Rep. Lois W. Kolkhorst,Lois Kolkhorst
599,599,599,SB 1096,Relating to certain employment and training investment programs in this state.,41354,Lois Kolkhorst,sponsor,79R,3495,Rep. Lois W. Kolkhorst,Lois Kolkhorst
600,600,600,SB 1304,Relating to projects that may be undertaken by certain development corporations with respect to business enterprises or business development.,41354,Lois Kolkhorst,sponsor,79R,3495,Rep. Lois W. Kolkhorst,Lois Kolkhorst
601,601,601,SB 1318,Relating to projects that may be undertaken by or supported by the tax proceeds of certain development corporations.,41354,Lois Kolkhorst,sponsor,79R,3495,Rep. Lois W. Kolkhorst,Lois Kolkhorst
602,602,602,HB 80,Relating to limiting the maximum average annual increase in the appraised value of residential real property for ad valorem tax purposes to three percent.,41354,Lois Kolkhorst,author,784,3495,Rep. Lois W. Kolkhorst,Lois Kolkhorst
603,603,603,HJR 17,Proposing a constitutional amendment authorizing the legislature to establish a three percent limit on annual increases in the appraised value for ad valorem tax purposes of residential real property.,41354,Lois Kolkhorst,author,784,3495,Rep. Lois W. Kolkhorst,Lois Kolkhorst
604,604,604,HR 216,Honoring John Brieden III of Brenham as the newly elected national commander of the American Legion.,41354,Lois Kolkhorst,author,783,3495,Rep. Lois W. Kolkhorst,Lois Kolkhorst
605,605,605,HB 39,Relating to the filing of personal financial disclosure statements by members of the boards of trustees of school districts.,41354,Lois Kolkhorst,coauthor,783,3495,Rep. Lois W. Kolkhorst,Lois Kolkhorst
606,606,606,HR 125,Recognizing October 2003 as Free Enterprise Month in Texas.,41354,Lois Kolkhorst,author,782,3495,Rep. Lois W. Kolkhorst,Lois Kolkhorst
607,607,607,HR 126,Honoring Lonny G. Traweek on his August 2003 retirement from the Texas Department of Transportation.,41354,Lois Kolkhorst,author,782,3495,Rep. Lois W. Kolkhorst,Lois Kolkhorst
