Unnamed: 0,Unnamed: 0.1,Unnamed: 0.1.1,bill_name,caption,filer_id,filer_name,function,session,leg_id,original_name,parsed_name
257,257,257,HJR 73,Proposing a constitutional amendment providing that a member of the legislature or person holding a statewide elective office automatically vacates office on announcing a candidacy or becoming a candidate for another elective office before December 1 of the last full odd-numbered year of the person's term of office.,-1,J. Sheffield,coauthor,83R,2735,Rep. J. D. Sheffield,J.. Sheffield
258,258,258,HJR 74,Proposing a constitutional amendment prohibiting the taxation of the sale or use of certain food and medicine.,-1,J. Sheffield,coauthor,83R,2735,Rep. J. D. Sheffield,J.. Sheffield
259,259,259,HR 985,Recognizing March 2013 as Texas Public Schools Month.,-1,J. Sheffield,coauthor,83R,2735,Rep. J. D. Sheffield,J.. Sheffield
260,260,260,HR 1193,"Recognizing April 18, 2013, as Texas Federation of Republican Women Day at the State Capitol.",-1,J. Sheffield,coauthor,83R,2735,Rep. J. D. Sheffield,J.. Sheffield
261,261,261,HR 1400,"Recognizing April 17, 2013, as Vietnamese American Day at the State Capitol.",-1,J. Sheffield,coauthor,83R,2735,Rep. J. D. Sheffield,J.. Sheffield
262,262,262,SB 63,Relating to consent to the immunization of certain children.,-1,J. Sheffield,sponsor,83R,2735,Rep. J. D. Sheffield,J.. Sheffield
263,263,263,SB 380,Relating to the recording of an informal settlement conference to resolve a complaint to the Texas Medical Board against a physician.,-1,J. Sheffield,sponsor,83R,2735,Rep. J. D. Sheffield,J.. Sheffield
264,264,264,SB 492,Relating to the licensing and regulation of prescribed pediatric extended care centers; providing penalties; imposing fees.,-1,J. Sheffield,sponsor,83R,2735,Rep. J. D. Sheffield,J.. Sheffield
265,265,265,SB 500,Relating to the Texas State Board of Pharmacy.,-1,J. Sheffield,sponsor,83R,2735,Rep. J. D. Sheffield,J.. Sheffield
266,266,266,SB 578,Relating to use of countywide polling places for certain elections.,-1,J. Sheffield,sponsor,83R,2735,Rep. J. D. Sheffield,J.. Sheffield
267,267,267,SB 807,Relating to the authority of the Department of State Health Services to admit certain nonresident tuberculosis patients to a state chest hospital.,-1,J. Sheffield,sponsor,83R,2735,Rep. J. D. Sheffield,J.. Sheffield
268,268,268,SB 949,Relating to licensing under the Medical Practice Act.,-1,J. Sheffield,sponsor,83R,2735,Rep. J. D. Sheffield,J.. Sheffield
269,269,269,SB 8,"Relating to the provision and delivery of certain health and human services in this state, including the provision of those services through the Medicaid program and the prevention of fraud, waste, and abuse in that program and other programs.",-1,J. Sheffield,sponsor,83R,2735,Rep. J. D. Sheffield,J.. Sheffield
270,270,270,SB 406,Relating to the practice of advanced practice registered nurses and physician assistants and the delegation of prescriptive authority by physicians to and the supervision by physicians of certain advanced practice registered nurses and physician assistants.,-1,J. Sheffield,cosponsor,83R,2735,Rep. J. D. Sheffield,J.. Sheffield
