Unnamed: 0,Unnamed: 0.1,Unnamed: 0.1.1,bill_name,caption,filer_id,filer_name,function,session,leg_id,original_name,parsed_name
263,263,263,HR 1339,Commending Betty Carter Hooey for serving as a Democratic Party precinct chair in Dallas County.,65751,Eric Johnson,author,82R,3345,Rep. Eric Johnson,Eric Johnson
264,264,264,HR 1340,Commending Gloria Hogg for serving as a Democratic Party precinct chair in Dallas County.,65751,Eric Johnson,author,82R,3345,Rep. Eric Johnson,Eric Johnson
265,265,265,HR 1341,Commending Brandi Hill for serving as a Democratic Party precinct chair in Dallas County.,65751,Eric Johnson,author,82R,3345,Rep. Eric Johnson,Eric Johnson
266,266,266,HR 1589,Commending Carl Johnson for serving as a Democratic Party precinct chair in Dallas County.,65751,Eric Johnson,author,82R,3345,Rep. Eric Johnson,Eric Johnson
267,267,267,HR 1590,Commending Saundra Ray for serving as a Democratic Party precinct chair in Dallas County.,65751,Eric Johnson,author,82R,3345,Rep. Eric Johnson,Eric Johnson
268,268,268,HR 1591,Commending Morris Luster for serving as a Democratic Party precinct chair in Dallas County.,65751,Eric Johnson,author,82R,3345,Rep. Eric Johnson,Eric Johnson
269,269,269,HR 1592,Commending Neil Emmons for serving as a Democratic Party precinct chair in Dallas County.,65751,Eric Johnson,author,82R,3345,Rep. Eric Johnson,Eric Johnson
270,270,270,HR 1593,Commending Marilynn S. Mayse for serving as a Democratic Party precinct chair in Dallas County.,65751,Eric Johnson,author,82R,3345,Rep. Eric Johnson,Eric Johnson
271,271,271,HR 1594,Commending Deborah C. Culberson for serving as a Democratic Party precinct chair in Dallas County.,65751,Eric Johnson,author,82R,3345,Rep. Eric Johnson,Eric Johnson
272,272,272,HR 1595,Commending Patrick McCrainey for serving as a Democratic Party precinct chair in Dallas County.,65751,Eric Johnson,author,82R,3345,Rep. Eric Johnson,Eric Johnson
273,273,273,HR 1596,Commending Casie Pierce for serving as a Democratic Party precinct chair in Dallas County.,65751,Eric Johnson,author,82R,3345,Rep. Eric Johnson,Eric Johnson
274,274,274,HR 1597,Commending Tommy Briggs for serving as a Democratic Party precinct chair in Dallas County.,65751,Eric Johnson,author,82R,3345,Rep. Eric Johnson,Eric Johnson
275,275,275,HR 1598,Commending Damion White for serving as a Democratic Party precinct chair in Dallas County.,65751,Eric Johnson,author,82R,3345,Rep. Eric Johnson,Eric Johnson
276,276,276,HR 1728,Commending Deloris Hill-Peace for serving as a Democratic Party precinct chair in Dallas County.,65751,Eric Johnson,author,82R,3345,Rep. Eric Johnson,Eric Johnson
277,277,277,HR 1750,Congratulating Betty Hooey on being elected to represent Dallas County in the Texas Silver-Haired Legislature for the 2011-2013 term.,65751,Eric Johnson,author,82R,3345,Rep. Eric Johnson,Eric Johnson
278,278,278,HR 1837,Honoring the Fourth Avenue Church of Christ in Dallas on the 50th anniversary of its founding.,65751,Eric Johnson,author,82R,3345,Rep. Eric Johnson,Eric Johnson
279,279,279,HR 1911,Commemorating the 100th anniversary of the founding of Kappa Alpha Psi Fraternity.,65751,Eric Johnson,author,82R,3345,Rep. Eric Johnson,Eric Johnson
280,280,280,HB 115,Relating to the creation of a commission to investigate convictions after exoneration and to prevent wrongful convictions.,65751,Eric Johnson,author,82R,3345,Rep. Eric Johnson,Eric Johnson
281,281,281,HB 1577,Relating to the sunset review of regional tollway authorities.,65751,Eric Johnson,author,82R,3345,Rep. Eric Johnson,Eric Johnson
282,282,282,HB 2020,Relating to state aid for certain juvenile justice alternative education programs that enter into certain revenue sharing agreements.,65751,Eric Johnson,author,82R,3345,Rep. Eric Johnson,Eric Johnson
283,283,283,HCR 46,Designating February 21 through 27 of each year from 2011 through 2020 as Barbara Jordan Freedom Week.,65751,Eric Johnson,author,82R,3345,Rep. Eric Johnson,Eric Johnson
284,284,284,HR 281,"Recognizing February 15, 2011, as Dallas Assembly Day at the State Capitol.",65751,Eric Johnson,author,82R,3345,Rep. Eric Johnson,Eric Johnson
285,285,285,HR 1259,Commemorating the 100th anniversary of the creation of White Rock Lake in Dallas.,65751,Eric Johnson,author,82R,3345,Rep. Eric Johnson,Eric Johnson
286,286,286,HR 2060,"Honoring The University of Texas Southwestern Medical Center at Dallas for its contributions in research, education, and health care.",65751,Eric Johnson,author,82R,3345,Rep. Eric Johnson,Eric Johnson
287,287,287,HB 7,"Relating to the prosecution, punishment, and certain criminal and civil consequences of offenses involving or related to the trafficking of persons and to certain protections for victims of those offenses.",65751,Eric Johnson,coauthor,82R,3345,Rep. Eric Johnson,Eric Johnson
288,288,288,HB 8,Relating to prohibiting certain private transfer fees and the preservation of private real property rights; providing penalties.,65751,Eric Johnson,coauthor,82R,3345,Rep. Eric Johnson,Eric Johnson
289,289,289,HB 11,Relating to reports filed with the comptroller regarding certain alcoholic beverage sales; providing a penalty.,65751,Eric Johnson,coauthor,82R,3345,Rep. Eric Johnson,Eric Johnson
290,290,290,HB 95,Relating to an exemption from ad valorem taxation of the residence homestead of the surviving spouse of a 100 percent or totally disabled veteran.,65751,Eric Johnson,coauthor,82R,3345,Rep. Eric Johnson,Eric Johnson
291,291,291,HB 117,Relating to disease control outreach programs to reduce the risk of certain communicable diseases.,65751,Eric Johnson,coauthor,82R,3345,Rep. Eric Johnson,Eric Johnson
292,292,292,HB 175,Relating to the on-premises consumption of certain alcoholic beverages; providing a penalty.,65751,Eric Johnson,coauthor,82R,3345,Rep. Eric Johnson,Eric Johnson
293,293,293,HB 224,"Relating to bullying, including cyberbullying, in public schools.",65751,Eric Johnson,coauthor,82R,3345,Rep. Eric Johnson,Eric Johnson
294,294,294,HB 399,Relating to requiring general academic teaching institutions to offer personal financial literacy training.,65751,Eric Johnson,coauthor,82R,3345,Rep. Eric Johnson,Eric Johnson
295,295,295,HB 410,Relating to the regulation of activities with respect to certain extensions of consumer credit.,65751,Eric Johnson,coauthor,82R,3345,Rep. Eric Johnson,Eric Johnson
296,296,296,HB 670,Relating to the elimination of smoking in certain workplaces and public places; providing penalties.,65751,Eric Johnson,coauthor,82R,3345,Rep. Eric Johnson,Eric Johnson
297,297,297,HB 1075,Relating to an alert for a missing person with an intellectual disability.,65751,Eric Johnson,coauthor,82R,3345,Rep. Eric Johnson,Eric Johnson
298,298,298,HB 1353,Relating to speed limits.,65751,Eric Johnson,coauthor,82R,3345,Rep. Eric Johnson,Eric Johnson
299,299,299,HB 1451,Relating to the licensing and regulation of certain dog and cat breeders; providing penalties.,65751,Eric Johnson,coauthor,82R,3345,Rep. Eric Johnson,Eric Johnson
300,300,300,HB 1942,Relating to bullying in public schools.,65751,Eric Johnson,coauthor,82R,3345,Rep. Eric Johnson,Eric Johnson
301,301,301,HB 2038,"Relating to prevention, treatment, and oversight of concussions affecting public school students participating in interscholastic athletics.",65751,Eric Johnson,coauthor,82R,3345,Rep. Eric Johnson,Eric Johnson
302,302,302,HB 2646,Relating to distribution by the School Land Board of revenue derived from permanent school fund land or other properties to the available school fund.,65751,Eric Johnson,coauthor,82R,3345,Rep. Eric Johnson,Eric Johnson
303,303,303,HB 3562,Relating to the liability of the state for a violation of the federal Americans with Disabilities Act.,65751,Eric Johnson,coauthor,82R,3345,Rep. Eric Johnson,Eric Johnson
304,304,304,HCR 126,In memory of the Honorable Edmund Kuempel of Seguin.,65751,Eric Johnson,coauthor,82R,3345,Rep. Eric Johnson,Eric Johnson
305,305,305,HCR 158,Urging the federal government to grant a conditional green card to certain noncitizens to allow them to enlist in the United States armed forces and urging the federal government to award citizenship to these immigrants upon the completion of four years of honorable military service.,65751,Eric Johnson,coauthor,82R,3345,Rep. Eric Johnson,Eric Johnson
306,306,306,HJR 109,"Proposing a constitutional amendment to clarify references to the permanent school fund, to allow the General Land Office to distribute revenue derived from permanent school fund land or other properties to the available school fund, and to provide for an increase in the market value of the permanent school fund for the purpose of allowing increased distributions from the available school fund.",65751,Eric Johnson,coauthor,82R,3345,Rep. Eric Johnson,Eric Johnson
307,307,307,HR 424,Honoring Bruce R. Sherbet for his outstanding service as the elections administrator for Dallas County.,65751,Eric Johnson,coauthor,82R,3345,Rep. Eric Johnson,Eric Johnson
308,308,308,HR 1694,"Commending President Barack Obama, intelligence personnel, and members of the armed forces for the successful completion of their operation.",65751,Eric Johnson,coauthor,82R,3345,Rep. Eric Johnson,Eric Johnson
309,309,309,SB 371,Relating to the eligibility for service retirement annuities of certain elected officials convicted of certain crimes.,65751,Eric Johnson,sponsor,82R,3345,Rep. Eric Johnson,Eric Johnson
310,310,310,SB 1730,Relating to requiring the Texas Higher Education Coordinating Board to create a tool to allow prospective students to compare general academic teaching institutions by certain criteria.,65751,Eric Johnson,sponsor,82R,3345,Rep. Eric Johnson,Eric Johnson
311,311,311,SB 24,"Relating to the prosecution, punishment, and certain criminal and civil consequences of offenses involving or related to the trafficking of persons and to certain protections for victims of those offenses.",65751,Eric Johnson,cosponsor,82R,3345,Rep. Eric Johnson,Eric Johnson
312,312,312,HB 232,Relating to the exemption of certain reserve peace officers from regulation under the Private Security Act.,65751,Eric Johnson,author,77R,3345,Rep. Eric Johnson,Eric Johnson
313,313,313,HB 233,Relating to the liability of volunteers at certain free health clinics.,65751,Eric Johnson,author,77R,3345,Rep. Eric Johnson,Eric Johnson
314,314,314,HB 234,Relating to exempting members of the armed forces from the Texas Academic Skills Program.,65751,Eric Johnson,author,77R,3345,Rep. Eric Johnson,Eric Johnson
315,315,315,HB 235,Relating to liability for use of property for disaster response or recovery.,65751,Eric Johnson,author,77R,3345,Rep. Eric Johnson,Eric Johnson
316,316,316,HB 337,Relating to cancelling or prohibiting the issuance of certain original or renewal alcoholic beverage permits or licenses for nonpayment of ad valorem taxes.,65751,Eric Johnson,author,77R,3345,Rep. Eric Johnson,Eric Johnson
317,317,317,HB 373,Relating to creating a foundation to finance health programs in the rural areas of the state.,65751,Eric Johnson,author,77R,3345,Rep. Eric Johnson,Eric Johnson
318,318,318,HB 681,Relating to an economic development program administered by the Texas Department of Agriculture.,65751,Eric Johnson,author,77R,3345,Rep. Eric Johnson,Eric Johnson
319,319,319,HB 682,Relating to the preservation of rail facilities by the Texas Department of Transportation.,65751,Eric Johnson,author,77R,3345,Rep. Eric Johnson,Eric Johnson
320,320,320,HB 752,Relating to exempting members of the armed forces from the Texas Academic Skills Program.,65751,Eric Johnson,author,77R,3345,Rep. Eric Johnson,Eric Johnson
321,321,321,HB 1441,Relating to certain anticipation notes for rural economic development.,65751,Eric Johnson,author,77R,3345,Rep. Eric Johnson,Eric Johnson
322,322,322,HB 1442,Relating to the application to certain children of military personnel of the requirement of exit-level performance on assessment instruments for graduation from public high school.,65751,Eric Johnson,author,77R,3345,Rep. Eric Johnson,Eric Johnson
323,323,323,HB 1443,Relating to creating the rural physician relief program.,65751,Eric Johnson,author,77R,3345,Rep. Eric Johnson,Eric Johnson
324,324,324,HB 1484,Relating to the authority of a county to borrow from the state infrastructure bank.,65751,Eric Johnson,author,77R,3345,Rep. Eric Johnson,Eric Johnson
325,325,325,HB 1485,Relating to the creation of a county development district and to the use of revenue of the district.,65751,Eric Johnson,author,77R,3345,Rep. Eric Johnson,Eric Johnson
326,326,326,HB 1711,Relating to the boll weevil eradication program.,65751,Eric Johnson,author,77R,3345,Rep. Eric Johnson,Eric Johnson
327,327,327,HB 1972,Relating to the election dates for directors of the Bee Groundwater Conservation District.,65751,Eric Johnson,author,77R,3345,Rep. Eric Johnson,Eric Johnson
328,328,328,HB 2040,Relating to defense base development authorities created by certain municipalities.,65751,Eric Johnson,author,77R,3345,Rep. Eric Johnson,Eric Johnson
329,329,329,HB 2041,Relating to permitting certain military dependents to qualify for automatic admission to general academic teaching institutions.,65751,Eric Johnson,author,77R,3345,Rep. Eric Johnson,Eric Johnson
330,330,330,HB 2046,"Relating to the ratification of the creation of and to the administration, powers, duties, operation, and financing of the Refugio Groundwater Conservation District.",65751,Eric Johnson,author,77R,3345,Rep. Eric Johnson,Eric Johnson
331,331,331,HB 2047,"Relating to the annexation of additional territory and the composition of the port commission of the Port of Corpus Christi Authority of Nueces County, Texas.",65751,Eric Johnson,author,77R,3345,Rep. Eric Johnson,Eric Johnson
332,332,332,HB 2125,Relating to public school admission of military personnel and dependents under reciprocity agreements between states.,65751,Eric Johnson,author,77R,3345,Rep. Eric Johnson,Eric Johnson
333,333,333,HB 2217,Relating to the issuance of a certificate of title for certain farm semitrailers.,65751,Eric Johnson,author,77R,3345,Rep. Eric Johnson,Eric Johnson
334,334,334,HB 2421,Relating to establishing a program to recruit rural medical students for service in rural communities.,65751,Eric Johnson,author,77R,3345,Rep. Eric Johnson,Eric Johnson
335,335,335,HB 2422,Relating to the provision of data by a rural provider to the Texas Health Care Information Council.,65751,Eric Johnson,author,77R,3345,Rep. Eric Johnson,Eric Johnson
336,336,336,HB 2423,Relating to the designation of a hospital as a rural hospital.,65751,Eric Johnson,author,77R,3345,Rep. Eric Johnson,Eric Johnson
337,337,337,HB 2424,Relating to payment for services provided by rural hospitals and physicians under the state child health plan.,65751,Eric Johnson,author,77R,3345,Rep. Eric Johnson,Eric Johnson
338,338,338,HB 2425,Relating to certain pilot programs under the Medicaid managed care program.,65751,Eric Johnson,author,77R,3345,Rep. Eric Johnson,Eric Johnson
339,339,339,HB 2426,Relating to disbursements to rural hospitals from the tertiary care account.,65751,Eric Johnson,author,77R,3345,Rep. Eric Johnson,Eric Johnson
340,340,340,HB 2427,Relating to the amount of hazardous duty pay for certain state employees.,65751,Eric Johnson,author,77R,3345,Rep. Eric Johnson,Eric Johnson
341,341,341,HB 2542,Relating to the advisory committee for the Center for Rural Health Initiatives.,65751,Eric Johnson,author,77R,3345,Rep. Eric Johnson,Eric Johnson
342,342,342,HB 2605,Relating to the maximum tax rate for certain hospital districts.,65751,Eric Johnson,author,77R,3345,Rep. Eric Johnson,Eric Johnson
343,343,343,HB 2709,"Relating to the use of an electric utility's power of condemnation to construct, operate, or maintain an electric transmission line.",65751,Eric Johnson,author,77R,3345,Rep. Eric Johnson,Eric Johnson
344,344,344,HB 2908,Relating to transferring the Texas Strategic Military Planning Commission to the office of the governor.,65751,Eric Johnson,author,77R,3345,Rep. Eric Johnson,Eric Johnson
345,345,345,HB 2909,Relating to information included on the Internet website of the Texas Department of Transportation.,65751,Eric Johnson,author,77R,3345,Rep. Eric Johnson,Eric Johnson
346,346,346,HB 3010,Relating to the operation of a statewide rural health care system.,65751,Eric Johnson,author,77R,3345,Rep. Eric Johnson,Eric Johnson
347,347,347,HB 3374,Relating to the availability and deployment of advanced telecommunications services for economic development and providing of funding.,65751,Eric Johnson,author,77R,3345,Rep. Eric Johnson,Eric Johnson
348,348,348,HB 3379,Relating to the regulation of floating cabins; providing penalties.,65751,Eric Johnson,author,77R,3345,Rep. Eric Johnson,Eric Johnson
349,349,349,HB 3681,"Relating to the annexation of additional territory and the composition of the port commission of the Port of Corpus Christi Authority of Nueces County, Texas.",65751,Eric Johnson,author,77R,3345,Rep. Eric Johnson,Eric Johnson
350,350,350,HCR 41,Designating the city of Kenedy as the Texas Horned Lizard Capital of the World.,65751,Eric Johnson,author,77R,3345,Rep. Eric Johnson,Eric Johnson
351,351,351,HR 39,Recognizing the city of Kenedy as the Horned Lizard Capital of Texas.,65751,Eric Johnson,author,77R,3345,Rep. Eric Johnson,Eric Johnson
352,352,352,HR 286,Honoring the Texas Scholars of San Patricio County.,65751,Eric Johnson,author,77R,3345,Rep. Eric Johnson,Eric Johnson
353,353,353,HR 313,"Recognizing February 21, 2001, as Interstate Route 69 Day in Texas.",65751,Eric Johnson,author,77R,3345,Rep. Eric Johnson,Eric Johnson
354,354,354,HR 361,"Recognizing March 6, 2001, as Cotton Day at the State Capitol.",65751,Eric Johnson,author,77R,3345,Rep. Eric Johnson,Eric Johnson
355,355,355,HR 406,Welcoming the visiting delegation from Glenlyon Primary School in Scotland to the State Capitol.,65751,Eric Johnson,author,77R,3345,Rep. Eric Johnson,Eric Johnson
356,356,356,HB 7,Relating to creating the Office of Rural Community Affairs.,65751,Eric Johnson,author,77R,3345,Rep. Eric Johnson,Eric Johnson
357,357,357,HB 246,Relating to the creation and funding of the Rural Communities Health Care Investment Program to attract and retain rural health care professionals.,65751,Eric Johnson,author,77R,3345,Rep. Eric Johnson,Eric Johnson
358,358,358,HB 328,Relating to single-member trustee districts and trustees for certain school districts.,65751,Eric Johnson,author,77R,3345,Rep. Eric Johnson,Eric Johnson
359,359,359,HB 427,Relating to compulsory school attendance.,65751,Eric Johnson,author,77R,3345,Rep. Eric Johnson,Eric Johnson
360,360,360,HB 432,Relating to driving privileges of drivers under 18 years of age.,65751,Eric Johnson,author,77R,3345,Rep. Eric Johnson,Eric Johnson
361,361,361,HB 611,Relating to the regulation of telepharmacy as a method to dispense drugs.,65751,Eric Johnson,author,77R,3345,Rep. Eric Johnson,Eric Johnson
362,362,362,HB 819,Relating to transfer of the Office of Rural Affairs to the Department of Agriculture.,65751,Eric Johnson,author,77R,3345,Rep. Eric Johnson,Eric Johnson
363,363,363,HB 835,Relating to the study of a buy-in option for the state child health plan.,65751,Eric Johnson,author,77R,3345,Rep. Eric Johnson,Eric Johnson
364,364,364,HB 906,Relating to the continuation and functions of the Coastal Coordination Council.,65751,Eric Johnson,author,77R,3345,Rep. Eric Johnson,Eric Johnson
365,365,365,HB 983,Relating to a franchise tax credit for expenditures made toward the cost of long-term care insurance policies for certain employees.,65751,Eric Johnson,author,77R,3345,Rep. Eric Johnson,Eric Johnson
366,366,366,HB 1082,Relating to a prohibition on employment discrimination in compensation; providing penalties.,65751,Eric Johnson,author,77R,3345,Rep. Eric Johnson,Eric Johnson
367,367,367,HB 1124,Relating to establishing a community healthcare awareness and mentoring program for students.,65751,Eric Johnson,author,77R,3345,Rep. Eric Johnson,Eric Johnson
368,368,368,HB 1370,Relating to the authority of certain public entities to borrow from the state infrastructure bank.,65751,Eric Johnson,author,77R,3345,Rep. Eric Johnson,Eric Johnson
369,369,369,HB 1689,Relating to an exemption from ad valorem taxation for certain organizations engaged primarily in performing charitable functions.,65751,Eric Johnson,author,77R,3345,Rep. Eric Johnson,Eric Johnson
370,370,370,HB 1736,Relating to the enhanced availability of advanced telecommunications services.,65751,Eric Johnson,author,77R,3345,Rep. Eric Johnson,Eric Johnson
371,371,371,HB 1811,Relating to the use of certain federal housing funds.,65751,Eric Johnson,author,77R,3345,Rep. Eric Johnson,Eric Johnson
372,372,372,HB 1941,Relating to allowing certain family members of military personnel who previously resided in Texas to pay resident tuition and fees at institutions of higher education.,65751,Eric Johnson,author,77R,3345,Rep. Eric Johnson,Eric Johnson
373,373,373,HB 1942,Relating to permitting certain military dependents to qualify for automatic admission to general academic teaching institutions.,65751,Eric Johnson,author,77R,3345,Rep. Eric Johnson,Eric Johnson
374,374,374,HB 2210,Relating to the scope of practice of a physician assistant acting in a delegated practice.,65751,Eric Johnson,author,77R,3345,Rep. Eric Johnson,Eric Johnson
375,375,375,HB 2688,Relating to school bus passenger safety.,65751,Eric Johnson,author,77R,3345,Rep. Eric Johnson,Eric Johnson
376,376,376,HB 2743,Relating to the maximum tax rate allowed on property in emergency service and rural fire prevention districts.,65751,Eric Johnson,author,77R,3345,Rep. Eric Johnson,Eric Johnson
377,377,377,HB 2744,Relating to emergency services and rural fire prevention districts.,65751,Eric Johnson,author,77R,3345,Rep. Eric Johnson,Eric Johnson
378,378,378,HB 2745,Relating to the property tax rate in overlapping emergency services and rural fire prevention districts.,65751,Eric Johnson,author,77R,3345,Rep. Eric Johnson,Eric Johnson
379,379,379,HB 2746,Relating to emergency services and rural fire prevention districts.,65751,Eric Johnson,author,77R,3345,Rep. Eric Johnson,Eric Johnson
380,380,380,HB 2800,Relating to the restoration of forfeited good conduct time.,65751,Eric Johnson,author,77R,3345,Rep. Eric Johnson,Eric Johnson
381,381,381,HCR 275,Memorializing the United States Congress to clarify its intent regarding U.S. Department of Veterans Affairs guidelines for veterans care in the several states.,65751,Eric Johnson,author,77R,3345,Rep. Eric Johnson,Eric Johnson
382,382,382,HJR 87,Proposing a constitutional amendment increasing the maximum tax rate allowed on property in emergency service and rural fire prevention districts.,65751,Eric Johnson,author,77R,3345,Rep. Eric Johnson,Eric Johnson
383,383,383,HR 359,Encouraging natural gas and energy suppliers to negotiate with agricultural producers to prevent disruption of utility services.,65751,Eric Johnson,author,77R,3345,Rep. Eric Johnson,Eric Johnson
384,384,384,HB 6,Relating to open-enrollment charter schools.,65751,Eric Johnson,coauthor,77R,3345,Rep. Eric Johnson,Eric Johnson
385,385,385,HB 12,Relating to a statewide group insurance program for employees and retirees of school districts.,65751,Eric Johnson,coauthor,77R,3345,Rep. Eric Johnson,Eric Johnson
386,386,386,HB 60,Relating to the punishment for theft committed against elderly individuals.,65751,Eric Johnson,coauthor,77R,3345,Rep. Eric Johnson,Eric Johnson
387,387,387,HB 181,Relating to the organizing of the house of representatives if the terms of house members are increased to four years.,65751,Eric Johnson,coauthor,77R,3345,Rep. Eric Johnson,Eric Johnson
388,388,388,HB 515,Relating to establishing a permanent fund for certain veterans' care purposes.,65751,Eric Johnson,coauthor,77R,3345,Rep. Eric Johnson,Eric Johnson
389,389,389,HB 587,"Relating to the investigation and prosecution of an offense motivated by bias or prejudice, to other civil and criminal remedies for and protections against certain hateful acts, and to training and education concerning hate laws.",65751,Eric Johnson,coauthor,77R,3345,Rep. Eric Johnson,Eric Johnson
390,390,390,HB 657,Relating to the amount of hazardous duty pay for certain state employees.,65751,Eric Johnson,coauthor,77R,3345,Rep. Eric Johnson,Eric Johnson
391,391,391,HB 660,Relating to career and technology education and training.,65751,Eric Johnson,coauthor,77R,3345,Rep. Eric Johnson,Eric Johnson
392,392,392,HB 686,Relating to designating September 25 as Bill of Rights Day.,65751,Eric Johnson,coauthor,77R,3345,Rep. Eric Johnson,Eric Johnson
393,393,393,HB 825,Relating to continuous eligibility of children for medical assistance.,65751,Eric Johnson,coauthor,77R,3345,Rep. Eric Johnson,Eric Johnson
394,394,394,HB 826,Relating to consideration of assets and resources for purposes of determining eligibility of children for Medicaid.,65751,Eric Johnson,coauthor,77R,3345,Rep. Eric Johnson,Eric Johnson
395,395,395,HB 827,Relating to simplifying the application and eligibility determination process for medical assistance provided to children.,65751,Eric Johnson,coauthor,77R,3345,Rep. Eric Johnson,Eric Johnson
396,396,396,HB 828,Relating to application and eligibility for Medicaid.,65751,Eric Johnson,coauthor,77R,3345,Rep. Eric Johnson,Eric Johnson
397,397,397,HB 1039,Relating to the ratification of the Southern Dairy Compact; providing civil penalties.,65751,Eric Johnson,coauthor,77R,3345,Rep. Eric Johnson,Eric Johnson
