Unnamed: 0,Unnamed: 0.1,Unnamed: 0.1.1,bill_name,caption,filer_id,filer_name,function,session,leg_id,original_name,parsed_name
419,419,419,HCR 144,Congratulating Shannon Wilson on being named a 2002-2003 Outstanding Teacher by the Fort Worth Independent School District.,-1,Kim Brimer,sponsor,78R,1100,Sen. Kim Brimer,Kim Brimer
420,420,420,HCR 145,Congratulating Jan Wilkins on being named a 2002-2003 Outstanding Teacher by the Fort Worth Independent School District.,-1,Kim Brimer,sponsor,78R,1100,Sen. Kim Brimer,Kim Brimer
421,421,421,HCR 146,Congratulating Kathy Elliott on being named a 2002-2003 Outstanding Teacher by the Fort Worth Independent School District.,-1,Kim Brimer,sponsor,78R,1100,Sen. Kim Brimer,Kim Brimer
422,422,422,HCR 147,Congratulating Jamie Cox on being named a 2002-2003 Outstanding Teacher by the Fort Worth Independent School District.,-1,Kim Brimer,sponsor,78R,1100,Sen. Kim Brimer,Kim Brimer
423,423,423,HCR 160,Congratulating the Everman High School boys' basketball team on winning the 2003 UIL Class 3A state championship.,-1,Kim Brimer,sponsor,78R,1100,Sen. Kim Brimer,Kim Brimer
424,424,424,HCR 169,Honoring Jorge Davila of Bishop Elementary School as one of the Everman Independent School District 2002-2003 Spelling Bee winners.,-1,Kim Brimer,sponsor,78R,1100,Sen. Kim Brimer,Kim Brimer
425,425,425,HCR 170,Honoring Courtney Sumner of Hommel Elementary School as one of the Everman Independent School District 2002-2003 Spelling Bee winners.,-1,Kim Brimer,sponsor,78R,1100,Sen. Kim Brimer,Kim Brimer
426,426,426,HCR 172,Honoring Shatonja Hudson of E. Ray Elementary School as one of the Everman Independent School District 2002-2003 Spelling Bee winners.,-1,Kim Brimer,sponsor,78R,1100,Sen. Kim Brimer,Kim Brimer
427,427,427,HCR 173,Honoring Rickey Wilson of Souder Elementary School as one of the Everman Independent School District 2002-2003 Spelling Bee winners.,-1,Kim Brimer,sponsor,78R,1100,Sen. Kim Brimer,Kim Brimer
428,428,428,HCR 174,Honoring Nathan Seaman of Everman Junior High School on being named Teacher of the Year.,-1,Kim Brimer,sponsor,78R,1100,Sen. Kim Brimer,Kim Brimer
429,429,429,HCR 175,Honoring Melanie DeGrand of Roger E. Souder Elementary School on being named Teacher of the Year.,-1,Kim Brimer,sponsor,78R,1100,Sen. Kim Brimer,Kim Brimer
430,430,430,HCR 176,Honoring Myra Asberry of E. Ray Elementary School on being named Teacher of the Year.,-1,Kim Brimer,sponsor,78R,1100,Sen. Kim Brimer,Kim Brimer
431,431,431,HCR 177,Honoring Mary Heidgerken of Alpha Hommel Elementary School on being named Teacher of the Year.,-1,Kim Brimer,sponsor,78R,1100,Sen. Kim Brimer,Kim Brimer
432,432,432,HCR 178,Honoring LuAnn Beck of J. W. Bishop Elementary School on being named Teacher of the Year.,-1,Kim Brimer,sponsor,78R,1100,Sen. Kim Brimer,Kim Brimer
433,433,433,HCR 179,Honoring Texas Cooperative Extension in Tarrant County for its community service.,-1,Kim Brimer,sponsor,78R,1100,Sen. Kim Brimer,Kim Brimer
434,434,434,HCR 180,Honoring E. Ray Elementary School of Fort Worth on being awarded recognized status by the Texas Education Agency for 2001-2002.,-1,Kim Brimer,sponsor,78R,1100,Sen. Kim Brimer,Kim Brimer
435,435,435,HCR 181,Honoring Roger E. Souder Elementary School of Everman on being awarded recognized status by the Texas Education Agency for 2001-2002.,-1,Kim Brimer,sponsor,78R,1100,Sen. Kim Brimer,Kim Brimer
436,436,436,HCR 182,Honoring J. W. Bishop Elementary School of Everman on being awarded recognized status by the Texas Education Agency for 2001-2002.,-1,Kim Brimer,sponsor,78R,1100,Sen. Kim Brimer,Kim Brimer
437,437,437,HCR 183,Honoring Alpha Hommel Elementary School of Everman on being awarded recognized status by the Texas Education Agency for 2001-2002.,-1,Kim Brimer,sponsor,78R,1100,Sen. Kim Brimer,Kim Brimer
438,438,438,HCR 184,Honoring Tyehimba Crear of Fort Worth for being named first place and grand prize winner of the Fort Worth Star-Telegram Race Against Drugs poster contest.,-1,Kim Brimer,sponsor,78R,1100,Sen. Kim Brimer,Kim Brimer
439,439,439,HCR 185,Honoring Wendy Lockwood of Everman Joe C. Bean High School on being named Teacher of the Year.,-1,Kim Brimer,sponsor,78R,1100,Sen. Kim Brimer,Kim Brimer
440,440,440,HCR 207,Honoring Gilda Molina Marquez of J. L. Long Middle School as Teacher of the Year.,-1,Kim Brimer,sponsor,78R,1100,Sen. Kim Brimer,Kim Brimer
441,441,441,HCR 212,Congratulating the Area II participants in the Fort Worth Independent School District's 2002 spelling bee contest.,-1,Kim Brimer,sponsor,78R,1100,Sen. Kim Brimer,Kim Brimer
442,442,442,HCR 213,"Honoring Monica DeSantiago and Arthur Moore, Area II champion and runner-up in the Fort Worth Independent School District 2003 spelling bee.",-1,Kim Brimer,sponsor,78R,1100,Sen. Kim Brimer,Kim Brimer
443,443,443,HCR 214,Honoring Alexis Whiteside and Shonte Roberts for their achievements in the Fort Worth Independent School District 2003 spelling bee.,-1,Kim Brimer,sponsor,78R,1100,Sen. Kim Brimer,Kim Brimer
444,444,444,HCR 215,"Honoring Vanessa Norris and James Kemp, Area III champion and runner-up in the Fort Worth Independent School District 2003 spelling bee.",-1,Kim Brimer,sponsor,78R,1100,Sen. Kim Brimer,Kim Brimer
445,445,445,HCR 216,Congratulating the Area III participants in the Fort Worth Independent School District's 2002 spelling bee contest.,-1,Kim Brimer,sponsor,78R,1100,Sen. Kim Brimer,Kim Brimer
446,446,446,HCR 217,Congratulating the Fort Worth Ambassadors of Christ Christian Academy boys' basketball team on winning the 2002-2003 TAPPS Class 1A state title.,-1,Kim Brimer,sponsor,78R,1100,Sen. Kim Brimer,Kim Brimer
447,447,447,HCR 222,"Designating April 29, 2003, as Dale Earnhardt Day in Texas.",-1,Kim Brimer,sponsor,78R,1100,Sen. Kim Brimer,Kim Brimer
448,448,448,HCR 234,"Honoring Morningside Elementary School as a ""recognized school.""",-1,Kim Brimer,sponsor,78R,1100,Sen. Kim Brimer,Kim Brimer
449,449,449,HCR 235,"Honoring Harlean Beal Elementary School as a ""recognized school.""",-1,Kim Brimer,sponsor,78R,1100,Sen. Kim Brimer,Kim Brimer
450,450,450,HCR 236,"Honoring Mitchell Boulevard Elementary School as a ""recognized school.""",-1,Kim Brimer,sponsor,78R,1100,Sen. Kim Brimer,Kim Brimer
451,451,451,HCR 237,"Honoring Christene Moss Elementary School as a ""recognized school.""",-1,Kim Brimer,sponsor,78R,1100,Sen. Kim Brimer,Kim Brimer
452,452,452,HCR 238,"Honoring A. M. Pate Elementary School as a ""recognized school.""",-1,Kim Brimer,sponsor,78R,1100,Sen. Kim Brimer,Kim Brimer
453,453,453,HCR 239,"Honoring David K. Sellars Elementary School as a ""recognized school.""",-1,Kim Brimer,sponsor,78R,1100,Sen. Kim Brimer,Kim Brimer
454,454,454,HCR 240,"Honoring Maudrie Walton Elementary School as a ""recognized school.""",-1,Kim Brimer,sponsor,78R,1100,Sen. Kim Brimer,Kim Brimer
455,455,455,HCR 241,"Honoring Van Zandt-Guinn Elementary School as an ""exemplary school.""",-1,Kim Brimer,sponsor,78R,1100,Sen. Kim Brimer,Kim Brimer
456,456,456,HCR 242,"Honoring East Handley Elementary School as an ""exemplary school.""",-1,Kim Brimer,sponsor,78R,1100,Sen. Kim Brimer,Kim Brimer
457,457,457,HCR 243,"Honoring Edward J. Briscoe Elementary School as an ""exemplary school.""",-1,Kim Brimer,sponsor,78R,1100,Sen. Kim Brimer,Kim Brimer
458,458,458,HCR 244,Congratulating Deralyn Riles Davis of Fort Worth on the 50th anniversary of her graduation from Huston-Tillotson College.,-1,Kim Brimer,sponsor,78R,1100,Sen. Kim Brimer,Kim Brimer
459,459,459,HCR 253,Honoring track and field legend Jim Hines for his remarkable athletic achievements.,-1,Kim Brimer,sponsor,78R,1100,Sen. Kim Brimer,Kim Brimer
460,460,460,HCR 262,Honoring Bob and Betty Stewart of Bedford on their 50th wedding anniversary.,-1,Kim Brimer,sponsor,78R,1100,Sen. Kim Brimer,Kim Brimer
461,461,461,HJR 54,Proposing a constitutional amendment providing that certain benefits in certain public retirement systems may not be reduced or impaired.,-1,Kim Brimer,sponsor,78R,1100,Sen. Kim Brimer,Kim Brimer
