Unnamed: 0,Unnamed: 0.1,Unnamed: 0.1.1,bill_name,caption,filer_id,filer_name,function,session,leg_id,original_name,parsed_name
244,244,244,SB 622,Relating to the privacy of protected health information; providing administrative and civil penalties.,41354,Lois Kolkhorst,sponsor,82R,3495,Rep. Lois W. Kolkhorst,Lois Kolkhorst
245,245,245,SB 731,Relating to the attorney general's legal sufficiency review of a comprehensive development agreement.,41354,Lois Kolkhorst,sponsor,82R,3495,Rep. Lois W. Kolkhorst,Lois Kolkhorst
246,246,246,SB 901,Relating to approval from the Department of State Health Services for disposal of ambulances purchased with certain grant funds.,41354,Lois Kolkhorst,sponsor,82R,3495,Rep. Lois W. Kolkhorst,Lois Kolkhorst
247,247,247,SB 969,Relating to the establishment of the Public Health Funding and Policy Committee within the Department of State Health Services.,41354,Lois Kolkhorst,sponsor,82R,3495,Rep. Lois W. Kolkhorst,Lois Kolkhorst
248,248,248,SB 1265,Relating to the accreditation of paramedic training programs.,41354,Lois Kolkhorst,sponsor,82R,3495,Rep. Lois W. Kolkhorst,Lois Kolkhorst
249,249,249,SB 14,"Relating to requirements to vote, including presenting proof of identification; providing criminal penalties.",41354,Lois Kolkhorst,cosponsor,82R,3495,Rep. Lois W. Kolkhorst,Lois Kolkhorst
250,250,250,SB 24,"Relating to the prosecution, punishment, and certain criminal and civil consequences of offenses involving or related to the trafficking of persons and to certain protections for victims of those offenses.",41354,Lois Kolkhorst,cosponsor,82R,3495,Rep. Lois W. Kolkhorst,Lois Kolkhorst
251,251,251,SB 257,"Relating to the issuance of ""Choose Life"" license plates and the creation of the Choose Life account in the general revenue fund.",41354,Lois Kolkhorst,cosponsor,82R,3495,Rep. Lois W. Kolkhorst,Lois Kolkhorst
252,252,252,SB 371,Relating to the eligibility for service retirement annuities of certain elected officials convicted of certain crimes.,41354,Lois Kolkhorst,cosponsor,82R,3495,Rep. Lois W. Kolkhorst,Lois Kolkhorst
253,253,253,HB 500,Relating to a temporary prohibition on increasing the market value of certain parcels of real property for ad valorem tax purposes following determination of a protest or appeal.,41354,Lois Kolkhorst,author,81R,3495,Rep. Lois W. Kolkhorst,Lois Kolkhorst
254,254,254,HB 504,Relating to the creation of an offense for a parent's contribution to a child's failure to comply with a sentence or court order relating to a disruptive activity or disruption of class on school property.,41354,Lois Kolkhorst,author,81R,3495,Rep. Lois W. Kolkhorst,Lois Kolkhorst
255,255,255,HB 508,Relating to a study of the effect on this state's economy of replacing all state and school district ad valorem tax revenue with revenue from a transaction tax.,41354,Lois Kolkhorst,author,81R,3495,Rep. Lois W. Kolkhorst,Lois Kolkhorst
256,256,256,HB 518,"Relating to programs to provide student loan repayment assistance for certain correctional officers, for certain speech-language pathologists and audiologists, and for certain mathematics and science teachers.",41354,Lois Kolkhorst,author,81R,3495,Rep. Lois W. Kolkhorst,Lois Kolkhorst
257,257,257,HB 768,Relating to the requirement that a new road ordered by the commissioners court of a county be laid out by a jury of view.,41354,Lois Kolkhorst,author,81R,3495,Rep. Lois W. Kolkhorst,Lois Kolkhorst
258,258,258,HB 1079,Relating to the appellate process for the community development block grant program.,41354,Lois Kolkhorst,author,81R,3495,Rep. Lois W. Kolkhorst,Lois Kolkhorst
259,259,259,HB 1187,Relating to the membership of the board of managers for certain emergency communication districts.,41354,Lois Kolkhorst,author,81R,3495,Rep. Lois W. Kolkhorst,Lois Kolkhorst
260,260,260,HB 1259,Relating to hiring outside legal counsel to provide legal services to the Teacher Retirement System of Texas.,41354,Lois Kolkhorst,author,81R,3495,Rep. Lois W. Kolkhorst,Lois Kolkhorst
261,261,261,HB 1273,Relating to reporting of and an adjustment under the school finance system for benefits received by school districts or associated foundations or other entities in connection with agreements under the Texas Economic Development Act.,41354,Lois Kolkhorst,author,81R,3495,Rep. Lois W. Kolkhorst,Lois Kolkhorst
262,262,262,HB 1274,Relating to the availability and reporting of certain information regarding applications under the Texas Economic Development Act to the public and the state.,41354,Lois Kolkhorst,author,81R,3495,Rep. Lois W. Kolkhorst,Lois Kolkhorst
263,263,263,HB 1275,Relating to the authority to impose a county hotel occupancy tax.,41354,Lois Kolkhorst,author,81R,3495,Rep. Lois W. Kolkhorst,Lois Kolkhorst
264,264,264,HB 1463,Relating to the authority of the Public Utility Commission of Texas to order certain electric providers to provide power to other electric providers during a natural disaster or declared emergency.,41354,Lois Kolkhorst,author,81R,3495,Rep. Lois W. Kolkhorst,Lois Kolkhorst
265,265,265,HB 1464,Relating to the right of certain municipalities to offer electric services within the service area of another certificate holder.,41354,Lois Kolkhorst,author,81R,3495,Rep. Lois W. Kolkhorst,Lois Kolkhorst
266,266,266,HB 1865,"Relating to the penalties for theft of cattle, horses, exotic livestock, exotic fowl, sheep, swine, or goats.",41354,Lois Kolkhorst,author,81R,3495,Rep. Lois W. Kolkhorst,Lois Kolkhorst
267,267,267,HB 1915,Relating to authorizing the issuance of revenue bonds for capital projects at Sam Houston State University.,41354,Lois Kolkhorst,author,81R,3495,Rep. Lois W. Kolkhorst,Lois Kolkhorst
268,268,268,HB 1916,Relating to authorizing the issuance of revenue bonds for capital projects at Sam Houston State University.,41354,Lois Kolkhorst,author,81R,3495,Rep. Lois W. Kolkhorst,Lois Kolkhorst
269,269,269,HB 2033,Relating to the regulation of polygraph examiners by the Texas Department of Licensing and Regulation and the abolition of the Polygraph Examiners Board.,41354,Lois Kolkhorst,author,81R,3495,Rep. Lois W. Kolkhorst,Lois Kolkhorst
270,270,270,HB 2034,Relating to the issuance of certain search warrants by certain municipal courts.,41354,Lois Kolkhorst,author,81R,3495,Rep. Lois W. Kolkhorst,Lois Kolkhorst
271,271,271,HB 2379,Relating to the establishment of an adult stem cell research program.,41354,Lois Kolkhorst,author,81R,3495,Rep. Lois W. Kolkhorst,Lois Kolkhorst
272,272,272,HB 2380,"Relating to adverse licensing, listing, or registration decisions by certain health and human services agencies.",41354,Lois Kolkhorst,author,81R,3495,Rep. Lois W. Kolkhorst,Lois Kolkhorst
273,273,273,HB 2381,Relating to disclosure of the prices charged to state agencies in connection with pharmacy benefit manager services.,41354,Lois Kolkhorst,author,81R,3495,Rep. Lois W. Kolkhorst,Lois Kolkhorst
274,274,274,HB 2382,Relating to information submitted to and maintained in the immunization registry after an individual becomes an adult.,41354,Lois Kolkhorst,author,81R,3495,Rep. Lois W. Kolkhorst,Lois Kolkhorst
275,275,275,HB 2383,Relating to the receipt and release of immunization information by the immunization registry in connection with a disaster.,41354,Lois Kolkhorst,author,81R,3495,Rep. Lois W. Kolkhorst,Lois Kolkhorst
276,276,276,HB 2384,Relating to certain mammography systems that fail certification standards.,41354,Lois Kolkhorst,author,81R,3495,Rep. Lois W. Kolkhorst,Lois Kolkhorst
277,277,277,HB 2472,Relating to persons authorized to perform a marriage ceremony.,41354,Lois Kolkhorst,author,81R,3495,Rep. Lois W. Kolkhorst,Lois Kolkhorst
278,278,278,HB 2473,"Relating to the composition of the First, Tenth, and Fourteenth Courts of Appeals Districts.",41354,Lois Kolkhorst,author,81R,3495,Rep. Lois W. Kolkhorst,Lois Kolkhorst
279,279,279,HB 2504,"Relating to requiring a public institution of higher education to establish uniform standards for publishing cost of attendance information, to conduct student course evaluations of faculty, and to make certain information available on the Internet.",41354,Lois Kolkhorst,author,81R,3495,Rep. Lois W. Kolkhorst,Lois Kolkhorst
280,280,280,HB 2505,Relating to the rates and imposition of the state sales and franchise taxes and to the allocation of certain revenue.,41354,Lois Kolkhorst,author,81R,3495,Rep. Lois W. Kolkhorst,Lois Kolkhorst
281,281,281,HB 2730,Relating to the continuation and functions of the Department of Public Safety of the State of Texas and the Texas Private Security Board; providing a penalty.,41354,Lois Kolkhorst,author,81R,3495,Rep. Lois W. Kolkhorst,Lois Kolkhorst
282,282,282,HB 2736,Relating to approval and certification of certain comprehensive development agreements.,41354,Lois Kolkhorst,author,81R,3495,Rep. Lois W. Kolkhorst,Lois Kolkhorst
283,283,283,HB 2746,"Relating to the establishment of the School of Ethics, Western Civilization, and American Traditions at The University of Texas at Austin.",41354,Lois Kolkhorst,author,81R,3495,Rep. Lois W. Kolkhorst,Lois Kolkhorst
284,284,284,HB 3299,Relating to ensuring that health information technology used in the medical assistance and child health plan programs conforms to certain standards.,41354,Lois Kolkhorst,author,81R,3495,Rep. Lois W. Kolkhorst,Lois Kolkhorst
285,285,285,HB 3300,Relating to the use of electronic prescribing data transmission systems under the state Medicaid program.,41354,Lois Kolkhorst,author,81R,3495,Rep. Lois W. Kolkhorst,Lois Kolkhorst
286,286,286,HB 3301,Relating to a health passport for Medicaid recipients.,41354,Lois Kolkhorst,author,81R,3495,Rep. Lois W. Kolkhorst,Lois Kolkhorst
287,287,287,HB 3665,Relating to the review of a Medicaid recipient's electronic medication history by a Medicaid provider.,41354,Lois Kolkhorst,author,81R,3495,Rep. Lois W. Kolkhorst,Lois Kolkhorst
288,288,288,HB 3666,Relating to the application for and issuance of a marriage license.,41354,Lois Kolkhorst,author,81R,3495,Rep. Lois W. Kolkhorst,Lois Kolkhorst
289,289,289,HB 4438,Relating to the transfer of certain state property from the Texas Department of Criminal Justice to the Texas Forest Service.,41354,Lois Kolkhorst,author,81R,3495,Rep. Lois W. Kolkhorst,Lois Kolkhorst
290,290,290,HB 4439,Relating to the transmission of information regarding public school students through the use of radio frequency identification technology.,41354,Lois Kolkhorst,author,81R,3495,Rep. Lois W. Kolkhorst,Lois Kolkhorst
291,291,291,HB 4440,Relating to a study by the attorney general of the effects on state law and authority of certain international and other agreements and bodies.,41354,Lois Kolkhorst,author,81R,3495,Rep. Lois W. Kolkhorst,Lois Kolkhorst
292,292,292,HB 4471,Relating to the professional nursing shortage reduction program.,41354,Lois Kolkhorst,author,81R,3495,Rep. Lois W. Kolkhorst,Lois Kolkhorst
293,293,293,HB 4596,"Relating to certain contracts between pharmacy benefit managers and the Employees Retirement System of Texas, the Teacher Retirement System of Texas, The Texas A&M University System, or The University of Texas System.",41354,Lois Kolkhorst,author,81R,3495,Rep. Lois W. Kolkhorst,Lois Kolkhorst
294,294,294,HCR 49,Designating the Burton Cotton Gin & Museum as the official Cotton Gin Museum of Texas.,41354,Lois Kolkhorst,author,81R,3495,Rep. Lois W. Kolkhorst,Lois Kolkhorst
295,295,295,HCR 71,Designating the Burton Cotton Gin & Museum as the official Cotton Gin Museum of Texas.,41354,Lois Kolkhorst,author,81R,3495,Rep. Lois W. Kolkhorst,Lois Kolkhorst
296,296,296,HCR 293,Instructing the enrolling clerk of the house to make corrections in H.B. No. 2730.,41354,Lois Kolkhorst,author,81R,3495,Rep. Lois W. Kolkhorst,Lois Kolkhorst
297,297,297,HR 476,"Recognizing February 17, 2009, as Sheriffs' Association of Texas Day at the State Capitol.",41354,Lois Kolkhorst,author,81R,3495,Rep. Lois W. Kolkhorst,Lois Kolkhorst
298,298,298,HR 511,"Recognizing February 19, 2009, as Austin County Day at the State Capitol.",41354,Lois Kolkhorst,author,81R,3495,Rep. Lois W. Kolkhorst,Lois Kolkhorst
299,299,299,HR 550,In memory of Hester Smith Lockett of Brenham.,41354,Lois Kolkhorst,author,81R,3495,Rep. Lois W. Kolkhorst,Lois Kolkhorst
300,300,300,HR 561,"Recognizing February 24, 2009, as Washington County Day at the State Capitol.",41354,Lois Kolkhorst,author,81R,3495,Rep. Lois W. Kolkhorst,Lois Kolkhorst
301,301,301,HR 562,In memory of Harold Roger Luhn of Bellville.,41354,Lois Kolkhorst,author,81R,3495,Rep. Lois W. Kolkhorst,Lois Kolkhorst
302,302,302,HR 585,Recognizing the Texas Leadership Institute for its outstanding contributions to communities across the state.,41354,Lois Kolkhorst,author,81R,3495,Rep. Lois W. Kolkhorst,Lois Kolkhorst
303,303,303,HR 586,"Commending members of the American Federation of State, County and Municipal Employees Corrections Council 7 for their Hurricane Ike relief efforts.",41354,Lois Kolkhorst,author,81R,3495,Rep. Lois W. Kolkhorst,Lois Kolkhorst
304,304,304,HR 587,Congratulating the Blinn College Lady Buccaneers volleyball team on winning the 2008 NJCAA Division 1 national championship.,41354,Lois Kolkhorst,author,81R,3495,Rep. Lois W. Kolkhorst,Lois Kolkhorst
305,305,305,HR 588,In memory of Joseph Alan Stivers of Huntsville.,41354,Lois Kolkhorst,author,81R,3495,Rep. Lois W. Kolkhorst,Lois Kolkhorst
306,306,306,HR 613,Congratulating Bonnie Blum of Bellville ISD on being named Region 6 Education Service Center Teacher of the Year for 2008-2009 and on receiving the 2009 Suzan and Julius Glickman Teaching Award from the Texas Exes.,41354,Lois Kolkhorst,author,81R,3495,Rep. Lois W. Kolkhorst,Lois Kolkhorst
307,307,307,HR 614,"Commending James ""Buddy"" Reynolds for his service as Walker County commissioner.",41354,Lois Kolkhorst,author,81R,3495,Rep. Lois W. Kolkhorst,Lois Kolkhorst
308,308,308,HR 615,"Recognizing February 25, 2009, as Substance Abuse Prevention and Treatment Advocacy Day at the State Capitol.",41354,Lois Kolkhorst,author,81R,3495,Rep. Lois W. Kolkhorst,Lois Kolkhorst
309,309,309,HR 616,"Recognizing March 5, 2009, as Grimes County Day at the State Capitol.",41354,Lois Kolkhorst,author,81R,3495,Rep. Lois W. Kolkhorst,Lois Kolkhorst
310,310,310,HR 688,Commemorating the 216th anniversary of the birth of Sam Houston.,41354,Lois Kolkhorst,author,81R,3495,Rep. Lois W. Kolkhorst,Lois Kolkhorst
311,311,311,HR 1037,Congratulating Sally Van Dyke on being named 2008 Woman of the Year by the Washington County Chamber of Commerce/Economic Development Foundation.,41354,Lois Kolkhorst,author,81R,3495,Rep. Lois W. Kolkhorst,Lois Kolkhorst
312,312,312,HR 1038,Congratulating Morris Johnson on his selection as the 2008 Citizen of the Year by the Huntsville-Walker County Chamber of Commerce.,41354,Lois Kolkhorst,author,81R,3495,Rep. Lois W. Kolkhorst,Lois Kolkhorst
313,313,313,HR 1039,Congratulating Becky Bader on being named the 2008 Citizen of the Year by the Bellville Lions Club.,41354,Lois Kolkhorst,author,81R,3495,Rep. Lois W. Kolkhorst,Lois Kolkhorst
314,314,314,HR 1040,Congratulating Mike Hopkins on being named 2008 Man of the Year by the Washington County Chamber of Commerce/Economic Development Foundation.,41354,Lois Kolkhorst,author,81R,3495,Rep. Lois W. Kolkhorst,Lois Kolkhorst
315,315,315,HR 1143,Commemorating the 119th annual Brenham Maifest and honoring the celebration's junior and senior royalty.,41354,Lois Kolkhorst,author,81R,3495,Rep. Lois W. Kolkhorst,Lois Kolkhorst
316,316,316,HR 1255,"Recognizing April 8, 2009, as Start! Day at the Capitol.",41354,Lois Kolkhorst,author,81R,3495,Rep. Lois W. Kolkhorst,Lois Kolkhorst
317,317,317,HR 1765,Honoring the Texas Transportation Institute's Teens in the Driver Seat program.,41354,Lois Kolkhorst,author,81R,3495,Rep. Lois W. Kolkhorst,Lois Kolkhorst
318,318,318,HR 2030,"Commemorating May 12, 2009, as Texas EMS Trauma & Acute Care Foundation Day at the Capitol.",41354,Lois Kolkhorst,author,81R,3495,Rep. Lois W. Kolkhorst,Lois Kolkhorst
319,319,319,HR 2245,Honoring Richard Stadelmann of Brenham on the occasion of his retirement as associate professor of philosophy at Texas A&M University.,41354,Lois Kolkhorst,author,81R,3495,Rep. Lois W. Kolkhorst,Lois Kolkhorst
320,320,320,HR 2246,In memory of Mary Jane Krueger of Bellville.,41354,Lois Kolkhorst,author,81R,3495,Rep. Lois W. Kolkhorst,Lois Kolkhorst
321,321,321,HR 2510,In memory of U.S. Marine Corps Lance Corporal Bobby Lee Twitty of Bedias.,41354,Lois Kolkhorst,author,81R,3495,Rep. Lois W. Kolkhorst,Lois Kolkhorst
322,322,322,HR 2807,Congratulating Joe Clements of Huntsville on receiving the Mance Park Lifetime Achievement Award from the Huntsville-Walker County Chamber of Commerce.,41354,Lois Kolkhorst,author,81R,3495,Rep. Lois W. Kolkhorst,Lois Kolkhorst
323,323,323,HR 2808,Congratulating Johnnie and Joyce Shupak of Frelsburg on being named the 2008 Citizens of the Year by the New Ulm Chamber of Commerce.,41354,Lois Kolkhorst,author,81R,3495,Rep. Lois W. Kolkhorst,Lois Kolkhorst
324,324,324,HB 11,Relating to repeal of authority for the establishment and operation of the Trans-Texas Corridor.,41354,Lois Kolkhorst,author,81R,3495,Rep. Lois W. Kolkhorst,Lois Kolkhorst
325,325,325,HB 233,Relating to the creation of an advisory committee to establish and recommend qualifications for certain health care translators and interpreters.,41354,Lois Kolkhorst,author,81R,3495,Rep. Lois W. Kolkhorst,Lois Kolkhorst
326,326,326,HB 339,Relating to driver education and driver's licensing requirements.,41354,Lois Kolkhorst,author,81R,3495,Rep. Lois W. Kolkhorst,Lois Kolkhorst
327,327,327,HB 425,Relating to a prohibition against changing the name of certain public institutions of higher education that are named after state historical figures.,41354,Lois Kolkhorst,author,81R,3495,Rep. Lois W. Kolkhorst,Lois Kolkhorst
328,328,328,HB 492,Relating to the expansion of faith- and community-based health and human services and social services initiatives.,41354,Lois Kolkhorst,author,81R,3495,Rep. Lois W. Kolkhorst,Lois Kolkhorst
329,329,329,HB 1348,Relating to initial claims under the unemployment compensation system.,41354,Lois Kolkhorst,author,81R,3495,Rep. Lois W. Kolkhorst,Lois Kolkhorst
330,330,330,HB 1358,Relating to the Cancer Prevention and Research Institute of Texas.,41354,Lois Kolkhorst,author,81R,3495,Rep. Lois W. Kolkhorst,Lois Kolkhorst
331,331,331,HB 1410,Relating to student information required to be provided at the time of enrollment in public schools.,41354,Lois Kolkhorst,author,81R,3495,Rep. Lois W. Kolkhorst,Lois Kolkhorst
332,332,332,HB 1580,Relating to the continuation and functions of the board of directors of the official cotton growers' boll weevil eradication foundation and the management of certain cotton in pest management zones.,41354,Lois Kolkhorst,author,81R,3495,Rep. Lois W. Kolkhorst,Lois Kolkhorst
333,333,333,HB 1583,Relating to the abolishment of the Office of State-Federal Relations as an independent agency and the transfer of the duties and functions of that agency to the office of the governor.,41354,Lois Kolkhorst,author,81R,3495,Rep. Lois W. Kolkhorst,Lois Kolkhorst
334,334,334,HB 1893,Relating to the carrying of concealed handguns on the campuses of institutions of higher education.,41354,Lois Kolkhorst,author,81R,3495,Rep. Lois W. Kolkhorst,Lois Kolkhorst
335,335,335,HB 2447,Relating to the abolition of the Board of Tax Professional Examiners and the transfer of its functions to the Texas Department of Licensing and Regulation.,41354,Lois Kolkhorst,author,81R,3495,Rep. Lois W. Kolkhorst,Lois Kolkhorst
336,336,336,HB 2471,Relating to career and technical education in the public schools and high school graduation requirements.,41354,Lois Kolkhorst,author,81R,3495,Rep. Lois W. Kolkhorst,Lois Kolkhorst
337,337,337,HB 3106,Relating to the amount of hazardous duty pay for certain employees of the Texas Department of Criminal Justice.,41354,Lois Kolkhorst,author,81R,3495,Rep. Lois W. Kolkhorst,Lois Kolkhorst
338,338,338,HB 3322,Relating to participation in an animal identification system.,41354,Lois Kolkhorst,author,81R,3495,Rep. Lois W. Kolkhorst,Lois Kolkhorst
339,339,339,HB 3445,Relating to requirements governing registration and authorized activities of certain lobbyists.,41354,Lois Kolkhorst,author,81R,3495,Rep. Lois W. Kolkhorst,Lois Kolkhorst
340,340,340,HB 3456,Relating to the education and preparation of resident physicians.,41354,Lois Kolkhorst,author,81R,3495,Rep. Lois W. Kolkhorst,Lois Kolkhorst
341,341,341,HB 3611,Relating to the consolidation of appraisal review boards.,41354,Lois Kolkhorst,author,81R,3495,Rep. Lois W. Kolkhorst,Lois Kolkhorst
342,342,342,HB 3676,Relating to the Texas Economic Development Act.,41354,Lois Kolkhorst,author,81R,3495,Rep. Lois W. Kolkhorst,Lois Kolkhorst
343,343,343,HB 3689,Relating to the functions and continuation of the Texas Youth Commission and the Texas Juvenile Probation Commission and to the functions of the Office of Independent Ombudsman for the Texas Youth Commission.,41354,Lois Kolkhorst,author,81R,3495,Rep. Lois W. Kolkhorst,Lois Kolkhorst
344,344,344,HB 3796,Relating to informed and voluntary consent for an abortion and the collection and reporting of information related to the performance of an abortion; providing penalties.,41354,Lois Kolkhorst,author,81R,3495,Rep. Lois W. Kolkhorst,Lois Kolkhorst
345,345,345,HB 5,Relating to the elimination of smoking in all workplaces and public places; providing penalties.,41354,Lois Kolkhorst,coauthor,81R,3495,Rep. Lois W. Kolkhorst,Lois Kolkhorst
346,346,346,HB 36,Relating to informed consent to an abortion.,41354,Lois Kolkhorst,coauthor,81R,3495,Rep. Lois W. Kolkhorst,Lois Kolkhorst
347,347,347,HB 109,"Relating to the issuance of ""Choose Life"" license plates and the creation of the Choose Life account in the general revenue fund.",41354,Lois Kolkhorst,coauthor,81R,3495,Rep. Lois W. Kolkhorst,Lois Kolkhorst
348,348,348,HB 125,Relating to requiring a voter to present proof of identification.,41354,Lois Kolkhorst,coauthor,81R,3495,Rep. Lois W. Kolkhorst,Lois Kolkhorst
349,349,349,HB 1039,Relating to the creation of county databases containing information on county expenditures.,41354,Lois Kolkhorst,coauthor,81R,3495,Rep. Lois W. Kolkhorst,Lois Kolkhorst
350,350,350,HB 1483,Relating to the use of eminent domain authority.,41354,Lois Kolkhorst,coauthor,81R,3495,Rep. Lois W. Kolkhorst,Lois Kolkhorst
351,351,351,HB 1715,"Relating to the establishment of the Texas Rural Development Fund and to the establishment, operation, and funding of certain programs for rural economic development.",41354,Lois Kolkhorst,coauthor,81R,3495,Rep. Lois W. Kolkhorst,Lois Kolkhorst
352,352,352,HB 2070,Relating to the fee based on admissions to certain sexually oriented businesses.,41354,Lois Kolkhorst,coauthor,81R,3495,Rep. Lois W. Kolkhorst,Lois Kolkhorst
353,353,353,HB 2083,Relating to determination of state contributions for participation by certain junior college employees in the state employees group benefits program.,41354,Lois Kolkhorst,coauthor,81R,3495,Rep. Lois W. Kolkhorst,Lois Kolkhorst
354,354,354,HB 3820,Relating to the governance and disclosure requirements of electric cooperative corporations and the review of complaints of electric cooperative corporation members by the Office of the Attorney General.,41354,Lois Kolkhorst,coauthor,81R,3495,Rep. Lois W. Kolkhorst,Lois Kolkhorst
355,355,355,HB 4009,"Relating to the provision of services to certain persons involved in, and the prosecution, punishment, and prevention of, offenses involving trafficking of persons or certain forced or sex-based labor or services, and to law enforcement training related to offenses involving that trafficking.",41354,Lois Kolkhorst,coauthor,81R,3495,Rep. Lois W. Kolkhorst,Lois Kolkhorst
356,356,356,HCR 50,"Affirming that the State of Texas claims sovereignty under the Tenth Amendment to the Constitution of the United States over all powers not otherwise enumerated and granted to the federal government by the U.S. Constitution, serving notice to the federal government to cease and desist certain mandates, and providing that certain federal legislation be prohibited or repealed.",41354,Lois Kolkhorst,coauthor,81R,3495,Rep. Lois W. Kolkhorst,Lois Kolkhorst
357,357,357,HCR 258,Urging the University of Houston and other institutions of higher education to cease displaying the flag of the Socialist Republic of Vietnam and to replace it with the Freedom and Heritage Flag.,41354,Lois Kolkhorst,coauthor,81R,3495,Rep. Lois W. Kolkhorst,Lois Kolkhorst
358,358,358,HJR 39,Post-ratifying Amendment XXIV to the Constitution of the United States prohibiting the denial or abridgment of the right to vote for failure to pay any poll tax or other tax.,41354,Lois Kolkhorst,coauthor,81R,3495,Rep. Lois W. Kolkhorst,Lois Kolkhorst
359,359,359,HR 454,"Recognizing April 16, 2009, as Texas Federation of Republican Women Day at the Capitol.",41354,Lois Kolkhorst,coauthor,81R,3495,Rep. Lois W. Kolkhorst,Lois Kolkhorst
360,360,360,HR 1699,Recognizing the Texas A&M University Agricultural and Natural Resources Policy Internship Program and Public Policy Internship Program and the interns for the 81st legislative session.,41354,Lois Kolkhorst,coauthor,81R,3495,Rep. Lois W. Kolkhorst,Lois Kolkhorst
361,361,361,SB 7,Relating to strategies for and improvements in quality of health care and care management provided through health care facilities and through the child health plan and medical assistance programs designed to improve health outcomes.,41354,Lois Kolkhorst,sponsor,81R,3495,Rep. Lois W. Kolkhorst,Lois Kolkhorst
362,362,362,SB 8,"Relating to the administration, powers, and duties of the Texas Health Services Authority.",41354,Lois Kolkhorst,sponsor,81R,3495,Rep. Lois W. Kolkhorst,Lois Kolkhorst
