Unnamed: 0,Unnamed: 0.1,Unnamed: 0.1.1,bill_name,caption,filer_id,filer_name,function,session,leg_id,original_name,parsed_name
0,0,0,SB 188,Relating to a promise to appear in court for speeding offenses.,-1,Kim Brimer,author,80R,1100,Sen. Kim Brimer,Kim Brimer
1,1,1,SB 189,Relating to the amount of sick leave for police officers employed by certain municipalities.,-1,Kim Brimer,author,80R,1100,Sen. Kim Brimer,Kim Brimer
2,2,2,SB 190,Relating to sales and use tax information provided by the comptroller of public accounts to certain municipalities.,-1,Kim Brimer,author,80R,1100,Sen. Kim Brimer,Kim Brimer
3,3,3,SB 191,Relating to the demolition of certain sports and community venues.,-1,Kim Brimer,author,80R,1100,Sen. Kim Brimer,Kim Brimer
4,4,4,SB 192,Relating to the Texas Mutual Insurance Company and the application of certain statutes to the Texas Mutual Insurance Company.,-1,Kim Brimer,author,80R,1100,Sen. Kim Brimer,Kim Brimer
5,5,5,SB 193,Relating to reservations of the state ceiling and priority carryforward classifications for certain projects under the private activity bond allocation program.,-1,Kim Brimer,author,80R,1100,Sen. Kim Brimer,Kim Brimer
6,6,6,SB 246,Relating to the management and maintenance of certain land located south of the Sam Houston Building by the State Preservation Board.,-1,Kim Brimer,author,80R,1100,Sen. Kim Brimer,Kim Brimer
7,7,7,SB 259,"Relating to the creation, purpose, implementation, and funding of the County Park Beautification and Improvement Program.",-1,Kim Brimer,author,80R,1100,Sen. Kim Brimer,Kim Brimer
8,8,8,SB 317,"Relating to allowing the State Preservation Board to purchase, lease, or maintain indoor plants for the Capitol or Capitol extension.",-1,Kim Brimer,author,80R,1100,Sen. Kim Brimer,Kim Brimer
9,9,9,SB 336,Relating to the notice required for the lease of real property by certain counties when responding to particular emergency circumstances.,-1,Kim Brimer,author,80R,1100,Sen. Kim Brimer,Kim Brimer
10,10,10,SB 469,Relating to the creation by the Texas Higher Education Coordinating Board of a certificate of recognition for persons who contribute certain gifts or donations to public institutions of higher education.,-1,Kim Brimer,author,80R,1100,Sen. Kim Brimer,Kim Brimer
11,11,11,SB 470,Relating to the submission of uniform financial reports.,-1,Kim Brimer,author,80R,1100,Sen. Kim Brimer,Kim Brimer
12,12,12,SB 471,Relating to certain information reporting requirements regarding workers' compensation claims.,-1,Kim Brimer,author,80R,1100,Sen. Kim Brimer,Kim Brimer
13,13,13,SB 472,Relating to the application of the sales and use tax to the transfer of certain tangible personal property.,-1,Kim Brimer,author,80R,1100,Sen. Kim Brimer,Kim Brimer
14,14,14,SB 572,Relating to the eligibility for unemployment benefits of individuals who are unemployed due to certain labor disputes.,-1,Kim Brimer,author,80R,1100,Sen. Kim Brimer,Kim Brimer
15,15,15,SB 573,Relating to an interim study concerning the breeding of white-tailed and mule deer in this state.,-1,Kim Brimer,author,80R,1100,Sen. Kim Brimer,Kim Brimer
16,16,16,SB 574,Relating to deer breeding operations; providing a penalty.,-1,Kim Brimer,author,80R,1100,Sen. Kim Brimer,Kim Brimer
17,17,17,SB 818,"Relating to participation and credit in, contributions to, and benefits and administration of the Texas County and District Retirement System.",-1,Kim Brimer,author,80R,1100,Sen. Kim Brimer,Kim Brimer
18,18,18,SB 902,Relating to the continuation and functions of the Prepaid Higher Education Tuition Board.,-1,Kim Brimer,author,80R,1100,Sen. Kim Brimer,Kim Brimer
19,19,19,SB 903,Relating to the continuation and functions of the Office of State-Federal Relations and the administrative attachment of that agency to the office of the governor.,-1,Kim Brimer,author,80R,1100,Sen. Kim Brimer,Kim Brimer
20,20,20,SB 904,Relating to the continuation and functions of the Texas Alcoholic Beverage Commission; providing penalties.,-1,Kim Brimer,author,80R,1100,Sen. Kim Brimer,Kim Brimer
21,21,21,SB 906,Relating to the licensing and regulation of structural pest control by the Department of Agriculture and the abolition of the Texas Structural Pest Control Board.,-1,Kim Brimer,author,80R,1100,Sen. Kim Brimer,Kim Brimer
22,22,22,SB 908,Relating to the continuation and functions of the State Office of Risk Management.,-1,Kim Brimer,author,80R,1100,Sen. Kim Brimer,Kim Brimer
23,23,23,SB 913,Relating to the continuation and functions of the Texas State Library and Archives Commission.,-1,Kim Brimer,author,80R,1100,Sen. Kim Brimer,Kim Brimer
24,24,24,SB 915,"Relating to the powers and duties of, and the entities reviewed by, the Sunset Advisory Commission.",-1,Kim Brimer,author,80R,1100,Sen. Kim Brimer,Kim Brimer
25,25,25,SB 924,Relating to rules and policies adopted by state agencies regarding engineering or architectural errors or omissions.,-1,Kim Brimer,author,80R,1100,Sen. Kim Brimer,Kim Brimer
26,26,26,SB 925,Relating to the time a person may be detained in custody for a preliminary examination.,-1,Kim Brimer,author,80R,1100,Sen. Kim Brimer,Kim Brimer
27,27,27,SB 926,Relating to the issuance and use of temporary cardboard tags on vehicles; providing penalties.,-1,Kim Brimer,author,80R,1100,Sen. Kim Brimer,Kim Brimer
28,28,28,SB 953,Relating to the application of the sales tax to services for repairing and remodeling certain historic commercial properties.,-1,Kim Brimer,author,80R,1100,Sen. Kim Brimer,Kim Brimer
29,29,29,SB 976,Relating to the public retirement system of certain municipalities.,-1,Kim Brimer,author,80R,1100,Sen. Kim Brimer,Kim Brimer
30,30,30,SB 1134,"Relating to the nonsubstantive revision of certain local laws concerning special districts, including conforming amendments.",-1,Kim Brimer,author,80R,1100,Sen. Kim Brimer,Kim Brimer
31,31,31,SB 1135,Relating to a nonsubstantive revision of statutes relating to business and commerce; including conforming amendments.,-1,Kim Brimer,author,80R,1100,Sen. Kim Brimer,Kim Brimer
32,32,32,SB 1136,"Relating to the nonsubstantive revision of statutes relating to the Texas Department of Insurance, the business of insurance, and certain related businesses, to nonsubstantive additions to and corrections in the codified Insurance Code, and to conforming the provisions of that code that were codified by the 79th Legislature to other Acts of that legislature, including conforming amendments, repeals, and penalties.",-1,Kim Brimer,author,80R,1100,Sen. Kim Brimer,Kim Brimer
33,33,33,SB 1177,Relating to a pilot test of an advanced control technology for the reduction of nitrogen oxides emissions.,-1,Kim Brimer,author,80R,1100,Sen. Kim Brimer,Kim Brimer
34,34,34,SB 1261,Relating to the nomination of a project or activity of a qualified business for designation as an enterprise project.,-1,Kim Brimer,author,80R,1100,Sen. Kim Brimer,Kim Brimer
35,35,35,SB 1262,Relating to the enterprise zone program.,-1,Kim Brimer,author,80R,1100,Sen. Kim Brimer,Kim Brimer
36,36,36,SB 1263,Relating to regulation and licensing of certain insurance agents.,-1,Kim Brimer,author,80R,1100,Sen. Kim Brimer,Kim Brimer
37,37,37,SB 1264,Relating to the authority of a taxing unit to make a loan to the board of directors of a tax increment financing reinvestment zone for deposit in the tax increment fund for the zone.,-1,Kim Brimer,author,80R,1100,Sen. Kim Brimer,Kim Brimer
38,38,38,SB 1265,Relating to the practice of optometry and therapeutic optometry and the administration by other health care professionals of treatments ordered by an optometrist or therapeutic optometrist.,-1,Kim Brimer,author,80R,1100,Sen. Kim Brimer,Kim Brimer
39,39,39,SB 1266,Relating to pass-through financing and the designation and operation of transportation reinvestment zones.,-1,Kim Brimer,author,80R,1100,Sen. Kim Brimer,Kim Brimer
40,40,40,SB 1423,Relating to funds exempt from the Public Funds Investment Act.,-1,Kim Brimer,author,80R,1100,Sen. Kim Brimer,Kim Brimer
41,41,41,SB 1424,Relating to the municipalities authorized to use the other events trust fund to attract certain sporting events and to the comptroller of public accounts' responsibilities regarding those events.,-1,Kim Brimer,author,80R,1100,Sen. Kim Brimer,Kim Brimer
42,42,42,SB 1425,Relating to economic impact studies and other financial issues affecting municipalities and counties that attempt to recruit or retain special events.,-1,Kim Brimer,author,80R,1100,Sen. Kim Brimer,Kim Brimer
43,43,43,SB 1435,"Relating to the creation, powers, and funding of a metropolitan area mobility authority; authorizing a tax.",-1,Kim Brimer,author,80R,1100,Sen. Kim Brimer,Kim Brimer
44,44,44,SB 1478,Relating to authorizing certain nonprofit organizations to conduct charitable poker tournaments; providing penalties.,-1,Kim Brimer,author,80R,1100,Sen. Kim Brimer,Kim Brimer
45,45,45,SB 1479,Relating to the application of the sales and use tax to the repair and remanufacture of industrial and printing rollers.,-1,Kim Brimer,author,80R,1100,Sen. Kim Brimer,Kim Brimer
46,46,46,SB 1480,Relating to the boundaries of Texas Department of Transportation districts.,-1,Kim Brimer,author,80R,1100,Sen. Kim Brimer,Kim Brimer
47,47,47,SB 1481,Relating to payments to nursing facilities based on TILE classifications assigned to residents of those facilities.,-1,Kim Brimer,author,80R,1100,Sen. Kim Brimer,Kim Brimer
48,48,48,SB 1482,Relating to the acquisition of toll projects and real property by the Texas Department of Transportation and regional mobility authorities.,-1,Kim Brimer,author,80R,1100,Sen. Kim Brimer,Kim Brimer
49,49,49,SB 1732,Relating to fees for copies of certain records and research protected by copyright and owned by the State Preservation Board.,-1,Kim Brimer,author,80R,1100,Sen. Kim Brimer,Kim Brimer
50,50,50,SB 1807,Relating to parental approval of a student's participation in human sexuality instruction in public schools.,-1,Kim Brimer,author,80R,1100,Sen. Kim Brimer,Kim Brimer
51,51,51,SB 1808,"Relating to the creation, powers, and funding of the Metroplex Area Mobility Authority and to requiring the Dallas-Fort Worth Metroplex to be included in a single Texas Department of Transportation district; authorizing a tax.",-1,Kim Brimer,author,80R,1100,Sen. Kim Brimer,Kim Brimer
52,52,52,SB 1809,Relating to the implementation of a project plan or financing plan for a reinvestment zone under the Tax Increment Financing Act and the granting of exemptions from ad valorem taxes imposed on real property in a reinvestment zone under that Act.,-1,Kim Brimer,author,80R,1100,Sen. Kim Brimer,Kim Brimer
53,53,53,SB 2052,Relating to the creation of the Northern Trinity Groundwater Conservation District.,-1,Kim Brimer,author,80R,1100,Sen. Kim Brimer,Kim Brimer
54,54,54,SCR 9,Honoring the Sunset Advisory Commission for its 30 years of service to the State of Texas.,-1,Kim Brimer,author,80R,1100,Sen. Kim Brimer,Kim Brimer
55,55,55,SCR 85,Recalling S.B. No. 924 from the governor for further consideration.,-1,Kim Brimer,author,80R,1100,Sen. Kim Brimer,Kim Brimer
56,56,56,SJR 11,Proposing a constitutional amendment relating to appropriations for the preservation and perpetuation of certain items of historical value; allowing the legislature and state agencies to accept on behalf of the state gifts of items of historical value and contributions to purchase such items.,-1,Kim Brimer,author,80R,1100,Sen. Kim Brimer,Kim Brimer
57,57,57,SR 4,Recognizing Everman Independent School District on the occasion of its 100th anniversary.,-1,Kim Brimer,author,80R,1100,Sen. Kim Brimer,Kim Brimer
58,58,58,SR 57,"Recognizing January 31, 2007, as Team Arlington Day at the State Capitol.",-1,Kim Brimer,author,80R,1100,Sen. Kim Brimer,Kim Brimer
59,59,59,SR 151,Welcoming delegates from our state's scouting troops to Austin on the occasion of the 100th anniversary of the World Scouting Movement.,-1,Kim Brimer,author,80R,1100,Sen. Kim Brimer,Kim Brimer
60,60,60,SR 176,Commending Cavan Lewis Larnard of Arlington for achieving the rank of Eagle Scout.,-1,Kim Brimer,author,80R,1100,Sen. Kim Brimer,Kim Brimer
61,61,61,SR 280,"Proclaiming February 20, 2007, Mansfield Day at the State Capitol.",-1,Kim Brimer,author,80R,1100,Sen. Kim Brimer,Kim Brimer
62,62,62,SR 323,Recognizing Big Brothers Big Sisters of North Texas on the occasion of its 80th anniversary.,-1,Kim Brimer,author,80R,1100,Sen. Kim Brimer,Kim Brimer
63,63,63,SR 356,Recognizing Diana Pham for being named a 2007 Prudential Spirit of Community Awards Distinguished Finalist.,-1,Kim Brimer,author,80R,1100,Sen. Kim Brimer,Kim Brimer
64,64,64,SR 538,Recognizing Ida B. McNeely of Fort Worth on the occasion of her 100th birthday.,-1,Kim Brimer,author,80R,1100,Sen. Kim Brimer,Kim Brimer
65,65,65,SR 539,Recognizing the Texas Council of Child Welfare Boards for its contributions to abused and neglected children.,-1,Kim Brimer,author,80R,1100,Sen. Kim Brimer,Kim Brimer
66,66,66,SR 678,Recognizing Fort Worth Spinks Airport for receiving the Most Improved Airport of the Year Award.,-1,Kim Brimer,author,80R,1100,Sen. Kim Brimer,Kim Brimer
67,67,67,SR 685,Recognizing the American Institute of Architects on the occasion of its 150th anniversary.,-1,Kim Brimer,author,80R,1100,Sen. Kim Brimer,Kim Brimer
68,68,68,SR 938,Commending Russell K. Tolman for his service to Cook Children's Health Care System.,-1,Kim Brimer,author,80R,1100,Sen. Kim Brimer,Kim Brimer
69,69,69,SR 1161,"Suspending limitations on conference committee jurisdiction, H.B. No. 2458.",-1,Kim Brimer,author,80R,1100,Sen. Kim Brimer,Kim Brimer
70,70,70,SR 1186,"Suspending limitations on conference committee jurisdiction, H.B. No. 3249.",-1,Kim Brimer,author,80R,1100,Sen. Kim Brimer,Kim Brimer
71,71,71,SR 1221,Congratulating Susan Tyler on her selection as the 2007 administrative recipient of the Betty King Public Service Award.,-1,Kim Brimer,author,80R,1100,Sen. Kim Brimer,Kim Brimer
72,72,72,SR 1222,Congratulating Joe Morris on his selection as the 2007 legislative recipient of the Betty King Public Service Award.,-1,Kim Brimer,author,80R,1100,Sen. Kim Brimer,Kim Brimer
73,73,73,SB 10,Relating to the operation and financing of the medical assistance program and other programs to provide health care benefits and services to persons in this state; providing penalties.,-1,Kim Brimer,author,80R,1100,Sen. Kim Brimer,Kim Brimer
74,74,74,SB 378,Relating to the use of force or deadly force in defense of a person.,-1,Kim Brimer,author,80R,1100,Sen. Kim Brimer,Kim Brimer
75,75,75,SB 769,"Relating to contracting issues of state agencies, including ethics issues related to state contracting.",-1,Kim Brimer,author,80R,1100,Sen. Kim Brimer,Kim Brimer
76,76,76,SB 792,Relating to the authority of certain counties and other entities with respect to certain transportation projects and to comprehensive development agreements with regard to such projects; authorizing the issuance of bonds; providing penalties.,-1,Kim Brimer,author,80R,1100,Sen. Kim Brimer,Kim Brimer
77,77,77,SB 1010,Relating to exempting sales of certain hurricane preparation and summer seasonal supplies from the sales tax for a limited period.,-1,Kim Brimer,author,80R,1100,Sen. Kim Brimer,Kim Brimer
78,78,78,SR 141,"Providing for the display of the motto ""In God We Trust"" in the senate chamber.",-1,Kim Brimer,author,80R,1100,Sen. Kim Brimer,Kim Brimer
79,79,79,SR 189,Congratulating The University of Texas at Arlington Wheelchair Basketball Team for winning the 2006 National Intercollegiate Wheelchair Basketball Tournament.,-1,Kim Brimer,author,80R,1100,Sen. Kim Brimer,Kim Brimer
80,80,80,SR 336,"Recognizing February 27 and 28, 2007, as Tarrant County Days at the State Capitol.",-1,Kim Brimer,author,80R,1100,Sen. Kim Brimer,Kim Brimer
81,81,81,SR 384,Requesting that the Legislative Audit Committee examine specified conduct and determine whether a condition of gross fiscal mismanagement exists in the Texas Youth Commission.,-1,Kim Brimer,author,80R,1100,Sen. Kim Brimer,Kim Brimer
82,82,82,SR 767,Recognizing the members of the Leadership Fort Worth Class of 2007.,-1,Kim Brimer,author,80R,1100,Sen. Kim Brimer,Kim Brimer
83,83,83,SR 1167,Congratulating Charles Emery of Denton County for being named Outstanding Board Member of the Year by the American Public Transportation Association.,-1,Kim Brimer,author,80R,1100,Sen. Kim Brimer,Kim Brimer
84,84,84,SB 5,"Relating to the prosecution, punishment, and supervision of certain sex offenders and to certain crimes involving sex offenders.",-1,Kim Brimer,coauthor,80R,1100,Sen. Kim Brimer,Kim Brimer
85,85,85,SB 103,Relating to the Texas Youth Commission and the prosecution of certain offenses and delinquent conduct in the Texas Youth Commission and certain other criminal justice agencies; providing penalties.,-1,Kim Brimer,coauthor,80R,1100,Sen. Kim Brimer,Kim Brimer
86,86,86,SB 252,Relating to the allocation and use of the sporting goods sales tax revenue to fund state and local parks.,-1,Kim Brimer,coauthor,80R,1100,Sen. Kim Brimer,Kim Brimer
87,87,87,SB 274,Relating to the issuance of Silver Star Medal license plates.,-1,Kim Brimer,coauthor,80R,1100,Sen. Kim Brimer,Kim Brimer
88,88,88,SB 438,Relating to prohibiting immunization against human papilloma virus as a condition for admission to public school.,-1,Kim Brimer,coauthor,80R,1100,Sen. Kim Brimer,Kim Brimer
89,89,89,SB 439,Relating to advance directives and health care and treatment decisions.,-1,Kim Brimer,coauthor,80R,1100,Sen. Kim Brimer,Kim Brimer
90,90,90,SB 785,Relating to information related to the performance of an abortion; creating an offense.,-1,Kim Brimer,coauthor,80R,1100,Sen. Kim Brimer,Kim Brimer
91,91,91,SB 807,Relating to the punishment for and prevention of the offense of burglary of vehicles.,-1,Kim Brimer,coauthor,80R,1100,Sen. Kim Brimer,Kim Brimer
92,92,92,SB 964,Relating to the board of directors of a regional tollway authority.,-1,Kim Brimer,coauthor,80R,1100,Sen. Kim Brimer,Kim Brimer
93,93,93,SB 965,Relating to the powers and duties of a regional tollway authority related to turnpikes and other related projects.,-1,Kim Brimer,coauthor,80R,1100,Sen. Kim Brimer,Kim Brimer
94,94,94,SB 1162,Relating to the ad valorem tax situs of certain portable drilling rigs and associated equipment.,-1,Kim Brimer,coauthor,80R,1100,Sen. Kim Brimer,Kim Brimer
95,95,95,SB 1693,Relating to the creation of inland port authorities; providing authority to impose a tax and issue bonds.,-1,Kim Brimer,coauthor,80R,1100,Sen. Kim Brimer,Kim Brimer
96,96,96,SJR 13,Proposing a constitutional amendment authorizing the legislature to provide for a reduction of the limitation on the total amount of ad valorem taxes that may be imposed for public school purposes on the residence homesteads of the elderly or disabled to reflect any reduction in the rate of those taxes for the 2006 and 2007 tax years.,-1,Kim Brimer,coauthor,80R,1100,Sen. Kim Brimer,Kim Brimer
97,97,97,SJR 28,Proposing a constitutional amendment to allow the legislature to override a veto of the governor following a legislative session.,-1,Kim Brimer,coauthor,80R,1100,Sen. Kim Brimer,Kim Brimer
98,98,98,SR 588,Recognizing April 2007 as Child Abuse Prevention Month.,-1,Kim Brimer,coauthor,80R,1100,Sen. Kim Brimer,Kim Brimer
99,99,99,HB 34,Relating to the prohibition of certain payments or other inducements regarding a workers' compensation claim; providing an administrative violation.,-1,Kim Brimer,sponsor,80R,1100,Sen. Kim Brimer,Kim Brimer
100,100,100,HB 309,Relating to certain notifications made by the Texas Department of Criminal Justice to close relatives of deceased victims.,-1,Kim Brimer,sponsor,80R,1100,Sen. Kim Brimer,Kim Brimer
101,101,101,HB 484,"Relating to the designation of a portion of United States Highway 287 as the Dr. Martin Luther King, Jr., Freeway.",-1,Kim Brimer,sponsor,80R,1100,Sen. Kim Brimer,Kim Brimer
102,102,102,HB 518,Relating to the detention and examination of certain persons for whom an application for emergency detention or a motion for an order of protective custody has been filed.,-1,Kim Brimer,sponsor,80R,1100,Sen. Kim Brimer,Kim Brimer
103,103,103,HB 1308,Relating to deer breeding operations; providing a penalty.,-1,Kim Brimer,sponsor,80R,1100,Sen. Kim Brimer,Kim Brimer
104,104,104,HB 1467,Relating to reservations of the state ceiling and priority carryforward classifications for certain projects under the private activity bond allocation program.,-1,Kim Brimer,sponsor,80R,1100,Sen. Kim Brimer,Kim Brimer
105,105,105,HB 1471,"Relating to resource sharing among certain political subdivisions, including regional planning commissions, during a disaster.",-1,Kim Brimer,sponsor,80R,1100,Sen. Kim Brimer,Kim Brimer
106,106,106,HB 1587,"Relating to participation and credit in, contributions to, and benefits and administration of the Texas County and District Retirement System.",-1,Kim Brimer,sponsor,80R,1100,Sen. Kim Brimer,Kim Brimer
107,107,107,HB 1667,Relating to the amount of the fee for issuing certain alcoholic beverage permits.,-1,Kim Brimer,sponsor,80R,1100,Sen. Kim Brimer,Kim Brimer
108,108,108,HB 1849,Relating to certain fees for valuing life insurance policies.,-1,Kim Brimer,sponsor,80R,1100,Sen. Kim Brimer,Kim Brimer
109,109,109,HB 1956,Relating to the financial responsibility requirements applicable to owners or operators of underground storage tanks.,-1,Kim Brimer,sponsor,80R,1100,Sen. Kim Brimer,Kim Brimer
110,110,110,HB 2173,Relating to the continuation and functions of the Prepaid Higher Education Tuition Board.,-1,Kim Brimer,sponsor,80R,1100,Sen. Kim Brimer,Kim Brimer
111,111,111,HB 2278,Relating to a nonsubstantive revision of statutes relating to business and commerce; including conforming amendments.,-1,Kim Brimer,sponsor,80R,1100,Sen. Kim Brimer,Kim Brimer
112,112,112,HB 2402,Relating to the authority granted to certain property owners' associations in dedicatory instruments and restrictive covenants.,-1,Kim Brimer,sponsor,80R,1100,Sen. Kim Brimer,Kim Brimer
113,113,113,HB 2458,Relating to the licensing and regulation of structural pest control by the Department of Agriculture and the abolition of the Texas Structural Pest Control Board.,-1,Kim Brimer,sponsor,80R,1100,Sen. Kim Brimer,Kim Brimer
114,114,114,HB 2462,Relating to providing for the sale of certain gambling equipment seized by a law enforcement agency.,-1,Kim Brimer,sponsor,80R,1100,Sen. Kim Brimer,Kim Brimer
115,115,115,HB 2636,"Relating to the nonsubstantive revision of statutes relating to the Texas Department of Insurance, the business of insurance, and certain related businesses, to nonsubstantive additions to and corrections in the codified Insurance Code, and to conforming the provisions of that code that were codified by the 79th Legislature to other Acts of that legislature, including conforming amendments, repeals, and penalties.",-1,Kim Brimer,sponsor,80R,1100,Sen. Kim Brimer,Kim Brimer
116,116,116,HB 2682,Relating to the administration and powers of a coordinated county transportation authority.,-1,Kim Brimer,sponsor,80R,1100,Sen. Kim Brimer,Kim Brimer
117,117,117,HB 3166,"Relating to the nonsubstantive revision of certain local laws concerning special districts, including conforming amendments.",-1,Kim Brimer,sponsor,80R,1100,Sen. Kim Brimer,Kim Brimer
118,118,118,HB 3249,"Relating to the powers and duties of, and the entities reviewed by, the Sunset Advisory Commission.",-1,Kim Brimer,sponsor,80R,1100,Sen. Kim Brimer,Kim Brimer
119,119,119,HB 3355,"Relating to the board of trustees, benefits, and contributions of certain fire and police pension funds.",-1,Kim Brimer,sponsor,80R,1100,Sen. Kim Brimer,Kim Brimer
120,120,120,HB 3378,Relating to the requirements governing municipal consent to the creation or expansion of certain water districts.,-1,Kim Brimer,sponsor,80R,1100,Sen. Kim Brimer,Kim Brimer
121,121,121,HB 3558,"Relating to the issuance of warrants to certain persons for fire, health, and code inspections.",-1,Kim Brimer,sponsor,80R,1100,Sen. Kim Brimer,Kim Brimer
122,122,122,HB 3563,Relating to the setting and collecting of fees for the public's use of certain images and documents protected by copyright owned by the State Preservation Board.,-1,Kim Brimer,sponsor,80R,1100,Sen. Kim Brimer,Kim Brimer
123,123,123,HB 4028,Relating to the creation of the Northern Trinity Groundwater Conservation District.,-1,Kim Brimer,sponsor,80R,1100,Sen. Kim Brimer,Kim Brimer
124,124,124,HCR 70,Authorizing the lieutenant governor and speaker to appoint interim joint committees.,-1,Kim Brimer,sponsor,80R,1100,Sen. Kim Brimer,Kim Brimer
125,125,125,HCR 111,Authorizing the placement of a monument commemorating the federal Bill of Rights.,-1,Kim Brimer,sponsor,80R,1100,Sen. Kim Brimer,Kim Brimer
126,126,126,HCR 135,Commending Special Olympics Texas and welcoming its athletes to the Capitol.,-1,Kim Brimer,sponsor,80R,1100,Sen. Kim Brimer,Kim Brimer
127,127,127,HCR 253,"Honoring Thomas L. Johnson, Sr., on his induction into the Texas Transportation Institute Hall of Honor.",-1,Kim Brimer,sponsor,80R,1100,Sen. Kim Brimer,Kim Brimer
128,128,128,HCR 256,Recalling S.B. No. 903 from the senate for further consideration.,-1,Kim Brimer,sponsor,80R,1100,Sen. Kim Brimer,Kim Brimer
129,129,129,HB 1022,Relating to the exemption from ad valorem taxation of a motor vehicle owned by an individual and used in the course of the owner's occupation or profession and also for personal activities of the owner and to the rendition of such vehicles.,-1,Kim Brimer,cosponsor,80R,1100,Sen. Kim Brimer,Kim Brimer
130,130,130,HB 3678,Relating to voluntary student expression of religious viewpoints in public schools.,-1,Kim Brimer,cosponsor,80R,1100,Sen. Kim Brimer,Kim Brimer
