Unnamed: 0,Unnamed: 0.1,Unnamed: 0.1.1,bill_name,caption,filer_id,filer_name,function,session,leg_id,original_name,parsed_name
416,416,416,SB 516,Relating to exempting oil produced from marginally economic leases and gas produced from marginally economic wells from production taxes.,20189,Don Henderson,author,71R,1210,Sen. Don Henderson,Don Henderson
417,417,417,SB 528,Relating to the abolishment of the state board of canvassers.,20189,Don Henderson,author,71R,1210,Sen. Don Henderson,Don Henderson
418,418,418,SB 529,"Relating to the continuation, name change, and operation of the Natural Fibers and Food Protein Commission.",20189,Don Henderson,author,71R,1210,Sen. Don Henderson,Don Henderson
419,419,419,SB 530,Relating to the continuation and functions of the Texas Animal Health Commission.,20189,Don Henderson,author,71R,1210,Sen. Don Henderson,Don Henderson
420,420,420,SB 531,Relating to the continuation and operation of the State Property Tax Board.,20189,Don Henderson,author,71R,1210,Sen. Don Henderson,Don Henderson
421,421,421,SB 740,"Relating to the purchasing, lease, or conversion of motor vehicles by state agencies, school districts, and local transit authorities and districts to assure use of compressed natural gas or other alternative fuels.",20189,Don Henderson,author,71R,1210,Sen. Don Henderson,Don Henderson
422,422,422,SB 748,Relating to the offense for abandoning a child.,20189,Don Henderson,author,71R,1210,Sen. Don Henderson,Don Henderson
423,423,423,SB 749,Relating to the payment of ad valorem taxes pending an appeal of an ad valorem tax determination.,20189,Don Henderson,author,71R,1210,Sen. Don Henderson,Don Henderson
424,424,424,SB 750,Relating to the interest paid on certain ad valorem tax refunds.,20189,Don Henderson,author,71R,1210,Sen. Don Henderson,Don Henderson
425,425,425,SB 751,Relating to the parties to an appeal of an ad valorem tax determination and to the payment of taxes pending the appeal.,20189,Don Henderson,author,71R,1210,Sen. Don Henderson,Don Henderson
426,426,426,SB 785,Relating to securities exempt from The Securities Act.,20189,Don Henderson,author,71R,1210,Sen. Don Henderson,Don Henderson
427,427,427,SB 933,Relating to the appeal of an ad valorem tax determination.,20189,Don Henderson,author,71R,1210,Sen. Don Henderson,Don Henderson
428,428,428,SB 934,Relating to the issuance of a subpoena by an appraisal review board.,20189,Don Henderson,author,71R,1210,Sen. Don Henderson,Don Henderson
429,429,429,SB 953,Relating to the establishment of equivalent membership service credit for employment with certain private schools by members of the Teacher Retirement System of Texas.,20189,Don Henderson,author,71R,1210,Sen. Don Henderson,Don Henderson
430,430,430,SB 963,Relating to providing tax and regulatory relief as incentives for the production of certain gas that is difficult or expensive to produce.,20189,Don Henderson,author,71R,1210,Sen. Don Henderson,Don Henderson
431,431,431,SB 970,Relating to the duration of certain leases made by certain municipalities.,20189,Don Henderson,author,71R,1210,Sen. Don Henderson,Don Henderson
432,432,432,SB 1032,Relating to the dissolution of the Harris County Regional District No. 2.,20189,Don Henderson,author,71R,1210,Sen. Don Henderson,Don Henderson
433,433,433,SB 1034,Relating to a property owner's remedies for unequal appraisal and other actions of the appraisal district or appraisal review board.,20189,Don Henderson,author,71R,1210,Sen. Don Henderson,Don Henderson
434,434,434,SB 1060,Relating to the authority of a person to stand in a roadway to solicit charitable contributions.,20189,Don Henderson,author,71R,1210,Sen. Don Henderson,Don Henderson
435,435,435,SB 1075,Relating to the authority and procedure for approving the revision of a subdivision plat in certain incorporated areas of a county.,20189,Don Henderson,author,71R,1210,Sen. Don Henderson,Don Henderson
436,436,436,SB 1076,Relating to the assignment of statutory probate court judges.,20189,Don Henderson,author,71R,1210,Sen. Don Henderson,Don Henderson
437,437,437,SB 1079,Relating to the regulation of airborne fireworks by certain counties; providing a penalty.,20189,Don Henderson,author,71R,1210,Sen. Don Henderson,Don Henderson
438,438,438,SB 1089,Relating to bank loan fees; providing a penalty.,20189,Don Henderson,author,71R,1210,Sen. Don Henderson,Don Henderson
439,439,439,SB 1092,Relating to the payment of ad valorem taxes pending an appeal of a tax determination and to the interest paid on a tax refund after an appeal.,20189,Don Henderson,author,71R,1210,Sen. Don Henderson,Don Henderson
440,440,440,SB 1163,Relating to an action to enjoin acts damaging to business reputation or to a trade name or mark.,20189,Don Henderson,author,71R,1210,Sen. Don Henderson,Don Henderson
441,441,441,SB 1280,"Relating to the creation, confirmation election, director's qualifications, matching funds, and exclusions of property from a regional water district.",20189,Don Henderson,author,71R,1210,Sen. Don Henderson,Don Henderson
442,442,442,SB 1302,Relating to the refund of premiums from premium finance companies.,20189,Don Henderson,author,71R,1210,Sen. Don Henderson,Don Henderson
443,443,443,SB 1303,"Relating to the authority to set maximum speed limits on causeways, bridges, tunnels, turnpikes, or highways in certain counties.",20189,Don Henderson,author,71R,1210,Sen. Don Henderson,Don Henderson
444,444,444,SB 1312,Relating to ad valorem tax abatement in a reinvestment zone.,20189,Don Henderson,author,71R,1210,Sen. Don Henderson,Don Henderson
445,445,445,SB 1368,Relating to the exclusion of land from a municipal utility district.,20189,Don Henderson,author,71R,1210,Sen. Don Henderson,Don Henderson
446,446,446,SB 1369,Relating to ad valorem tax abatement by a conservation and reclamation district.,20189,Don Henderson,author,71R,1210,Sen. Don Henderson,Don Henderson
447,447,447,SB 1370,"Relating to procedures for the application for special property tax appraisals and to the granting, denial, and review of those applications.",20189,Don Henderson,author,71R,1210,Sen. Don Henderson,Don Henderson
448,448,448,SB 1371,Relating to the appointment of the board of directors of an appraisal district.,20189,Don Henderson,author,71R,1210,Sen. Don Henderson,Don Henderson
449,449,449,SB 1390,Relating to creation of the Texas capital access fund and the economic development of the state.,20189,Don Henderson,author,71R,1210,Sen. Don Henderson,Don Henderson
450,450,450,SB 1418,Relating to video recording of certain activity at an unmanned teller machine.,20189,Don Henderson,author,71R,1210,Sen. Don Henderson,Don Henderson
451,451,451,SB 1419,Relating to the liability of certain homeowners organizations and the volunteers and employees of the organizations.,20189,Don Henderson,author,71R,1210,Sen. Don Henderson,Don Henderson
452,452,452,SB 1427,Relating to liability of subscribers and shareholders of Texas business corporations.,20189,Don Henderson,author,71R,1210,Sen. Don Henderson,Don Henderson
453,453,453,SB 1428,Relating to authority of State of Texas to make agreements to indemnify against loss or damage certain art and artifacts.,20189,Don Henderson,author,71R,1210,Sen. Don Henderson,Don Henderson
454,454,454,SB 1641,Relating to the electronic funds transfer of the compensation and reimbursement of municipal officers and employees.,20189,Don Henderson,author,71R,1210,Sen. Don Henderson,Don Henderson
455,455,455,SB 1770,Relating to the statutory probate courts in Harris County.,20189,Don Henderson,author,71R,1210,Sen. Don Henderson,Don Henderson
456,456,456,SB 1783,"Relating to the appraisal of property for ad valorem taxation, the administration of ad valorem taxes, and the administrative and judicial review of ad valorem tax matters; providing criminal penalties.",20189,Don Henderson,author,71R,1210,Sen. Don Henderson,Don Henderson
457,457,457,SB 1821,Relating to the definition of family homes as community-based residential homes exclusively for disabled persons.,20189,Don Henderson,author,71R,1210,Sen. Don Henderson,Don Henderson
458,458,458,SCR 8,In memory of former State Representative Albert Brown.,20189,Don Henderson,author,71R,1210,Sen. Don Henderson,Don Henderson
459,459,459,SCR 37,"Granting Sibley and Associates, Inc., permission to sue the State of Texas and The University of Texas System.",20189,Don Henderson,author,71R,1210,Sen. Don Henderson,Don Henderson
460,460,460,SCR 45,"Granting Mission Construction, Inc., permission to sue the state and the Parks and Wildlife Commission.",20189,Don Henderson,author,71R,1210,Sen. Don Henderson,Don Henderson
461,461,461,SCR 52,"Granting John Phenix and Associates, Inc., permission to sue the State of Texas and the University of Houston System.",20189,Don Henderson,author,71R,1210,Sen. Don Henderson,Don Henderson
462,462,462,SCR 70,"Directing the State Department of Highways and Public Transportation to issue ""U.S. Judge"" plates to federal bankruptcy judges residing in Texas.",20189,Don Henderson,author,71R,1210,Sen. Don Henderson,Don Henderson
463,463,463,SCR 139,Congratulating Spring High School for their substance abuse prevention and education program.,20189,Don Henderson,author,71R,1210,Sen. Don Henderson,Don Henderson
464,464,464,SJR 8,Proposing a constitutional amendment providing for the issuance of general obligation bonds to provide the public with an investment alternative to use in financing a college education.,20189,Don Henderson,author,71R,1210,Sen. Don Henderson,Don Henderson
465,465,465,SJR 16,Proposing a constitutional amendment to abolish the office of county surveyor in certain counties.,20189,Don Henderson,author,71R,1210,Sen. Don Henderson,Don Henderson
466,466,466,SJR 21,Proposing a constitutional amendment relating to qualifications for office of certain judges.,20189,Don Henderson,author,71R,1210,Sen. Don Henderson,Don Henderson
467,467,467,SR 14,"Expressing the appreciation and gratitude of the Senate to Dr. Jack Haley, Capitol Physician, January 11, 1989.",20189,Don Henderson,author,71R,1210,Sen. Don Henderson,Don Henderson
468,468,468,SR 22,Congratulating Jason Sweeney of Kinkaid High School.,20189,Don Henderson,author,71R,1210,Sen. Don Henderson,Don Henderson
469,469,469,SR 50,Congratulating George W. Schalles IV.,20189,Don Henderson,author,71R,1210,Sen. Don Henderson,Don Henderson
470,470,470,SR 58,Congratulating Steven D. Doan on achieving the rank of Eagle Scout.,20189,Don Henderson,author,71R,1210,Sen. Don Henderson,Don Henderson
471,471,471,SR 76,Congratulating Dorothy Hall Haley on being named Woman of the Year.,20189,Don Henderson,author,71R,1210,Sen. Don Henderson,Don Henderson
472,472,472,SR 117,Congratulating Stuart Bush on achieving the rank of Eagle Scout.,20189,Don Henderson,author,71R,1210,Sen. Don Henderson,Don Henderson
473,473,473,SR 118,Congratulating Mitchell Sadler on achieving the rank of Eagle Scout.,20189,Don Henderson,author,71R,1210,Sen. Don Henderson,Don Henderson
474,474,474,SR 119,Congratulating Gregory Corinth on achieving the rank of Eagle Scout.,20189,Don Henderson,author,71R,1210,Sen. Don Henderson,Don Henderson
475,475,475,SR 131,Extending congratulations to Eugene Chen on achieving the rank of Eagle Scout.,20189,Don Henderson,author,71R,1210,Sen. Don Henderson,Don Henderson
476,476,476,SR 132,Extending congratulations to Christopher W. Jones on achieving the rank of Eagle Scout.,20189,Don Henderson,author,71R,1210,Sen. Don Henderson,Don Henderson
477,477,477,SR 169,Congratulating Bruce Palmer on the occasion of his retirement from AAA Auto Club.,20189,Don Henderson,author,71R,1210,Sen. Don Henderson,Don Henderson
478,478,478,SR 170,Congratulating Allen Walker on achieving the rank of Eagle Scout.,20189,Don Henderson,author,71R,1210,Sen. Don Henderson,Don Henderson
479,479,479,SR 200,Congratulating Danielle Denise Fisher for her outstanding academic achievement.,20189,Don Henderson,author,71R,1210,Sen. Don Henderson,Don Henderson
480,480,480,SR 256,Congratulating Charles E. Simmons of Houston on attaining the rank of Eagle Scout.,20189,Don Henderson,author,71R,1210,Sen. Don Henderson,Don Henderson
481,481,481,SR 306,Commending Ashford Elementary School in Houston for receiving the 1989 Outstanding Volunteer Program.,20189,Don Henderson,author,71R,1210,Sen. Don Henderson,Don Henderson
482,482,482,SR 324,Congratulating Lorin Theiss on attaining the Gold Medal of Achievement.,20189,Don Henderson,author,71R,1210,Sen. Don Henderson,Don Henderson
483,483,483,SR 415,Congratulating Kevin Soniat on attaining the rank of Eagle Scout.,20189,Don Henderson,author,71R,1210,Sen. Don Henderson,Don Henderson
484,484,484,SR 416,Congratulating Tyler L. Burgener on attaining the rank of Eagle Scout.,20189,Don Henderson,author,71R,1210,Sen. Don Henderson,Don Henderson
485,485,485,SR 417,Congratulating Lucero Raul Parodi on becoming a United States citizen.,20189,Don Henderson,author,71R,1210,Sen. Don Henderson,Don Henderson
486,486,486,SR 499,Congratulating Derek Gentry on achieving the rank of Eagle Scout.,20189,Don Henderson,author,71R,1210,Sen. Don Henderson,Don Henderson
487,487,487,SR 526,Congratulating Alan Gluth on achieving the rank of Eagle Scout.,20189,Don Henderson,author,71R,1210,Sen. Don Henderson,Don Henderson
488,488,488,SR 558,Congratulating Jon Christopher Moore on attaining the rank of Eagle Scout.,20189,Don Henderson,author,71R,1210,Sen. Don Henderson,Don Henderson
489,489,489,SR 559,Congratulating Clifton Kyle Netterville on attaining the rank of Eagle Scout.,20189,Don Henderson,author,71R,1210,Sen. Don Henderson,Don Henderson
490,490,490,SR 572,"Commending the students, faculty and administrators of the Cypress-Fairbanks Independent School District for their exceptional educational program as they celebrate their golden anniversary.",20189,Don Henderson,author,71R,1210,Sen. Don Henderson,Don Henderson
491,491,491,SR 580,Congratulating Eric Warnsman on achieving the rank of Eagle Scout.,20189,Don Henderson,author,71R,1210,Sen. Don Henderson,Don Henderson
492,492,492,SR 581,Congratulating Paul Ryan Bierwagen of Houston on achieving the rank of Eagle Scout.,20189,Don Henderson,author,71R,1210,Sen. Don Henderson,Don Henderson
493,493,493,SR 758,Congratulating Christopher Elbert Coker of Spring on achieving the rank of Eagle Scout.,20189,Don Henderson,author,71R,1210,Sen. Don Henderson,Don Henderson
494,494,494,SR 869,Extending congratulations to Nathan Mickle on achieving the rank of Eagle Scout.,20189,Don Henderson,author,71R,1210,Sen. Don Henderson,Don Henderson
495,495,495,SR 870,Extending congratulations to Davis Rumsey on achieving the rank of Eagle Scout.,20189,Don Henderson,author,71R,1210,Sen. Don Henderson,Don Henderson
496,496,496,SR 871,Extending congratulations to Michael Young of Houston on achieving the rank of Eagle Scout.,20189,Don Henderson,author,71R,1210,Sen. Don Henderson,Don Henderson
497,497,497,SR 872,Extending congratulations to Kreg Gotschall on achieving the rank of Eagle Scout.,20189,Don Henderson,author,71R,1210,Sen. Don Henderson,Don Henderson
498,498,498,SR 873,Extending congratulations to John Bowman of Houston on achieving the rank of Eagle Scout.,20189,Don Henderson,author,71R,1210,Sen. Don Henderson,Don Henderson
499,499,499,SB 69,Relating to designating and marking Beltway 8 as the Sam Houston Parkway.,20189,Don Henderson,coauthor,71R,1210,Sen. Don Henderson,Don Henderson
500,500,500,SB 234,Relating to the consent to abortion for certain minors; providing penalties.,20189,Don Henderson,coauthor,71R,1210,Sen. Don Henderson,Don Henderson
501,501,501,SB 769,Relating to the adoption of certain regulations to encourage and require the use of natural gas and other alternative fuels.,20189,Don Henderson,coauthor,71R,1210,Sen. Don Henderson,Don Henderson
502,502,502,SB 911,"Relating to coverage of chemical dependency under certain health insurance, prepaid health plans, and self-funded and self-insured health plans.",20189,Don Henderson,coauthor,71R,1210,Sen. Don Henderson,Don Henderson
503,503,503,SB 1762,Relating to the issuance of general obligation bonds by the Texas Higher Education Coordinating Board to assist in financing the Texas opportunity plan fund to make educational loans and to the issuance of those bonds....,20189,Don Henderson,coauthor,71R,1210,Sen. Don Henderson,Don Henderson
504,504,504,SJR 74,Proposing a constitutional amendment providing for the issuance of general obligation bonds by the Texas Higher Education Coordinating Board to assist in financing the Texas opportunity plan fund to make loans to students....,20189,Don Henderson,coauthor,71R,1210,Sen. Don Henderson,Don Henderson
505,505,505,SR 183,"Congratulating Pete Williford for his 50 years of meritorious service to Central Freight Lines, Incorporated.",20189,Don Henderson,coauthor,71R,1210,Sen. Don Henderson,Don Henderson
506,506,506,SR 334,Congratulating Angie and Warren Schlief on their 50th wedding anniversary.,20189,Don Henderson,coauthor,71R,1210,Sen. Don Henderson,Don Henderson
507,507,507,HB 182,Relating to the provision of refueling services to disabled persons and to the price charged for motor vehicle fuel provided to those persons; providing a penalty.,20189,Don Henderson,sponsor,71R,1210,Sen. Don Henderson,Don Henderson
508,508,508,HB 202,Relating to the termination of a condominium regime.,20189,Don Henderson,sponsor,71R,1210,Sen. Don Henderson,Don Henderson
509,509,509,HB 369,Relating to creation and operation of the Texas exporters loan fund.,20189,Don Henderson,sponsor,71R,1210,Sen. Don Henderson,Don Henderson
510,510,510,HB 432,"Relating to the appraisal of property for ad valorem taxation, the imposition, administration, and collection of ad valorem taxes, and the administrative and judicial review of ad valorem tax matters; providing....",20189,Don Henderson,sponsor,71R,1210,Sen. Don Henderson,Don Henderson
511,511,511,HB 625,Relating to the effect of citing volume and page numbers or film code numbers in referring to real property records in instruments relating to real property transactions.,20189,Don Henderson,sponsor,71R,1210,Sen. Don Henderson,Don Henderson
512,512,512,HB 660,Relating to requirements for the recording of documents relating to real or personal property.,20189,Don Henderson,sponsor,71R,1210,Sen. Don Henderson,Don Henderson
513,513,513,HB 772,Relating to the abolishment of the state board of canvassers.,20189,Don Henderson,sponsor,71R,1210,Sen. Don Henderson,Don Henderson
514,514,514,HB 1450,Relating to the regulation of credit services organizations.,20189,Don Henderson,sponsor,71R,1210,Sen. Don Henderson,Don Henderson
515,515,515,HB 1522,Relating to the violation of traffic laws by certain minors.,20189,Don Henderson,sponsor,71R,1210,Sen. Don Henderson,Don Henderson
516,516,516,HB 1603,Relating to political funds reporting requirements in connection with certain political club meetings.,20189,Don Henderson,sponsor,71R,1210,Sen. Don Henderson,Don Henderson
517,517,517,HB 1772,Relating to leave of absence for public officers and employees,20189,Don Henderson,sponsor,71R,1210,Sen. Don Henderson,Don Henderson
518,518,518,HB 1873,Relating to statutory probate courts.,20189,Don Henderson,sponsor,71R,1210,Sen. Don Henderson,Don Henderson
519,519,519,HB 2032,"Relating to the meaning of ""qualified voter"" in connection with eligibility to sign a petition relating to an election.",20189,Don Henderson,sponsor,71R,1210,Sen. Don Henderson,Don Henderson
520,520,520,HB 2033,Relating to certain election processes and procedures.,20189,Don Henderson,sponsor,71R,1210,Sen. Don Henderson,Don Henderson
521,521,521,HB 2178,"Relating to a revision of Title 15, Election Code, regulating political funds and campaigns.",20189,Don Henderson,sponsor,71R,1210,Sen. Don Henderson,Don Henderson
522,522,522,HB 2301,Relating to the membership of the board of directors and the appraisal review board of an appraisal district.,20189,Don Henderson,sponsor,71R,1210,Sen. Don Henderson,Don Henderson
523,523,523,HB 2304,Relating to ad valorem tax abatement by a conservation and reclamation district.,20189,Don Henderson,sponsor,71R,1210,Sen. Don Henderson,Don Henderson
524,524,524,HB 2306,Relating to the exclusion of land from a municipal utility district.,20189,Don Henderson,sponsor,71R,1210,Sen. Don Henderson,Don Henderson
525,525,525,HB 2441,Relating to agreements by the state to indemnify against loss or damage in connection with certain art and artifacts.,20189,Don Henderson,sponsor,71R,1210,Sen. Don Henderson,Don Henderson
526,526,526,HB 2795,Relating to the penalty for violating the restrictions of an occupational license for essential need or for failing to carry in a vehicle a certified copy of the court order authorizing the license.,20189,Don Henderson,sponsor,71R,1210,Sen. Don Henderson,Don Henderson
527,527,527,HB 2796,"Relating to the authority of the sheriffs of certain counties to regulate the manufacture, transfer, use, and possession of explosives; providing a penalty.",20189,Don Henderson,sponsor,71R,1210,Sen. Don Henderson,Don Henderson
528,528,528,HB 2803,Relating to creation of the Texas business enhancement fund and the economic development of the state.,20189,Don Henderson,sponsor,71R,1210,Sen. Don Henderson,Don Henderson
529,529,529,HB 2963,Relating to electronic funds transfer of compensation and reimbursement of municipal officers and employees.,20189,Don Henderson,sponsor,71R,1210,Sen. Don Henderson,Don Henderson
530,530,530,HB 3126,Relating to the terms of office of the board of supervisors of the Memorial Villages Water Authority.,20189,Don Henderson,sponsor,71R,1210,Sen. Don Henderson,Don Henderson
531,531,531,HCR 124,Honoring John W. Phenicie.,20189,Don Henderson,sponsor,71R,1210,Sen. Don Henderson,Don Henderson
532,532,532,HCR 154,Commending the Westfield High School band.,20189,Don Henderson,sponsor,71R,1210,Sen. Don Henderson,Don Henderson
533,533,533,HCR 155,Congratulating the Northwest 45 All Star baseball team.,20189,Don Henderson,sponsor,71R,1210,Sen. Don Henderson,Don Henderson
