Unnamed: 0,Unnamed: 0.1,Unnamed: 0.1.1,bill_name,caption,filer_id,filer_name,function,session,leg_id,original_name,parsed_name
383,383,383,HJR 23,Proposing a constitutional amendment authorizing the legislature to provide for an exemption from ad valorem taxation of the residence homestead of the surviving spouse of a 100 percent or totally disabled veteran in an amount equal to the amount of the residence homestead exemption to which the disabled veteran was entitled.,65889,Dan Huberty,coauthor,82R,2285,Rep. Dan Huberty,Dan Huberty
384,384,384,HJR 42,"Proposing a constitutional amendment concerning the limitation on the rate of growth of state appropriations and the use of unencumbered surplus state revenues to provide for a rebate of state franchise taxes, to reduce public school district property taxes, and to fund the state's rainy day fund.",65889,Dan Huberty,coauthor,82R,2285,Rep. Dan Huberty,Dan Huberty
385,385,385,HJR 46,Proposing a constitutional amendment releasing a school district from the obligation to comply with an unfunded state educational mandate.,65889,Dan Huberty,coauthor,82R,2285,Rep. Dan Huberty,Dan Huberty
386,386,386,HJR 51,Proposing a constitutional amendment relating to the rights of individuals to choose or decline to choose to purchase health insurance coverage.,65889,Dan Huberty,coauthor,82R,2285,Rep. Dan Huberty,Dan Huberty
387,387,387,HJR 56,Proposing a constitutional amendment to restrict the power of the legislature to mandate requirements on local governments.,65889,Dan Huberty,coauthor,82R,2285,Rep. Dan Huberty,Dan Huberty
388,388,388,HJR 58,Proposing a constitutional amendment concerning the limitation on the rate of growth of state appropriations.,65889,Dan Huberty,coauthor,82R,2285,Rep. Dan Huberty,Dan Huberty
389,389,389,HJR 62,Proposing a constitutional amendment to authorize the legislature to limit the maximum appraised value of a residence homestead for ad valorem tax purposes to 105 percent or more of the appraised value of the property for the preceding tax year.,65889,Dan Huberty,coauthor,82R,2285,Rep. Dan Huberty,Dan Huberty
390,390,390,HJR 70,Proposing a constitutional amendment regarding the maximum rate of growth of appropriations and the use of unencumbered surplus general revenues to fund the state's rainy day fund and a public school property tax relief fund.,65889,Dan Huberty,coauthor,82R,2285,Rep. Dan Huberty,Dan Huberty
391,391,391,HJR 100,Applying to the Congress of the United States to call a convention to propose an amendment to the United States Constitution to require a balanced federal budget.,65889,Dan Huberty,coauthor,82R,2285,Rep. Dan Huberty,Dan Huberty
392,392,392,HJR 109,"Proposing a constitutional amendment to clarify references to the permanent school fund, to allow the General Land Office to distribute revenue derived from permanent school fund land or other properties to the available school fund, and to provide for an increase in the market value of the permanent school fund for the purpose of allowing increased distributions from the available school fund.",65889,Dan Huberty,coauthor,82R,2285,Rep. Dan Huberty,Dan Huberty
393,393,393,HJR 124,Proposing a constitutional amendment requiring a four-fifths vote by the house of representatives to increase taxes.,65889,Dan Huberty,coauthor,82R,2285,Rep. Dan Huberty,Dan Huberty
394,394,394,HR 288,"Recognizing March 3, 2011, as Texas Federation of Republican Women Day at the Capitol.",65889,Dan Huberty,coauthor,82R,2285,Rep. Dan Huberty,Dan Huberty
395,395,395,HR 415,"Recognizing February 16, 2011, as Texans Support Libraries Day at the State Capitol.",65889,Dan Huberty,coauthor,82R,2285,Rep. Dan Huberty,Dan Huberty
396,396,396,HR 1193,"Commemorating April 6, 2011, as Catholic Faith in Action Advocacy Day, sponsored by the Texas Catholic Conference.",65889,Dan Huberty,coauthor,82R,2285,Rep. Dan Huberty,Dan Huberty
397,397,397,SB 461,Relating to the design and issuance of license plates for United States paratroopers.,65889,Dan Huberty,sponsor,82R,2285,Rep. Dan Huberty,Dan Huberty
398,398,398,SB 778,Relating to the inclusion of professional staff who educate students with disabilities on district-level and campus-level planning and decision-making committees.,65889,Dan Huberty,sponsor,82R,2285,Rep. Dan Huberty,Dan Huberty
399,399,399,SB 1113,Relating to certain contracts entered into by school districts for another entity to provide food services at one or more district schools.,65889,Dan Huberty,sponsor,82R,2285,Rep. Dan Huberty,Dan Huberty
400,400,400,SB 1788,Relating to planning for students enrolled in public school special education programs.,65889,Dan Huberty,sponsor,82R,2285,Rep. Dan Huberty,Dan Huberty
401,401,401,SB 14,"Relating to requirements to vote, including presenting proof of identification; providing criminal penalties.",65889,Dan Huberty,cosponsor,82R,2285,Rep. Dan Huberty,Dan Huberty
402,402,402,SB 24,"Relating to the prosecution, punishment, and certain criminal and civil consequences of offenses involving or related to the trafficking of persons and to certain protections for victims of those offenses.",65889,Dan Huberty,cosponsor,82R,2285,Rep. Dan Huberty,Dan Huberty
403,403,403,SB 257,"Relating to the issuance of ""Choose Life"" license plates and the creation of the Choose Life account in the general revenue fund.",65889,Dan Huberty,cosponsor,82R,2285,Rep. Dan Huberty,Dan Huberty
404,404,404,SB 371,Relating to the eligibility for service retirement annuities of certain elected officials convicted of certain crimes.,65889,Dan Huberty,cosponsor,82R,2285,Rep. Dan Huberty,Dan Huberty
405,405,405,SB 1353,Relating to certain claims against persons licensed as real estate brokers and salespersons.,65889,Dan Huberty,cosponsor,82R,2285,Rep. Dan Huberty,Dan Huberty
