Unnamed: 0,Unnamed: 0.1,Unnamed: 0.1.1,bill_name,caption,filer_id,filer_name,function,session,leg_id,original_name,parsed_name
278,278,278,SB 304,Relating to municipal officer and employee participation in state travel services contracts.,-1,Kim Brimer,author,78R,1100,Sen. Kim Brimer,Kim Brimer
279,279,279,SB 331,Relating to statistical information concerning certain judicial proceedings to bypass parental notice of a minor's abortion.,-1,Kim Brimer,author,78R,1100,Sen. Kim Brimer,Kim Brimer
280,280,280,SB 656,Relating to the removal of certain on-premise signs in a municipality.,-1,Kim Brimer,author,78R,1100,Sen. Kim Brimer,Kim Brimer
281,281,281,SB 657,Relating to the effect of tax increment financing by certain taxing units in the calculation of ad valorem tax rates for those taxing units.,-1,Kim Brimer,author,78R,1100,Sen. Kim Brimer,Kim Brimer
282,282,282,SB 658,Relating to making permanent the exemption from ad valorem taxation of motor vehicles leased for personal use.,-1,Kim Brimer,author,78R,1100,Sen. Kim Brimer,Kim Brimer
283,283,283,SB 659,Relating to the creation of the economic development coordinator; the abolition of the Texas Department of Economic Development and the transfer of its functions to the economic development coordinator; and the establishment of economic and business development programs to be administered by the economic development coordinator.,-1,Kim Brimer,author,78R,1100,Sen. Kim Brimer,Kim Brimer
284,284,284,SB 731,Relating to the local registration of retail electric providers.,-1,Kim Brimer,author,78R,1100,Sen. Kim Brimer,Kim Brimer
285,285,285,SB 732,Relating to discounts or other forms of pricing flexibility for telecommunications services.,-1,Kim Brimer,author,78R,1100,Sen. Kim Brimer,Kim Brimer
286,286,286,SB 757,Relating to the application for a candidate to be placed on the general primary election ballot.,-1,Kim Brimer,author,78R,1100,Sen. Kim Brimer,Kim Brimer
287,287,287,SB 758,Relating to the application of the sales tax to services for repairing and remodeling certain commercial properties.,-1,Kim Brimer,author,78R,1100,Sen. Kim Brimer,Kim Brimer
288,288,288,SB 759,Relating to certain pesticide application by persons engaged in pest control work for a political subdivision.,-1,Kim Brimer,author,78R,1100,Sen. Kim Brimer,Kim Brimer
289,289,289,SB 760,Relating to the sale of land by the Parks and Wildlife Department.,-1,Kim Brimer,author,78R,1100,Sen. Kim Brimer,Kim Brimer
290,290,290,SB 798,Relating to the imposition of a surcharge for use of a credit card.,-1,Kim Brimer,author,78R,1100,Sen. Kim Brimer,Kim Brimer
291,291,291,SB 849,Relating to authorizing the Texas Animal Health Commission to charge inspection fees.,-1,Kim Brimer,author,78R,1100,Sen. Kim Brimer,Kim Brimer
292,292,292,SB 884,Relating to county authority to regulate the placement of water wells in unincorporated areas of the county; providing a penalty.,-1,Kim Brimer,author,78R,1100,Sen. Kim Brimer,Kim Brimer
293,293,293,SB 901,Relating to an exemption from the franchise tax for certain business activities involving wind energy facilities.,-1,Kim Brimer,author,78R,1100,Sen. Kim Brimer,Kim Brimer
294,294,294,SB 981,Relating to the eligibility for unemployment benefits of individuals who are unemployed due to certain labor disputes.,-1,Kim Brimer,author,78R,1100,Sen. Kim Brimer,Kim Brimer
295,295,295,SB 1525,Relating to the storage location of certain tobacco products.,-1,Kim Brimer,author,78R,1100,Sen. Kim Brimer,Kim Brimer
296,296,296,SB 1526,Relating to collection and use of information in connection with licensing regarding a retail installment transaction involving a motor vehicle.,-1,Kim Brimer,author,78R,1100,Sen. Kim Brimer,Kim Brimer
297,297,297,SB 1527,Relating to a purchaser's right to cure default under an executory contract for conveyance.,-1,Kim Brimer,author,78R,1100,Sen. Kim Brimer,Kim Brimer
298,298,298,SB 1528,Relating to the disposition of cruelly treated animals.,-1,Kim Brimer,author,78R,1100,Sen. Kim Brimer,Kim Brimer
299,299,299,SB 1529,Relating to the disposition and administration of the workers' compensation subsequent injury fund.,-1,Kim Brimer,author,78R,1100,Sen. Kim Brimer,Kim Brimer
300,300,300,SB 1530,Relating to the establishment of economic and business development programs to be administered by the Texas Department of Economic Development.,-1,Kim Brimer,author,78R,1100,Sen. Kim Brimer,Kim Brimer
301,301,301,SB 1531,Relating to the composition of certain districts of the Texas Senate.,-1,Kim Brimer,author,78R,1100,Sen. Kim Brimer,Kim Brimer
302,302,302,SB 1532,Relating to the filing of an application for registration of a trademark or service mark and other trademark instruments with the secretary of state.,-1,Kim Brimer,author,78R,1100,Sen. Kim Brimer,Kim Brimer
303,303,303,SB 1533,Relating to the filing of a financing statement record under the Uniform Commercial Code.,-1,Kim Brimer,author,78R,1100,Sen. Kim Brimer,Kim Brimer
304,304,304,SB 1558,Relating to the creation and powers of a north Texas regional mobility authority.,-1,Kim Brimer,author,78R,1100,Sen. Kim Brimer,Kim Brimer
305,305,305,SB 1717,Relating to the governance and operation of The University of Texas at Arlington.,-1,Kim Brimer,author,78R,1100,Sen. Kim Brimer,Kim Brimer
306,306,306,SB 1771,Relating to economic development programs and funding.,-1,Kim Brimer,author,78R,1100,Sen. Kim Brimer,Kim Brimer
307,307,307,SCR 54,"Granting Town Talk Foods, Inc., and Thomas E. Potthoff permission to sue the State of Texas and the Texas Department of Health.",-1,Kim Brimer,author,78R,1100,Sen. Kim Brimer,Kim Brimer
308,308,308,SJR 2,Proposing a constitutional amendment authorizing a portion of the annual distribution from the permanent university fund to be appropriated to support certain institutions in The University of Texas System.,-1,Kim Brimer,author,78R,1100,Sen. Kim Brimer,Kim Brimer
309,309,309,SJR 38,Proposing a constitutional amendment providing that payment of retirement and related benefits to certain public employees is a contractual obligation that cannot be reduced or impaired.,-1,Kim Brimer,author,78R,1100,Sen. Kim Brimer,Kim Brimer
310,310,310,SJR 59,Proposing a constitutional amendment to provide for the continuation of funding for capital improvements and acquisitions at The University of Texas at Arlington.,-1,Kim Brimer,author,78R,1100,Sen. Kim Brimer,Kim Brimer
311,311,311,SR 104,"In memory of Wilson Clark Martin, Jr., of Fort Worth.",-1,Kim Brimer,author,78R,1100,Sen. Kim Brimer,Kim Brimer
312,312,312,SR 105,Commending Jeff Wentworth of Fort Worth for his service to his community.,-1,Kim Brimer,author,78R,1100,Sen. Kim Brimer,Kim Brimer
313,313,313,SR 106,Commending Mary Rebekah Krsnak of Fort Worth for earning a Milken Family Foundation National Educator Award.,-1,Kim Brimer,author,78R,1100,Sen. Kim Brimer,Kim Brimer
314,314,314,SR 158,In memory of Jerry W. Allen of Fort Worth.,-1,Kim Brimer,author,78R,1100,Sen. Kim Brimer,Kim Brimer
315,315,315,SR 159,Commending the football team of Everman High School in Everman for winning a championship title.,-1,Kim Brimer,author,78R,1100,Sen. Kim Brimer,Kim Brimer
316,316,316,SR 241,Congratulating James and Maxine Marchbanks on their 53rd wedding anniversary.,-1,Kim Brimer,author,78R,1100,Sen. Kim Brimer,Kim Brimer
317,317,317,SR 242,Congratulating the cheerleaders of Mansfield High School in Mansfield for winning a national competition.,-1,Kim Brimer,author,78R,1100,Sen. Kim Brimer,Kim Brimer
318,318,318,SR 313,"In memory of William ""Bill"" Patrick Abbott of Kennedale.",-1,Kim Brimer,author,78R,1100,Sen. Kim Brimer,Kim Brimer
319,319,319,SR 314,"Recognizing March 11, 2003, as Parent Association for the Retarded of Texas Day at the State Capitol.",-1,Kim Brimer,author,78R,1100,Sen. Kim Brimer,Kim Brimer
320,320,320,SR 454,In memory of Allen Hardy Sanders of Colleyville.,-1,Kim Brimer,author,78R,1100,Sen. Kim Brimer,Kim Brimer
321,321,321,SR 455,"In memory of Osro Lycurgus ""O. L."" Watson, Jr., of Mansfield.",-1,Kim Brimer,author,78R,1100,Sen. Kim Brimer,Kim Brimer
322,322,322,SR 488,Commending the members of the Leadership Fort Worth Class of 2003.,-1,Kim Brimer,author,78R,1100,Sen. Kim Brimer,Kim Brimer
323,323,323,SR 489,"Recognizing April 7, 2003, as Mansfield Day at the State Capitol.",-1,Kim Brimer,author,78R,1100,Sen. Kim Brimer,Kim Brimer
324,324,324,SR 502,Commending Esteban Guillen of Grapevine for coming to the aid of a fellow man.,-1,Kim Brimer,author,78R,1100,Sen. Kim Brimer,Kim Brimer
325,325,325,SR 607,Commending Russell Don Steagall.,-1,Kim Brimer,author,78R,1100,Sen. Kim Brimer,Kim Brimer
326,326,326,SR 608,Paying tribute to Kenneth L. Barr of Fort Worth for his service to his community.,-1,Kim Brimer,author,78R,1100,Sen. Kim Brimer,Kim Brimer
327,327,327,SR 885,"Honoring our armed forces during May of 2003, National Military Appreciation Month.",-1,Kim Brimer,author,78R,1100,Sen. Kim Brimer,Kim Brimer
328,328,328,SR 918,In memory of Jason Eric Bentley of Hurst.,-1,Kim Brimer,author,78R,1100,Sen. Kim Brimer,Kim Brimer
329,329,329,SR 946,Commending Joni McCoy for her accomplishments.,-1,Kim Brimer,author,78R,1100,Sen. Kim Brimer,Kim Brimer
330,330,330,SB 1,General Appropriations Bill.,-1,Kim Brimer,coauthor,78R,1100,Sen. Kim Brimer,Kim Brimer
331,331,331,SB 2,"Relating to public school finance, a state ad valorem tax, state general sales and use taxes, state taxes on the sale or use of a motor vehicle, and property tax relief for residential tenants.",-1,Kim Brimer,coauthor,78R,1100,Sen. Kim Brimer,Kim Brimer
332,332,332,SB 7,Relating to the recognition of a same-sex marriage or a civil union.,-1,Kim Brimer,coauthor,78R,1100,Sen. Kim Brimer,Kim Brimer
333,333,333,SB 10,Relating to the creation of employer health benefit plan groups.,-1,Kim Brimer,coauthor,78R,1100,Sen. Kim Brimer,Kim Brimer
334,334,334,SB 156,Relating to the regulation of cloning of human beings; providing penalties.,-1,Kim Brimer,coauthor,78R,1100,Sen. Kim Brimer,Kim Brimer
335,335,335,SB 310,Relating to rate information to be filed by certain insurers of residential property; providing an administrative penalty.,-1,Kim Brimer,coauthor,78R,1100,Sen. Kim Brimer,Kim Brimer
336,336,336,SB 319,Relating to the death of or injury to an unborn child; providing penalties.,-1,Kim Brimer,coauthor,78R,1100,Sen. Kim Brimer,Kim Brimer
337,337,337,SB 630,Relating to the recognition of a same-sex marriage or civil union.,-1,Kim Brimer,coauthor,78R,1100,Sen. Kim Brimer,Kim Brimer
338,338,338,SB 835,Relating to regulation of abortion; creating an offense.,-1,Kim Brimer,coauthor,78R,1100,Sen. Kim Brimer,Kim Brimer
339,339,339,SB 1220,Relating to the Texas emissions reduction plan.,-1,Kim Brimer,coauthor,78R,1100,Sen. Kim Brimer,Kim Brimer
340,340,340,SB 1409,Relating to the regional emergency medical dispatch resource center pilot program.,-1,Kim Brimer,coauthor,78R,1100,Sen. Kim Brimer,Kim Brimer
341,341,341,SB 1874,Relating to naming the school of pharmacy at Texas A&M University--Kingsville and its physical facility after Irma Rangel.,-1,Kim Brimer,coauthor,78R,1100,Sen. Kim Brimer,Kim Brimer
342,342,342,SB 1953,Relating to the criminal consequences of conduct that involves the trafficking of persons; providing penalties.,-1,Kim Brimer,coauthor,78R,1100,Sen. Kim Brimer,Kim Brimer
343,343,343,SCR 1,Memorializing Congress to restore the federal income tax deductibility of state and local sales taxes.,-1,Kim Brimer,coauthor,78R,1100,Sen. Kim Brimer,Kim Brimer
344,344,344,SCR 17,"Recognizing the artists and arts patrons who are being honored at the Texas Medal of Arts Awards on March 25, 2003.",-1,Kim Brimer,coauthor,78R,1100,Sen. Kim Brimer,Kim Brimer
345,345,345,SJR 1,"Proposing a constitutional amendment to provide financial support for public education by creating the Texas education fund, imposing a state property tax, increasing the state general sales and use tax rate, expanding the general sales and use tax base to include certain services, increasing the state motor vehicle sales and use tax rate, abolishing the school district property tax for maintenance and operations purposes, dedicating the proceeds of any state lottery to public education, authorizing a school district property tax for the purpose of educational enrichment, and repealing the restriction on the legislature's authority to limit annual increases in the appraised value of residence homesteads for ad valorem tax purposes.",-1,Kim Brimer,coauthor,78R,1100,Sen. Kim Brimer,Kim Brimer
346,346,346,SR 179,"Commending Dr. Thomas A. Carlson for saving the life of Don Long, the Texas Senate Doorkeeper.",-1,Kim Brimer,coauthor,78R,1100,Sen. Kim Brimer,Kim Brimer
347,347,347,SR 211,"Recognizing February 26, 2003, as Tarrant County Day at the State Capitol.",-1,Kim Brimer,coauthor,78R,1100,Sen. Kim Brimer,Kim Brimer
348,348,348,SR 237,"Recognizing February 26, 2003, as Emmitt Smith Day at the State Capitol.",-1,Kim Brimer,coauthor,78R,1100,Sen. Kim Brimer,Kim Brimer
349,349,349,SR 711,Commending the Texas High School Rodeo Association.,-1,Kim Brimer,coauthor,78R,1100,Sen. Kim Brimer,Kim Brimer
350,350,350,SR 916,Congratulating the Dallas Mavericks.,-1,Kim Brimer,coauthor,78R,1100,Sen. Kim Brimer,Kim Brimer
351,351,351,SR 1016,Commending United States Marine Corps Captain Michael Ogden for his service to his country.,-1,Kim Brimer,coauthor,78R,1100,Sen. Kim Brimer,Kim Brimer
352,352,352,HB 276,Relating to the award of attorney's fees and costs in an action against a fraudulent transfer.,-1,Kim Brimer,sponsor,78R,1100,Sen. Kim Brimer,Kim Brimer
353,353,353,HB 671,Relating to the requirements for certain alcoholic beverage licenses.,-1,Kim Brimer,sponsor,78R,1100,Sen. Kim Brimer,Kim Brimer
354,354,354,HB 850,Relating to the regulation of the sale of a tow truck at a new motor vehicle show or exhibition.,-1,Kim Brimer,sponsor,78R,1100,Sen. Kim Brimer,Kim Brimer
355,355,355,HB 893,"Relating to the correction of an appraisal roll, a tax roll, and other appropriate records following the final determination of an ad valorem tax appeal.",-1,Kim Brimer,sponsor,78R,1100,Sen. Kim Brimer,Kim Brimer
356,356,356,HB 904,Relating to certain nonprofit cemetery corporations.,-1,Kim Brimer,sponsor,78R,1100,Sen. Kim Brimer,Kim Brimer
357,357,357,HB 1061,Relating to municipal officer and employee participation in state travel services contracts.,-1,Kim Brimer,sponsor,78R,1100,Sen. Kim Brimer,Kim Brimer
358,358,358,HB 1066,Relating to the continuance of the municipal court technology fund and the purposes for which the fund may be used.,-1,Kim Brimer,sponsor,78R,1100,Sen. Kim Brimer,Kim Brimer
359,359,359,HB 1119,Relating to the disposition of cruelly treated animals.,-1,Kim Brimer,sponsor,78R,1100,Sen. Kim Brimer,Kim Brimer
360,360,360,HB 1232,Relating to the expiration of alcoholic beverage permits and licenses.,-1,Kim Brimer,sponsor,78R,1100,Sen. Kim Brimer,Kim Brimer
361,361,361,HB 1369,Relating to the local registration of retail electric providers.,-1,Kim Brimer,sponsor,78R,1100,Sen. Kim Brimer,Kim Brimer
362,362,362,HB 1444,Relating to the exemption from ad valorem taxation of motor vehicles leased for noncommercial use.,-1,Kim Brimer,sponsor,78R,1100,Sen. Kim Brimer,Kim Brimer
363,363,363,HB 1773,Relating to regulation of junked vehicles.,-1,Kim Brimer,sponsor,78R,1100,Sen. Kim Brimer,Kim Brimer
364,364,364,HB 1944,Relating to the compensation of a statutory probate court judge while assigned as a visiting judge.,-1,Kim Brimer,sponsor,78R,1100,Sen. Kim Brimer,Kim Brimer
365,365,365,HB 1952,Relating to local regulation of public swimming pools.,-1,Kim Brimer,sponsor,78R,1100,Sen. Kim Brimer,Kim Brimer
366,366,366,HB 2043,Relating to the procedures for appointment of the board of directors of an appraisal district.,-1,Kim Brimer,sponsor,78R,1100,Sen. Kim Brimer,Kim Brimer
367,367,367,HB 2112,"Relating to the liability of an employer for actions of an employee in the sale, service, dispensing, or delivery of alcoholic beverages.",-1,Kim Brimer,sponsor,78R,1100,Sen. Kim Brimer,Kim Brimer
368,368,368,HB 2185,Relating to the issuance of a certificate of death by catastrophe.,-1,Kim Brimer,sponsor,78R,1100,Sen. Kim Brimer,Kim Brimer
369,369,369,HB 2386,Relating to the authority of certain municipalities or counties to impose a facility use tax to finance venue projects.,-1,Kim Brimer,sponsor,78R,1100,Sen. Kim Brimer,Kim Brimer
370,370,370,HB 2409,Relating to the disclosure of certain information held by a business offering check verification or check guarantee services.,-1,Kim Brimer,sponsor,78R,1100,Sen. Kim Brimer,Kim Brimer
371,371,371,HB 2466,Relating to the costs of reviewing a development project that must be approved by certain municipalities.,-1,Kim Brimer,sponsor,78R,1100,Sen. Kim Brimer,Kim Brimer
372,372,372,HB 2924,Relating to the addition of territory to a public improvement district.,-1,Kim Brimer,sponsor,78R,1100,Sen. Kim Brimer,Kim Brimer
373,373,373,HB 3167,Relating to filing fees for certain types of actions.,-1,Kim Brimer,sponsor,78R,1100,Sen. Kim Brimer,Kim Brimer
374,374,374,HB 3232,Relating to the collection of costs incurred by certain municipalities in remedying substandard conditions on a property.,-1,Kim Brimer,sponsor,78R,1100,Sen. Kim Brimer,Kim Brimer
375,375,375,HB 3414,Relating to the form used for filing a financing statement and certain other written records.,-1,Kim Brimer,sponsor,78R,1100,Sen. Kim Brimer,Kim Brimer
376,376,376,HB 3603,Relating to the appointment or election of judges of municipal courts of record in the City of Bedford.,-1,Kim Brimer,sponsor,78R,1100,Sen. Kim Brimer,Kim Brimer
377,377,377,HCR 33,Recognizing Terrence Bunkley of Fort Worth for his selection as a finalist in the Discovery Channel Young Scientist Challenge.,-1,Kim Brimer,sponsor,78R,1100,Sen. Kim Brimer,Kim Brimer
378,378,378,HCR 39,Honoring the Everman High School Bulldogs football team on their championship season.,-1,Kim Brimer,sponsor,78R,1100,Sen. Kim Brimer,Kim Brimer
379,379,379,HCR 47,Honoring Tarrant County extension agent Hurley E. Miller for receiving the 2002 Superior Service Award.,-1,Kim Brimer,sponsor,78R,1100,Sen. Kim Brimer,Kim Brimer
380,380,380,HCR 48,Honoring Sonya Blackwell Smith of the Dunbar 6th Grade Center in Fort Worth for being named an Academic Chair for Teaching Excellence in English.,-1,Kim Brimer,sponsor,78R,1100,Sen. Kim Brimer,Kim Brimer
381,381,381,HCR 49,Congratulating Ernest Mason of Dunbar High School in Fort Worth on being named a U.S. Army All-American.,-1,Kim Brimer,sponsor,78R,1100,Sen. Kim Brimer,Kim Brimer
382,382,382,HCR 50,"In memory of William Glenn Smiley, Jr., of Fort Worth.",-1,Kim Brimer,sponsor,78R,1100,Sen. Kim Brimer,Kim Brimer
383,383,383,HCR 71,Honoring Coach Robert Hughes of Dunbar High School for being the most successful high school basketball coach in history.,-1,Kim Brimer,sponsor,78R,1100,Sen. Kim Brimer,Kim Brimer
384,384,384,HCR 79,In memory of Dr. Marion Jack Brooks of Fort Worth.,-1,Kim Brimer,sponsor,78R,1100,Sen. Kim Brimer,Kim Brimer
385,385,385,HCR 107,"Congratulating RaShawn Washington of Fort Worth on the publication of her poem ""Talk.""",-1,Kim Brimer,sponsor,78R,1100,Sen. Kim Brimer,Kim Brimer
386,386,386,HCR 108,Honoring Dunbar Middle School student Tiffany Lewis of Fort Worth for her selection to attend the People to People Student Ambassador Program's 2003 Leadership Summit.,-1,Kim Brimer,sponsor,78R,1100,Sen. Kim Brimer,Kim Brimer
387,387,387,HCR 110,Congratulating Torivia N. Hernandez on being named a 2002-2003 Outstanding Teacher by the Fort Worth Independent School District.,-1,Kim Brimer,sponsor,78R,1100,Sen. Kim Brimer,Kim Brimer
388,388,388,HCR 111,Congratulating Rochelle M. Grisafi on being named a 2002-2003 Outstanding Teacher by the Fort Worth Independent School District.,-1,Kim Brimer,sponsor,78R,1100,Sen. Kim Brimer,Kim Brimer
389,389,389,HCR 112,Congratulating Crystal Clancy on being named a 2002-2003 Outstanding Teacher by the Fort Worth Independent School District.,-1,Kim Brimer,sponsor,78R,1100,Sen. Kim Brimer,Kim Brimer
390,390,390,HCR 113,Congratulating Sandra G. Farmer on being named a 2002-2003 Outstanding Teacher by the Fort Worth Independent School District.,-1,Kim Brimer,sponsor,78R,1100,Sen. Kim Brimer,Kim Brimer
391,391,391,HCR 114,Congratulating Shawne Briggs on being named a 2002-2003 Outstanding Teacher by the Fort Worth Independent School District.,-1,Kim Brimer,sponsor,78R,1100,Sen. Kim Brimer,Kim Brimer
392,392,392,HCR 115,Congratulating Kristy Muckleroy on being named a 2002-2003 Outstanding Teacher by the Fort Worth Independent School District.,-1,Kim Brimer,sponsor,78R,1100,Sen. Kim Brimer,Kim Brimer
393,393,393,HCR 116,Congratulating Karla Bevel on being named a 2002-2003 Outstanding Teacher by the Fort Worth Independent School District.,-1,Kim Brimer,sponsor,78R,1100,Sen. Kim Brimer,Kim Brimer
394,394,394,HCR 117,Congratulating Shaneeka Shannon on being named a 2002-2003 Outstanding Teacher by the Fort Worth Independent School District.,-1,Kim Brimer,sponsor,78R,1100,Sen. Kim Brimer,Kim Brimer
395,395,395,HCR 118,Congratulating Keith Haliburton on being named a 2002-2003 Outstanding Teacher by the Fort Worth Independent School District.,-1,Kim Brimer,sponsor,78R,1100,Sen. Kim Brimer,Kim Brimer
396,396,396,HCR 119,Congratulating Tonya Allen on being named a 2002-2003 Outstanding Teacher by the Fort Worth Independent School District.,-1,Kim Brimer,sponsor,78R,1100,Sen. Kim Brimer,Kim Brimer
397,397,397,HCR 120,Congratulating Paulino Rosales III on being named a 2002-2003 Outstanding Teacher by the Fort Worth Independent School District.,-1,Kim Brimer,sponsor,78R,1100,Sen. Kim Brimer,Kim Brimer
398,398,398,HCR 121,Congratulating Sedonia L. Johnson on being named a 2002-2003 Outstanding Teacher by the Fort Worth Independent School District.,-1,Kim Brimer,sponsor,78R,1100,Sen. Kim Brimer,Kim Brimer
399,399,399,HCR 122,Congratulating Andrea Curley Harper on being named a 2002-2003 Outstanding Teacher by the Fort Worth Independent School District.,-1,Kim Brimer,sponsor,78R,1100,Sen. Kim Brimer,Kim Brimer
400,400,400,HCR 123,Congratulating Lori Freeman on being named a 2002-2003 Outstanding Teacher by the Fort Worth Independent School District.,-1,Kim Brimer,sponsor,78R,1100,Sen. Kim Brimer,Kim Brimer
401,401,401,HCR 124,Congratulating Willanette Williams on being named a 2002-2003 Outstanding Teacher by the Fort Worth Independent School District.,-1,Kim Brimer,sponsor,78R,1100,Sen. Kim Brimer,Kim Brimer
402,402,402,HCR 127,In memory of Tarrence Leon White of Fort Worth.,-1,Kim Brimer,sponsor,78R,1100,Sen. Kim Brimer,Kim Brimer
403,403,403,HCR 128,Congratulating the Fort Worth Dunbar High School boys' basketball team on winning the 2003 UIL Class 4A state championship.,-1,Kim Brimer,sponsor,78R,1100,Sen. Kim Brimer,Kim Brimer
404,404,404,HCR 129,Congratulating Melzora Webster on being named a 2002-2003 Outstanding Teacher by the Fort Worth Independent School District.,-1,Kim Brimer,sponsor,78R,1100,Sen. Kim Brimer,Kim Brimer
405,405,405,HCR 130,Congratulating Kristen Williams on being named a 2002-2003 Outstanding Teacher by the Fort Worth Independent School District.,-1,Kim Brimer,sponsor,78R,1100,Sen. Kim Brimer,Kim Brimer
406,406,406,HCR 131,Congratulating Dorothy Westergren on being named a 2002-2003 Outstanding Teacher by the Fort Worth Independent School District.,-1,Kim Brimer,sponsor,78R,1100,Sen. Kim Brimer,Kim Brimer
407,407,407,HCR 132,Congratulating Patty Rose on being named a 2002-2003 Outstanding Teacher by the Fort Worth Independent School District.,-1,Kim Brimer,sponsor,78R,1100,Sen. Kim Brimer,Kim Brimer
408,408,408,HCR 133,Congratulating Mary Preston on being named a 2002-2003 Outstanding Teacher by the Fort Worth Independent School District.,-1,Kim Brimer,sponsor,78R,1100,Sen. Kim Brimer,Kim Brimer
409,409,409,HCR 134,Congratulating LaWanda Booghrey on being named a 2002-2003 Outstanding Teacher by the Fort Worth Independent School District.,-1,Kim Brimer,sponsor,78R,1100,Sen. Kim Brimer,Kim Brimer
410,410,410,HCR 135,Congratulating Ozella Campbell on being named a 2002-2003 Outstanding Teacher by the Fort Worth Independent School District.,-1,Kim Brimer,sponsor,78R,1100,Sen. Kim Brimer,Kim Brimer
411,411,411,HCR 136,Congratulating Mary Ornellas on being named a 2002-2003 Outstanding Teacher by the Fort Worth Independent School District.,-1,Kim Brimer,sponsor,78R,1100,Sen. Kim Brimer,Kim Brimer
412,412,412,HCR 137,Congratulating Latresa Kennard on being named a 2002-2003 Outstanding Teacher by the Fort Worth Independent School District.,-1,Kim Brimer,sponsor,78R,1100,Sen. Kim Brimer,Kim Brimer
413,413,413,HCR 138,Congratulating Roshea Phillips on being named a 2002-2003 Outstanding Teacher by the Fort Worth Independent School District.,-1,Kim Brimer,sponsor,78R,1100,Sen. Kim Brimer,Kim Brimer
414,414,414,HCR 139,Congratulating Erin Bushko on being named a 2002-2003 Outstanding Teacher by the Fort Worth Independent School District.,-1,Kim Brimer,sponsor,78R,1100,Sen. Kim Brimer,Kim Brimer
415,415,415,HCR 140,Congratulating La Tres Cole on being named a 2002-2003 Outstanding Teacher by the Fort Worth Independent School District.,-1,Kim Brimer,sponsor,78R,1100,Sen. Kim Brimer,Kim Brimer
416,416,416,HCR 141,Congratulating Ben Broadwater on being named a 2002-2003 Outstanding Teacher by the Fort Worth Independent School District.,-1,Kim Brimer,sponsor,78R,1100,Sen. Kim Brimer,Kim Brimer
417,417,417,HCR 142,Congratulating Juana Williams on being named a 2002-2003 Outstanding Teacher by the Fort Worth Independent School District.,-1,Kim Brimer,sponsor,78R,1100,Sen. Kim Brimer,Kim Brimer
418,418,418,HCR 143,Congratulating Karen Chaffin on being named a 2002-2003 Outstanding Teacher by the Fort Worth Independent School District.,-1,Kim Brimer,sponsor,78R,1100,Sen. Kim Brimer,Kim Brimer
