Unnamed: 0,Unnamed: 0.1,Unnamed: 0.1.1,bill_name,caption,filer_id,filer_name,function,session,leg_id,original_name,parsed_name
141,141,141,SB 497,Relating to the authority and responsibility of the Texas Motor Vehicle Board of the Texas Department of Transportation.,20189,Don Henderson,author,73R,1210,Sen. Don Henderson,Don Henderson
142,142,142,SB 505,Relating to the regulation of property development and development plats by a zoned or unzoned municipality with a population of more than 1.5 million.,20189,Don Henderson,author,73R,1210,Sen. Don Henderson,Don Henderson
143,143,143,SB 506,"Relating to the creation of multiple panels of, and to the operation of, a municipality's zoning board of adjustment; providing for the repeal of zoning regulations.",20189,Don Henderson,author,73R,1210,Sen. Don Henderson,Don Henderson
144,144,144,SB 548,Relating to judicial review of ad valorem tax appraisals of oil and gas pipelines and of electric transmission and distribution lines.,20189,Don Henderson,author,73R,1210,Sen. Don Henderson,Don Henderson
145,145,145,SB 596,Relating to the requirement that the chief justice deliver a state of the judiciary message to the legislature.,20189,Don Henderson,author,73R,1210,Sen. Don Henderson,Don Henderson
146,146,146,SB 610,Relating to the composition of a county bail bond board.,20189,Don Henderson,author,73R,1210,Sen. Don Henderson,Don Henderson
147,147,147,SB 680,Relating to allowing a limited partnership to operate as a common carrier for the transportation by pipeline of certain materials.,20189,Don Henderson,author,73R,1210,Sen. Don Henderson,Don Henderson
148,148,148,SB 682,Relating to the regulation and operation of tow trucks and storage facilities; providing penalties.,20189,Don Henderson,author,73R,1210,Sen. Don Henderson,Don Henderson
149,149,149,SB 709,"Relating to the management, investment, and expenditure of funds held by public institutions of higher education.",20189,Don Henderson,author,73R,1210,Sen. Don Henderson,Don Henderson
150,150,150,SB 777,Relating to statutory construction.,20189,Don Henderson,author,73R,1210,Sen. Don Henderson,Don Henderson
151,151,151,SB 857,Relating to court fees and costs in certain family law actions; making an appropriation to the attorney general.,20189,Don Henderson,author,73R,1210,Sen. Don Henderson,Don Henderson
152,152,152,SB 858,"Relating to the payment of child support to local registries and the Title IV-D registry for the collection of court-ordered child support and income withholding for child support, and to retroactive child support.",20189,Don Henderson,author,73R,1210,Sen. Don Henderson,Don Henderson
153,153,153,SB 859,Relating to the use of hearing officers in teacher hearings.,20189,Don Henderson,author,73R,1210,Sen. Don Henderson,Don Henderson
154,154,154,SB 860,Relating to the suspension of a public school teacher without pay.,20189,Don Henderson,author,73R,1210,Sen. Don Henderson,Don Henderson
155,155,155,SB 861,"Relating to the creation, operation, and organization of certain courts in this state.",20189,Don Henderson,author,73R,1210,Sen. Don Henderson,Don Henderson
156,156,156,SB 862,Relating to certain hotel facilities.,20189,Don Henderson,author,73R,1210,Sen. Don Henderson,Don Henderson
157,157,157,SB 863,Relating to the regulation of air conditioning and refrigeration contractors.,20189,Don Henderson,author,73R,1210,Sen. Don Henderson,Don Henderson
158,158,158,SB 864,"Relating to driver's licenses, permits, and resident and nonresident operating privileges.",20189,Don Henderson,author,73R,1210,Sen. Don Henderson,Don Henderson
159,159,159,SB 865,Relating to appraisal review boards and to certain property tax agreements.,20189,Don Henderson,author,73R,1210,Sen. Don Henderson,Don Henderson
160,160,160,SB 1227,"Relating to the offenses of barratry, falsely holding oneself out as a lawyer, and the unauthorized practice of law; relating to solicitations regarding certain investigative, legal, and health care professional employment; providing penalties.",20189,Don Henderson,author,73R,1210,Sen. Don Henderson,Don Henderson
161,161,161,SB 1228,Relating to certain solicitations regarding professional employment.,20189,Don Henderson,author,73R,1210,Sen. Don Henderson,Don Henderson
162,162,162,SB 1229,Relating to the administration of certain districts providing fire and emergency services.,20189,Don Henderson,author,73R,1210,Sen. Don Henderson,Don Henderson
163,163,163,SB 1230,Relating to the conveyance of parks in certain municipalities.,20189,Don Henderson,author,73R,1210,Sen. Don Henderson,Don Henderson
164,164,164,SB 1231,Relating to certain information required of property and casualty insurers.,20189,Don Henderson,author,73R,1210,Sen. Don Henderson,Don Henderson
165,165,165,SB 1244,"Relating to the use of alternative fuels; establishing a alternative fuels council, developing an alternative fuels program, and managing certain appropriated funds.",20189,Don Henderson,author,73R,1210,Sen. Don Henderson,Don Henderson
166,166,166,SB 1245,Relating to athletic trainers.,20189,Don Henderson,author,73R,1210,Sen. Don Henderson,Don Henderson
167,167,167,SB 1268,Relating to elections concerning zoning issues in home-rule municipalities.,20189,Don Henderson,author,73R,1210,Sen. Don Henderson,Don Henderson
168,168,168,SB 1333,Relating to the creation of an offense involving sales of tickets to certain events; providing a penalty.,20189,Don Henderson,author,73R,1210,Sen. Don Henderson,Don Henderson
169,169,169,SB 1382,Relating to changing the date of a political subdivision's general election for officers.,20189,Don Henderson,author,73R,1210,Sen. Don Henderson,Don Henderson
170,170,170,SB 1431,Relating to approval of and objection to assignment of certain visiting judges.,20189,Don Henderson,author,73R,1210,Sen. Don Henderson,Don Henderson
171,171,171,SB 1457,"Relating to the creation of the County Criminal Court at Law No. 15 of Harris County, Texas.",20189,Don Henderson,author,73R,1210,Sen. Don Henderson,Don Henderson
172,172,172,SB 1464,"Relating to the regulation by home-rule municipalities of streets, avenues, alleys, and boulevards on which certain residences are located.",20189,Don Henderson,author,73R,1210,Sen. Don Henderson,Don Henderson
173,173,173,SB 1466,"Relating to appraisal districts, appraisal review boards, property tax appraisal rolls, property tax collections, and property tax appeals.",20189,Don Henderson,author,73R,1210,Sen. Don Henderson,Don Henderson
174,174,174,SCR 8,"Granting John R. Phenix & Associates, Inc., permission to sue the State of Texas and the University of Houston System.",20189,Don Henderson,author,73R,1210,Sen. Don Henderson,Don Henderson
175,175,175,SCR 43,Requesting the Council of the Alternative Dispute Resolution Section of the State Bar to provide advisory assistance to the Senate Committee on Jurisprudence.,20189,Don Henderson,author,73R,1210,Sen. Don Henderson,Don Henderson
176,176,176,SCR 107,Authorizing the chief clerk of the house to return House Bill 1564 to the senate for further consideration.,20189,Don Henderson,author,73R,1210,Sen. Don Henderson,Don Henderson
177,177,177,SCR 108,Authorizing the chief clerk of the house to return H.B. 7 to the senate for further consideration.,20189,Don Henderson,author,73R,1210,Sen. Don Henderson,Don Henderson
178,178,178,SCR 112,Instructing the enrolling clerk to make corrections to H.B. 2685.,20189,Don Henderson,author,73R,1210,Sen. Don Henderson,Don Henderson
179,179,179,SR 25,Congratulating Kevin Farnsworth on achieving the rank of Eagle Scout.,20189,Don Henderson,author,73R,1210,Sen. Don Henderson,Don Henderson
180,180,180,SR 26,Congratulating Aaron Theilhorn on achieving the rank of Eagle Scout.,20189,Don Henderson,author,73R,1210,Sen. Don Henderson,Don Henderson
181,181,181,SR 28,Congratulating Chris Hardisty on achieving the rank of Eagle Scout.,20189,Don Henderson,author,73R,1210,Sen. Don Henderson,Don Henderson
182,182,182,SR 29,Congratulating Andy Speyer on achieving the rank of Eagle Scout.,20189,Don Henderson,author,73R,1210,Sen. Don Henderson,Don Henderson
183,183,183,SR 87,Congratulating Nathan J. Davis of Houston on achieving the rank of Eagle Scout.,20189,Don Henderson,author,73R,1210,Sen. Don Henderson,Don Henderson
184,184,184,SR 88,"Congratulating Jan White, who was chosen ""Council Woman of the Year"" for the Houston 1960 Chapter of the Women's Council of Realtors for 1992.",20189,Don Henderson,author,73R,1210,Sen. Don Henderson,Don Henderson
185,185,185,SR 89,Congratulating Travis Smith of Houston on achieving the rank of Eagle Scout.,20189,Don Henderson,author,73R,1210,Sen. Don Henderson,Don Henderson
186,186,186,SR 308,Congratulating Clinton John Burkholder on achieving the rank of Eagle Scout.,20189,Don Henderson,author,73R,1210,Sen. Don Henderson,Don Henderson
187,187,187,SR 309,Congratulating Aaron Parker on achieving the rank of Eagle Scout.,20189,Don Henderson,author,73R,1210,Sen. Don Henderson,Don Henderson
188,188,188,SR 427,"Commending the volunteers who work with Family Outreach Center, Incorporated, of North Harris County and the Spring Branch/Memorial Family Outreach Center, Incorporated.",20189,Don Henderson,author,73R,1210,Sen. Don Henderson,Don Henderson
189,189,189,SR 442,In memory of Dr. Jerome Nathaniel Sherman of Houston.,20189,Don Henderson,author,73R,1210,Sen. Don Henderson,Don Henderson
190,190,190,SR 469,"Congratulating Marilyn D. Rhinehart of Spring, who was selected as a recipient of the 1992 T. R. Fehrenbach Book Award by the Texas Historical Commission and Dow Chemical Company.",20189,Don Henderson,author,73R,1210,Sen. Don Henderson,Don Henderson
191,191,191,SR 478,"Commending Carol Black of Avondale, Pennsylvania, for her perseverance and adventuresome spirit and declaring her an honorary Texan.",20189,Don Henderson,author,73R,1210,Sen. Don Henderson,Don Henderson
192,192,192,SR 489,Congratulating Michael Mathena of Spring on achieving the rank of Eagle Scout.,20189,Don Henderson,author,73R,1210,Sen. Don Henderson,Don Henderson
193,193,193,SR 490,Congratulating Philip Gonzalez on achieving the rank of Eagle Scout.,20189,Don Henderson,author,73R,1210,Sen. Don Henderson,Don Henderson
194,194,194,SR 491,Congratulating Eric Waligura of Houston on achieving the rank of Eagle Scout.,20189,Don Henderson,author,73R,1210,Sen. Don Henderson,Don Henderson
195,195,195,SR 492,Congratulating Tony Lyons on achieving the rank of Eagle Scout.,20189,Don Henderson,author,73R,1210,Sen. Don Henderson,Don Henderson
196,196,196,SR 493,Congratulating Jeff Moore on achieving the rank of Eagle Scout.,20189,Don Henderson,author,73R,1210,Sen. Don Henderson,Don Henderson
197,197,197,SR 494,Congratulating Stephen Lunsford of Houston on achieving the rank of Eagle Scout.,20189,Don Henderson,author,73R,1210,Sen. Don Henderson,Don Henderson
198,198,198,SR 495,Congratulating David Mensing on achieving the rank of Eagle Scout.,20189,Don Henderson,author,73R,1210,Sen. Don Henderson,Don Henderson
199,199,199,SR 528,Congratulating Brent Dyer of Houston on achieving the rank of Eagle Scout.,20189,Don Henderson,author,73R,1210,Sen. Don Henderson,Don Henderson
200,200,200,SR 529,"Congratulating Ronald L. Lewis, Jr., of Houston on achieving the rank of Eagle Scout.",20189,Don Henderson,author,73R,1210,Sen. Don Henderson,Don Henderson
201,201,201,SR 533,Congratulating Dorothy Elaine Gillis Lindsey on the occasion of her 65th birthday.,20189,Don Henderson,author,73R,1210,Sen. Don Henderson,Don Henderson
202,202,202,SR 696,Recognizing Oak Creek Elementary School in the Spring Independent School District on the occasion of its 20th anniversary.,20189,Don Henderson,author,73R,1210,Sen. Don Henderson,Don Henderson
203,203,203,SR 697,"Recognizing ITT Educational Services, Incorporated, on the occasion of its 25th anniversary.",20189,Don Henderson,author,73R,1210,Sen. Don Henderson,Don Henderson
204,204,204,SR 698,Congratulating Anthony Wayne Hearn on achieving the rank of Eagle Scout.,20189,Don Henderson,author,73R,1210,Sen. Don Henderson,Don Henderson
205,205,205,SR 699,Congratulating Jeffery Michael Parson on achieving the rank of Eagle Scout.,20189,Don Henderson,author,73R,1210,Sen. Don Henderson,Don Henderson
206,206,206,SR 700,Congratulating Scott Alan Parson on achieving the rank of Eagle Scout.,20189,Don Henderson,author,73R,1210,Sen. Don Henderson,Don Henderson
207,207,207,SR 701,Congratulating Michael W. Mathena of Spring on achieving the rank of Eagle Scout.,20189,Don Henderson,author,73R,1210,Sen. Don Henderson,Don Henderson
208,208,208,SR 702,Congratulating Jason Gardner of Houston on achieving the rank of Eagle Scout.,20189,Don Henderson,author,73R,1210,Sen. Don Henderson,Don Henderson
209,209,209,SR 703,Congratulating Jonathan Balas on achieving the rank of Eagle Scout.,20189,Don Henderson,author,73R,1210,Sen. Don Henderson,Don Henderson
210,210,210,SR 704,Congratulating Craig Jeter on achieving the rank of Eagle Scout.,20189,Don Henderson,author,73R,1210,Sen. Don Henderson,Don Henderson
211,211,211,SR 705,Congratulating Stephen Anthis on achieving the rank of Eagle Scout.,20189,Don Henderson,author,73R,1210,Sen. Don Henderson,Don Henderson
212,212,212,SR 742,Recognizing Krahn Elementary School of the Klein Independent School District on the occasion of its 10th anniversary.,20189,Don Henderson,author,73R,1210,Sen. Don Henderson,Don Henderson
213,213,213,SR 849,Congratulating John Evans on achieving the rank of Eagle Scout.,20189,Don Henderson,author,73R,1210,Sen. Don Henderson,Don Henderson
214,214,214,SR 857,Congratulating Donald V. and Marjorie Blanton Henderson of Houston on the occasion of their 50th wedding anniversary.,20189,Don Henderson,author,73R,1210,Sen. Don Henderson,Don Henderson
215,215,215,SR 912,Recognizing the Hildebrandt Intermediate School for earning second place in the middle school division of the H.E.B./General Land Office Environmental Challenge.,20189,Don Henderson,author,73R,1210,Sen. Don Henderson,Don Henderson
216,216,216,SR 913,"Congratulating Carol Sheridan McGee of Santa Fe, New Mexico, on the occasion of her 47th birthday.",20189,Don Henderson,author,73R,1210,Sen. Don Henderson,Don Henderson
217,217,217,SR 970,Commending the founding fathers and mothers of the Texas Junior State for their drive and determination in achieving statehood.,20189,Don Henderson,author,73R,1210,Sen. Don Henderson,Don Henderson
218,218,218,SR 971,"Commending Bobbie Jo Choice Shephard for being selected as the 1993 Humanitarian of the Year by The Accomplishers, a group of Christians from various churches in Houston and the surrounding area.",20189,Don Henderson,author,73R,1210,Sen. Don Henderson,Don Henderson
219,219,219,SR 972,Congratulating Brett O'Neil of Spring on achieving the rank of Eagle Scout.,20189,Don Henderson,author,73R,1210,Sen. Don Henderson,Don Henderson
220,220,220,SR 973,Congratulating Mr. and Mrs. Stan Weiss on the occasion of their 50th wedding anniversary.,20189,Don Henderson,author,73R,1210,Sen. Don Henderson,Don Henderson
221,221,221,SR 1043,"Congratulating Kelly Rueben Short, who was named Outstanding Male Student from Episcopal High School in Houston.",20189,Don Henderson,author,73R,1210,Sen. Don Henderson,Don Henderson
222,222,222,SB 197,Relating to rights and remedies under The Securities Act.,20189,Don Henderson,author,73R,1210,Sen. Don Henderson,Don Henderson
223,223,223,SR 218,"In memory of J. Frank Melcher, Sr., of Harris County.",20189,Don Henderson,author,73R,1210,Sen. Don Henderson,Don Henderson
224,224,224,SB 2,Relating to the application of the doctrine of forum non conveniens to certain actions.,20189,Don Henderson,coauthor,73R,1210,Sen. Don Henderson,Don Henderson
225,225,225,SB 4,Relating to products liability.,20189,Don Henderson,coauthor,73R,1210,Sen. Don Henderson,Don Henderson
226,226,226,SB 25,"Relating to the offense of harassment and including within that offense conduct that constitutes stalking; providing limitations on release on bond, furlough, probation, and parole; and providing notification.",20189,Don Henderson,coauthor,73R,1210,Sen. Don Henderson,Don Henderson
227,227,227,SB 155,Relating to the creation of the Texas Commission on Children and Youth.,20189,Don Henderson,coauthor,73R,1210,Sen. Don Henderson,Don Henderson
228,228,228,SB 245,Relating to apportionment of the state into senatorial districts.,20189,Don Henderson,coauthor,73R,1210,Sen. Don Henderson,Don Henderson
229,229,229,SB 778,Relating to the dedication of certain funds for the use of the Texas Commission on the Arts.,20189,Don Henderson,coauthor,73R,1210,Sen. Don Henderson,Don Henderson
230,230,230,SB 1105,Relating to parental notification before an abortion may be performed on a minor; providing a criminal penalty.,20189,Don Henderson,coauthor,73R,1210,Sen. Don Henderson,Don Henderson
231,231,231,SB 1408,Relating to discrimination by certain accommodations and associations; imposing civil penalties.,20189,Don Henderson,coauthor,73R,1210,Sen. Don Henderson,Don Henderson
232,232,232,SR 1003,Congratulating John and Girlinear Langston of Dallas on the occasion of their 60th wedding anniversary.,20189,Don Henderson,coauthor,73R,1210,Sen. Don Henderson,Don Henderson
233,233,233,SR 1033,"Recognizing Dr. Joseph T. Painter, who will be installed as the 148th president of the American Medical Association.",20189,Don Henderson,coauthor,73R,1210,Sen. Don Henderson,Don Henderson
234,234,234,HB 5,Relating to the regulation of air conditioning and refrigeration contractors.,20189,Don Henderson,sponsor,73R,1210,Sen. Don Henderson,Don Henderson
235,235,235,HB 7,Relating to the criteria for enforceability of covenants not to compete and to certain procedures and remedies in actions to enforce those convenants.,20189,Don Henderson,sponsor,73R,1210,Sen. Don Henderson,Don Henderson
236,236,236,HB 38,Relating to fees charged by a notary public.,20189,Don Henderson,sponsor,73R,1210,Sen. Don Henderson,Don Henderson
237,237,237,HB 301,Relating to judicial review of certain ad valorem tax determinations.,20189,Don Henderson,sponsor,73R,1210,Sen. Don Henderson,Don Henderson
238,238,238,HB 728,Relating to the annexation of and provision of services to areas by certain municipalities.,20189,Don Henderson,sponsor,73R,1210,Sen. Don Henderson,Don Henderson
239,239,239,HB 941,Relating to the authority and responsibility of the Texas Motor Vehicle Board of the Texas Department of Transportation.,20189,Don Henderson,sponsor,73R,1210,Sen. Don Henderson,Don Henderson
240,240,240,HB 1158,Relating to penalties and interest on property taxes included in certain tax bills returned undelivered to the tax collector by the postal service.,20189,Don Henderson,sponsor,73R,1210,Sen. Don Henderson,Don Henderson
241,241,241,HB 1319,"Relating to driver's licenses, permits, and resident and nonresident operating privileges.",20189,Don Henderson,sponsor,73R,1210,Sen. Don Henderson,Don Henderson
242,242,242,HB 1357,Relating to a complainant's right to appear before the State Commission on Judicial Conduct.,20189,Don Henderson,sponsor,73R,1210,Sen. Don Henderson,Don Henderson
243,243,243,HB 1444,Relating to the daily compensation of a retired judge serving as an assigned probate judge.,20189,Don Henderson,sponsor,73R,1210,Sen. Don Henderson,Don Henderson
244,244,244,HB 1564,Relating to occupancy limits for rental dwellings.,20189,Don Henderson,sponsor,73R,1210,Sen. Don Henderson,Don Henderson
245,245,245,HB 1565,Relating to a cash payment for rental of residential property.,20189,Don Henderson,sponsor,73R,1210,Sen. Don Henderson,Don Henderson
246,246,246,HB 2042,Relating to a state agency's modification of its findings or decision in a contested case while the case is on appeal to the courts.,20189,Don Henderson,sponsor,73R,1210,Sen. Don Henderson,Don Henderson
247,247,247,HB 2073,Relating to the practice of court reporting and taking of depositions.,20189,Don Henderson,sponsor,73R,1210,Sen. Don Henderson,Don Henderson
248,248,248,HB 2237,Relating to qualified immunity from civil liability for certain impartial third parties who conduct or facilitate alternative dispute resolution procedures.,20189,Don Henderson,sponsor,73R,1210,Sen. Don Henderson,Don Henderson
249,249,249,HB 2282,Relating to certain hotel facilities.,20189,Don Henderson,sponsor,73R,1210,Sen. Don Henderson,Don Henderson
250,250,250,HB 2289,Relating to the registration without examination of certain interior designers.,20189,Don Henderson,sponsor,73R,1210,Sen. Don Henderson,Don Henderson
251,251,251,HB 2415,Relating to the suspension of a public school teacher without pay.,20189,Don Henderson,sponsor,73R,1210,Sen. Don Henderson,Don Henderson
252,252,252,HB 2506,Relating to the offense of and punishment for barratry and to certain solicitations regarding professional employment.,20189,Don Henderson,sponsor,73R,1210,Sen. Don Henderson,Don Henderson
253,253,253,HB 2511,Relating to administrative hearings and appeals.,20189,Don Henderson,sponsor,73R,1210,Sen. Don Henderson,Don Henderson
254,254,254,HB 2512,Relating to continued operation under a license after judicial review of a contested case.,20189,Don Henderson,sponsor,73R,1210,Sen. Don Henderson,Don Henderson
255,255,255,HB 2529,Relating to immunity from civil liability for certain persons responsible for or acting in furtherance of programs in which juvenile probationers are required to perform manual labor or to perform community service.,20189,Don Henderson,sponsor,73R,1210,Sen. Don Henderson,Don Henderson
256,256,256,HB 2671,Relating to the sale or trade by certain municipalities of a park under two acres that is no longer usable and functional as a park.,20189,Don Henderson,sponsor,73R,1210,Sen. Don Henderson,Don Henderson
257,257,257,HB 2685,Relating to guardianships of the person or estate of incapacitated persons.,20189,Don Henderson,sponsor,73R,1210,Sen. Don Henderson,Don Henderson
258,258,258,HB 2854,"Relating to the regulation by home-rule municipalities of streets, avenues, alleys, and boulevards on which certain residences are located.",20189,Don Henderson,sponsor,73R,1210,Sen. Don Henderson,Don Henderson
259,259,259,HB 2856,"Relating to the creation of the County Criminal Court at Law No. 15 of Harris County, Texas.",20189,Don Henderson,sponsor,73R,1210,Sen. Don Henderson,Don Henderson
260,260,260,HCR 50,"Inviting the Honorable Tom Phillips, chief justice of the Supreme Court of Texas, to address the Regular Session of the 73rd Legislature on Tuesday, February 23, 1993.",20189,Don Henderson,sponsor,73R,1210,Sen. Don Henderson,Don Henderson
261,261,261,HCR 82,Officially recognizing Tyler Marie Nathan as an honorary citizen of the Lone Star State and congratulating Robert and Tambra Nathan on the birth of their daughter.,20189,Don Henderson,sponsor,73R,1210,Sen. Don Henderson,Don Henderson
262,262,262,SB 7,Relating to the validation of government acts and proceedings regarding certain bond elections in municipalities with a population of more than 1.5 million.,20189,Don Henderson,author,724,1210,Sen. Don Henderson,Don Henderson
263,263,263,SB 11,Relating to the transfer of Texas Turnpike Authority projects to a county or local government corporation and to the administration of those projects.,20189,Don Henderson,author,724,1210,Sen. Don Henderson,Don Henderson
264,264,264,SCR 3,Establishing the Stephen F. Austin Bicentennial Commission.,20189,Don Henderson,coauthor,724,1210,Sen. Don Henderson,Don Henderson
265,265,265,HCR 17,Commending the Honorable George Herbert Walker Bush on his exemplary record of public service to the people of this state and this nation.,20189,Don Henderson,sponsor,724,1210,Sen. Don Henderson,Don Henderson
266,266,266,SR 8,Extending congratulations to Dereck C. Voorhies of Spring on achieving the rank of Eagle Scout.,20189,Don Henderson,author,723,1210,Sen. Don Henderson,Don Henderson
267,267,267,SR 9,Extending congratulations to Cesar Alexander Sylva of Troop 652 on achieving the rank of Eagle Scout.,20189,Don Henderson,author,723,1210,Sen. Don Henderson,Don Henderson
268,268,268,SR 86,Encouraging the Goodyear Tire Company to reconsider leaving the Goodyear Airship in Spring.,20189,Don Henderson,author,723,1210,Sen. Don Henderson,Don Henderson
269,269,269,SR 14,Congratulating Bryan Waters on achieving the rank of Eagle Scout.,20189,Don Henderson,author,722,1210,Sen. Don Henderson,Don Henderson
270,270,270,SR 53,Congratulating Eric Gilless of Troop 900 on achieving the rank of Eagle Scout.,20189,Don Henderson,author,722,1210,Sen. Don Henderson,Don Henderson
271,271,271,SR 54,Honoring the 192nd Supply Company Army Reserve Unit for its exemplary service to the United States.,20189,Don Henderson,author,722,1210,Sen. Don Henderson,Don Henderson
272,272,272,SB 7,"Relating to the efficient operation of the state criminal justice system, including the punishment of offenses, probation and parole, criminal justice services and facilities, and the issuance of general obligation bonds for acquiring, constructing, or equipping certain of those facilities.",20189,Don Henderson,coauthor,722,1210,Sen. Don Henderson,Don Henderson
273,273,273,SB 39,Relating to the sale and protection of certain animals; providing civil and criminal penalties.,20189,Don Henderson,coauthor,722,1210,Sen. Don Henderson,Don Henderson
274,274,274,SR 18,Congratulating Christopher Scott Sweeney on achieving the rank of Eagle Scout.,20189,Don Henderson,author,721,1210,Sen. Don Henderson,Don Henderson
275,275,275,SR 19,"Congratulating George G. Gentes, Jr., on achieving the rank of Eagle Scout.",20189,Don Henderson,author,721,1210,Sen. Don Henderson,Don Henderson
276,276,276,SR 28,Congratulating Benjamin Mitchem of Houston on achieving the rank of Eagle Scout.,20189,Don Henderson,author,721,1210,Sen. Don Henderson,Don Henderson
277,277,277,SR 29,Congratulating Andrew Kerr on achieving the rank of Eagle Scout.,20189,Don Henderson,author,721,1210,Sen. Don Henderson,Don Henderson
