Unnamed: 0,Unnamed: 0.1,Unnamed: 0.1.1,bill_name,caption,filer_id,filer_name,function,session,leg_id,original_name,parsed_name
328,328,328,HB 31,"Relating to adjusting the ""price to beat"" for electric utility services to reflect reduced natural gas fuel prices.",80871,Yvonne Gonzalez Toureilles,coauthor,793,4660,Rep. Yvonne Gonzalez Toureilles,Yvonne Toureilles
329,329,329,HB 32,Relating to the system benefit fund and to eligibility for and enrollment for benefits under the fund.,80871,Yvonne Gonzalez Toureilles,coauthor,793,4660,Rep. Yvonne Gonzalez Toureilles,Yvonne Toureilles
330,330,330,HB 72,Relating to providing for an adjustment of the limitation on the total amount of ad valorem taxes that may be imposed by a school district on the residence homesteads of the elderly or disabled to reflect any change in the school district's tax rate and protecting a school district against the resulting loss in local revenue.,80871,Yvonne Gonzalez Toureilles,coauthor,793,4660,Rep. Yvonne Gonzalez Toureilles,Yvonne Toureilles
331,331,331,HB 73,Relating to public financing of the public education employee retirement system and certain retirement benefits; making an appropriation.,80871,Yvonne Gonzalez Toureilles,coauthor,793,4660,Rep. Yvonne Gonzalez Toureilles,Yvonne Toureilles
332,332,332,HB 120,Relating to a temporary reduction in the rate imposed on the sale of gasoline.,80871,Yvonne Gonzalez Toureilles,coauthor,793,4660,Rep. Yvonne Gonzalez Toureilles,Yvonne Toureilles
333,333,333,HB 174,Relating to temporary eligibility requirements for and administration of the child health plan program.,80871,Yvonne Gonzalez Toureilles,coauthor,793,4660,Rep. Yvonne Gonzalez Toureilles,Yvonne Toureilles
334,334,334,HJR 26,Proposing a constitutional amendment providing for an adjustment of the limitation on the total amount of ad valorem taxes that may be imposed for public school purposes on the residence homesteads of the elderly or disabled to reflect any change in the rate of those taxes.,80871,Yvonne Gonzalez Toureilles,coauthor,793,4660,Rep. Yvonne Gonzalez Toureilles,Yvonne Toureilles
335,335,335,HR 772,Recognizing the Honorable Ken Armbrister for his many years of distinguished service in the Texas Legislature.,80871,Yvonne Gonzalez Toureilles,coauthor,793,4660,Rep. Yvonne Gonzalez Toureilles,Yvonne Toureilles
336,336,336,SCR 11,Memorializing Congress to reauthorize certain provisions of the Voting Rights Act of 1965.,80871,Yvonne Gonzalez Toureilles,sponsor,793,4660,Rep. Yvonne Gonzalez Toureilles,Yvonne Toureilles
337,337,337,HB 14,"Relating to increasing the amount of the residence homestead exemption from ad valorem taxation for public school purposes to $45,000, providing for an adjustment of the limitation on the total amount of ad valorem taxes that may be imposed for those purposes on the homesteads of the elderly or disabled to reflect the increased exemption amount and changes in school district ad valorem tax rates, and protecting school districts against the resulting loss in local revenue.",80871,Yvonne Gonzalez Toureilles,coauthor,792,4660,Rep. Yvonne Gonzalez Toureilles,Yvonne Toureilles
338,338,338,HB 16,Relating to limits on the use of the power of eminent domain.,80871,Yvonne Gonzalez Toureilles,coauthor,792,4660,Rep. Yvonne Gonzalez Toureilles,Yvonne Toureilles
339,339,339,HB 57,Relating to the salary paid to certain professional employees of public schools.,80871,Yvonne Gonzalez Toureilles,coauthor,792,4660,Rep. Yvonne Gonzalez Toureilles,Yvonne Toureilles
340,340,340,HJR 14,"Proposing a constitutional amendment increasing the amount of the residence homestead exemption from ad valorem taxation for public school purposes to $45,000 and providing for an adjustment of the limitation on the total amount of taxes that may be imposed for those purposes on the homesteads of the elderly or disabled to reflect the increased exemption amount and changes in school district ad valorem tax rates.",80871,Yvonne Gonzalez Toureilles,coauthor,792,4660,Rep. Yvonne Gonzalez Toureilles,Yvonne Toureilles
341,341,341,HR 295,Honoring U.S. Marine Lance Corporal Steven Kelly Schulz of Karnes County for his service to his country.,80871,Yvonne Gonzalez Toureilles,author,791,4660,Rep. Yvonne Gonzalez Toureilles,Yvonne Toureilles
342,342,342,HB 15,Relating to public education and public school finance matters.,80871,Yvonne Gonzalez Toureilles,coauthor,791,4660,Rep. Yvonne Gonzalez Toureilles,Yvonne Toureilles
343,343,343,HJR 11,"Proposing a constitutional amendment increasing the amount of the school district residence homestead property tax exemption to $45,000 and providing for a corresponding adjustment of the limitation on school taxes on residence homesteads of elderly and disabled persons.",80871,Yvonne Gonzalez Toureilles,coauthor,791,4660,Rep. Yvonne Gonzalez Toureilles,Yvonne Toureilles
344,344,344,HJR 19,Proposing a constitutional amendment to restrict the state or a political subdivision from taking private property for the primary purpose of economic development or to benefit a particular class of identifiable individuals.,80871,Yvonne Gonzalez Toureilles,coauthor,791,4660,Rep. Yvonne Gonzalez Toureilles,Yvonne Toureilles
345,345,345,HJR 24,Proposing a constitutional amendment to reduce the total amount of ad valorem taxes that may be imposed by a school district on the residence homestead of an elderly or disabled person in proportion to any reduction in the tax rate of the school district.,80871,Yvonne Gonzalez Toureilles,coauthor,791,4660,Rep. Yvonne Gonzalez Toureilles,Yvonne Toureilles
346,346,346,HB 1418,Relating to the justice court technology fund and to requiring the assessment of a technology fee on conviction of certain misdemeanor offenses.,80871,Yvonne Gonzalez Toureilles,author,79R,4660,Rep. Yvonne Gonzalez Toureilles,Yvonne Toureilles
347,347,347,HB 1934,Relating to security fees for justice courts.,80871,Yvonne Gonzalez Toureilles,author,79R,4660,Rep. Yvonne Gonzalez Toureilles,Yvonne Toureilles
348,348,348,HB 2487,Relating to the award of attorney's fees in an election contest.,80871,Yvonne Gonzalez Toureilles,author,79R,4660,Rep. Yvonne Gonzalez Toureilles,Yvonne Toureilles
349,349,349,HB 2711,Relating to the provision of intervention or counseling services to certain persons who have committed family violence and to a process for accrediting those services.,80871,Yvonne Gonzalez Toureilles,author,79R,4660,Rep. Yvonne Gonzalez Toureilles,Yvonne Toureilles
350,350,350,HB 3418,Relating to audits of providers in the medical assistance program.,80871,Yvonne Gonzalez Toureilles,author,79R,4660,Rep. Yvonne Gonzalez Toureilles,Yvonne Toureilles
351,351,351,HB 3496,Relating to the powers and duties of the Bee Groundwater Conservation District.,80871,Yvonne Gonzalez Toureilles,author,79R,4660,Rep. Yvonne Gonzalez Toureilles,Yvonne Toureilles
352,352,352,HB 3533,Relating to the powers and duties of the Karnes County Hospital District.,80871,Yvonne Gonzalez Toureilles,author,79R,4660,Rep. Yvonne Gonzalez Toureilles,Yvonne Toureilles
353,353,353,HR 77,Congratulating Lauren Ashly Self of George West on being crowned Miss Live Oak County 2004.,80871,Yvonne Gonzalez Toureilles,author,79R,4660,Rep. Yvonne Gonzalez Toureilles,Yvonne Toureilles
354,354,354,HR 170,Honoring Jerry Retzloff of Live Oak County on being named Volunteer of the Year for 2005 by the Three Rivers Chamber of Commerce.,80871,Yvonne Gonzalez Toureilles,author,79R,4660,Rep. Yvonne Gonzalez Toureilles,Yvonne Toureilles
355,355,355,HR 171,"Honoring Lawrence ""Buddy"" Orsak for receiving the 2005 Educator of the Year Award from the Three Rivers Chamber of Commerce.",80871,Yvonne Gonzalez Toureilles,author,79R,4660,Rep. Yvonne Gonzalez Toureilles,Yvonne Toureilles
356,356,356,HR 172,"Recognizing February 23, 2005, as Atascosa County Day at the State Capitol.",80871,Yvonne Gonzalez Toureilles,author,79R,4660,Rep. Yvonne Gonzalez Toureilles,Yvonne Toureilles
357,357,357,HR 173,Honoring Emilio Garza on being named Elected Official of the Year by the Three Rivers Chamber of Commerce.,80871,Yvonne Gonzalez Toureilles,author,79R,4660,Rep. Yvonne Gonzalez Toureilles,Yvonne Toureilles
358,358,358,HR 186,"Designating February 9, 2005, as Jim Wells County Day at the State Capitol.",80871,Yvonne Gonzalez Toureilles,author,79R,4660,Rep. Yvonne Gonzalez Toureilles,Yvonne Toureilles
359,359,359,HR 237,"Recognizing February 22, 2005, as Goliad County Day at the State Capitol.",80871,Yvonne Gonzalez Toureilles,author,79R,4660,Rep. Yvonne Gonzalez Toureilles,Yvonne Toureilles
360,360,360,HR 238,Honoring Emily Shane of Beeville on her selection to the Texas Music Educators Association Women's All-State Choir for 2005.,80871,Yvonne Gonzalez Toureilles,author,79R,4660,Rep. Yvonne Gonzalez Toureilles,Yvonne Toureilles
361,361,361,HR 239,Congratulating Eric Latcham of A. C. Jones High School in Beeville for being named to the All-State Academic Football Team by the Texas High School Coaches Association.,80871,Yvonne Gonzalez Toureilles,author,79R,4660,Rep. Yvonne Gonzalez Toureilles,Yvonne Toureilles
362,362,362,HR 369,"Recognizing February 17, 2005, as Bee County Day at the State Capitol.",80871,Yvonne Gonzalez Toureilles,author,79R,4660,Rep. Yvonne Gonzalez Toureilles,Yvonne Toureilles
363,363,363,HR 372,Honoring Jack and James Bradford of Alice.,80871,Yvonne Gonzalez Toureilles,author,79R,4660,Rep. Yvonne Gonzalez Toureilles,Yvonne Toureilles
364,364,364,HR 373,In memory of Clementina B. Marmolejo of Alice.,80871,Yvonne Gonzalez Toureilles,author,79R,4660,Rep. Yvonne Gonzalez Toureilles,Yvonne Toureilles
365,365,365,HR 374,Honoring Lance Corporal Travis Pollok of Falls City for his courageous service to his country.,80871,Yvonne Gonzalez Toureilles,author,79R,4660,Rep. Yvonne Gonzalez Toureilles,Yvonne Toureilles
366,366,366,HR 463,Honoring Dr. Ruben M. Garcia on receiving the MLK Humanitarian Award from the office of the mayor of Alice.,80871,Yvonne Gonzalez Toureilles,author,79R,4660,Rep. Yvonne Gonzalez Toureilles,Yvonne Toureilles
367,367,367,HR 464,"Recognizing February 28, 2005, as McMullen County Day at the State Capitol.",80871,Yvonne Gonzalez Toureilles,author,79R,4660,Rep. Yvonne Gonzalez Toureilles,Yvonne Toureilles
368,368,368,HR 465,Congratulating Leonard C. Smith of George West on his 101st birthday.,80871,Yvonne Gonzalez Toureilles,author,79R,4660,Rep. Yvonne Gonzalez Toureilles,Yvonne Toureilles
369,369,369,HR 466,"Honoring U.S. Marine Corps Reservist Octaviano Suarez, Jr., of Premont for his service in Iraq.",80871,Yvonne Gonzalez Toureilles,author,79R,4660,Rep. Yvonne Gonzalez Toureilles,Yvonne Toureilles
370,370,370,HR 467,Honoring Sam Houston Burris of Alice.,80871,Yvonne Gonzalez Toureilles,author,79R,4660,Rep. Yvonne Gonzalez Toureilles,Yvonne Toureilles
371,371,371,HR 533,"Recognizing March 23, 2005, as Live Oak County Day at the State Capitol.",80871,Yvonne Gonzalez Toureilles,author,79R,4660,Rep. Yvonne Gonzalez Toureilles,Yvonne Toureilles
372,372,372,HR 646,Congratulating Rick Del Bosque of Alice on receiving an MLK Humanitarian Award presented by the mayor of Alice.,80871,Yvonne Gonzalez Toureilles,author,79R,4660,Rep. Yvonne Gonzalez Toureilles,Yvonne Toureilles
373,373,373,HR 647,Paying tribute to the late Walter Johnson of Alice on the presentation in his honor of an MLK Humanitarian Award from the mayor of Alice.,80871,Yvonne Gonzalez Toureilles,author,79R,4660,Rep. Yvonne Gonzalez Toureilles,Yvonne Toureilles
374,374,374,HR 648,Paying tribute to the late Virginia Vaughan of Alice on the presentation in her honor of an MLK Humanitarian Award from the mayor of Alice.,80871,Yvonne Gonzalez Toureilles,author,79R,4660,Rep. Yvonne Gonzalez Toureilles,Yvonne Toureilles
375,375,375,HR 649,Congratulating Newell W. Atkinson III of Alice on his receipt of an MLK Humanitarian Award presented by the mayor of Alice.,80871,Yvonne Gonzalez Toureilles,author,79R,4660,Rep. Yvonne Gonzalez Toureilles,Yvonne Toureilles
376,376,376,HR 650,Congratulating Celia Barrera of Alice on her receipt of an MLK Humanitarian Award presented by the mayor of Alice.,80871,Yvonne Gonzalez Toureilles,author,79R,4660,Rep. Yvonne Gonzalez Toureilles,Yvonne Toureilles
377,377,377,HR 692,"Congratulating Lupe Martinez on his receipt of a Martin Luther King, Jr., Humanitarian Award from the office of the mayor of Alice.",80871,Yvonne Gonzalez Toureilles,author,79R,4660,Rep. Yvonne Gonzalez Toureilles,Yvonne Toureilles
378,378,378,HR 707,"Recognizing Karnes County Day on March 14, 2005, at the State Capitol.",80871,Yvonne Gonzalez Toureilles,author,79R,4660,Rep. Yvonne Gonzalez Toureilles,Yvonne Toureilles
379,379,379,HR 855,Honoring the life of J. Frank Dobie and acknowledging his remarkable contributions to Texas letters.,80871,Yvonne Gonzalez Toureilles,author,79R,4660,Rep. Yvonne Gonzalez Toureilles,Yvonne Toureilles
380,380,380,HR 1728,"Honoring U.S. Army Sergeant Nieves Rodriguez, Jr., for his service in Iraq.",80871,Yvonne Gonzalez Toureilles,author,79R,4660,Rep. Yvonne Gonzalez Toureilles,Yvonne Toureilles
381,381,381,HR 1729,Honoring Dr. Euell Crisp for his dedication to the residents of Alice.,80871,Yvonne Gonzalez Toureilles,author,79R,4660,Rep. Yvonne Gonzalez Toureilles,Yvonne Toureilles
382,382,382,HR 1730,Honoring Armando Marroquin of Alice for providing scholarships for high school seniors.,80871,Yvonne Gonzalez Toureilles,author,79R,4660,Rep. Yvonne Gonzalez Toureilles,Yvonne Toureilles
383,383,383,HR 1731,"Congratulating Adan Valadez on his receipt of the Martin Luther King, Jr., Humanitarian Award from the office of the mayor of Alice.",80871,Yvonne Gonzalez Toureilles,author,79R,4660,Rep. Yvonne Gonzalez Toureilles,Yvonne Toureilles
384,384,384,HR 1732,"Congratulating Eva Richardson on her receipt of the Martin Luther King, Jr., Humanitarian Award from the office of the mayor of Alice.",80871,Yvonne Gonzalez Toureilles,author,79R,4660,Rep. Yvonne Gonzalez Toureilles,Yvonne Toureilles
385,385,385,HR 1843,Paying tribute to the life of U.S. Army Private Felix Longoria of Three Rivers for his heroism in World War II.,80871,Yvonne Gonzalez Toureilles,author,79R,4660,Rep. Yvonne Gonzalez Toureilles,Yvonne Toureilles
386,386,386,HB 27,Relating to the penalties for intoxication assault and intoxication manslaughter and to the sentencing of defendants convicted of those offenses.,80871,Yvonne Gonzalez Toureilles,author,79R,4660,Rep. Yvonne Gonzalez Toureilles,Yvonne Toureilles
387,387,387,HB 183,Relating to the use of safety belts and child passenger safety seat systems.,80871,Yvonne Gonzalez Toureilles,author,79R,4660,Rep. Yvonne Gonzalez Toureilles,Yvonne Toureilles
388,388,388,HB 213,Relating to a limitation on the amount of ad valorem taxes that may be imposed on the residence homestead of an eligible person serving on active duty in the United States armed forces or the National Guard.,80871,Yvonne Gonzalez Toureilles,author,79R,4660,Rep. Yvonne Gonzalez Toureilles,Yvonne Toureilles
389,389,389,HB 322,"Relating to concealed handgun licenses for members and veterans of the United States armed forces, including a member younger than 21 years of age.",80871,Yvonne Gonzalez Toureilles,author,79R,4660,Rep. Yvonne Gonzalez Toureilles,Yvonne Toureilles
390,390,390,HB 488,Relating to providing notice of the release or escape of a defendant to certain crime victims and witnesses in criminal trials.,80871,Yvonne Gonzalez Toureilles,author,79R,4660,Rep. Yvonne Gonzalez Toureilles,Yvonne Toureilles
391,391,391,HB 527,Relating to the punishment of certain assaults committed against employees of primary and secondary schools.,80871,Yvonne Gonzalez Toureilles,author,79R,4660,Rep. Yvonne Gonzalez Toureilles,Yvonne Toureilles
392,392,392,HB 528,Relating to exemptions from the sales tax for school supplies and other instructional material.,80871,Yvonne Gonzalez Toureilles,author,79R,4660,Rep. Yvonne Gonzalez Toureilles,Yvonne Toureilles
393,393,393,HB 607,Relating to the delivery of blank check forms; providing a civil penalty.,80871,Yvonne Gonzalez Toureilles,author,79R,4660,Rep. Yvonne Gonzalez Toureilles,Yvonne Toureilles
394,394,394,HB 628,Relating to debt collection after a consumer has filed a report with a law enforcement agency.,80871,Yvonne Gonzalez Toureilles,author,79R,4660,Rep. Yvonne Gonzalez Toureilles,Yvonne Toureilles
395,395,395,HB 630,Relating to the distribution of federal earned income tax credit information to persons receiving assistance or benefits under certain health and human services programs.,80871,Yvonne Gonzalez Toureilles,author,79R,4660,Rep. Yvonne Gonzalez Toureilles,Yvonne Toureilles
396,396,396,HB 752,Relating to the penalty for theft of identifying information.,80871,Yvonne Gonzalez Toureilles,author,79R,4660,Rep. Yvonne Gonzalez Toureilles,Yvonne Toureilles
397,397,397,HB 823,Relating to the applicability of the offense of unlawful carrying of weapons to certain persons and to the consequence of certain presumptions in the prosecution of a criminal offense.,80871,Yvonne Gonzalez Toureilles,author,79R,4660,Rep. Yvonne Gonzalez Toureilles,Yvonne Toureilles
398,398,398,HB 844,Relating to retirement benefits for certain teachers.,80871,Yvonne Gonzalez Toureilles,author,79R,4660,Rep. Yvonne Gonzalez Toureilles,Yvonne Toureilles
399,399,399,HB 1032,Relating to the prosecution of the offense of fraudulent use or possession of identifying information and to assistance to victims of that offense.,80871,Yvonne Gonzalez Toureilles,author,79R,4660,Rep. Yvonne Gonzalez Toureilles,Yvonne Toureilles
400,400,400,HB 1252,Relating to providing services for persons with chronic kidney disease under the medical assistance program.,80871,Yvonne Gonzalez Toureilles,author,79R,4660,Rep. Yvonne Gonzalez Toureilles,Yvonne Toureilles
401,401,401,HB 1321,Relating to the prevention and punishment of identity theft and the rights of certain victims of identity theft; providing penalties.,80871,Yvonne Gonzalez Toureilles,author,79R,4660,Rep. Yvonne Gonzalez Toureilles,Yvonne Toureilles
402,402,402,HB 1576,Relating to the justice court technology fund and to requiring the assessment of a technology fee on conviction of certain misdemeanor offenses.,80871,Yvonne Gonzalez Toureilles,author,79R,4660,Rep. Yvonne Gonzalez Toureilles,Yvonne Toureilles
403,403,403,HB 1794,Relating to the development of the Trans-Texas Corridor.,80871,Yvonne Gonzalez Toureilles,author,79R,4660,Rep. Yvonne Gonzalez Toureilles,Yvonne Toureilles
404,404,404,HB 2734,Relating to tuition and fee exemptions for certain military personnel and their dependents.,80871,Yvonne Gonzalez Toureilles,author,79R,4660,Rep. Yvonne Gonzalez Toureilles,Yvonne Toureilles
405,405,405,HB 3306,Relating to certain diseases or illnesses suffered by certain emergency fire fighter or emergency medical technicians.,80871,Yvonne Gonzalez Toureilles,author,79R,4660,Rep. Yvonne Gonzalez Toureilles,Yvonne Toureilles
406,406,406,HB 3419,Relating to the Trans-Texas Corridor and other transportation projects.,80871,Yvonne Gonzalez Toureilles,author,79R,4660,Rep. Yvonne Gonzalez Toureilles,Yvonne Toureilles
407,407,407,HB 67,Relating to designating August 26 as Women's Independence Day.,80871,Yvonne Gonzalez Toureilles,coauthor,79R,4660,Rep. Yvonne Gonzalez Toureilles,Yvonne Toureilles
408,408,408,HB 115,Relating to compliance by political subdivisions with unfunded legislative mandates.,80871,Yvonne Gonzalez Toureilles,coauthor,79R,4660,Rep. Yvonne Gonzalez Toureilles,Yvonne Toureilles
409,409,409,HB 120,"Relating to the creation of a donor education, awareness, and registry program, the establishment of an organ donor and tissue council, and anatomical gift donation.",80871,Yvonne Gonzalez Toureilles,coauthor,79R,4660,Rep. Yvonne Gonzalez Toureilles,Yvonne Toureilles
410,410,410,HB 129,Relating to the authority to require a convicted person to perform manual labor for a nonprofit organization or a cemetery maintained by the county.,80871,Yvonne Gonzalez Toureilles,coauthor,79R,4660,Rep. Yvonne Gonzalez Toureilles,Yvonne Toureilles
411,411,411,HB 180,Relating to appropriations to The Texas A&M University System and to Texas A&M University--Kingsville in connection with the Irma Rangel School of Pharmacy.,80871,Yvonne Gonzalez Toureilles,coauthor,79R,4660,Rep. Yvonne Gonzalez Toureilles,Yvonne Toureilles
412,412,412,HB 225,Relating to the issuance and expiration of certain licenses to carry a concealed handgun.,80871,Yvonne Gonzalez Toureilles,coauthor,79R,4660,Rep. Yvonne Gonzalez Toureilles,Yvonne Toureilles
413,413,413,HB 233,Relating to the securing by municipal police officers of a scene to which the municipality's emergency ambulance service responds.,80871,Yvonne Gonzalez Toureilles,coauthor,79R,4660,Rep. Yvonne Gonzalez Toureilles,Yvonne Toureilles
414,414,414,HB 255,Relating to the reduction in value or expiration of a stored value card.,80871,Yvonne Gonzalez Toureilles,coauthor,79R,4660,Rep. Yvonne Gonzalez Toureilles,Yvonne Toureilles
415,415,415,HB 283,"Relating to admission, assignment, and conduct of certain public school students.",80871,Yvonne Gonzalez Toureilles,coauthor,79R,4660,Rep. Yvonne Gonzalez Toureilles,Yvonne Toureilles
416,416,416,HB 288,Relating to the personal needs allowance for certain Medicaid recipients who are residents of long-term care facilities.,80871,Yvonne Gonzalez Toureilles,coauthor,79R,4660,Rep. Yvonne Gonzalez Toureilles,Yvonne Toureilles
417,417,417,HB 444,Relating to the proximity of a school bus stop to the residence of a sex offender or sexually violent predator.,80871,Yvonne Gonzalez Toureilles,coauthor,79R,4660,Rep. Yvonne Gonzalez Toureilles,Yvonne Toureilles
418,418,418,HB 503,Relating to tuition and fee exemptions for certain military personnel and certain children of those personnel.,80871,Yvonne Gonzalez Toureilles,coauthor,79R,4660,Rep. Yvonne Gonzalez Toureilles,Yvonne Toureilles
419,419,419,HB 545,Relating to services provided by podiatrists under the Medicaid program.,80871,Yvonne Gonzalez Toureilles,coauthor,79R,4660,Rep. Yvonne Gonzalez Toureilles,Yvonne Toureilles
420,420,420,HB 692,Relating to the punishment for and certain civil consequences of committing the offense of prostitution.,80871,Yvonne Gonzalez Toureilles,coauthor,79R,4660,Rep. Yvonne Gonzalez Toureilles,Yvonne Toureilles
421,421,421,HB 695,Relating to restrictions on the prices of certain consumer goods and services during an abnormal disruption of the market.,80871,Yvonne Gonzalez Toureilles,coauthor,79R,4660,Rep. Yvonne Gonzalez Toureilles,Yvonne Toureilles
422,422,422,HB 710,Relating to provision of certain optional services for adults and operation of the medically needy program under the state Medicaid program.,80871,Yvonne Gonzalez Toureilles,coauthor,79R,4660,Rep. Yvonne Gonzalez Toureilles,Yvonne Toureilles
423,423,423,HB 725,Relating to restoring services under the Medicaid and children's health insurance programs; making an appropriation.,80871,Yvonne Gonzalez Toureilles,coauthor,79R,4660,Rep. Yvonne Gonzalez Toureilles,Yvonne Toureilles
424,424,424,HB 775,Relating to the allocation of certain community development block grant program money for the installation of street lights in colonias.,80871,Yvonne Gonzalez Toureilles,coauthor,79R,4660,Rep. Yvonne Gonzalez Toureilles,Yvonne Toureilles
425,425,425,HB 790,Relating to the conduct of newborn screening by the Department of State Health Services.,80871,Yvonne Gonzalez Toureilles,coauthor,79R,4660,Rep. Yvonne Gonzalez Toureilles,Yvonne Toureilles
426,426,426,HB 894,Relating to produce samples at municipally owned farmers' markets.,80871,Yvonne Gonzalez Toureilles,coauthor,79R,4660,Rep. Yvonne Gonzalez Toureilles,Yvonne Toureilles
427,427,427,HB 977,Relating to the proximity of the residences of certain sex offenders or sexually violent predators to schools; imposing a criminal penalty.,80871,Yvonne Gonzalez Toureilles,coauthor,79R,4660,Rep. Yvonne Gonzalez Toureilles,Yvonne Toureilles
428,428,428,HB 984,Relating to the care of elementary and secondary school students with diabetes.,80871,Yvonne Gonzalez Toureilles,coauthor,79R,4660,Rep. Yvonne Gonzalez Toureilles,Yvonne Toureilles
429,429,429,HB 1001,Relating to the compensation of state judges and to the computation of retirement benefits for members of the elected class of the Employees Retirement System of Texas.,80871,Yvonne Gonzalez Toureilles,coauthor,79R,4660,Rep. Yvonne Gonzalez Toureilles,Yvonne Toureilles
430,430,430,HB 1249,Relating to criminal punishment for aggressive driving that results in the death of a person.,80871,Yvonne Gonzalez Toureilles,coauthor,79R,4660,Rep. Yvonne Gonzalez Toureilles,Yvonne Toureilles
431,431,431,HB 1273,Relating to the development of the Trans-Texas Corridor.,80871,Yvonne Gonzalez Toureilles,coauthor,79R,4660,Rep. Yvonne Gonzalez Toureilles,Yvonne Toureilles
432,432,432,HB 1348,Relating to political contributions and expenditures; providing civil and criminal penalties.,80871,Yvonne Gonzalez Toureilles,coauthor,79R,4660,Rep. Yvonne Gonzalez Toureilles,Yvonne Toureilles
433,433,433,HB 1371,Relating to certain offenses that involve impersonating a peace officer or other public servant and misrepresenting the nature of certain property.,80871,Yvonne Gonzalez Toureilles,coauthor,79R,4660,Rep. Yvonne Gonzalez Toureilles,Yvonne Toureilles
434,434,434,HB 1416,Relating to health insurance benefits provided to certain public school retirees and their dependents.,80871,Yvonne Gonzalez Toureilles,coauthor,79R,4660,Rep. Yvonne Gonzalez Toureilles,Yvonne Toureilles
435,435,435,HB 1612,Relating to promotion of students to certain grade levels in public school.,80871,Yvonne Gonzalez Toureilles,coauthor,79R,4660,Rep. Yvonne Gonzalez Toureilles,Yvonne Toureilles
436,436,436,HB 1613,Relating to the requirements for a high school diploma.,80871,Yvonne Gonzalez Toureilles,coauthor,79R,4660,Rep. Yvonne Gonzalez Toureilles,Yvonne Toureilles
